Ranking,Project Name,Stars,Forks,Watchers,Open Issues,Created At,Last Commit,Size,Size (KB),Description,Language,Repo URL
273,30dayMakeOS,6244,1456,6244,11,05/09/2014,01/04/2024,3.49 MB,3575,ã€Š30å¤©è‡ªåˆ¶æ“ä½œç³»ç»Ÿã€‹æºç ä¸­æ–‡ç‰ˆã€‚è‡ªå·±åˆ¶ä½œä¸€ä¸ªæ“ä½œç³»ç»Ÿï¼ˆOSASKï¼‰çš„è¿‡ç¨‹,C,https://github.com/yourtion/30dayMakeOS
274,xrdp,6233,1713,6233,245,25/04/2011,04/08/2025,17.07 MB,17476,xrdp: an open source RDP server,C,https://github.com/neutrinolabs/xrdp
275,nokogiri,6205,920,6205,100,14/07/2008,04/08/2025,37.68 MB,38582,Nokogiri (é‹¸) makes it easy and painless to work with XML and HTML from Ruby.,C,https://github.com/sparklemotion/nokogiri
276,pcileech,6143,878,6143,6,27/07/2016,07/07/2025,4.97 MB,5088,Direct Memory Access (DMA) Attack Software,C,https://github.com/ufrisk/pcileech
277,nanomsg,6137,1019,6137,17,10/10/2012,03/02/2024,8.08 MB,8270,nanomsg library,C,https://github.com/nanomsg/nanomsg
278,Provenance,6137,701,6137,278,27/08/2013,02/08/2025,1.68 GB,1763632,"iOS & tvOS multi-emulator frontend, supporting various Atari, Bandai, NEC, Nintendo, Sega, SNK and Sony console systemsâ€¦ Get Started:  https://wiki.provenance-emu.com  | ",C,https://github.com/Provenance-Emu/Provenance
279,kphp-kdb,6115,217,6115,20,18/02/2014,09/02/2019,4.20 MB,4301,VK-KittenPHP/DB/Engine suite,C,https://github.com/vk-com/kphp-kdb
280,siege,6101,391,6101,139,26/09/2014,29/06/2025,1.58 MB,1623,Siege is an http load tester and benchmarking utility,C,https://github.com/JoeDog/siege
281,omi,6093,894,6093,196,22/03/2024,04/08/2025,666.62 MB,682621,"AI wearables. Put it on, speak, transcribe, automatically",C,https://github.com/BasedHardware/omi
282,Serial-Studio,6077,901,6077,24,18/10/2020,04/08/2025,200.65 MB,205462,Visualize embedded device data.,C,https://github.com/Serial-Studio/Serial-Studio
283,ios-webkit-debug-proxy,6076,472,6076,13,12/02/2013,02/07/2025,688.00 KB,688,A DevTools proxy (Chrome Remote Debugging Protocol) for iOS devices (Safari Remote Web Inspector).,C,https://github.com/google/ios-webkit-debug-proxy
284,redshift,6063,435,6063,297,20/12/2012,05/06/2024,2.09 MB,2145,Redshift adjusts the color temperature of your screen according to your surroundings. This may help your eyes hurt less if you are working in front of the screen at night.,C,https://github.com/jonls/redshift
285,sqlitestudio,6053,625,6053,584,11/01/2018,03/08/2025,84.67 MB,86702,"A free, open source, multi-platform SQLite database manager.",C,https://github.com/pawelsalawa/sqlitestudio
286,mbedtls,6049,2741,6049,1591,14/11/2012,01/08/2025,131.73 MB,134891,"An open source, portable, easy to use, readable and flexible TLS library, and reference implementation of the PSA Cryptography API. Releases are on a varying cadence, typically around 3 - 6 months between releases.",C,https://github.com/Mbed-TLS/mbedtls
287,littlefs,6040,887,6040,573,25/02/2017,22/07/2025,11.23 MB,11501,A little fail-safe filesystem designed for microcontrollers,C,https://github.com/littlefs-project/littlefs
288,reptyr,6031,222,6031,24,14/01/2011,15/01/2025,357.00 KB,357,Reparent a running program to a new terminal,C,https://github.com/nelhage/reptyr
289,HDMI-PI,6022,886,6022,35,19/10/2020,10/09/2023,45.78 MB,46880,æˆ‘è®¾è®¡çš„ä¸€ä¸ªHDMIè½¬MIPIæ¨¡å—ï¼Œå¯ä»¥ç”¨äºé©±åŠ¨å„ç§æ‰‹æœºå±å¹•å½“æ˜¾ç¤ºå™¨ç”¨ã€‚,C,https://github.com/peng-zhihui/HDMI-PI
290,X-TRACK,5996,1299,5996,14,19/03/2021,08/05/2025,202.99 MB,207858,A GPS bicycle speedometer that supports offline maps and track recording ,C,https://github.com/FASTSHIFT/X-TRACK
291,deepin-wine-ubuntu,5985,862,5985,257,04/07/2018,01/09/2022,86.06 MB,88126,Deepin Wine for Ubuntu/Debian,C,https://github.com/wszqkzqk/deepin-wine-ubuntu
292,lwan,5974,550,5974,49,28/01/2012,19/06/2025,5.96 MB,6104,"Experimental, scalable, high performance HTTP server",C,https://github.com/lpereira/lwan
293,HP-Socket,5970,1789,5970,28,17/12/2013,21/05/2025,400.66 MB,410274,High Performance TCP/UDP/HTTP Communication Component,C,https://github.com/ldcsaa/HP-Socket
294,sqlite-vec,5948,222,5948,146,20/04/2024,24/01/2025,1.00 MB,1028,A vector search SQLite extension that runs anywhere!,C,https://github.com/asg017/sqlite-vec
295,Logan,5946,893,5946,154,26/09/2018,21/08/2024,19.90 MB,20375,Logan is a lightweight case logging system based on mobile platform.,C,https://github.com/Meituan-Dianping/Logan
296,ponyc,5925,423,5925,268,13/11/2012,29/07/2025,19.53 MB,19996,"Pony is an open-source, actor-model, capabilities-secure, high performance programming language",C,https://github.com/ponylang/ponyc
297,grbl,5900,3138,5900,560,24/01/2009,02/06/2024,2.23 MB,2285,"An open source, embedded, high performance g-code-parser and CNC milling controller written in optimized C that will run on a straight Arduino",C,https://github.com/grbl/grbl
298,RediSearch,5897,555,5897,550,05/05/2016,04/08/2025,52.91 MB,54177,"A query and indexing engine for Redis, providing secondary indexing, full-text search, vector similarity search and aggregations.",C,https://github.com/RediSearch/RediSearch
299,AFLplusplus,5890,1156,5890,36,28/05/2019,04/08/2025,32.49 MB,33268,"The fuzzer afl++ is afl with community patches, qemu 5.1 upgrade, collision-free coverage, enhanced laf-intel & redqueen, AFLfast++ power schedules, MOpt mutators, unicorn_mode, and a lot more!",C,https://github.com/AFLplusplus/AFLplusplus
300,7-Zip-zstd,5878,331,5878,20,25/06/2016,10/07/2025,21.72 MB,22240,"7-Zip with support for Brotli, Fast-LZMA2, Lizard, LZ4, LZ5 and Zstandard",C,https://github.com/mcmilk/7-Zip-zstd
301,htop,5870,579,5870,317,13/01/2014,17/11/2020,2.63 MB,2697,htop is an interactive text-mode process viewer for Unix systems. It aims to be a better 'top'.,C,https://github.com/hishamhm/htop
302,zmap,5863,947,5863,11,23/01/2013,22/07/2025,6.55 MB,6712,ZMap is a fast single packet network scanner designed for Internet-wide network surveys.,C,https://github.com/zmap/zmap
303,cmus,5863,488,5863,204,29/12/2012,16/03/2025,6.02 MB,6166,"Small, fast and powerful console music player for Unix-like operating systems.",C,https://github.com/cmus/cmus
304,Luma3DS,5856,585,5856,102,08/02/2016,30/07/2025,8.77 MB,8982,"Nintendo 3DS ""Custom Firmware""",C,https://github.com/LumaTeam/Luma3DS
305,tmate,5853,318,5853,123,12/06/2013,16/10/2023,15.94 MB,16321,Instant Terminal Sharing,C,https://github.com/tmate-io/tmate
306,i3,5852,317,5852,1,21/11/2014,01/11/2022,13.20 MB,13512,A fork of the i3 window manager with gaps and some other features. :warning: i3-gaps has been merged into i3. ,C,https://github.com/Airblader/i3
307,ravynos,5837,195,5837,83,31/01/2021,27/07/2025,2.72 GB,2851777,A BSD-based OS project that aims to provide source and binary compatibility with macOSÂ® and a similar user experience.,C,https://github.com/ravynsoft/ravynos
308,haproxy,5831,855,5831,327,09/04/2018,03/08/2025,102.83 MB,105303,HAProxy Load Balancer's development branch (mirror of git.haproxy.org),C,https://github.com/haproxy/haproxy
309,u8g2,5822,1133,5822,254,06/11/2015,18/07/2025,213.00 MB,218115,"U8glib library for monochrome displays, version 2 ",C,https://github.com/olikraus/u8g2
310,MBE,5796,903,5796,11,20/06/2015,09/12/2021,355.00 KB,355,Course materials for Modern Binary Exploitation by RPISEC,C,https://github.com/RPISEC/MBE
311,tinyusb,5782,1222,5782,238,26/11/2012,02/08/2025,44.85 MB,45924,An open source  cross-platform USB stack for embedded system,C,https://github.com/hathach/tinyusb
312,chsrc,5770,243,5770,16,03/09/2023,31/07/2025,3.97 MB,4069,chsrc å…¨å¹³å°é€šç”¨æ¢æºå·¥å…·ä¸æ¡†æ¶. Change Source everywhere for every software,C,https://github.com/RubyMetric/chsrc
313,fio,5752,1319,5752,239,22/10/2012,02/08/2025,30.02 MB,30739,Flexible I/O Tester,C,https://github.com/axboe/fio
314,libusb,5727,1982,5727,179,11/12/2013,01/08/2025,5.27 MB,5396,A cross-platform library to access USB devices ,C,https://github.com/libusb/libusb
315,libfuse,5721,1202,5721,65,19/12/2015,02/08/2025,4.65 MB,4764,The reference implementation of the Linux FUSE (Filesystem in Userspace) interface,C,https://github.com/libfuse/libfuse
316,asuswrt-merlin.ng,5711,674,5711,45,05/09/2017,03/08/2025,2.58 GB,2707871,Third party firmware for Asus routers (newer codebase),C,https://github.com/RMerl/asuswrt-merlin.ng
317,sshfs-win,5677,277,5677,298,18/06/2016,21/11/2024,3.41 MB,3489,SSHFS For Windows,C,https://github.com/winfsp/sshfs-win
318,clumsy,5662,562,5662,122,01/10/2013,23/06/2024,56.38 MB,57737,"clumsy makes your network condition on Windows significantly worse, but in a controlled and interactive manner.",C,https://github.com/jagt/clumsy
319,GmSSL,5660,1742,5660,369,01/12/2014,31/07/2024,41.27 MB,42256,æ”¯æŒå›½å¯†SM2/SM3/SM4/SM9/SSLçš„å¯†ç å·¥å…·ç®±,C,https://github.com/guanzhi/GmSSL
320,kbengine,5646,2338,5646,176,17/02/2014,13/12/2022,325.88 MB,333705,A MMOG engine of server.,C,https://github.com/kbengine/kbengine
321,SQLAdvisor,5631,1247,5631,76,01/03/2017,08/10/2023,19.93 MB,20412,è¾“å…¥SQLï¼Œè¾“å‡ºç´¢å¼•ä¼˜åŒ–å»ºè®®,C,https://github.com/Meituan-Dianping/SQLAdvisor
322,palera1n,5629,673,5629,11,17/09/2022,10/07/2025,98.16 MB,100515,"Jailbreak for A8 through A11, T2 devices, on iOS/iPadOS/tvOS 15.0, bridgeOS 5.0 and higher.",C,https://github.com/palera1n/palera1n
323,puerts,5626,769,5626,282,15/08/2020,04/08/2025,313.04 MB,320551,PUER(æ™®æ´±) Typescript. Let's write your game in UE or Unity with TypeScript.,C,https://github.com/Tencent/puerts
324,dokany,5615,689,5615,93,10/12/2014,31/07/2025,6.51 MB,6662,User mode file system library for windows with FUSE Wrapper,C,https://github.com/dokan-dev/dokany
325,kcat,5615,493,5615,162,30/03/2014,09/07/2024,528.00 KB,528,Generic command line non-JVM Apache Kafka producer and consumer,C,https://github.com/edenhill/kcat
326,gimp,5589,742,5589,0,03/06/2012,04/08/2025,751.42 MB,769454,Read-only mirror of https://gitlab.gnome.org/GNOME/gimp,C,https://github.com/GNOME/gimp
327,mozjpeg,5585,427,5585,96,12/01/2014,23/06/2025,16.97 MB,17382,Improved JPEG encoder.,C,https://github.com/mozilla/mozjpeg
328,RIOT,5552,2057,5552,809,29/12/2012,04/08/2025,178.21 MB,182491,RIOT -  The friendly OS for IoT,C,https://github.com/RIOT-OS/RIOT
329,unit,5550,352,5550,266,06/09/2017,29/07/2025,13.00 MB,13316,NGINX Unit - universal web app server - a lightweight and versatile open source server that simplifies the application stack by natively executing application code across eight different programming language runtimes.,C,https://github.com/nginx/unit
330,ZipArchive,5541,1347,5541,59,19/08/2010,05/05/2025,4.00 MB,4098,"ZipArchive is a simple utility class for zipping and unzipping files on iOS, macOS and tvOS.",C,https://github.com/ZipArchive/ZipArchive
331,TIC-80,5512,542,5512,359,03/01/2017,05/07/2025,127.38 MB,130437,"TIC-80 is a fantasy computer for making, playing and sharing tiny games.",C,https://github.com/nesbox/TIC-80
332,wasm-micro-runtime,5481,710,5481,494,02/05/2019,04/08/2025,28.65 MB,29336,WebAssembly Micro Runtime (WAMR),C,https://github.com/bytecodealliance/wasm-micro-runtime
333,licecap,5476,459,5476,102,21/07/2014,05/09/2023,10.04 MB,10279,LICEcap simple animated screen capture tool for Windows and OS X,C,https://github.com/justinfrankel/licecap
334,FFmpegAndroid,5472,1335,5472,2,23/01/2018,04/08/2025,166.55 MB,170550,FFmpegå®ç°è§†é¢‘è£å‰ªã€æ°´å°ã€è½¬ç ã€ç¼–è§£ç ã€è½¬GifåŠ¨å›¾ï¼›FFmpegæœ¬åœ°æ¨æµã€H264ä¸RTMPå®æ—¶æ¨æµç›´æ’­ï¼›OpenGLæ»¤é•œç‰¹æ•ˆï¼Œè§†é¢‘æ‹æ‘„ã€‚éŸ³è§†é¢‘å­¦ä¹ è·¯çº¿ï¼ŒéŸ³è§†é¢‘çŸ¥è¯†æ€»ç»“ã€æµåª’ä½“åè®®,C,https://github.com/xufuji456/FFmpegAndroid
335,esp32-weather-epd,5471,382,5471,37,08/03/2022,31/07/2025,77.62 MB,79488,A low-power E-Paper weather display powered by an ESP32 microcontroller. Utilizes the OpenWeatherMap API.,C,https://github.com/lmarzen/esp32-weather-epd
336,linux-kernel-exploits,5469,1739,5469,4,25/04/2017,13/07/2020,8.95 MB,9163,linux-kernel-exploits Linuxå¹³å°ææƒæ¼æ´é›†åˆ,C,https://github.com/SecWiki/linux-kernel-exploits
337,ffmpeg-kit,5465,2156,5465,70,28/07/2020,23/06/2025,13.35 MB,13674,"FFmpeg Kit for applications. Supports Android, Flutter, iOS, Linux, macOS, React Native and tvOS. Supersedes MobileFFmpeg, flutter_ffmpeg and react-native-ffmpeg.",C,https://github.com/arthenica/ffmpeg-kit
338,moonlight-android,5453,855,5453,342,21/09/2013,29/07/2025,126.86 MB,129902,GameStream client for Android,C,https://github.com/moonlight-stream/moonlight-android
339,suricata,5446,1556,5446,67,14/08/2012,01/08/2025,79.09 MB,80991,"Suricata is a network Intrusion Detection System, Intrusion Prevention System and Network Security Monitoring engine developed by the OISF and the Suricata community.",C,https://github.com/OISF/suricata
340,h3,5438,515,5438,127,21/12/2017,30/07/2025,50.80 MB,52024,Hexagonal hierarchical geospatial indexing system,C,https://github.com/uber/h3
341,pngquant,5421,493,5421,53,17/09/2009,07/07/2025,1.74 MB,1777,Lossy PNG compressor â€” pngquant command based on libimagequant library,C,https://github.com/kornelski/pngquant
342,raddebugger,5417,242,5417,124,10/01/2024,01/08/2025,22.74 MB,23287,"A native, user-mode, multi-process, graphical debugger.",C,https://github.com/EpicGamesExt/raddebugger
343,nanovg,5415,792,5415,319,12/11/2013,19/03/2024,3.42 MB,3500,Antialiased 2D vector drawing library on top of OpenGL for UI and visualizations.,C,https://github.com/memononen/nanovg
344,dperf,5408,542,5408,0,21/12/2021,23/07/2025,555.00 KB,555,dperf: High-Performance Network Load Testing Tool Based on DPDK,C,https://github.com/baidu/dperf
345,mruby,5398,814,5398,175,19/04/2012,01/08/2025,24.30 MB,24879,Lightweight Ruby,C,https://github.com/mruby/mruby
346,camerakit-android,5386,882,5386,164,27/11/2016,08/08/2023,21.33 MB,21847,Library for Android Camera 1 and 2 APIs. Massively increase stability and reliability of photo and video capture on all Android devices.,C,https://github.com/CameraKit/camerakit-android
347,swift-corelibs-foundation,5379,1158,5379,672,09/11/2015,03/08/2025,25.98 MB,26606,"The Foundation Project, providing core utilities, internationalization, and OS independence",C,https://github.com/swiftlang/swift-corelibs-foundation
348,clamav,5371,778,5371,306,20/07/2012,25/07/2025,175.88 MB,180099,ClamAV - Documentation is here: https://docs.clamav.net,C,https://github.com/Cisco-Talos/clamav
349,gamemode,5368,198,5368,204,10/04/2018,02/05/2025,667.00 KB,667,Optimise Linux system performance on demand,C,https://github.com/FeralInteractive/gamemode
350,espeak-ng,5353,1073,5353,561,08/12/2015,12/07/2025,74.75 MB,76546,eSpeak NG is an open source speech synthesizer that supports more than hundred languages and accents.,C,https://github.com/espeak-ng/espeak-ng
351,Quake,5347,942,5347,4,31/01/2012,15/06/2024,2.08 MB,2129,Quake GPL Source Release,C,https://github.com/id-Software/Quake
352,MTProxy,5347,927,5347,299,29/05/2018,09/06/2024,330.00 KB,330,,C,https://github.com/TelegramMessenger/MTProxy
353,tinyproxy,5341,716,5341,128,07/12/2015,21/06/2025,1.99 MB,2035,tinyproxy - a light-weight HTTP/HTTPS proxy daemon for POSIX operating systems,C,https://github.com/tinyproxy/tinyproxy
354,fishhook,5328,978,5328,38,11/07/2013,01/08/2024,40.00 KB,40,A library that enables dynamically rebinding symbols in Mach-O binaries running on iOS.,C,https://github.com/facebook/fishhook
355,cjdns,5287,597,5287,107,16/02/2011,31/03/2025,25.62 MB,26240,An encrypted IPv6 network using public-key cryptography for address allocation and a distributed hash table for routing.,C,https://github.com/cjdelisle/cjdns
356,edk2,5281,2815,5281,1192,14/04/2011,04/08/2025,324.20 MB,331978,EDK II,C,https://github.com/tianocore/edk2
357,rainmeter,5245,595,5245,44,31/03/2012,04/06/2025,15.72 MB,16095,Desktop customization tool for Windows,C,https://github.com/rainmeter/rainmeter
358,dsvpn,5237,401,5237,1,17/07/2019,10/06/2025,183.00 KB,183,A Dead Simple VPN.,C,https://github.com/jedisct1/dsvpn
359,activate-linux,5221,106,5221,33,16/03/2022,14/07/2025,1.06 MB,1081,"The ""Activate Windows"" watermark ported to Linux",C,https://github.com/MrGlockenspiel/activate-linux
360,mjolnir,5210,129,5210,0,19/06/2014,14/03/2021,11.21 MB,11475,Lightweight automation and productivity app for OS X,C,https://github.com/mjolnirapp/mjolnir
361,bitwise,5195,225,5195,17,10/03/2018,07/03/2019,1005.00 KB,1005,Bitwise is an educational project where we create the software/hardware stack for a computer from scratch.,C,https://github.com/pervognsen/bitwise
362,entr,5181,115,5181,2,27/03/2018,08/07/2025,1.01 MB,1039,Run arbitrary commands when files change,C,https://github.com/eradman/entr
363,sds,5161,488,5161,105,06/02/2014,18/04/2025,85.00 KB,85,Simple Dynamic Strings library for C,C,https://github.com/antirez/sds
364,oot,5159,635,5159,31,17/03/2020,15/07/2025,157.38 MB,161160,Decompilation of The Legend of Zelda: Ocarina of Time,C,https://github.com/zeldaret/oot
365,LuaJIT,5140,1051,5140,68,06/08/2015,24/07/2025,9.30 MB,9526,Mirror of the LuaJIT git repository,C,https://github.com/LuaJIT/LuaJIT
366,cava,5139,262,5139,13,16/03/2014,03/08/2025,4.64 MB,4752,Cross-platform Audio Visualizer,C,https://github.com/karlstav/cava
367,LookingGlass,5127,282,5127,18,07/12/2017,30/06/2025,5.97 MB,6112,An extremely low latency KVMFR (KVM FrameRelay) implementation for guests with VGA PCI Passthrough.,C,https://github.com/gnif/LookingGlass
368,dunst,5104,362,5104,143,07/09/2011,04/08/2025,7.34 MB,7517,Lightweight and customizable notification daemon,C,https://github.com/dunst-project/dunst
369,sc-im,5091,219,5091,96,30/10/2014,02/06/2025,5.74 MB,5877,sc-im - Spreadsheet Calculator Improvised -- An ncurses spreadsheet program for terminal,C,https://github.com/andmarti1424/sc-im
370,mdp,5088,258,5088,11,14/09/2014,09/07/2025,368.00 KB,368,A command-line based markdown presentation tool.,C,https://github.com/visit1985/mdp
371,macvim,5074,394,5074,9,29/05/2010,05/08/2017,76.29 MB,78126,Vim - the text editor - for Mac OS X,C,https://github.com/b4winckler/macvim
372,libwebsockets,5056,1549,5056,173,06/02/2013,01/08/2025,45.56 MB,46652,canonical libwebsockets.org networking library,C,https://github.com/warmcat/libwebsockets
373,redcarpet,5051,526,5051,111,24/03/2011,06/03/2025,1.10 MB,1128,"The safe Markdown parser, reloaded.",C,https://github.com/vmg/redcarpet
374,phc-winner-argon2,5040,432,5040,97,04/10/2015,06/08/2024,5.77 MB,5907,"The password hash Argon2, winner of PHC ",C,https://github.com/P-H-C/phc-winner-argon2
375,minhook,5029,958,5029,40,10/05/2013,18/05/2025,356.00 KB,356,The Minimalistic x86/x64 API Hooking Library for Windows,C,https://github.com/TsudaKageyu/minhook
376,clib,5028,254,5028,24,28/10/2012,30/03/2025,807.00 KB,807,Package manager for the C programming language.,C,https://github.com/clibs/clib
377,seL4,5027,706,5027,215,18/07/2014,04/08/2025,14.72 MB,15076,The seL4 microkernel,C,https://github.com/seL4/seL4
378,tbox,5017,747,5017,38,10/04/2011,04/08/2025,31.64 MB,32401,ğŸ A glib-like multi-platform c library,C,https://github.com/tboox/tbox
379,katran,5008,523,5008,1,27/04/2018,03/08/2025,9.08 MB,9302,A high performance layer 4 load balancer,C,https://github.com/facebookincubator/katran
380,esp_wifi_repeater,5005,951,5005,251,16/12/2016,13/02/2025,7.76 MB,7948,A full functional WiFi Repeater (correctly: a WiFi NAT Router),C,https://github.com/martin-ger/esp_wifi_repeater
381,ostep-projects,4998,1379,4998,35,16/01/2018,19/07/2024,32.04 MB,32807,Projects for an undergraduate OS course,C,https://github.com/remzi-arpacidusseau/ostep-projects
382,glusterfs,4989,1105,4989,229,17/02/2011,02/07/2025,173.28 MB,177437,Gluster Filesystem : Build your distributed storage in minutes,C,https://github.com/gluster/glusterfs
383,UEFITool,4986,687,4986,23,08/10/2013,31/07/2025,5.92 MB,6065,UEFI firmware image viewer and editor,C,https://github.com/LongSoft/UEFITool
384,vgpu_unlock,4983,455,4983,53,28/01/2021,28/02/2023,102.00 KB,102,Unlock vGPU functionality for consumer grade GPUs.,C,https://github.com/DualCoder/vgpu_unlock
385,mpc-hc,4945,1917,4945,17,25/07/2012,24/04/2020,112.13 MB,114821,MPC-HC's main repository.  For support use our Trac: https://trac.mpc-hc.org/,C,https://github.com/mpc-hc/mpc-hc
386,lxc,4939,1133,4939,163,07/09/2012,29/07/2025,35.09 MB,35937,LXC - Linux Containers,C,https://github.com/lxc/lxc
387,yasea,4920,1321,4920,281,06/04/2016,12/06/2024,26.68 MB,27323,RTMP live streaming client for Android,C,https://github.com/begeekmyfriend/yasea
388,sigma-file-manager,4916,180,4916,163,25/05/2021,30/04/2024,289.27 MB,296208,"""Sigma File Manager"" is a free, open-source, quickly evolving, modern file manager (explorer / browser) app for Windows and Linux.",C,https://github.com/aleksey-hoffman/sigma-file-manager
389,rnnoise,4901,976,4901,196,03/08/2017,22/02/2025,910.00 KB,910,Recurrent neural network for audio noise reduction,C,https://github.com/xiph/rnnoise
390,miniaudio,4898,438,4898,33,21/10/2016,23/07/2025,173.41 MB,177576,"Audio playback and capture library written in C, in a single source file.",C,https://github.com/mackron/miniaudio
391,LiteOS,4892,1588,4892,47,11/09/2016,31/05/2022,502.37 MB,514429,code and manual,C,https://github.com/LiteOS/LiteOS
392,pushdeer,4876,494,4876,59,16/12/2021,13/03/2025,158.24 MB,162035,å¼€æ”¾æºç çš„æ— Appæ¨é€æœåŠ¡ï¼ŒiOS14+æ‰«ç å³ç”¨ã€‚äº¦æ”¯æŒå¿«åº”ç”¨/iOSå’ŒMacå®¢æˆ·ç«¯ã€Androidå®¢æˆ·ç«¯ã€è‡ªåˆ¶è®¾å¤‡,C,https://github.com/easychen/pushdeer
393,OpenLara,4860,375,4860,161,13/08/2016,16/06/2025,43.70 MB,44747,Classic Tomb Raider open-source engine,C,https://github.com/XProger/OpenLara
394,Ditto,4844,258,4844,631,13/11/2020,22/07/2025,161.64 MB,165517,Ditto is an extension to the Windows Clipboard. You copy something to the Clipboard and Ditto takes what you copied and stores it in a database to retrieve at a later time.,C,https://github.com/sabrogden/Ditto
395,sslh,4833,382,4833,40,10/07/2013,24/07/2025,2.34 MB,2397,Applicative Protocol Multiplexer (e.g. share SSH and HTTPS on the same port),C,https://github.com/yrutschle/sslh
396,pebble,4825,356,4825,2,21/01/2025,25/02/2025,78.36 MB,80240,This is the latest version of the internal repository from Pebble Technology providing the software to run on Pebble watches. Proprietary source code has been removed from this repository and it will not compile as-is. This is for information only.,C,https://github.com/google/pebble
397,naxsi,4825,607,4825,0,19/08/2011,08/11/2023,2.00 MB,2048,"NAXSI is an open-source, high performance, low rules maintenance WAF for NGINX",C,https://github.com/nbs-system/naxsi
398,CloverBootloader,4821,645,4821,26,02/09/2019,01/08/2025,231.16 MB,236707,"Bootloader for macOS, Windows and Linux in UEFI and in legacy mode",C,https://github.com/CloverHackyColor/CloverBootloader
399,microui,4811,308,4811,35,22/09/2018,13/08/2024,54.00 KB,54,A tiny immediate-mode UI library,C,https://github.com/rxi/microui
400,nanopb,4811,933,4811,83,29/04/2015,22/07/2025,4.43 MB,4532,Protocol Buffers with small code size,C,https://github.com/nanopb/nanopb
401,jo,4796,160,4796,5,04/03/2016,20/06/2025,309.00 KB,309,JSON output from a shell,C,https://github.com/jpmens/jo
402,ossec-hids,4787,1057,4787,350,17/09/2013,22/01/2025,20.01 MB,20493,"OSSEC is an Open Source Host-based Intrusion Detection System that performs log analysis, file integrity checking, policy monitoring, rootkit detection, real-time alerting and active response.",C,https://github.com/ossec/ossec-hids
403,mbed-os,4777,3012,4777,205,18/02/2013,08/10/2024,497.87 MB,509821,Arm Mbed OS is a platform operating system designed for the internet of things,C,https://github.com/ARMmbed/mbed-os
404,stlink,4768,1282,4768,9,14/01/2011,16/07/2025,17.06 MB,17473,Open source STM32 MCU programming toolset,C,https://github.com/stlink-org/stlink
405,box64,4742,360,4742,353,01/12/2020,04/08/2025,43.49 MB,44536,"Box64 - Linux Userspace x86_64 Emulator with a twist, targeted at ARM64, RV64 and LoongArch Linux devices",C,https://github.com/ptitSeb/box64
406,proxmark3,4729,1186,4729,56,12/08/2018,04/08/2025,88.53 MB,90655,Iceman Fork - Proxmark3,C,https://github.com/RfidResearchGroup/proxmark3
407,kyanos,4727,209,4727,48,30/04/2024,02/08/2025,38.94 MB,39870,"Kyanos is a networking analysis tool using eBPF. It can visualize the time packets spend in the kernel, capture requests/responses, makes troubleshooting more efficient.",C,https://github.com/hengyoush/kyanos
408,cute_headers,4721,285,4721,20,05/06/2016,11/07/2025,12.59 MB,12890,"Collection of cross-platform one-file C/C++ libraries with no dependencies, primarily used for games",C,https://github.com/RandyGaul/cute_headers
409,coreutils,4678,979,4678,8,07/07/2013,04/08/2025,45.36 MB,46444,upstream mirror,C,https://github.com/coreutils/coreutils
410,bytehound,4677,197,4677,51,16/05/2019,28/07/2023,16.23 MB,16615,A memory profiler for Linux.,C,https://github.com/koute/bytehound
