Ranking,Project Name,Stars,Forks,Watchers,Open Issues,Created At,Last Commit,Size,Size (KB),Description,Language,Repo URL
712,tilck,2947,116,2947,1,14/03/2016,25/08/2025,10.48 MB,10735,A Tiny Linux-Compatible Kernel,C,https://github.com/vvaltchev/tilck
713,libpcap,2946,895,2946,163,14/04/2013,28/08/2025,19.41 MB,19878,the LIBpcap interface to various kernel packet capture mechanism,C,https://github.com/the-tcpdump-group/libpcap
714,util-linux,2945,1278,2945,398,07/09/2011,28/08/2025,253.52 MB,259602,,C,https://github.com/util-linux/util-linux
715,Collections-C,2943,332,2943,16,17/08/2014,27/06/2025,1.74 MB,1781,A library of generic data structures for the C language.,C,https://github.com/srdja/Collections-C
716,android-app,2938,382,2938,66,12/12/2019,20/08/2025,280.42 MB,287154,Official ProtonVPN Android app,C,https://github.com/ProtonVPN/android-app
717,esp-link,2938,731,2938,238,16/05/2015,18/07/2021,3.08 MB,3150,"esp8266 wifi-serial bridge, outbound TCP, and arduino/AVR/LPC/NXP programmer",C,https://github.com/jeelabs/esp-link
718,fftw3,2935,683,2935,171,17/03/2013,05/02/2025,11.43 MB,11708,DO NOT CHECK OUT THESE FILES FROM GITHUB UNLESS YOU KNOW WHAT YOU ARE DOING. (See below.),C,https://github.com/FFTW/fftw3
719,muon,2931,66,2931,26,26/09/2019,15/03/2023,139.96 MB,143324,GPU based Electron on a diet,C,https://github.com/ImVexed/muon
720,termux-x11,2929,414,2929,18,25/08/2019,29/08/2025,12.53 MB,12832,Termux X-server add-on.,C,https://github.com/termux/termux-x11
721,webdis,2923,308,2923,66,20/12/2010,14/03/2025,1.13 MB,1156,A Redis HTTP interface with JSON output,C,https://github.com/nicolasff/webdis
722,libfaketime,2920,350,2920,58,24/04/2011,23/08/2025,880.00 KB,880,libfaketime modifies the system time for a single application,C,https://github.com/wolfcw/libfaketime
723,ZSWatch,2918,259,2918,19,27/08/2022,29/08/2025,162.28 MB,166178,"ZSWatch - the Open Source Zephyr™ based Smartwatch, including both HW and FW.",C,https://github.com/ZSWatch/ZSWatch
724,raspi3-tutorial,2913,351,2913,5,04/01/2018,21/06/2024,535.00 KB,535,Bare metal Raspberry Pi 3 tutorials,C,https://github.com/bztsrc/raspi3-tutorial
725,esp-homekit-devices,2910,369,2910,1,26/01/2018,08/06/2025,24.40 MB,24987,"Advanced firmware to add native Apple HomeKit and custom configurations, compatible with any SoC based on ESP32, ESP32-S, ESP32-C and ESP8266 series. (Shelly, Sonoff, Electrodragon, Tuya...)",C,https://github.com/RavenSystem/esp-homekit-devices
726,nanos,2900,147,2900,77,23/12/2017,12/06/2025,10.89 MB,11147,A kernel designed to run one and only one application in a virtualized environment,C,https://github.com/nanovms/nanos
727,p2pvc,2896,212,2896,15,07/02/2015,01/11/2023,12.51 MB,12810,A point to point color terminal video chat.,C,https://github.com/mofarrell/p2pvc
728,nginx-http-flv-module,2894,582,2894,21,25/06/2017,29/06/2025,3.85 MB,3944,"A media streaming server based on nginx-rtmp-module. In addtion to the features nginx-rtmp-module provides, HTTP-FLV, GOP cache, VHosts (one IP for multi domain names) and JSON style statistics are supported now.",C,https://github.com/winshining/nginx-http-flv-module
729,dynamorio,2890,593,2890,1757,27/11/2014,29/08/2025,124.06 MB,127040,Dynamic Instrumentation Tool Platform,C,https://github.com/DynamoRIO/dynamorio
730,GTAO_Booster_PoC,2888,176,2888,17,28/02/2021,01/10/2021,24.00 KB,24,,C,https://github.com/tostercx/GTAO_Booster_PoC
731,Espruino,2887,760,2887,123,26/09/2013,29/08/2025,226.62 MB,232059,The Espruino JavaScript interpreter - Official Repo,C,https://github.com/espruino/Espruino
732,WinDivert,2885,554,2885,51,19/08/2011,15/03/2023,1.28 MB,1309,WinDivert: Windows Packet Divert,C,https://github.com/basil00/WinDivert
733,neuralcoref,2884,475,2884,65,03/07/2017,13/04/2023,67.83 MB,69454,✨Fast Coreference Resolution in spaCy with Neural Networks,C,https://github.com/huggingface/neuralcoref
734,lastpass-cli,2881,299,2881,209,22/10/2014,22/04/2025,1.02 MB,1049,LastPass command line interface tool,C,https://github.com/lastpass/lastpass-cli
735,sxhkd,2878,142,2878,140,31/12/2012,12/09/2023,434.00 KB,434,Simple X hotkey daemon,C,https://github.com/baskerville/sxhkd
736,open62541,2876,1342,2876,863,20/12/2013,28/08/2025,61.09 MB,62561,Open source implementation of OPC UA (OPC Unified Architecture) aka IEC 62541 licensed under Mozilla Public License v2.0,C,https://github.com/open62541/open62541
737,PF_RING,2860,360,2860,38,04/05/2015,18/08/2025,120.30 MB,123183,High-speed packet processing framework,C,https://github.com/ntop/PF_RING
738,willow,2858,110,2858,23,31/03/2023,03/07/2025,1.88 MB,1920,"Open source, local, and self-hosted Amazon Echo/Google Home competitive Voice Assistant alternative",C,https://github.com/HeyWillow/willow
739,rlwrap,2853,162,2853,21,23/02/2014,22/08/2025,1.06 MB,1083,A readline wrapper,C,https://github.com/hanslub42/rlwrap
740,INTANG,2850,559,2850,23,15/09/2017,11/06/2025,304.00 KB,304,,C,https://github.com/seclab-ucr/INTANG
741,mydumper,2847,486,2847,40,06/11/2015,29/08/2025,6.79 MB,6949,Official MyDumper Project,C,https://github.com/mydumper/mydumper
742,Il2CppInspector,2833,483,2833,67,17/03/2017,13/05/2022,455.67 MB,466609,Powerful automated tool for reverse engineering Unity IL2CPP binaries,C,https://github.com/djkaty/Il2CppInspector
743,Goldleaf,2821,344,2821,84,29/06/2018,12/08/2025,30.52 MB,31255,🍂 Multipurpose homebrew tool for Nintendo Switch,C,https://github.com/XorTroll/Goldleaf
744,MachOView,2818,722,2818,19,13/10/2012,22/07/2024,12.89 MB,13199,MachOView fork,C,https://github.com/gdbinit/MachOView
745,OpenSC,2816,784,2816,112,05/07/2011,28/08/2025,23.27 MB,23827,Open source smart card tools and middleware. PKCS#11/MiniDriver/Tokend,C,https://github.com/OpenSC/OpenSC
746,RTKLIB,2814,1727,2814,432,29/04/2013,28/05/2024,71.51 MB,73227,,C,https://github.com/tomojitakasu/RTKLIB
747,printf,2813,527,2813,68,04/10/2014,03/04/2023,393.00 KB,393,"Tiny, fast, non-dependent and fully loaded printf implementation for embedded systems. Extensive test suite passing.",C,https://github.com/mpaland/printf
748,pigz,2809,181,2809,14,09/04/2010,16/08/2025,974.00 KB,974,"A parallel implementation of gzip for modern multi-processor, multi-core machines.",C,https://github.com/madler/pigz
749,riscv-isa-sim,2806,967,2806,350,26/08/2011,28/08/2025,7.87 MB,8060,"Spike, a RISC-V ISA Simulator",C,https://github.com/riscv-software-src/riscv-isa-sim
750,HackSysExtremeVulnerableDriver,2799,567,2799,14,28/05/2015,24/02/2025,1.84 MB,1883,HackSys Extreme Vulnerable Driver (HEVD) - Windows & Linux,C,https://github.com/hacksysteam/HackSysExtremeVulnerableDriver
751,Zygisk-Il2CppDumper,2794,8021,2794,100,04/07/2020,09/08/2024,1.58 MB,1617,Using Zygisk to dump il2cpp data at runtime,C,https://github.com/Perfare/Zygisk-Il2CppDumper
752,wipeout-rewrite,2792,232,2792,55,10/08/2023,14/06/2025,433.00 KB,433,,C,https://github.com/phoboslab/wipeout-rewrite
753,gstreamer,2788,666,2788,0,01/12/2015,29/08/2025,326.35 MB,334187,GStreamer open-source multimedia framework,C,https://github.com/GStreamer/gstreamer
754,glew,2786,638,2786,73,19/03/2013,25/08/2025,2.53 MB,2591,The OpenGL Extension Wrangler Library,C,https://github.com/nigels-com/glew
755,shadowsocksr-native,2782,763,2782,15,28/07/2017,17/11/2024,4.61 MB,4724,"翻墙 从容穿越党国敏感日 ShadowsocksR (SSRoT) native implementation for all platforms, GFW terminator",C,https://github.com/ShadowsocksR-Live/shadowsocksr-native
756,simde,2780,279,2780,151,28/03/2017,26/08/2025,37.89 MB,38797,Implementations of SIMD instruction sets for systems which don't natively support them.,C,https://github.com/simd-everywhere/simde
757,lmdb,2779,604,2779,0,22/04/2015,12/06/2025,2.52 MB,2579,Read-only mirror of official repo on openldap.org. Issues and pull requests here are ignored. Use OpenLDAP ITS for issues.,C,https://github.com/LMDB/lmdb
758,txiki.js,2776,187,2776,46,21/07/2019,23/08/2025,44.54 MB,45611,A tiny JavaScript runtime,C,https://github.com/saghul/txiki.js
759,tidy-html5,2775,432,2775,227,17/11/2011,04/05/2024,6.45 MB,6601,"The granddaddy of HTML tools, with support for modern standards",C,https://github.com/htacg/tidy-html5
760,LDD-LinuxDeviceDrivers,2775,903,2775,4,26/03/2016,12/08/2025,115.16 MB,117922,Linux内核与设备驱动程序学习笔记,C,https://github.com/gatieme/LDD-LinuxDeviceDrivers
761,libqrencode,2774,610,2774,66,25/02/2011,01/07/2024,1.72 MB,1758,A fast and compact QR Code encoding library,C,https://github.com/fukuchi/libqrencode
762,Broadway,2773,431,2773,88,14/10/2011,22/01/2023,92.58 MB,94798,A JavaScript H.264 decoder.,C,https://github.com/mbebenita/Broadway
763,mpc,2763,299,2763,36,26/09/2013,10/08/2025,702.00 KB,702,A Parser Combinator library for C,C,https://github.com/orangeduck/mpc
764,os,2753,234,2753,23,31/10/2016,17/12/2021,25.79 MB,26406,Minoca operating system,C,https://github.com/minoca/os
765,fdupes,2750,205,2750,92,15/05/2014,31/03/2025,339.00 KB,339,FDUPES is a program for identifying or deleting duplicate files residing within specified directories.,C,https://github.com/adrianlopezroche/fdupes
766,viabtc_exchange_server,2750,1511,2750,112,06/03/2017,17/12/2021,778.00 KB,778,A trading engine with high-speed performance and real-time notification,C,https://github.com/viabtc/viabtc_exchange_server
767,WebBench,2741,1148,2741,15,13/04/2015,19/06/2021,74.00 KB,74,Webbench是Radim Kolar在1997年写的一个在linux下使用的非常简单的网站压测工具。它使用fork()模拟多个客户端同时访问我们设定的URL，测试网站在压力下工作的性能，最多可以模拟3万个并发连接去测试网站的负载能力。官网地址:http://home.tiscali.cz/~cz210552/webbench.html,C,https://github.com/EZLippi/WebBench
768,operating-system-in-1000-lines,2734,207,2734,8,26/07/2023,29/08/2025,1.48 MB,1511,"Writing an OS in 1,000 lines.",C,https://github.com/nuta/operating-system-in-1000-lines
769,xdp-tutorial,2734,629,2734,167,25/02/2019,16/06/2025,570.00 KB,570,XDP tutorial,C,https://github.com/xdp-project/xdp-tutorial
770,opus,2733,693,2733,140,19/08/2014,27/08/2025,23.14 MB,23696,Modern audio compression for the internet.,C,https://github.com/xiph/opus
771,asterisk,2733,1098,2733,141,11/04/2015,28/08/2025,367.58 MB,376405,The official Asterisk Project repository.,C,https://github.com/asterisk/asterisk
772,libtree,2724,61,2724,11,04/04/2020,21/06/2024,584.00 KB,584,ldd as a tree,C,https://github.com/haampie/libtree
773,Catime,2724,114,2724,113,28/01/2025,28/08/2025,80.27 MB,82192,A very useful timer (🍅Pomodoro Clock),C,https://github.com/vladelaina/Catime
774,io,2723,306,2723,64,22/02/2008,13/08/2025,25.99 MB,26612,"Io programming language. Inspired by Self, Smalltalk and LISP.",C,https://github.com/IoLanguage/io
775,brownie,2714,583,2714,394,02/11/2018,25/08/2025,21.43 MB,21948,A Python-based development and testing framework for smart contracts targeting the Ethereum Virtual Machine.,C,https://github.com/eth-brownie/brownie
776,playerctl,2711,90,2711,85,15/04/2014,13/06/2024,683.00 KB,683,"🎧 mpris media player command-line controller for vlc, mpv, RhythmBox, web browsers, cmus, mpd, spotify and others.",C,https://github.com/altdesktop/playerctl
777,permafrost-engine,2708,114,2708,1,30/12/2017,10/08/2025,319.40 MB,327061,An OpenGL RTS game engine written in C,C,https://github.com/eduard-permyakov/permafrost-engine
778,chadwm,2703,207,2703,15,19/07/2021,06/07/2025,4.44 MB,4546,Making dwm as beautiful as possible! ,C,https://github.com/siduck/chadwm
779,zimg,2692,400,2692,119,01/07/2013,29/03/2018,54.32 MB,55620,A lightweight and high performance image storage and processing system.,C,https://github.com/buaazp/zimg
780,mc-old,2687,526,2687,26,13/11/2011,28/02/2025,85.98 MB,88039,Midnight Commander's repository,C,https://github.com/MidnightCommander/mc-old
781,pokeemerald,2685,3378,2685,61,05/10/2015,21/08/2025,182.42 MB,186800,Decompilation of Pokémon Emerald,C,https://github.com/pret/pokeemerald
782,toybox,2680,360,2680,105,07/02/2012,15/08/2025,13.23 MB,13552,toybox,C,https://github.com/landley/toybox
783,cleanflight,2680,1389,2680,1,27/03/2013,20/10/2023,353.78 MB,362275,Clean-code version of the baseflight flight controller firmware,C,https://github.com/cleanflight/cleanflight
784,dump1090,2668,1383,2668,98,05/01/2013,21/01/2024,587.00 KB,587,Dump1090 is a simple Mode S decoder for RTLSDR devices,C,https://github.com/antirez/dump1090
785,openmv,2664,1205,2664,54,13/11/2013,25/08/2025,597.72 MB,612070,OpenMV Camera Module,C,https://github.com/openmv/openmv
786,WizQTClient,2662,813,2662,305,14/11/2012,26/05/2021,89.80 MB,91958,为知笔记跨平台客户端,C,https://github.com/WizTeam/WizQTClient
787,can-utils,2662,753,2662,60,04/03/2015,24/06/2025,1.26 MB,1289,Linux-CAN / SocketCAN user space applications,C,https://github.com/linux-can/can-utils
788,StringZilla,2657,88,2657,41,14/08/2020,29/08/2025,10.42 MB,10673,"Up to 10x faster strings for C, C++, Python, Rust, Swift & Go, leveraging NEON, AVX2, AVX-512, SVE, & SWAR to accelerate search, hashing, sort, edit distances, and memory ops 🦖",C,https://github.com/ashvardanian/StringZilla
789,mako,2651,146,2651,107,22/04/2018,17/04/2025,692.00 KB,692,A lightweight Wayland notification daemon,C,https://github.com/emersion/mako
790,libsixel,2650,91,2650,35,20/08/2013,29/08/2025,33.63 MB,34436,A SIXEL encoder/decoder implementation derived from kmiya's sixel (https://github.com/saitoha/sixel).,C,https://github.com/saitoha/libsixel
791,pipelinedb,2648,244,2648,135,26/11/2013,20/02/2022,47.85 MB,48997,High-performance time-series aggregation for PostgreSQL,C,https://github.com/pipelinedb/pipelinedb
792,SmartAppUpdates,2648,826,2648,16,09/12/2013,11/04/2016,86.45 MB,88525,Android应用增量更新,C,https://github.com/cundong/SmartAppUpdates
793,sniproxy,2647,402,2647,119,20/12/2010,28/08/2025,1.09 MB,1119,Proxies incoming HTTP and TLS connections based on the hostname contained in the initial request of the TCP session.,C,https://github.com/dlundquist/sniproxy
794,panda,2644,497,2644,112,23/08/2013,18/08/2025,500.93 MB,512952,Platform for Architecture-Neutral Dynamic Analysis,C,https://github.com/panda-re/panda
795,pspg,2641,87,2641,0,11/07/2017,31/07/2025,4.63 MB,4746,"Unix pager (with very rich functionality) designed for work with tables. Designed for PostgreSQL, but MySQL is supported too. Works well with pgcli too. Can be used as CSV or TSV viewer too. It supports searching, selecting rows, columns, or block and export selected area to clipboard. ",C,https://github.com/okbob/pspg
796,nexmon,2638,476,2638,340,27/10/2016,25/06/2025,383.69 MB,392896,"The C-based Firmware Patching Framework for Broadcom/Cypress WiFi Chips that enables Monitor Mode, Frame Injection and much more",C,https://github.com/seemoo-lab/nexmon
797,cglm,2637,262,2637,74,11/09/2016,18/06/2025,2.61 MB,2673,📽 Highly Optimized 2D / 3D Graphics Math (glm) for C,C,https://github.com/recp/cglm
798,WidescreenFixesPack,2635,235,2635,502,02/03/2014,12/08/2025,186.33 MB,190797,"Plugins to make or improve widescreen resolutions support in games, add more features and fix bugs.",C,https://github.com/ThirteenAG/WidescreenFixesPack
799,Tiny,2634,347,2634,63,04/04/2017,07/10/2020,65.17 MB,66732,an image compression framework.（一个高保真、高压缩比的图片压缩框架）,C,https://github.com/Sunzxyong/Tiny
800,renderer,2632,288,2632,1,20/03/2017,06/03/2021,131.50 MB,134661,A shader-based software renderer written from scratch in C89,C,https://github.com/zauonlok/renderer
801,drmemory,2631,276,2631,1045,27/11/2014,15/07/2025,7.88 MB,8069,"Memory Debugger for Windows, Linux, Mac, and Android",C,https://github.com/DynamoRIO/drmemory
802,r8152,2630,216,2630,127,01/09/2019,21/06/2025,862.00 KB,862,Synology DSM driver for Realtek RTL8152/RTL8153/RTL8156 based adapters,C,https://github.com/bb-qq/r8152
803,zathura,2626,176,2626,218,03/11/2013,25/08/2025,4.04 MB,4134,Document viewer,C,https://github.com/pwmt/zathura
804,PongoOS,2625,444,2625,47,05/02/2020,03/07/2025,1.84 MB,1889,pongoOS,C,https://github.com/checkra1n/PongoOS
805,HomeKitADK,2623,233,2623,41,11/12/2019,06/07/2022,655.00 KB,655,,C,https://github.com/apple/HomeKitADK
806,iotjs,2615,441,2615,51,08/04/2015,18/06/2021,63.24 MB,64757,Platform for Internet of Things with JavaScript http://www.iotjs.net ,C,https://github.com/jerryscript-project/iotjs
807,Adafruit-GFX-Library,2613,1600,2613,173,13/03/2012,22/04/2025,2.48 MB,2540,"Adafruit GFX graphics core Arduino library, this is the 'core' class that all our other graphics libraries derive from",C,https://github.com/adafruit/Adafruit-GFX-Library
808,Arduino_STM32,2612,1270,2612,31,30/10/2014,01/07/2025,40.15 MB,41115,"Arduino STM32. Hardware files to support STM32 boards, on Arduino IDE 1.8.x including LeafLabs Maple and other generic STM32F103 boards",C,https://github.com/rogerclarkmelbourne/Arduino_STM32
809,bldc,2610,1521,2610,226,09/01/2014,28/08/2025,91.77 MB,93975,The VESC motor control firmware,C,https://github.com/vedderb/bldc
810,yojimbo,2606,258,2606,6,29/05/2016,20/06/2025,10.45 MB,10700,A network library for client/server games written in C++,C,https://github.com/mas-bandwidth/yojimbo
811,word2vec,2605,630,2605,5,25/08/2013,06/04/2023,6.58 MB,6734,Python interface to Google word2vec,C,https://github.com/danielfrg/word2vec
812,strongswan,2601,862,2601,119,28/10/2010,22/08/2025,103.49 MB,105975,strongSwan - IPsec-based VPN,C,https://github.com/strongswan/strongswan
813,mongoose-os,2595,435,2595,95,29/06/2014,06/08/2025,45.94 MB,47043,"Mongoose OS - an IoT Firmware Development Framework. Supported microcontrollers: ESP32, ESP8266, CC3220, CC3200, STM32F4, STM32L4, STM32F7. Amazon AWS IoT, Microsoft Azure, Google IoT Core integrated. Code in C or JavaScript.",C,https://github.com/cesanta/mongoose-os
814,wolfssl,2594,892,2594,158,07/01/2015,28/08/2025,762.39 MB,780687,"The wolfSSL library is a small, fast, portable implementation of TLS/SSL for embedded devices to the cloud.  wolfSSL supports up to TLS 1.3 and DTLS 1.3!",C,https://github.com/wolfSSL/wolfssl
815,jessibuca,2592,450,2592,13,14/02/2016,29/08/2025,1.64 GB,1724032,Jessibuca是一款开源的纯H5直播流播放器,C,https://github.com/langhuihui/jessibuca
816,WindowsInternals,2585,524,2585,6,15/11/2016,11/04/2024,344.00 KB,344,Windows Internals Book 7th edition Tools,C,https://github.com/zodiacon/WindowsInternals
817,kamailio,2577,1026,2577,47,11/12/2013,28/08/2025,116.70 MB,119502,Kamailio - The Open Source SIP Server for large VoIP and real-time communication platforms -,C,https://github.com/kamailio/kamailio
818,AndroidUSBCamera,2574,885,2574,483,29/09/2017,02/09/2024,160.08 MB,163923,"🔥🔥🔥Flexible and useful UVC camera engine on Android platform, supporting multi-road cameras!",C,https://github.com/jiangdongguo/AndroidUSBCamera
819,JankyBorders,2572,44,2572,45,02/11/2023,06/08/2025,3.25 MB,3333,A lightweight window border system for macOS,C,https://github.com/FelixKratz/JankyBorders
820,ettercap,2569,508,2569,126,14/07/2012,16/07/2025,89.55 MB,91697,Ettercap Project,C,https://github.com/Ettercap/ettercap
821,DAPLink,2566,1031,2566,135,28/09/2014,27/02/2025,28.11 MB,28783,,C,https://github.com/ARMmbed/DAPLink
822,Primes,2562,578,2562,2,23/03/2021,05/05/2025,7.78 MB,7970,Prime Number Projects in C#/C++/Python,C,https://github.com/PlummersSoftwareLLC/Primes
823,Open-PS2-Loader,2561,323,2561,391,15/10/2016,28/07/2025,13.53 MB,13855,Game and app loader for Sony PlayStation 2,C,https://github.com/ps2homebrew/Open-PS2-Loader
824,OSCPRepo,2548,738,2548,1,12/11/2017,22/06/2020,697.04 MB,713766,"A list of commands, scripts, resources, and more that I have gathered and attempted to consolidate for use as OSCP (and more) study material. Commands in 'Usefulcommands' Keepnote. Bookmarks and reading material in 'BookmarkList' CherryTree. Reconscan Py2 and Py3. Custom ISO building.",C,https://github.com/rewardone/OSCPRepo
825,inspektor-gadget,2544,297,2544,361,16/04/2019,29/08/2025,108.28 MB,110879,Inspektor Gadget is a set of tools and framework for data collection and system inspection on Kubernetes clusters and Linux hosts using eBPF,C,https://github.com/inspektor-gadget/inspektor-gadget
826,ck,2540,328,2540,13,17/04/2014,19/08/2025,2.08 MB,2133,"Concurrency primitives, safe memory reclamation mechanisms and non-blocking (including lock-free) data structures designed to aid in the research, design and implementation of high performance concurrent systems developed in C99+.",C,https://github.com/concurrencykit/ck
827,amazon-freertos,2538,1089,2538,20,09/11/2017,18/11/2022,282.03 MB,288797,DEPRECATED - See README.md,C,https://github.com/aws/amazon-freertos
828,tio,2533,182,2533,21,27/09/2014,07/08/2025,17.71 MB,18131,A serial device I/O tool,C,https://github.com/tio/tio
829,Entware,2530,167,2530,30,05/03/2018,29/08/2025,11.06 MB,11323,Ultimate repo for embedded devices,C,https://github.com/Entware/Entware
830,SQLiteCpp,2529,545,2529,81,12/04/2012,13/07/2025,20.39 MB,20884,SQLiteC++ (SQLiteCpp) is a smart and easy to use C++ SQLite3 wrapper.,C,https://github.com/SRombauts/SQLiteCpp
831,hidapi,2527,910,2527,246,11/04/2010,16/10/2023,14.43 MB,14775,"A Simple library for communicating with USB and Bluetooth HID devices on Linux, Mac, and Windows.",C,https://github.com/signal11/hidapi
832,swift-corelibs-libdispatch,2525,477,2525,100,09/11/2015,29/08/2025,5.08 MB,5198,"The libdispatch Project, (a.k.a. Grand Central Dispatch), for concurrency on multicore hardware",C,https://github.com/swiftlang/swift-corelibs-libdispatch
833,ZBar,2525,1066,2525,19,22/09/2012,18/03/2024,4.17 MB,4272,Clone of the mercurial repository http://zbar.hg.sourceforge.net:8000/hgroot/zbar/zbar,C,https://github.com/ZBar/ZBar
834,esp32-wifi-penetration-tool,2523,394,2523,68,05/04/2021,18/02/2024,1.90 MB,1949,Exploring possibilities of ESP32 platform to attack on nearby Wi-Fi networks.,C,https://github.com/risinek/esp32-wifi-penetration-tool
835,cc65,2519,464,2519,187,21/03/2013,26/08/2025,30.98 MB,31725,cc65 - a freeware C compiler for 6502 based systems,C,https://github.com/cc65/cc65
836,bpftop,2518,115,2518,2,10/02/2024,19/08/2025,2.57 MB,2629,"bpftop provides a dynamic real-time view of running eBPF programs. It displays the average runtime, events per second, and estimated total CPU % for each program.",C,https://github.com/Netflix/bpftop
837,exploits,2513,687,2513,1,26/08/2020,02/01/2023,3.04 MB,3117,,C,https://github.com/r4j0x00/exploits
838,netcode,2512,198,2512,0,29/12/2016,13/08/2025,6.52 MB,6680,Secure client/server connections over UDP,C,https://github.com/mas-bandwidth/netcode
839,coroutine,2509,689,2509,8,23/07/2012,16/12/2022,9.00 KB,9,A asymmetric coroutine library for C.,C,https://github.com/cloudwu/coroutine
840,sslscan,2506,403,2506,52,16/04/2013,25/08/2025,1.11 MB,1133,sslscan tests SSL/TLS enabled services to discover supported cipher suites,C,https://github.com/rbsec/sslscan
841,sc,2503,284,2503,3,10/11/2020,15/02/2025,835.00 KB,835,Common libraries and data structures for C.,C,https://github.com/tezc/sc
842,CSAPP-Labs,2500,442,2500,4,23/09/2017,15/02/2023,4.17 MB,4270,Solutions and Notes for Labs of Computer Systems: A Programmer's Perspective 3rd Editon // 《深入理解计算机系统》第三版的实验文件、解答与笔记,C,https://github.com/Exely/CSAPP-Labs
843,ldd3,2499,929,2499,9,27/11/2010,28/04/2025,376.00 KB,376,Linux Device Drivers 3 examples updated to work in recent kernels,C,https://github.com/martinezjavier/ldd3
844,arduino-pico,2497,494,2497,9,25/02/2021,28/08/2025,275.47 MB,282079,"Raspberry Pi Pico Arduino core, for all RP2040 and RP2350 boards",C,https://github.com/earlephilhower/arduino-pico
845,blis,2496,391,2496,114,22/01/2014,20/08/2025,49.38 MB,50561,BLAS-like Library Instantiation Software Framework,C,https://github.com/flame/blis
846,HID,2495,418,2495,105,03/06/2014,21/03/2024,3.80 MB,3896,Bring enhanced HID functions to your Arduino!,C,https://github.com/NicoHood/HID
847,NymphCast,2492,83,2492,20,07/02/2019,26/08/2025,126.44 MB,129472,Audio and video casting system with support for custom applications.,C,https://github.com/MayaPosch/NymphCast
848,CrossC2,2492,366,2492,40,16/01/2020,20/11/2023,644.81 MB,660290,generate CobaltStrike's cross-platform payload,C,https://github.com/gloxec/CrossC2
849,c-jwt-cracker,2486,270,2486,16,19/01/2017,02/06/2023,26.00 KB,26,JWT brute force cracker written in C,C,https://github.com/brendan-rius/c-jwt-cracker
850,tsar,2486,732,2486,20,16/01/2013,18/02/2022,2.40 MB,2457,Taobao System Activity Reporter,C,https://github.com/alibaba/tsar
851,xnu,2481,262,2481,1,04/10/2021,27/08/2025,139.40 MB,142743,,C,https://github.com/apple-oss-distributions/xnu
852,libbpf,2477,458,2477,19,10/10/2018,27/08/2025,9.70 MB,9934,Automated upstream mirror for libbpf stand-alone build.,C,https://github.com/libbpf/libbpf
853,OpenGL,2475,679,2475,2,23/02/2013,12/01/2025,227.77 MB,233234,OpenGL 3 and 4 with GLSL,C,https://github.com/McNopper/OpenGL
854,byedpi,2473,163,2473,49,01/06/2023,13/07/2025,336.00 KB,336,Bypass DPI,C,https://github.com/hufrea/byedpi
855,open-vm-tools,2470,455,2470,290,25/04/2014,11/08/2025,24.53 MB,25118,Official repository of VMware open-vm-tools project,C,https://github.com/vmware/open-vm-tools
856,ltp,2469,1066,2469,292,07/03/2012,29/08/2025,65.88 MB,67463,Linux Test Project (mailing list: https://lists.linux.it/listinfo/ltp),C,https://github.com/linux-test-project/ltp
857,oniguruma,2468,335,2468,4,13/07/2015,24/04/2025,6.06 MB,6208,regular expression library,C,https://github.com/kkos/oniguruma
