Ranking,Project Name,Stars,Forks,Watchers,Open Issues,Created At,Last Commit,Size,Size (KB),Description,Language,Repo URL
692,vifm,2989,138,2989,126,21/01/2009,24/07/2025,52.02 MB,53270,"Vifm is a file manager with curses interface, which provides Vim-like environment for managing objects within file systems, extended with some useful ideas from mutt.",C,https://github.com/vifm/vifm
693,irssi,2987,370,2987,204,30/05/2014,26/07/2025,8.54 MB,8750,The client of the future,C,https://github.com/irssi/irssi
694,acl,2987,944,2987,42,07/10/2012,26/07/2025,121.28 MB,124188,"C/C++ server and network library, including coroutine,redis client,http/https/websocket,mqtt, mysql/postgresql/sqlite client with C/C++ for Linux, Android, iOS, MacOS, Windows, etc..",C,https://github.com/acl-dev/acl
695,ShiYanLou,2984,774,2984,1,13/11/2017,17/05/2024,222.51 MB,227853,å­¦ä¹ C & C++ & python&æ±‡ç¼–è¯­è¨€ LLVMç¼–è¯‘å™¨ æ•°æ®ç»“æ„ ç®—æ³• æ“ä½œç³»ç»Ÿ å•ç‰‡æœº  linux  é¢è¯•,C,https://github.com/Ewenwan/ShiYanLou
696,lightning,2981,950,2981,723,13/06/2015,01/08/2025,117.02 MB,119828,Core Lightning â€” Lightning Network implementation focusing on spec compliance and performance,C,https://github.com/ElementsProject/lightning
697,dumpdecrypted,2980,667,2980,21,28/09/2011,26/10/2017,248.00 KB,248,Dumps decrypted mach-o files from encrypted iPhone applications from memory to disk. This tool is necessary for security researchers to be able to look under the hood of encryption.,C,https://github.com/stefanesser/dumpdecrypted
698,julius,2979,348,2979,3,19/08/2017,31/07/2025,34.09 MB,34905,An open source re-implementation of Caesar III,C,https://github.com/bvschaik/julius
699,tcpdump,2975,885,2975,116,14/04/2013,01/08/2025,27.31 MB,27970,the TCPdump network dissector,C,https://github.com/the-tcpdump-group/tcpdump
700,mtr,2974,357,2974,177,02/02/2013,13/07/2025,1.56 MB,1594,"Official repository for mtr, a network diagnostic tool",C,https://github.com/traviscross/mtr
701,zap,2974,98,2974,18,12/01/2023,25/07/2025,11.12 MB,11385,blazingly fast backends in zig,C,https://github.com/zigzap/zap
702,silk-v3-decoder,2972,661,2972,5,07/02/2016,22/01/2025,75.23 MB,77038,"[Skype Silk Codec SDK]Decode silk v3 audio files (like wechat amr, aud files, qq slk files) and convert to other format (like mp3). Batch conversion support.",C,https://github.com/kn007/silk-v3-decoder
703,enet,2970,706,2970,95,05/05/2012,26/07/2025,418.00 KB,418,ENet reliable UDP networking library ,C,https://github.com/lsalzman/enet
704,columnar,2970,89,2970,30,22/07/2022,10/02/2025,4.62 MB,4734,Postgres-native columnar storage extension,C,https://github.com/hydradatabase/columnar
705,IdGenerator,2962,402,2962,30,13/03/2021,10/04/2025,7.71 MB,7900,ğŸ’å¤šè¯­è¨€å®ç°ï¼Œé«˜æ€§èƒ½ç”Ÿæˆå”¯ä¸€æ•°å­—IDã€‚ ğŸ’ä¼˜åŒ–çš„é›ªèŠ±ç®—æ³•ï¼ˆSnowFlakeï¼‰â€”â€”é›ªèŠ±æ¼‚ç§»ç®—æ³•ï¼Œåœ¨ç¼©çŸ­IDé•¿åº¦çš„åŒæ—¶ï¼Œå…·å¤‡æé«˜ç¬æ—¶å¹¶å‘å¤„ç†èƒ½åŠ›ï¼ˆ50W/0.1sï¼‰ã€‚ ğŸ’åŸç”Ÿæ”¯æŒ C#/Java/Go/Rust/C/JavaScript/TypeScript/Python/Pascal å¤šè¯­è¨€ï¼Œæä¾›å…¶å®ƒé€‚ç”¨äºå…¶å®ƒè¯­è¨€çš„å¤šçº¿ç¨‹å®‰å…¨è°ƒç”¨åŠ¨æ€åº“ï¼ˆFFIï¼‰ã€‚ğŸ’æ”¯æŒå®¹å™¨ç¯å¢ƒè‡ªåŠ¨æ‰©å®¹ï¼ˆè‡ªåŠ¨æ³¨å†Œ WorkerId ï¼‰ï¼Œå•æœºæˆ–åˆ†å¸ƒå¼å”¯ä¸€IdGeneratorã€‚ğŸ’é¡¶å°–ä¼˜åŒ–ï¼Œè¶…å¼ºæ•ˆèƒ½ã€‚,C,https://github.com/yitter/IdGenerator
706,shellinabox,2962,470,2962,225,02/03/2015,27/07/2024,4.30 MB,4407,Official-ish Fork of Shell In A Box,C,https://github.com/shellinabox/shellinabox
707,PainterEngine,2959,323,2959,5,04/06/2019,04/08/2025,71.93 MB,73652,"PainterEngine is a application/game engine with software renderer,PainterEngine can be transplanted to any platform that supports C",C,https://github.com/matrixcascade/PainterEngine
708,VulkanMemoryAllocator,2959,392,2959,30,16/06/2017,10/07/2025,28.45 MB,29131,Easy to integrate Vulkan memory allocation library,C,https://github.com/GPUOpen-LibrariesAndSDKs/VulkanMemoryAllocator
709,winevdm,2955,168,2955,339,22/09/2015,04/05/2025,10.46 MB,10710,"16-bit Windows (Windows 1.x, 2.x, 3.0, 3.1, etc.) on 64-bit Windows",C,https://github.com/otya128/winevdm
710,Collections-C,2935,331,2935,15,17/08/2014,27/06/2025,1.74 MB,1781,A library of generic data structures for the C language.,C,https://github.com/srdja/Collections-C
711,util-linux,2934,1273,2934,399,07/09/2011,30/07/2025,253.51 MB,259594,,C,https://github.com/util-linux/util-linux
712,tilck,2933,116,2933,1,14/03/2016,28/07/2025,10.45 MB,10701,A Tiny Linux-Compatible Kernel,C,https://github.com/vvaltchev/tilck
713,esp-link,2929,730,2929,239,16/05/2015,18/07/2021,3.08 MB,3150,"esp8266 wifi-serial bridge, outbound TCP, and arduino/AVR/LPC/NXP programmer",C,https://github.com/jeelabs/esp-link
714,muon,2926,66,2926,26,26/09/2019,15/03/2023,139.96 MB,143324,GPU based Electron on a diet,C,https://github.com/ImVexed/muon
715,libpcap,2925,897,2925,159,14/04/2013,30/07/2025,19.46 MB,19925,the LIBpcap interface to various kernel packet capture mechanism,C,https://github.com/the-tcpdump-group/libpcap
716,webdis,2922,308,2922,66,20/12/2010,14/03/2025,1.13 MB,1156,A Redis HTTP interface with JSON output,C,https://github.com/nicolasff/webdis
717,fftw3,2920,678,2920,168,17/03/2013,05/02/2025,11.43 MB,11708,DO NOT CHECK OUT THESE FILES FROM GITHUB UNLESS YOU KNOW WHAT YOU ARE DOING. (See below.),C,https://github.com/FFTW/fftw3
718,raspi3-tutorial,2905,349,2905,5,04/01/2018,21/06/2024,535.00 KB,535,Bare metal Raspberry Pi 3 tutorials,C,https://github.com/bztsrc/raspi3-tutorial
719,libfaketime,2905,350,2905,57,24/04/2011,03/08/2025,970.00 KB,970,libfaketime modifies the system time for a single application,C,https://github.com/wolfcw/libfaketime
720,esp-homekit-devices,2900,368,2900,2,26/01/2018,08/06/2025,24.40 MB,24987,"Advanced firmware to add native Apple HomeKit and custom configurations, compatible with any SoC based on ESP32, ESP32-S, ESP32-C and ESP8266 series. (Shelly, Sonoff, Electrodragon, Tuya...)",C,https://github.com/RavenSystem/esp-homekit-devices
721,p2pvc,2899,212,2899,15,07/02/2015,01/11/2023,12.51 MB,12810,A point to point color terminal video chat.,C,https://github.com/mofarrell/p2pvc
722,nginx-http-flv-module,2888,582,2888,21,25/06/2017,29/06/2025,3.85 MB,3944,"A media streaming server based on nginx-rtmp-module. In addtion to the features nginx-rtmp-module provides, HTTP-FLV, GOP cache, VHosts (one IP for multi domain names) and JSON style statistics are supported now.",C,https://github.com/winshining/nginx-http-flv-module
723,GTAO_Booster_PoC,2887,176,2887,17,28/02/2021,01/10/2021,24.00 KB,24,,C,https://github.com/tostercx/GTAO_Booster_PoC
724,Espruino,2881,761,2881,125,26/09/2013,30/07/2025,227.25 MB,232708,The Espruino JavaScript interpreter - Official Repo,C,https://github.com/espruino/Espruino
725,lastpass-cli,2881,302,2881,209,22/10/2014,22/04/2025,1.02 MB,1049,LastPass command line interface tool,C,https://github.com/lastpass/lastpass-cli
726,neuralcoref,2880,476,2880,65,03/07/2017,13/04/2023,67.83 MB,69454,âœ¨Fast Coreference Resolution in spaCy with Neural Networks,C,https://github.com/huggingface/neuralcoref
727,android-app,2877,377,2877,66,12/12/2019,15/07/2025,280.29 MB,287017,Official ProtonVPN Android app,C,https://github.com/ProtonVPN/android-app
728,sxhkd,2875,140,2875,139,31/12/2012,12/09/2023,434.00 KB,434,Simple X hotkey daemon,C,https://github.com/baskerville/sxhkd
729,f3,2870,150,2870,70,14/12/2011,27/03/2025,509.00 KB,509,F3 - Fight Flash Fraud,C,https://github.com/AltraMayor/f3
730,dynamorio,2869,590,2869,1751,27/11/2014,02/08/2025,124.05 MB,127032,Dynamic Instrumentation Tool Platform,C,https://github.com/DynamoRIO/dynamorio
731,termux-x11,2865,410,2865,16,25/08/2019,02/08/2025,12.53 MB,12826,Termux X-server add-on.,C,https://github.com/termux/termux-x11
732,ZSWatch,2859,252,2859,21,27/08/2022,04/08/2025,155.52 MB,159255,"ZSWatch - the Open Source Zephyrâ„¢ based Smartwatch, including both HW and FW.",C,https://github.com/ZSWatch/ZSWatch
733,WinDivert,2859,546,2859,49,19/08/2011,15/03/2023,1.28 MB,1309,WinDivert: Windows Packet Divert,C,https://github.com/basil00/WinDivert
734,WinDiskWriter,2852,67,2852,14,26/01/2023,05/07/2025,37.62 MB,38525,ğŸ–¥ Windows Bootable USB creator for macOS. ğŸ›  Patches Windows 11 to bypass TPM and Secure Boot requirements. ğŸ‘¾ UEFI & Legacy Support,C,https://github.com/TechUnRestricted/WinDiskWriter
735,INTANG,2850,559,2850,23,15/09/2017,11/06/2025,304.00 KB,304,,C,https://github.com/seclab-ucr/INTANG
736,open62541,2850,1336,2850,853,20/12/2013,04/08/2025,61.00 MB,62463,Open source implementation of OPC UA (OPC Unified Architecture) aka IEC 62541 licensed under Mozilla Public License v2.0,C,https://github.com/open62541/open62541
737,willow,2841,110,2841,23,31/03/2023,03/07/2025,1.88 MB,1920,"Open source, local, and self-hosted Amazon Echo/Google Home competitive Voice Assistant alternative",C,https://github.com/HeyWillow/willow
738,PF_RING,2840,359,2840,38,04/05/2015,31/07/2025,121.33 MB,124246,High-speed packet processing framework,C,https://github.com/ntop/PF_RING
739,rlwrap,2832,164,2832,23,23/02/2014,08/05/2025,965.00 KB,965,A readline wrapper,C,https://github.com/hanslub42/rlwrap
740,nanos,2831,141,2831,76,23/12/2017,12/06/2025,10.89 MB,11147,A kernel designed to run one and only one application in a virtualized environment,C,https://github.com/nanovms/nanos
741,Il2CppInspector,2821,474,2821,66,17/03/2017,13/05/2022,455.67 MB,466609,Powerful automated tool for reverse engineering Unity IL2CPP binaries,C,https://github.com/djkaty/Il2CppInspector
742,mydumper,2813,480,2813,41,06/11/2015,02/08/2025,6.99 MB,7159,Official MyDumper Project,C,https://github.com/mydumper/mydumper
743,MachOView,2807,721,2807,19,13/10/2012,22/07/2024,12.89 MB,13199,MachOView fork,C,https://github.com/gdbinit/MachOView
744,Goldleaf,2806,346,2806,83,29/06/2018,10/06/2025,30.50 MB,31227,ğŸ‚ Multipurpose homebrew tool for Nintendo Switch,C,https://github.com/XorTroll/Goldleaf
745,pigz,2798,181,2798,14,09/04/2010,13/06/2025,973.00 KB,973,"A parallel implementation of gzip for modern multi-processor, multi-core machines.",C,https://github.com/madler/pigz
746,OpenSC,2798,783,2798,116,05/07/2011,22/07/2025,22.96 MB,23515,Open source smart card tools and middleware. PKCS#11/MiniDriver/Tokend,C,https://github.com/OpenSC/OpenSC
747,RTKLIB,2794,1719,2794,431,29/04/2013,28/05/2024,71.51 MB,73227,,C,https://github.com/tomojitakasu/RTKLIB
748,printf,2789,523,2789,69,04/10/2014,03/04/2023,393.00 KB,393,"Tiny, fast, non-dependent and fully loaded printf implementation for embedded systems. Extensive test suite passing.",C,https://github.com/mpaland/printf
749,wipeout-rewrite,2782,231,2782,55,10/08/2023,14/06/2025,433.00 KB,433,,C,https://github.com/phoboslab/wipeout-rewrite
750,shadowsocksr-native,2781,763,2781,15,28/07/2017,17/11/2024,4.61 MB,4724,"ç¿»å¢™ ä»å®¹ç©¿è¶Šå…šå›½æ•æ„Ÿæ—¥ ShadowsocksR (SSRoT) native implementation for all platforms, GFW terminator",C,https://github.com/ShadowsocksR-Live/shadowsocksr-native
751,riscv-isa-sim,2780,963,2780,347,26/08/2011,04/08/2025,7.84 MB,8029,"Spike, a RISC-V ISA Simulator",C,https://github.com/riscv-software-src/riscv-isa-sim
752,glew,2777,636,2777,71,19/03/2013,23/06/2025,2.53 MB,2590,The OpenGL Extension Wrangler Library,C,https://github.com/nigels-com/glew
753,Broadway,2775,431,2775,88,14/10/2011,22/01/2023,92.58 MB,94798,A JavaScript H.264 decoder.,C,https://github.com/mbebenita/Broadway
754,tidy-html5,2774,432,2774,225,17/11/2011,04/05/2024,6.45 MB,6601,"The granddaddy of HTML tools, with support for modern standards",C,https://github.com/htacg/tidy-html5
755,txiki.js,2766,183,2766,43,21/07/2019,01/05/2025,43.54 MB,44580,A tiny JavaScript runtime,C,https://github.com/saghul/txiki.js
756,LDD-LinuxDeviceDrivers,2764,900,2764,4,26/03/2016,30/06/2025,114.05 MB,116786,Linuxå†…æ ¸ä¸è®¾å¤‡é©±åŠ¨ç¨‹åºå­¦ä¹ ç¬”è®°,C,https://github.com/gatieme/LDD-LinuxDeviceDrivers
757,Zygisk-Il2CppDumper,2764,7937,2764,99,04/07/2020,09/08/2024,1.58 MB,1617,Using Zygisk to dump il2cpp data at runtime,C,https://github.com/Perfare/Zygisk-Il2CppDumper
758,lmdb,2762,605,2762,0,22/04/2015,12/06/2025,2.52 MB,2579,Read-only mirror of official repo on openldap.org. Issues and pull requests here are ignored. Use OpenLDAP ITS for issues.,C,https://github.com/LMDB/lmdb
759,mpc,2756,299,2756,36,26/09/2013,11/05/2024,721.00 KB,721,A Parser Combinator library for C,C,https://github.com/orangeduck/mpc
760,libqrencode,2755,609,2755,66,25/02/2011,01/07/2024,1.72 MB,1758,A fast and compact QR Code encoding library,C,https://github.com/fukuchi/libqrencode
761,simde,2754,276,2754,149,28/03/2017,27/07/2025,37.69 MB,38599,Implementations of SIMD instruction sets for systems which don't natively support them.,C,https://github.com/simd-everywhere/simde
762,os,2752,233,2752,23,31/10/2016,17/12/2021,25.79 MB,26406,Minoca operating system,C,https://github.com/minoca/os
763,HackSysExtremeVulnerableDriver,2749,561,2749,14,28/05/2015,24/02/2025,1.84 MB,1883,HackSys Extreme Vulnerable Driver (HEVD) - Windows & Linux,C,https://github.com/hacksysteam/HackSysExtremeVulnerableDriver
764,viabtc_exchange_server,2741,1511,2741,112,06/03/2017,17/12/2021,778.00 KB,778,A trading engine with high-speed performance and real-time notification,C,https://github.com/viabtc/viabtc_exchange_server
765,fdupes,2737,204,2737,92,15/05/2014,31/03/2025,339.00 KB,339,FDUPES is a program for identifying or deleting duplicate files residing within specified directories.,C,https://github.com/adrianlopezroche/fdupes
766,gstreamer,2736,660,2736,0,01/12/2015,04/08/2025,322.44 MB,330176,GStreamer open-source multimedia framework,C,https://github.com/GStreamer/gstreamer
767,WebBench,2735,1150,2735,16,13/04/2015,19/06/2021,74.00 KB,74,Webbenchæ˜¯Radim Kolaråœ¨1997å¹´å†™çš„ä¸€ä¸ªåœ¨linuxä¸‹ä½¿ç”¨çš„éå¸¸ç®€å•çš„ç½‘ç«™å‹æµ‹å·¥å…·ã€‚å®ƒä½¿ç”¨fork()æ¨¡æ‹Ÿå¤šä¸ªå®¢æˆ·ç«¯åŒæ—¶è®¿é—®æˆ‘ä»¬è®¾å®šçš„URLï¼Œæµ‹è¯•ç½‘ç«™åœ¨å‹åŠ›ä¸‹å·¥ä½œçš„æ€§èƒ½ï¼Œæœ€å¤šå¯ä»¥æ¨¡æ‹Ÿ3ä¸‡ä¸ªå¹¶å‘è¿æ¥å»æµ‹è¯•ç½‘ç«™çš„è´Ÿè½½èƒ½åŠ›ã€‚å®˜ç½‘åœ°å€:http://home.tiscali.cz/~cz210552/webbench.html,C,https://github.com/EZLippi/WebBench
768,io,2724,304,2724,63,22/02/2008,07/07/2025,25.97 MB,26598,"Io programming language. Inspired by Self, Smalltalk and LISP.",C,https://github.com/IoLanguage/io
769,libtree,2722,61,2722,11,04/04/2020,21/06/2024,584.00 KB,584,ldd as a tree,C,https://github.com/haampie/libtree
770,xdp-tutorial,2720,625,2720,167,25/02/2019,16/06/2025,570.00 KB,570,XDP tutorial,C,https://github.com/xdp-project/xdp-tutorial
771,brownie,2709,582,2709,392,02/11/2018,04/08/2025,18.25 MB,18691,A Python-based development and testing framework for smart contracts targeting the Ethereum Virtual Machine.,C,https://github.com/eth-brownie/brownie
772,operating-system-in-1000-lines,2706,205,2706,7,26/07/2023,26/07/2025,1.45 MB,1482,"Writing an OS in 1,000 lines.",C,https://github.com/nuta/operating-system-in-1000-lines
773,permafrost-engine,2700,114,2700,1,30/12/2017,26/07/2025,319.30 MB,326961,An OpenGL RTS game engine written in C,C,https://github.com/eduard-permyakov/permafrost-engine
774,asterisk,2699,1093,2699,137,11/04/2015,31/07/2025,367.63 MB,376455,The official Asterisk Project repository.,C,https://github.com/asterisk/asterisk
775,chadwm,2695,205,2695,15,19/07/2021,06/07/2025,4.44 MB,4546,Making dwm as beautiful as possible! ,C,https://github.com/siduck/chadwm
776,mc-old,2694,526,2694,26,13/11/2011,28/02/2025,85.98 MB,88039,Midnight Commander's repository,C,https://github.com/MidnightCommander/mc-old
777,opus,2694,691,2694,149,19/08/2014,01/08/2025,22.99 MB,23545,Modern audio compression for the internet.,C,https://github.com/xiph/opus
778,playerctl,2693,90,2693,85,15/04/2014,13/06/2024,683.00 KB,683,"ğŸ§ mpris media player command-line controller for vlc, mpv, RhythmBox, web browsers, cmus, mpd, spotify and others.",C,https://github.com/altdesktop/playerctl
779,zimg,2692,400,2692,119,01/07/2013,29/03/2018,54.32 MB,55620,A lightweight and high performance image storage and processing system.,C,https://github.com/buaazp/zimg
780,cleanflight,2676,1389,2676,1,27/03/2013,20/10/2023,353.78 MB,362275,Clean-code version of the baseflight flight controller firmware,C,https://github.com/cleanflight/cleanflight
781,WizQTClient,2658,812,2658,305,14/11/2012,26/05/2021,89.80 MB,91958,ä¸ºçŸ¥ç¬”è®°è·¨å¹³å°å®¢æˆ·ç«¯,C,https://github.com/WizTeam/WizQTClient
782,toybox,2658,357,2658,104,07/02/2012,02/08/2025,13.23 MB,13543,toybox,C,https://github.com/landley/toybox
783,dump1090,2651,1381,2651,98,05/01/2013,21/01/2024,587.00 KB,587,Dump1090 is a simple Mode S decoder for RTLSDR devices,C,https://github.com/antirez/dump1090
784,pipelinedb,2647,243,2647,135,26/11/2013,20/02/2022,47.85 MB,48997,High-performance time-series aggregation for PostgreSQL,C,https://github.com/pipelinedb/pipelinedb
785,SmartAppUpdates,2647,827,2647,16,09/12/2013,11/04/2016,86.45 MB,88525,Androidåº”ç”¨å¢é‡æ›´æ–°,C,https://github.com/cundong/SmartAppUpdates
786,pokeemerald,2642,3306,2642,59,05/10/2015,02/08/2025,182.24 MB,186610,Decompilation of PokÃ©mon Emerald,C,https://github.com/pret/pokeemerald
787,can-utils,2641,752,2641,59,04/03/2015,24/06/2025,1.26 MB,1289,Linux-CAN / SocketCAN user space applications,C,https://github.com/linux-can/can-utils
788,sniproxy,2640,402,2640,119,20/12/2010,02/07/2024,1.09 MB,1113,Proxies incoming HTTP and TLS connections based on the hostname contained in the initial request of the TCP session.,C,https://github.com/dlundquist/sniproxy
789,openmv,2638,1201,2638,57,13/11/2013,03/08/2025,597.71 MB,612050,OpenMV Camera Module,C,https://github.com/openmv/openmv
790,StringZilla,2637,88,2637,40,14/08/2020,04/08/2025,10.82 MB,11078,"Up to 10x faster strings for C, C++, Python, Rust, Swift & Go, leveraging NEON, AVX2, AVX-512, SVE, & SWAR to accelerate search, hashing, sort, edit distances, and memory ops ğŸ¦–",C,https://github.com/ashvardanian/StringZilla
791,panda,2636,496,2636,110,23/08/2013,24/07/2025,500.83 MB,512850,Platform for Architecture-Neutral Dynamic Analysis,C,https://github.com/panda-re/panda
792,Catime,2636,111,2636,114,28/01/2025,25/07/2025,79.79 MB,81703,A very useful timer (ğŸ…Pomodoro Clock),C,https://github.com/vladelaina/Catime
793,Tiny,2632,347,2632,63,04/04/2017,07/10/2020,65.17 MB,66732,an image compression framework.ï¼ˆä¸€ä¸ªé«˜ä¿çœŸã€é«˜å‹ç¼©æ¯”çš„å›¾ç‰‡å‹ç¼©æ¡†æ¶ï¼‰,C,https://github.com/Sunzxyong/Tiny
794,libsixel,2629,90,2629,45,20/08/2013,04/08/2025,33.39 MB,34188,A SIXEL encoder/decoder implementation derived from kmiya's sixel (https://github.com/saitoha/sixel).,C,https://github.com/saitoha/libsixel
795,renderer,2626,287,2626,1,20/03/2017,06/03/2021,131.50 MB,134661,A shader-based software renderer written from scratch in C89,C,https://github.com/zauonlok/renderer
796,pspg,2626,87,2626,0,11/07/2017,31/07/2025,4.63 MB,4746,"Unix pager (with very rich functionality) designed for work with tables. Designed for PostgreSQL, but MySQL is supported too. Works well with pgcli too. Can be used as CSV or TSV viewer too. It supports searching, selecting rows, columns, or block and export selected area to clipboard. ",C,https://github.com/okbob/pspg
797,drmemory,2622,275,2622,1044,27/11/2014,15/07/2025,7.88 MB,8069,"Memory Debugger for Windows, Linux, Mac, and Android",C,https://github.com/DynamoRIO/drmemory
798,nexmon,2618,474,2618,340,27/10/2016,25/06/2025,383.69 MB,392896,"The C-based Firmware Patching Framework for Broadcom/Cypress WiFi Chips that enables Monitor Mode, Frame Injection and much more",C,https://github.com/seemoo-lab/nexmon
799,HomeKitADK,2618,233,2618,41,11/12/2019,06/07/2022,655.00 KB,655,,C,https://github.com/apple/HomeKitADK
800,WidescreenFixesPack,2616,236,2616,503,02/03/2014,01/08/2025,186.32 MB,190794,"Plugins to make or improve widescreen resolutions support in games, add more features and fix bugs.",C,https://github.com/ThirteenAG/WidescreenFixesPack
801,PongoOS,2615,444,2615,47,05/02/2020,03/07/2025,1.84 MB,1889,pongoOS,C,https://github.com/checkra1n/PongoOS
802,iotjs,2614,440,2614,51,08/04/2015,18/06/2021,63.24 MB,64757,Platform for Internet of Things with JavaScript http://www.iotjs.net ,C,https://github.com/jerryscript-project/iotjs
803,Arduino_STM32,2612,1269,2612,31,30/10/2014,01/07/2025,40.15 MB,41115,"Arduino STM32. Hardware files to support STM32 boards, on Arduino IDE 1.8.x including LeafLabs Maple and other generic STM32F103 boards",C,https://github.com/rogerclarkmelbourne/Arduino_STM32
804,cglm,2609,263,2609,74,11/09/2016,18/06/2025,2.61 MB,2673,ğŸ“½ Highly Optimized 2D / 3D Graphics Math (glm) for C,C,https://github.com/recp/cglm
805,mako,2606,146,2606,105,22/04/2018,17/04/2025,692.00 KB,692,A lightweight Wayland notification daemon,C,https://github.com/emersion/mako
806,r8152,2605,210,2605,118,01/09/2019,21/06/2025,862.00 KB,862,Synology DSM driver for Realtek RTL8152/RTL8153/RTL8156 based adapters,C,https://github.com/bb-qq/r8152
807,word2vec,2603,630,2603,5,25/08/2013,06/04/2023,6.58 MB,6734,Python interface to Google word2vec,C,https://github.com/danielfrg/word2vec
808,yojimbo,2597,257,2597,5,29/05/2016,20/06/2025,10.45 MB,10700,A network library for client/server games written in C++,C,https://github.com/mas-bandwidth/yojimbo
809,Adafruit-GFX-Library,2594,1598,2594,172,13/03/2012,22/04/2025,2.48 MB,2540,"Adafruit GFX graphics core Arduino library, this is the 'core' class that all our other graphics libraries derive from",C,https://github.com/adafruit/Adafruit-GFX-Library
810,mongoose-os,2591,435,2591,95,29/06/2014,06/06/2025,45.94 MB,47038,"Mongoose OS - an IoT Firmware Development Framework. Supported microcontrollers: ESP32, ESP8266, CC3220, CC3200, STM32F4, STM32L4, STM32F7. Amazon AWS IoT, Microsoft Azure, Google IoT Core integrated. Code in C or JavaScript.",C,https://github.com/cesanta/mongoose-os
811,zathura,2585,172,2585,213,03/11/2013,03/08/2025,4.06 MB,4160,Document viewer,C,https://github.com/pwmt/zathura
812,strongswan,2580,852,2580,119,28/10/2010,04/08/2025,103.17 MB,105643,strongSwan - IPsec-based VPN,C,https://github.com/strongswan/strongswan
813,WindowsInternals,2577,524,2577,6,15/11/2016,11/04/2024,344.00 KB,344,Windows Internals Book 7th edition Tools,C,https://github.com/zodiacon/WindowsInternals
814,bldc,2575,1506,2575,222,09/01/2014,01/08/2025,91.61 MB,93808,The VESC motor control firmware,C,https://github.com/vedderb/bldc
815,wolfssl,2567,883,2567,157,07/01/2015,01/08/2025,755.91 MB,774050,"The wolfSSL library is a small, fast, portable implementation of TLS/SSL for embedded devices to the cloud.  wolfSSL supports up to TLS 1.3 and DTLS 1.3!",C,https://github.com/wolfSSL/wolfssl
816,jessibuca,2562,444,2562,13,14/02/2016,04/08/2025,1.58 GB,1653728,Jessibucaæ˜¯ä¸€æ¬¾å¼€æºçš„çº¯H5ç›´æ’­æµæ’­æ”¾å™¨,C,https://github.com/langhuihui/jessibuca
817,DAPLink,2562,1023,2562,134,28/09/2014,27/02/2025,28.11 MB,28783,,C,https://github.com/ARMmbed/DAPLink
818,AndroidUSBCamera,2559,878,2559,482,29/09/2017,02/09/2024,160.08 MB,163923,"ğŸ”¥ğŸ”¥ğŸ”¥Flexible and useful UVC camera engine on Android platform, supporting multi-road cameras!",C,https://github.com/jiangdongguo/AndroidUSBCamera
819,Primes,2558,579,2558,2,23/03/2021,05/05/2025,7.78 MB,7970,Prime Number Projects in C#/C++/Python,C,https://github.com/PlummersSoftwareLLC/Primes
820,ettercap,2557,502,2557,127,14/07/2012,16/07/2025,89.55 MB,91697,Ettercap Project,C,https://github.com/Ettercap/ettercap
821,OSCPRepo,2544,740,2544,1,12/11/2017,22/06/2020,697.04 MB,713766,"A list of commands, scripts, resources, and more that I have gathered and attempted to consolidate for use as OSCP (and more) study material. Commands in 'Usefulcommands' Keepnote. Bookmarks and reading material in 'BookmarkList' CherryTree. Reconscan Py2 and Py3. Custom ISO building.",C,https://github.com/rewardone/OSCPRepo
822,amazon-freertos,2541,1091,2541,20,09/11/2017,18/11/2022,282.03 MB,288797,DEPRECATED - See README.md,C,https://github.com/aws/amazon-freertos
823,Open-PS2-Loader,2541,318,2541,390,15/10/2016,28/07/2025,13.53 MB,13855,Game and app loader for Sony PlayStation 2,C,https://github.com/ps2homebrew/Open-PS2-Loader
824,kamailio,2532,1017,2532,31,11/12/2013,04/08/2025,116.50 MB,119295,Kamailio - The Open Source SIP Server for large VoIP and real-time communication platforms -,C,https://github.com/kamailio/kamailio
825,inspektor-gadget,2526,296,2526,349,16/04/2019,04/08/2025,108.02 MB,110613,Inspektor Gadget is a set of tools and framework for data collection and system inspection on Kubernetes clusters and Linux hosts using eBPF,C,https://github.com/inspektor-gadget/inspektor-gadget
826,ck,2526,326,2526,11,17/04/2014,17/06/2025,2.07 MB,2119,"Concurrency primitives, safe memory reclamation mechanisms and non-blocking (including lock-free) data structures designed to aid in the research, design and implementation of high performance concurrent systems developed in C99+.",C,https://github.com/concurrencykit/ck
