Ranking,Project Name,Stars,Forks,Watchers,Open Issues,Created At,Last Commit,Size,Size (KB),Description,Language,Repo URL
566,crun,3530,368,3530,42,13/09/2017,29/08/2025,6.05 MB,6193,A fast and lightweight fully featured OCI runtime and C library for running containers,C,https://github.com/containers/crun
567,retro,3524,535,3524,60,07/02/2018,22/02/2024,220.02 MB,225303,Retro Games in Gym,C,https://github.com/openai/retro
568,src,3520,906,3520,0,30/08/2016,29/08/2025,1.51 GB,1581041,Read-only git conversion of OpenBSD's official CVS src repository. Pull requests not accepted - send diffs to the tech@ mailing list.,C,https://github.com/openbsd/src
569,bpf-developer-tutorial,3518,489,3518,29,02/12/2022,24/08/2025,25.99 MB,26615,eBPF Developer Tutorial: Learning eBPF Step by Step with Examples,C,https://github.com/eunomia-bpf/bpf-developer-tutorial
570,uwsgi,3517,696,3517,869,09/10/2011,03/06/2025,30.11 MB,30830,uWSGI application server container,C,https://github.com/unbit/uwsgi
571,earlyoom,3510,184,3510,22,12/01/2014,16/08/2025,494.00 KB,494,earlyoom - Early OOM Daemon for Linux,C,https://github.com/rfjakob/earlyoom
572,aubio,3509,394,3509,177,04/12/2009,12/05/2025,11.54 MB,11814,a library for audio and music analysis,C,https://github.com/aubio/aubio
573,c-algorithms,3507,740,3507,9,23/06/2010,17/04/2025,808.00 KB,808,A library of common data structures and algorithms written in C.,C,https://github.com/fragglet/c-algorithms
574,redsocks,3502,877,3502,77,18/08/2008,29/06/2024,782.00 KB,782,transparent TCP-to-proxy redirector,C,https://github.com/darkk/redsocks
575,zmk,3500,3439,3500,379,08/06/2020,27/08/2025,26.48 MB,27112,ZMK Firmware Repository,C,https://github.com/zmkfirmware/zmk
576,guacamole-server,3490,702,3490,52,22/03/2016,16/08/2025,8.48 MB,8679,Mirror of Apache Guacamole Server,C,https://github.com/apache/guacamole-server
577,neomutt,3490,320,3490,239,21/12/2015,29/08/2025,172.28 MB,176410,✉️ Teaching an Old Dog New Tricks -- IRC: #neomutt on irc.libera.chat,C,https://github.com/neomutt/neomutt
578,openssh-portable,3486,1925,3486,126,17/01/2014,29/08/2025,30.75 MB,31492,Portable OpenSSH,C,https://github.com/openssh/openssh-portable
579,dSYMTools,3477,881,3477,1,26/06/2014,04/06/2024,27.20 MB,27851,dSYM analyze,C,https://github.com/answer-huang/dSYMTools
580,litex,3469,642,3469,354,07/11/2015,28/08/2025,17.42 MB,17835,"Build your hardware, easily!",C,https://github.com/enjoy-digital/litex
581,ESP8266_RTOS_SDK,3467,1599,3467,475,05/12/2014,09/05/2025,65.66 MB,67231,"Latest ESP8266 SDK based on FreeRTOS, esp-idf style.",C,https://github.com/espressif/ESP8266_RTOS_SDK
582,premake-core,3462,634,3462,291,21/03/2015,26/08/2025,39.05 MB,39984,Premake,C,https://github.com/premake/premake-core
583,small-video-record,3461,728,3461,199,25/08/2016,13/06/2020,88.71 MB,90844,利用FFmpeg视频录制微信小视频与其压缩处理,C,https://github.com/mabeijianxi/small-video-record
584,pthreads,3460,504,3460,54,28/08/2012,09/11/2019,2.56 MB,2622,"Threading for PHP - Share Nothing, Do Everything :)",C,https://github.com/krakjoe/pthreads
585,pgbouncer,3454,513,3454,231,04/05/2010,29/08/2025,3.82 MB,3915,lightweight connection pooler for PostgreSQL,C,https://github.com/pgbouncer/pgbouncer
586,FreeRTOS-Kernel,3454,1337,3454,31,09/09/2019,29/08/2025,121.76 MB,124681,"FreeRTOS kernel files only, submoduled into https://github.com/FreeRTOS/FreeRTOS and various other repos.",C,https://github.com/FreeRTOS/FreeRTOS-Kernel
587,surge,3451,424,3451,233,20/09/2018,27/08/2025,428.52 MB,438802,Synthesizer plug-in (previously released as Vember Audio Surge),C,https://github.com/surge-synthesizer/surge
588,pico-examples,3449,949,3449,148,20/01/2021,29/08/2025,8.95 MB,9166,,C,https://github.com/raspberrypi/pico-examples
589,nuttx,3448,1469,3448,659,14/12/2019,29/08/2025,328.25 MB,336132,"Apache NuttX is a mature, real-time embedded operating system (RTOS)",C,https://github.com/apache/nuttx
590,libffi,3448,752,3448,197,29/09/2009,22/08/2025,8.35 MB,8551,A portable foreign-function interface library.,C,https://github.com/libffi/libffi
591,xserver,3443,183,3443,157,01/02/2025,29/08/2025,53.89 MB,55188,XLibre Xserver,C,https://github.com/X11Libre/xserver
592,Bruce,3442,716,3442,176,02/05/2024,26/08/2025,5.48 GB,5744072,Predatory ESP32 Firmware,C,https://github.com/pr3y/Bruce
593,pg_cron,3439,226,3439,124,04/09/2016,30/06/2025,421.00 KB,421,Run periodic jobs in PostgreSQL,C,https://github.com/citusdata/pg_cron
594,HyperDbg,3439,431,3439,12,01/01/2020,27/08/2025,44.75 MB,45826,State-of-the-art native debugging tools,C,https://github.com/HyperDbg/HyperDbg
595,krackattacks-scripts,3434,771,3434,5,18/10/2017,25/12/2024,17.27 MB,17682,,C,https://github.com/vanhoefm/krackattacks-scripts
596,pwru,3431,203,3431,31,12/10/2021,20/08/2025,9.39 MB,9611,"Packet, where are you? -- eBPF-based Linux kernel networking debugger",C,https://github.com/cilium/pwru
597,Racer,3427,459,3427,21,15/10/2024,02/07/2025,3.85 MB,3946,,C,https://github.com/StuckAtPrototype/Racer
598,yyjson,3421,291,3421,23,08/10/2020,22/08/2025,4.21 MB,4315,The fastest JSON library in C,C,https://github.com/ibireme/yyjson
599,OBS,3418,851,3418,41,13/09/2012,01/08/2020,48.95 MB,50128,Open Broadcaster Software (Deprecated: See OBS Studio repository instead),C,https://github.com/jp9000/OBS
600,massdns,3415,490,3415,15,23/06/2016,21/07/2025,868.00 KB,868,A high-performance DNS stub resolver for bulk lookups and reconnaissance (subdomain enumeration),C,https://github.com/blechschmidt/massdns
601,lk,3412,701,3412,106,27/12/2011,28/08/2025,27.62 MB,28284,LK embedded kernel,C,https://github.com/littlekernel/lk
602,geany,3399,631,3399,1162,07/10/2011,23/08/2025,73.72 MB,75485,A fast and lightweight IDE,C,https://github.com/geany/geany
603,PSBits,3396,550,3396,0,29/06/2019,11/08/2025,15.10 MB,15465,Simple (relatively) things allowing you to dig a bit deeper than usual.,C,https://github.com/gtworek/PSBits
604,xemu,3393,340,3393,847,18/02/2020,25/08/2025,561.46 MB,574940,"Original Xbox Emulator for Windows, macOS, and Linux (Active Development)",C,https://github.com/xemu-project/xemu
605,libopencm3,3387,1086,3387,257,18/04/2012,14/07/2025,6.77 MB,6937,Open source ARM Cortex-M microcontroller library,C,https://github.com/libopencm3/libopencm3
606,nginx-module-vts,3383,481,3383,43,13/02/2015,18/07/2025,1.11 MB,1138,Nginx virtual host traffic status module,C,https://github.com/vozlt/nginx-module-vts
607,emojicode,3380,166,3380,21,31/12/2015,07/08/2023,27.37 MB,28024,😀😜🔂 World’s only programming language that’s bursting with emojis,C,https://github.com/emojicode/emojicode
608,QuickJS,3365,302,3365,10,12/07/2019,28/04/2025,3.13 MB,3209,QuickJS是一个小型并且可嵌入的Javascript引擎，它支持ES2020规范，包括模块，异步生成器和代理器。,C,https://github.com/quickjs-zh/QuickJS
609,odyssey,3363,182,3363,144,28/05/2018,29/08/2025,20.03 MB,20515,Scalable PostgreSQL connection pooler,C,https://github.com/yandex/odyssey
610,criu,3353,660,3353,248,17/01/2014,16/08/2025,21.22 MB,21731,Checkpoint/Restore tool,C,https://github.com/checkpoint-restore/criu
611,minigame-unity-webgl-transform,3353,496,3353,82,24/05/2021,25/08/2025,370.95 MB,379856,Wechat Mini Game Unity engine adapter documents.,C,https://github.com/wechat-miniprogram/minigame-unity-webgl-transform
612,proxmark3,3349,932,3349,64,16/03/2014,03/02/2024,25.91 MB,26532,Proxmark 3,C,https://github.com/Proxmark/proxmark3
613,media-server,3344,1121,3344,105,03/01/2014,24/08/2025,3.92 MB,4015,RTSP/RTP/RTMP/FLV/HLS/MPEG-TS/MPEG-PS/MPEG-DASH/MP4/fMP4/MKV/WebM,C,https://github.com/ireader/media-server
614,ngx_http_google_filter_module,3343,767,3343,39,16/12/2014,26/09/2023,84.00 KB,84,Nginx Module for Google Mirror,C,https://github.com/cuber/ngx_http_google_filter_module
615,rt-n56u,3333,3675,3333,308,27/10/2017,13/06/2024,1.10 GB,1152084,Padavan,C,https://github.com/hanwckf/rt-n56u
616,spdk,3332,1270,3332,210,13/07/2015,29/08/2025,276.72 MB,283362,Storage Performance Development Kit,C,https://github.com/spdk/spdk
617,liburing,3326,469,3326,45,05/08/2019,23/08/2025,3.82 MB,3909,Library providing helpers for the Linux kernel io_uring support,C,https://github.com/axboe/liburing
618,uftrace,3305,520,3305,416,11/02/2014,19/08/2025,8.39 MB,8587,Function graph tracer for C/C++/Rust/Python,C,https://github.com/namhyung/uftrace
619,NetHack,3303,507,3303,147,08/12/2015,28/08/2025,155.52 MB,159251,Official NetHack Git Repository,C,https://github.com/NetHack/NetHack
620,haxm,3302,889,3302,154,25/07/2017,28/01/2023,1.47 MB,1508,Intel® Hardware Accelerated Execution Manager (Intel® HAXM),C,https://github.com/intel/haxm
621,collectd,3300,1250,3300,770,18/01/2012,29/08/2025,28.00 MB,28672,The system statistics collection daemon. Please send Pull Requests here!,C,https://github.com/collectd/collectd
622,warpd,3299,163,3299,90,22/09/2019,12/07/2024,10.84 MB,11102,A modal keyboard-driven virtual pointer,C,https://github.com/rvaiya/warpd
623,bdwgc,3298,427,3298,180,26/07/2011,25/08/2025,29.96 MB,30679,"The Boehm-Demers-Weiser conservative C/C++ Garbage Collector (bdwgc, also known as bdw-gc, boehm-gc, libgc)",C,https://github.com/bdwgc/bdwgc
624,ebpf-for-windows,3288,260,3288,288,08/04/2021,27/08/2025,38.15 MB,39061,eBPF implementation that runs on top of Windows,C,https://github.com/microsoft/ebpf-for-windows
625,npcap,3288,560,3288,241,19/05/2015,25/08/2025,12.92 MB,13234,Nmap Project's Windows packet capture and transmission library,C,https://github.com/nmap/npcap
626,libarchive,3287,826,3287,521,19/01/2012,26/08/2025,28.88 MB,29577,Multi-format archive and compression library,C,https://github.com/libarchive/libarchive
627,clink,3278,284,3278,165,02/01/2014,03/08/2024,5.40 MB,5526,Bash's powerful command line editing in cmd.exe,C,https://github.com/mridgers/clink
628,minix,3273,1105,3273,118,03/10/2014,18/03/2024,190.16 MB,194720,Official MINIX sources - Automatically replicated from gerrit.minix3.org,C,https://github.com/Stichting-MINIX-Research-Foundation/minix
629,tinyvm,3270,304,3270,5,08/01/2011,23/03/2019,177.00 KB,177,"TinyVM is a small, fast, lightweight virtual machine written in pure ANSI C.",C,https://github.com/jakogut/tinyvm
630,trurl,3267,108,3267,1,31/03/2023,18/08/2025,399.00 KB,399,a command line tool for URL parsing and manipulation.,C,https://github.com/curl/trurl
631,libuv,3259,646,3259,64,29/03/2011,27/06/2015,23.23 MB,23784,Go to ,C,https://github.com/joyent/libuv
632,Remotery,3258,283,3258,38,12/03/2014,28/08/2024,2.08 MB,2134,"Single C file, Realtime CPU/GPU Profiler with Remote Web Viewer",C,https://github.com/Celtoys/Remotery
633,slurm,3255,729,3255,4,20/06/2011,29/08/2025,325.20 MB,333002,Slurm: A Highly Scalable Workload Manager,C,https://github.com/SchedMD/slurm
634,threadx,3250,870,3250,80,11/05/2020,29/07/2025,18.17 MB,18603,Eclipse ThreadX is an advanced real-time operating system (RTOS) designed specifically for deeply embedded applications.,C,https://github.com/eclipse-threadx/threadx
635,checkedc,3245,186,3245,73,23/02/2016,07/10/2024,4.59 MB,4699,Checked C is an extension to C that lets programmers write C code with bounds checking and improved type-safety. The goal is to let people easily make their existing C code type-safe and eliminate entire classes of errors.,C,https://github.com/checkedc/checkedc
636,honggfuzz,3241,521,3241,27,07/05/2015,19/05/2025,187.69 MB,192195,"Security oriented software fuzzer. Supports evolutionary, feedback-driven fuzzing based on code coverage (SW and HW based)",C,https://github.com/google/honggfuzz
637,awtk,3240,784,3240,405,21/02/2018,29/08/2025,224.31 MB,229695,AWTK = Toolkit AnyWhere(a cross-platform embedded GUI),C,https://github.com/zlgopen/awtk
638,unikraft,3238,1445,3238,305,12/04/2019,29/08/2025,8.54 MB,8741,"A next-generation cloud native kernel designed to unlock best-in-class performance, security primitives and efficiency savings.",C,https://github.com/unikraft/unikraft
639,PufferLib,3235,227,3235,79,17/09/2022,29/08/2025,308.50 MB,315899,Simplifying reinforcement learning for complex game environments,C,https://github.com/PufferAI/PufferLib
640,jansson,3230,835,3230,124,23/04/2009,24/07/2025,1.78 MB,1819,"C library for encoding, decoding and manipulating JSON data",C,https://github.com/akheron/jansson
641,axel,3220,284,3220,82,13/08/2015,02/02/2025,1.52 MB,1560,Lightweight CLI download accelerator,C,https://github.com/axel-download-accelerator/axel
642,nut,3219,396,3219,885,10/02/2013,14/08/2025,89.73 MB,91879,"The Network UPS Tools repository. UPS management protocol Informational RFC 9271 published by IETF at https://www.rfc-editor.org/info/rfc9271 Please star NUT on GitHub, this helps with sponsorships!",C,https://github.com/networkupstools/nut
643,EasyHook,3219,674,3219,186,09/08/2015,25/01/2024,1.09 MB,1119,EasyHook - The reinvention of Windows API Hooking,C,https://github.com/EasyHook/EasyHook
644,pgbackrest,3215,240,3215,56,11/11/2013,25/08/2025,56.55 MB,57903,Reliable PostgreSQL Backup & Restore,C,https://github.com/pgbackrest/pgbackrest
645,MPC-BE,3205,121,3205,2,30/01/2022,23/08/2025,165.41 MB,169379,MPC-BE – универсальный проигрыватель аудио и видеофайлов для операционной системы Windows.,C,https://github.com/Aleksoid1978/MPC-BE
646,dosbox-x,3199,435,3199,1889,17/05/2014,29/08/2025,627.85 MB,642922,DOSBox-X fork of the DOSBox project,C,https://github.com/joncampbell123/dosbox-x
647,winscp,3195,364,3195,0,22/06/2016,29/08/2025,114.56 MB,117314,"WinSCP is a popular free file manager for Windows supporting SFTP, FTP, FTPS, SCP, S3, WebDAV and local-to-local file transfers. A powerful tool to enhance your productivity with a user-friendly interface and automation options like .NET assembly.",C,https://github.com/winscp/winscp
648,sysstat,3194,468,3194,69,25/04/2013,20/08/2025,11.62 MB,11900,Performance monitoring tools for Linux,C,https://github.com/sysstat/sysstat
649,icmptunnel,3185,357,3185,17,24/08/2015,12/04/2022,841.00 KB,841,Transparently tunnel your IP traffic through ICMP echo and reply packets.,C,https://github.com/DhavalKapil/icmptunnel
650,pingfs,3184,128,3184,4,07/08/2014,05/08/2023,66.00 KB,66,Stores your data in ICMP ping packets,C,https://github.com/yarrick/pingfs
651,civetweb,3183,1002,3183,195,05/10/2013,16/08/2025,27.30 MB,27960,Embedded C/C++ web server,C,https://github.com/civetweb/civetweb
652,gear-lib,3177,868,3177,29,07/08/2015,08/08/2024,5.64 MB,5778,"Gear-Lib, C library for IOT Embedded Multimedia and Network",C,https://github.com/gozfree/gear-lib
653,oj,3174,263,3174,9,17/02/2012,18/08/2025,5.54 MB,5677,Optimized JSON,C,https://github.com/ohler55/oj
654,Main_MiSTer,3172,348,3172,122,13/06/2017,28/08/2025,48.74 MB,49911,Main MiSTer binary and Wiki,C,https://github.com/MiSTer-devel/Main_MiSTer
655,ATC_MiThermometer,3169,553,3169,183,27/08/2020,15/01/2025,2.13 MB,2183,Custom firmware for the Xiaomi Thermometer LYWSD03MMC and Telink Flasher via USB to Serial converter,C,https://github.com/atc1441/ATC_MiThermometer
656,mjpg-streamer,3160,1263,3160,154,07/06/2013,08/08/2024,3.48 MB,3562,Fork of http://sourceforge.net/projects/mjpg-streamer/,C,https://github.com/jacksonliam/mjpg-streamer
657,wsltty,3159,106,3159,20,11/09/2016,28/08/2025,392.00 KB,392,Mintty as a terminal for Bash on Ubuntu on Windows / WSL,C,https://github.com/mintty/wsltty
658,dpvs,3157,747,3157,126,10/10/2017,23/06/2025,6.77 MB,6933,DPVS is a high performance Layer-4 load balancer based on DPDK.,C,https://github.com/iqiyi/dpvs
659,json-c,3156,1083,3156,19,04/12/2010,07/08/2025,4.11 MB,4210,https://github.com/json-c/json-c is the official code repository for json-c.  See the wiki for release tarballs for download.  API docs at http://json-c.github.io/json-c/,C,https://github.com/json-c/json-c
660,leetcode,3153,815,3153,3,15/06/2015,11/07/2025,573.00 KB,573,LeetCode in pure C,C,https://github.com/begeekmyfriend/leetcode
661,Kernelhub,3152,689,3152,0,09/08/2020,15/02/2023,60.34 MB,61784,":palm_tree:Linux、macOS、Windows Kernel privilege escalation vulnerability collection, with compilation environment, demo GIF map, vulnerability details, executable file  (提权漏洞合集) ",C,https://github.com/Ascotbe/Kernelhub
662,audioFlux,3149,144,3149,16,16/01/2023,24/05/2024,7.28 MB,7453,"A library for audio and music analysis, feature extraction.",C,https://github.com/libAudioFlux/audioFlux
663,hexchat,3149,544,3149,768,11/07/2012,19/08/2024,23.75 MB,24318,GTK+ IRC client,C,https://github.com/hexchat/hexchat
664,SimpleKernel,3141,426,3141,8,07/03/2018,07/05/2025,125.08 MB,128083,Simple kernel for learning operating systems. 用于学习操作系统的简单内核,C,https://github.com/Simple-XX/SimpleKernel
665,UVCCamera,3138,1262,3138,519,03/05/2014,14/12/2021,12.88 MB,13188,library and sample to access to UVC web camera on non-rooted Android device,C,https://github.com/saki4510t/UVCCamera
666,tvheadend,3137,938,3137,42,30/12/2010,25/08/2025,62.79 MB,64300,"Tvheadend is the leading TV streaming server for Linux with ATSC, DVB-C/C2, DVB-S/S2, DVB-T/T2, IPTV, SAT>IP and unix pipe input sources",C,https://github.com/tvheadend/tvheadend
667,WiringPi,3135,1271,3135,42,29/06/2012,26/08/2025,1.32 MB,1353,The arguably fastest GPIO Library for the Raspberry Pi,C,https://github.com/WiringPi/WiringPi
668,sl,3135,442,3135,36,04/05/2013,11/06/2024,644.00 KB,644,SL(1): Cure your bad habit of mistyping,C,https://github.com/mtoyoda/sl
669,log.c,3131,649,3131,39,12/03/2017,21/07/2024,7.00 KB,7,A simple logging library implemented in C99,C,https://github.com/rxi/log.c
670,spksrc,3131,1263,3131,274,12/10/2011,27/08/2025,90.18 MB,92344,Cross compilation framework to create native packages for the Synology's NAS,C,https://github.com/SynoCommunity/spksrc
671,weechat,3126,343,3126,430,03/03/2014,16/08/2025,249.22 MB,255206,The extensible chat client.,C,https://github.com/weechat/weechat
672,fzy,3124,137,3124,49,12/07/2014,29/07/2025,345.00 KB,345,":mag: A simple, fast fuzzy finder for the terminal",C,https://github.com/jhawthorn/fzy
673,gps-sdr-sim,3122,868,3122,173,15/06/2015,26/01/2025,5.50 MB,5632,Software-Defined GPS Signal Simulator,C,https://github.com/osqzss/gps-sdr-sim
674,eddystone,3100,756,3100,81,26/06/2015,10/12/2019,4.37 MB,4475,"Specification for Eddystone, an open beacon format from Google",C,https://github.com/google/eddystone
675,Arduino_Core_STM32,3098,1029,3098,29,10/05/2017,29/08/2025,130.50 MB,133635,STM32 core support for Arduino,C,https://github.com/stm32duino/Arduino_Core_STM32
676,rubinius,3085,601,3085,15,12/01/2008,09/05/2023,164.13 MB,168069,The Rubinius Language Platform,C,https://github.com/rubinius/rubinius
677,pycryptodome,3084,537,3084,76,02/05/2014,21/06/2025,40.18 MB,41144,A self-contained cryptographic library for Python,C,https://github.com/Legrandin/pycryptodome
678,gpac,3084,561,3084,43,03/05/2014,27/08/2025,151.38 MB,155009,"GPAC Ultramedia OSS for Video Streaming & Next-Gen Multimedia Transcoding, Packaging & Delivery",C,https://github.com/gpac/gpac
679,libmill,3075,213,3075,22,29/04/2014,09/02/2021,17.09 MB,17499,Go-style concurrency in C,C,https://github.com/sustrik/libmill
680,InfiniTime,3073,1021,3073,386,05/12/2019,20/07/2025,48.77 MB,49945,Firmware for Pinetime smartwatch written in C++ and based on FreeRTOS,C,https://github.com/InfiniTimeOrg/InfiniTime
681,rizin,3052,414,3052,513,30/09/2020,29/08/2025,151.89 MB,155533,UNIX-like reverse engineering framework and command-line toolset.,C,https://github.com/rizinorg/rizin
682,ReflectiveDLLInjection,3051,804,3051,15,04/11/2011,03/09/2022,563.00 KB,563,Reflective DLL injection is a library injection technique in which the concept of reflective programming is employed to perform the loading of a library from memory into a host process.,C,https://github.com/stephenfewer/ReflectiveDLLInjection
683,nchan,3051,292,3051,124,10/08/2009,19/08/2025,8.00 MB,8196,"Fast, horizontally scalable, multiprocess pub/sub queuing server and proxy for HTTP, long-polling, Websockets and EventSource (SSE), powered by Nginx.",C,https://github.com/slact/nchan
684,PolarDB-for-PostgreSQL,3049,495,3049,34,25/05/2021,29/08/2025,727.85 MB,745319,A cloud-native database based on PostgreSQL developed by Alibaba Cloud.,C,https://github.com/ApsaraDB/PolarDB-for-PostgreSQL
685,Quake-2,3045,695,3045,3,31/01/2012,05/12/2023,693.00 KB,693,Quake 2 GPL Source Release,C,https://github.com/id-Software/Quake-2
686,julius,3043,354,3043,4,19/08/2017,31/07/2025,34.09 MB,34905,An open source re-implementation of Caesar III,C,https://github.com/bvschaik/julius
687,ProcDump-for-Linux,3039,325,3039,26,10/11/2017,22/08/2025,7.73 MB,7913,A Linux version of the ProcDump Sysinternals tool,C,https://github.com/microsoft/ProcDump-for-Linux
688,nq,3032,65,3032,4,31/07/2015,03/07/2024,87.00 KB,87,Unix command line queue utility,C,https://github.com/leahneukirchen/nq
689,starrtc-server,3032,933,3032,46,08/01/2019,27/12/2019,1.20 GB,1261211,免费IM系统，IM即时通信消息系统(含一对一文字聊天，群聊，聊天室)，免费一对一voip实时通话，录屏，webrtc服务端，免费直播连麦，互动直播，视频直播，RTSP拉流，RTMP推流，语音对讲，免费在线会议，视频会议等服务端程序，支持物联网平台，✨万水千山总是情，来个star行不行✨,C,https://github.com/starrtc/starrtc-server
690,level-ip,3027,410,3027,17,26/02/2016,13/12/2022,791.00 KB,791,A hacker's userspace TCP/IP stack,C,https://github.com/saminiir/level-ip
691,bjoern,3024,190,3024,35,01/03/2010,09/08/2024,615.00 KB,615,A screamingly fast Python 2/3 WSGI server written in C.,C,https://github.com/jonashaag/bjoern
692,MemoryModule,3017,788,3017,56,23/10/2010,03/01/2024,259.00 KB,259,Library to load a DLL from memory.,C,https://github.com/fancycode/MemoryModule
693,vifm,3007,136,3007,128,21/01/2009,23/08/2025,52.25 MB,53506,"Vifm is a file manager with curses interface, which provides Vim-like environment for managing objects within file systems, extended with some useful ideas from mutt.",C,https://github.com/vifm/vifm
694,zap,3006,100,3006,20,12/01/2023,29/08/2025,11.18 MB,11452,blazingly fast backends in zig,C,https://github.com/zigzap/zap
695,irssi,3000,372,3000,206,30/05/2014,26/07/2025,8.54 MB,8750,The client of the future,C,https://github.com/irssi/irssi
696,IdGenerator,2999,407,2999,32,13/03/2021,10/04/2025,7.71 MB,7900,💎多语言实现，高性能生成唯一数字ID。 💎优化的雪花算法（SnowFlake）——雪花漂移算法，在缩短ID长度的同时，具备极高瞬时并发处理能力（50W/0.1s）。 💎原生支持 C#/Java/Go/Rust/C/JavaScript/TypeScript/Python/Pascal 多语言，提供其它适用于其它语言的多线程安全调用动态库（FFI）。💎支持容器环境自动扩容（自动注册 WorkerId ），单机或分布式唯一IdGenerator。💎顶尖优化，超强效能。,C,https://github.com/yitter/IdGenerator
697,enet,2999,709,2999,95,05/05/2012,26/07/2025,418.00 KB,418,ENet reliable UDP networking library ,C,https://github.com/lsalzman/enet
698,VulkanMemoryAllocator,2999,393,2999,32,16/06/2017,10/07/2025,28.45 MB,29131,Easy to integrate Vulkan memory allocation library,C,https://github.com/GPUOpen-LibrariesAndSDKs/VulkanMemoryAllocator
699,acl,2997,943,2997,43,07/10/2012,21/08/2025,121.30 MB,124211,"C/C++ server and network library, including coroutine,redis client,http/https/websocket,mqtt, mysql/postgresql/sqlite client with C/C++ for Linux, Android, iOS, MacOS, Windows, etc..",C,https://github.com/acl-dev/acl
700,silk-v3-decoder,2992,662,2992,5,07/02/2016,22/01/2025,75.23 MB,77038,"[Skype Silk Codec SDK]Decode silk v3 audio files (like wechat amr, aud files, qq slk files) and convert to other format (like mp3). Batch conversion support.",C,https://github.com/kn007/silk-v3-decoder
701,tcpdump,2990,887,2990,115,14/04/2013,28/08/2025,27.35 MB,28004,the TCPdump network dissector,C,https://github.com/the-tcpdump-group/tcpdump
702,ShiYanLou,2990,774,2990,1,13/11/2017,17/05/2024,222.51 MB,227853,学习C & C++ & python&汇编语言 LLVM编译器 数据结构 算法 操作系统 单片机  linux  面试,C,https://github.com/Ewenwan/ShiYanLou
703,lightning,2983,952,2983,712,13/06/2015,28/08/2025,120.02 MB,122901,Core Lightning — Lightning Network implementation focusing on spec compliance and performance,C,https://github.com/ElementsProject/lightning
704,winevdm,2983,171,2983,337,22/09/2015,28/08/2025,10.52 MB,10774,"16-bit Windows (Windows 1.x, 2.x, 3.0, 3.1, etc.) on 64-bit Windows",C,https://github.com/otya128/winevdm
705,columnar,2982,91,2982,30,22/07/2022,10/02/2025,4.62 MB,4734,Postgres-native columnar storage extension,C,https://github.com/hydradatabase/columnar
706,mtr,2981,356,2981,177,02/02/2013,13/07/2025,1.56 MB,1594,"Official repository for mtr, a network diagnostic tool",C,https://github.com/traviscross/mtr
707,dumpdecrypted,2976,668,2976,21,28/09/2011,26/10/2017,248.00 KB,248,Dumps decrypted mach-o files from encrypted iPhone applications from memory to disk. This tool is necessary for security researchers to be able to look under the hood of encryption.,C,https://github.com/stefanesser/dumpdecrypted
708,PainterEngine,2975,326,2975,5,04/06/2019,04/08/2025,71.93 MB,73652,"PainterEngine is a application/game engine with software renderer,PainterEngine can be transplanted to any platform that supports C",C,https://github.com/matrixcascade/PainterEngine
709,shellinabox,2970,472,2970,225,02/03/2015,27/07/2024,4.30 MB,4407,Official-ish Fork of Shell In A Box,C,https://github.com/shellinabox/shellinabox
710,f3,2951,153,2951,73,14/12/2011,27/03/2025,509.00 KB,509,F3 - Fight Flash Fraud,C,https://github.com/AltraMayor/f3
711,WinDiskWriter,2950,69,2950,14,26/01/2023,05/07/2025,37.62 MB,38525,🖥 Windows Bootable USB creator for macOS. 🛠 Patches Windows 11 to bypass TPM and Secure Boot requirements. 👾 UEFI & Legacy Support,C,https://github.com/TechUnRestricted/WinDiskWriter
