Ranking,Project Name,Stars,Forks,Watchers,Open Issues,Created At,Last Commit,Size,Size (KB),Description,Language,Repo URL
282,Provenance,6156,708,6156,282,27/08/2013,23/09/2025,1.75 GB,1835783,"iOS & tvOS multi-emulator frontend, supporting various Atari, Bandai, NEC, Nintendo, Sega, SNK and Sony console systems… Get Started:  https://wiki.provenance-emu.com  | ",C,https://github.com/Provenance-Emu/Provenance
283,littlefs,6146,909,6146,583,25/02/2017,22/07/2025,11.23 MB,11501,A little fail-safe filesystem designed for microcontrollers,C,https://github.com/littlefs-project/littlefs
284,mbedtls,6134,2764,6134,1588,14/11/2012,27/09/2025,132.29 MB,135468,"An open source, portable, easy to use, readable and flexible TLS library, and reference implementation of the PSA Cryptography API. Releases are on a varying cadence, typically around 3 - 6 months between releases.",C,https://github.com/Mbed-TLS/mbedtls
285,siege,6131,394,6131,146,26/09/2014,08/09/2025,1.51 MB,1543,Siege is an http load tester and benchmarking utility,C,https://github.com/JoeDog/siege
286,kphp-kdb,6117,216,6117,20,18/02/2014,09/02/2019,4.20 MB,4301,VK-KittenPHP/DB/Engine suite,C,https://github.com/vk-com/kphp-kdb
287,ios-webkit-debug-proxy,6096,472,6096,14,12/02/2013,02/07/2025,688.00 KB,688,A DevTools proxy (Chrome Remote Debugging Protocol) for iOS devices (Safari Remote Web Inspector).,C,https://github.com/google/ios-webkit-debug-proxy
288,redshift,6088,435,6088,298,20/12/2012,05/06/2024,2.09 MB,2145,Redshift adjusts the color temperature of your screen according to your surroundings. This may help your eyes hurt less if you are working in front of the screen at night.,C,https://github.com/jonls/redshift
289,reptyr,6067,224,6067,27,14/01/2011,12/08/2025,359.00 KB,359,Reparent a running program to a new terminal,C,https://github.com/nelhage/reptyr
290,X-TRACK,6060,1314,6060,9,19/03/2021,12/08/2025,202.99 MB,207865,A GPS bicycle speedometer that supports offline maps and track recording ,C,https://github.com/FASTSHIFT/X-TRACK
291,tinyusb,6058,1272,6058,224,26/11/2012,27/09/2025,45.33 MB,46423,An open source  cross-platform USB stack for embedded system,C,https://github.com/hathach/tinyusb
292,7-Zip-zstd,6051,337,6051,19,25/06/2016,19/08/2025,21.93 MB,22453,"7-Zip with support for Brotli, Fast-LZMA2, Lizard, LZ4, LZ5 and Zstandard",C,https://github.com/mcmilk/7-Zip-zstd
293,HDMI-PI,6045,881,6045,36,19/10/2020,10/09/2023,45.78 MB,46880,我设计的一个HDMI转MIPI模块，可以用于驱动各种手机屏幕当显示器用。,C,https://github.com/peng-zhihui/HDMI-PI
294,AFLplusplus,6005,1168,6005,37,28/05/2019,28/09/2025,33.07 MB,33861,"The fuzzer afl++ is afl with community patches, qemu 5.1 upgrade, collision-free coverage, enhanced laf-intel & redqueen, AFLfast++ power schedules, MOpt mutators, unicorn_mode, and a lot more!",C,https://github.com/AFLplusplus/AFLplusplus
295,HP-Socket,6001,1795,6001,27,17/12/2013,25/09/2025,406.14 MB,415890,High Performance TCP/UDP/HTTP Communication Component,C,https://github.com/ldcsaa/HP-Socket
296,lwan,5993,550,5993,51,28/01/2012,23/09/2025,6.08 MB,6231,"Experimental, scalable, high performance HTTP server",C,https://github.com/lpereira/lwan
297,raddebugger,5992,256,5992,164,10/01/2024,27/09/2025,21.36 MB,21871,"A native, user-mode, multi-process, graphical debugger.",C,https://github.com/EpicGamesExt/raddebugger
298,deepin-wine-ubuntu,5981,859,5981,257,04/07/2018,01/09/2022,86.06 MB,88126,Deepin Wine for Ubuntu/Debian,C,https://github.com/wszqkzqk/deepin-wine-ubuntu
299,Logan,5973,896,5973,153,26/09/2018,08/08/2025,19.91 MB,20384,Logan is a lightweight case logging system based on mobile platform.,C,https://github.com/Meituan-Dianping/Logan
300,u8g2,5971,1146,5971,262,06/11/2015,21/09/2025,219.40 MB,224665,"U8glib library for monochrome displays, version 2 ",C,https://github.com/olikraus/u8g2
301,haproxy,5962,863,5962,341,09/04/2018,27/09/2025,101.10 MB,103529,HAProxy Load Balancer's development branch (mirror of git.haproxy.org),C,https://github.com/haproxy/haproxy
302,Luma3DS,5960,595,5960,112,08/02/2016,26/09/2025,8.78 MB,8986,"Nintendo 3DS ""Custom Firmware""",C,https://github.com/LumaTeam/Luma3DS
303,RediSearch,5945,557,5945,597,05/05/2016,28/09/2025,55.49 MB,56817,"A query and indexing engine for Redis, providing secondary indexing, full-text search, vector similarity search and aggregations.",C,https://github.com/RediSearch/RediSearch
304,ponyc,5941,424,5941,269,13/11/2012,27/09/2025,19.53 MB,19997,"Pony is an open-source, actor-model, capabilities-secure, high performance programming language",C,https://github.com/ponylang/ponyc
305,grbl,5940,3147,5940,559,24/01/2009,02/06/2024,2.23 MB,2285,"An open source, embedded, high performance g-code-parser and CNC milling controller written in optimized C that will run on a straight Arduino",C,https://github.com/grbl/grbl
306,zmap,5919,950,5919,10,23/01/2013,27/08/2025,6.38 MB,6537,ZMap is a fast single packet network scanner designed for Internet-wide network surveys.,C,https://github.com/zmap/zmap
307,cmus,5917,490,5917,203,29/12/2012,27/09/2025,6.04 MB,6187,"Small, fast and powerful console music player for Unix-like operating systems.",C,https://github.com/cmus/cmus
308,tmate,5877,321,5877,123,12/06/2013,16/10/2023,15.94 MB,16321,Instant Terminal Sharing,C,https://github.com/tmate-io/tmate
309,ravynos,5875,198,5875,87,31/01/2021,12/09/2025,2.82 GB,2957353,A BSD-based OS project that aims to provide source and binary compatibility with macOS® and a similar user experience.,C,https://github.com/ravynsoft/ravynos
310,htop,5874,580,5874,317,13/01/2014,17/11/2020,2.63 MB,2697,htop is an interactive text-mode process viewer for Unix systems. It aims to be a better 'top'.,C,https://github.com/hishamhm/htop
311,i3,5844,316,5844,1,21/11/2014,01/11/2022,13.20 MB,13512,A fork of the i3 window manager with gaps and some other features. :warning: i3-gaps has been merged into i3. ,C,https://github.com/Airblader/i3
312,MBE,5841,905,5841,11,20/06/2015,09/12/2021,355.00 KB,355,Course materials for Modern Binary Exploitation by RPISEC,C,https://github.com/RPISEC/MBE
313,fio,5839,1336,5839,230,22/10/2012,26/09/2025,30.14 MB,30865,Flexible I/O Tester,C,https://github.com/axboe/fio
314,libusb,5807,2010,5807,170,11/12/2013,19/09/2025,5.44 MB,5568,A cross-platform library to access USB devices ,C,https://github.com/libusb/libusb
315,sshfs-win,5778,280,5778,298,18/06/2016,21/11/2024,3.41 MB,3489,SSHFS For Windows,C,https://github.com/winfsp/sshfs-win
316,asuswrt-merlin.ng,5771,679,5771,45,05/09/2017,27/09/2025,2.60 GB,2730846,Third party firmware for Asus routers (newer codebase),C,https://github.com/RMerl/asuswrt-merlin.ng
317,libfuse,5767,1219,5767,59,19/12/2015,22/09/2025,4.65 MB,4764,The reference implementation of the Linux FUSE (Filesystem in Userspace) interface,C,https://github.com/libfuse/libfuse
318,GmSSL,5743,1756,5743,379,01/12/2014,31/07/2024,41.27 MB,42256,支持国密SM2/SM3/SM4/SM9/SSL的密码工具箱,C,https://github.com/guanzhi/GmSSL
319,clumsy,5739,568,5739,123,01/10/2013,23/06/2024,56.38 MB,57737,"clumsy makes your network condition on Windows significantly worse, but in a controlled and interactive manner.",C,https://github.com/jagt/clumsy
320,palera1n,5722,689,5722,13,17/09/2022,25/09/2025,98.17 MB,100523,"Jailbreak for A8 through A11, T2 devices, on iOS/iPadOS/tvOS 15.0, bridgeOS 5.0 and higher.",C,https://github.com/palera1n/palera1n
321,gimp,5685,778,5685,0,03/06/2012,28/09/2025,765.43 MB,783804,Read-only mirror of https://gitlab.gnome.org/GNOME/gimp,C,https://github.com/GNOME/gimp
322,kbengine,5659,2339,5659,175,17/02/2014,13/12/2022,325.88 MB,333705,A MMOG engine of server.,C,https://github.com/kbengine/kbengine
323,dokany,5654,689,5654,95,10/12/2014,31/07/2025,6.51 MB,6662,User mode file system library for windows with FUSE Wrapper,C,https://github.com/dokan-dev/dokany
324,kcat,5652,493,5652,162,30/03/2014,09/07/2024,528.00 KB,528,Generic command line non-JVM Apache Kafka producer and consumer,C,https://github.com/edenhill/kcat
325,moonlight-android,5646,899,5646,351,21/09/2013,29/07/2025,126.86 MB,129902,GameStream client for Android,C,https://github.com/moonlight-stream/moonlight-android
326,suricata,5639,1585,5639,43,14/08/2012,26/09/2025,80.42 MB,82353,"Suricata is a network Intrusion Detection System, Intrusion Prevention System and Network Security Monitoring engine developed by the OISF and the Suricata community.",C,https://github.com/OISF/suricata
327,SQLAdvisor,5638,1246,5638,76,01/03/2017,08/10/2023,19.93 MB,20412,输入SQL，输出索引优化建议,C,https://github.com/Meituan-Dianping/SQLAdvisor
328,espeak-ng,5619,1121,5619,575,08/12/2015,15/09/2025,74.80 MB,76592,eSpeak NG is an open source speech synthesizer that supports more than hundred languages and accents.,C,https://github.com/espeak-ng/espeak-ng
329,clamav,5614,791,5614,302,20/07/2012,26/09/2025,176.29 MB,180522,ClamAV - Documentation is here: https://docs.clamav.net,C,https://github.com/Cisco-Talos/clamav
330,mozjpeg,5608,429,5608,96,12/01/2014,23/06/2025,16.97 MB,17382,Improved JPEG encoder.,C,https://github.com/mozilla/mozjpeg
331,RIOT,5600,2057,5600,829,29/12/2012,28/09/2025,182.12 MB,186486,RIOT -  The friendly OS for IoT,C,https://github.com/RIOT-OS/RIOT
332,TIC-80,5595,553,5595,373,03/01/2017,27/09/2025,127.65 MB,130710,"TIC-80 is a fantasy computer for making, playing and sharing tiny games.",C,https://github.com/nesbox/TIC-80
333,unit,5570,357,5570,269,06/09/2017,25/09/2025,13.07 MB,13385,NGINX Unit - universal web app server - a lightweight and versatile open source server that simplifies the application stack by natively executing application code across eight different programming language runtimes.,C,https://github.com/nginx/unit
334,esp32-weather-epd,5568,392,5568,38,08/03/2022,31/07/2025,77.62 MB,79488,A low-power E-Paper weather display powered by an ESP32 microcontroller. Utilizes the OpenWeatherMap API.,C,https://github.com/lmarzen/esp32-weather-epd
335,ZipArchive,5559,1347,5559,59,19/08/2010,05/05/2025,4.00 MB,4098,"ZipArchive is a simple utility class for zipping and unzipping files on iOS, macOS and tvOS.",C,https://github.com/ZipArchive/ZipArchive
336,wasm-micro-runtime,5556,722,5556,534,02/05/2019,24/09/2025,28.72 MB,29413,WebAssembly Micro Runtime (WAMR),C,https://github.com/bytecodealliance/wasm-micro-runtime
337,ffmpeg-kit,5554,2270,5554,70,28/07/2020,23/06/2025,13.35 MB,13674,"FFmpeg Kit for applications. Supports Android, Flutter, iOS, Linux, macOS, React Native and tvOS. Supersedes MobileFFmpeg, flutter_ffmpeg and react-native-ffmpeg.",C,https://github.com/arthenica/ffmpeg-kit
338,FFmpegAndroid,5550,1344,5550,2,23/01/2018,31/08/2025,174.39 MB,178574,FFmpeg实现视频裁剪、水印、转码、编解码、转Gif动图；FFmpeg本地推流、H264与RTMP实时推流直播；OpenGL滤镜特效，视频拍摄。音视频学习路线，音视频知识总结、流媒体协议,C,https://github.com/xufuji456/FFmpegAndroid
339,h3,5538,518,5538,131,21/12/2017,08/09/2025,49.61 MB,50802,Hexagonal hierarchical geospatial indexing system,C,https://github.com/uber/h3
340,linux-kernel-exploits,5506,1737,5506,4,25/04/2017,13/07/2020,8.95 MB,9163,linux-kernel-exploits Linux平台提权漏洞集合,C,https://github.com/SecWiki/linux-kernel-exploits
341,licecap,5492,461,5492,102,21/07/2014,05/09/2023,10.04 MB,10279,LICEcap simple animated screen capture tool for Windows and OS X,C,https://github.com/justinfrankel/licecap
342,nanovg,5450,795,5450,319,12/11/2013,19/03/2024,3.42 MB,3500,Antialiased 2D vector drawing library on top of OpenGL for UI and visualizations.,C,https://github.com/memononen/nanovg
343,pngquant,5450,495,5450,54,17/09/2009,07/07/2025,1.74 MB,1777,Lossy PNG compressor — pngquant command based on libimagequant library,C,https://github.com/kornelski/pngquant
344,gamemode,5445,203,5445,202,10/04/2018,04/09/2025,731.00 KB,731,Optimise Linux system performance on demand,C,https://github.com/FeralInteractive/gamemode
345,dperf,5441,545,5441,0,21/12/2021,24/09/2025,568.00 KB,568,dperf: High-Performance Network Load Testing Tool Based on DPDK,C,https://github.com/baidu/dperf
346,tinyproxy,5438,729,5438,130,07/12/2015,21/06/2025,1.99 MB,2035,tinyproxy - a light-weight HTTP/HTTPS proxy daemon for POSIX operating systems,C,https://github.com/tinyproxy/tinyproxy
347,edk2,5431,2884,5431,1196,14/04/2011,26/09/2025,325.60 MB,333419,EDK II,C,https://github.com/tianocore/edk2
348,Quake,5427,960,5427,4,31/01/2012,15/06/2024,2.08 MB,2129,Quake GPL Source Release,C,https://github.com/id-Software/Quake
349,mruby,5421,818,5421,175,19/04/2012,23/09/2025,24.51 MB,25099,Lightweight Ruby,C,https://github.com/mruby/mruby
350,MTProxy,5411,946,5411,305,29/05/2018,09/06/2024,330.00 KB,330,,C,https://github.com/TelegramMessenger/MTProxy
351,camerakit-android,5391,881,5391,165,27/11/2016,08/08/2023,21.33 MB,21847,Library for Android Camera 1 and 2 APIs. Massively increase stability and reliability of photo and video capture on all Android devices.,C,https://github.com/CameraKit/camerakit-android
352,swift-corelibs-foundation,5383,1161,5383,681,09/11/2015,28/09/2025,25.47 MB,26079,"The Foundation Project, providing core utilities, internationalization, and OS independence",C,https://github.com/swiftlang/swift-corelibs-foundation
353,rainmeter,5342,594,5342,40,31/03/2012,29/08/2025,15.74 MB,16114,Desktop customization tool for Windows,C,https://github.com/rainmeter/rainmeter
354,fishhook,5342,982,5342,38,11/07/2013,01/08/2024,40.00 KB,40,A library that enables dynamically rebinding symbols in Mach-O binaries running on iOS.,C,https://github.com/facebook/fishhook
355,cava,5310,265,5310,16,16/03/2014,16/09/2025,4.67 MB,4777,Cross-platform Audio Visualizer,C,https://github.com/karlstav/cava
356,cjdns,5301,597,5301,105,16/02/2011,19/09/2025,25.63 MB,26242,An encrypted IPv6 network using public-key cryptography for address allocation and a distributed hash table for routing.,C,https://github.com/cjdelisle/cjdns
357,activate-linux,5287,109,5287,35,16/03/2022,14/07/2025,1.06 MB,1081,"The ""Activate Windows"" watermark ported to Linux",C,https://github.com/MrGlockenspiel/activate-linux
358,sds,5277,495,5277,106,06/02/2014,18/04/2025,85.00 KB,85,Simple Dynamic Strings library for C,C,https://github.com/antirez/sds
359,miniaudio,5264,460,5264,34,21/10/2016,27/09/2025,171.33 MB,175444,"Audio playback and capture library written in C, in a single source file.",C,https://github.com/mackron/miniaudio
360,entr,5258,115,5258,3,27/03/2018,28/09/2025,1.02 MB,1042,Run arbitrary commands when files change,C,https://github.com/eradman/entr
361,dsvpn,5249,402,5249,1,17/07/2019,10/06/2025,183.00 KB,183,A Dead Simple VPN.,C,https://github.com/jedisct1/dsvpn
362,Ditto,5240,295,5240,673,13/11/2020,27/09/2025,159.59 MB,163424,Ditto is an extension to the Windows Clipboard. You copy something to the Clipboard and Ditto takes what you copied and stores it in a database to retrieve at a later time.,C,https://github.com/sabrogden/Ditto
363,LookingGlass,5213,286,5213,10,07/12/2017,22/09/2025,6.02 MB,6161,An extremely low latency KVMFR (KVM FrameRelay) implementation for guests with VGA PCI Passthrough.,C,https://github.com/gnif/LookingGlass
364,LuaJIT,5213,1067,5213,72,06/08/2015,24/07/2025,9.30 MB,9526,Mirror of the LuaJIT git repository,C,https://github.com/LuaJIT/LuaJIT
365,bitwise,5211,226,5211,17,10/03/2018,07/03/2019,1005.00 KB,1005,Bitwise is an educational project where we create the software/hardware stack for a computer from scratch.,C,https://github.com/pervognsen/bitwise
366,mjolnir,5210,129,5210,0,19/06/2014,14/03/2021,11.21 MB,11475,Lightweight automation and productivity app for OS X,C,https://github.com/mjolnirapp/mjolnir
367,sc-im,5197,221,5197,99,30/10/2014,18/09/2025,5.80 MB,5936,sc-im - Spreadsheet Calculator Improvised -- An ncurses spreadsheet program for terminal,C,https://github.com/andmarti1424/sc-im
368,dunst,5184,363,5184,130,07/09/2011,15/09/2025,7.47 MB,7649,Lightweight and customizable notification daemon,C,https://github.com/dunst-project/dunst
369,oot,5184,644,5184,31,17/03/2020,20/08/2025,157.38 MB,161160,Decompilation of The Legend of Zelda: Ocarina of Time,C,https://github.com/zeldaret/oot
370,minhook,5168,992,5168,42,10/05/2013,18/05/2025,356.00 KB,356,The Minimalistic x86/x64 API Hooking Library for Windows,C,https://github.com/TsudaKageyu/minhook
371,ostep-projects,5144,1417,5144,36,16/01/2018,19/07/2024,32.04 MB,32807,Projects for an undergraduate OS course,C,https://github.com/remzi-arpacidusseau/ostep-projects
372,mdp,5106,258,5106,11,14/09/2014,09/07/2025,368.00 KB,368,A command-line based markdown presentation tool.,C,https://github.com/visit1985/mdp
373,libwebsockets,5101,1555,5101,182,06/02/2013,20/09/2025,54.28 MB,55582,canonical libwebsockets.org networking library,C,https://github.com/warmcat/libwebsockets
374,phc-winner-argon2,5083,440,5083,97,04/10/2015,06/08/2024,5.77 MB,5907,"The password hash Argon2, winner of PHC ",C,https://github.com/P-H-C/phc-winner-argon2
375,seL4,5080,717,5080,218,18/07/2014,08/09/2025,14.71 MB,15063,The seL4 microkernel,C,https://github.com/seL4/seL4
376,macvim,5073,393,5073,9,29/05/2010,05/08/2017,76.29 MB,78126,Vim - the text editor - for Mac OS X,C,https://github.com/b4winckler/macvim
377,UEFITool,5073,694,5073,24,08/10/2013,26/09/2025,5.98 MB,6121,UEFI firmware image viewer and editor,C,https://github.com/LongSoft/UEFITool
378,clib,5061,256,5061,24,28/10/2012,30/03/2025,807.00 KB,807,Package manager for the C programming language.,C,https://github.com/clibs/clib
379,vgpu_unlock,5060,462,5060,53,28/01/2021,28/02/2023,102.00 KB,102,Unlock vGPU functionality for consumer grade GPUs.,C,https://github.com/DualCoder/vgpu_unlock
380,redcarpet,5059,527,5059,112,24/03/2011,06/03/2025,1.10 MB,1128,"The safe Markdown parser, reloaded.",C,https://github.com/vmg/redcarpet
381,katran,5050,523,5050,2,27/04/2018,27/09/2025,9.31 MB,9536,A high performance layer 4 load balancer,C,https://github.com/facebookincubator/katran
382,tbox,5044,751,5044,39,10/04/2011,21/09/2025,31.57 MB,32325,🎁 A glib-like multi-platform c library,C,https://github.com/tboox/tbox
383,esp_wifi_repeater,5040,950,5040,251,16/12/2016,13/02/2025,7.76 MB,7948,A full functional WiFi Repeater (correctly: a WiFi NAT Router),C,https://github.com/martin-ger/esp_wifi_repeater
384,glusterfs,5034,1112,5034,239,17/02/2011,06/09/2025,173.34 MB,177498,Gluster Filesystem : Build your distributed storage in minutes,C,https://github.com/gluster/glusterfs
385,rnnoise,5031,996,5031,200,03/08/2017,22/02/2025,910.00 KB,910,Recurrent neural network for audio noise reduction,C,https://github.com/xiph/rnnoise
386,sigma-file-manager,5017,185,5017,164,25/05/2021,30/04/2024,289.27 MB,296208,"""Sigma File Manager"" is a free, open-source, quickly evolving, modern file manager (explorer / browser) app for Windows and Linux.",C,https://github.com/aleksey-hoffman/sigma-file-manager
387,microui,5016,324,5016,38,22/09/2018,13/08/2024,54.00 KB,54,A tiny immediate-mode UI library,C,https://github.com/rxi/microui
388,mpc-hc,4995,1926,4995,17,25/07/2012,24/04/2020,112.13 MB,114821,MPC-HC's main repository.  For support use our Trac: https://trac.mpc-hc.org/,C,https://github.com/mpc-hc/mpc-hc
389,lxc,4992,1147,4992,169,07/09/2012,22/09/2025,34.99 MB,35831,LXC - Linux Containers,C,https://github.com/lxc/lxc
390,yasea,4921,1322,4921,284,06/04/2016,12/06/2024,26.68 MB,27323,RTMP live streaming client for Android,C,https://github.com/begeekmyfriend/yasea
391,pushdeer,4919,498,4919,60,16/12/2021,13/03/2025,158.24 MB,162035,开放源码的无App推送服务，iOS14+扫码即用。亦支持快应用/iOS和Mac客户端、Android客户端、自制设备,C,https://github.com/easychen/pushdeer
392,nanopb,4910,956,4910,84,29/04/2015,07/08/2025,4.43 MB,4533,Protocol Buffers with small code size,C,https://github.com/nanopb/nanopb
393,LiteOS,4895,1590,4895,47,11/09/2016,31/05/2022,502.37 MB,514429,code and manual,C,https://github.com/LiteOS/LiteOS
394,OpenLara,4882,377,4882,162,13/08/2016,16/06/2025,43.70 MB,44747,Classic Tomb Raider open-source engine,C,https://github.com/XProger/OpenLara
395,sslh,4870,386,4870,40,10/07/2013,24/09/2025,2.38 MB,2441,Applicative Protocol Multiplexer (e.g. share SSH and HTTPS on the same port),C,https://github.com/yrutschle/sslh
396,proxmark3,4860,1213,4860,58,12/08/2018,25/09/2025,88.60 MB,90727,Iceman Fork - Proxmark3,C,https://github.com/RfidResearchGroup/proxmark3
397,pebble,4857,368,4857,2,21/01/2025,25/02/2025,78.36 MB,80240,This is the latest version of the internal repository from Pebble Technology providing the software to run on Pebble watches. Proprietary source code has been removed from this repository and it will not compile as-is. This is for information only.,C,https://github.com/google/pebble
398,CloverBootloader,4856,648,4856,31,02/09/2019,17/09/2025,232.02 MB,237585,"Bootloader for macOS, Windows and Linux in UEFI and in legacy mode",C,https://github.com/CloverHackyColor/CloverBootloader
399,box64,4843,374,4843,368,01/12/2020,27/09/2025,42.19 MB,43203,"Box64 - Linux Userspace x86_64 Emulator with a twist, targeted at ARM64, RV64 and LoongArch Linux devices",C,https://github.com/ptitSeb/box64
400,ossec-hids,4833,1057,4833,350,17/09/2013,22/01/2025,20.01 MB,20493,"OSSEC is an Open Source Host-based Intrusion Detection System that performs log analysis, file integrity checking, policy monitoring, rootkit detection, real-time alerting and active response.",C,https://github.com/ossec/ossec-hids
401,stlink,4827,1287,4827,9,14/01/2011,16/07/2025,17.06 MB,17473,Open source STM32 MCU programming toolset,C,https://github.com/stlink-org/stlink
402,naxsi,4825,605,4825,0,19/08/2011,08/11/2023,2.00 MB,2048,"NAXSI is an open-source, high performance, low rules maintenance WAF for NGINX",C,https://github.com/nbs-system/naxsi
403,jo,4811,160,4811,5,04/03/2016,20/06/2025,309.00 KB,309,JSON output from a shell,C,https://github.com/jpmens/jo
404,kyanos,4799,215,4799,49,30/04/2024,28/09/2025,38.94 MB,39872,"Kyanos is a networking analysis tool using eBPF. It can visualize the time packets spend in the kernel, capture requests/responses, makes troubleshooting more efficient.",C,https://github.com/hengyoush/kyanos
405,Unity,4787,1062,4787,98,26/01/2012,07/08/2025,7.07 MB,7236,Simple unit testing for C,C,https://github.com/ThrowTheSwitch/Unity
406,mbed-os,4784,3013,4784,207,18/02/2013,08/10/2024,497.87 MB,509821,Arm Mbed OS is a platform operating system designed for the internet of things,C,https://github.com/ARMmbed/mbed-os
407,coreutils,4763,987,4763,8,07/07/2013,27/09/2025,45.60 MB,46696,upstream mirror,C,https://github.com/coreutils/coreutils
408,cute_headers,4762,289,4762,22,05/06/2016,02/09/2025,12.62 MB,12921,"Collection of cross-platform one-file C/C++ libraries with no dependencies, primarily used for games",C,https://github.com/RandyGaul/cute_headers
409,tiny-AES-c,4706,1360,4706,32,24/05/2012,04/10/2024,178.00 KB,178,Small portable AES128/192/256 in C,C,https://github.com/kokke/tiny-AES-c
410,bytehound,4702,198,4702,52,16/05/2019,28/07/2023,16.23 MB,16615,A memory profiler for Linux.,C,https://github.com/koute/bytehound
411,u-boot,4680,4094,4680,221,12/11/2014,27/09/2025,300.79 MB,308014,"""Das U-Boot"" Source Tree",C,https://github.com/u-boot/u-boot
412,RxFFmpeg,4679,775,4679,198,10/10/2018,11/04/2023,416.25 MB,426244,🔥💥RxFFmpeg 是基于 ( FFmpeg 4.0 + X264 + mp3lame + fdk-aac + opencore-amr + openssl ) 编译的适用于 Android 平台的音视频编辑、视频剪辑的快速处理框架，包含以下功能：视频拼接，转码，压缩，裁剪，片头片尾，分离音视频，变速，添加静态贴纸和gif动态贴纸，添加字幕，添加滤镜，添加背景音乐，加速减速视频，倒放音视频，音频裁剪，变声，混音，图片合成视频，视频解码图片，抖音首页，视频播放器及支持 OpenSSL https 等主流特色功能,C,https://github.com/microshow/RxFFmpeg
413,bubblewrap,4672,257,4672,162,16/02/2016,04/08/2025,902.00 KB,902,Low-level unprivileged sandboxing tool used by Flatpak and similar projects,C,https://github.com/containers/bubblewrap
414,cmatrix,4662,478,4662,73,31/10/2013,21/08/2024,364.00 KB,364,"Terminal based ""The Matrix"" like implementation",C,https://github.com/abishekvashok/cmatrix
415,tcpcopy,4660,1035,4660,0,14/10/2011,18/06/2025,8.59 MB,8798,"An online request replication and TCP stream replay tool, ideal for real testing, performance testing, stability testing, stress testing, load testing, smoke testing, and more.",C,https://github.com/session-replay-tools/tcpcopy
416,Atlas,4651,1146,4651,176,18/12/2013,04/01/2019,2.23 MB,2284,"A high-performance and stable proxy for MySQL, it is developed by Qihoo's DBA and infrastructure team",C,https://github.com/Qihoo360/Atlas
417,s2n-tls,4632,740,4632,330,27/06/2014,26/09/2025,36.55 MB,37424,An implementation of the TLS/SSL protocols,C,https://github.com/aws/s2n-tls
418,AliOS-Things,4625,1150,4625,72,30/08/2017,04/07/2023,1.72 GB,1803784,面向IoT领域的、高可伸缩的物联网操作系统，可去官网了解更多信息https://www.aliyun.com/product/aliosthings,C,https://github.com/alibaba/AliOS-Things
419,wuffs,4624,141,4624,31,13/11/2017,19/07/2025,36.14 MB,37007,Wrangling Untrusted File Formats Safely,C,https://github.com/google/wuffs
420,streem,4607,235,4607,24,11/12/2014,03/01/2022,841.00 KB,841,prototype of stream based programming language,C,https://github.com/matz/streem
421,flatpak,4600,444,4600,1048,19/05/2016,25/09/2025,48.15 MB,49310,Linux application sandboxing and distribution framework,C,https://github.com/flatpak/flatpak
422,3proxy,4599,857,4599,112,08/04/2014,13/08/2025,2.27 MB,2320,3proxy - tiny free proxy server,C,https://github.com/3proxy/3proxy
