Ranking,Project Name,Stars,Forks,Watchers,Open Issues,Created At,Last Commit,Size,Size (KB),Description,Language,Repo URL
568,psycopg2,3550,521,3550,24,21/01/2013,02/09/2025,8.78 MB,8992,PostgreSQL database adapter for the Python programming language,C,https://github.com/psycopg/psycopg2
569,src,3549,909,3549,0,30/08/2016,28/09/2025,1.49 GB,1563231,Read-only git conversion of OpenBSD's official CVS src repository. Pull requests not accepted - send diffs to the tech@ mailing list.,C,https://github.com/openbsd/src
570,FreeRTOS-Kernel,3543,1356,3543,36,09/09/2019,17/09/2025,121.76 MB,124681,"FreeRTOS kernel files only, submoduled into https://github.com/FreeRTOS/FreeRTOS and various other repos.",C,https://github.com/FreeRTOS/FreeRTOS-Kernel
571,retro,3533,536,3533,60,07/02/2018,22/02/2024,220.02 MB,225303,Retro Games in Gym,C,https://github.com/openai/retro
572,aubio,3527,394,3527,177,04/12/2009,12/05/2025,11.54 MB,11814,a library for audio and music analysis,C,https://github.com/aubio/aubio
573,pgbouncer,3522,516,3522,239,04/05/2010,19/09/2025,3.91 MB,4007,lightweight connection pooler for PostgreSQL,C,https://github.com/pgbouncer/pgbouncer
574,uwsgi,3520,697,3520,871,09/10/2011,21/09/2025,30.12 MB,30841,uWSGI application server container,C,https://github.com/unbit/uwsgi
575,litex,3519,646,3519,354,07/11/2015,26/09/2025,17.51 MB,17934,"Build your hardware, easily!",C,https://github.com/enjoy-digital/litex
576,c-algorithms,3518,740,3518,9,23/06/2010,17/04/2025,808.00 KB,808,A library of common data structures and algorithms written in C.,C,https://github.com/fragglet/c-algorithms
577,guacamole-server,3517,706,3517,53,22/03/2016,26/09/2025,8.49 MB,8693,Mirror of Apache Guacamole Server,C,https://github.com/apache/guacamole-server
578,redsocks,3515,882,3515,77,18/08/2008,29/06/2024,782.00 KB,782,transparent TCP-to-proxy redirector,C,https://github.com/darkk/redsocks
579,neomutt,3509,324,3509,244,21/12/2015,27/09/2025,173.20 MB,177353,✉️ Teaching an Old Dog New Tricks -- IRC: #neomutt on irc.libera.chat,C,https://github.com/neomutt/neomutt
580,openssh-portable,3509,1938,3509,127,17/01/2014,27/09/2025,30.82 MB,31556,Portable OpenSSH,C,https://github.com/openssh/openssh-portable
581,pico-examples,3506,958,3506,151,20/01/2021,04/09/2025,9.25 MB,9468,,C,https://github.com/raspberrypi/pico-examples
582,nuttx,3494,1482,3494,678,14/12/2019,28/09/2025,329.46 MB,337368,"Apache NuttX is a mature, real-time embedded operating system (RTOS)",C,https://github.com/apache/nuttx
583,surge,3487,427,3487,237,20/09/2018,27/09/2025,429.06 MB,439356,Synthesizer plug-in (previously released as Vember Audio Surge),C,https://github.com/surge-synthesizer/surge
584,premake-core,3483,636,3483,288,21/03/2015,26/09/2025,37.57 MB,38471,Premake,C,https://github.com/premake/premake-core
585,HyperDbg,3483,437,3483,11,01/01/2020,07/09/2025,44.81 MB,45885,State-of-the-art native debugging tools,C,https://github.com/HyperDbg/HyperDbg
586,pg_cron,3482,229,3482,124,04/09/2016,04/09/2025,352.00 KB,352,Run periodic jobs in PostgreSQL,C,https://github.com/citusdata/pg_cron
587,dSYMTools,3479,878,3479,1,26/06/2014,04/06/2024,27.20 MB,27851,dSYM analyze,C,https://github.com/answer-huang/dSYMTools
588,ESP8266_RTOS_SDK,3477,1601,3477,477,05/12/2014,09/05/2025,65.66 MB,67231,"Latest ESP8266 SDK based on FreeRTOS, esp-idf style.",C,https://github.com/espressif/ESP8266_RTOS_SDK
589,libffi,3472,755,3472,198,29/09/2009,22/08/2025,8.35 MB,8551,A portable foreign-function interface library.,C,https://github.com/libffi/libffi
590,yyjson,3466,296,3466,22,08/10/2020,13/09/2025,4.26 MB,4366,The fastest JSON library in C,C,https://github.com/ibireme/yyjson
591,pwru,3465,206,3465,37,12/10/2021,26/09/2025,9.52 MB,9752,"Packet, where are you? -- eBPF-based Linux kernel networking debugger",C,https://github.com/cilium/pwru
592,pthreads,3458,502,3458,54,28/08/2012,09/11/2019,2.56 MB,2622,"Threading for PHP - Share Nothing, Do Everything :)",C,https://github.com/krakjoe/pthreads
593,small-video-record,3458,728,3458,199,25/08/2016,13/06/2020,88.71 MB,90844,利用FFmpeg视频录制微信小视频与其压缩处理,C,https://github.com/mabeijianxi/small-video-record
594,krackattacks-scripts,3443,773,3443,5,18/10/2017,25/12/2024,17.27 MB,17682,,C,https://github.com/vanhoefm/krackattacks-scripts
595,xemu,3439,345,3439,839,18/02/2020,25/09/2025,562.47 MB,575972,"Original Xbox Emulator for Windows, macOS, and Linux (Active Development)",C,https://github.com/xemu-project/xemu
596,Racer,3438,458,3438,21,15/10/2024,02/07/2025,3.85 MB,3946,,C,https://github.com/StuckAtPrototype/Racer
597,massdns,3437,493,3437,15,23/06/2016,21/07/2025,868.00 KB,868,A high-performance DNS stub resolver for bulk lookups and reconnaissance (subdomain enumeration),C,https://github.com/blechschmidt/massdns
598,lk,3436,708,3436,105,27/12/2011,24/09/2025,27.73 MB,28392,LK embedded kernel,C,https://github.com/littlekernel/lk
599,geany,3421,634,3421,1168,07/10/2011,10/09/2025,73.83 MB,75606,A fast and lightweight IDE,C,https://github.com/geany/geany
600,PufferLib,3421,250,3421,83,17/09/2022,26/09/2025,308.58 MB,315989,Simplifying reinforcement learning for complex game environments,C,https://github.com/PufferAI/PufferLib
601,OBS,3418,851,3418,41,13/09/2012,01/08/2020,48.95 MB,50128,Open Broadcaster Software (Deprecated: See OBS Studio repository instead),C,https://github.com/jp9000/OBS
602,criu,3409,664,3409,260,17/01/2014,26/09/2025,21.33 MB,21839,Checkpoint/Restore tool,C,https://github.com/checkpoint-restore/criu
603,libopencm3,3404,1090,3404,262,18/04/2012,22/09/2025,6.78 MB,6942,Open source ARM Cortex-M microcontroller library,C,https://github.com/libopencm3/libopencm3
604,PSBits,3404,551,3404,0,29/06/2019,11/08/2025,15.10 MB,15465,Simple (relatively) things allowing you to dig a bit deeper than usual.,C,https://github.com/gtworek/PSBits
605,nginx-module-vts,3386,482,3386,43,13/02/2015,18/07/2025,1.11 MB,1138,Nginx virtual host traffic status module,C,https://github.com/vozlt/nginx-module-vts
606,emojicode,3381,166,3381,21,31/12/2015,07/08/2023,27.37 MB,28024,😀😜🔂 World’s only programming language that’s bursting with emojis,C,https://github.com/emojicode/emojicode
607,odyssey,3379,184,3379,147,28/05/2018,25/09/2025,20.05 MB,20536,Scalable PostgreSQL connection pooler,C,https://github.com/yandex/odyssey
608,QuickJS,3375,302,3375,10,12/07/2019,28/04/2025,3.13 MB,3209,QuickJS是一个小型并且可嵌入的Javascript引擎，它支持ES2020规范，包括模块，异步生成器和代理器。,C,https://github.com/quickjs-zh/QuickJS
609,liburing,3367,474,3367,55,05/08/2019,22/09/2025,3.83 MB,3922,Library providing helpers for the Linux kernel io_uring support,C,https://github.com/axboe/liburing
610,bareiron,3363,161,3363,31,12/08/2025,28/09/2025,197.00 KB,197,Minimalist Minecraft server for memory-restrictive embedded systems,C,https://github.com/p2r3/bareiron
611,proxmark3,3359,935,3359,65,16/03/2014,03/02/2024,25.91 MB,26532,Proxmark 3,C,https://github.com/Proxmark/proxmark3
612,spdk,3356,1271,3356,217,13/07/2015,26/09/2025,277.84 MB,284508,Storage Performance Development Kit,C,https://github.com/spdk/spdk
613,media-server,3355,1125,3355,105,03/01/2014,28/09/2025,3.93 MB,4020,RTSP/RTP/RTMP/FLV/HLS/MPEG-TS/MPEG-PS/MPEG-DASH/MP4/fMP4/MKV/WebM,C,https://github.com/ireader/media-server
614,ngx_http_google_filter_module,3345,767,3345,39,16/12/2014,26/09/2023,84.00 KB,84,Nginx Module for Google Mirror,C,https://github.com/cuber/ngx_http_google_filter_module
615,rt-n56u,3334,3672,3334,308,27/10/2017,13/06/2024,1.10 GB,1152084,Padavan,C,https://github.com/hanwckf/rt-n56u
616,NetHack,3333,510,3333,149,08/12/2015,26/09/2025,156.20 MB,159947,Official NetHack Git Repository,C,https://github.com/NetHack/NetHack
617,warpd,3329,166,3329,92,22/09/2019,12/07/2024,10.84 MB,11102,A modal keyboard-driven virtual pointer,C,https://github.com/rvaiya/warpd
618,uftrace,3326,524,3326,420,11/02/2014,28/09/2025,8.39 MB,8590,Function graph tracer for C/C++/Rust/Python,C,https://github.com/namhyung/uftrace
619,npcap,3317,561,3317,244,19/05/2015,26/09/2025,12.75 MB,13057,Nmap Project's Windows packet capture and transmission library,C,https://github.com/nmap/npcap
620,nut,3314,395,3314,891,10/02/2013,23/09/2025,90.93 MB,93111,"The Network UPS Tools repository. UPS management protocol Informational RFC 9271 published by IETF at https://www.rfc-editor.org/info/rfc9271 Please star NUT on GitHub, this helps with sponsorships!",C,https://github.com/networkupstools/nut
621,slurm,3311,734,3311,4,20/06/2011,27/09/2025,330.04 MB,337965,Slurm: A Highly Scalable Workload Manager,C,https://github.com/SchedMD/slurm
622,collectd,3311,1252,3311,769,18/01/2012,01/09/2025,28.02 MB,28693,The system statistics collection daemon. Please send Pull Requests here!,C,https://github.com/collectd/collectd
623,ebpf-for-windows,3309,266,3309,269,08/04/2021,27/09/2025,38.99 MB,39929,eBPF implementation that runs on top of Windows,C,https://github.com/microsoft/ebpf-for-windows
624,bdwgc,3309,426,3309,180,26/07/2011,17/09/2025,30.29 MB,31019,"The Boehm-Demers-Weiser conservative C/C++ Garbage Collector (bdwgc, also known as bdw-gc, boehm-gc, libgc)",C,https://github.com/bdwgc/bdwgc
625,libarchive,3309,832,3309,520,19/01/2012,27/09/2025,28.59 MB,29278,Multi-format archive and compression library,C,https://github.com/libarchive/libarchive
626,haxm,3305,891,3305,154,25/07/2017,28/01/2023,1.47 MB,1508,Intel® Hardware Accelerated Execution Manager (Intel® HAXM),C,https://github.com/intel/haxm
627,minix,3295,1109,3295,119,03/10/2014,18/03/2024,190.16 MB,194720,Official MINIX sources - Automatically replicated from gerrit.minix3.org,C,https://github.com/Stichting-MINIX-Research-Foundation/minix
628,unikraft,3284,1445,3284,309,12/04/2019,16/09/2025,8.51 MB,8718,"A next-generation cloud native kernel designed to unlock best-in-class performance, security primitives and efficiency savings.",C,https://github.com/unikraft/unikraft
629,clink,3282,284,3282,165,02/01/2014,03/08/2024,5.40 MB,5526,Bash's powerful command line editing in cmd.exe,C,https://github.com/mridgers/clink
630,MPC-BE,3278,127,3278,0,30/01/2022,27/09/2025,168.46 MB,172502,MPC-BE – универсальный проигрыватель аудио и видеофайлов для операционной системы Windows.,C,https://github.com/Aleksoid1978/MPC-BE
631,trurl,3276,108,3276,1,31/03/2023,18/08/2025,399.00 KB,399,a command line tool for URL parsing and manipulation.,C,https://github.com/curl/trurl
632,tinyvm,3274,304,3274,5,08/01/2011,23/03/2019,177.00 KB,177,"TinyVM is a small, fast, lightweight virtual machine written in pure ANSI C.",C,https://github.com/jakogut/tinyvm
633,threadx,3272,876,3272,80,11/05/2020,21/09/2025,18.19 MB,18622,Eclipse ThreadX is an advanced real-time operating system (RTOS) designed specifically for deeply embedded applications.,C,https://github.com/eclipse-threadx/threadx
634,pgbackrest,3271,239,3271,56,11/11/2013,26/09/2025,56.42 MB,57769,Reliable PostgreSQL Backup & Restore,C,https://github.com/pgbackrest/pgbackrest
635,Remotery,3266,283,3266,38,12/03/2014,28/08/2024,2.08 MB,2134,"Single C file, Realtime CPU/GPU Profiler with Remote Web Viewer",C,https://github.com/Celtoys/Remotery
636,libuv,3259,645,3259,64,29/03/2011,27/06/2015,23.23 MB,23784,Go to ,C,https://github.com/joyent/libuv
637,honggfuzz,3258,525,3258,27,07/05/2015,14/09/2025,187.67 MB,192174,"Security oriented software fuzzer. Supports evolutionary, feedback-driven fuzzing based on code coverage (SW and HW based)",C,https://github.com/google/honggfuzz
638,awtk,3250,784,3250,406,21/02/2018,28/09/2025,223.27 MB,228626,AWTK = Toolkit AnyWhere(a cross-platform embedded GUI),C,https://github.com/zlgopen/awtk
639,axel,3248,287,3248,80,13/08/2015,02/02/2025,1.52 MB,1560,Lightweight CLI download accelerator,C,https://github.com/axel-download-accelerator/axel
640,checkedc,3247,187,3247,74,23/02/2016,07/10/2024,4.59 MB,4699,Checked C is an extension to C that lets programmers write C code with bounds checking and improved type-safety. The goal is to let people easily make their existing C code type-safe and eliminate entire classes of errors.,C,https://github.com/checkedc/checkedc
641,jansson,3246,834,3246,125,23/04/2009,02/09/2025,1.78 MB,1821,"C library for encoding, decoding and manipulating JSON data",C,https://github.com/akheron/jansson
642,winscp,3235,368,3235,0,22/06/2016,23/09/2025,114.95 MB,117712,"WinSCP is a popular free file manager for Windows supporting SFTP, FTP, FTPS, SCP, S3, WebDAV and local-to-local file transfers. A powerful tool to enhance your productivity with a user-friendly interface and automation options like .NET assembly.",C,https://github.com/winscp/winscp
643,dosbox-x,3226,441,3226,1917,17/05/2014,22/09/2025,628.16 MB,643240,DOSBox-X fork of the DOSBox project,C,https://github.com/joncampbell123/dosbox-x
644,EasyHook,3223,675,3223,186,09/08/2015,25/01/2024,1.09 MB,1119,EasyHook - The reinvention of Windows API Hooking,C,https://github.com/EasyHook/EasyHook
645,log.c,3211,655,3211,40,12/03/2017,21/07/2024,7.00 KB,7,A simple logging library implemented in C99,C,https://github.com/rxi/log.c
646,sysstat,3205,469,3205,69,25/04/2013,03/09/2025,11.67 MB,11949,Performance monitoring tools for Linux,C,https://github.com/sysstat/sysstat
647,civetweb,3205,1004,3205,187,05/10/2013,11/09/2025,29.11 MB,29813,Embedded C/C++ web server,C,https://github.com/civetweb/civetweb
648,tvheadend,3196,945,3196,47,30/12/2010,28/09/2025,63.50 MB,65019,"Tvheadend is the leading TV streaming server for Linux with ATSC, DVB-C/C2, DVB-S/S2, DVB-T/T2, IPTV, SAT>IP and unix pipe input sources",C,https://github.com/tvheadend/tvheadend
649,icmptunnel,3192,355,3192,17,24/08/2015,12/04/2022,841.00 KB,841,Transparently tunnel your IP traffic through ICMP echo and reply packets.,C,https://github.com/DhavalKapil/icmptunnel
650,ATC_MiThermometer,3189,560,3189,184,27/08/2020,15/01/2025,2.13 MB,2183,Custom firmware for the Xiaomi Thermometer LYWSD03MMC and Telink Flasher via USB to Serial converter,C,https://github.com/atc1441/ATC_MiThermometer
651,pingfs,3186,127,3186,4,07/08/2014,05/08/2023,66.00 KB,66,Stores your data in ICMP ping packets,C,https://github.com/yarrick/pingfs
652,Main_MiSTer,3185,351,3185,124,13/06/2017,25/09/2025,48.30 MB,49455,Main MiSTer binary and Wiki,C,https://github.com/MiSTer-devel/Main_MiSTer
653,oj,3178,263,3178,12,17/02/2012,18/08/2025,5.54 MB,5677,Optimized JSON,C,https://github.com/ohler55/oj
654,gear-lib,3173,866,3173,29,07/08/2015,08/08/2024,5.64 MB,5778,"Gear-Lib, C library for IOT Embedded Multimedia and Network",C,https://github.com/gozfree/gear-lib
655,dpvs,3170,748,3170,128,10/10/2017,23/06/2025,6.77 MB,6933,DPVS is a high performance Layer-4 load balancer based on DPDK.,C,https://github.com/iqiyi/dpvs
656,audioFlux,3169,146,3169,16,16/01/2023,24/05/2024,7.28 MB,7453,"A library for audio and music analysis, feature extraction.",C,https://github.com/libAudioFlux/audioFlux
657,WiringPi,3168,1272,3168,43,29/06/2012,19/09/2025,1.21 MB,1244,The arguably fastest GPIO Library for the Raspberry Pi,C,https://github.com/WiringPi/WiringPi
658,mjpg-streamer,3168,1265,3168,156,07/06/2013,08/08/2024,3.48 MB,3562,Fork of http://sourceforge.net/projects/mjpg-streamer/,C,https://github.com/jacksonliam/mjpg-streamer
659,json-c,3166,1084,3166,20,04/12/2010,07/08/2025,4.11 MB,4210,https://github.com/json-c/json-c is the official code repository for json-c.  See the wiki for release tarballs for download.  API docs at http://json-c.github.io/json-c/,C,https://github.com/json-c/json-c
660,Kernelhub,3165,690,3165,0,09/08/2020,15/02/2023,60.34 MB,61784,":palm_tree:Linux、macOS、Windows Kernel privilege escalation vulnerability collection, with compilation environment, demo GIF map, vulnerability details, executable file  (提权漏洞合集) ",C,https://github.com/Ascotbe/Kernelhub
661,hexchat,3161,552,3161,768,11/07/2012,19/08/2024,23.75 MB,24318,GTK+ IRC client,C,https://github.com/hexchat/hexchat
662,wsltty,3159,106,3159,22,11/09/2016,02/09/2025,404.00 KB,404,Mintty as a terminal for Bash on Ubuntu on Windows / WSL,C,https://github.com/mintty/wsltty
663,gps-sdr-sim,3158,880,3158,173,15/06/2015,26/01/2025,5.50 MB,5632,Software-Defined GPS Signal Simulator,C,https://github.com/osqzss/gps-sdr-sim
664,weechat,3156,345,3156,433,03/03/2014,23/09/2025,248.44 MB,254399,The extensible chat client.,C,https://github.com/weechat/weechat
665,leetcode,3156,816,3156,3,15/06/2015,11/07/2025,573.00 KB,573,LeetCode in pure C,C,https://github.com/begeekmyfriend/leetcode
666,sl,3150,441,3150,36,04/05/2013,11/06/2024,644.00 KB,644,SL(1): Cure your bad habit of mistyping,C,https://github.com/mtoyoda/sl
667,SimpleKernel,3140,427,3140,8,07/03/2018,07/05/2025,125.08 MB,128083,Simple kernel for learning operating systems. 用于学习操作系统的简单内核,C,https://github.com/Simple-XX/SimpleKernel
668,fzy,3139,139,3139,51,12/07/2014,29/07/2025,345.00 KB,345,":mag: A simple, fast fuzzy finder for the terminal",C,https://github.com/jhawthorn/fzy
669,UVCCamera,3138,1266,3138,519,03/05/2014,14/12/2021,12.88 MB,13188,library and sample to access to UVC web camera on non-rooted Android device,C,https://github.com/saki4510t/UVCCamera
670,spksrc,3134,1268,3134,279,12/10/2011,26/09/2025,90.18 MB,92344,Cross compilation framework to create native packages for the Synology's NAS,C,https://github.com/SynoCommunity/spksrc
671,Arduino_Core_STM32,3124,1031,3124,31,10/05/2017,23/09/2025,130.17 MB,133294,STM32 core support for Arduino,C,https://github.com/stm32duino/Arduino_Core_STM32
672,gpac,3108,562,3108,43,03/05/2014,25/09/2025,145.25 MB,148741,"GPAC Ultramedia OSS for Video Streaming & Next-Gen Multimedia Transcoding, Packaging & Delivery",C,https://github.com/gpac/gpac
673,pycryptodome,3106,541,3106,79,02/05/2014,21/06/2025,40.18 MB,41144,A self-contained cryptographic library for Python,C,https://github.com/Legrandin/pycryptodome
674,eddystone,3101,750,3101,81,26/06/2015,10/12/2019,4.37 MB,4475,"Specification for Eddystone, an open beacon format from Google",C,https://github.com/google/eddystone
675,rizin,3097,419,3097,523,30/09/2020,28/09/2025,153.11 MB,156782,UNIX-like reverse engineering framework and command-line toolset.,C,https://github.com/rizinorg/rizin
676,rubinius,3085,601,3085,16,12/01/2008,11/09/2025,164.18 MB,168116,The Rubinius Language Platform,C,https://github.com/rubinius/rubinius
677,InfiniTime,3083,1022,3083,381,05/12/2019,23/09/2025,48.78 MB,49954,Firmware for Pinetime smartwatch written in C++ and based on FreeRTOS,C,https://github.com/InfiniTimeOrg/InfiniTime
678,libmill,3082,213,3082,22,29/04/2014,09/02/2021,17.09 MB,17499,Go-style concurrency in C,C,https://github.com/sustrik/libmill
679,ReflectiveDLLInjection,3077,805,3077,15,04/11/2011,03/09/2022,563.00 KB,563,Reflective DLL injection is a library injection technique in which the concept of reflective programming is employed to perform the loading of a library from memory into a host process.,C,https://github.com/stephenfewer/ReflectiveDLLInjection
680,Quake-2,3075,696,3075,3,31/01/2012,05/12/2023,693.00 KB,693,Quake 2 GPL Source Release,C,https://github.com/id-Software/Quake-2
681,PolarDB-for-PostgreSQL,3066,499,3066,34,25/05/2021,28/09/2025,742.01 MB,759822,A cloud-native database based on PostgreSQL developed by Alibaba Cloud.,C,https://github.com/ApsaraDB/PolarDB-for-PostgreSQL
682,julius,3065,359,3065,11,19/08/2017,31/07/2025,34.09 MB,34905,An open source re-implementation of Caesar III,C,https://github.com/bvschaik/julius
683,nchan,3053,293,3053,125,10/08/2009,19/08/2025,8.00 MB,8196,"Fast, horizontally scalable, multiprocess pub/sub queuing server and proxy for HTTP, long-polling, Websockets and EventSource (SSE), powered by Nginx.",C,https://github.com/slact/nchan
684,WinDiskWriter,3049,71,3049,15,26/01/2023,05/07/2025,37.62 MB,38525,🖥 Windows Bootable USB creator for macOS. 🛠 Patches Windows 11 to bypass TPM and Secure Boot requirements. 👾 UEFI & Legacy Support,C,https://github.com/TechUnRestricted/WinDiskWriter
685,level-ip,3045,411,3045,17,26/02/2016,13/12/2022,791.00 KB,791,A hacker's userspace TCP/IP stack,C,https://github.com/saminiir/level-ip
686,ProcDump-for-Linux,3042,326,3042,22,10/11/2017,26/09/2025,7.46 MB,7636,A Linux version of the ProcDump Sysinternals tool,C,https://github.com/microsoft/ProcDump-for-Linux
687,zap,3042,100,3042,22,12/01/2023,29/08/2025,11.18 MB,11452,blazingly fast backends in zig,C,https://github.com/zigzap/zap
688,nq,3040,66,3040,4,31/07/2015,03/07/2024,87.00 KB,87,Unix command line queue utility,C,https://github.com/leahneukirchen/nq
689,starrtc-server,3036,933,3036,46,08/01/2019,27/12/2019,1.20 GB,1261211,免费IM系统，IM即时通信消息系统(含一对一文字聊天，群聊，聊天室)，免费一对一voip实时通话，录屏，webrtc服务端，免费直播连麦，互动直播，视频直播，RTSP拉流，RTMP推流，语音对讲，免费在线会议，视频会议等服务端程序，支持物联网平台，✨万水千山总是情，来个star行不行✨,C,https://github.com/starrtc/starrtc-server
690,MemoryModule,3035,790,3035,56,23/10/2010,03/01/2024,259.00 KB,259,Library to load a DLL from memory.,C,https://github.com/fancycode/MemoryModule
691,VulkanMemoryAllocator,3034,393,3034,29,16/06/2017,09/09/2025,29.00 MB,29699,Easy to integrate Vulkan memory allocation library,C,https://github.com/GPUOpen-LibrariesAndSDKs/VulkanMemoryAllocator
692,bjoern,3025,189,3025,35,01/03/2010,09/08/2024,615.00 KB,615,A screamingly fast Python 2/3 WSGI server written in C.,C,https://github.com/jonashaag/bjoern
693,IdGenerator,3022,408,3022,32,13/03/2021,10/04/2025,7.71 MB,7900,💎多语言实现，高性能生成唯一数字ID。 💎优化的雪花算法（SnowFlake）——雪花漂移算法，在缩短ID长度的同时，具备极高瞬时并发处理能力（50W/0.1s）。 💎原生支持 C#/Java/Go/Rust/C/JavaScript/TypeScript/Python/Pascal 多语言，提供其它适用于其它语言的多线程安全调用动态库（FFI）。💎支持容器环境自动扩容（自动注册 WorkerId ），单机或分布式唯一IdGenerator。💎顶尖优化，超强效能。,C,https://github.com/yitter/IdGenerator
694,termux-x11,3017,422,3017,22,25/08/2019,20/09/2025,12.53 MB,12834,Termux X-server add-on.,C,https://github.com/termux/termux-x11
695,tcpdump,3017,892,3017,118,14/04/2013,26/09/2025,27.45 MB,28107,the TCPdump network dissector,C,https://github.com/the-tcpdump-group/tcpdump
696,vifm,3017,137,3017,129,21/01/2009,03/09/2025,52.57 MB,53828,"Vifm is a file manager with curses interface, which provides Vim-like environment for managing objects within file systems, extended with some useful ideas from mutt.",C,https://github.com/vifm/vifm
697,enet,3017,709,3017,96,05/05/2012,26/07/2025,418.00 KB,418,ENet reliable UDP networking library ,C,https://github.com/lsalzman/enet
698,silk-v3-decoder,3012,663,3012,5,07/02/2016,22/01/2025,75.23 MB,77038,"[Skype Silk Codec SDK]Decode silk v3 audio files (like wechat amr, aud files, qq slk files) and convert to other format (like mp3). Batch conversion support.",C,https://github.com/kn007/silk-v3-decoder
699,irssi,3011,376,3011,210,30/05/2014,26/07/2025,8.54 MB,8750,The client of the future,C,https://github.com/irssi/irssi
700,mtr,3009,358,3009,176,02/02/2013,26/09/2025,1.60 MB,1637,"Official repository for mtr, a network diagnostic tool",C,https://github.com/traviscross/mtr
701,winevdm,3007,173,3007,342,22/09/2015,28/08/2025,10.52 MB,10774,"16-bit Windows (Windows 1.x, 2.x, 3.0, 3.1, etc.) on 64-bit Windows",C,https://github.com/otya128/winevdm
702,acl,3005,945,3005,40,07/10/2012,25/09/2025,121.48 MB,124397,"C/C++ server and network library, including coroutine,redis client,http/https/websocket,mqtt, mysql/postgresql/sqlite client with C/C++ for Linux, Android, iOS, MacOS, Windows, etc..",C,https://github.com/acl-dev/acl
703,lightning,3001,955,3001,724,13/06/2015,23/09/2025,120.31 MB,123196,Core Lightning — Lightning Network implementation focusing on spec compliance and performance,C,https://github.com/ElementsProject/lightning
704,PainterEngine,2999,327,2999,5,04/06/2019,04/08/2025,71.93 MB,73652,"PainterEngine is a application/game engine with software renderer,PainterEngine can be transplanted to any platform that supports C",C,https://github.com/matrixcascade/PainterEngine
705,ShiYanLou,2998,774,2998,1,13/11/2017,17/05/2024,222.51 MB,227853,学习C & C++ & python&汇编语言 LLVM编译器 数据结构 算法 操作系统 单片机  linux  面试,C,https://github.com/Ewenwan/ShiYanLou
706,operating-system-in-1000-lines,2992,229,2992,8,26/07/2023,31/08/2025,1.54 MB,1580,"Writing an OS in 1,000 lines.",C,https://github.com/nuta/operating-system-in-1000-lines
707,columnar,2989,93,2989,30,22/07/2022,10/02/2025,4.62 MB,4734,Postgres-native columnar storage extension,C,https://github.com/hydradatabase/columnar
708,android-app,2987,396,2987,66,12/12/2019,24/09/2025,285.67 MB,292522,Official ProtonVPN Android app,C,https://github.com/ProtonVPN/android-app
709,tilck,2981,124,2981,1,14/03/2016,26/09/2025,10.53 MB,10781,A Tiny Linux-Compatible Kernel,C,https://github.com/vvaltchev/tilck
710,f3,2980,156,2980,73,14/12/2011,09/09/2025,412.00 KB,412,F3 - Fight Flash Fraud,C,https://github.com/AltraMayor/f3
711,dumpdecrypted,2978,668,2978,21,28/09/2011,26/10/2017,248.00 KB,248,Dumps decrypted mach-o files from encrypted iPhone applications from memory to disk. This tool is necessary for security researchers to be able to look under the hood of encryption.,C,https://github.com/stefanesser/dumpdecrypted
712,nanos,2977,151,2977,78,23/12/2017,07/09/2025,10.91 MB,11174,A kernel designed to run one and only one application in a virtualized environment,C,https://github.com/nanovms/nanos
713,util-linux,2975,1280,2975,401,07/09/2011,24/09/2025,260.21 MB,266457,,C,https://github.com/util-linux/util-linux
