Ranking,Project Name,Stars,Forks,Watchers,Open Issues,Created At,Last Commit,Size,Size (KB),Description,Language,Repo URL
545,inav,3656,1629,3656,318,13/03/2015,28/07/2025,390.30 MB,399669,INAV: Navigation-enabled flight control software,C,https://github.com/iNavFlight/inav
546,rpi4-osdev,3651,272,3651,2,12/07/2020,03/02/2025,9.81 MB,10048,"Tutorial: Writing a ""bare metal"" operating system for Raspberry Pi 4",C,https://github.com/babbleberry/rpi4-osdev
547,orbital,3641,267,3641,10,28/10/2017,06/04/2024,1.20 MB,1227,Experimental PlayStation 4 emulator.,C,https://github.com/AlexAltea/orbital
548,Skill-Tree,3635,1081,3635,5,28/06/2017,03/03/2020,2.32 MB,2379,ğŸ¼ å‡†å¤‡ç§‹æ‹›ï¼Œæ¬¢è¿æ¥æ ‘ä¸Šå–æœå®,C,https://github.com/linw7/Skill-Tree
549,armortools,3629,375,3629,255,06/02/2017,04/08/2025,191.66 MB,196256,3D Content Creation Tools,C,https://github.com/armory3d/armortools
550,libaco,3621,405,3621,34,30/06/2018,21/05/2022,1.37 MB,1406,A blazing fast and lightweight C asymmetric coroutine library  ğŸ’ â›…ğŸš€â›…ğŸŒ,C,https://github.com/hnes/libaco
551,sandboxie,3619,709,3619,64,14/04/2020,22/09/2022,892.00 KB,892,The Sandboxie application,C,https://github.com/sandboxie/sandboxie
552,ChinaDNS,3617,1275,3617,44,24/07/2014,03/05/2020,1.21 MB,1241,Protect yourself against DNS poisoning in China.,C,https://github.com/shadowsocks/ChinaDNS
553,ics-openvpn,3616,1253,3616,46,19/03/2015,29/07/2025,53.10 MB,54372,OpenVPN for Android,C,https://github.com/schwabe/ics-openvpn
554,box86,3597,242,3597,182,09/01/2019,28/07/2025,16.31 MB,16699,"Box86 - Linux Userspace x86 Emulator with a twist, targeted at ARM Linux devices",C,https://github.com/ptitSeb/box86
555,Nintendo_Switch_Reverse_Engineering,3596,202,3596,90,09/03/2017,14/07/2022,42.70 MB,43726,A look at inner workings of Joycon and Nintendo Switch,C,https://github.com/dekuNukem/Nintendo_Switch_Reverse_Engineering
556,openwrt,3587,1829,3587,0,12/02/2020,02/08/2025,264.00 MB,270340,Lienol's Modified OpenWrt source,C,https://github.com/Lienol/openwrt
557,flinux,3574,246,3574,49,11/07/2014,31/03/2016,1.67 MB,1708,Foreign LINUX - Run unmodified Linux applications inside Windows.,C,https://github.com/wishstudio/flinux
558,blackmagic,3563,823,3563,115,06/02/2011,04/08/2025,10.66 MB,10919,In-application debugger for ARM Cortex and RISC-V processors.,C,https://github.com/blackmagic-debug/blackmagic
559,wine,3556,1155,3556,10,07/08/2014,03/08/2025,1.05 GB,1103356,,C,https://github.com/wine-mirror/wine
560,chafa,3550,74,3550,41,24/04/2018,04/08/2025,3.80 MB,3894,ğŸ“ºğŸ—¿ Terminal graphics for the 21st century.,C,https://github.com/hpjansson/chafa
561,xdotool,3544,326,3544,317,16/02/2011,11/01/2025,1.14 MB,1164,"fake keyboard/mouse input, window management, and more ",C,https://github.com/jordansissel/xdotool
562,fwupd,3527,498,3527,82,26/02/2015,04/08/2025,61.05 MB,62517,A system daemon to allow session software to update firmware,C,https://github.com/fwupd/fwupd
563,retro,3516,534,3516,60,07/02/2018,22/02/2024,220.02 MB,225303,Retro Games in Gym,C,https://github.com/openai/retro
564,psycopg2,3513,516,3513,24,21/01/2013,01/08/2025,8.78 MB,8987,PostgreSQL database adapter for the Python programming language,C,https://github.com/psycopg/psycopg2
565,uwsgi,3512,695,3512,866,09/10/2011,03/06/2025,30.11 MB,30830,uWSGI application server container,C,https://github.com/unbit/uwsgi
566,c-algorithms,3498,738,3498,9,23/06/2010,17/04/2025,808.00 KB,808,A library of common data structures and algorithms written in C.,C,https://github.com/fragglet/c-algorithms
567,orioledb,3496,134,3496,54,28/11/2021,04/08/2025,6.19 MB,6339,OrioleDB â€“ building a modern cloud-native storage engine (... and solving some PostgreSQL wicked problems) ,C,https://github.com/orioledb/orioledb
568,crun,3493,364,3493,38,13/09/2017,31/07/2025,6.19 MB,6338,A fast and lightweight fully featured OCI runtime and C library for running containers,C,https://github.com/containers/crun
569,src,3492,900,3492,0,30/08/2016,04/08/2025,1.51 GB,1579395,Read-only git conversion of OpenBSD's official CVS src repository. Pull requests not accepted - send diffs to the tech@ mailing list.,C,https://github.com/openbsd/src
570,aubio,3482,393,3482,176,04/12/2009,12/05/2025,11.54 MB,11814,a library for audio and music analysis,C,https://github.com/aubio/aubio
571,redsocks,3480,875,3480,77,18/08/2008,29/06/2024,782.00 KB,782,transparent TCP-to-proxy redirector,C,https://github.com/darkk/redsocks
572,earlyoom,3475,181,3475,22,12/01/2014,02/11/2024,491.00 KB,491,earlyoom - Early OOM Daemon for Linux,C,https://github.com/rfjakob/earlyoom
573,dSYMTools,3474,882,3474,1,26/06/2014,04/06/2024,27.20 MB,27851,dSYM analyze,C,https://github.com/answer-huang/dSYMTools
574,neomutt,3473,321,3473,238,21/12/2015,28/07/2025,172.00 MB,176124,âœ‰ï¸ Teaching an Old Dog New Tricks -- IRC: #neomutt on irc.libera.chat,C,https://github.com/neomutt/neomutt
575,guacamole-server,3465,693,3465,47,22/03/2016,01/08/2025,8.44 MB,8644,Mirror of Apache Guacamole Server,C,https://github.com/apache/guacamole-server
576,pthreads,3462,503,3462,54,28/08/2012,09/11/2019,2.56 MB,2622,"Threading for PHP - Share Nothing, Do Everything :)",C,https://github.com/krakjoe/pthreads
577,small-video-record,3461,729,3461,199,25/08/2016,13/06/2020,88.71 MB,90844,åˆ©ç”¨FFmpegè§†é¢‘å½•åˆ¶å¾®ä¿¡å°è§†é¢‘ä¸å…¶å‹ç¼©å¤„ç†,C,https://github.com/mabeijianxi/small-video-record
578,openssh-portable,3457,1917,3457,124,17/01/2014,02/08/2025,30.10 MB,30824,Portable OpenSSH,C,https://github.com/openssh/openssh-portable
579,ESP8266_RTOS_SDK,3457,1600,3457,474,05/12/2014,09/05/2025,65.66 MB,67231,"Latest ESP8266 SDK based on FreeRTOS, esp-idf style.",C,https://github.com/espressif/ESP8266_RTOS_SDK
580,zmk,3444,3401,3444,478,08/06/2020,04/08/2025,26.43 MB,27060,ZMK Firmware Repository,C,https://github.com/zmkfirmware/zmk
581,bpf-developer-tutorial,3443,477,3443,28,02/12/2022,29/07/2025,25.79 MB,26407,eBPF Developer Tutorial: Learning eBPF Step by Step with Examples,C,https://github.com/eunomia-bpf/bpf-developer-tutorial
582,libffi,3439,749,3439,196,29/09/2009,02/08/2025,8.35 MB,8554,A portable foreign-function interface library.,C,https://github.com/libffi/libffi
583,krackattacks-scripts,3436,772,3436,5,18/10/2017,25/12/2024,17.27 MB,17682,,C,https://github.com/vanhoefm/krackattacks-scripts
584,premake-core,3436,632,3436,291,21/03/2015,14/07/2025,39.03 MB,39964,Premake,C,https://github.com/premake/premake-core
585,litex,3433,637,3433,346,07/11/2015,04/08/2025,17.42 MB,17842,"Build your hardware, easily!",C,https://github.com/enjoy-digital/litex
586,nuttx,3426,1451,3426,646,14/12/2019,04/08/2025,327.40 MB,335258,"Apache NuttX is a mature, real-time embedded operating system (RTOS)",C,https://github.com/apache/nuttx
587,surge,3422,422,3422,250,20/09/2018,28/07/2025,428.49 MB,438773,Synthesizer plug-in (previously released as Vember Audio Surge),C,https://github.com/surge-synthesizer/surge
588,OBS,3419,852,3419,41,13/09/2012,01/08/2020,48.95 MB,50128,Open Broadcaster Software (Deprecated: See OBS Studio repository instead),C,https://github.com/jp9000/OBS
589,pico-examples,3413,937,3413,137,20/01/2021,29/07/2025,8.50 MB,8699,,C,https://github.com/raspberrypi/pico-examples
590,Racer,3411,458,3411,21,15/10/2024,02/07/2025,3.85 MB,3946,,C,https://github.com/StuckAtPrototype/Racer
591,pwru,3406,199,3406,34,12/10/2021,29/07/2025,9.33 MB,9559,"Packet, where are you? -- eBPF-based Linux kernel networking debugger",C,https://github.com/cilium/pwru
592,lk,3403,694,3403,106,27/12/2011,30/07/2025,27.60 MB,28260,LK embedded kernel,C,https://github.com/littlekernel/lk
593,pg_cron,3400,224,3400,121,04/09/2016,30/06/2025,421.00 KB,421,Run periodic jobs in PostgreSQL,C,https://github.com/citusdata/pg_cron
594,pgbouncer,3399,505,3399,234,04/05/2010,01/08/2025,3.80 MB,3890,lightweight connection pooler for PostgreSQL,C,https://github.com/pgbouncer/pgbouncer
595,86Box,3395,416,3395,17,25/06/2016,04/08/2025,150.07 MB,153668,Emulator of x86-based machines.,C,https://github.com/86Box/86Box
596,FreeRTOS-Kernel,3395,1316,3395,29,09/09/2019,31/07/2025,121.69 MB,124615,"FreeRTOS kernel files only, submoduled into https://github.com/FreeRTOS/FreeRTOS and various other repos.",C,https://github.com/FreeRTOS/FreeRTOS-Kernel
597,massdns,3391,485,3391,15,23/06/2016,21/07/2025,868.00 KB,868,A high-performance DNS stub resolver for bulk lookups and reconnaissance (subdomain enumeration),C,https://github.com/blechschmidt/massdns
598,PSBits,3386,550,3386,1,29/06/2019,12/03/2025,15.12 MB,15485,Simple (relatively) things allowing you to dig a bit deeper than usual.,C,https://github.com/gtworek/PSBits
599,yyjson,3383,282,3383,22,08/10/2020,03/08/2025,3.54 MB,3625,The fastest JSON library in C,C,https://github.com/ibireme/yyjson
600,HyperDbg,3383,426,3383,13,01/01/2020,03/08/2025,44.35 MB,45414,State-of-the-art native debugging tools,C,https://github.com/HyperDbg/HyperDbg
601,emojicode,3371,166,3371,21,31/12/2015,07/08/2023,27.37 MB,28024,ğŸ˜€ğŸ˜œğŸ”‚ Worldâ€™s only programming language thatâ€™s bursting with emojis,C,https://github.com/emojicode/emojicode
602,nginx-module-vts,3368,481,3368,43,13/02/2015,18/07/2025,1.11 MB,1138,Nginx virtual host traffic status module,C,https://github.com/vozlt/nginx-module-vts
603,geany,3367,627,3367,1146,07/10/2011,20/07/2025,73.73 MB,75501,A fast and lightweight IDE,C,https://github.com/geany/geany
604,xemu,3359,337,3359,820,18/02/2020,04/08/2025,561.62 MB,575095,"Original Xbox Emulator for Windows, macOS, and Linux (Active Development)",C,https://github.com/xemu-project/xemu
605,libopencm3,3352,1087,3352,255,18/04/2012,14/07/2025,6.77 MB,6937,Open source ARM Cortex-M microcontroller library,C,https://github.com/libopencm3/libopencm3
606,odyssey,3348,181,3348,139,28/05/2018,04/08/2025,20.23 MB,20716,Scalable PostgreSQL connection pooler,C,https://github.com/yandex/odyssey
607,QuickJS,3347,305,3347,10,12/07/2019,28/04/2025,3.13 MB,3209,QuickJSæ˜¯ä¸€ä¸ªå°å‹å¹¶ä¸”å¯åµŒå…¥çš„Javascriptå¼•æ“ï¼Œå®ƒæ”¯æŒES2020è§„èŒƒï¼ŒåŒ…æ‹¬æ¨¡å—ï¼Œå¼‚æ­¥ç”Ÿæˆå™¨å’Œä»£ç†å™¨ã€‚,C,https://github.com/quickjs-zh/QuickJS
608,ngx_http_google_filter_module,3343,767,3343,39,16/12/2014,26/09/2023,84.00 KB,84,Nginx Module for Google Mirror,C,https://github.com/cuber/ngx_http_google_filter_module
609,proxmark3,3334,930,3334,64,16/03/2014,03/02/2024,25.91 MB,26532,Proxmark 3,C,https://github.com/Proxmark/proxmark3
610,rt-n56u,3332,3680,3332,307,27/10/2017,13/06/2024,1.10 GB,1152084,Padavan,C,https://github.com/hanwckf/rt-n56u
611,media-server,3324,1116,3324,105,03/01/2014,12/07/2025,3.90 MB,3998,RTSP/RTP/RTMP/FLV/HLS/MPEG-TS/MPEG-PS/MPEG-DASH/MP4/fMP4/MKV/WebM,C,https://github.com/ireader/media-server
612,criu,3323,651,3323,243,17/01/2014,29/07/2025,21.27 MB,21785,Checkpoint/Restore tool,C,https://github.com/checkpoint-restore/criu
613,minigame-unity-webgl-transform,3317,490,3317,74,24/05/2021,31/07/2025,368.66 MB,377507,Wechat Mini Game Unity engine adapter documents.,C,https://github.com/wechat-miniprogram/minigame-unity-webgl-transform
614,spdk,3301,1258,3301,204,13/07/2015,01/08/2025,275.67 MB,282291,Storage Performance Development Kit,C,https://github.com/spdk/spdk
615,haxm,3300,889,3300,154,25/07/2017,28/01/2023,1.47 MB,1508,IntelÂ® Hardware Accelerated Execution Manager (IntelÂ® HAXM),C,https://github.com/intel/haxm
616,collectd,3295,1251,3295,768,18/01/2012,22/05/2025,28.02 MB,28696,The system statistics collection daemon. Please send Pull Requests here!,C,https://github.com/collectd/collectd
617,uftrace,3290,518,3290,416,11/02/2014,03/08/2025,8.42 MB,8623,Function graph tracer for C/C++/Rust/Python,C,https://github.com/namhyung/uftrace
618,liburing,3285,466,3285,43,05/08/2019,02/08/2025,3.78 MB,3875,Library providing helpers for the Linux kernel io_uring support,C,https://github.com/axboe/liburing
619,NetHack,3282,505,3282,152,08/12/2015,30/07/2025,158.58 MB,162381,Official NetHack Git Repository,C,https://github.com/NetHack/NetHack
620,bdwgc,3282,426,3282,179,26/07/2011,30/07/2025,29.95 MB,30664,"The Boehm-Demers-Weiser conservative C/C++ Garbage Collector (bdwgc, also known as bdw-gc, boehm-gc, libgc)",C,https://github.com/bdwgc/bdwgc
621,xserver,3278,175,3278,123,01/02/2025,04/08/2025,54.05 MB,55351,XLibre Xserver,C,https://github.com/X11Libre/xserver
622,clink,3276,282,3276,165,02/01/2014,03/08/2024,5.40 MB,5526,Bash's powerful command line editing in cmd.exe,C,https://github.com/mridgers/clink
623,npcap,3274,561,3274,239,19/05/2015,01/08/2025,12.80 MB,13112,Nmap Project's Windows packet capture and transmission library,C,https://github.com/nmap/npcap
624,ebpf-for-windows,3270,255,3270,286,08/04/2021,02/08/2025,37.87 MB,38783,eBPF implementation that runs on top of Windows,C,https://github.com/microsoft/ebpf-for-windows
625,warpd,3268,162,3268,90,22/09/2019,12/07/2024,10.84 MB,11102,A modal keyboard-driven virtual pointer,C,https://github.com/rvaiya/warpd
626,tinyvm,3265,305,3265,5,08/01/2011,23/03/2019,177.00 KB,177,"TinyVM is a small, fast, lightweight virtual machine written in pure ANSI C.",C,https://github.com/jakogut/tinyvm
627,trurl,3263,107,3263,3,31/03/2023,16/05/2025,400.00 KB,400,a command line tool for URL parsing and manipulation.,C,https://github.com/curl/trurl
628,libarchive,3262,825,3262,519,19/01/2012,02/08/2025,28.59 MB,29275,Multi-format archive and compression library,C,https://github.com/libarchive/libarchive
629,Bruce,3262,600,3262,148,02/05/2024,04/08/2025,5.41 GB,5675823,Predatory ESP32 Firmware,C,https://github.com/pr3y/Bruce
630,libuv,3261,646,3261,64,29/03/2011,27/06/2015,23.23 MB,23784,Go to ,C,https://github.com/joyent/libuv
631,Remotery,3249,282,3249,38,12/03/2014,28/08/2024,2.08 MB,2134,"Single C file, Realtime CPU/GPU Profiler with Remote Web Viewer",C,https://github.com/Celtoys/Remotery
632,minix,3249,1099,3249,118,03/10/2014,18/03/2024,190.16 MB,194720,Official MINIX sources - Automatically replicated from gerrit.minix3.org,C,https://github.com/Stichting-MINIX-Research-Foundation/minix
633,checkedc,3244,186,3244,73,23/02/2016,07/10/2024,4.59 MB,4699,Checked C is an extension to C that lets programmers write C code with bounds checking and improved type-safety. The goal is to let people easily make their existing C code type-safe and eliminate entire classes of errors.,C,https://github.com/checkedc/checkedc
634,threadx,3238,867,3238,74,11/05/2020,29/07/2025,18.17 MB,18603,Eclipse ThreadX is an advanced real-time operating system (RTOS) designed specifically for deeply embedded applications.,C,https://github.com/eclipse-threadx/threadx
635,honggfuzz,3222,518,3222,27,07/05/2015,19/05/2025,187.69 MB,192195,"Security oriented software fuzzer. Supports evolutionary, feedback-driven fuzzing based on code coverage (SW and HW based)",C,https://github.com/google/honggfuzz
636,jansson,3221,834,3221,124,23/04/2009,24/07/2025,1.78 MB,1819,"C library for encoding, decoding and manipulating JSON data",C,https://github.com/akheron/jansson
637,awtk,3210,780,3210,404,21/02/2018,04/08/2025,223.34 MB,228704,AWTK = Toolkit AnyWhere(a cross-platform embedded GUI),C,https://github.com/zlgopen/awtk
638,unikraft,3207,1447,3207,327,12/04/2019,31/07/2025,8.21 MB,8411,"A next-generation cloud native kernel designed to unlock best-in-class performance, security primitives and efficiency savings.",C,https://github.com/unikraft/unikraft
639,EasyHook,3202,672,3202,186,09/08/2015,25/01/2024,1.09 MB,1119,EasyHook - The reinvention of Windows API Hooking,C,https://github.com/EasyHook/EasyHook
640,axel,3200,280,3200,81,13/08/2015,02/02/2025,1.52 MB,1560,Lightweight CLI download accelerator,C,https://github.com/axel-download-accelerator/axel
641,slurm,3194,723,3194,4,20/06/2011,03/08/2025,327.97 MB,335845,Slurm: A Highly Scalable Workload Manager,C,https://github.com/SchedMD/slurm
642,oj,3177,263,3177,8,17/02/2012,02/06/2025,5.48 MB,5612,Optimized JSON,C,https://github.com/ohler55/oj
643,sysstat,3175,466,3175,71,25/04/2013,04/08/2025,11.58 MB,11859,Performance monitoring tools for Linux,C,https://github.com/sysstat/sysstat
644,pingfs,3174,128,3174,4,07/08/2014,05/08/2023,66.00 KB,66,Stores your data in ICMP ping packets,C,https://github.com/yarrick/pingfs
645,gear-lib,3174,867,3174,29,07/08/2015,08/08/2024,5.64 MB,5778,"Gear-Lib, C library for IOT Embedded Multimedia and Network",C,https://github.com/gozfree/gear-lib
646,icmptunnel,3174,357,3174,17,24/08/2015,12/04/2022,841.00 KB,841,Transparently tunnel your IP traffic through ICMP echo and reply packets.,C,https://github.com/DhavalKapil/icmptunnel
647,Main_MiSTer,3171,345,3171,118,13/06/2017,04/08/2025,48.07 MB,49219,Main MiSTer binary and Wiki,C,https://github.com/MiSTer-devel/Main_MiSTer
648,dosbox-x,3160,426,3160,1879,17/05/2014,01/08/2025,627.31 MB,642363,DOSBox-X fork of the DOSBox project,C,https://github.com/joncampbell123/dosbox-x
649,winscp,3159,361,3159,0,22/06/2016,02/08/2025,113.36 MB,116078,"WinSCP is a popular free file manager for Windows supporting SFTP, FTP, FTPS, SCP, S3, WebDAV and local-to-local file transfers. A powerful tool to enhance your productivity with a user-friendly interface and automation options like .NET assembly.",C,https://github.com/winscp/winscp
650,civetweb,3158,999,3158,191,05/10/2013,25/05/2025,27.30 MB,27952,Embedded C/C++ web server,C,https://github.com/civetweb/civetweb
651,wsltty,3156,106,3156,29,11/09/2016,29/03/2025,345.00 KB,345,Mintty as a terminal for Bash on Ubuntu on Windows / WSL,C,https://github.com/mintty/wsltty
652,dpvs,3155,746,3155,123,10/10/2017,23/06/2025,6.77 MB,6933,DPVS is a high performance Layer-4 load balancer based on DPDK.,C,https://github.com/iqiyi/dpvs
653,mjpg-streamer,3155,1260,3155,154,07/06/2013,08/08/2024,3.48 MB,3562,Fork of http://sourceforge.net/projects/mjpg-streamer/,C,https://github.com/jacksonliam/mjpg-streamer
654,ATC_MiThermometer,3153,541,3153,183,27/08/2020,15/01/2025,2.13 MB,2183,Custom firmware for the Xiaomi Thermometer LYWSD03MMC and Telink Flasher via USB to Serial converter,C,https://github.com/atc1441/ATC_MiThermometer
655,leetcode,3149,815,3149,3,15/06/2015,11/07/2025,573.00 KB,573,LeetCode in pure C,C,https://github.com/begeekmyfriend/leetcode
656,json-c,3146,1082,3146,19,04/12/2010,09/07/2025,4.11 MB,4206,https://github.com/json-c/json-c is the official code repository for json-c.  See the wiki for release tarballs for download.  API docs at http://json-c.github.io/json-c/,C,https://github.com/json-c/json-c
657,hexchat,3145,542,3145,768,11/07/2012,19/08/2024,23.75 MB,24318,GTK+ IRC client,C,https://github.com/hexchat/hexchat
658,pgbackrest,3144,237,3144,51,11/11/2013,21/07/2025,56.70 MB,58057,Reliable PostgreSQL Backup & Restore,C,https://github.com/pgbackrest/pgbackrest
659,nut,3142,392,3142,873,10/02/2013,02/08/2025,91.33 MB,93519,"The Network UPS Tools repository. UPS management protocol Informational RFC 9271 published by IETF at https://www.rfc-editor.org/info/rfc9271 Please star NUT on GitHub, this helps with sponsorships!",C,https://github.com/networkupstools/nut
660,SimpleKernel,3137,426,3137,8,07/03/2018,07/05/2025,125.08 MB,128083,Simple kernel for learning operating systems. ç”¨äºå­¦ä¹ æ“ä½œç³»ç»Ÿçš„ç®€å•å†…æ ¸,C,https://github.com/Simple-XX/SimpleKernel
661,UVCCamera,3128,1258,3128,517,03/05/2014,14/12/2021,12.88 MB,13188,library and sample to access to UVC web camera on non-rooted Android device,C,https://github.com/saki4510t/UVCCamera
662,audioFlux,3126,143,3126,15,16/01/2023,24/05/2024,7.28 MB,7453,"A library for audio and music analysis, feature extraction.",C,https://github.com/libAudioFlux/audioFlux
663,sl,3124,443,3124,36,04/05/2013,11/06/2024,644.00 KB,644,SL(1): Cure your bad habit of mistyping,C,https://github.com/mtoyoda/sl
664,weechat,3123,342,3123,430,03/03/2014,19/07/2025,247.03 MB,252963,The extensible chat client.,C,https://github.com/weechat/weechat
665,spksrc,3120,1258,3120,285,12/10/2011,04/08/2025,90.01 MB,92171,Cross compilation framework to create native packages for the Synology's NAS,C,https://github.com/SynoCommunity/spksrc
666,tvheadend,3117,932,3117,33,30/12/2010,27/07/2025,62.82 MB,64323,"Tvheadend is the leading TV streaming server for Linux with ATSC, DVB-C/C2, DVB-S/S2, DVB-T/T2, IPTV, SAT>IP and unix pipe input sources",C,https://github.com/tvheadend/tvheadend
667,MPC-BE,3116,119,3116,0,30/01/2022,03/08/2025,164.21 MB,168146,MPC-BE â€“ ÑƒĞ½Ğ¸Ğ²ĞµÑ€ÑĞ°Ğ»ÑŒĞ½Ñ‹Ğ¹ Ğ¿Ñ€Ğ¾Ğ¸Ğ³Ñ€Ñ‹Ğ²Ğ°Ñ‚ĞµĞ»ÑŒ Ğ°ÑƒĞ´Ğ¸Ğ¾ Ğ¸ Ğ²Ğ¸Ğ´ĞµĞ¾Ñ„Ğ°Ğ¹Ğ»Ğ¾Ğ² Ğ´Ğ»Ñ Ğ¾Ğ¿ĞµÑ€Ğ°Ñ†Ğ¸Ğ¾Ğ½Ğ½Ğ¾Ğ¹ ÑĞ¸ÑÑ‚ĞµĞ¼Ñ‹ Windows.,C,https://github.com/Aleksoid1978/MPC-BE
668,Kernelhub,3115,685,3115,0,09/08/2020,15/02/2023,60.34 MB,61784,":palm_tree:Linuxã€macOSã€Windows Kernel privilege escalation vulnerability collection, with compilation environment, demo GIF map, vulnerability details, executable file  (ææƒæ¼æ´åˆé›†) ",C,https://github.com/Ascotbe/Kernelhub
669,WiringPi,3107,1269,3107,42,29/06/2012,13/06/2025,1.32 MB,1349,The arguably fastest GPIO Library for the Raspberry Pi,C,https://github.com/WiringPi/WiringPi
670,fzy,3103,136,3103,48,12/07/2014,29/07/2025,345.00 KB,345,":mag: A simple, fast fuzzy finder for the terminal",C,https://github.com/jhawthorn/fzy
671,gps-sdr-sim,3101,859,3101,173,15/06/2015,26/01/2025,5.50 MB,5632,Software-Defined GPS Signal Simulator,C,https://github.com/osqzss/gps-sdr-sim
672,eddystone,3098,755,3098,81,26/06/2015,10/12/2019,4.37 MB,4475,"Specification for Eddystone, an open beacon format from Google",C,https://github.com/google/eddystone
673,PufferLib,3092,201,3092,65,17/09/2022,04/08/2025,307.88 MB,315264,Simplifying reinforcement learning for complex game environments,C,https://github.com/PufferAI/PufferLib
674,Arduino_Core_STM32,3085,1022,3085,28,10/05/2017,30/07/2025,129.30 MB,132401,STM32 core support for Arduino,C,https://github.com/stm32duino/Arduino_Core_STM32
675,rubinius,3084,601,3084,15,12/01/2008,09/05/2023,164.13 MB,168069,The Rubinius Language Platform,C,https://github.com/rubinius/rubinius
676,log.c,3078,639,3078,39,12/03/2017,21/07/2024,7.00 KB,7,A simple logging library implemented in C99,C,https://github.com/rxi/log.c
677,pycryptodome,3070,538,3070,76,02/05/2014,21/06/2025,40.18 MB,41144,A self-contained cryptographic library for Python,C,https://github.com/Legrandin/pycryptodome
678,libmill,3069,212,3069,22,29/04/2014,09/02/2021,17.09 MB,17499,Go-style concurrency in C,C,https://github.com/sustrik/libmill
679,gpac,3062,559,3062,46,03/05/2014,01/08/2025,150.55 MB,154164,"GPAC Ultramedia OSS for Video Streaming & Next-Gen Multimedia Transcoding, Packaging & Delivery",C,https://github.com/gpac/gpac
680,InfiniTime,3051,1015,3051,384,05/12/2019,20/07/2025,48.77 MB,49945,Firmware for Pinetime smartwatch written in C++ and based on FreeRTOS,C,https://github.com/InfiniTimeOrg/InfiniTime
681,nchan,3050,291,3050,122,10/08/2009,20/09/2024,7.96 MB,8155,"Fast, horizontally scalable, multiprocess pub/sub queuing server and proxy for HTTP, long-polling, Websockets and EventSource (SSE), powered by Nginx.",C,https://github.com/slact/nchan
682,ProcDump-for-Linux,3033,323,3033,27,10/11/2017,30/06/2025,7.73 MB,7912,A Linux version of the ProcDump Sysinternals tool,C,https://github.com/microsoft/ProcDump-for-Linux
683,Quake-2,3029,693,3029,4,31/01/2012,05/12/2023,693.00 KB,693,Quake 2 GPL Source Release,C,https://github.com/id-Software/Quake-2
684,starrtc-server,3029,932,3029,46,08/01/2019,27/12/2019,1.20 GB,1261211,å…è´¹IMç³»ç»Ÿï¼ŒIMå³æ—¶é€šä¿¡æ¶ˆæ¯ç³»ç»Ÿ(å«ä¸€å¯¹ä¸€æ–‡å­—èŠå¤©ï¼Œç¾¤èŠï¼ŒèŠå¤©å®¤)ï¼Œå…è´¹ä¸€å¯¹ä¸€voipå®æ—¶é€šè¯ï¼Œå½•å±ï¼ŒwebrtcæœåŠ¡ç«¯ï¼Œå…è´¹ç›´æ’­è¿éº¦ï¼Œäº’åŠ¨ç›´æ’­ï¼Œè§†é¢‘ç›´æ’­ï¼ŒRTSPæ‹‰æµï¼ŒRTMPæ¨æµï¼Œè¯­éŸ³å¯¹è®²ï¼Œå…è´¹åœ¨çº¿ä¼šè®®ï¼Œè§†é¢‘ä¼šè®®ç­‰æœåŠ¡ç«¯ç¨‹åºï¼Œæ”¯æŒç‰©è”ç½‘å¹³å°ï¼Œâœ¨ä¸‡æ°´åƒå±±æ€»æ˜¯æƒ…ï¼Œæ¥ä¸ªstarè¡Œä¸è¡Œâœ¨,C,https://github.com/starrtc/starrtc-server
685,PolarDB-for-PostgreSQL,3027,495,3027,35,25/05/2021,04/08/2025,731.11 MB,748659,A cloud-native database based on PostgreSQL developed by Alibaba Cloud.,C,https://github.com/ApsaraDB/PolarDB-for-PostgreSQL
686,nq,3025,65,3025,4,31/07/2015,03/07/2024,87.00 KB,87,Unix command line queue utility,C,https://github.com/leahneukirchen/nq
687,bjoern,3024,190,3024,35,01/03/2010,09/08/2024,615.00 KB,615,A screamingly fast Python 2/3 WSGI server written in C.,C,https://github.com/jonashaag/bjoern
688,level-ip,3018,409,3018,17,26/02/2016,13/12/2022,791.00 KB,791,A hacker's userspace TCP/IP stack,C,https://github.com/saminiir/level-ip
689,ReflectiveDLLInjection,3013,802,3013,15,04/11/2011,03/09/2022,563.00 KB,563,Reflective DLL injection is a library injection technique in which the concept of reflective programming is employed to perform the loading of a library from memory into a host process.,C,https://github.com/stephenfewer/ReflectiveDLLInjection
690,rizin,3005,410,3005,513,30/09/2020,04/08/2025,152.19 MB,155841,UNIX-like reverse engineering framework and command-line toolset.,C,https://github.com/rizinorg/rizin
691,MemoryModule,2998,786,2998,56,23/10/2010,03/01/2024,259.00 KB,259,Library to load a DLL from memory.,C,https://github.com/fancycode/MemoryModule
