Ranking,Project Name,Stars,Forks,Watchers,Open Issues,Created At,Last Commit,Size,Size (KB),Description,Language,Repo URL
714,shellinabox,2974,472,2974,226,02/03/2015,06/09/2025,4.31 MB,4410,Official-ish Fork of Shell In A Box,C,https://github.com/shellinabox/shellinabox
715,libpcap,2971,905,2971,165,14/04/2013,25/09/2025,19.42 MB,19885,the LIBpcap interface to various kernel packet capture mechanism,C,https://github.com/the-tcpdump-group/libpcap
716,ZSWatch,2959,266,2959,17,27/08/2022,27/09/2025,162.96 MB,166873,"ZSWatch - the Open Source Zephyr™ based Smartwatch, including both HW and FW.",C,https://github.com/ZSWatch/ZSWatch
717,esp-link,2945,732,2945,238,16/05/2015,18/07/2021,3.08 MB,3150,"esp8266 wifi-serial bridge, outbound TCP, and arduino/AVR/LPC/NXP programmer",C,https://github.com/jeelabs/esp-link
718,Collections-C,2945,330,2945,16,17/08/2014,27/06/2025,1.74 MB,1781,A library of generic data structures for the C language.,C,https://github.com/srdja/Collections-C
719,fftw3,2938,689,2938,173,17/03/2013,06/09/2025,11.44 MB,11714,DO NOT CHECK OUT THESE FILES FROM GITHUB UNLESS YOU KNOW WHAT YOU ARE DOING. (See below.),C,https://github.com/FFTW/fftw3
720,libfaketime,2936,348,2936,60,24/04/2011,27/09/2025,919.00 KB,919,libfaketime modifies the system time for a single application,C,https://github.com/wolfcw/libfaketime
721,muon,2932,66,2932,26,26/09/2019,15/03/2023,139.96 MB,143324,GPU based Electron on a diet,C,https://github.com/ImVexed/muon
722,webdis,2925,309,2925,66,20/12/2010,14/03/2025,1.13 MB,1156,A Redis HTTP interface with JSON output,C,https://github.com/nicolasff/webdis
723,raspi3-tutorial,2925,349,2925,5,04/01/2018,21/06/2024,535.00 KB,535,Bare metal Raspberry Pi 3 tutorials,C,https://github.com/bztsrc/raspi3-tutorial
724,esp-homekit-devices,2917,369,2917,2,26/01/2018,08/06/2025,24.40 MB,24987,"Advanced firmware to add native Apple HomeKit and custom configurations, compatible with any SoC based on ESP32, ESP32-S, ESP32-C and ESP8266 series. (Shelly, Sonoff, Electrodragon, Tuya...)",C,https://github.com/RavenSystem/esp-homekit-devices
725,dynamorio,2908,595,2908,1762,27/11/2014,27/09/2025,125.03 MB,128032,Dynamic Instrumentation Tool Platform,C,https://github.com/DynamoRIO/dynamorio
726,WinDivert,2902,555,2902,52,19/08/2011,15/03/2023,1.28 MB,1309,WinDivert: Windows Packet Divert,C,https://github.com/basil00/WinDivert
727,nginx-http-flv-module,2899,582,2899,21,25/06/2017,22/09/2025,3.85 MB,3939,"A media streaming server based on nginx-rtmp-module. In addtion to the features nginx-rtmp-module provides, HTTP-FLV, GOP cache, VHosts (one IP for multi domain names) and JSON style statistics are supported now.",C,https://github.com/winshining/nginx-http-flv-module
728,open62541,2898,1348,2898,843,20/12/2013,25/09/2025,62.71 MB,64219,Open source implementation of OPC UA (OPC Unified Architecture) aka IEC 62541 licensed under Mozilla Public License v2.0,C,https://github.com/open62541/open62541
729,p2pvc,2897,212,2897,14,07/02/2015,01/11/2023,12.51 MB,12810,A point to point color terminal video chat.,C,https://github.com/mofarrell/p2pvc
730,Espruino,2895,761,2895,124,26/09/2013,26/09/2025,227.11 MB,232563,The Espruino JavaScript interpreter - Official Repo,C,https://github.com/espruino/Espruino
731,Catime,2890,116,2890,125,28/01/2025,24/09/2025,84.86 MB,86898,A very useful timer (🍅Pomodoro Clock),C,https://github.com/vladelaina/Catime
732,neuralcoref,2885,475,2885,65,03/07/2017,13/04/2023,67.83 MB,69454,✨Fast Coreference Resolution in spaCy with Neural Networks,C,https://github.com/huggingface/neuralcoref
733,lastpass-cli,2884,299,2884,209,22/10/2014,22/04/2025,1.02 MB,1049,LastPass command line interface tool,C,https://github.com/lastpass/lastpass-cli
734,GTAO_Booster_PoC,2884,176,2884,17,28/02/2021,01/10/2021,24.00 KB,24,,C,https://github.com/tostercx/GTAO_Booster_PoC
735,mydumper,2884,489,2884,52,06/11/2015,25/09/2025,7.08 MB,7246,Official MyDumper Project,C,https://github.com/mydumper/mydumper
736,sxhkd,2881,143,2881,131,31/12/2012,27/09/2025,404.00 KB,404,Simple X hotkey daemon,C,https://github.com/baskerville/sxhkd
737,willow,2874,112,2874,23,31/03/2023,03/07/2025,1.88 MB,1920,"Open source, local, and self-hosted Amazon Echo/Google Home competitive Voice Assistant alternative",C,https://github.com/HeyWillow/willow
738,rlwrap,2872,161,2872,21,23/02/2014,22/08/2025,1.06 MB,1083,A readline wrapper,C,https://github.com/hanslub42/rlwrap
739,PF_RING,2870,361,2870,39,04/05/2015,26/09/2025,123.41 MB,126373,High-speed packet processing framework,C,https://github.com/ntop/PF_RING
740,Il2CppInspector,2855,487,2855,68,17/03/2017,13/05/2022,455.67 MB,466609,Powerful automated tool for reverse engineering Unity IL2CPP binaries,C,https://github.com/djkaty/Il2CppInspector
741,printf,2853,536,2853,68,04/10/2014,03/04/2023,393.00 KB,393,"Tiny, fast, non-dependent and fully loaded printf implementation for embedded systems. Extensive test suite passing.",C,https://github.com/mpaland/printf
742,Zygisk-Il2CppDumper,2853,8148,2853,104,04/07/2020,09/08/2024,1.58 MB,1617,Using Zygisk to dump il2cpp data at runtime,C,https://github.com/Perfare/Zygisk-Il2CppDumper
743,INTANG,2849,559,2849,23,15/09/2017,11/06/2025,304.00 KB,304,,C,https://github.com/seclab-ucr/INTANG
744,riscv-isa-sim,2844,980,2844,355,26/08/2011,26/09/2025,7.91 MB,8100,"Spike, a RISC-V ISA Simulator",C,https://github.com/riscv-software-src/riscv-isa-sim
745,StringZilla,2841,98,2841,26,14/08/2020,22/09/2025,10.77 MB,11025,"Up to 100x faster strings for C, C++, CUDA, Python, Rust, Swift, JS, & Go, leveraging NEON, AVX2, AVX-512, SVE, GPGPU, & SWAR to accelerate search, hashing, sorting, edit distances, sketches, and memory ops 🦖",C,https://github.com/ashvardanian/StringZilla
746,RTKLIB,2840,1741,2840,435,29/04/2013,28/05/2024,71.51 MB,73227,,C,https://github.com/tomojitakasu/RTKLIB
747,Goldleaf,2839,344,2839,86,29/06/2018,12/08/2025,30.52 MB,31255,🍂 Multipurpose homebrew tool for Nintendo Switch,C,https://github.com/XorTroll/Goldleaf
748,OpenSC,2838,791,2838,119,05/07/2011,24/09/2025,23.30 MB,23861,Open source smart card tools and middleware. PKCS#11/MiniDriver/Tokend,C,https://github.com/OpenSC/OpenSC
749,HackSysExtremeVulnerableDriver,2830,569,2830,14,28/05/2015,24/02/2025,1.84 MB,1883,HackSys Extreme Vulnerable Driver (HEVD) - Windows & Linux,C,https://github.com/hacksysteam/HackSysExtremeVulnerableDriver
750,gstreamer,2827,677,2827,0,01/12/2015,27/09/2025,330.26 MB,338185,GStreamer open-source multimedia framework,C,https://github.com/GStreamer/gstreamer
751,MachOView,2824,720,2824,19,13/10/2012,22/07/2024,12.89 MB,13199,MachOView fork,C,https://github.com/gdbinit/MachOView
752,pigz,2823,181,2823,14,09/04/2010,16/08/2025,974.00 KB,974,"A parallel implementation of gzip for modern multi-processor, multi-core machines.",C,https://github.com/madler/pigz
753,asterisk,2809,1112,2809,151,11/04/2015,25/09/2025,368.71 MB,377559,The official Asterisk Project repository.,C,https://github.com/asterisk/asterisk
754,simde,2806,285,2806,139,28/03/2017,25/09/2025,37.93 MB,38836,Implementations of SIMD instruction sets for systems which don't natively support them.,C,https://github.com/simd-everywhere/simde
755,wipeout-rewrite,2805,232,2805,55,10/08/2023,14/06/2025,433.00 KB,433,,C,https://github.com/phoboslab/wipeout-rewrite
756,lmdb,2800,608,2800,0,22/04/2015,12/06/2025,2.52 MB,2579,Read-only mirror of official repo on openldap.org. Issues and pull requests here are ignored. Use OpenLDAP ITS for issues.,C,https://github.com/LMDB/lmdb
757,txiki.js,2796,190,2796,43,21/07/2019,11/09/2025,45.16 MB,46239,A tiny JavaScript runtime,C,https://github.com/saghul/txiki.js
758,glew,2795,640,2795,72,19/03/2013,25/08/2025,2.53 MB,2591,The OpenGL Extension Wrangler Library,C,https://github.com/nigels-com/glew
759,libqrencode,2795,610,2795,66,25/02/2011,01/07/2024,1.72 MB,1758,A fast and compact QR Code encoding library,C,https://github.com/fukuchi/libqrencode
760,LDD-LinuxDeviceDrivers,2793,904,2793,4,26/03/2016,27/09/2025,117.28 MB,120096,Linux内核与设备驱动程序学习笔记,C,https://github.com/gatieme/LDD-LinuxDeviceDrivers
761,fdupes,2784,206,2784,92,15/05/2014,31/03/2025,339.00 KB,339,FDUPES is a program for identifying or deleting duplicate files residing within specified directories.,C,https://github.com/adrianlopezroche/fdupes
762,tidy-html5,2780,435,2780,232,17/11/2011,04/05/2024,6.45 MB,6601,"The granddaddy of HTML tools, with support for modern standards",C,https://github.com/htacg/tidy-html5
763,shadowsocksr-native,2780,762,2780,15,28/07/2017,17/11/2024,4.61 MB,4724,"翻墙 从容穿越党国敏感日 ShadowsocksR (SSRoT) native implementation for all platforms, GFW terminator",C,https://github.com/ShadowsocksR-Live/shadowsocksr-native
764,Broadway,2776,429,2776,88,14/10/2011,22/01/2023,92.58 MB,94798,A JavaScript H.264 decoder.,C,https://github.com/mbebenita/Broadway
765,mpc,2776,300,2776,36,26/09/2013,10/08/2025,702.00 KB,702,A Parser Combinator library for C,C,https://github.com/orangeduck/mpc
766,opus,2775,701,2775,147,19/08/2014,28/09/2025,23.30 MB,23860,Modern audio compression for the internet.,C,https://github.com/xiph/opus
767,Primes,2772,585,2772,2,23/03/2021,09/09/2025,7.84 MB,8029,"Prime number projects in 100+ programming languages, to compare their speed - and their programmer's cleverness",C,https://github.com/PlummersSoftwareLLC/Primes
768,xdp-tutorial,2762,629,2762,170,25/02/2019,11/09/2025,585.00 KB,585,XDP tutorial,C,https://github.com/xdp-project/xdp-tutorial
769,documentdb,2760,156,2760,42,22/01/2025,26/09/2025,49.73 MB,50926,"MongoDB-compatible database engine for cloud-native and open-source workloads. Built for scalability, performance, and developer productivity.",C,https://github.com/documentdb/documentdb
770,os,2755,235,2755,23,31/10/2016,17/12/2021,25.79 MB,26406,Minoca operating system,C,https://github.com/minoca/os
771,viabtc_exchange_server,2754,1511,2754,112,06/03/2017,17/12/2021,778.00 KB,778,A trading engine with high-speed performance and real-time notification,C,https://github.com/viabtc/viabtc_exchange_server
772,WebBench,2745,1147,2745,15,13/04/2015,19/06/2021,74.00 KB,74,Webbench是Radim Kolar在1997年写的一个在linux下使用的非常简单的网站压测工具。它使用fork()模拟多个客户端同时访问我们设定的URL，测试网站在压力下工作的性能，最多可以模拟3万个并发连接去测试网站的负载能力。官网地址:http://home.tiscali.cz/~cz210552/webbench.html,C,https://github.com/EZLippi/WebBench
773,playerctl,2733,92,2733,86,15/04/2014,13/06/2024,683.00 KB,683,"🎧 mpris media player command-line controller for vlc, mpv, RhythmBox, web browsers, cmus, mpd, spotify and others.",C,https://github.com/altdesktop/playerctl
774,libtree,2732,61,2732,11,04/04/2020,21/06/2024,584.00 KB,584,ldd as a tree,C,https://github.com/haampie/libtree
775,io,2731,307,2731,63,22/02/2008,17/09/2025,26.01 MB,26631,"Io programming language. Inspired by Self, Smalltalk and LISP.",C,https://github.com/IoLanguage/io
776,pokeemerald,2722,3433,2722,66,05/10/2015,13/09/2025,182.55 MB,186933,Decompilation of Pokémon Emerald,C,https://github.com/pret/pokeemerald
777,chadwm,2720,208,2720,16,19/07/2021,27/09/2025,4.45 MB,4560,Making dwm as beautiful as possible! ,C,https://github.com/siduck/chadwm
778,brownie,2718,586,2718,392,02/11/2018,23/09/2025,25.29 MB,25898,A Python-based development and testing framework for smart contracts targeting the Ethereum Virtual Machine.,C,https://github.com/eth-brownie/brownie
779,permafrost-engine,2713,114,2713,1,30/12/2017,10/08/2025,319.40 MB,327061,An OpenGL RTS game engine written in C,C,https://github.com/eduard-permyakov/permafrost-engine
780,toybox,2708,365,2708,113,07/02/2012,18/09/2025,13.26 MB,13579,toybox,C,https://github.com/landley/toybox
781,mako,2699,150,2699,111,22/04/2018,11/09/2025,686.00 KB,686,A lightweight Wayland notification daemon,C,https://github.com/emersion/mako
782,JankyBorders,2697,47,2697,47,02/11/2023,24/09/2025,3.23 MB,3305,A lightweight window border system for macOS,C,https://github.com/FelixKratz/JankyBorders
783,dump1090,2695,1386,2695,98,05/01/2013,21/01/2024,587.00 KB,587,Dump1090 is a simple Mode S decoder for RTLSDR devices,C,https://github.com/antirez/dump1090
784,zimg,2691,400,2691,119,01/07/2013,29/03/2018,54.32 MB,55620,A lightweight and high performance image storage and processing system.,C,https://github.com/buaazp/zimg
785,can-utils,2688,756,2688,58,04/03/2015,03/09/2025,1.25 MB,1281,Linux-CAN / SocketCAN user space applications,C,https://github.com/linux-can/can-utils
786,zathura,2684,177,2684,218,03/11/2013,27/09/2025,4.08 MB,4181,Document viewer,C,https://github.com/pwmt/zathura
787,cleanflight,2681,1390,2681,1,27/03/2013,20/10/2023,353.78 MB,362275,Clean-code version of the baseflight flight controller firmware,C,https://github.com/cleanflight/cleanflight
788,openmv,2679,1211,2679,59,13/11/2013,27/09/2025,597.92 MB,612274,OpenMV Camera Module,C,https://github.com/openmv/openmv
789,mc-old,2678,524,2678,26,13/11/2011,28/02/2025,85.98 MB,88039,Midnight Commander's repository,C,https://github.com/MidnightCommander/mc-old
790,libsixel,2671,91,2671,36,20/08/2013,27/09/2025,34.67 MB,35502,A SIXEL encoder/decoder implementation derived from kmiya's sixel (https://github.com/saitoha/sixel).,C,https://github.com/saitoha/libsixel
791,r8152,2670,219,2670,128,01/09/2019,31/08/2025,863.00 KB,863,Synology DSM driver for Realtek RTL8152/RTL8153/RTL8156 based adapters,C,https://github.com/bb-qq/r8152
792,panda,2669,498,2669,113,23/08/2013,18/08/2025,500.93 MB,512952,Platform for Architecture-Neutral Dynamic Analysis,C,https://github.com/panda-re/panda
793,WidescreenFixesPack,2669,236,2669,507,02/03/2014,13/09/2025,186.34 MB,190809,"Plugins to make or improve widescreen resolutions support in games, add more features and fix bugs.",C,https://github.com/ThirteenAG/WidescreenFixesPack
794,nexmon,2666,476,2666,340,27/10/2016,25/06/2025,383.69 MB,392896,"The C-based Firmware Patching Framework for Broadcom/Cypress WiFi Chips that enables Monitor Mode, Frame Injection and much more",C,https://github.com/seemoo-lab/nexmon
795,WizQTClient,2665,810,2665,306,14/11/2012,26/05/2021,89.80 MB,91958,为知笔记跨平台客户端,C,https://github.com/WizTeam/WizQTClient
796,cglm,2662,263,2662,75,11/09/2016,18/06/2025,2.61 MB,2673,📽 Highly Optimized 2D / 3D Graphics Math (glm) for C,C,https://github.com/recp/cglm
797,sniproxy,2660,403,2660,119,20/12/2010,05/09/2025,1.10 MB,1122,Proxies incoming HTTP and TLS connections based on the hostname contained in the initial request of the TCP session.,C,https://github.com/dlundquist/sniproxy
798,renderer,2656,290,2656,1,20/03/2017,06/03/2021,131.50 MB,134661,A shader-based software renderer written from scratch in C89,C,https://github.com/zauonlok/renderer
799,pspg,2654,87,2654,0,11/07/2017,26/09/2025,4.70 MB,4817,"Unix pager (with very rich functionality) designed for work with tables. Designed for PostgreSQL, but MySQL is supported too. Works well with pgcli too. Can be used as CSV or TSV viewer too. It supports searching, selecting rows, columns, or block and export selected area to clipboard. ",C,https://github.com/okbob/pspg
800,SmartAppUpdates,2650,826,2650,16,09/12/2013,11/04/2016,86.45 MB,88525,Android应用增量更新,C,https://github.com/cundong/SmartAppUpdates
801,pipelinedb,2647,244,2647,135,26/11/2013,20/02/2022,47.85 MB,48997,High-performance time-series aggregation for PostgreSQL,C,https://github.com/pipelinedb/pipelinedb
802,bldc,2645,1540,2645,229,09/01/2014,23/09/2025,91.90 MB,94102,The VESC motor control firmware,C,https://github.com/vedderb/bldc
803,strongswan,2642,870,2642,124,28/10/2010,26/09/2025,103.16 MB,105634,strongSwan - IPsec-based VPN,C,https://github.com/strongswan/strongswan
804,drmemory,2638,278,2638,1045,27/11/2014,15/07/2025,7.88 MB,8069,"Memory Debugger for Windows, Linux, Mac, and Android",C,https://github.com/DynamoRIO/drmemory
805,Tiny,2637,347,2637,64,04/04/2017,07/10/2020,65.17 MB,66732,an image compression framework.（一个高保真、高压缩比的图片压缩框架）,C,https://github.com/Sunzxyong/Tiny
806,Adafruit-GFX-Library,2633,1603,2633,172,13/03/2012,24/09/2025,2.53 MB,2589,"Adafruit GFX graphics core Arduino library, this is the 'core' class that all our other graphics libraries derive from",C,https://github.com/adafruit/Adafruit-GFX-Library
807,PongoOS,2626,451,2626,48,05/02/2020,03/07/2025,1.84 MB,1889,pongoOS,C,https://github.com/checkra1n/PongoOS
808,HomeKitADK,2623,233,2623,41,11/12/2019,06/07/2022,655.00 KB,655,,C,https://github.com/apple/HomeKitADK
809,jessibuca,2620,449,2620,15,14/02/2016,27/09/2025,1.74 GB,1828743,Jessibuca是一款开源的纯H5直播流播放器,C,https://github.com/langhuihui/jessibuca
810,Arduino_STM32,2618,1271,2618,31,30/10/2014,01/07/2025,40.15 MB,41115,"Arduino STM32. Hardware files to support STM32 boards, on Arduino IDE 1.8.x including LeafLabs Maple and other generic STM32F103 boards",C,https://github.com/rogerclarkmelbourne/Arduino_STM32
811,iotjs,2613,441,2613,51,08/04/2015,18/06/2021,63.24 MB,64757,Platform for Internet of Things with JavaScript http://www.iotjs.net ,C,https://github.com/jerryscript-project/iotjs
812,wolfssl,2611,897,2611,184,07/01/2015,27/09/2025,764.45 MB,782794,"The wolfSSL library is a small, fast, portable implementation of TLS/SSL for embedded devices to the cloud.  wolfSSL supports up to TLS 1.3 and DTLS 1.3!",C,https://github.com/wolfSSL/wolfssl
813,yojimbo,2608,259,2608,5,29/05/2016,16/09/2025,10.45 MB,10702,A network library for client/server games written in C++,C,https://github.com/mas-bandwidth/yojimbo
814,word2vec,2607,630,2607,5,25/08/2013,06/04/2023,6.58 MB,6734,Python interface to Google word2vec,C,https://github.com/danielfrg/word2vec
815,WindowsInternals,2604,523,2604,6,15/11/2016,11/04/2024,344.00 KB,344,Windows Internals Book 7th edition Tools,C,https://github.com/zodiacon/WindowsInternals
816,kamailio,2598,1032,2598,39,11/12/2013,28/09/2025,117.24 MB,120058,Kamailio - The Open Source SIP Server for large VoIP and real-time communication platforms -,C,https://github.com/kamailio/kamailio
817,mongoose-os,2595,435,2595,95,29/06/2014,06/08/2025,45.94 MB,47043,"Mongoose OS - an IoT Firmware Development Framework. Supported microcontrollers: ESP32, ESP8266, CC3220, CC3200, STM32F4, STM32L4, STM32F7. Amazon AWS IoT, Microsoft Azure, Google IoT Core integrated. Code in C or JavaScript.",C,https://github.com/cesanta/mongoose-os
818,AndroidUSBCamera,2591,889,2591,487,29/09/2017,02/09/2024,160.08 MB,163923,"🔥🔥🔥Flexible and useful UVC camera engine on Android platform, supporting multi-road cameras!",C,https://github.com/jiangdongguo/AndroidUSBCamera
819,ettercap,2590,513,2590,126,14/07/2012,16/07/2025,89.55 MB,91697,Ettercap Project,C,https://github.com/Ettercap/ettercap
820,DAPLink,2589,1038,2589,136,28/09/2014,27/02/2025,28.11 MB,28783,,C,https://github.com/ARMmbed/DAPLink
821,Open-PS2-Loader,2583,332,2583,393,15/10/2016,18/09/2025,13.53 MB,13852,Game and app loader for Sony PlayStation 2,C,https://github.com/ps2homebrew/Open-PS2-Loader
822,esp32-wifi-penetration-tool,2572,403,2572,69,05/04/2021,18/02/2024,1.90 MB,1949,Exploring possibilities of ESP32 platform to attack on nearby Wi-Fi networks.,C,https://github.com/risinek/esp32-wifi-penetration-tool
823,inspektor-gadget,2564,303,2564,368,16/04/2019,26/09/2025,108.67 MB,111282,Inspektor Gadget is a set of tools and framework for data collection and system inspection on Kubernetes clusters and Linux hosts using eBPF,C,https://github.com/inspektor-gadget/inspektor-gadget
824,tio,2562,183,2562,28,27/09/2014,07/08/2025,17.71 MB,18131,A serial device I/O tool,C,https://github.com/tio/tio
825,byedpi,2561,167,2561,49,01/06/2023,22/09/2025,351.00 KB,351,Bypass DPI,C,https://github.com/hufrea/byedpi
826,Entware,2559,169,2559,34,05/03/2018,29/08/2025,11.06 MB,11323,Ultimate repo for embedded devices,C,https://github.com/Entware/Entware
827,OSCPRepo,2553,738,2553,1,12/11/2017,22/06/2020,697.04 MB,713766,"A list of commands, scripts, resources, and more that I have gathered and attempted to consolidate for use as OSCP (and more) study material. Commands in 'Usefulcommands' Keepnote. Bookmarks and reading material in 'BookmarkList' CherryTree. Reconscan Py2 and Py3. Custom ISO building.",C,https://github.com/rewardone/OSCPRepo
828,ck,2551,327,2551,12,17/04/2014,22/09/2025,2.08 MB,2135,"Concurrency primitives, safe memory reclamation mechanisms and non-blocking (including lock-free) data structures designed to aid in the research, design and implementation of high performance concurrent systems developed in C99+.",C,https://github.com/concurrencykit/ck
829,SQLiteCpp,2546,548,2546,83,12/04/2012,01/09/2025,17.97 MB,18403,SQLiteC++ (SQLiteCpp) is a smart and easy to use C++ SQLite3 wrapper.,C,https://github.com/SRombauts/SQLiteCpp
830,bpftop,2543,118,2543,2,10/02/2024,10/09/2025,2.58 MB,2644,"bpftop provides a dynamic real-time view of running eBPF programs. It displays the average runtime, events per second, and estimated total CPU % for each program.",C,https://github.com/Netflix/bpftop
831,swift-corelibs-libdispatch,2538,477,2538,101,09/11/2015,28/09/2025,4.92 MB,5037,"The libdispatch Project, (a.k.a. Grand Central Dispatch), for concurrency on multicore hardware",C,https://github.com/swiftlang/swift-corelibs-libdispatch
832,cc65,2538,469,2538,187,21/03/2013,22/09/2025,31.13 MB,31881,cc65 - a freeware C compiler for 6502 based systems,C,https://github.com/cc65/cc65
833,xnu,2537,274,2537,1,04/10/2021,27/08/2025,139.40 MB,142743,,C,https://github.com/apple-oss-distributions/xnu
834,amazon-freertos,2536,1089,2536,20,09/11/2017,18/11/2022,282.03 MB,288797,DEPRECATED - See README.md,C,https://github.com/aws/amazon-freertos
835,hidapi,2532,907,2532,246,11/04/2010,16/10/2023,14.43 MB,14775,"A Simple library for communicating with USB and Bluetooth HID devices on Linux, Mac, and Windows.",C,https://github.com/signal11/hidapi
836,ZBar,2529,1066,2529,19,22/09/2012,18/03/2024,4.17 MB,4272,Clone of the mercurial repository http://zbar.hg.sourceforge.net:8000/hgroot/zbar/zbar,C,https://github.com/ZBar/ZBar
837,arduino-pico,2528,498,2528,7,25/02/2021,25/09/2025,273.80 MB,280371,"Raspberry Pi Pico Arduino core, for all RP2040 and RP2350 boards",C,https://github.com/earlephilhower/arduino-pico
838,sslscan,2519,405,2519,52,16/04/2013,25/08/2025,1.11 MB,1133,sslscan tests SSL/TLS enabled services to discover supported cipher suites,C,https://github.com/rbsec/sslscan
839,blis,2518,392,2518,115,22/01/2014,25/09/2025,50.06 MB,51257,BLAS-like Library Instantiation Software Framework,C,https://github.com/flame/blis
840,ldd3,2517,931,2517,9,27/11/2010,28/04/2025,376.00 KB,376,Linux Device Drivers 3 examples updated to work in recent kernels,C,https://github.com/martinezjavier/ldd3
841,netcode,2515,198,2515,0,29/12/2016,13/08/2025,6.52 MB,6680,Secure client/server connections over UDP,C,https://github.com/mas-bandwidth/netcode
842,CSAPP-Labs,2514,442,2514,4,23/09/2017,15/02/2023,4.17 MB,4270,Solutions and Notes for Labs of Computer Systems: A Programmer's Perspective 3rd Editon // 《深入理解计算机系统》第三版的实验文件、解答与笔记,C,https://github.com/Exely/CSAPP-Labs
843,coroutine,2512,689,2512,8,23/07/2012,16/12/2022,9.00 KB,9,A asymmetric coroutine library for C.,C,https://github.com/cloudwu/coroutine
844,exploits,2509,686,2509,1,26/08/2020,02/01/2023,3.04 MB,3117,,C,https://github.com/r4j0x00/exploits
845,liboqs,2508,625,2508,96,12/08/2016,28/09/2025,208.03 MB,213020,C library for prototyping and experimenting with quantum-resistant cryptography,C,https://github.com/open-quantum-safe/liboqs
846,sc,2506,286,2506,3,10/11/2020,15/02/2025,835.00 KB,835,Common libraries and data structures for C.,C,https://github.com/tezc/sc
847,NymphCast,2504,83,2504,20,07/02/2019,08/09/2025,126.44 MB,129473,Audio and video casting system with support for custom applications.,C,https://github.com/MayaPosch/NymphCast
848,Avem,2504,553,2504,6,10/08/2016,03/10/2023,29.51 MB,30219,🚁 轻量级无人机飞控-[Drone]-[STM32]-[PID]-[BLDC],C,https://github.com/avem-labs/Avem
849,HID,2500,420,2500,105,03/06/2014,21/03/2024,3.80 MB,3896,Bring enhanced HID functions to your Arduino!,C,https://github.com/NicoHood/HID
850,CrossC2,2500,367,2500,40,16/01/2020,20/11/2023,644.81 MB,660290,generate CobaltStrike's cross-platform payload,C,https://github.com/gloxec/CrossC2
851,c-jwt-cracker,2498,269,2498,16,19/01/2017,02/06/2023,26.00 KB,26,JWT brute force cracker written in C,C,https://github.com/brendan-rius/c-jwt-cracker
852,libbpf,2498,462,2498,19,10/10/2018,27/08/2025,9.70 MB,9934,Automated upstream mirror for libbpf stand-alone build.,C,https://github.com/libbpf/libbpf
853,openctp,2495,528,2495,5,06/08/2021,16/09/2025,211.05 MB,216116,openctp提供CTP股票期权、中泰证券XTP、华鑫证券奇点TORA、东方证券OST、东方财富证券EMT、盈透证券TWS、易盛TAP、量投QDP等各通道的CTPAPI兼容接口，CTP程序可以无缝对接各股票柜台。openctp也提供了一套基于TTS交易系统的模拟环境，同样提供了CTPAPI兼容接口，不仅支持国内期货与期权全品种，也支持A股股票、基金、债券以及股票期权模拟交易，可以替代Simnow，为CTP量化交易开发者提供7x24可用的模拟环境。,C,https://github.com/openctp/openctp
854,tsar,2484,732,2484,20,16/01/2013,18/02/2022,2.40 MB,2457,Taobao System Activity Reporter,C,https://github.com/alibaba/tsar
855,open-vm-tools,2483,456,2483,290,25/04/2014,11/08/2025,24.53 MB,25118,Official repository of VMware open-vm-tools project,C,https://github.com/vmware/open-vm-tools
856,ltp,2481,1066,2481,288,07/03/2012,26/09/2025,66.01 MB,67591,Linux Test Project (mailing list: https://lists.linux.it/listinfo/ltp),C,https://github.com/linux-test-project/ltp
