Ranking,Project Name,Stars,Forks,Watchers,Open Issues,Created At,Last Commit,Size,Description,Language,Repo URL,Size
651,WindowsAppSDK,4440,420,4440,382,15/04/2020,06/03/2026,231.61 MB,"The Windows App SDK empowers all Windows desktop apps with modern Windows UI, APIs, and platform features, including back-compat support, shipped via NuGet.",C++,https://github.com/microsoft/WindowsAppSDK,231.61 MB
652,FluentUI,4431,597,4431,203,24/02/2023,05/03/2026,29.26 MB,FluentUI for QML,C++,https://github.com/zhuzichu520/FluentUI,29.26 MB
653,tiny-cuda-nn,4427,550,4427,248,16/04/2021,14/12/2025,19.59 MB,Lightning fast C++/CUDA neural network framework,C++,https://github.com/NVlabs/tiny-cuda-nn,19.59 MB
654,infinity,4421,416,4421,68,18/07/2022,05/03/2026,77.84 MB,"The AI-native database built for LLM applications, providing incredibly fast hybrid search of dense vector, sparse vector, tensor (multi-vector), and full-text.",C++,https://github.com/infiniflow/infinity,77.84 MB
655,ceres-solver,4420,1103,4420,87,06/01/2014,25/02/2026,32.41 MB,A large scale non-linear optimization library,C++,https://github.com/ceres-solver/ceres-solver,32.41 MB
656,PhysX,4416,597,4416,74,04/10/2022,04/03/2026,146.12 MB,NVIDIA PhysX SDK,C++,https://github.com/NVIDIA-Omniverse/PhysX,146.12 MB
657,cef,4406,578,4406,203,02/04/2017,05/03/2026,43.66 MB,Chromium Embedded Framework (CEF). A simple framework for embedding Chromium-based browsers in other applications.,C++,https://github.com/chromiumembedded/cef,43.66 MB
658,amazon-dsstne,4400,725,4400,45,24/03/2016,02/03/2020,31.60 MB,Deep Scalable Sparse Tensor Network Engine (DSSTNE) is an Amazon developed library for building Deep Learning (DL) machine learning (ML) models ,C++,https://github.com/amazon-archives/amazon-dsstne,31.60 MB
659,MTranServer,4399,274,4399,16,06/02/2025,18/01/2026,13.45 MB,"Offline translation model server with low resource consumption, fast speed, and private deployment capability. 低资源占用速度快可私有部署的离线翻译模型服务器",C++,https://github.com/xxnuo/MTranServer,13.45 MB
660,VINS-Fusion,4396,1559,4396,210,10/01/2019,23/05/2024,80.75 MB,An optimization-based multi-sensor state estimator,C++,https://github.com/HKUST-Aerial-Robotics/VINS-Fusion,80.75 MB
661,node-opencv,4391,846,4391,127,14/01/2012,09/07/2024,10.06 MB,OpenCV Bindings for node.js,C++,https://github.com/peterbraden/node-opencv,10.06 MB
662,qgroundcontrol,4389,4668,4389,1070,13/10/2011,05/03/2026,512.87 MB,"Cross-platform ground control station for drones (Android, iOS, Mac OS, Linux, Windows)",C++,https://github.com/mavlink/qgroundcontrol,512.87 MB
663,CloudCompare,4380,1161,4380,275,06/11/2012,25/02/2026,88.33 MB,CloudCompare main repository,C++,https://github.com/CloudCompare/CloudCompare,88.33 MB
664,lite.ai.toolkit,4380,775,4380,1,22/03/2021,25/02/2026,458.45 MB,"🛠A lite C++ AI toolkit: 100+ models with MNN, ORT and TRT, including Det, Seg, Stable-Diffusion, Face-Fusion, etc.🎉",C++,https://github.com/xlite-dev/lite.ai.toolkit,458.45 MB
665,ActionRoguelike,4374,780,4374,2,07/09/2020,05/03/2026,1.32 GB,Co-op Action Roguelike in Unreal Engine C++,C++,https://github.com/tomlooman/ActionRoguelike,1.32 GB
666,FAST_LIO,4363,1407,4363,0,12/10/2020,15/01/2025,126.75 MB,A computationally efficient and robust LiDAR-inertial odometry (LIO) package,C++,https://github.com/hku-mars/FAST_LIO,126.75 MB
667,range-v3,4351,465,4351,288,11/11/2013,23/03/2025,33.61 MB,"Range library for C++14/17/20, basis for C++20's std::ranges",C++,https://github.com/ericniebler/range-v3,33.61 MB
668,incubator-pagespeed-ngx,4350,361,4350,353,23/06/2012,21/04/2023,78.87 MB,Automatic PageSpeed optimization module for Nginx,C++,https://github.com/apache/incubator-pagespeed-ngx,78.87 MB
669,CTranslate2,4341,453,4341,256,23/09/2019,04/02/2026,16.22 MB,Fast inference engine for Transformer models,C++,https://github.com/OpenNMT/CTranslate2,16.22 MB
670,hip,4338,579,4338,33,07/01/2016,05/03/2026,27.53 MB,HIP: C++ Heterogeneous-Compute Interface for Portability,C++,https://github.com/ROCm/hip,27.53 MB
671,libsass,4337,471,4337,159,31/01/2012,24/10/2025,12.37 MB,A C/C++ implementation of a Sass compiler,C++,https://github.com/sass/libsass,12.37 MB
672,imgui-node-editor,4335,656,4335,114,10/12/2017,21/07/2024,13.25 MB,Node Editor built using Dear ImGui,C++,https://github.com/thedmd/imgui-node-editor,13.25 MB
673,cpp-sdk,4326,18,4326,3,20/06/2025,09/07/2025,113.00 KB,,C++,https://github.com/QuipNetwork/cpp-sdk,113.00 KB
674,pycdc,4323,813,4323,228,18/09/2011,30/08/2025,945.00 KB,C++ python bytecode disassembler and decompiler,C++,https://github.com/zrax/pycdc,945.00 KB
675,orbit,4318,360,4318,0,21/09/2017,31/01/2025,153.06 MB,C/C++ Performance Profiler,C++,https://github.com/google/orbit,153.06 MB
676,miniob,4316,1563,4316,57,12/10/2021,24/12/2025,43.93 MB,MiniOB is a compact database that assists developers in understanding the fundamental workings of a database.,C++,https://github.com/oceanbase/miniob,43.93 MB
677,yosys,4314,1046,4314,584,05/01/2013,05/03/2026,33.69 MB,Yosys Open SYnthesis Suite,C++,https://github.com/YosysHQ/yosys,33.69 MB
678,Rack,4314,459,4314,308,14/11/2016,04/11/2025,19.25 MB,The virtual Eurorack studio,C++,https://github.com/VCVRack/Rack,19.25 MB
679,onnxsim,4305,422,4305,136,01/04/2019,26/02/2026,543.00 KB,Simplify your onnx model,C++,https://github.com/onnxsim/onnxsim,543.00 KB
680,OCAuxiliaryTools,4292,388,4292,5,04/08/2020,10/09/2025,118.66 MB,Cross-platform GUI management tools for OpenCore（OCAT）,C++,https://github.com/ic005k/OCAuxiliaryTools,118.66 MB
681,pdns,4287,985,4287,927,26/04/2013,05/03/2026,103.84 MB,"PowerDNS Authoritative, PowerDNS Recursor, dnsdist",C++,https://github.com/PowerDNS/pdns,103.84 MB
682,LxRunOffline,4266,250,4266,22,08/01/2017,02/02/2022,1017.00 KB,A full-featured utility for managing Windows Subsystem for Linux (WSL),C++,https://github.com/DDoSolitary/LxRunOffline,1017.00 KB
683,halflife,4266,679,4266,2101,14/02/2013,02/10/2024,12.04 MB,Half-Life 1 engine based games,C++,https://github.com/ValveSoftware/halflife,12.04 MB
684,SpaceCadetPinball,4263,282,4263,62,29/01/2021,21/08/2024,5.39 MB,Decompilation of 3D Pinball for Windows – Space Cadet,C++,https://github.com/k4zmu2a/SpaceCadetPinball,5.39 MB
685,media-downloader,4261,299,4261,10,18/01/2021,05/03/2026,16.03 MB,"Media Downloader is a Qt/C++ front end to yt-dlp, youtube-dl, gallery-dl, lux, you-get, svtplay-dl, aria2c, wget and safari books..",C++,https://github.com/mhogomchungu/media-downloader,16.03 MB
686,obs-websocket,4256,742,4256,142,09/10/2016,03/03/2026,3.74 MB,Remote-control of OBS Studio through WebSocket,C++,https://github.com/obsproject/obs-websocket,3.74 MB
687,backward-cpp,4252,528,4252,122,17/02/2013,14/04/2025,873.00 KB,A beautiful stack trace pretty printer for C++,C++,https://github.com/bombela/backward-cpp,873.00 KB
688,kvrocks,4249,609,4249,223,15/08/2019,05/03/2026,12.98 MB,Apache Kvrocks is a distributed key value NoSQL database that uses RocksDB as storage engine and is compatible with Redis protocol.,C++,https://github.com/apache/kvrocks,12.98 MB
689,librime,4232,674,4232,143,20/03/2012,28/02/2026,16.87 MB,"Rime Input Method Engine, the core library",C++,https://github.com/rime/librime,16.87 MB
690,notes,4228,371,4228,134,25/12/2015,15/11/2025,14.80 MB,Fast and beautiful note-taking app written in C++. Write down your thoughts.,C++,https://github.com/nuttyartist/notes,14.80 MB
691,rpi-rgb-led-matrix,4228,1326,4228,13,16/02/2013,10/02/2026,24.95 MB,"Controlling up to three chains of 64x64, 32x32, 16x32 or similar RGB LED displays using Raspberry Pi GPIO",C++,https://github.com/hzeller/rpi-rgb-led-matrix,24.95 MB
692,i2cdevlib,4223,7467,4223,268,26/07/2011,04/08/2025,2.10 MB,I2C device library collection for AVR/Arduino or other C++-based MCUs,C++,https://github.com/jrowberg/i2cdevlib,2.10 MB
693,QtAV,4219,1534,4219,526,29/10/2012,15/08/2025,13.53 MB,A cross-platform multimedia framework based on Qt and FFmpeg. 基于Qt和FFmpeg的跨平台高性能音视频播放框架. Recommand to use new sdk https://github.com/wang-bin/mdk-sdk,C++,https://github.com/wang-bin/QtAV,13.53 MB
694,UEVR,4210,224,4210,195,01/09/2022,13/01/2026,4.50 MB,Universal Unreal Engine VR Mod (4.8 - 5.4),C++,https://github.com/praydog/UEVR,4.50 MB
695,coost,4209,588,4209,14,10/11/2019,27/05/2025,3.36 MB,A tiny boost library in C++11.,C++,https://github.com/idealvin/coost,3.36 MB
696,braft,4201,911,4201,200,07/02/2018,25/10/2024,4.64 MB,"An industrial-grade C++ implementation of RAFT consensus algorithm based on brpc,  widely used inside Baidu to build highly-available distributed systems.",C++,https://github.com/baidu/braft,4.64 MB
697,diff-pdf,4186,250,4186,17,28/10/2009,26/11/2024,461.00 KB,A simple tool for visually comparing two PDF files,C++,https://github.com/vslavik/diff-pdf,461.00 KB
698,webots,4177,1987,4177,245,05/11/2018,05/03/2026,4.11 GB,Webots Robot Simulator,C++,https://github.com/cyberbotics/webots,4.11 GB
699,Bilibili-plus,4175,1060,4175,1,17/02/2021,25/08/2025,262.17 MB,课程视频、PPT和源代码：侯捷C++系列；台大郭彦甫MATLAB,C++,https://github.com/ZachL1/Bilibili-plus,262.17 MB
700,Clementine,4172,717,4172,2435,06/12/2013,18/02/2026,204.38 MB,:tangerine: Clementine Music Player,C++,https://github.com/clementine-player/Clementine,204.38 MB
701,course,4171,560,4171,22,10/12/2021,18/10/2024,439.94 MB,高性能并行编程与优化 - 课件,C++,https://github.com/parallel101/course,439.94 MB
702,f3d,4169,382,4169,274,17/02/2020,04/03/2026,10.95 MB,Fast and minimalist 3D viewer.,C++,https://github.com/f3d-app/f3d,10.95 MB
703,fastllm,4167,413,4167,320,13/05/2023,05/03/2026,26.33 MB,fastllm是后端无依赖的高性能大模型推理库。同时支持张量并行推理稠密模型和混合模式推理MOE模型，任意10G以上显卡即可推理满血DeepSeek。双路9004/9005服务器+单显卡部署DeepSeek满血满精度原版模型，单并发20tps；INT4量化模型单并发30tps，多并发可达60+。,C++,https://github.com/ztxz16/fastllm,26.33 MB
704,CLI11,4164,429,4164,69,25/01/2017,05/03/2026,5.32 MB,CLI11 is a command line parser for C++11 and beyond that provides a rich feature set with a simple and intuitive interface.,C++,https://github.com/CLIUtils/CLI11,5.32 MB
705,obs-backgroundremoval,4162,268,4162,10,15/04/2021,05/03/2026,140.73 MB,"An OBS plugin for removing background in portrait images (video), making it easy to replace the background when recording or streaming.",C++,https://github.com/royshil/obs-backgroundremoval,140.73 MB
706,lsfg-vk,4159,97,4159,12,28/06/2025,23/02/2026,3.00 MB,Lossless Scaling Frame Generation on Linux,C++,https://github.com/PancakeTAS/lsfg-vk,3.00 MB
707,StreamFX-Public,4134,3203,4134,0,28/06/2017,13/12/2024,17.37 MB,"StreamFX is a plugin for OBS® Studio which adds many new effects, filters, sources, transitions and encoders! Be it 3D Transform, Blur, complex Masking, or even custom shaders, you'll find it all here.",C++,https://github.com/Vhonowslend/StreamFX-Public,17.37 MB
708,olcPixelGameEngine,4133,917,4133,136,02/09/2018,26/09/2025,10.53 MB,"The official distribution of olcPixelGameEngine, a tool used in javidx9's YouTube videos and projects",C++,https://github.com/OneLoneCoder/olcPixelGameEngine,10.53 MB
709,logiops,4128,302,4128,263,09/07/2019,29/12/2025,838.00 KB,An unofficial userspace driver for HID++ Logitech devices,C++,https://github.com/PixlOne/logiops,838.00 KB
710,NoahGameFrame,4124,1118,4124,25,16/05/2014,25/02/2023,29.46 MB,"A fast, scalable, distributed game server engine/framework for C++, include the actor library, network library, can be used as a  real time multiplayer game engine ( MMO RPG/MOBA ), which support C#/Lua script/ Unity3d, Cocos2dx and plan to support Unreal.",C++,https://github.com/ketoo/NoahGameFrame,29.46 MB
711,UABE,4116,523,4116,217,06/09/2015,31/12/2023,1.29 MB,Asset Bundle Extractor. No longer supported. Consider using https://github.com/nesrak1/UABEA,C++,https://github.com/SeriousCache/UABE,1.29 MB
712,cling,4110,307,4110,132,07/01/2016,26/02/2026,20.06 MB,The cling C++ interpreter,C++,https://github.com/root-project/cling,20.06 MB
713,projectm,4102,447,4102,33,12/08/2013,26/02/2026,216.70 MB,projectM - Cross-platform Music Visualization Library. Open-source and Milkdrop-compatible.,C++,https://github.com/projectM-visualizer/projectm,216.70 MB
714,BambuStudio,4087,633,4087,6040,08/07/2022,04/03/2026,843.41 MB,PC Software for BambuLab and other 3D printers,C++,https://github.com/bambulab/BambuStudio,843.41 MB
715,Triton,4080,577,4080,36,25/01/2015,02/12/2025,58.56 MB,"Triton is a dynamic binary analysis library. Build your own program analysis tools, automate your reverse engineering, perform software verification or just emulate code.",C++,https://github.com/JonathanSalwan/Triton,58.56 MB
716,DWMBlurGlass,4077,165,4077,85,14/01/2024,17/01/2026,27.93 MB,"Add custom effect to global system title bar, support win10 and win11.",C++,https://github.com/Maplespe/DWMBlurGlass,27.93 MB
717,xmr-stak,4076,1756,4076,549,03/10/2017,20/06/2024,5.28 MB,Free Monero RandomX Miner and unified CryptoNight miner,C++,https://github.com/fireice-uk/xmr-stak,5.28 MB
718,velox,4070,1469,4070,1450,23/07/2021,05/03/2026,237.75 MB,A composable and fully extensible C++ execution engine library for data management systems.,C++,https://github.com/facebookincubator/velox,237.75 MB
719,fivem,4065,2565,4065,700,16/01/2017,02/03/2026,414.02 MB,"The source code for the Cfx.re modification frameworks, such as FiveM, RedM and LibertyM, as well as FXServer.",C++,https://github.com/citizenfx/fivem,414.02 MB
720,telegram-bot-api,4062,801,4062,42,04/11/2020,01/03/2026,820.00 KB,Telegram Bot API server ,C++,https://github.com/tdlib/telegram-bot-api,820.00 KB
721,cplusplus-_Implementation_Of_Introduction_to_Algorithms,4056,1050,4056,7,26/03/2016,14/03/2024,3.07 MB,《算法导论》第三版中算法的C++实现,C++,https://github.com/huaxz1986/cplusplus-_Implementation_Of_Introduction_to_Algorithms,3.07 MB
722,WebServer,4049,782,4049,72,15/06/2020,02/12/2023,56.50 MB,C++  Linux WebServer服务器,C++,https://github.com/markparticle/WebServer,56.50 MB
723,touchegg,4048,184,4048,36,16/03/2015,14/06/2025,118.84 MB,Linux multi-touch gesture recognizer,C++,https://github.com/JoseExposito/touchegg,118.84 MB
724,xla,4042,755,4042,548,09/08/2022,06/03/2026,317.59 MB,"A machine learning compiler for GPUs, CPUs, and ML accelerators",C++,https://github.com/openxla/xla,317.59 MB
725,ccls,4041,275,4041,191,31/03/2018,30/11/2025,4.74 MB,"C/C++/ObjC language server supporting cross references, hierarchies, completion and semantic highlighting",C++,https://github.com/MaskRay/ccls,4.74 MB
726,nlp_paper_study,4024,648,4024,1,18/05/2019,18/08/2023,877.88 MB,该仓库主要记录 NLP 算法工程师相关的顶会论文研读笔记,C++,https://github.com/km1994/nlp_paper_study,877.88 MB
727,ESPAsyncWebServer,4020,1367,4020,287,19/12/2015,20/01/2025,5.32 MB,Async Web Server for ESP8266 and ESP32,C++,https://github.com/me-no-dev/ESPAsyncWebServer,5.32 MB
728,ScyllaHide,4016,487,4016,53,27/01/2016,04/06/2024,6.62 MB,Advanced usermode anti-anti-debugger. Forked from https://bitbucket.org/NtQuery/scyllahide,C++,https://github.com/x64dbg/ScyllaHide,6.62 MB
729,oboe,4008,618,4008,155,02/10/2017,05/03/2026,115.67 MB,Oboe is a C++ library that makes it easy to build high-performance audio apps on Android.,C++,https://github.com/google/oboe,115.67 MB
730,heaptrack,4008,234,4008,5,18/09/2015,20/02/2026,13.65 MB,A heap memory profiler for Linux,C++,https://github.com/KDE/heaptrack,13.65 MB
731,ViGEmBus,4006,381,4006,9,28/01/2018,02/11/2023,1.37 MB,Windows kernel-mode driver emulating well-known USB game controllers.,C++,https://github.com/nefarius/ViGEmBus,1.37 MB
732,win-capture-audio,4000,211,4000,140,12/08/2021,30/01/2024,164.00 KB,"An OBS plugin that allows capture of independant application audio streams on Windows, in a similar fashion to OBS's game capture and Discord's application streaming.",C++,https://github.com/bozbez/win-capture-audio,164.00 KB
733,pubsubclient,3995,1504,3995,567,02/02/2009,14/08/2024,313.00 KB,A client library for the Arduino Ethernet Shield that provides support for MQTT.,C++,https://github.com/knolleary/pubsubclient,313.00 KB
734,lac,3988,592,3988,158,02/07/2018,25/05/2021,65.14 MB,百度NLP：分词，词性标注，命名实体识别，词重要性,C++,https://github.com/baidu/lac,65.14 MB
735,navigation2,3978,1738,3978,135,29/05/2018,05/03/2026,114.21 MB,ROS 2 Navigation Framework and System,C++,https://github.com/ros-navigation/navigation2,114.21 MB
736,aleth,3978,2162,3978,340,26/12/2013,05/03/2024,56.70 MB,"Aleth – Ethereum C++ client, tools and libraries",C++,https://github.com/ethereum/aleth,56.70 MB
737,OpenMQTTGateway,3967,858,3967,49,17/09/2016,04/03/2026,1.44 GB,"MQTT gateway for ESP8266 or ESP32 with bidirectional 433mhz/315mhz/868mhz, Infrared communications, BLE, Bluetooth, beacons detection, mi flora, mi jia, LYWSD02, LYWSD03MMC, Mi Scale, TPMS, BBQ thermometer compatibility & LoRa.",C++,https://github.com/1technophile/OpenMQTTGateway,1.44 GB
738,blynk-library,3961,1405,3961,12,24/03/2015,24/02/2026,9.82 MB,"Blynk library for IoT boards. Works with Arduino, ESP32, ESP8266, Raspberry Pi, Particle, ARM Mbed, etc.",C++,https://github.com/blynkkk/blynk-library,9.82 MB
739,SEAL,3960,759,3960,118,09/11/2018,02/04/2025,4.80 MB,Microsoft SEAL is an easy-to-use and powerful homomorphic encryption library.,C++,https://github.com/microsoft/SEAL,4.80 MB
740,StarSpace,3958,527,3958,56,28/06/2017,04/12/2022,3.04 MB,"Learning embeddings for classification, retrieval and ranking.",C++,https://github.com/facebookresearch/StarSpace,3.04 MB
741,oneDNN,3957,1110,3957,147,09/05/2016,06/03/2026,215.56 MB,oneAPI Deep Neural Network Library (oneDNN),C++,https://github.com/uxlfoundation/oneDNN,215.56 MB
742,motion,3957,550,3957,1,14/06/2014,04/03/2026,10.66 MB,"Motion, a software motion detector.     Home page:  https://motion-project.github.io/",C++,https://github.com/Motion-Project/motion,10.66 MB
743,lyra,3949,368,3949,86,19/03/2021,20/08/2024,19.86 MB,A Very Low-Bitrate Codec for Speech Compression,C++,https://github.com/google/lyra,19.86 MB
744,gpu.cpp,3945,188,3945,9,30/05/2024,08/10/2025,6.44 MB,A lightweight library for portable low-level GPU computation using WebGPU. ,C++,https://github.com/AnswerDotAI/gpu.cpp,6.44 MB
745,flamingo,3944,1463,3944,20,25/05/2017,22/07/2024,37.11 MB,flamingo 一款高性能轻量级开源即时通讯软件,C++,https://github.com/balloonwj/flamingo,37.11 MB
746,angle,3941,710,3941,4,26/08/2014,05/03/2026,194.31 MB,"A conformant OpenGL ES implementation for Windows, Mac, Linux, iOS and Android.",C++,https://github.com/google/angle,194.31 MB
747,btfs,3939,147,3939,17,26/07/2015,17/02/2026,158.00 KB,A bittorrent filesystem based on FUSE.,C++,https://github.com/johang/btfs,158.00 KB
748,easyloggingpp,3933,948,3933,303,23/09/2012,06/07/2025,30.32 MB,"C++ logging library. It is powerful, supports asynchronous low latency, extendable, light-weight, fast performing, thread and type safe and consists of many built-in features. It provides ability to write logs in your own customized format. It also provide support for logging your classes, third-party libraries, STL and third-party containers etc.",C++,https://github.com/abumq/easyloggingpp,30.32 MB
749,NumCpp,3930,579,3930,6,07/02/2018,04/12/2025,125.00 MB,C++ implementation of the Python Numpy library,C++,https://github.com/dpilger26/NumCpp,125.00 MB
750,USearch,3927,294,3927,99,22/02/2023,02/03/2026,4.97 MB,"Fast Open-Source Search & Clustering engine × for Vectors & Arbitrary Objects × in C++, C, Python, JavaScript, Rust, Java, Objective-C, Swift, C#, GoLang, and Wolfram 🔍",C++,https://github.com/unum-cloud/USearch,4.97 MB
751,drake,3923,1349,3923,710,26/01/2014,05/03/2026,410.78 MB,Model-based design and verification for robotics.,C++,https://github.com/RobotLocomotion/drake,410.78 MB
752,SourceCodeSyntaxHighlight,3918,94,3918,82,20/10/2019,30/11/2025,61.42 MB,Quick Look extension for highlight source code files on macOS 10.15 and later.,C++,https://github.com/sbarex/SourceCodeSyntaxHighlight,61.42 MB
753,ricochet,3917,421,3917,181,07/07/2010,30/12/2021,2.85 MB,Anonymous peer-to-peer instant messaging,C++,https://github.com/ricochet-im/ricochet,2.85 MB
754,scribe,3915,776,3915,51,02/04/2009,27/08/2020,2.21 MB,Scribe is a server for aggregating log data streamed in real time from a large number of servers.,C++,https://github.com/facebookarchive/scribe,2.21 MB
755,mapnik,3911,836,3911,722,11/10/2011,05/03/2026,172.61 MB,Mapnik is an open source toolkit for developing mapping applications,C++,https://github.com/mapnik/mapnik,172.61 MB
756,i2pd,3907,480,3907,167,01/09/2013,05/03/2026,16.52 MB, 🛡 I2P: End-to-End encrypted and anonymous Internet,C++,https://github.com/PurpleI2P/i2pd,16.52 MB
757,sumo,3903,1703,3903,2905,27/10/2017,05/03/2026,1.36 GB,"Eclipse SUMO is an open source, highly portable, microscopic and continuous traffic simulation package designed to handle large networks. It allows for intermodal simulation including pedestrians and comes with a large set of tools for scenario creation.",C++,https://github.com/eclipse-sumo/sumo,1.36 GB
758,openthread,3902,1146,3902,158,08/04/2016,05/03/2026,120.43 MB,OpenThread released by Google is an open-source implementation of the Thread networking protocol,C++,https://github.com/openthread/openthread,120.43 MB
759,openMVS,3897,958,3897,373,18/05/2015,03/03/2026,4.82 MB,open Multi-View Stereo reconstruction library,C++,https://github.com/cdcseacave/openMVS,4.82 MB
760,srsRAN_4G,3892,1256,3892,334,06/12/2013,26/01/2026,66.50 MB,Open source SDR 4G software suite from Software Radio Systems (SRS) https://docs.srsran.com/projects/4g,C++,https://github.com/srsran/srsRAN_4G,66.50 MB
761,ton,3883,1468,3883,247,07/09/2019,04/03/2026,35.73 MB,Main TON monorepo,C++,https://github.com/ton-blockchain/ton,35.73 MB
762,input-overlay,3883,295,3883,22,11/08/2017,02/03/2026,109.57 MB,"Show keyboard, gamepad and mouse input on stream",C++,https://github.com/univrsal/input-overlay,109.57 MB
763,spring,3876,865,3876,2,22/12/2008,31/03/2024,158.21 MB,A powerful free cross-platform RTS game engine. - Report issues at https://springrts.com/mantis/,C++,https://github.com/spring/spring,158.21 MB
764,RmlUi,3874,402,3874,46,15/06/2018,21/02/2026,22.54 MB,RmlUi - The HTML/CSS User Interface library evolved,C++,https://github.com/mikke89/RmlUi,22.54 MB
765,oclint,3871,495,3871,15,14/12/2012,23/02/2026,1.84 MB,"A static source code analysis tool to improve quality and reduce defects for C, C++ and Objective-C",C++,https://github.com/oclint/oclint,1.84 MB
766,OpenRGB,3862,313,3862,24,27/05/2019,05/03/2026,59.07 MB,"Open source RGB lighting control that doesn't depend on manufacturer software. Supports Windows, Linux, MacOS.  Mirror of https://gitlab.com/CalcProgrammer1/OpenRGB.  Releases can be found on GitLab.",C++,https://github.com/CalcProgrammer1/OpenRGB,59.07 MB
767,BehaviorTree.CPP,3862,810,3862,30,16/10/2018,11/02/2026,11.80 MB,Behavior Trees Library in C++. Batteries included.,C++,https://github.com/BehaviorTree/BehaviorTree.CPP,11.80 MB
768,apkstudio,3856,633,3856,3,09/09/2014,05/01/2026,15.11 MB,"Open-source, cross platform Qt6 based IDE for reverse-engineering Android application packages. It features a friendly IDE-like layout including code editor with syntax highlighting support for *.smali code files.",C++,https://github.com/vaibhavpandeyvpz/apkstudio,15.11 MB
769,TWiLightMenu,3837,208,3837,229,06/05/2017,05/03/2026,446.88 MB,DSi Menu replacement for DS/DSi/3DS/2DS,C++,https://github.com/DS-Homebrew/TWiLightMenu,446.88 MB
770,stairspeedtest-reborn,3837,641,3837,60,01/08/2019,08/06/2023,33.29 MB,Proxy performance batch tester based on Shadowsocks(R) and V2Ray,C++,https://github.com/tindy2013/stairspeedtest-reborn,33.29 MB
771,cherrytree,3828,505,3828,918,22/03/2015,10/02/2026,77.09 MB,cherrytree,C++,https://github.com/giuspen/cherrytree,77.09 MB
772,cppcoro,3824,501,3824,113,20/03/2017,09/01/2024,852.00 KB,A library of C++ coroutine abstractions for the coroutines TS,C++,https://github.com/lewissbaker/cppcoro,852.00 KB
773,RawTherapee,3824,376,3824,1014,11/08/2015,02/03/2026,197.58 MB,A powerful cross-platform raw photo processing program,C++,https://github.com/RawTherapee/RawTherapee,197.58 MB
774,kungfu,3822,1206,3822,11,15/11/2017,02/05/2024,170.18 MB,Kungfu Trader,C++,https://github.com/kungfu-origin/kungfu,170.18 MB
775,crossdesk,3821,356,3821,19,20/11/2023,05/03/2026,49.27 MB,"A lightweight, cross-platform remote desktop software with support for Web Client access | 一款支持 Web 客户端访问的轻量级跨平台远程桌面软件。",C++,https://github.com/kunkundi/crossdesk,49.27 MB
776,turbopilot,3805,125,3805,18,09/04/2023,30/09/2023,2.60 MB,Turbopilot is an open source large-language-model based code completion engine that runs locally on CPU,C++,https://github.com/ravenscroftj/turbopilot,2.60 MB
777,halley,3804,172,3804,45,28/09/2015,05/03/2026,47.86 MB,A lightweight game engine written in modern C++,C++,https://github.com/amzeratul/halley,47.86 MB
778,ImGuizmo,3804,1044,3804,133,16/08/2016,27/12/2025,5.08 MB,Immediate mode 3D gizmo for scene editing and other controls based on Dear Imgui,C++,https://github.com/CedricGuillemet/ImGuizmo,5.08 MB
779,Riskfolio-Lib,3801,609,3801,0,02/03/2020,05/03/2026,179.83 MB,Portfolio Optimization and Quantitative Strategic Asset Allocation in Python,C++,https://github.com/dcajasn/Riskfolio-Lib,179.83 MB
780,Karabiner-archived,3796,299,3796,112,17/04/2011,01/03/2020,21.11 MB,Karabiner (KeyRemap4MacBook) is a powerful utility for keyboard customization.,C++,https://github.com/pqrs-org/Karabiner-archived,21.11 MB
