Ranking,Project Name,Stars,Forks,Watchers,Open Issues,Created At,Last Commit,Size,Size (KB),Description,Language,Repo URL
285,breatheco-de,1973,2387,1973,2263,30/11/2018,24/07/2025,84.76 MB,86793,,CSS,https://github.com/breatheco-de/breatheco-de
286,programmer-book,1957,277,1957,1,09/08/2019,21/04/2022,23.25 MB,23808,公众号：普通程序员,CSS,https://github.com/abc-club/programmer-book
287,Terminus2049.github.io,1948,349,1948,54,27/04/2018,16/12/2023,29.58 MB,30286,No more 404,CSS,https://github.com/Terminus2049/Terminus2049.github.io
288,PythonBooks,1944,722,1944,8,26/08/2012,03/02/2021,6.75 MB,6917,Directory of free Python ebooks,CSS,https://github.com/revolunet/PythonBooks
289,dotnetcore-microservices-poc,1941,686,1941,8,26/09/2018,16/09/2025,2.97 MB,3046,Very simplified insurance sales system made in a microservices architecture using .NET Core,CSS,https://github.com/asc-lab/dotnetcore-microservices-poc
290,Obsidian-Homepage,1940,168,1940,9,23/12/2021,29/08/2024,74.72 MB,76509,A dashboard for your obsidian vault.,CSS,https://github.com/Rainbell129/Obsidian-Homepage
291,csszengarden.com,1925,586,1925,9,03/05/2013,14/07/2024,67.53 MB,69153,The source of csszengarden.com,CSS,https://github.com/mezzoblue/csszengarden.com
292,onebot,1921,165,1921,3,08/08/2020,06/07/2023,1.33 MB,1359,OneBot：统一的聊天机器人应用接口标准,CSS,https://github.com/botuniverse/onebot
293,system24,1919,123,1919,38,08/06/2024,31/10/2025,5.98 MB,6127,a tui-style discord theme,CSS,https://github.com/refact0r/system24
294,matcha,1912,48,1912,18,09/05/2024,13/09/2025,1.40 MB,1431,🍵 Drop-in semantic styling library in pure CSS. Highly customizable and perfect for simple websites and prototyping web apps!,CSS,https://github.com/lowlighter/matcha
295,fancyInput,1911,279,1911,10,19/02/2013,10/04/2018,598.00 KB,598,Makes typing in input fields fun with CSS3 effects,CSS,https://github.com/yairEO/fancyInput
296,cs16.css,1910,42,1910,0,22/01/2025,06/02/2025,123.00 KB,123,CSS library based on Counter Strike 1.6 UI.,CSS,https://github.com/ekmas/cs16.css
297,ct,1896,50,1896,6,06/01/2021,21/06/2023,1.00 MB,1029,Let’s take a look inside your <head>…,CSS,https://github.com/csswizardry/ct
298,smartping,1883,338,1883,50,24/03/2017,18/07/2023,2.22 MB,2272,综合性网络质量(PING)检测工具，支持正/反向PING绘图、互PING拓扑绘图与报警、全国PING延迟地图与在线检测工具等功能 ,CSS,https://github.com/smartping/smartping
299,hexo-theme-ayer,1866,298,1866,22,03/12/2019,11/12/2024,5.21 MB,5336,一个干净优雅的hexo主题 A clean and elegant theme for Hexo.  🐋,CSS,https://github.com/shen-yu/hexo-theme-ayer
300,simple-line-icons,1866,836,1866,31,22/09/2014,14/08/2025,1.50 MB,1541,Simple and Minimal Line Icons,CSS,https://github.com/thesabbir/simple-line-icons
301,simplefox,1860,114,1860,6,07/06/2020,24/04/2022,19.20 MB,19663,A Userstyle theme for Firefox minimalist and Keyboard centered.,CSS,https://github.com/migueravila/simplefox
302,amplify,1859,163,1859,3,14/03/2016,18/03/2024,729.00 KB,729,A Jekyll html theme in the vague style of Medium.com built using Google AMP,CSS,https://github.com/ageitgey/amplify
303,awesome-product-management,1844,161,1844,27,04/03/2019,01/09/2025,41.20 MB,42192,🚀 A curated list of awesome resources for product/program managers to learn and grow.,CSS,https://github.com/dend/awesome-product-management
304,liftkit,1836,40,1836,18,09/04/2025,15/11/2025,8.11 MB,8305,Components from design to production,CSS,https://github.com/Chainlift/liftkit
305,stylestats,1820,64,1820,5,25/02/2014,02/05/2018,483.00 KB,483,StyleStats is a library to collect CSS statistics.,CSS,https://github.com/t32k/stylestats
306,code,1816,347,1816,15,04/02/2014,01/10/2020,9.02 MB,9233,[DEPRECATED]Douban CODE,CSS,https://github.com/douban/code
307,data-engineering-wiki,1816,222,1816,16,04/05/2021,30/09/2025,8.07 MB,8262,The best place to learn data engineering. Built and maintained by the data engineering community.,CSS,https://github.com/data-engineering-community/data-engineering-wiki
308,flakes,1814,82,1814,7,22/09/2014,26/07/2016,257.00 KB,257,"Flakes is an Admin Template Framework. A combination of CSS Libraries, JavaScript Libraries and Design files that help you build business tools very quickly.",CSS,https://github.com/kumailht/flakes
309,pretty-checkbox,1811,150,1811,57,14/07/2016,14/10/2020,2.70 MB,2769,A pure CSS library to beautify checkbox and radio buttons.,CSS,https://github.com/lokesh-coder/pretty-checkbox
310,predawn,1801,159,1801,21,04/10/2013,30/10/2024,4.93 MB,5053,Predawn is a dark interface and syntax theme for Sublime Text and Atom.,CSS,https://github.com/jamiewilson/predawn
311,dropin-minimal-css,1794,53,1794,15,24/06/2016,25/07/2024,4.65 MB,4759,Drop-in switcher for previewing minimal CSS frameworks,CSS,https://github.com/dohliam/dropin-minimal-css
312,blog,1787,508,1787,34,09/03/2017,20/01/2024,4.41 MB,4518,林鑫的个人博客，用于总结平时工作和学习中的经验。,CSS,https://github.com/lin-xin/blog
313,.github,1760,229,1760,0,19/07/2018,31/10/2025,28.20 MB,28877,ApacheCN  开源组织：公告、介绍、成员、活动、交流方式,CSS,https://github.com/apachecn/.github
314,react-mdl,1759,252,1759,81,19/07/2015,01/03/2021,8.04 MB,8231,React Components for Material Design Lite,CSS,https://github.com/tleunen/react-mdl
315,Pathfinding-Visualizer,1740,506,1740,10,14/11/2016,23/09/2023,4.83 MB,4947,A visualization tool for various pathfinding algorithms.,CSS,https://github.com/clementmihailescu/Pathfinding-Visualizer
316,segment,1740,100,1740,2,24/10/2015,31/01/2018,84.00 KB,84,A JavaScript library to draw and animate SVG path strokes,CSS,https://github.com/lmgonzalves/segment
317,slack-black-theme,1733,399,1733,65,14/03/2017,30/07/2019,35.00 KB,35,"A darker, more contrasty, Slack theme.",CSS,https://github.com/widget-/slack-black-theme
318,hexo-theme-nexmoe,1733,258,1733,25,21/07/2019,10/11/2025,16.11 MB,16495,"🔥 A special Hexo theme focusing on pictures and images. Images tell stories, and Nexmoe makes them more vivid.",CSS,https://github.com/theme-nexmoe/hexo-theme-nexmoe
319,csv-to-html-table,1732,356,1732,22,13/06/2015,08/03/2024,314.00 KB,314,":arrow_down_small: Display any CSV (comma separated values) file as a searchable, filterable, pretty HTML table",CSS,https://github.com/derekeder/csv-to-html-table
320,shards-ui,1719,211,1719,27,07/11/2017,29/12/2022,2.61 MB,2671,🎨Shards is a beautiful & modern Bootstrap 4 UI kit packed with extra templates and components.,CSS,https://github.com/DesignRevision/shards-ui
321,ArcWTF,1711,27,1711,57,28/01/2024,14/11/2025,13.31 MB,13634,"A userChrome.css theme to bring Arc Browser look on Windows to Firefox. Work with Windows, Linux and macOS ✨",CSS,https://github.com/KiKaraage/ArcWTF
322,winscript,1710,107,1710,6,29/05/2024,16/11/2025,9.45 MB,9678,"Open-source tool to build your Windows script from scratch. It includes debloat, privacy, performance & app installing scripts.",CSS,https://github.com/flick9000/winscript
323,Vimix-gtk-themes,1702,114,1702,67,01/12/2016,27/07/2025,64.26 MB,65798,"Vimix is a flat Material Design theme for GTK 3, GTK 2 and Gnome-Shell etc.",CSS,https://github.com/vinceliuice/Vimix-gtk-themes
324,now-ui-kit,1696,392,1696,19,11/05/2017,26/06/2024,62.32 MB,63819,Now UI Kit Bootstrap 4 - Designed by Invision. Coded by Creative Tim,CSS,https://github.com/creativetimofficial/now-ui-kit
325,marx,1693,101,1693,13,10/04/2015,04/08/2024,1.08 MB,1108,The classless CSS reset (perfect for Communists).,CSS,https://github.com/mblode/marx
326,labs.fossasia.org,1687,246,1687,15,11/01/2015,16/11/2022,45.99 MB,47093,Projects Website for FOSSASIA http://labs.fossasia.org,CSS,https://github.com/fossasia/labs.fossasia.org
327,css-social-buttons,1682,288,1682,11,30/01/2011,08/11/2022,3.34 MB,3421,Zocial: CSS login and social buttons,CSS,https://github.com/smcllns/css-social-buttons
328,vivify,1679,150,1679,6,26/08/2017,19/07/2022,18.00 KB,18,Vivify is free CSS animation library.,CSS,https://github.com/Martz90/vivify
329,preboot,1673,164,1673,5,20/03/2011,20/01/2016,504.00 KB,504,A collection of LESS mixins and variables for writing better CSS.,CSS,https://github.com/mdo/preboot
330,angular2-rxjs-chat,1669,518,1669,40,09/09/2015,05/12/2020,2.58 MB,2639,Example Chat Application using RxJS and Angular 2,CSS,https://github.com/ng-book/angular2-rxjs-chat
331,nfqws-keenetic,1656,113,1656,15,09/08/2024,22/10/2025,1.24 MB,1269,,CSS,https://github.com/Anonym-tsk/nfqws-keenetic
332,SidebarTransitions,1650,252,1650,10,28/08/2013,05/08/2024,109.00 KB,109,Some inspiration for transition effects for off-canvas navigations.,CSS,https://github.com/codrops/SidebarTransitions
333,luxirty-search,1649,168,1649,10,07/10/2024,12/12/2024,110.00 KB,110,一个搜索引擎，基于 Google，屏蔽内容农场，无广告，无跟踪，干净，简洁，快。,CSS,https://github.com/KoriIku/luxirty-search
334,programmingfonts,1649,104,1649,11,18/11/2014,14/11/2025,81.69 MB,83650,Test drive programming fonts online: the definitive list of fonts for code.,CSS,https://github.com/braver/programmingfonts
335,bhvr,1644,77,1644,5,26/04/2025,09/08/2025,114.00 KB,114,"A monorepo template using Bun, Hono, Vite, and React",CSS,https://github.com/stevedylandev/bhvr
336,css,1644,271,1644,90,18/07/2012,12/04/2024,185.00 KB,185,CSS parser / stringifier for Node.js,CSS,https://github.com/reworkcss/css
337,HoverEffectIdeas,1642,313,1642,3,19/06/2014,17/10/2023,2.14 MB,2196,Some inspiration and modern ideas for subtle hover effects.,CSS,https://github.com/codrops/HoverEffectIdeas
338,DataScienceSpecialization.github.io,1641,2817,1641,15,13/08/2014,04/12/2020,575.00 KB,575,http://DataScienceSpecialization.github.io,CSS,https://github.com/DataScienceSpecialization/DataScienceSpecialization.github.io
339,Qogir-theme,1640,121,1640,114,22/04/2018,09/11/2025,31.79 MB,32552,Qogir is a flat Design theme for GTK,CSS,https://github.com/vinceliuice/Qogir-theme
340,Bootstrap-Admin-Theme,1633,794,1633,0,03/02/2013,10/03/2021,4.11 MB,4213,A generic admin theme built with Bootstrap free for both personal and commercial use.,CSS,https://github.com/VinceG/Bootstrap-Admin-Theme
341,flat-remix-gnome,1625,108,1625,1,28/06/2015,26/09/2025,116.77 MB,119569,"Flat Remix is a GNOME Shell theme inspired by material design. It is mostly flat using a colorful palette with some shadows, highlights, and gradients for some depth.",CSS,https://github.com/daniruiz/flat-remix-gnome
342,jquery-mobile-flat-ui-theme,1621,380,1621,14,21/03/2013,09/08/2015,1.31 MB,1341,jQuery Mobile Flat UI Theme,CSS,https://github.com/ququplay/jquery-mobile-flat-ui-theme
343,Sweet,1619,94,1619,79,09/08/2018,12/11/2025,38.70 MB,39632,Light and dark theme with neon vibes for GNOME,CSS,https://github.com/EliverLara/Sweet
344,rtail,1618,104,1618,65,26/10/2014,08/07/2020,943.00 KB,943,"rtail(1) - Terminal output to the browser in seconds, using UNIX pipes.",CSS,https://github.com/kilianc/rtail
345,gci17.fossasia.org,1606,203,1606,16,15/12/2015,19/10/2022,34.53 MB,35356,FOSSASIA Google Code-In Website 2017/18 https://gci17.fossasia.org,CSS,https://github.com/fossasia/gci17.fossasia.org
346,Golden-Grid-System,1606,276,1606,11,19/07/2011,30/08/2015,288.00 KB,288,A folding grid for responsive design.,CSS,https://github.com/jonikorpi/Golden-Grid-System
347,FlyingFox,1604,77,1604,33,17/05/2020,11/04/2023,48.63 MB,49794,An opinionated set of configurations for firefox.,CSS,https://github.com/akshat46/FlyingFox
348,dots,1604,86,1604,4,26/02/2022,06/12/2024,225.61 MB,231028,Nothing here but Dotfiles & Customization 💫,CSS,https://github.com/1amSimp1e/dots
349,How-to-Be-A-Programmer-CN,1600,205,1600,0,20/01/2016,17/12/2017,270.00 KB,270,[译]如何做好一枚程序员,CSS,https://github.com/ahangchen/How-to-Be-A-Programmer-CN
350,PaymentFont,1599,124,1599,100,21/09/2014,21/12/2017,1.53 MB,1567,A sleek webfont featuring your favourite payment methods,CSS,https://github.com/AlexanderPoellmann/PaymentFont
351,bitplay,1599,105,1599,12,18/04/2025,15/07/2025,2.80 MB,2863,Stream video torrents in your web browser with ease.,CSS,https://github.com/aculix/bitplay
352,precss,1598,77,1598,28,06/07/2015,07/01/2022,420.00 KB,420,Use Sass-like markup in your CSS,CSS,https://github.com/csstools/precss
353,Firefox-Mod-Blur,1598,75,1598,3,29/02/2020,07/11/2025,30.74 MB,31477,Firefox CSS Theme - For dark theme lovers / More compact / Modular / Blur,CSS,https://github.com/datguypiko/Firefox-Mod-Blur
354,restcookbook,1597,301,1597,16,12/12/2012,21/07/2019,1.77 MB,1815,Jekyll cms site for restcookbook.com,CSS,https://github.com/restcookbook/restcookbook
355,HyperApp-Guide,1587,323,1587,77,12/03/2017,23/06/2022,41.62 MB,42618,HyperApp user's manual ,CSS,https://github.com/waylybaye/HyperApp-Guide
356,textfox,1583,49,1583,21,11/10/2024,07/11/2025,2.53 MB,2592,firefox theme for the tui enthusiast,CSS,https://github.com/adriankarlen/textfox
357,semantic.gs,1579,244,1579,55,16/06/2011,30/10/2017,741.00 KB,741,The Semantic CSS Grid,CSS,https://github.com/tylertate/semantic.gs
358,hedy,1577,319,1577,145,09/12/2019,02/11/2025,992.20 MB,1016008,"Hedy is a gradual programming language to teach children programming. Gradual languages use different language levels, where each level adds new concepts and syntactic complexity. At the end of the Hedy level sequence, kids master a subset of syntactically valid Python.",CSS,https://github.com/hedyorg/hedy
359,juliamono,1575,33,1575,32,22/05/2020,16/10/2025,2.52 GB,2639268,"repository for JuliaMono, a monospaced font with reasonable Unicode support.",CSS,https://github.com/cormullion/juliamono
360,2012.fossasia.org,1575,75,1575,6,04/01/2015,10/07/2020,15.57 MB,15943,FOSSASIA Summit 2012 Event Site https://2012.fossasia.org,CSS,https://github.com/fossasia/2012.fossasia.org
361,2016.fossasia.org,1574,117,1574,3,17/06/2015,10/10/2020,378.53 MB,387615,FOSSASIA Summit 2016 https://2016.fossasia.org,CSS,https://github.com/fossasia/2016.fossasia.org
362,the_new_world_linux,1569,243,1569,4,04/10/2014,21/12/2018,26.75 MB,27389,"the new world, linux",CSS,https://github.com/yangyangwithgnu/the_new_world_linux
363,cascade,1567,144,1567,19,10/06/2021,02/10/2025,10.97 MB,11235,A responsive One-Line CSS Theme for Firefox,CSS,https://github.com/cascadefox/cascade
364,foundation-apps,1565,215,1565,147,12/06/2014,15/07/2018,5.25 MB,5379,The first front-end framework created for developing fully responsive web apps.,CSS,https://github.com/zurb/foundation-apps
365,sans,1564,37,1564,5,01/11/2021,19/03/2025,1.43 MB,1466,The home for our Cal Sans font.,CSS,https://github.com/calcom/sans
366,wallhaven,1558,108,1558,16,30/12/2021,14/06/2024,18.35 MB,18791,基于wallhaven.cc的一款壁纸管理工具,CSS,https://github.com/leoFitz1024/wallhaven
367,wordlists,1558,159,1558,3,16/11/2020,27/10/2025,74.88 MB,76682,Automated & Manual Wordlists provided by Assetnote,CSS,https://github.com/assetnote/wordlists
368,cutestrap,1557,77,1557,18,14/05/2016,04/01/2023,32.13 MB,32902,"A strong, independent CSS Framework. Only 2.7KB minified & gzipped. ",CSS,https://github.com/tylerchilds/cutestrap
369,2015.fossasia.org,1553,49,1553,10,03/07/2014,19/12/2022,251.68 MB,257721,FOSSASIA Summit 2015 Event Site https://2015.fossasia.org,CSS,https://github.com/fossasia/2015.fossasia.org
370,fingernft,1551,509,1551,43,21/11/2021,15/11/2022,13.66 MB,13988,FingerNFT是一款开源NFT市场，兼容Opensea、Rarible。,CSS,https://github.com/fingerchar/fingernft
371,sg18.sciencehack.asia,1549,21,1549,0,04/12/2014,08/10/2018,18.16 MB,18592,UNESCO Hackathon Website at the FOSSASIA Summit Singapore https://sg18.sciencehack.asia,CSS,https://github.com/fossasia/sg18.sciencehack.asia
372,unesco.sciencehack.asia,1547,38,1547,3,10/01/2016,28/10/2020,21.33 MB,21840,UNESCO Hackathon Website https://unesco.sciencehack.asia,CSS,https://github.com/fossasia/unesco.sciencehack.asia
373,AntSK,1546,196,1546,0,01/02/2024,06/11/2025,28.98 MB,29671,"An AI knowledge base/agent built with .Net 9, AntBlazor, Semantic Kernel, and Kernel Memory, supporting local offline AI large models. It can run offline without an internet connection. Supports Aspire for monitoring application data.",CSS,https://github.com/AIDotNet/AntSK
374,vum,1543,268,1543,48,07/06/2016,29/11/2017,3.15 MB,3226,An UI Framework build with Vue.js for mobile webapp ,CSS,https://github.com/vum-team/vum
375,fries,1543,217,1543,23,05/05/2013,13/04/2016,1.01 MB,1039,"Fries helps you prototype Android apps using HTML, CSS, and JavaScript.",CSS,https://github.com/jaunesarmiento/fries
376,adobe.github.com,1539,368,1539,46,09/03/2012,14/08/2024,7.89 MB,8077,Adobe central hub for open source,CSS,https://github.com/adobe/adobe.github.com
377,cayman-theme,1538,315,1538,0,29/03/2015,04/10/2023,78.00 KB,78,A responsive theme for GitHub Pages,CSS,https://github.com/jasonlong/cayman-theme
378,junior,1533,204,1533,11,27/12/2012,09/08/2016,708.00 KB,708,A front-end framework for building html5 mobile apps with a native look and feel.,CSS,https://github.com/justspamjustin/junior
379,bottomupcs,1532,150,1532,25,17/08/2011,26/09/2025,100.52 MB,102935,Bottom Up Computer Science,CSS,https://github.com/ianw/bottomupcs
380,sciencehack.asia,1528,8,1528,0,01/09/2015,08/10/2018,19.01 MB,19464,Science Hack Website http://sciencehack.asia,CSS,https://github.com/fossasia/sciencehack.asia
381,Perlite,1524,128,1524,17,29/05/2021,13/11/2025,74.46 MB,76243,A web-based markdown viewer optimized for Obsidian,CSS,https://github.com/secure-77/Perlite
382,0.30000000000000004,1522,171,1522,42,30/09/2012,18/05/2025,226.00 KB,226,Floating Point Math Examples,CSS,https://github.com/erikwiffin/0.30000000000000004
383,progit2-zh,1521,360,1521,3,31/10/2014,10/10/2025,184.24 MB,188662,,CSS,https://github.com/progit/progit2-zh
384,Makisu,1520,350,1520,8,18/10/2012,28/07/2022,159.00 KB,159,CSS 3D Dropdown Concept,CSS,https://github.com/soulwire/Makisu
385,marka,1517,82,1517,5,27/07/2014,25/10/2015,892.00 KB,892,Beautiful transformable icons built for the web.,CSS,https://github.com/fians/marka
386,xaringan,1517,279,1517,44,28/11/2016,18/08/2025,530.00 KB,530,Presentation Ninja 幻灯忍者 · 写轮眼,CSS,https://github.com/yihui/xaringan
387,jQuery-Parallax,1516,500,1516,16,19/10/2011,21/07/2016,1.31 MB,1338,**NO LONGER MAINTAINED** Used to recreate the Nike Better World parallax effect,CSS,https://github.com/IanLunn/jQuery-Parallax
388,VABlog,1513,277,1513,1,13/01/2021,29/04/2023,9.12 MB,9336,YUV/PCM/H264/H265/AAC/FFmpeg/Opengl. 这有丰富的音视频开发的学习资源、开发工具、优秀书籍、教程、面试题和开源项目，旨在帮助开发者和爱好者更好地学习、实践和工作。,CSS,https://github.com/xhunmon/VABlog
389,coc.fossasia.org,1509,4,1509,0,23/06/2016,11/09/2019,13.96 MB,14294,Code of Conduct http://coc.fossasia.org,CSS,https://github.com/fossasia/coc.fossasia.org
390,prism-themes,1504,494,1504,15,21/02/2015,09/12/2023,640.00 KB,640,A wider selection of Prism themes,CSS,https://github.com/PrismJS/prism-themes
391,ElementTransitions,1502,239,1502,7,06/07/2013,23/05/2016,211.00 KB,211,Simple transitions for web pages,CSS,https://github.com/dan-silver/ElementTransitions
392,2018.codeheat.org,1498,10,1498,0,29/07/2016,25/02/2020,44.62 MB,45693,Codeheat Coding Contest Website https://2018.codeheat.org,CSS,https://github.com/fossasia/2018.codeheat.org
393,calendar.fossasia.org,1496,7,1496,0,29/09/2016,12/01/2020,14.33 MB,14678,FOSSASIA Calendar Site http://calendar.fossasia.org,CSS,https://github.com/fossasia/calendar.fossasia.org
394,react-spinkit,1495,73,1495,48,11/08/2014,06/12/2022,2.95 MB,3021,A collection of loading indicators animated with CSS for React,CSS,https://github.com/KyleAMathews/react-spinkit
395,refills,1495,142,1495,0,21/11/2013,02/03/2018,99.46 MB,101849,[no longer maintained],CSS,https://github.com/thoughtbot/refills
396,asksusi,1495,36,1495,0,17/04/2017,02/06/2019,29.87 MB,30583,AskSUSI.AI Bot http://asksusi.com,CSS,https://github.com/fossasia/asksusi
397,Singularity,1493,109,1493,27,06/03/2012,03/09/2020,1.03 MB,1058,Grids without limits,CSS,https://github.com/at-import/Singularity
398,gotgithub,1493,514,1493,8,25/08/2011,01/09/2016,44.42 MB,45485,GotGitHub: an open source E-book about GitHub in Chinese,CSS,https://github.com/gotgit/gotgithub
399,csswizardry-grids,1490,202,1490,45,06/02/2013,31/01/2023,99.00 KB,99,"Simple, fluid, nestable, flexible, Sass-based, responsive grid system.",CSS,https://github.com/csswizardry/csswizardry-grids
400,MingCute,1490,50,1490,49,06/07/2021,25/12/2024,11.83 MB,12111,"Carefully Designed Icon Library. MingCute is a set of simple and exquisite open-source icon library. Whether you're a designer or a developer, it's perfect for use in web and mobile.",CSS,https://github.com/Richard9394/MingCute
401,obsidian-help,1479,438,1479,37,05/08/2020,15/11/2025,27.56 MB,28221,Help documentation for Obsidian.,CSS,https://github.com/obsidianmd/obsidian-help
402,money.js,1472,123,1472,28,11/10/2011,09/09/2022,338.00 KB,338,"money.js is a tiny (1kb) javascript currency conversion library, for web & nodeJS",CSS,https://github.com/openexchangerates/money.js
403,obsidian-modular-css-layout,1470,92,1470,52,27/03/2022,01/09/2024,87.56 MB,89663,CSS Layout hack for Obsidian.md,CSS,https://github.com/efemkay/obsidian-modular-css-layout
404,2017.codeheat.org,1470,6,1470,0,30/08/2017,05/09/2019,22.81 MB,23356,Codeheat 2017 Website http://2017.codeheat.org,CSS,https://github.com/fossasia/2017.codeheat.org
405,2016.codeheat.org,1464,4,1464,0,21/08/2017,05/09/2019,19.39 MB,19853,Codeheat Coding Contest 2016 http://2016.codeheat.org,CSS,https://github.com/fossasia/2016.codeheat.org
406,wtf-html-css,1461,83,1461,17,24/03/2014,04/03/2022,58.00 KB,58,Common reasons your HTML and CSS may be fucked.,CSS,https://github.com/mdo/wtf-html-css
407,fukol-grids,1458,54,1458,6,02/10/2016,24/02/2017,1.41 MB,1443,,CSS,https://github.com/Heydon/fukol-grids
408,Adwaita-for-Steam,1458,34,1458,17,31/07/2022,02/10/2025,7.29 MB,7470,A skin to make Steam look more like a native GNOME app,CSS,https://github.com/tkashkin/Adwaita-for-Steam
409,markdown-cv,1454,3370,1454,34,11/10/2012,27/06/2024,13.24 MB,13561,a simple template to write your CV in a readable markdown file and use CSS to publish/print it.,CSS,https://github.com/elipapa/markdown-cv
410,pills,1449,54,1449,1,12/08/2015,08/09/2016,92.00 KB,92,A simple responsive CSS Grid for humans. View Demo - ,CSS,https://github.com/rohitkrai03/pills
411,justdelete.me,1440,440,1440,149,16/08/2013,28/06/2024,7.48 MB,7662,A directory of direct links to delete your account from web services.,CSS,https://github.com/justdeleteme/justdelete.me
412,obsidian,1440,58,1440,65,31/10/2021,21/10/2024,75.08 MB,76882,"Comfy, playful but productive theme for Obsidian. ""Primary instantly puts you in a relaxed state that opens the door to creativity and exploration. Wonderfully executed down to the smallest details,""",CSS,https://github.com/primary-theme/obsidian
413,markdown-css,1437,165,1437,5,06/02/2013,02/10/2020,29.00 KB,29,CSS for making regular HTML look like plain-text markdown.,CSS,https://github.com/mrcoles/markdown-css
414,angular-busy,1431,255,1431,59,24/04/2013,27/02/2018,1.29 MB,1321,Show busy/loading indicators on any element during $http requests (or any promise).,CSS,https://github.com/cgross/angular-busy
415,Blue-Topaz_Obsidian-css,1428,94,1428,118,01/10/2020,14/07/2025,185.56 MB,190017,A blue theme for Obsidian. ,CSS,https://github.com/PKM-er/Blue-Topaz_Obsidian-css
416,AWSConsoleRecorder,1427,90,1427,29,02/10/2018,24/01/2021,9.69 MB,9918,Records actions made in the AWS Management Console and outputs the equivalent CLI/SDK commands and CloudFormation/Terraform templates.,CSS,https://github.com/iann0036/AWSConsoleRecorder
417,nows,1419,338,1419,34,18/09/2019,30/08/2022,91.00 KB,91,毒鸡汤,CSS,https://github.com/egotong/nows
418,leopardpan.github.io,1417,842,1417,53,29/03/2016,06/09/2023,20.38 MB,20865,个人博客，看效果进入,CSS,https://github.com/leopardpan/leopardpan.github.io
419,kissui.scrollanim,1417,129,1417,7,30/07/2016,25/03/2017,67.00 KB,67,CSS3 scroll animation library,CSS,https://github.com/usablica/kissui.scrollanim
420,starability,1417,206,1417,11,16/05/2016,27/02/2023,650.00 KB,650,Accessible rating forms with cute animations on top.,CSS,https://github.com/LunarLogic/starability
421,pesticide,1415,140,1415,30,04/11/2013,10/11/2021,5.27 MB,5396,Kill your css layout bugs,CSS,https://github.com/mrmrs/pesticide
422,microtip,1398,73,1398,28,18/04/2017,10/08/2023,376.00 KB,376,"💬  Minimal, accessible, ultra lightweight css tooltip library. Just 1kb.",CSS,https://github.com/ghosh/microtip
423,2015.opentechsummit.de,1390,1,1390,0,18/05/2015,30/07/2019,750.22 MB,768227,Website of OpenTechSummit 2015 http://2015.opentechsummit.de,CSS,https://github.com/OpnTec/2015.opentechsummit.de
424,opentechsummit.de,1389,2,1389,0,22/06/2014,20/05/2024,283.68 MB,290484,OpenTechSummit Germany https://opentechsummit.de,CSS,https://github.com/OpnTec/opentechsummit.de
425,2016.opentechsummit.de,1387,9,1387,0,20/07/2015,30/07/2019,974.15 MB,997525,Website of OpenTechSummit 2016 http://2016.opentechsummit.de,CSS,https://github.com/OpnTec/2016.opentechsummit.de
426,2017.opentechsummit.de,1386,3,1386,0,19/05/2016,30/07/2019,463.65 MB,474776,OpenTechSummit 2017 http://2017.opentechsummit.de,CSS,https://github.com/OpnTec/2017.opentechsummit.de
427,2018.opentechsummit.de,1386,3,1386,2,21/05/2017,30/07/2019,467.16 MB,478375,OpenTechSummit 2018 http://2018.opentechsummit.de,CSS,https://github.com/OpnTec/2018.opentechsummit.de
428,thai.opentechsummit.asia,1376,14,1376,7,24/11/2017,15/01/2020,86.72 MB,88802,OpenTechSummit Thailand 2019 https://thai.opentechsummit.asia,CSS,https://github.com/OpnTec/thai.opentechsummit.asia
