Ranking,Project Name,Stars,Forks,Watchers,Open Issues,Created At,Last Commit,Size,Size (KB),Description,Language,Repo URL
573,thesixsectorTeam,992,270,992,43,05/12/2019,17/12/2023,9.47 MB,9694,,CSS,https://github.com/canxin0523/thesixsectorTeam
574,china_school_badge,990,42,990,8,11/05/2020,04/03/2025,11.75 MB,12033,全国高校校徽字体图标库,CSS,https://github.com/lovefc/china_school_badge
575,gopher,988,231,988,12,31/08/2012,12/12/2023,9.31 MB,9533,Golang-China(golangtc.com) Website,CSS,https://github.com/jimmykuu/gopher
576,tablecloth,987,123,987,11,30/04/2012,26/09/2013,242.00 KB,242,A CSS and JS bootstrap to style and manipulate data tables,JavaScript,https://github.com/bwsewell/tablecloth
577,jekyll-theme-hpstr,980,1421,980,30,23/08/2013,27/08/2019,3.51 MB,3594,A Jekyll theme with some tumble-log tendencies.,CSS,https://github.com/mmistakes/jekyll-theme-hpstr
578,dotfiles,975,74,975,0,15/01/2021,04/05/2025,273.60 MB,280162,dotfiles for my beautiful rices! (OUTDATED BUT WORKS),CSS,https://github.com/siduck/dotfiles
579,lemmy-ui,972,367,972,45,23/08/2020,17/11/2025,13.26 MB,13576,The official web app for lemmy.,CSS,https://github.com/LemmyNet/lemmy-ui
580,examples,971,199,971,19,02/11/2015,18/05/2020,116.00 KB,116,"OBSOLETE. This repo was for Caddy v1. For v2 and newer, see our forum's wiki category.",CSS,https://github.com/caddyserver/examples
581,pluralsight-ddd-fundamentals,969,340,969,5,07/02/2021,17/03/2025,22.00 MB,22525,"Sample code for the Pluralsight DDD Fundamentals course by Julie Lerman and Steve ""ardalis"" Smith",CSS,https://github.com/ardalis/pluralsight-ddd-fundamentals
582,webcron,965,383,965,35,24/12/2015,30/06/2022,4.46 MB,4567,定时任务管理器,CSS,https://github.com/lisijie/webcron
583,JSONFeed,965,59,965,73,14/05/2017,09/09/2025,120.00 KB,120,The JSONFeed.org website,CSS,https://github.com/manton/JSONFeed
584,soundcleod,964,102,964,55,17/01/2013,29/04/2022,59.96 MB,61400,SoundCloud for macOS and Windows,CSS,https://github.com/salomvary/soundcleod
585,repaintless,961,43,961,4,18/02/2016,24/01/2021,114.00 KB,114,Library for fast CSS Animations,CSS,https://github.com/szynszyliszys/repaintless
586,TextInputEffects,961,170,961,3,08/01/2015,19/03/2017,304.00 KB,304,Simple styles and effects for enhancing text input interactions.,CSS,https://github.com/codrops/TextInputEffects
587,hugo-theme-jane,961,291,961,67,06/03/2018,01/09/2025,4.28 MB,4382,"A readable & concise theme for Hugo, color schemes to choose, easy to personalize. Working well since 2018.",CSS,https://github.com/xianmin/hugo-theme-jane
588,octocat.github.io,959,473,959,237,18/03/2014,11/08/2024,335.00 KB,335,,CSS,https://github.com/octocat/octocat.github.io
589,typora-vue-theme,958,180,958,17,30/05/2018,01/06/2023,340.00 KB,340,This is a typora theme inspired by Vue document style. 一个类似于 Vue 文档风格的 Typora Markdown 编辑器主题。,CSS,https://github.com/blinkfox/typora-vue-theme
590,spcss,956,32,956,7,29/11/2020,08/01/2024,38.00 KB,38,"A simple, minimal, classless stylesheet for simple HTML pages",CSS,https://github.com/susam/spcss
591,angled-edges,956,43,956,1,13/06/2016,04/01/2019,527.00 KB,527,:triangular_ruler: Quickly create angled section edges using only Sass,CSS,https://github.com/josephfusco/angled-edges
592,sassaparilla,955,141,955,3,02/02/2013,05/06/2014,3.12 MB,3192,Start your web projects fast with Sassaparilla,CSS,https://github.com/fffunction/sassaparilla
593,less.ruby,953,69,953,93,03/05/2009,18/09/2013,1008.00 KB,1008,Less Ruby — now at http://github.com/cowboyd/less.rb,CSS,https://github.com/less/less.ruby
594,stackicons,952,114,952,14,20/02/2014,23/04/2018,1.88 MB,1926,"Icon font and Sass-based construction kit for Stackicons-Social, which supports multiple button shapes and a unique ""multi-color"" option in CSS for over 60 social brands.",CSS,https://github.com/parkerbennett/stackicons
595,bootstrap-rtl,950,410,950,46,15/05/2014,08/01/2020,3.52 MB,3604,RTL Theme for Bootstrap v3.x,CSS,https://github.com/morteza/bootstrap-rtl
596,DSEG,949,66,949,10,02/01/2017,05/12/2023,4.81 MB,4924,7-segment and 14-segment font 7セグ・14セグフォント,CSS,https://github.com/keshikan/DSEG
597,kolibri,948,829,948,412,19/01/2016,17/11/2025,140.99 MB,144372,Kolibri Learning Platform: the offline app for universal education,CSS,https://github.com/learningequality/kolibri
598,themes,948,368,948,1613,23/01/2018,17/02/2025,863.23 MB,883943,Free WordPress themes made by Automattic for WordPress.org and WordPress.com.,CSS,https://github.com/Automattic/themes
599,breaking-and-pwning-apps-and-servers-aws-azure-training,944,260,944,1,09/04/2020,26/11/2022,25.30 MB,25908,"Course content, lab setup instructions and documentation of our very popular Breaking and Pwning Apps and Servers on AWS and Azure hands on training!",CSS,https://github.com/appsecco/breaking-and-pwning-apps-and-servers-aws-azure-training
600,CssGitHubWindows,940,33,940,15,04/07/2018,12/04/2019,177.00 KB,177,(UserStyle) GitHub Windows Edition [MIT],CSS,https://github.com/Athari/CssGitHubWindows
601,react-daily-ui,936,329,936,4,09/09/2016,11/09/2017,42.80 MB,43825,100 Days of React UI Interfaces - https://codepen.io/collection/DoLZRm/4/,CSS,https://github.com/fullstackreact/react-daily-ui
602,jekyll-theme-H2O,936,540,936,28,18/04/2017,27/02/2023,4.47 MB,4573, 🎉 A clean and delicate Jekyll theme. Jekyll博客主题,CSS,https://github.com/kaeyleo/jekyll-theme-H2O
603,halo-theme-sakura,936,149,936,37,31/05/2020,03/06/2025,19.63 MB,20103,Halo 版本的樱花🌸主题,CSS,https://github.com/LIlGG/halo-theme-sakura
604,api-spec,936,99,936,102,17/07/2012,04/04/2014,17.00 MB,17404,"App.net API Documentation is on the web at https://developers.app.net. Source for these docs is in the new-docs branch here. Please use the issue tracker and submit pull requests! Help us build the real-time social service where users and developers come first, not advertisers.",CSS,https://github.com/appdotnet/api-spec
605,Mobirise,933,492,933,6,15/05/2015,16/09/2025,126.60 MB,129640,"AI Website Builder, Open Source, Bootstrap 5",CSS,https://github.com/Mobirise/Mobirise
606,arc-firefox-theme,932,48,932,58,19/08/2015,27/08/2019,3.45 MB,3530,Arc Firefox Theme,CSS,https://github.com/horst3180/arc-firefox-theme
607,NotificationStyles,929,120,929,6,23/07/2014,05/03/2018,74.00 KB,74,Various simple ideas and effects for unobtrusive notifications on a website.,CSS,https://github.com/codrops/NotificationStyles
608,bigfoot,927,77,927,30,12/11/2013,03/01/2019,351.00 KB,351,A jQuery plugin for creating exceptional footnotes.,CSS,https://github.com/lemonmade/bigfoot
609,blurredfox,926,43,926,25,20/05/2020,27/06/2023,6.12 MB,6270,"A sleek, modern and elegant Firefox CSS theme",CSS,https://github.com/eromatiya/blurredfox
610,ElegantFin,926,66,926,42,01/12/2024,15/11/2025,141.59 MB,144992,A Jellyfin theme inspired from Jellyseerr. This theme improves the overall look and experience with various little fixes to the UI/UX.,CSS,https://github.com/lscambo13/ElegantFin
611,react-zmage,926,95,926,59,26/10/2017,16/11/2025,13.90 MB,14229,一个基于 React 的可缩放图片控件 | A scalable image wrapper power by react,CSS,https://github.com/Caldis/react-zmage
612,MERN_Stack_Project_Ecommerce_Hayroo,924,457,924,0,07/08/2020,15/11/2025,1.37 MB,1404,E-commerce Website | Payment gateway | Reactjs | Nodejs | Mongodb | Expressjs | JWT | Tailwind Css,CSS,https://github.com/hasan-py/MERN_Stack_Project_Ecommerce_Hayroo
613,glass-website,924,601,924,16,15/01/2021,12/05/2024,109.00 KB,109,,CSS,https://github.com/developedbyed/glass-website
614,css-spinners,923,153,923,7,10/05/2013,30/12/2019,175.00 KB,175,Simple CSS spinners and throbbers made with CSS and minimal HTML markup.,CSS,https://github.com/jlong/css-spinners
615,springboot-starterkit,917,461,917,3,21/02/2019,15/09/2020,10.36 MB,10605,Starter Kit for Spring Boot based (REST APIs and WebMVC) micro services.,CSS,https://github.com/khandelwal-arpit/springboot-starterkit
616,shinydashboard,916,298,916,163,11/11/2014,22/04/2025,5.30 MB,5423,Shiny Dashboarding framework,CSS,https://github.com/rstudio/shinydashboard
617,reverie,915,197,915,111,07/11/2011,20/12/2016,3.32 MB,3399,Reverie is a versatile HTML5 responsive WordPress framework based on ZURB's Foundation.,CSS,https://github.com/milohuang/reverie
618,chfsgui,915,147,915,25,21/03/2018,24/09/2018,23.17 MB,23726,This is just a GUI WRAPPER for chfs(cute http file server),CSS,https://github.com/docblue/chfsgui
619,azuredevopslabs,914,1006,914,142,31/01/2017,04/03/2025,565.93 MB,579516,"Learn how you can plan smartly, collaborate better, and ship faster with a set of modern development services with Azure DevOps.",CSS,https://github.com/microsoft/azuredevopslabs
620,project-hub,913,170,913,2,19/09/2013,13/10/2019,368.00 KB,368,An HTML template for project timelines,CSS,https://github.com/bradfrost/project-hub
621,mbmit.github.io,911,0,911,0,24/11/2017,20/01/2018,1.50 MB,1531,Website at http://mbmit.com,CSS,https://github.com/MBMIT/mbmit.github.io
622,Rpg-Awesome,911,53,911,50,06/01/2015,15/07/2021,1.55 MB,1584,A fantasy themed font and CSS toolkit.,CSS,https://github.com/nagoshiashumari/Rpg-Awesome
623,anicollection,910,67,910,1,11/03/2015,30/10/2015,354.00 KB,354,"The easiest way to find, use and share animations. Priceless!",CSS,https://github.com/anicollection/anicollection
624,rodal,910,85,910,7,28/08/2015,01/08/2023,1.80 MB,1844,A React modal with animations.,CSS,https://github.com/chenjiahan/rodal
625,diy-ipmi,907,99,907,30,13/09/2017,06/11/2018,2.61 MB,2672,A DIY IPMI / IP KVM system utilizing the Raspberry Pi,CSS,https://github.com/Fmstrat/diy-ipmi
626,toolkit,906,68,906,14,19/06/2012,07/12/2016,1.13 MB,1159,Toolkit for Responsive Web Design and Progressive Enhancement with Compass,CSS,https://github.com/at-import/toolkit
627,tomono,902,138,902,4,11/01/2016,01/09/2025,196.00 KB,196,Multi- To Mono-repository merge,CSS,https://github.com/hraban/tomono
628,html-website-templates,900,801,900,17,17/01/2019,25/04/2024,17.04 MB,17452,Free static HTML website templates created using the Slides - https://designmodo.com/slides/,CSS,https://github.com/designmodo/html-website-templates
629,fossasia-jekyll-theme,895,5,895,0,05/12/2018,10/12/2018,27.34 MB,27996,Jekyll Theme for FOSSASIA blogs,CSS,https://github.com/fossasia/fossasia-jekyll-theme
630,minimal-light,895,796,895,10,08/04/2020,12/11/2025,643.00 KB,643,A simple and elegant Jekyll theme for an academic personal homepage,CSS,https://github.com/yaoyao-liu/minimal-light
631,hass-config-public,895,69,895,16,20/05/2022,01/08/2023,5.94 MB,6081,"My Dashboards for Home Assistant - Advanced data visualizations, responsive design, a neat maximalist Metro Live Tile layout, and an ultraminimal tablet layout!",CSS,https://github.com/Madelena/hass-config-public
632,obsidian-hub,893,172,893,66,14/09/2021,12/11/2025,34.38 MB,35205,Resource hub for Obsidian resources.,CSS,https://github.com/obsidian-community/obsidian-hub
633,SinglePaged,892,1163,892,27,19/09/2014,13/05/2024,2.21 MB,2262,SinglePaged - Simple Jekyll template,CSS,https://github.com/t413/SinglePaged
634,flat-remix-gtk,891,74,891,20,17/02/2018,30/07/2024,79.22 MB,81126,"Flat Remix is a GTK application theme inspired by material design. It is mostly flat using a colorful palette with some shadows, highlights, and gradients for some depth.",CSS,https://github.com/daniruiz/flat-remix-gtk
635,clank,891,80,891,22,20/05/2013,03/09/2022,6.10 MB,6246,Clank: open source prototyping framework for mobile apps,CSS,https://github.com/Wolfr/clank
636,bash-style-guide,890,95,890,1,26/08/2014,08/06/2025,39.00 KB,39,"A style guide for writing safe, predictable, and portable bash scripts (not sh!)",CSS,https://github.com/bahamas10/bash-style-guide
637,hugo-universal-theme,888,602,888,56,14/06/2016,15/11/2025,11.67 MB,11953,"Universal theme for Hugo, it stands out with its clean design and elegant typography.",CSS,https://github.com/devcows/hugo-universal-theme
638,constitution,887,70,887,0,19/04/2014,13/03/2021,61.00 KB,61,中华人民共和国宪法,CSS,https://github.com/cn/constitution
639,Simple-Grid,885,118,885,18,09/04/2016,30/01/2024,15.00 KB,15,"A simple, lightweight CSS grid",CSS,https://github.com/zachacole/Simple-Grid
640,jquery-labelauty,882,113,882,7,31/08/2013,11/10/2017,133.00 KB,133,A lightweight and beautiful jQuery plugin for radio and checkbox inputs.,CSS,https://github.com/fntneves/jquery-labelauty
641,obsidian-snippets,882,140,882,10,05/01/2021,12/02/2024,804.00 KB,804,,CSS,https://github.com/deathau/obsidian-snippets
642,52bp.github.io,880,41,880,7,29/03/2020,26/10/2025,5.89 MB,6029,52BP机场导航，提供免费、付费、半公益、高端付费、老牌的SS/SSR/V2Ray/Trojan机场导航推荐，自2020起稳定提供导航服务，是追求稳定机场的最佳选择。记得点击⭐️⭐️==不迷路,CSS,https://github.com/52bp/52bp.github.io
643,tradingViewWikiCn,880,227,880,1,26/08/2017,05/05/2023,2.97 MB,3038,tradingView的中文开发文档,CSS,https://github.com/zlq4863947/tradingViewWikiCn
644,lavalamp.js,879,33,879,6,03/11/2014,09/03/2016,2.58 MB,2643,A replacement for infinite scrolling.,CSS,https://github.com/jgthms/lavalamp.js
645,wally3k.github.io,879,42,879,10,02/01/2017,16/11/2025,381.00 KB,381,Repo for Firebog hosting,CSS,https://github.com/WaLLy3K/wally3k.github.io
646,obsidian-things,873,73,873,59,26/10/2021,18/03/2024,2.17 MB,2223,"An Obsidian theme inspired by the beautifully-designed app, Things. ",CSS,https://github.com/colineckert/obsidian-things
647,gxmods,873,3694,873,232,09/02/2023,19/08/2025,266.57 MB,272963,Documentation for GX mods,CSS,https://github.com/opera-gaming/gxmods
648,Chromium_doc_zh,871,168,871,1,15/02/2016,02/07/2021,2.30 MB,2359,Chromium中文文档，学习google家的架构,CSS,https://github.com/ahangchen/Chromium_doc_zh
649,uno-zen,871,279,871,26,05/01/2015,12/05/2019,4.12 MB,4223,Minimalist and Elegant theme for Ghost. Demo @ https://kikobeats.com,CSS,https://github.com/Kikobeats/uno-zen
650,REVENGE.CSS,869,59,869,14,24/07/2013,18/07/2024,38.00 KB,38,A CSS bookmarklet that puts pink error boxes (with messages in comic sans) everywhere you write bad HTML.,CSS,https://github.com/Heydon/REVENGE.CSS
651,ht,869,21,869,6,05/04/2024,25/07/2025,193.00 KB,193,headless terminal - wrap any binary with a terminal interface for easy programmatic access.,CSS,https://github.com/andyk/ht
652,ghostwriter,869,361,869,14,19/09/2013,27/01/2020,584.00 KB,584,A simple AJAX driven Ghost theme.,CSS,https://github.com/roryg/ghostwriter
653,lmbtfy,867,204,867,1,16/03/2017,02/07/2025,99.00 KB,99,🔍 让我帮你百度一下？Let Me Baidu That For You,CSS,https://github.com/mengkunsoft/lmbtfy
654,select2-bootstrap-theme,867,489,867,38,02/04/2015,21/09/2022,527.00 KB,527,A Select2 v4 Theme for Bootstrap 3,CSS,https://github.com/select2/select2-bootstrap-theme
655,theme.typora.io,865,479,865,44,21/09/2016,11/11/2025,500.63 MB,512644,Website for Typora themes,CSS,https://github.com/typora/theme.typora.io
656,QQ-Groups-Spider,864,353,864,2,23/07/2016,31/12/2017,6.53 MB,6689,QQ Groups Spider（QQ 群爬虫）,CSS,https://github.com/caspartse/QQ-Groups-Spider
657,twemoji-awesome,864,97,864,4,11/11/2014,31/12/2017,139.00 KB,139,"[Unmaintained] Like Font Awesome, but for Twitter Emoji",CSS,https://github.com/ellekasai/twemoji-awesome
658,Ultrachromic,863,53,863,30,15/05/2021,25/10/2025,128.00 KB,128,"The final form, the true evolution of the chromic theme saga!",CSS,https://github.com/CTalvio/Ultrachromic
659,sidebar-v2,862,335,862,45,02/08/2014,16/01/2023,2.50 MB,2556,"A responsive sidebar with tabs for Leaflet, OpenLayers, Google Maps, ...",CSS,https://github.com/Turbo87/sidebar-v2
660,ngx-spinner,860,143,860,18,20/11/2017,15/11/2025,4.65 MB,4759,A library for loading spinner for Angular 4 - 19.,CSS,https://github.com/Napster2210/ngx-spinner
661,Windows-10,859,130,859,10,01/12/2015,22/08/2025,22.01 MB,22541,Windows 10 Light theme for Linux (GTK),CSS,https://github.com/B00merang-Project/Windows-10
662,typi,859,43,859,8,06/12/2015,09/12/2022,257.00 KB,257,A sass mixin to make responsive typography easy,CSS,https://github.com/zellwk/typi
663,interges.github.io,858,1,858,0,05/08/2014,15/09/2014,608.00 KB,608,Interges Website,CSS,https://github.com/MBMIT/interges.github.io
664,sierra,858,69,858,10,10/12/2015,28/01/2022,1.12 MB,1152,Sierra SCSS library,CSS,https://github.com/sierra-library/sierra
665,VueStar,857,106,857,16,28/01/2017,17/12/2019,999.00 KB,999,:sparkles:A like button with delightful star animation powered by Vue.js,CSS,https://github.com/OYsun/VueStar
666,WeChat-Shelter,856,125,856,0,24/05/2019,30/04/2020,1.12 MB,1148,chrome插件，把网页微信伪装成云笔记~（仅供娱乐! (￣ε￣) ,CSS,https://github.com/YGYOOO/WeChat-Shelter
667,mingw-w64.github.io,856,2860,856,5,09/07/2021,24/09/2025,13.35 MB,13671,mingw-w64.net web page contents (The new web page),CSS,https://github.com/mingw-w64/mingw-w64.github.io
668,checkout-single-subscription,855,391,855,17,27/08/2019,21/11/2024,5.56 MB,5690,Learn how to combine Checkout and Billing for fast subscription pages,CSS,https://github.com/stripe-samples/checkout-single-subscription
669,the-internet,854,710,854,35,27/05/2013,20/08/2024,32.53 MB,33307,An example application that captures prominent and ugly functionality found on the web. Perfect for writing automated acceptance tests against.,CSS,https://github.com/saucelabs/the-internet
670,academicons,853,104,853,84,29/12/2014,17/09/2025,4.09 MB,4185,An icon font for academics,CSS,https://github.com/jpswalsh/academicons
671,r-ninja,851,327,851,12,19/03/2012,18/10/2022,390.00 KB,390,R语言忍者秘笈,CSS,https://github.com/yihui/r-ninja
672,big-rig,851,42,851,12,30/10/2015,08/02/2017,4.18 MB,4278,"A proof-of-concept Performance Dashboard, CLI and Node module",CSS,https://github.com/googlearchive/big-rig
673,livereload-js,849,190,849,20,29/09/2011,15/11/2025,2.63 MB,2693,LiveReload JavaScript code that communicates with the server and implements reloading,CSS,https://github.com/livereload/livereload-js
674,csstyle,848,34,848,21,11/08/2014,15/07/2020,323.00 KB,323,MOVED TO https://github.com/csstyle/csstyle     a modern approach for crafting beautifully maintainable stylesheets,CSS,https://github.com/geddski/csstyle
675,bchiang7.github.io,848,425,848,18,07/12/2016,26/01/2024,61.63 MB,63107,Third iteration of my personal website built with Jekyll,CSS,https://github.com/bchiang7/bchiang7.github.io
676,Ant,848,46,848,30,08/05/2016,15/11/2025,11.58 MB,11857,:ant:  A flat and light theme with a modern look,CSS,https://github.com/EliverLara/Ant
677,vue-tel-input,847,356,847,159,14/12/2017,16/08/2025,7.75 MB,7939,International Telephone Input with Vue,CSS,https://github.com/iamstevendao/vue-tel-input
678,localFont,845,20,845,2,02/03/2015,19/02/2016,160.00 KB,160,Implement localStorage web font caching in seconds,CSS,https://github.com/jaicab/localFont
679,maintainablecss.com-jekyll,845,61,845,2,21/03/2016,29/01/2021,4.65 MB,4757,"Write CSS without worrying that overzealous, pre-existing styles will cause problems. MaintainableCSS is an approach to writing modular, scalable and of course, maintainable CSS.",CSS,https://github.com/adamsilver/maintainablecss.com-jekyll
680,2014-talks,843,69,843,2,12/04/2014,12/08/2014,44.63 MB,45698,This is the official repository for slides and talks from GopherCon 2014,CSS,https://github.com/gophercon/2014-talks
681,touchwx,842,177,842,30,24/04/2018,06/07/2018,391.00 KB,391,小程序组件化解决方案。官网：https://www.wetouch.net/wx.html,CSS,https://github.com/uileader/touchwx
682,lcthw-zh,841,188,841,6,27/03/2016,31/10/2023,325.00 KB,325,:book: 【译】笨办法学C,CSS,https://github.com/wizardforcel/lcthw-zh
683,PushServer,841,44,841,2,28/04/2014,29/04/2014,367.00 KB,367,nodejs server for sending Apple APNS push notifications,CSS,https://github.com/jazzychad/PushServer
684,furatto,838,109,838,7,12/07/2013,18/01/2018,48.15 MB,49304,"It's a flat, fast and powerful front-end framework for  rapid web development.",CSS,https://github.com/IcaliaLabs/furatto
685,Dashboard-Designs,837,360,837,4,22/06/2023,12/07/2024,13.74 MB,14066,AsmrProg Youtube Channel Dashboard Designs Code Collection,CSS,https://github.com/AsmrProg-YT/Dashboard-Designs
686,postcss-normalize,836,39,836,3,04/07/2015,28/12/2024,225.00 KB,225,Use the parts of normalize.css (or sanitize.css) you need from your browserslist,CSS,https://github.com/csstools/postcss-normalize
687,detexify,835,52,835,19,28/05/2009,03/01/2023,6.12 MB,6263,Latex Symbol Classifier Web Frontend,CSS,https://github.com/kirel/detexify
688,adapt,834,123,834,8,15/04/2011,25/11/2020,302.00 KB,302,Adapt.js serves CSS based on screen width.,CSS,https://github.com/nathansmith/adapt
689,doxmate,834,199,834,4,27/09/2012,27/03/2019,1.51 MB,1544,文档伴侣,CSS,https://github.com/JacksonTian/doxmate
690,greyshade,833,159,833,8,25/10/2012,22/12/2015,1.21 MB,1238,A minimal responsive octopress theme,CSS,https://github.com/shashankmehta/greyshade
691,Jackwire.github.io,832,114,832,3,17/07/2019,03/05/2020,2.70 MB,2762,托福雅思GRE和GMAT资料，申请文书集合。存在百度网盘里,CSS,https://github.com/Jackwire/Jackwire.github.io
692,ar5iv,831,24,831,410,26/09/2021,06/11/2025,2.38 MB,2439,A web service offering HTML5 articles from arXiv.org as converted with latexml,CSS,https://github.com/dginev/ar5iv
693,starknetbook,830,491,830,0,05/05/2022,20/06/2024,40.02 MB,40978,Mastering Starknet. By the Starknet community,CSS,https://github.com/starknet-edu/starknetbook
694,CymChad.github.io,826,142,826,0,06/05/2016,11/07/2019,5.00 MB,5120,RecyclerView优秀文集,CSS,https://github.com/CymChad/CymChad.github.io
695,cryptocoins,823,189,823,54,13/11/2014,03/12/2019,3.77 MB,3859,Cryptocoins is the most complete vector/webfont icon pack of your favourite cryptocurrencies,CSS,https://github.com/AllienWorks/cryptocoins
696,atom-material-ui,820,202,820,29,19/06/2015,22/08/2021,2.38 MB,2437,A dynamic UI theme for Atom that follows Google's Material Design Guidelines,CSS,https://github.com/atom-material/atom-material-ui
697,logback,820,349,820,10,03/11/2017,07/06/2025,52.83 MB,54101,💡 SpringBoot+Spring Security基本配置,CSS,https://github.com/longfeizheng/logback
698,my-personal-kanban,818,183,818,1,06/06/2013,17/02/2022,6.19 MB,6340,This is a one page HTML/JavaScript application for people who would like to use simple and basic Kanban board for their personal stuff,CSS,https://github.com/greggigon/my-personal-kanban
699,eks-workshop,818,1230,818,0,07/09/2018,11/09/2025,91.09 MB,93279,AWS Workshop for Learning EKS,CSS,https://github.com/aws-samples/eks-workshop
700,HackFlowy,817,146,817,7,23/03/2013,15/03/2016,7.04 MB,7209,":notebook: Workflowy clone, built using Backbone.js & Socket.io",CSS,https://github.com/abhshkdz/HackFlowy
701,raster,816,41,816,13,16/02/2019,08/09/2022,680.00 KB,680,Raster — simple CSS grid system,CSS,https://github.com/rsms/raster
702,zuanbot.com,816,109,816,0,08/01/2022,04/08/2025,487.00 KB,487,骂人宝典（祖安语录）,CSS,https://github.com/cndiandian/zuanbot.com
703,devfreebooks.github.io,816,75,816,2,01/11/2016,04/08/2022,5.97 MB,6113,A huge collection of free books for developers,CSS,https://github.com/devfreebooks/devfreebooks.github.io
704,robot,816,180,816,11,20/07/2017,21/10/2020,238.00 KB,238,知识图谱问答机器人，聊天机器人，基于知识图谱、语义理解等的对话机器人。,CSS,https://github.com/ownthink/robot
705,scss-blend-modes,815,119,815,4,26/12/2011,01/09/2017,35.00 KB,35,Using standard color blending functions in SASS.,CSS,https://github.com/heygrady/scss-blend-modes
706,css-extras,813,15,813,0,05/10/2025,12/11/2025,106.00 KB,106,Useful CSS custom functions using the new @​function rule,CSS,https://github.com/sindresorhus/css-extras
707,slippy,813,89,813,3,02/06/2010,06/06/2018,236.00 KB,236,HTML Presentations,CSS,https://github.com/Seldaek/slippy
708,go-database-sql-tutorial,813,184,813,20,11/07/2013,16/02/2023,1.15 MB,1181,A tutorial for Go's database/sql package,CSS,https://github.com/VividCortex/go-database-sql-tutorial
709,fasthtml-example,812,123,812,24,02/06/2024,15/08/2025,13.14 MB,13451,Example fasthtml applications demonstrating a range of web programming techniques,CSS,https://github.com/AnswerDotAI/fasthtml-example
710,What-The-Flexbox,810,997,810,16,02/08/2015,09/12/2023,5.77 MB,5905,Exercises for the What The Flexbox video series - available at Flexbox.io,CSS,https://github.com/wesbos/What-The-Flexbox
711,jekyll-theme-skinny-bones,807,892,807,20,02/06/2014,27/08/2019,2.77 MB,2836,A Jekyll starter with a variety of flexible layouts and components.,CSS,https://github.com/mmistakes/jekyll-theme-skinny-bones
712,hellogithub.com,805,137,805,4,14/07/2017,01/05/2023,3.50 MB,3587,旧 HelloGitHub.com 网站源码,CSS,https://github.com/521xueweihan/hellogithub.com
713,landio-html,802,168,802,0,09/10/2015,17/09/2018,9.49 MB,9715,Landio design (Sketch to HTML),CSS,https://github.com/tatygrassini/landio-html
714,Intro-to-Vue-3,802,3294,802,100,14/05/2020,09/08/2024,298.00 KB,298,Code for Vue Mastery's Intro to Vue 3 course:,CSS,https://github.com/Code-Pop/Intro-to-Vue-3
715,halo-theme-hao,799,154,799,1,09/10/2022,16/08/2025,42.95 MB,43977,,CSS,https://github.com/chengzhongxue/halo-theme-hao
716,turretcss,799,46,799,15,29/01/2015,02/12/2022,3.77 MB,3862,Turret is a styles and browser behaviour normalisation framework for rapid development of responsive and accessible websites.,CSS,https://github.com/turretcss/turretcss
717,hugo-theme-cleanwhite,798,368,798,11,16/06/2018,06/11/2025,11.41 MB,11683,"A clean, elegant blog theme for hugo",CSS,https://github.com/zhaohuabing/hugo-theme-cleanwhite
718,wordpress-nginx-docker-compose,794,301,794,9,28/08/2018,15/11/2025,9.27 MB,9491,Run WordPress with nginx using Docker Compose. ,CSS,https://github.com/urre/wordpress-nginx-docker-compose
