Ranking,Project Name,Stars,Forks,Watchers,Open Issues,Created At,Last Commit,Size,Size (KB),Description,Language,Repo URL
429,unsemantic,1370,160,1370,7,27/10/2012,15/01/2021,518.00 KB,518,"Fluid grid for mobile, tablet, and desktop.",CSS,https://github.com/nathansmith/unsemantic
430,gridlex,1369,142,1369,34,25/06/2015,16/04/2023,822.00 KB,822,Just a CSS Flexbox Grid System,CSS,https://github.com/devlint/gridlex
431,gomorra-sql,1367,25,1367,11,27/04/2021,06/06/2023,297.00 KB,297,SQL made uagliò.,CSS,https://github.com/aurasphere/gomorra-sql
432,space.js,1364,125,1364,24,06/03/2015,16/10/2020,8.01 MB,8207, A HTML-driven JavaScript-library for narrative 3D-scrolling.,CSS,https://github.com/gopatrik/space.js
433,augmented-ui,1364,67,1364,1,20/08/2019,28/05/2024,1.10 MB,1125,Cyberpunk-inspired web UI made easy. Get augmented.,CSS,https://github.com/propjockey/augmented-ui
434,light-bootstrap-dashboard,1363,722,1363,25,09/09/2015,05/08/2024,36.21 MB,37084,Light Bootstrap Dashboard is an admin dashboard template designed to be beautiful and simple. ,CSS,https://github.com/creativetimofficial/light-bootstrap-dashboard
435,CmsWing,1358,457,1358,29,31/05/2016,26/04/2024,321.88 MB,329600,"一款基于Egg.js(为企业级框架和应用而生)、Sequelize和GraphQL，功能强大的（PC端,手机端和微信公众平台）电子商务平台及CMS建站系统",CSS,https://github.com/arterli/CmsWing
436,alltomp3-app,1357,134,1357,186,29/07/2016,02/03/2023,3.79 MB,3886,"Download and Convert YouTube, SoundCloud & Spotify in MP3 with full tags (title, artist, genre, cover, lyrics 🔥)",CSS,https://github.com/AllToMP3/alltomp3-app
437,RxSwift-Chinese-Documentation,1353,151,1353,2,23/07/2017,07/12/2022,18.76 MB,19214,RxSwift 中文文档,CSS,https://github.com/beeth0ven/RxSwift-Chinese-Documentation
438,w12scan,1343,354,1343,28,23/01/2019,08/12/2022,14.70 MB,15054,🚀 A simple asset discovery engine for cybersecurity. (网络资产发现引擎),CSS,https://github.com/w-digital-scanner/w12scan
439,redredstar,1342,274,1342,39,18/01/2019,15/11/2025,15.97 MB,16349,RedRedStar,CSS,https://github.com/xland/redredstar
440,Aristo-jQuery-UI-Theme,1336,157,1336,9,01/04/2010,25/05/2021,226.00 KB,226,"The ""Aristo"" theme for Cappuccino ported to a jQuery UI Theme",CSS,https://github.com/taitems/Aristo-jQuery-UI-Theme
441,goflow,1331,156,1331,28,04/07/2020,16/09/2025,4.82 MB,4932,"A Golang based high performance, scalable and distributed workflow framework",CSS,https://github.com/s8sg/goflow
442,visualixir,1328,45,1328,21,07/11/2015,09/12/2022,88.61 MB,90734,A process/message visualizer for BEAM nodes.💪👁,CSS,https://github.com/koudelka/visualixir
443,node-webkit-hipster-seed,1328,80,1328,11,16/01/2014,04/05/2017,328.00 KB,328,Bootstrap a crossplatform Desktop Application using tools you probably never heard of. ,CSS,https://github.com/Anonyfox/node-webkit-hipster-seed
444,nlp_overview,1327,198,1327,5,20/10/2018,25/03/2020,6.99 MB,7155,Overview of Modern Deep Learning Techniques Applied to Natural Language Processing,CSS,https://github.com/omarsar/nlp_overview
445,aliceui.github.io,1325,593,1325,9,28/11/2011,15/08/2017,8.54 MB,8750,写样式的一种方式,CSS,https://github.com/aliceui/aliceui.github.io
446,sortable,1325,113,1325,26,20/11/2013,26/02/2023,1.29 MB,1322,Drop-in script to make tables sortable,CSS,https://github.com/HubSpot/sortable
447,dog-fucked-zhihu,1324,177,1324,4,29/05/2015,30/03/2017,197.00 KB,197,退出知乎好帮手——狗日的知乎，备份自己的答案，取消所有点赞，批量替换所有答案,CSS,https://github.com/wintercn/dog-fucked-zhihu
448,hugging-multi-agent,1324,156,1324,4,11/12/2023,10/05/2024,5.86 MB,6004,A tutorial based on MetaGPT to quickly help you understand the concept of agent and muti-agent and get started with coding development. 基于MetaGPT的多智能体入门与开发教程,CSS,https://github.com/datawhalechina/hugging-multi-agent
449,Mac-QuickLook,1317,45,1317,3,05/03/2018,29/09/2025,54.32 MB,55624,QuickLook plugins and packages,CSS,https://github.com/haokaiyang/Mac-QuickLook
450,verylegit.link,1313,40,1313,16,14/08/2016,07/12/2022,1.80 MB,1839,"A URL shortener, but it makes the URLs look extremely dodgy instead",CSS,https://github.com/defaultnamehere/verylegit.link
451,uchu,1310,17,1310,4,06/12/2023,21/02/2025,2.53 MB,2592,the color palette for internet lovers,CSS,https://github.com/NeverCease/uchu
452,Fluent-gtk-theme,1308,70,1308,98,02/02/2021,03/11/2025,72.55 MB,74296,Fluent design gtk theme for linux desktops,CSS,https://github.com/vinceliuice/Fluent-gtk-theme
453,formalize,1305,119,1305,7,14/09/2010,26/02/2014,525.00 KB,525,Teach your forms some manners!,CSS,https://github.com/nathansmith/formalize
454,workflow,1305,178,1305,53,23/02/2016,30/03/2020,21.76 MB,22281,The open source PaaS for Kubernetes.,CSS,https://github.com/deis/workflow
455,css3-buttons,1298,141,1298,5,31/05/2010,26/10/2018,228.00 KB,228,A collection of CSS3 buttons implemented in Sass.,CSS,https://github.com/ubuwaits/css3-buttons
456,LookingGlass,1297,351,1297,25,21/09/2012,07/06/2022,559.00 KB,559,A user-friendly PHP Looking Glass,CSS,https://github.com/telephone/LookingGlass
457,the-unix-workbench,1295,2250,1295,368,11/10/2016,03/08/2024,9.17 MB,9388,:house_with_garden: A Book for Anyone to Get Started with Unix,CSS,https://github.com/seankross/the-unix-workbench
458,aimeos-symfony,1291,52,1291,0,17/09/2014,15/09/2025,8.22 MB,8420,"Symfony e-commerce bundle for professional, ultra fast online shops, complex B2B applications and #gigacommerce",CSS,https://github.com/aimeos/aimeos-symfony
459,ungrid,1290,53,1290,1,27/02/2014,22/04/2020,160.00 KB,160,ungrid - the simplest responsive css grid,CSS,https://github.com/chrisnager/ungrid
460,doxygen-awesome-css,1289,135,1289,42,16/03/2021,12/10/2025,8.43 MB,8631,Custom CSS theme for doxygen html-documentation with lots of customization parameters.,CSS,https://github.com/jothepro/doxygen-awesome-css
461,archie,1279,361,1279,36,06/04/2020,11/10/2025,2.33 MB,2387,A minimal Hugo Theme,CSS,https://github.com/athul/archie
462,RxJava-Essentials-CN,1279,226,1279,0,03/01/2016,04/09/2017,3.95 MB,4049,RxJava Essentials 中文翻译版 仅供交流学习使用，严禁商业用途 ,CSS,https://github.com/yuxingxin/RxJava-Essentials-CN
463,dockerfiles,1273,282,1273,2,08/06/2021,18/09/2025,7.74 MB,7928,"不定期收集,整理和编写常用优秀软件和服务的 Dockerfile 文件.  https://docker.ioiox.com",CSS,https://github.com/stilleshan/dockerfiles
464,aprilFools.css,1272,126,1272,9,22/03/2013,27/03/2019,105.00 KB,105,Harmlessly goof up your co-workers browser and chrome dev tools,CSS,https://github.com/wesbos/aprilFools.css
465,twentytwenty,1270,291,1270,64,10/06/2013,03/12/2020,821.00 KB,821,jQuery Plugin to Compare Images,CSS,https://github.com/zurb/twentytwenty
466,chalk,1270,443,1270,35,26/07/2016,09/04/2024,14.82 MB,15171,"Chalk is a high quality, completely customizable, performant and 100% free Jekyll blog theme.",CSS,https://github.com/nielsenramon/chalk
467,jquery.pin,1268,319,1268,41,20/03/2013,05/04/2018,511.00 KB,511,Pin any element within a container,CSS,https://github.com/webpop/jquery.pin
468,h5ds,1266,389,1266,3,19/10/2017,23/09/2021,5.65 MB,5783,H5DS (HTML5 Design software) 这是一款基于WEB的 H5制作工具，H5编辑器。让不会写代码的人也能轻松快速上手制作H5页面。类似易企秀的H5制作、建站工具，示范网站：h5ds.com ,CSS,https://github.com/h5ds/h5ds
469,universal.css,1260,39,1260,12,17/05/2016,11/08/2017,518.00 KB,518,The only CSS you will ever need,CSS,https://github.com/marmelab/universal.css
470,JavaScript-Equality-Table,1257,195,1257,9,02/02/2011,21/02/2020,334.00 KB,334,,CSS,https://github.com/dorey/JavaScript-Equality-Table
471,sass-mediaqueries,1257,158,1257,12,18/08/2012,28/03/2018,179.00 KB,179,Media Queries mixins for Sass - fully customizable and very easy to use.,CSS,https://github.com/rafalbromirski/sass-mediaqueries
472,square.github.io,1250,264,1250,6,15/09/2011,07/01/2025,3.23 MB,3306,"A simple, static portal which outlines our open source offerings.",CSS,https://github.com/square/square.github.io
473,spectrum-css,1247,207,1247,13,05/11/2018,14/11/2025,91.50 MB,93701,The standard CSS implementation of the Spectrum design language.,CSS,https://github.com/adobe/spectrum-css
474,UserChrome-Tweaks,1243,117,1243,51,02/09/2017,05/06/2021,137.00 KB,137,A community maintained repository of userChrome.css tweaks for Firefox,CSS,https://github.com/Timvde/UserChrome-Tweaks
475,hackerweb,1241,133,1241,26,16/10/2011,22/04/2024,8.74 MB,8952,A simply readable Hacker News web app,CSS,https://github.com/cheeaun/hackerweb
476,global,1240,751,1240,24,08/08/2016,14/02/2024,11.69 MB,11975,HTML5 website template,CSS,https://github.com/BuckyMaler/global
477,HTML-Sheets-of-Paper,1234,142,1234,7,13/09/2014,27/03/2022,492.00 KB,492,"Word processor in your browser using HTML and CSS (for invoices, legal notices, etc.)",CSS,https://github.com/delight-im/HTML-Sheets-of-Paper
478,noduino,1234,223,1234,22,26/02/2012,24/05/2018,1.82 MB,1862,JavaScript and Node.js Framework for controlling Arduino with HTML and WebSockets,CSS,https://github.com/sbstjn/noduino
479,select-css,1228,110,1228,0,16/09/2014,20/10/2022,77.00 KB,77,Cross-browser styles for consistent select element styling,CSS,https://github.com/filamentgroup/select-css
480,payment-webfont,1227,133,1227,43,27/04/2014,23/01/2018,1.42 MB,1450,An SVG webfont full of main payment system icons,CSS,https://github.com/orlandotm/payment-webfont
481,after-dark-css,1226,145,1226,7,12/03/2014,22/01/2024,1.32 MB,1351,Recreating After Dark screensavers in CSS.,CSS,https://github.com/bryanbraun/after-dark-css
482,nuxt-ssr-demo,1222,300,1222,24,25/03/2018,03/01/2023,3.74 MB,3831,:sparkles:  高仿掘金，整合 vue + nuxt + axios + vuex + vue-router (nuxt 自带 vuex 和 vue-router)，一个基于 Nuxt 的服务器端渲染 Demo,CSS,https://github.com/xuqiang521/nuxt-ssr-demo
483,jQuery-Mobile-Bootstrap-Theme,1220,343,1220,1,13/02/2012,26/05/2016,525.00 KB,525,A jQuery Mobile theme based on Bootstrap,CSS,https://github.com/commadelimited/jQuery-Mobile-Bootstrap-Theme
484,HTML-KickStart,1219,240,1219,45,06/02/2012,03/10/2021,1.24 MB,1268,Ultra–Lean HTML Building Blocks for Rapid Website Production,CSS,https://github.com/joshuagatcke/HTML-KickStart
485,shards-dashboard,1217,234,1217,14,11/07/2018,03/12/2022,5.77 MB,5906,🔥A beautiful Bootstrap 4 admin dashboard templates pack.,CSS,https://github.com/DesignRevision/shards-dashboard
486,blog,1216,74,1216,19,12/01/2015,03/01/2023,12.85 MB,13156,All the sources for my (not powered by React anymore) blog,CSS,https://github.com/jlongster/blog
487,VueCircleMenu,1216,189,1216,18,14/01/2017,09/02/2017,1.52 MB,1561,:rabbit:A beautiful circle menu powered by Vue.js,CSS,https://github.com/OYsun/VueCircleMenu
488,asciicast2gif,1209,79,1209,1,26/04/2017,14/08/2022,1.45 MB,1482,Generate GIF animations from asciicasts (asciinema recordings),CSS,https://github.com/asciinema/asciicast2gif
489,jo,1208,179,1208,29,05/06/2010,11/02/2020,975.00 KB,975,"Jo (0.5.0) is a thin (~16K) candy shell for making HTML5 apps. Jo works with: PhoneGap, Chrome, Safari, Opera, FireFox, iOS, Android, BlackBerry 10, Tizen, & Windows Phone 8+. Features include skinnable UI widgets, a clean event model and a light data layer.",CSS,https://github.com/davebalmer/jo
490,app,1204,63,1204,43,10/01/2025,08/11/2025,54.93 MB,56249,"A modified Twitter app, with branding reverts, BHTwitter and other QoL modifications.",CSS,https://github.com/NeoFreeBird/app
491,gci18.fossasia.org,1201,89,1201,13,19/09/2018,05/01/2020,60.85 MB,62310,FOSSASIA Google Code-In Website 2018 https://gci18.fossasia.org,CSS,https://github.com/fossasia/gci18.fossasia.org
492,vscode-portfolio,1197,297,1197,6,27/04/2021,19/03/2025,417.00 KB,417,A VSCode themed developer portfolio built using Next.js,CSS,https://github.com/itsnitinr/vscode-portfolio
493,Zen-Nebula,1186,45,1186,28,06/03/2025,30/10/2025,16.38 MB,16778,A minimalist Glassmorphism based theme to elevate the UI of Zen browser,CSS,https://github.com/JustAdumbPrsn/Zen-Nebula
494,course-collaboration-travel-plans,1185,17487,1185,2024,11/04/2017,19/08/2024,5.00 KB,5,,CSS,https://github.com/udacity/course-collaboration-travel-plans
495,mocka,1183,38,1183,1,24/05/2017,26/05/2017,48.00 KB,48,"Simple, elegant content placeholder",CSS,https://github.com/Chalarangelo/mocka
496,flexnav,1177,385,1177,81,18/01/2012,08/10/2015,51.20 MB,52426,A jQuery plugin for responsive menus,CSS,https://github.com/mrjasonweaver/flexnav
497,midnight-discord,1174,460,1174,42,02/10/2021,17/11/2025,7.01 MB,7179,"a dark, customizable discord theme.",CSS,https://github.com/refact0r/midnight-discord
498,birthday,1173,3216,1173,97,05/01/2015,19/08/2024,2.52 MB,2585,"A Happy Birthday animation design in CSS3, HTML5 ",CSS,https://github.com/ayusharma/birthday
499,Masuit.MyBlogs,1172,306,1172,3,14/07/2018,01/11/2025,544.37 MB,557439,基于C#/.NET9+vue3的 masuit.org个人博客站项目源码，https://masuit.org ，供参考、学习、引用、非商业性质的部署。,CSS,https://github.com/ldqk/Masuit.MyBlogs
500,WaveFox,1167,55,1167,2,03/06/2021,16/11/2025,3.88 MB,3974,Firefox CSS Theme/Style for manual customization,CSS,https://github.com/QNetITQ/WaveFox
501,react-vertical-timeline,1161,177,1161,46,26/10/2017,11/12/2024,22.50 MB,23039,Vertical timeline for React.js,CSS,https://github.com/stephane-monnot/react-vertical-timeline
502,cppreference2mshelp,1159,181,1159,7,05/05/2018,02/10/2025,60.12 MB,61560,cppreference.com html archive  converter to microsoft help (for Visual Studio 2012+) and chm help (for Windows) ,CSS,https://github.com/myfreeer/cppreference2mshelp
503,eclipse-ui-theme,1157,184,1157,50,11/04/2013,04/07/2014,4.20 MB,4298,Dark UI Theme for Eclipse 4+,CSS,https://github.com/guari/eclipse-ui-theme
504,evilportals,1156,215,1156,12,13/12/2016,27/05/2024,3.56 MB,3647,A collection of captive portals for phishing using a WiFi Pineapple ,CSS,https://github.com/kleo/evilportals
505,codyhouse-framework,1153,172,1153,7,10/12/2018,10/07/2023,1.03 MB,1057,"A lightweight front-end framework for building accessible, bespoke interfaces.",CSS,https://github.com/codyhouse/codyhouse-framework
506,modern-todomvc-vanillajs,1151,112,1151,1,30/04/2022,12/03/2024,153.00 KB,153,"TodoMVC with Modern (ES6+), Vanilla JavaScript",CSS,https://github.com/1Marc/modern-todomvc-vanillajs
507,stormzhang.github.com,1147,472,1147,11,20/10/2013,01/09/2016,37.42 MB,38321,个人博客,CSS,https://github.com/stormzhang/stormzhang.github.com
508,AnythingSlider,1145,379,1145,40,22/07/2010,02/04/2022,2.99 MB,3062,A jQuery Slider plugin for anything.,CSS,https://github.com/CSS-Tricks/AnythingSlider
509,gallery-css,1134,296,1134,5,14/03/2013,14/12/2021,6.05 MB,6196,CSS only Gallery,CSS,https://github.com/benschwarz/gallery-css
510,docbox,1133,186,1133,6,03/03/2016,21/04/2020,196.00 KB,196,REST API documentation generator,CSS,https://github.com/tmcw/docbox
511,pygments-css,1130,369,1130,7,27/05/2009,25/08/2022,49.00 KB,49,css files created from pygment's built-in styles,CSS,https://github.com/richleland/pygments-css
512,ssr,1130,139,1130,22,22/04/2019,18/08/2025,19.01 MB,19467,ssr免费节点,CSS,https://github.com/wandou911/ssr
513,Frameless,1128,214,1128,9,27/08/2011,30/08/2015,186.00 KB,186,The spiritual successor to Less Framework,CSS,https://github.com/jonikorpi/Frameless
514,Next.js-Developer-Portfolio-Starter-Code,1127,586,1127,0,20/03/2023,18/06/2025,5.65 MB,5786,"⭐Build a stunning portfolio website with Next.js, Tailwind CSS and Framer-motion. If you want to learn to create this you can follow the tutorial link given in the Read me file.",CSS,https://github.com/codebucks27/Next.js-Developer-Portfolio-Starter-Code
515,DistortedButtonEffects,1123,132,1123,4,11/05/2016,08/10/2016,769.00 KB,769,"A set of inspirational, highly experimental distortion effects for buttons using SVG filters. By Adrien Denat. ",CSS,https://github.com/codrops/DistortedButtonEffects
516,shop,1123,120,1123,9,01/09/2013,24/09/2017,1.18 MB,1207,Single-page shop    ,CSS,https://github.com/stripe-archive/shop
517,WSL-Programs,1122,96,1122,6,07/04/2016,17/12/2023,163.00 KB,163,A community powered list of programs that work (and those that don't) on the Windows subsystem for Linux,CSS,https://github.com/emmatyping/WSL-Programs
518,sass-flex-mixin,1120,227,1120,4,20/04/2013,16/01/2018,39.00 KB,39,Flexbox mixins,CSS,https://github.com/mastastealth/sass-flex-mixin
519,intentionjs,1113,110,1113,16,19/07/2012,19/11/2014,25.37 MB,25983,A library for intentionally dealing with responsive design,CSS,https://github.com/dowjones/intentionjs
520,monu,1110,71,1110,18,20/03/2015,28/01/2018,470.00 KB,470,menubar process monitor mac app [ALPHA],CSS,https://github.com/max-mapper/monu
521,initializr-template,1108,360,1108,14,09/12/2011,22/11/2021,17.00 KB,17,Initializr's generated page,CSS,https://github.com/verekia/initializr-template
522,SnappySnippet,1108,167,1108,48,20/09/2013,25/03/2020,2.60 MB,2660,Chrome extension that allows easy extraction of CSS and HTML from selected element.,CSS,https://github.com/kdzwinel/SnappySnippet
523,hexo-theme-pure,1102,288,1102,100,10/06/2017,14/08/2025,4.59 MB,4702,Hexo theme pure. It's a pure theme for Hexo.,CSS,https://github.com/cofess/hexo-theme-pure
524,stately,1097,111,1097,19,31/10/2012,13/08/2018,893.00 KB,893,,CSS,https://github.com/mobomo/stately
525,open-android-backup,1096,54,1096,43,26/12/2021,14/10/2025,8.29 MB,8488,"Back up your device without vendor lock-ins, using insecure software or root. Supports encryption and compression out of the box. Works cross-platform.",CSS,https://github.com/mrrfv/open-android-backup
526,wallop,1096,80,1096,10,17/10/2013,21/04/2020,6.99 MB,7153,:no_entry: currently unmaintained :no_entry: A minimal JS library for showing & hiding things,CSS,https://github.com/peduarte/wallop
527,pyda-2e-zh,1092,346,1092,4,24/10/2018,02/01/2021,22.58 MB,23120,:book:  [译] 利用 Python 进行数据分析 · 第 2 版,CSS,https://github.com/apachecn/pyda-2e-zh
528,elixir-tips,1092,68,1092,0,12/04/2017,24/02/2023,9.46 MB,9690,The Killer Elixir Tips and Tricks...from the experience...,CSS,https://github.com/blackode/elixir-tips
529,iA-Writer-Templates,1081,189,1081,13,12/05/2016,05/01/2023,233.00 KB,233,"Preview, create PDFs, and print documents in your own style with templates in iA Writer.",CSS,https://github.com/iainc/iA-Writer-Templates
530,social-likes,1081,239,1081,4,21/04/2011,21/11/2017,1.64 MB,1679,Beautiful social “like” buttons with counters for jQuery.,CSS,https://github.com/sapegin/social-likes
531,javascript-projects-for-beginners,1059,282,1059,12,10/10/2019,17/07/2024,5.49 MB,5623,Repository for all (future) 100+ JavaScript projects for beginners created on JSBeginners.com.,CSS,https://github.com/romeojeremiah/javascript-projects-for-beginners
532,jekyll-incorporated,1057,364,1057,21,09/10/2013,15/11/2017,11.81 MB,12094,Modern Jekyll based blog for companies,CSS,https://github.com/kippt/jekyll-incorporated
533,MakeGithubGreatAgain,1053,49,1053,10,10/02/2017,13/08/2019,625.00 KB,625,Extension for making GitHub great again,CSS,https://github.com/DennisSnijder/MakeGithubGreatAgain
534,DropPoint,1053,67,1053,28,16/06/2021,31/07/2023,6.09 MB,6235,Make drag-and-drop easier using DropPoint. Drag content without having to open side-by-side windows,CSS,https://github.com/GameGodS3/DropPoint
535,FF-ULTIMA,1051,36,1051,5,17/03/2024,14/11/2025,341.50 MB,349701,The Firefox theme with too many options.. FF Ultima.,CSS,https://github.com/soulhotel/FF-ULTIMA
536,CaoMei,1050,72,1050,21,05/06/2017,23/05/2020,379.00 KB,379,🍓CaoMei Icon - Designed for developers and creatros http://chuangzaoshi.com/icon/,CSS,https://github.com/xiangsudian/CaoMei
537,materialette,1049,60,1049,8,15/10/2016,01/02/2021,12.67 MB,12972,Materialette - A material design color palette,CSS,https://github.com/mike-schultz/materialette
538,equalize.js,1049,124,1049,5,10/09/2012,23/12/2016,307.00 KB,307,The jQuery plugin for equalizing the height or width of your elements,CSS,https://github.com/tsvensen/equalize.js
539,CMSScan,1049,147,1049,4,15/11/2018,18/05/2021,740.00 KB,740,"CMS Scanner: Scan Wordpress, Drupal, Joomla, vBulletin websites for Security issues",CSS,https://github.com/ajinabraham/CMSScan
540,hexo-blog-encrypt,1047,107,1047,12,29/03/2016,19/09/2023,234.00 KB,234,"Yet, just another hexo plugin for security.",CSS,https://github.com/D0n9X1n/hexo-blog-encrypt
541,thunderbird-monterail,1046,75,1046,61,26/04/2017,18/05/2020,5.54 MB,5670,A set of themes for thunderbird inspired by a Monterail blog post,CSS,https://github.com/spymastermatt/thunderbird-monterail
542,csspin,1042,116,1042,3,18/11/2016,08/10/2019,41.00 KB,41,"CSS Spinners and Loaders - Modular, Customizable and Single HTML Element Code for Pure CSS Loader and Spinner",CSS,https://github.com/webkul/csspin
543,notes,1041,472,1041,5,24/10/2018,11/08/2020,622.07 MB,636997,,CSS,https://github.com/hiromis/notes
544,css3-,1034,268,1034,2,18/04/2016,08/10/2018,10.30 MB,10543,CSS3 实现各类 3D && 3D 行星动画效果,CSS,https://github.com/chokcoco/css3-
545,slim.js,1034,62,1034,14,27/09/2016,06/09/2023,2.90 MB,2973,Fast & Robust Front-End Micro-framework based on modern standards,CSS,https://github.com/slimjs/slim.js
546,kasper,1033,386,1033,11,10/11/2013,25/03/2023,855.00 KB,855,Ghost's default theme (Casper v1.0) on Jekyll,CSS,https://github.com/rosario/kasper
547,firefox-gx,1031,40,1031,7,16/12/2021,11/11/2025,52.73 MB,53994,Opera GX Skin for Firefox,CSS,https://github.com/Godiesc/firefox-gx
548,instabrute.github.io,1030,62,1030,17,17/07/2020,18/03/2025,3.56 MB,3643,best script for hacking instagram,CSS,https://github.com/dark-player/instabrute.github.io
549,gtk,1029,88,1029,61,25/01/2018,11/11/2025,17.66 MB,18080,🧛🏻‍♂️ Dark theme for GTK,CSS,https://github.com/dracula/gtk
550,susi_chat,1029,9,1029,3,25/11/2017,17/04/2025,1.25 MB,1278,,CSS,https://github.com/susiai/susi_chat
551,bootcards,1028,148,1028,20,16/01/2014,07/09/2017,5.27 MB,5401,No longer maintained. See below for details.,CSS,https://github.com/bootcards/bootcards
552,jacman,1025,362,1025,69,13/03/2014,26/02/2020,2.83 MB,2894,Jacman is a fresh looking and responsive theme for Hexo with more features based on Pacman.,CSS,https://github.com/wuchong/jacman
553,load-awesome,1023,147,1023,12,06/05/2015,14/12/2016,554.00 KB,554,An awesome collection of — Pure CSS — Loaders and Spinners,CSS,https://github.com/danielcardoso/load-awesome
554,security,1021,513,1021,8,04/03/2017,28/10/2023,4.65 MB,4758,Stuff about it-security that might be good to know,CSS,https://github.com/xapax/security
555,ngAnimate,1019,605,1019,16,07/10/2013,17/04/2017,368.00 KB,368,ngAnimate is best effect sulotion made for AngularJS,CSS,https://github.com/Augus/ngAnimate
556,rippleui,1019,44,1019,7,25/11/2022,30/07/2023,27.00 MB,27643,"Clean, modern and beautiful Tailwind CSS components.",CSS,https://github.com/Siumauricio/rippleui
557,nwg-shell,1019,16,1019,5,09/05/2021,25/10/2025,70.60 MB,72294,Installer & meta-package for the nwg-shell project: a GTK3-based shell for sway and Hyprland Wayland compositors,CSS,https://github.com/nwg-piotr/nwg-shell
558,MarkdownView,1019,164,1019,12,25/12/2011,15/03/2019,5.70 MB,5839,"MarkdownView is an Android webview with the capablity of loading Markdown text or file and display it as HTML, it uses MarkdownJ and extends Android webview.",CSS,https://github.com/falnatsheh/MarkdownView
559,3dtransforms,1015,160,1015,6,01/12/2010,30/03/2020,580.00 KB,580,:package: Introduction to CSS 3D transforms,CSS,https://github.com/desandro/3dtransforms
560,dotfiles,1014,41,1014,6,05/08/2023,16/11/2025,125.57 MB,128582,My Hyprland dotfiles,CSS,https://github.com/linkfrg/dotfiles
561,google-type,1013,91,1013,10,22/07/2014,31/10/2025,58.04 MB,59429,Collaborative typography project using select passages from Aesop's Fables set to Google Fonts,CSS,https://github.com/femmebot/google-type
562,vprofile-project,1010,5461,1010,90,21/06/2023,06/11/2025,30.00 MB,30724,,CSS,https://github.com/hkhcoder/vprofile-project
563,ffii.github.io,1009,0,1009,1,09/02/2015,23/05/2016,671.00 KB,671,FFII Developer Site,CSS,https://github.com/ffii/ffii.github.io
564,list-of-good-things,1009,206,1009,0,16/01/2016,05/12/2021,41.89 MB,42896,list-of-good-things 好物清单,CSS,https://github.com/cnfeat/list-of-good-things
565,orbit-model,1007,74,1007,12,11/06/2019,07/03/2025,38.97 MB,39902,A framework for building high gravity communities 🪐,CSS,https://github.com/orbit-love/orbit-model
566,postcss-plugins,1007,83,1007,9,02/11/2019,15/11/2025,25.50 MB,26109,PostCSS Tools and Plugins,CSS,https://github.com/csstools/postcss-plugins
567,checkout-one-time-payments,1003,516,1003,12,16/08/2019,16/01/2025,9.16 MB,9378,Use Checkout to quickly collect one-time payments.,CSS,https://github.com/stripe-samples/checkout-one-time-payments
568,Pattern-Primer,1002,152,1002,2,18/11/2011,08/10/2014,191.00 KB,191,Generating styled markup from a folder of markup snippets.,CSS,https://github.com/adactio/Pattern-Primer
569,graphql-ide,998,69,998,22,21/11/2016,24/07/2018,5.00 MB,5122,⚡️ GraphQL IDE - An extensive IDE for exploring GraphQL API's,CSS,https://github.com/andev-software/graphql-ide
570,object-fit,997,91,997,8,14/11/2013,28/03/2016,839.00 KB,839,Polyfill (mostly IE) for CSS object-fit property to fill-in/fit-in images into containers.,CSS,https://github.com/anselmh/object-fit
571,Cowardly-Witch,995,69,995,5,16/07/2018,26/08/2021,22.53 MB,23066,『臆病な魔女は、Webサイトに魔法をかけた。』,CSS,https://github.com/yui540/Cowardly-Witch
572,sakai-react,993,615,993,53,18/05/2018,18/10/2024,18.45 MB,18889,Free React Admin Template ,CSS,https://github.com/primefaces/sakai-react
