Ranking,Project Name,Stars,Forks,Watchers,Open Issues,Created At,Last Commit,Size,Description,Language,Repo URL,Size
634,trianglify,10094,662,10094,12,12/04/2014,12/05/2025,4.09 MB,Algorithmically generated triangle art,JavaScript,https://github.com/qrohlf/trianglify,4.09 MB
635,ua-parser-js,10088,1224,10088,19,01/02/2012,15/03/2026,20.88 MB,"UAParser.js - The Essential Web Development Tool for User-Agent Detection. Detect Browsers, OS, Devices, Bots, Apps, AI Crawlers, and more. Run in Browser (client-side) or Node.js (server-side).",JavaScript,https://github.com/faisalman/ua-parser-js,20.88 MB
636,webtorrent-desktop,10040,1021,10040,75,04/05/2015,13/03/2026,173.08 MB,"❤️ Streaming torrent app for Mac, Windows, and Linux",JavaScript,https://github.com/webtorrent/webtorrent-desktop,173.08 MB
637,webpack-howto,10036,682,10036,51,17/07/2014,11/08/2017,469.00 KB,,JavaScript,https://github.com/petehunt/webpack-howto,469.00 KB
638,wechat-bot,10024,1180,10024,114,15/12/2021,25/02/2026,1.19 MB,🤖一个基于 WeChaty 结合 ChatGPT / Claude / Kimi / DeepSeek / Ollama等Ai服务实现的微信机器人 ，可以用来帮助你自动回复微信消息，或者社群分析/好友管理，检测僵尸粉等...,JavaScript,https://github.com/wangrongding/wechat-bot,1.19 MB
639,vue-resource,10021,1575,10021,113,07/02/2014,08/12/2022,1.72 MB,The HTTP client for Vue.js,JavaScript,https://github.com/pagekit/vue-resource,1.72 MB
640,codimd,10010,1119,10010,348,04/05/2015,02/10/2025,28.15 MB,CodiMD - Realtime collaborative markdown notes on all platforms.,JavaScript,https://github.com/hackmdio/codimd,28.15 MB
641,hotel,10008,443,10008,123,27/05/2015,23/10/2023,3.07 MB,🏩 A simple process manager for developers. Start apps from your browser and access them using local domains,JavaScript,https://github.com/typicode/hotel,3.07 MB
642,madge,10001,343,10001,120,20/05/2012,21/01/2026,1.41 MB,"Create graphs from your CommonJS, AMD or ES6 module dependencies",JavaScript,https://github.com/pahen/madge,1.41 MB
643,register,9999,19352,9999,59,04/10/2020,19/03/2026,134.77 MB,Grab your own sweet-looking '.is-a.dev' subdomain.,JavaScript,https://github.com/is-a-dev/register,134.77 MB
644,PairDrop,9996,595,9996,118,07/01/2023,25/02/2025,20.31 MB,"PairDrop: Transfer Files Cross-Platform. No Setup, No Signup.",JavaScript,https://github.com/schlagmichdoch/PairDrop,20.31 MB
645,css.gg,9980,495,9980,43,01/10/2019,26/08/2024,6.59 MB,"700+ Pure CSS, SVG & Figma UI Icons, 6000+ glyphs, patterns, colors and layouts.",JavaScript,https://github.com/astrit/css.gg,6.59 MB
646,uPlot,9972,446,9972,142,27/09/2019,26/02/2026,8.26 MB,"📈 A small, fast chart for time series, lines, areas, ohlc & bars",JavaScript,https://github.com/leeoniya/uPlot,8.26 MB
647,jscodeshift,9965,489,9965,145,07/03/2015,20/03/2026,2.41 MB,A JavaScript codemod toolkit.,JavaScript,https://github.com/facebook/jscodeshift,2.41 MB
648,react-native-animatable,9952,695,9952,170,18/10/2015,26/10/2023,1.71 MB,Standard set of easy to use animations and declarative transitions for React Native,JavaScript,https://github.com/oblador/react-native-animatable,1.71 MB
649,h5-Dooring,9931,1836,9931,35,22/08/2020,23/12/2025,50.94 MB,"H5 Page Maker, H5 Editor, LowCode. Make H5 as easy as building blocks. | 让H5制作像搭积木一样简单, 轻松搭建H5页面, H5网站, PC端网站,LowCode平台.",JavaScript,https://github.com/MrXujiang/h5-Dooring,50.94 MB
650,react-i18next,9928,1047,9928,4,12/12/2015,11/03/2026,20.41 MB,Internationalization for react done right. Using the i18next i18n ecosystem.,JavaScript,https://github.com/i18next/react-i18next,20.41 MB
651,WOW,9918,4018,9918,189,29/12/2013,24/06/2024,1.03 MB,Reveal CSS animation as you scroll down a page,JavaScript,https://github.com/mattdelacdev/WOW,1.03 MB
652,testcafe,9917,678,9917,26,20/04/2015,12/03/2026,132.50 MB,A Node.js tool to automate end-to-end web testing.,JavaScript,https://github.com/DevExpress/testcafe,132.50 MB
653,connect,9913,1086,9913,13,26/05/2010,27/09/2024,5.20 MB,"Connect is an extensible HTTP server framework for node using ""plugins"" known as middleware.",JavaScript,https://github.com/senchalabs/connect,5.20 MB
654,gtop,9905,333,9905,41,09/08/2017,06/11/2025,410.00 KB,System monitoring dashboard for terminal,JavaScript,https://github.com/aksakalli/gtop,410.00 KB
655,art-of-node,9891,849,9891,15,21/03/2013,03/08/2020,1.71 MB,:snowflake: a short introduction to node.js,JavaScript,https://github.com/max-mapper/art-of-node,1.71 MB
656,purifycss,9890,381,9890,81,26/05/2015,17/10/2020,349.00 KB,Remove unused CSS. Also works with single-page apps.,JavaScript,https://github.com/purifycss/purifycss,349.00 KB
657,react-app-rewired,9879,419,9879,18,08/08/2016,13/02/2025,876.00 KB,Override create-react-app webpack configs without ejecting,JavaScript,https://github.com/timarney/react-app-rewired,876.00 KB
658,art-template,9876,2659,9876,92,03/06/2012,07/12/2024,3.11 MB,High performance JavaScript templating engine,JavaScript,https://github.com/goofychris/art-template,3.11 MB
659,html5shiv,9868,2530,9868,83,12/02/2011,07/07/2024,5.02 MB,This script is the defacto way to enable use of HTML5 sectioning elements in legacy Internet Explorer.,JavaScript,https://github.com/aFarkas/html5shiv,5.02 MB
660,ai-guide,9863,1053,9863,1,13/02/2025,11/03/2026,3.44 MB,程序员鱼皮的 AI 资源大全 + Vibe Coding 零基础教程，分享大模型选择指南（DeepSeek / GPT / Gemini / Claude）、最新 AI 资讯、Prompt 提示词大全、AI 知识百科（RAG / MCP / A2A）、AI 编程教程、AI 工具用法（Cursor / Claude Code / OpenClaw / TRAE / Lovable / Agent Skills）、AI 开发框架教程（Spring AI / LangChain）、AI 产品变现指南，帮你快速掌握 AI 技术，走在时代前沿。本项目为开源文档版本，已升级为鱼皮 AI 导航网站,JavaScript,https://github.com/liyupi/ai-guide,3.44 MB
661,bootstrap-select,9849,2702,9849,318,26/09/2012,29/07/2024,8.77 MB,":rocket: The jQuery plugin that brings select elements into the 21st century with intuitive multiselection, searching, and much more.",JavaScript,https://github.com/snapappointments/bootstrap-select,8.77 MB
662,claude-relay-service,9842,1503,9842,276,14/07/2025,19/03/2026,73.30 MB,CRS-自建Claude Code镜像，一站式开源中转服务，让 Claude、OpenAI、Gemini、Droid 订阅统一接入，支持拼车共享，更高效分摊成本，原生工具无缝使用。,JavaScript,https://github.com/Wei-Shaw/claude-relay-service,73.30 MB
663,picturefill,9822,1052,9822,1,21/02/2012,06/09/2022,17.05 MB,"A responsive image polyfill for <picture>, srcset, sizes, and more",JavaScript,https://github.com/scottjehl/picturefill,17.05 MB
664,lets-chat,9815,1566,9815,276,09/03/2012,15/11/2025,21.25 MB,Self-hosted chat app for small teams,JavaScript,https://github.com/sdelements/lets-chat,21.25 MB
665,streama,9808,983,9808,349,29/07/2015,04/01/2026,70.67 MB,Self hosted streaming media server. https://docs.streama-project.com/,JavaScript,https://github.com/streamaserver/streama,70.67 MB
666,ncc,9797,312,9797,221,13/11/2018,19/03/2026,10.40 MB,"Compile a Node.js project into a single file. Supports TypeScript, binary addons, dynamic requires.",JavaScript,https://github.com/vercel/ncc,10.40 MB
667,sinon,9760,779,9760,45,29/06/2010,16/03/2026,43.35 MB,"Test spies, stubs and mocks for JavaScript.",JavaScript,https://github.com/sinonjs/sinon,43.35 MB
668,Numeral-js,9726,912,9726,349,01/10/2012,15/02/2026,1.23 MB,A javascript library for formatting and manipulating numbers.,JavaScript,https://github.com/adamwdraper/Numeral-js,1.23 MB
669,clsx,9713,172,9713,14,24/12/2018,10/06/2024,139.00 KB,A tiny (239B) utility for constructing `className` strings conditionally.,JavaScript,https://github.com/lukeed/clsx,139.00 KB
670,howtheysre,9707,889,9707,10,14/02/2021,17/11/2025,458.00 KB,A curated collection of publicly available resources on how technology and tech-savvy organizations around the world practice Site Reliability Engineering (SRE),JavaScript,https://github.com/upgundecha/howtheysre,458.00 KB
671,Windows-universal-samples,9699,7821,9699,154,06/03/2015,24/07/2025,49.76 MB,API samples for the Universal Windows Platform.,JavaScript,https://github.com/microsoft/Windows-universal-samples,49.76 MB
672,apidoc,9698,1650,9698,85,20/04/2013,16/02/2024,3.41 MB,RESTful web API Documentation Generator.,JavaScript,https://github.com/apidoc/apidoc,3.41 MB
673,WebKit,9694,1891,9694,1984,11/12/2020,20/03/2026,11.63 GB,"Home of the WebKit project, the browser engine used by Safari, Mail, App Store and many other applications on macOS, iOS and Linux.",JavaScript,https://github.com/WebKit/WebKit,11.63 GB
674,react-slingshot,9673,2889,9673,88,31/12/2015,26/09/2023,4.26 MB,"React + Redux starter kit / boilerplate with Babel, hot reloading, testing, linting and a working example app built in",JavaScript,https://github.com/coryhouse/react-slingshot,4.26 MB
675,win11React,9662,1198,9662,16,12/07/2021,11/08/2024,91.60 MB,Windows 11 in React 💻🌈⚡,JavaScript,https://github.com/blueedgetechno/win11React,91.60 MB
676,pencil,9662,776,9662,534,19/06/2014,10/09/2024,36.49 MB,The Pencil Project's unique mission is to build a free and opensource tool for making diagrams and GUI prototyping that everyone can use. ,JavaScript,https://github.com/evolus/pencil,36.49 MB
677,webpack,9661,4318,9661,177,26/12/2015,01/03/2023,1.24 MB,"A full-featured Webpack + vue-loader setup with hot reload, linting, testing & css extraction.",JavaScript,https://github.com/vuejs-templates/webpack,1.24 MB
678,ora,9637,286,9637,0,03/03/2016,22/02/2026,755.00 KB,Elegant terminal spinner,JavaScript,https://github.com/sindresorhus/ora,755.00 KB
679,jquery-mobile,9633,2367,9633,182,13/09/2010,07/10/2021,130.59 MB,jQuery Mobile Framework,JavaScript,https://github.com/jquery-archive/jquery-mobile,130.59 MB
680,node-fs-extra,9624,783,9624,12,16/11/2011,03/03/2026,1.30 MB,"Node.js: extra methods for the fs object like copy(), remove(), mkdirs()",JavaScript,https://github.com/jprichardson/node-fs-extra,1.30 MB
681,1on1-questions,9619,626,9619,3,18/11/2017,18/03/2023,231.00 KB,Mega list of 1 on 1 meeting questions compiled from a variety to sources,JavaScript,https://github.com/VGraupera/1on1-questions,231.00 KB
682,cli,9615,4218,9615,621,05/07/2018,18/03/2026,169.92 MB,the package manager for JavaScript,JavaScript,https://github.com/npm/cli,169.92 MB
683,webpack-demos,9593,2235,9593,0,14/08/2015,03/12/2020,953.00 KB,a collection of simple demos of Webpack,JavaScript,https://github.com/ruanyf/webpack-demos,953.00 KB
684,ducks-modular-redux,9579,338,9579,36,31/08/2015,31/01/2022,494.00 KB,"A proposal for bundling reducers, action types and actions when using Redux",JavaScript,https://github.com/erikras/ducks-modular-redux,494.00 KB
685,drei,9526,790,9526,69,26/04/2020,23/02/2026,49.65 MB,🥉 useful helpers for react-three-fiber,JavaScript,https://github.com/pmndrs/drei,49.65 MB
686,react-desktop,9502,452,9502,36,14/10/2015,01/07/2023,4.95 MB,React UI Components for macOS High Sierra and Windows 10,JavaScript,https://github.com/gabrielbull/react-desktop,4.95 MB
687,elasticsearch-head,9496,2027,9496,175,16/06/2011,17/07/2021,2.54 MB,A web front end for an elastic search cluster,JavaScript,https://github.com/mobz/elasticsearch-head,2.54 MB
688,tracking.js,9489,1433,9489,226,18/06/2012,03/06/2023,32.11 MB,A modern approach for Computer Vision on the web,JavaScript,https://github.com/eduardolundgren/tracking.js,32.11 MB
689,onepage-scroll,9484,2014,9484,266,12/09/2013,19/02/2026,244.00 KB,Create an Apple-like one page scroller website (iPhone 5S website) with One Page Scroll plugin,JavaScript,https://github.com/peachananr/onepage-scroll,244.00 KB
690,bpmn-js,9478,1452,9478,137,10/03/2014,19/03/2026,14.34 MB,A BPMN 2.0 rendering toolkit and web modeler.,JavaScript,https://github.com/bpmn-io/bpmn-js,14.34 MB
691,UserScript,9474,675,9474,46,29/09/2020,18/03/2026,4.43 MB,🐵 自用的一些乱七八糟 油猴脚本~ ,JavaScript,https://github.com/XIU2/UserScript,4.43 MB
692,kue,9468,865,9468,288,27/06/2011,12/02/2024,6.28 MB,"Kue is a priority job queue backed by redis, built for node.js.",JavaScript,https://github.com/Automattic/kue,6.28 MB
693,bundlephobia,9468,240,9468,357,27/03/2017,08/03/2026,9.19 MB,🏋️ Find out the cost of adding a new frontend dependency to your project,JavaScript,https://github.com/pastelsky/bundlephobia,9.19 MB
694,swagger-editor,9426,2365,9426,34,02/05/2014,17/03/2026,2.33 GB,Swagger Editor,JavaScript,https://github.com/swagger-api/swagger-editor,2.33 GB
695,uncss,9421,406,9421,58,18/04/2013,18/06/2024,1.71 MB,Remove unused styles from CSS,JavaScript,https://github.com/uncss/uncss,1.71 MB
696,BrowserQuest,9370,2923,9370,0,30/09/2011,14/07/2023,66.84 MB,DEPRECATED - A HTML5/JavaScript multiplayer game experiment,JavaScript,https://github.com/mozilla/BrowserQuest,66.84 MB
697,HackMyResume,9361,530,9361,67,24/09/2015,03/04/2022,3.18 MB,"Generate polished résumés and CVs in HTML, Markdown, LaTeX, MS Word, PDF, plain text, JSON, XML, YAML, smoke signal, and carrier pigeon.",JavaScript,https://github.com/hacksalot/HackMyResume,3.18 MB
698,cors-anywhere,9356,6567,9356,94,03/01/2013,16/08/2024,231.00 KB,CORS Anywhere is a NodeJS reverse proxy which adds CORS headers to the proxied request.,JavaScript,https://github.com/Rob--W/cors-anywhere,231.00 KB
699,c3,9352,1372,9352,779,18/07/2013,27/02/2026,15.10 MB,:bar_chart: A D3-based reusable chart library,JavaScript,https://github.com/c3js/c3,15.10 MB
700,nodeclub,9326,3078,9326,163,15/02/2012,06/12/2025,9.31 MB,:baby_chick:Nodeclub 是使用 Node.js 和 MongoDB 开发的社区系统,JavaScript,https://github.com/cnodejs/nodeclub,9.31 MB
701,Winds,9316,635,9316,0,19/09/2016,11/10/2021,60.06 MB,A Beautiful Open Source RSS & Podcast App Powered by Getstream.io,JavaScript,https://github.com/GetStream/Winds,60.06 MB
702,react-draggable,9292,1054,9292,213,24/07/2014,28/02/2026,4.17 MB,React draggable component,JavaScript,https://github.com/react-grid-layout/react-draggable,4.17 MB
703,taskbook,9288,393,9288,102,12/02/2018,03/11/2025,560.00 KB,"Tasks, boards & notes for the command-line habitat",JavaScript,https://github.com/klaudiosinani/taskbook,560.00 KB
704,carlo,9283,313,9283,57,28/10/2018,29/04/2022,431.00 KB,Web rendering surface for Node applications,JavaScript,https://github.com/GoogleChromeLabs/carlo,431.00 KB
705,eslint-plugin-react,9275,2737,9275,340,15/12/2014,11/03/2026,8.36 MB,React-specific linting rules for ESLint,JavaScript,https://github.com/jsx-eslint/eslint-plugin-react,8.36 MB
706,material-design-for-bootstrap,9274,1118,9274,27,20/07/2016,01/02/2023,11.36 MB,Important! A new UI Kit version for Bootstrap 5 is available. Access the latest free version via the link below.,JavaScript,https://github.com/mdbootstrap/material-design-for-bootstrap,11.36 MB
707,webfontloader,9271,638,9271,107,21/04/2010,04/01/2024,28.82 MB,Web Font Loader gives you added control when using linked fonts via @font-face.,JavaScript,https://github.com/typekit/webfontloader,28.82 MB
708,terser,9258,443,9258,327,11/01/2015,16/03/2026,13.36 MB,"🗜 JavaScript parser, mangler and compressor toolkit for ES6+",JavaScript,https://github.com/terser/terser,13.36 MB
709,prompts,9257,320,9257,152,24/02/2018,14/05/2025,8.50 MB,"❯ Lightweight, beautiful and user-friendly interactive prompts",JavaScript,https://github.com/terkelg/prompts,8.50 MB
710,ChakraCore,9241,1216,9241,612,05/01/2016,19/02/2026,180.53 MB,ChakraCore is an open source Javascript engine with a C API.,JavaScript,https://github.com/chakra-core/ChakraCore,180.53 MB
711,node-schedule,9222,505,9222,171,11/05/2011,19/06/2025,358.00 KB,A cron-like and not-cron-like job scheduler for Node.,JavaScript,https://github.com/node-schedule/node-schedule,358.00 KB
712,lunr.js,9215,560,9215,129,23/06/2011,31/07/2024,4.00 MB,"A bit like Solr, but much smaller and not as bright",JavaScript,https://github.com/olivernn/lunr.js,4.00 MB
713,laverna,9211,793,9211,448,21/01/2014,30/05/2021,6.51 MB,Laverna is a JavaScript note taking application with Markdown editor and encryption support. Consider it like open source alternative to Evernote.,JavaScript,https://github.com/Laverna/laverna,6.51 MB
714,grpc-web,9195,788,9195,185,20/06/2016,07/02/2026,1.42 MB,gRPC for Web Clients,JavaScript,https://github.com/grpc/grpc-web,1.42 MB
715,evil-huawei,9188,679,9188,4,01/12/2019,01/07/2021,14.34 MB,Evil Huawei - 华为作过的恶,JavaScript,https://github.com/evil-huawei/evil-huawei,14.34 MB
716,signale,9171,233,9171,40,08/04/2018,17/01/2026,1.01 MB,Highly configurable logging library,JavaScript,https://github.com/klaudiosinani/signale,1.01 MB
717,apihub,9154,1412,9154,61,20/05/2023,14/03/2025,6.18 MB,"Your own API Hub to learn and master API interaction. Ideal for frontend, mobile dev and backend developers. ",JavaScript,https://github.com/hiteshchoudhary/apihub,6.18 MB
718,xgplayer,9145,932,9145,26,16/05/2018,19/03/2026,457.20 MB,A HTML5 video player with a parser that saves traffic,JavaScript,https://github.com/bytedance/xgplayer,457.20 MB
719,stylex,9141,396,9141,118,08/12/2022,19/03/2026,17.84 MB,StyleX is the styling system for ambitious user interfaces.,JavaScript,https://github.com/facebook/stylex,17.84 MB
720,CF-Workers-docker.io,9131,10638,9131,55,10/06/2024,26/06/2025,337.00 KB,这个项目是一个基于 Cloudflare Workers 的 Docker 镜像代理工具。它能够中转对 Docker 官方镜像仓库的请求，解决一些访问限制和加速访问的问题。,JavaScript,https://github.com/cmliu/CF-Workers-docker.io,337.00 KB
721,computer-science-in-javascript,9124,1193,9124,12,12/04/2009,08/01/2026,134.00 KB,"Collection of classic computer science paradigms, algorithms, and approaches written in JavaScript. ",JavaScript,https://github.com/humanwhocodes/computer-science-in-javascript,134.00 KB
722,cube-ui,9122,1456,9122,65,03/11/2017,05/01/2026,27.09 MB,:large_orange_diamond: A fantastic mobile ui lib implement by Vue,JavaScript,https://github.com/didi/cube-ui,27.09 MB
723,city-roads,9121,690,9121,34,19/01/2020,17/03/2026,2.06 MB,Visualization of all roads within any city,JavaScript,https://github.com/anvaka/city-roads,2.06 MB
724,node-telegram-bot-api,9120,1651,9120,105,28/06/2015,15/03/2026,2.09 MB,Telegram Bot API for NodeJS,JavaScript,https://github.com/yagop/node-telegram-bot-api,2.09 MB
725,is.js,9102,618,9102,47,01/01/2015,11/01/2022,617.00 KB,Micro check library,JavaScript,https://github.com/arasatasaygin/is.js,617.00 KB
726,stats.js,9102,1199,9102,22,08/04/2010,11/10/2024,31.86 MB,JavaScript Performance Monitor,JavaScript,https://github.com/mrdoob/stats.js,31.86 MB
727,jsdiff,9093,525,9093,19,29/03/2011,18/03/2026,2.54 MB,A javascript text differencing implementation.,JavaScript,https://github.com/kpdecker/jsdiff,2.54 MB
728,gremlins.js,9086,426,9086,21,21/10/2013,06/03/2023,4.60 MB,Monkey testing library for web apps and Node.js,JavaScript,https://github.com/marmelab/gremlins.js,4.60 MB
729,kiss-translator,9083,382,9083,99,18/07/2023,18/03/2026,18.75 MB,"A simple, open source bilingual translation extension & Greasemonkey script (一个简约、开源的 双语对照翻译扩展 & 油猴脚本)",JavaScript,https://github.com/fishjar/kiss-translator,18.75 MB
730,jshint,9070,1626,9070,464,19/01/2011,13/02/2025,19.67 MB,JSHint is a tool that helps to detect errors and potential problems in your JavaScript code,JavaScript,https://github.com/jshint/jshint,19.67 MB
731,bigbluebutton,9057,5998,9057,741,25/05/2010,19/03/2026,939.58 MB,A complete web conferencing system for virtual classes and more!,JavaScript,https://github.com/bigbluebutton/bigbluebutton,939.58 MB
732,WebGoat,9035,7498,9035,53,06/03/2015,08/02/2026,102.68 MB,WebGoat is a deliberately insecure application,JavaScript,https://github.com/WebGoat/WebGoat,102.68 MB
733,BingGPT,9026,678,9026,241,16/02/2023,08/02/2024,1.62 MB,"Desktop application of new Bing's AI-powered chat (Windows, macOS and Linux)",JavaScript,https://github.com/dice2o/BingGPT,1.62 MB
734,easy-mock,9018,1345,9018,186,27/08/2017,09/01/2023,3.32 MB,A persistent service that generates mock data quickly and provids visualization view.,JavaScript,https://github.com/easy-mock/easy-mock,3.32 MB
735,mapscii,9010,285,9010,49,18/09/2016,03/11/2024,13.61 MB,"🗺  MapSCII is a Braille & ASCII world map renderer for your console - enter => telnet mapscii.me <= on Mac (brew install telnet) and Linux, connect with PuTTY on Windows",JavaScript,https://github.com/rastapasta/mapscii,13.61 MB
736,htm,9010,178,9010,49,30/07/2018,01/02/2024,377.00 KB,"Hyperscript Tagged Markup: JSX alternative using standard tagged templates, with compiler support.",JavaScript,https://github.com/developit/htm,377.00 KB
737,Parsley.js,8996,1289,8996,71,16/12/2012,18/03/2026,9.64 MB,"Validate your forms, frontend, without writing a single line of javascript",JavaScript,https://github.com/guillaumepotier/Parsley.js,9.64 MB
738,chameleon,8988,693,8988,277,18/01/2019,07/01/2023,129.22 MB,🦎 一套代码运行多端，一端所见即多端所见,JavaScript,https://github.com/didi/chameleon,129.22 MB
739,buster,8983,668,8983,45,18/11/2018,04/06/2024,2.03 MB,"Captcha solver extension for humans, available for Chrome, Edge and Firefox",JavaScript,https://github.com/dessant/buster,2.03 MB
740,carbon,8958,2120,8958,1059,13/03/2017,20/03/2026,7.68 GB,A design system built by IBM,JavaScript,https://github.com/carbon-design-system/carbon,7.68 GB
741,js-beautify,8953,1406,8953,438,04/12/2008,07/02/2026,12.69 MB,Beautifier for javascript ,JavaScript,https://github.com/beautifier/js-beautify,12.69 MB
742,Sub-Store,8951,1049,8951,18,19/08/2020,14/03/2026,9.63 MB,"Advanced Subscription Manager for QX, Loon, Surge, Stash, Egern and Shadowrocket!",JavaScript,https://github.com/sub-store-org/Sub-Store,9.63 MB
743,TimelineJS,8948,1542,8948,195,06/03/2012,11/05/2022,17.92 MB,TimelineJS: A Storytelling Timeline built in JavaScript. ,JavaScript,https://github.com/NUKnightLab/TimelineJS,17.92 MB
744,react-native-router-flux,8946,2085,8946,335,25/08/2015,28/06/2023,5.55 MB,The first declarative React Native router,JavaScript,https://github.com/aksonov/react-native-router-flux,5.55 MB
745,xiaozhi-esp32-server,8942,3047,8942,686,02/02/2025,19/03/2026,179.04 MB,"本项目为xiaozhi-esp32提供后端服务，帮助您快速搭建ESP32设备控制服务器。Backend service for xiaozhi-esp32, helps you quickly build an ESP32 device control server.",JavaScript,https://github.com/xinnan-tech/xiaozhi-esp32-server,179.04 MB
746,rawgraphs-app,8940,1852,8940,74,17/04/2013,18/11/2025,52.24 MB,A web interface to create custom vector-based visualizations on top of RAWGraphs core,JavaScript,https://github.com/rawgraphs/rawgraphs-app,52.24 MB
747,escrcpy,8924,624,8924,41,15/09/2023,13/03/2026,299.47 MB,📱 Display and control your Android device graphically with scrcpy.,JavaScript,https://github.com/viarotel-org/escrcpy,299.47 MB
748,artillery,8923,547,8923,478,28/05/2015,11/03/2026,53.71 MB,"The complete load testing platform. Everything you need for production-grade load tests. Serverless & distributed. Load test with Playwright. Load test HTTP APIs, GraphQL, WebSocket, and more. Use any Node.js module.",JavaScript,https://github.com/artilleryio/artillery,53.71 MB
749,qs,8922,869,8922,69,25/07/2014,15/02/2026,12.24 MB,A querystring parser and serializer with nesting support,JavaScript,https://github.com/ljharb/qs,12.24 MB
750,tailblocks,8917,841,8917,47,14/05/2020,31/01/2023,25.77 MB,Ready-to-use Tailwind CSS blocks.,JavaScript,https://github.com/mertJF/tailblocks,25.77 MB
751,nunjucks,8915,653,8915,354,09/08/2012,07/02/2026,7.99 MB,"A powerful templating engine with inheritance, asynchronous control, and more (jinja2 inspired)",JavaScript,https://github.com/mozilla/nunjucks,7.99 MB
752,cnn-explainer,8896,1332,8896,5,03/11/2019,14/10/2023,88.28 MB,Learning Convolutional Neural Networks with Interactive Visualization.,JavaScript,https://github.com/poloclub/cnn-explainer,88.28 MB
753,min,8894,831,8894,599,31/10/2015,01/03/2026,179.46 MB,"A fast, minimal browser that protects your privacy",JavaScript,https://github.com/minbrowser/min,179.46 MB
754,imagesloaded,8886,1127,8886,15,25/08/2011,22/02/2022,573.00 KB,":camera: JavaScript is all like ""You images done yet or what?""",JavaScript,https://github.com/desandro/imagesloaded,573.00 KB
755,release-it,8880,556,8880,56,15/01/2014,20/01/2026,6.94 MB,🚀 Automate versioning and package publishing,JavaScript,https://github.com/release-it/release-it,6.94 MB
756,OnsenUI,8867,1010,8867,13,11/09/2013,21/01/2026,191.56 MB,"Mobile app development framework and SDK using HTML5 and JavaScript. Create beautiful and performant cross-platform mobile apps. Based on Web Components, and provides bindings for Angular 1, 2, React and Vue.js.",JavaScript,https://github.com/OnsenUI/OnsenUI,191.56 MB
757,node-fetch,8860,1052,8860,238,26/01/2015,13/08/2024,1.24 MB,A light-weight module that brings the Fetch API to Node.js,JavaScript,https://github.com/node-fetch/node-fetch,1.24 MB
758,ytDownloader,8860,759,8860,35,25/07/2022,15/02/2026,4.59 MB,Desktop App for downloading Videos and Audios from hundreds of sites,JavaScript,https://github.com/aandrew-me/ytDownloader,4.59 MB
759,nue,8855,261,8855,77,13/09/2023,17/02/2026,36.53 MB,Fastest way to build modern websites,JavaScript,https://github.com/nuejs/nue,36.53 MB
760,awesome-wpo,8854,572,8854,12,14/10/2014,12/03/2026,842.00 KB,:pencil: A curated list of Web Performance Optimization. Everyone can contribute here!,JavaScript,https://github.com/davidsonfellipe/awesome-wpo,842.00 KB
761,gridstudio,8847,1490,8847,42,23/07/2019,07/11/2023,127.56 MB,Grid studio is a web-based application for data science with full integration of open source data science frameworks and languages.,JavaScript,https://github.com/ricklamers/gridstudio,127.56 MB
