Ranking,Project Name,Stars,Forks,Watchers,Open Issues,Created At,Last Commit,Size,Description,Language,Repo URL,Size
509,Detox,11862,1914,11862,186,15/06/2016,19/03/2026,71.94 MB,Gray box end-to-end testing and automation framework for mobile apps,JavaScript,https://github.com/wix/Detox,71.94 MB
510,ivideo,11855,3185,11855,54,17/04/2018,28/01/2021,7.16 MB,一个可以观看国内主流视频平台所有视频的客户端（Mac、Windows、Linux） A client that can watch video of domestic(China) mainstream video platform,JavaScript,https://github.com/phobal/ivideo,7.16 MB
511,bootstrap-table,11827,4384,11827,226,20/08/2013,20/03/2026,47.72 MB,"An extended table for integration with some of the most widely used CSS frameworks. (Supports Bootstrap, Semantic UI, Bulma, Material Design, Foundation, Vue.js)",JavaScript,https://github.com/wenzhixin/bootstrap-table,47.72 MB
512,summernote,11826,2270,11826,107,27/04/2013,20/03/2026,20.61 MB,Super Simple WYSIWYG Editor,JavaScript,https://github.com/summernote/summernote,20.61 MB
513,vega,11819,1561,11819,491,03/02/2013,19/03/2026,106.22 MB,A visualization grammar.,JavaScript,https://github.com/vega/vega,106.22 MB
514,ReLaXed,11800,427,11800,52,21/03/2018,07/09/2025,854.00 KB,Create PDF documents using web technologies,JavaScript,https://github.com/RelaxedJS/ReLaXed,854.00 KB
515,mousetrap,11799,961,11799,237,05/07/2012,15/03/2023,461.00 KB,Simple library for handling keyboard shortcuts in Javascript,JavaScript,https://github.com/ccampbell/mousetrap,461.00 KB
516,blessed,11787,560,11787,253,27/01/2013,22/03/2024,13.11 MB,A high-level terminal interface library for node.js.,JavaScript,https://github.com/chjj/blessed,13.11 MB
517,TikTok-Unlock,11781,839,11781,368,02/06/2020,18/09/2025,7.04 MB,TikTok 無需拔卡解鎖最新支援  iPhone &iPad 、TikTok&TikTok TestFlight，地區切換 、視頻發佈 、 live 直播 、點贊 評論、私信聊天等！,JavaScript,https://github.com/Semporia/TikTok-Unlock,7.04 MB
518,medis,11770,789,11770,72,12/10/2015,21/02/2024,51.64 MB,"💻 Medis is a beautiful, easy-to-use Mac database management application for Redis.",JavaScript,https://github.com/luin/medis,51.64 MB
519,svg.js,11754,1083,11754,15,15/12/2012,15/09/2025,11.14 MB,The lightweight library for manipulating and animating SVG,JavaScript,https://github.com/svgdotjs/svg.js,11.14 MB
520,github-do-not-ban-us,11718,1024,11718,8,25/07/2019,01/08/2019,6.58 MB,GitHub do not ban us from open source world :iran:,JavaScript,https://github.com/1995parham/github-do-not-ban-us,6.58 MB
521,leanote,11715,2449,11715,517,05/05/2014,27/11/2023,120.88 MB,Not Just A Notepad! (golang + mongodb) http://leanote.org,JavaScript,https://github.com/leanote/leanote,120.88 MB
522,react.dev,11709,7870,11709,1465,06/10/2017,09/03/2026,188.65 MB,The React documentation website,JavaScript,https://github.com/reactjs/react.dev,188.65 MB
523,planka,11689,1203,11689,413,30/08/2019,19/03/2026,55.45 MB,PLANKA is the Kanban-style project mastering tool for everyone,JavaScript,https://github.com/plankanban/planka,55.45 MB
524,WatermelonDB,11608,643,11608,295,28/08/2018,11/08/2025,30.24 MB,🍉 Reactive & asynchronous database for powerful React and React Native apps ⚡️,JavaScript,https://github.com/Nozbe/WatermelonDB,30.24 MB
525,gutenberg,11584,4734,11584,7721,03/02/2017,20/03/2026,925.43 MB,The Block Editor project for WordPress and beyond. Plugin is available from the official repository.,JavaScript,https://github.com/WordPress/gutenberg,925.43 MB
526,firefox,11581,975,11581,10,30/07/2024,20/03/2026,4.47 GB,The official repository of Mozilla's Firefox web browser.,JavaScript,https://github.com/mozilla-firefox/firefox,4.47 GB
527,examples,11533,4411,11533,182,12/11/2016,06/08/2025,16.49 MB,"Serverless Examples – A collection of boilerplates and examples of serverless architectures built with the Serverless Framework on AWS Lambda, Microsoft Azure, Google Cloud Functions, and more.",JavaScript,https://github.com/serverless/examples,16.49 MB
528,minimal-repro,11521,4933,11521,14,16/10/2015,18/03/2026,1.31 MB,Clone to try a simple Electron app,JavaScript,https://github.com/electron/minimal-repro,1.31 MB
529,mdx-deck,11479,600,11479,141,28/07/2018,04/01/2023,10.20 MB,♠️ React MDX-based presentation decks,JavaScript,https://github.com/jxnblk/mdx-deck,10.20 MB
530,yargs,11457,1011,11457,310,07/11/2013,28/02/2026,5.25 MB," yargs the modern, pirate-themed successor to optimist.",JavaScript,https://github.com/yargs/yargs,5.25 MB
531,debug,11450,966,11450,85,29/11/2011,29/01/2026,421.00 KB,A tiny JavaScript debugging utility modelled after Node.js core's debugging technique. Works in Node.js and web browsers,JavaScript,https://github.com/debug-js/debug,421.00 KB
532,stylelint,11438,995,11438,140,04/12/2014,19/03/2026,35.45 MB,A mighty CSS linter that helps you avoid errors and enforce conventions.,JavaScript,https://github.com/stylelint/stylelint,35.45 MB
533,magnetW,11372,2084,11372,31,09/03/2018,09/04/2022,7.17 MB,[已失效，不再维护],JavaScript,https://github.com/xiandanin/magnetW,7.17 MB
534,awesome-ctf,11365,1612,11365,55,28/02/2015,22/07/2024,569.00 KB,"A curated list of CTF frameworks, libraries, resources and softwares",JavaScript,https://github.com/apsdehal/awesome-ctf,569.00 KB
535,Magnific-Popup,11357,3399,11357,678,10/01/2013,08/06/2024,1.94 MB,Light and responsive lightbox script with focus on performance.,JavaScript,https://github.com/dimsemenov/Magnific-Popup,1.94 MB
536,junior-recruit-scheduler,11346,1626,11346,21,04/05/2017,27/07/2024,13.75 MB,주니어 개발자 채용 정보,JavaScript,https://github.com/jojoldu/junior-recruit-scheduler,13.75 MB
537,jquery-ui,11346,5235,11346,152,19/01/2010,06/03/2026,30.13 MB,The official jQuery user interface library.,JavaScript,https://github.com/jquery/jquery-ui,30.13 MB
538,acorn,11342,1015,11342,15,24/09/2012,14/03/2026,6.33 MB,"A small, fast, JavaScript-based JavaScript parser",JavaScript,https://github.com/acornjs/acorn,6.33 MB
539,stylus,11324,1142,11324,281,28/12/2010,24/04/2025,7.26 MB,"Expressive, robust, feature-rich CSS language built for nodejs",JavaScript,https://github.com/stylus/stylus,7.26 MB
540,blur-admin,11322,3050,11322,258,08/04/2016,01/01/2024,85.62 MB,AngularJS Bootstrap Admin Panel Framework,JavaScript,https://github.com/akveo/blur-admin,85.62 MB
541,raphael,11293,1653,11293,347,02/09/2008,12/01/2024,6.70 MB,JavaScript Vector Library,JavaScript,https://github.com/DmitryBaranovskiy/raphael,6.70 MB
542,TwitchAdSolutions,11268,585,11268,13,22/12/2020,05/03/2026,505.00 KB,,JavaScript,https://github.com/pixeltris/TwitchAdSolutions,505.00 KB
543,Respond,11261,3293,11261,115,07/02/2011,16/03/2018,321.00 KB,"A fast & lightweight polyfill for min/max-width CSS3 Media Queries (for IE 6-8, and more)",JavaScript,https://github.com/scottjehl/Respond,321.00 KB
544,SS-Rule-Snippet,11255,1808,11255,40,11/10/2016,19/03/2024,1.03 MB,搜集、整理、维护 Surge / Quantumult (X) / Shadowrocket / Surfboard / clash (Premium) 实用规则。,JavaScript,https://github.com/Hackl0us/SS-Rule-Snippet,1.03 MB
545,list.js,11244,889,11244,202,30/01/2011,27/04/2025,3.48 MB,"The perfect library for adding search, sort, filters and flexibility to tables, lists and various HTML elements. Built to be invisible and work on existing HTML.",JavaScript,https://github.com/javve/list.js,3.48 MB
546,quicklink,11230,420,11230,40,23/11/2018,10/03/2026,13.91 MB,⚡️Faster subsequent page-loads by prefetching in-viewport links during idle time,JavaScript,https://github.com/GoogleChromeLabs/quicklink,13.91 MB
547,NotionNext,11226,14505,11226,437,26/09/2021,18/02/2026,56.23 MB,"使用 NextJS + Notion API 实现的，支持多种部署方案的静态博客，无需服务器、零门槛搭建网站，为Notion和所有创作者设计。 (A static blog built with NextJS and Notion API, supporting multiple deployment options. No server required, zero threshold to set up a website. Designed for Notion and all creators.)",JavaScript,https://github.com/tangly1024/NotionNext,56.23 MB
548,react-native-macos,11211,420,11211,75,04/10/2015,13/02/2024,83.47 MB,[deprecated in favor of https://microsoft.github.io/react-native-windows/] React Native for macOS is an experimental fork for writing desktop apps using Cocoa,JavaScript,https://github.com/ptmt/react-native-macos,83.47 MB
549,listen1_desktop,11208,1518,11208,948,19/05/2016,17/03/2026,1.21 MB,"one for all free music in china (Windows, Mac, Linux desktop)",JavaScript,https://github.com/listen1/listen1_desktop,1.21 MB
550,pipedream,11187,5617,11187,4365,22/01/2020,20/03/2026,655.09 MB,"Connect APIs, remarkably fast.  Free for developers.",JavaScript,https://github.com/PipedreamHQ/pipedream,655.09 MB
551,apachecn-algo-zh,11169,2184,11169,4,29/09/2017,19/06/2024,1.11 MB,ApacheCN 数据结构与算法译文集,JavaScript,https://github.com/apachecn/apachecn-algo-zh,1.11 MB
552,Awesome-Profile-README-templates,11157,7311,11157,94,09/07/2020,08/08/2024,482.00 KB,A collection of awesome readme templates to display on your profile,JavaScript,https://github.com/kautukkundan/Awesome-Profile-README-templates,482.00 KB
553,convnetjs,11146,2069,11146,75,05/01/2014,07/01/2023,27.15 MB,Deep Learning in Javascript. Train Convolutional Neural Networks (or ordinary ones) in your browser.,JavaScript,https://github.com/karpathy/convnetjs,27.15 MB
554,readme-md-generator,11104,1382,11104,30,03/06/2019,20/09/2022,2.57 MB,📄 CLI that generates beautiful README.md files,JavaScript,https://github.com/kefranabg/readme-md-generator,2.57 MB
555,Sigma-Web-Dev-Course,11100,3063,11100,179,26/09/2023,05/11/2024,98.80 MB,Source Code for Sigma Web Development Course,JavaScript,https://github.com/CodeWithHarry/Sigma-Web-Dev-Course,98.80 MB
556,jvm,11077,2312,11077,1,23/06/2018,21/01/2026,64.97 MB,🤗 JVM 底层原理最全知识总结,JavaScript,https://github.com/doocs/jvm,64.97 MB
557,razzle,11064,852,11064,136,10/02/2016,11/03/2024,13.58 MB,✨ Create server-rendered universal JavaScript applications with no configuration,JavaScript,https://github.com/jaredpalmer/razzle,13.58 MB
558,jira_clone,11063,2151,11063,10,02/12/2019,20/06/2024,1.93 MB,"A simplified Jira clone built with React/Babel (Client), and Node/TypeScript (API). Auto formatted with Prettier, tested with Cypress.",JavaScript,https://github.com/oldboyxx/jira_clone,1.93 MB
559,OSINT-Framework,11050,1796,11050,77,19/12/2015,14/03/2026,1.94 MB,OSINT Framework,JavaScript,https://github.com/lockfale/OSINT-Framework,1.94 MB
560,readability,11025,703,11025,302,03/02/2015,21/01/2026,6.81 MB,A standalone version of the readability lib,JavaScript,https://github.com/mozilla/readability,6.81 MB
561,daterangepicker,11003,3274,11003,121,20/08/2012,09/08/2024,2.10 MB,"JavaScript Date Range, Date and Time Picker Component",JavaScript,https://github.com/dangrossman/daterangepicker,2.10 MB
562,react-dropzone,10981,798,10981,71,27/09/2014,10/02/2026,4.91 MB,Simple HTML5 drag-drop zone with React.js.,JavaScript,https://github.com/react-dropzone/react-dropzone,4.91 MB
563,spug,10979,2193,10979,224,31/01/2018,08/03/2026,5.40 MB,开源运维平台：面向中小型企业设计的轻量级无Agent的自动化运维平台，整合了主机管理、主机批量执行、主机在线终端、文件在线上传下载、应用发布部署、在线任务计划、配置中心、监控、报警等一系列功能。,JavaScript,https://github.com/openspug/spug,5.40 MB
564,muuri,10968,655,10968,117,21/12/2015,25/05/2024,7.87 MB,"Infinite responsive, sortable, filterable and draggable layouts",JavaScript,https://github.com/haltu/muuri,7.87 MB
565,kodluyoruz-frontend-101-egitimi,10962,4033,10962,7,23/12/2020,28/11/2025,2.58 MB,Kodluyoruz için Hazırladığım Video Eğitim Seti Repo'sudur. Tüm Eğitimlerime: https://linktr.ee/hakanyalcinkaya adresinden ulaşabilirsiniz.,JavaScript,https://github.com/hakanyalcinkaya/kodluyoruz-frontend-101-egitimi,2.58 MB
566,impeccable,10962,419,10962,14,16/11/2025,20/03/2026,13.37 MB,The design language that makes your AI harness better at design.,JavaScript,https://github.com/pbakaus/impeccable,13.37 MB
567,fullstack-course4,10937,11736,10937,3,15/02/2016,05/08/2024,30.87 MB,"Example code for HTML, CSS, and Javascript for Web Developers Coursera Course",JavaScript,https://github.com/jhu-ep-coursera/fullstack-course4,30.87 MB
568,dashing,10920,1157,10920,251,18/07/2012,29/04/2019,2.48 MB,The exceptionally handsome dashboard framework in Ruby and Coffeescript.,JavaScript,https://github.com/Shopify/dashing,2.48 MB
569,react-sortable-hoc,10902,969,10902,291,08/06/2016,13/09/2023,21.83 MB,"A set of higher-order components to turn any list into an animated, accessible and touch-friendly sortable list✌️",JavaScript,https://github.com/clauderic/react-sortable-hoc,21.83 MB
570,ndb,10902,247,10902,55,20/07/2018,26/05/2022,730.00 KB,"ndb is an improved debugging experience for Node.js, enabled by Chrome DevTools",JavaScript,https://github.com/GoogleChromeLabs/ndb,730.00 KB
571,cytoscape.js,10900,1663,10900,23,23/08/2011,18/03/2026,84.73 MB,Graph theory (network) library for visualisation and analysis,JavaScript,https://github.com/cytoscape/cytoscape.js,84.73 MB
572,vue-hackernews-2.0,10899,2130,10899,145,05/08/2016,08/12/2022,1.01 MB,"HackerNews clone built with Vue 2.0, vue-router & vuex, with server-side rendering",JavaScript,https://github.com/vuejs/vue-hackernews-2.0,1.01 MB
573,natural,10872,854,10872,80,07/05/2011,22/02/2026,63.97 MB,general natural language facilities for node,JavaScript,https://github.com/NaturalNode/natural,63.97 MB
574,android-training-course-in-chinese,10868,2660,10868,13,13/06/2014,11/01/2018,94.22 MB,Android官方培训课程中文版,JavaScript,https://github.com/kesenhoo/android-training-course-in-chinese,94.22 MB
575,spectrum,10857,1206,10857,288,29/06/2016,20/07/2022,52.67 MB,"Simple, powerful online communities.",JavaScript,https://github.com/withspectrum/spectrum,52.67 MB
576,headroom.js,10848,805,10848,20,07/08/2013,25/10/2023,699.00 KB,Give your pages some headroom. Hide your header until you need it,JavaScript,https://github.com/WickyNilliams/headroom.js,699.00 KB
577,hermes,10832,746,10832,191,22/10/2018,19/03/2026,107.97 MB,A JavaScript engine optimized for running React Native.,JavaScript,https://github.com/facebook/hermes,107.97 MB
578,SpaceX-API,10826,976,10826,78,19/06/2017,17/08/2024,17.51 MB,":rocket: Open Source REST API for SpaceX launch, rocket, core, capsule, starlink, launchpad, and landing pad data.",JavaScript,https://github.com/r-spacex/SpaceX-API,17.51 MB
579,MathJax,10801,1196,10801,171,19/08/2010,19/02/2026,156.72 MB,Beautiful and accessible math in all browsers,JavaScript,https://github.com/mathjax/MathJax,156.72 MB
580,Crash-Course-Computer-Science-Chinese,10788,1607,10788,2,21/09/2017,27/02/2026,2.24 MB,计算机速成课（播放量 486 万） （共40集）,JavaScript,https://github.com/1c7/Crash-Course-Computer-Science-Chinese,2.24 MB
581,dom-to-image,10785,1693,10785,337,17/04/2015,08/04/2024,9.54 MB,Generates an image from a DOM node using HTML5 canvas,JavaScript,https://github.com/tsayen/dom-to-image,9.54 MB
582,beef,10778,2344,10778,43,23/11/2011,19/03/2026,24.43 MB,The Browser Exploitation Framework Project,JavaScript,https://github.com/beefproject/beef,24.43 MB
583,html-webpack-plugin,10744,1298,10744,39,08/08/2014,16/01/2026,1.90 MB,Simplifies creation of HTML files to serve your webpack bundles,JavaScript,https://github.com/jantimon/html-webpack-plugin,1.90 MB
584,chatGPTBox,10734,853,10734,368,15/03/2023,17/03/2026,3.82 MB,"Integrating ChatGPT into your browser deeply, everything you need is here",JavaScript,https://github.com/ChatGPTBox-dev/chatGPTBox,3.82 MB
585,sharedrop,10729,864,10729,109,20/03/2014,10/02/2025,2.28 MB,Easy P2P file transfer powered by WebRTC - inspired by Apple AirDrop,JavaScript,https://github.com/ShareDropio/sharedrop,2.28 MB
586,DeFi-Developer-Road-Map,10713,1309,10713,3,20/06/2021,14/03/2026,2.84 MB,"DeFi Developer roadmap is a curated Developer handbook which includes a list of the best tools for DApps development, resources and references! ",JavaScript,https://github.com/OffcierCia/DeFi-Developer-Road-Map,2.84 MB
587,node-restify,10711,983,10711,130,25/04/2011,19/09/2024,4.27 MB,The future of Node.js REST development,JavaScript,https://github.com/restify/node-restify,4.27 MB
588,engineer-manager,10693,644,10693,4,22/11/2016,02/03/2026,1018.00 KB,A list of engineering manager resource links.,JavaScript,https://github.com/ryanburgess/engineer-manager,1018.00 KB
589,history.js,10691,1321,10691,228,20/01/2011,12/02/2022,3.00 MB,"History.js gracefully supports the HTML5 History/State APIs (pushState, replaceState, onPopState) in all browsers. Including continued support for data, titles, replaceState. Supports jQuery, MooTools and Prototype.  For HTML5 browsers this means that you can modify the URL directly, without needing to use hashes anymore. For HTML4 browsers it will revert back to using the old onhashchange functionality.",JavaScript,https://github.com/browserstate/history.js,3.00 MB
590,awesome-guidelines,10665,612,10665,1,12/07/2017,05/03/2026,538.00 KB,A curated list of high quality coding style conventions and standards.,JavaScript,https://github.com/Kristories/awesome-guidelines,538.00 KB
591,node-canvas,10657,1184,10657,457,29/09/2010,17/03/2026,4.93 MB,Node canvas is a Cairo backed Canvas implementation for NodeJS.,JavaScript,https://github.com/Automattic/node-canvas,4.93 MB
592,kutt,10655,1430,10655,85,13/02/2018,27/02/2026,5.23 MB,Free Modern URL Shortener.,JavaScript,https://github.com/thedevs-network/kutt,5.23 MB
593,context-hub,10643,936,10643,95,30/10/2025,19/03/2026,5.83 MB,,JavaScript,https://github.com/andrewyng/context-hub,5.83 MB
594,zdog,10612,401,10612,54,06/03/2019,18/07/2023,659.00 KB,"Flat, round, designer-friendly pseudo-3D engine for canvas & SVG",JavaScript,https://github.com/metafizzy/zdog,659.00 KB
595,pdfkit,10610,1209,10610,402,11/07/2011,18/03/2026,52.84 MB,A JavaScript PDF generation library for Node and the browser,JavaScript,https://github.com/foliojs/pdfkit,52.84 MB
596,linux-dash,10590,1198,10590,46,16/10/2013,16/04/2024,4.58 MB,A beautiful web dashboard for Linux,JavaScript,https://github.com/tariqbuilds/linux-dash,4.58 MB
597,ungit,10573,641,10573,229,19/05/2013,20/03/2026,21.11 MB,The easiest way to use git. On any platform. Anywhere.,JavaScript,https://github.com/FredrikNoren/ungit,21.11 MB
598,falcor,10573,444,10573,74,13/02/2015,28/08/2025,23.13 MB,A JavaScript library for efficient data fetching,JavaScript,https://github.com/Netflix/falcor,23.13 MB
599,vue2-happyfri,10556,2874,10556,30,08/12/2016,11/03/2023,5.25 MB,vue2 + vue-router + vuex  入门项目,JavaScript,https://github.com/bailicangdu/vue2-happyfri,5.25 MB
600,chroma.js,10551,545,10551,64,12/12/2011,02/03/2026,3.22 MB,JavaScript library for all kinds of color manipulations,JavaScript,https://github.com/gka/chroma.js,3.22 MB
601,knockout,10538,1495,10538,346,05/07/2010,18/03/2026,7.75 MB,"Knockout makes it easier to create rich, responsive UIs with JavaScript",JavaScript,https://github.com/knockout/knockout,7.75 MB
602,reactstrap,10535,1296,10535,323,19/02/2016,26/09/2024,7.45 MB,Simple React Bootstrap 5 components,JavaScript,https://github.com/reactstrap/reactstrap,7.45 MB
603,react-native-snap-carousel,10531,2295,10531,406,11/10/2016,25/06/2024,1.28 MB,"Swiper/carousel component for React Native featuring previews, multiple layouts, parallax images, performant handling of huge numbers of items, and more. Compatible with Android & iOS.",JavaScript,https://github.com/meliorence/react-native-snap-carousel,1.28 MB
604,reactide,10525,623,10525,58,07/03/2017,08/01/2023,53.90 MB,Reactide is the first dedicated IDE for React web application development.,JavaScript,https://github.com/reactide/reactide,53.90 MB
605,protobuf.js,10514,1613,10514,714,01/03/2013,11/03/2026,40.30 MB,Protocol Buffers for JavaScript & TypeScript.,JavaScript,https://github.com/protobufjs/protobuf.js,40.30 MB
606,stremio-web,10505,1125,10505,75,04/06/2018,19/03/2026,953.70 MB,Stremio - Freedom to Stream,JavaScript,https://github.com/Stremio/stremio-web,953.70 MB
607,react-native-swiper,10505,2316,10505,783,20/04/2015,01/02/2026,8.76 MB,The best Swiper component for React Native.,JavaScript,https://github.com/leecade/react-native-swiper,8.76 MB
608,lax.js,10493,491,10493,20,12/03/2019,21/05/2025,4.97 MB,Simple & lightweight (<4kb gzipped) vanilla JavaScript library to create smooth & beautiful animations when you scroll.,JavaScript,https://github.com/alexfoxy/lax.js,4.97 MB
609,live2d-widget,10492,2616,10492,19,11/07/2018,16/03/2026,1.80 MB,把萌萌哒的看板娘抱回家 (ノ≧∇≦)ノ | Live2D widget for web platform,JavaScript,https://github.com/stevenjoezhang/live2d-widget,1.80 MB
610,react-native-debugger,10475,819,10475,181,29/05/2016,21/10/2023,8.28 MB,"The standalone app based on official debugger of React Native, and includes React Inspector / Redux DevTools",JavaScript,https://github.com/jhen0409/react-native-debugger,8.28 MB
611,Detect-It-Easy,10446,888,10446,35,01/06/2014,19/03/2026,27.07 MB,"Program for determining types of files for Windows, Linux and MacOS.",JavaScript,https://github.com/horsicq/Detect-It-Easy,27.07 MB
612,lifeRestart,10391,2350,10391,212,15/08/2021,23/02/2026,32.94 MB,やり直すんだ。そして、次はうまくやる。,JavaScript,https://github.com/VickScarlet/lifeRestart,32.94 MB
613,nodeppt,10376,2043,10376,27,15/04/2012,25/01/2021,25.55 MB,This is probably the best web presentation tool so far!,JavaScript,https://github.com/ksky521/nodeppt,25.55 MB
614,react-static,10358,746,10358,1,09/09/2017,31/10/2022,36.92 MB,⚛️ 🚀 A progressive static site generator for React.,JavaScript,https://github.com/react-static/react-static,36.92 MB
615,jquery-validation,10338,2734,10338,41,05/05/2010,12/03/2026,8.07 MB,jQuery Validation Plugin library sources,JavaScript,https://github.com/jquery-validation/jquery-validation,8.07 MB
616,BrasilAPI,10333,709,10333,220,30/01/2020,27/02/2026,4.90 MB,Vamos transformar o Brasil em uma API?,JavaScript,https://github.com/BrasilAPI/BrasilAPI,4.90 MB
617,regexr,10333,1008,10333,218,07/03/2014,17/07/2025,2.12 MB,"RegExr is a HTML/JS based tool for creating, testing, and learning about Regular Expressions.",JavaScript,https://github.com/gskinner/regexr,2.12 MB
618,Lepton,10332,479,10332,85,30/12/2016,18/11/2025,41.76 MB,💻     Democratizing Snippet Management (macOS/Win/Linux),JavaScript,https://github.com/hackjutsu/Lepton,41.76 MB
619,waypoints,10331,1307,10331,102,25/01/2011,18/11/2022,1.32 MB,Waypoints is a library that makes it easy to execute a function whenever you scroll to an element.,JavaScript,https://github.com/imakewebthings/waypoints,1.32 MB
620,jszip,10325,1335,10325,410,30/08/2009,28/03/2025,24.21 MB,"Create, read and edit .zip files with Javascript",JavaScript,https://github.com/Stuk/jszip,24.21 MB
621,webui-aria2,10308,1469,10308,135,01/05/2012,05/04/2024,15.81 MB,"The aim for this project is to create the worlds best and hottest interface to interact with aria2. Very simple to use, just download and open index.html in any web browser. ",JavaScript,https://github.com/ziahamza/webui-aria2,15.81 MB
622,easydiffusion,10290,848,10290,119,23/08/2022,09/03/2026,58.91 MB,"An easy 1-click way to create beautiful artwork on your PC using AI, with no tech knowledge. Provides a browser UI for generating images from text prompts and images. Just enter your text prompt, and see the generated image.",JavaScript,https://github.com/easydiffusion/easydiffusion,58.91 MB
623,pollyjs,10258,355,10258,56,31/05/2018,31/05/2025,3.61 MB,"Record, Replay, and Stub HTTP Interactions.",JavaScript,https://github.com/Netflix/pollyjs,3.61 MB
624,react-transition-group,10258,646,10258,258,20/11/2016,05/03/2026,14.17 MB,An easy way to perform animations when a React component enters or leaves the DOM,JavaScript,https://github.com/reactjs/react-transition-group,14.17 MB
625,PatrickJS-starter,10248,4773,10248,0,07/03/2015,07/10/2023,3.72 MB,MFE Starter,JavaScript,https://github.com/PatrickJS/PatrickJS-starter,3.72 MB
626,react-redux-starter-kit,10245,2152,10245,130,24/06/2015,03/06/2018,1.16 MB,"Get started with React, Redux, and React-Router.",JavaScript,https://github.com/dvdzkwsk/react-redux-starter-kit,1.16 MB
627,fantasy-land,10228,374,10228,36,12/04/2013,10/11/2024,586.00 KB,Specification for interoperability of common algebraic structures in JavaScript,JavaScript,https://github.com/fantasyland/fantasy-land,586.00 KB
628,Betterfox,10203,253,10203,6,23/03/2020,28/02/2026,1.04 MB,"Firefox user.js for optimal privacy and security. Your favorite browser, but better.",JavaScript,https://github.com/yokoffing/Betterfox,1.04 MB
629,leonsans,10190,530,10190,14,28/07/2019,21/09/2020,11.23 MB,Leon Sans is a geometric sans-serif typeface made with code in 2019 by Jongmin Kim.,JavaScript,https://github.com/cmiscm/leonsans,11.23 MB
630,critical,10179,380,10179,48,28/06/2014,24/01/2026,4.88 MB,Extract & Inline Critical-path CSS in HTML pages,JavaScript,https://github.com/addyosmani/critical,4.88 MB
631,gekko,10178,3849,10178,0,12/05/2013,16/02/2020,5.90 MB,A bitcoin trading bot written in node - https://gekko.wizb.it/,JavaScript,https://github.com/askmike/gekko,5.90 MB
632,simplemde-markdown-editor,10155,1099,10155,290,19/06/2015,11/06/2024,9.12 MB,"A simple, beautiful, and embeddable JavaScript Markdown editor. Delightful editing for beginners and experts alike. Features built-in autosaving and spell checking.",JavaScript,https://github.com/sparksuite/simplemde-markdown-editor,9.12 MB
633,typescript-book,10140,597,10140,3,04/09/2022,14/03/2026,36.80 MB,The Concise TypeScript Book: A Concise Guide to Effective Development in TypeScript. Free and Open Source.,JavaScript,https://github.com/gibbok/typescript-book,36.80 MB
