Ranking,Project Name,Stars,Forks,Watchers,Open Issues,Created At,Last Commit,Size,Description,Language,Repo URL,Size
249,You-Dont-Need-jQuery,20210,1730,20210,3,21/11/2015,10/03/2026,749.00 KB,"Examples of how to do query, style, dom, ajax, event etc like jQuery with plain javascript.",JavaScript,https://github.com/camsong/You-Dont-Need-jQuery,749.00 KB
250,popmotion,20182,669,20182,51,17/08/2014,12/03/2024,48.92 MB,Simple animation libraries for delightful user interfaces,JavaScript,https://github.com/Popmotion/popmotion,48.92 MB
251,Fuse,20039,804,20039,7,28/05/2012,08/03/2025,9.75 MB,"Lightweight fuzzy-search, in JavaScript",JavaScript,https://github.com/krisk/Fuse,9.75 MB
252,nightmare,19964,1073,19964,203,05/04/2014,20/04/2024,2.48 MB,A high-level browser automation library.,JavaScript,https://github.com/segment-boneyard/nightmare,2.48 MB
253,trix,19931,1137,19931,172,01/08/2013,11/03/2026,7.17 MB,A rich text editor for everyday writing,JavaScript,https://github.com/basecamp/trix,7.17 MB
254,enzyme,19867,1984,19867,281,10/11/2015,22/10/2025,7.71 MB,JavaScript Testing utilities for React,JavaScript,https://github.com/enzymejs/enzyme,7.71 MB
255,snapdrop,19705,1889,19705,290,18/12/2015,10/02/2025,3.49 MB,A Progressive Web App for local file sharing ,JavaScript,https://github.com/SnapDrop/snapdrop,3.49 MB
256,Mock,19657,2651,19657,342,26/04/2013,15/03/2024,5.28 MB,A simulation data generator,JavaScript,https://github.com/nuysoft/Mock,5.28 MB
257,react-testing-library,19552,1155,19552,77,19/03/2018,19/01/2026,1.63 MB,🐐 Simple and complete React DOM testing utilities that encourage good testing practices.,JavaScript,https://github.com/testing-library/react-testing-library,1.63 MB
258,Recoil,19520,1222,19520,322,04/05/2020,01/01/2025,48.66 MB,"Recoil is an experimental state management library for React apps. It provides several capabilities that are difficult to achieve with React alone, while being compatible with the newest features of React.",JavaScript,https://github.com/facebookexperimental/Recoil,48.66 MB
259,eleventy,19512,568,19512,173,27/11/2017,18/03/2026,6.04 MB,A simpler site generator. Transforms a directory of templates (of varying types) into HTML.,JavaScript,https://github.com/11ty/eleventy,6.04 MB
260,RxJS,19392,2071,19392,286,07/01/2012,18/04/2018,66.38 MB,The Reactive Extensions for JavaScript,JavaScript,https://github.com/Reactive-Extensions/RxJS,66.38 MB
261,snowpack,19372,911,19372,387,26/02/2019,05/03/2023,80.29 MB,"ESM-powered frontend build tool. Instant, lightweight, unbundled development. ✌️",JavaScript,https://github.com/FredKSchott/snowpack,80.29 MB
262,mdx,19331,1181,19331,22,24/12/2017,18/03/2026,43.39 MB,Markdown for the component era,JavaScript,https://github.com/mdx-js/mdx,43.39 MB
263,hyperapp,19215,781,19215,14,20/01/2017,20/03/2025,6.78 MB,1kB-ish JavaScript framework for building hypertext applications,JavaScript,https://github.com/jorgebucaran/hyperapp,6.78 MB
264,You-Dont-Need-Lodash-Underscore,19160,826,19160,64,26/01/2016,19/03/2026,749.00 KB,List of JavaScript methods which you can use natively + ESLint Plugin,JavaScript,https://github.com/you-dont-need/You-Dont-Need-Lodash-Underscore,749.00 KB
265,multipleWindow3dScene,18996,2935,18996,41,23/11/2023,29/11/2023,161.00 KB,"A quick example of how one can ""synchronize"" a 3d scene across multiple windows using three.js and localStorage",JavaScript,https://github.com/bgstaal/multipleWindow3dScene,161.00 KB
266,awesome-blockchain-cn,18995,3636,18995,7,12/03/2017,29/02/2024,228.00 KB,收集所有区块链(BlockChain)技术开发相关资料，包括Fabric和Ethereum开发资料,JavaScript,https://github.com/chaozh/awesome-blockchain-cn,228.00 KB
267,decap-cms,18993,3105,18993,605,20/01/2015,17/03/2026,95.75 MB,A Git-based CMS for Static Site Generators,JavaScript,https://github.com/decaporg/decap-cms,95.75 MB
268,gun,18980,1236,18980,313,31/07/2014,01/03/2026,32.15 MB,An open source cybersecurity protocol for syncing decentralized graph data.,JavaScript,https://github.com/amark/gun,32.15 MB
269,react-developer-roadmap,18977,2009,18977,35,16/06/2018,16/02/2024,15.42 MB,Roadmap to becoming a React developer,JavaScript,https://github.com/adam-golab/react-developer-roadmap,15.42 MB
270,vue-router,18935,5016,18935,121,11/12/2013,27/02/2026,11.95 MB,🚦 The official router for Vue 2,JavaScript,https://github.com/vuejs/vue-router,11.95 MB
271,mysql,18811,2526,18811,172,29/07/2010,25/06/2024,2.62 MB,A pure node.js JavaScript Client implementing the MySQL protocol.,JavaScript,https://github.com/mysqljs/mysql,2.62 MB
272,x-ui,18808,7262,18808,54,18/05/2021,19/08/2024,15.56 MB,支持多协议多用户的 xray 面板,JavaScript,https://github.com/vaxilu/x-ui,15.56 MB
273,ZeroNet,18743,2301,18743,779,12/01/2015,31/01/2024,13.45 MB,ZeroNet - Decentralized websites using Bitcoin crypto and BitTorrent network,JavaScript,https://github.com/HelloZeroNet/ZeroNet,13.45 MB
274,browsh,18639,461,18639,241,08/05/2016,11/07/2025,7.79 MB,"A fully-modern text-based browser, rendering to TTY and browsers",JavaScript,https://github.com/browsh-org/browsh,7.79 MB
275,framework7,18634,3206,18634,241,23/02/2014,13/02/2026,100.69 MB,Full featured HTML framework for building iOS & Android apps,JavaScript,https://github.com/framework7io/framework7,100.69 MB
276,handlebars.js,18615,2044,18615,109,31/07/2010,19/03/2026,4.27 MB,Minimal templating on steroids.,JavaScript,https://github.com/handlebars-lang/handlebars.js,4.27 MB
277,cat-catch,18505,1620,18505,552,25/12/2015,19/03/2026,6.02 MB,猫抓 浏览器资源嗅探扩展 / cat-catch Browser Resource Sniffing Extension,JavaScript,https://github.com/xifangczy/cat-catch,6.02 MB
278,draggable,18454,1108,18454,164,27/09/2017,01/12/2025,5.93 MB,The JavaScript Drag & Drop library your grandparents warned you about.,JavaScript,https://github.com/Shopify/draggable,5.93 MB
279,dropzone,18397,3267,18397,151,12/02/2012,15/07/2024,6.94 MB,Dropzone is an easy to use drag'n'drop library. It supports image previews and shows nice progress bars.,JavaScript,https://github.com/dropzone/dropzone,6.94 MB
280,vant-weapp,18350,3478,18350,169,23/01/2017,05/03/2026,22.30 MB,轻量、可靠的小程序 UI 组件库,JavaScript,https://github.com/youzan/vant-weapp,22.30 MB
281,style2paints,18209,2089,18209,54,05/06/2017,01/08/2023,551.66 MB,sketch + style = paints :art: (TOG2018/SIGGRAPH2018ASIA),JavaScript,https://github.com/lllyasviel/style2paints,551.66 MB
282,node-jsonwebtoken,18160,1266,18160,189,01/07/2013,18/03/2026,471.00 KB,JsonWebToken implementation for node.js http://self-issued.info/docs/draft-ietf-oauth-json-web-token.html,JavaScript,https://github.com/auth0/node-jsonwebtoken,471.00 KB
283,plotly.js,18133,1977,18133,803,05/11/2015,20/02/2026,1.80 GB,Open-source JavaScript charting library behind Plotly and Dash,JavaScript,https://github.com/plotly/plotly.js,1.80 GB
284,matter-js,18099,1993,18099,278,19/02/2014,17/08/2024,22.33 MB,a 2D rigid body physics engine for the web ▲● ■,JavaScript,https://github.com/liabru/matter-js,22.33 MB
285,sweetalert2,18056,1640,18056,7,03/01/2015,16/03/2026,21.47 MB,"✨ A beautiful, responsive, highly customizable and accessible (WAI-ARIA) replacement for JavaScript's popup boxes. Zero dependencies. 🇺🇦🇪🇺",JavaScript,https://github.com/sweetalert2/sweetalert2,21.47 MB
286,screenity,18040,1444,18040,11,01/11/2020,19/03/2026,54.18 MB,The free and privacy-friendly screen recorder with no limits 🎥,JavaScript,https://github.com/alyssaxuu/screenity,54.18 MB
287,statsd,18022,1947,18022,90,30/12/2010,20/05/2025,841.00 KB,Daemon for easy but powerful stats aggregation,JavaScript,https://github.com/statsd/statsd,841.00 KB
288,emotion,18007,1133,18007,371,27/05/2017,04/11/2025,24.70 MB,👩‍🎤 CSS-in-JS library designed for high performance style composition,JavaScript,https://github.com/emotion-js/emotion,24.70 MB
289,fks,17969,4536,17969,16,17/10/2012,08/12/2023,1.74 MB,前端技能汇总 Frontend Knowledge Structure,JavaScript,https://github.com/JacksonTian/fks,1.74 MB
290,mjml,17925,982,17925,73,28/01/2016,19/03/2026,11.30 MB,MJML: the only framework that makes responsive-email easy,JavaScript,https://github.com/mjmlio/mjml,11.30 MB
291,cleave.js,17917,1587,17917,219,18/05/2016,25/11/2023,3.00 MB,Format input text content when you are typing...,JavaScript,https://github.com/nosir/cleave.js,3.00 MB
292,classnames,17832,561,17832,8,05/11/2014,09/03/2026,911.00 KB,A simple javascript utility for conditionally joining classNames together,JavaScript,https://github.com/JedWatson/classnames,911.00 KB
293,lazysizes,17741,1714,17741,209,11/10/2014,03/04/2024,2.84 MB,"High performance and SEO friendly lazy loader for images (responsive and normal), iframes and more, that detects any visibility changes triggered through user interaction, CSS or JavaScript without configuration.",JavaScript,https://github.com/aFarkas/lazysizes,2.84 MB
294,pouchdb,17571,1505,17571,163,10/06/2010,19/03/2026,123.15 MB,:kangaroo: - PouchDB is a pocket-sized database.,JavaScript,https://github.com/apache/pouchdb,123.15 MB
295,pino,17535,946,17535,146,16/02/2016,18/03/2026,3.38 MB,"🌲 super fast, all natural json logger",JavaScript,https://github.com/pinojs/pino,3.38 MB
296,nodemailer,17502,1427,17502,1,19/01/2011,18/03/2026,10.56 MB,✉️ Send e-mails with Node.JS – easy as cake!,JavaScript,https://github.com/nodemailer/nodemailer,10.56 MB
297,aframe,17497,4338,17497,336,15/09/2015,15/03/2026,898.12 MB,:a: Web framework for building virtual reality experiences.,JavaScript,https://github.com/aframevr/aframe,898.12 MB
298,react-helmet,17491,646,17491,220,18/06/2015,18/07/2023,2.10 MB,A document head manager for React,JavaScript,https://github.com/nfl/react-helmet,2.10 MB
299,flux,17484,3404,17484,6,20/07/2014,21/03/2023,5.36 MB,Application Architecture for Building User Interfaces,JavaScript,https://github.com/facebookarchive/flux,5.36 MB
300,overleaf,17470,1912,17470,162,08/02/2014,19/03/2026,221.44 MB,A web-based collaborative LaTeX editor,JavaScript,https://github.com/overleaf/overleaf,221.44 MB
301,UnblockNeteaseMusic,17456,2469,17456,218,19/06/2018,25/06/2023,1.73 MB,Revive unavailable songs for Netease Cloud Music,JavaScript,https://github.com/nondanee/UnblockNeteaseMusic,1.73 MB
302,cz-cli,17450,567,17450,201,20/04/2015,05/03/2026,2.27 MB,The commitizen command line utility. #BlackLivesMatter,JavaScript,https://github.com/commitizen/cz-cli,2.27 MB
303,chrome-extensions-samples,17412,8988,17412,85,13/06/2012,20/03/2026,56.68 MB,Chrome Extensions Samples,JavaScript,https://github.com/GoogleChrome/chrome-extensions-samples,56.68 MB
304,pot-desktop,17399,835,17399,444,26/02/2023,21/01/2026,79.35 MB,🌈一个跨平台的划词翻译和OCR软件 | A cross-platform software for text translation and recognition.,JavaScript,https://github.com/pot-app/pot-desktop,79.35 MB
305,Mailspring,17317,981,17317,18,13/10/2016,18/03/2026,138.89 MB,":love_letter: A beautiful, fast and fully open source mail client for Mac, Windows and Linux.",JavaScript,https://github.com/Foundry376/Mailspring,138.89 MB
306,velocity,17236,1525,17236,41,09/04/2014,24/10/2020,7.95 MB,Accelerated JavaScript animation.,JavaScript,https://github.com/julianshapiro/velocity,7.95 MB
307,complete-javascript-course,17089,17522,17089,224,14/06/2018,10/12/2024,44.54 MB,"Starter files, final projects, and FAQ for my Complete JavaScript course",JavaScript,https://github.com/jonasschmedtmann/complete-javascript-course,44.54 MB
308,less.js,17053,3385,17053,189,20/02/2010,19/03/2026,17.15 MB,Less. The dynamic stylesheet language.,JavaScript,https://github.com/less/less.js,17.15 MB
309,BoostNote-Legacy,16966,1449,16966,510,06/03/2016,19/04/2023,18.80 MB,This repository is outdated and new Boost Note app is available! We've launched a new Boost Note app which supports real-time collaborative writing. https://github.com/BoostIO/BoostNote-App,JavaScript,https://github.com/BoostIO/BoostNote-Legacy,18.80 MB
310,awesome-vite,16947,1323,16947,113,21/08/2020,04/02/2026,1.52 MB,⚡️ A curated list of awesome things related to Vite.js,JavaScript,https://github.com/vitejs/awesome-vite,1.52 MB
311,Functional-Light-JS,16791,1937,16791,26,17/08/2016,26/12/2023,30.98 MB,"Pragmatic, balanced FP in JavaScript. @FLJSBook on twitter.",JavaScript,https://github.com/getify/Functional-Light-JS,30.98 MB
312,hubot,16785,3735,16785,6,27/08/2011,24/02/2026,4.49 MB,A customizable life embetterment robot.,JavaScript,https://github.com/hubotio/hubot,4.49 MB
313,DOMPurify,16769,829,16769,0,17/02/2014,14/03/2026,11.07 MB,"DOMPurify - a DOM-only, super-fast, uber-tolerant XSS sanitizer for HTML, MathML and SVG. DOMPurify works with a secure default, but offers a lot of configurability and hooks. Demo:",JavaScript,https://github.com/cure53/DOMPurify,11.07 MB
314,mustache.js,16714,2364,16714,115,04/10/2009,14/06/2024,1.54 MB,Minimal templating with {{mustaches}} in JavaScript,JavaScript,https://github.com/janl/mustache.js,1.54 MB
315,react-demos,16680,6293,16680,1,23/03/2015,29/10/2024,1.89 MB,a collection of simple demos of React.js,JavaScript,https://github.com/ruanyf/react-demos,1.89 MB
316,jquery-pjax,16664,1943,16664,93,26/02/2011,30/11/2022,872.00 KB,pushState + ajax = pjax,JavaScript,https://github.com/defunkt/jquery-pjax,872.00 KB
317,superagent,16644,1328,16644,181,13/04/2011,06/01/2026,7.12 MB,"Ajax for Node.js and browsers (JS HTTP client). Maintained for @forwardemail, @ladjs, @spamscanner, @breejs, @cabinjs, and @lassjs.",JavaScript,https://github.com/forwardemail/superagent,7.12 MB
318,Luckysheet,16620,2598,16620,685,15/05/2020,19/08/2025,27.50 MB,Luckysheet upgraded to Univer,JavaScript,https://github.com/dream-num/Luckysheet,27.50 MB
319,parallax,16605,2110,16605,11,01/08/2013,06/04/2024,3.71 MB,Parallax Engine that reacts to the orientation of a smart device,JavaScript,https://github.com/wagerfield/parallax,3.71 MB
320,webvm,16562,3064,16562,12,31/01/2022,24/02/2026,41.30 MB,Virtual Machine for the Web,JavaScript,https://github.com/leaningtech/webvm,41.30 MB
321,react-loadable,16559,766,16559,34,09/03/2017,10/07/2024,325.00 KB,:hourglass_flowing_sand: A higher order component for loading components with promises.,JavaScript,https://github.com/jamiebuilds/react-loadable,325.00 KB
322,typeahead.js,16483,3145,16483,506,19/02/2013,14/04/2023,2.10 MB,typeahead.js is a fast and fully-featured autocomplete library,JavaScript,https://github.com/twitter/typeahead.js,2.10 MB
323,node-lessons,16482,4645,16482,93,05/10/2014,15/02/2022,2.02 MB,:closed_book:《Node.js 包教不包会》 by alsotang,JavaScript,https://github.com/alsotang/node-lessons,2.02 MB
324,material,16422,3347,16422,278,01/07/2014,05/09/2024,49.52 MB,Material design for AngularJS,JavaScript,https://github.com/angular/material,49.52 MB
325,inferno,16412,639,16412,40,01/02/2015,14/02/2026,45.46 MB,":fire: An extremely fast, React-like JavaScript library for building modern user interfaces",JavaScript,https://github.com/infernojs/inferno,45.46 MB
326,crypto-js,16398,2505,16398,275,08/04/2013,09/08/2024,10.81 MB,JavaScript library of crypto standards.,JavaScript,https://github.com/brix/crypto-js,10.81 MB
327,luxon,16379,767,16379,196,30/11/2015,07/02/2026,99.13 MB,⏱ A library for working with dates and times in JS,JavaScript,https://github.com/moment/luxon,99.13 MB
328,metrics,16375,2159,16375,53,08/09/2020,19/03/2026,190.87 MB,"📊 An infographics generator with 30+ plugins and 300+ options to display stats about your GitHub account and render them as SVG, Markdown, PDF or JSON!",JavaScript,https://github.com/lowlighter/metrics,190.87 MB
329,DPlayer,16356,2487,16356,264,03/05/2016,04/03/2026,11.29 MB,":lollipop: Wow, such a lovely HTML5 danmaku video player",JavaScript,https://github.com/DIYgod/DPlayer,11.29 MB
330,filepond,16343,855,16343,140,09/10/2017,17/03/2026,8.31 MB,🌊 A flexible and fun JavaScript file upload library,JavaScript,https://github.com/pqina/filepond,8.31 MB
331,ChatALL,16329,1719,16329,266,08/04/2023,11/02/2026,148.12 MB," Concurrently chat with ChatGPT, Bing Chat, Bard, Alpaca, Vicuna, Claude, ChatGLM, MOSS, 讯飞星火, 文心一言 and more, discover the best answers",JavaScript,https://github.com/ai-shifu/ChatALL,148.12 MB
332,typed.js,16302,1774,16302,22,25/05/2013,25/01/2026,5.80 MB,A JavaScript Typing Animation Library,JavaScript,https://github.com/mattboldt/typed.js,5.80 MB
333,bull,16248,1424,16248,146,27/06/2013,28/02/2026,4.21 MB,Premium Queue package for handling distributed jobs and messages in NodeJS.,JavaScript,https://github.com/OptimalBits/bull,4.21 MB
334,dva,16204,3126,16204,28,24/06/2016,06/08/2025,1.53 MB,"🌱 React and redux based, lightweight and elm-style framework. (Inspired by elm and choo)",JavaScript,https://github.com/dvajs/dva,1.53 MB
335,WebGL-Fluid-Simulation,16189,1859,16189,76,22/08/2017,12/11/2024,3.19 MB,Play with fluids in your browser (works even on mobile),JavaScript,https://github.com/PavelDoGreat/WebGL-Fluid-Simulation,3.19 MB
336,medium-editor,16128,1838,16128,360,29/05/2013,24/10/2024,10.14 MB,Medium.com WYSIWYG editor clone. Uses contenteditable API to implement a rich text solution.,JavaScript,https://github.com/yabwe/medium-editor,10.14 MB
337,terminalizer,16103,520,16103,108,22/07/2018,29/08/2024,4.02 MB,🦄 Record your terminal and generate animated gif images or share a web player,JavaScript,https://github.com/faressoft/terminalizer,4.02 MB
338,vanillawebprojects,15964,4398,15964,26,28/01/2020,28/03/2024,30.70 MB,"Mini projects built with HTML5, CSS & JavaScript. No frameworks or libraries",JavaScript,https://github.com/bradtraversy/vanillawebprojects,30.70 MB
339,hexo-theme-next,15861,3552,15861,90,01/12/2014,10/11/2022,13.05 MB,Elegant theme for Hexo. ,JavaScript,https://github.com/iissnan/hexo-theme-next,13.05 MB
340,jasmine,15843,2238,15843,11,02/12/2008,14/03/2026,10.58 MB,Simple JavaScript testing framework for browsers and node.js,JavaScript,https://github.com/jasmine/jasmine,10.58 MB
341,blessed-contrib,15718,843,15718,97,14/01/2015,09/01/2024,5.36 MB,Build terminal dashboards using ascii/ansi art and javascript,JavaScript,https://github.com/yaronn/blessed-contrib,5.36 MB
342,not-paid,15607,1048,15607,10,05/10/2016,28/04/2025,38.00 KB,Client did not pay? Add opacity to the body tag and decrease it every day until their site completely fades away,JavaScript,https://github.com/kleampa/not-paid,38.00 KB
343,transformers.js,15598,1110,15598,273,13/02/2023,18/03/2026,106.62 MB,"State-of-the-art Machine Learning for the web. Run 🤗 Transformers directly in your browser, with no need for a server!",JavaScript,https://github.com/huggingface/transformers.js,106.62 MB
344,BullshitGenerator,15581,2824,15581,153,28/10/2019,10/07/2021,33.00 KB, Needs to generate some texts to test if my GUI rendering codes good or not. so I made this.,JavaScript,https://github.com/menzi11/BullshitGenerator,33.00 KB
345,react-markdown,15560,921,15560,3,18/05/2015,21/04/2025,2.02 MB,Markdown component for React,JavaScript,https://github.com/remarkjs/react-markdown,2.02 MB
346,vivus,15464,1130,15464,22,13/05/2014,06/07/2022,472.00 KB,JavaScript library to make drawing animation on SVG,JavaScript,https://github.com/maxwellito/vivus,472.00 KB
347,ChineseBQB,15444,1330,15444,20,08/05/2019,25/09/2025,2.87 GB,"🇨🇳 Chinese sticker pack,More joy / 表情包的博物馆, Github最有毒的仓库, 中国表情包大集合, 聚欢乐~",JavaScript,https://github.com/zhaoolee/ChineseBQB,2.87 GB
348,electron-vue,15442,1523,15442,282,12/05/2016,14/01/2022,5.79 MB,"An Electron & Vue.js quick start boilerplate with vue-cli scaffolding, common Vue plugins, electron-packager/electron-builder, unit/e2e testing, vue-devtools, and webpack.",JavaScript,https://github.com/SimulatedGREG/electron-vue,5.79 MB
349,N-blog,15425,4584,15425,30,27/05/2013,26/04/2023,10.48 MB,《一起学 Node.js》,JavaScript,https://github.com/nswbmw/N-blog,10.48 MB
350,jsdoc,15423,1488,15423,453,13/03/2010,19/03/2026,25.87 MB,An API documentation generator for JavaScript.,JavaScript,https://github.com/jsdoc/jsdoc,25.87 MB
351,volkswagen,15415,241,15415,23,07/10/2015,27/02/2026,252.00 KB,":see_no_evil: Volkswagen detects when your tests are being run in a CI server, and makes them pass.",JavaScript,https://github.com/auchenberg/volkswagen,252.00 KB
352,whistle,15415,1154,15415,79,13/03/2015,15/02/2026,98.92 MB,"HTTP, HTTP2, HTTPS, Websocket debugging proxy",JavaScript,https://github.com/avwo/whistle,98.92 MB
353,gpu.js,15374,663,15374,231,09/02/2016,21/04/2025,19.03 MB,GPU Accelerated JavaScript,JavaScript,https://github.com/gpujs/gpu.js,19.03 MB
354,33-js-concepts,15315,2327,15315,6,16/10/2018,28/02/2023,87.00 KB,:scroll: 每个 JavaScript 工程师都应懂的33个概念 @leonardomso,JavaScript,https://github.com/stephentian/33-js-concepts,87.00 KB
355,headless-recorder,15263,734,15263,1,13/08/2018,16/12/2022,11.83 MB,Chrome extension that records your browser interactions and generates a Playwright or Puppeteer script. ,JavaScript,https://github.com/checkly/headless-recorder,11.83 MB
356,front-end-guide,15261,1107,15261,26,24/04/2017,12/06/2023,4.30 MB,📚 Study guide and introduction to the modern front end stack.,JavaScript,https://github.com/grab/front-end-guide,4.30 MB
357,q,15224,1187,15224,115,04/09/2010,08/11/2023,1.39 MB,A promise library for JavaScript,JavaScript,https://github.com/kriskowal/q,1.39 MB
358,exceljs,15189,1965,15189,786,09/12/2014,21/01/2025,21.28 MB,Excel Workbook Manager,JavaScript,https://github.com/exceljs/exceljs,21.28 MB
359,Flat-UI,15175,2289,15175,10,03/03/2013,08/07/2025,35.34 MB,"Flat UI Free - Design Framework (html/css3/less/js). Flat UI is based on Bootstrap, a comfortable, responsive, and functional framework that simplifies the development of websites.",JavaScript,https://github.com/designmodo/Flat-UI,35.34 MB
360,charts,15087,749,15087,144,26/10/2017,02/07/2025,6.84 MB,"Simple, responsive, modern SVG Charts with zero dependencies",JavaScript,https://github.com/frappe/charts,6.84 MB
361,apexcharts.js,15085,1382,15085,335,24/07/2018,16/03/2026,156.69 MB,📊 Interactive JavaScript Charts built on SVG,JavaScript,https://github.com/apexcharts/apexcharts.js,156.69 MB
362,NodeBB,15027,2945,15027,184,22/04/2013,19/03/2026,101.65 MB,Node.js based forum software built for the modern web,JavaScript,https://github.com/NodeBB/NodeBB,101.65 MB
363,recompose,15019,1226,15019,122,07/10/2015,10/09/2022,1.29 MB,A React utility belt for function components and higher-order components.,JavaScript,https://github.com/acdlite/recompose,1.29 MB
364,mathjs,15018,1297,15018,173,15/02/2013,19/03/2026,100.12 MB,An extensive math library for JavaScript and Node.js,JavaScript,https://github.com/josdejong/mathjs,100.12 MB
365,cesium,14996,3760,14996,1588,02/03/2012,19/03/2026,818.25 MB,An open-source JavaScript library for world-class 3D globes and maps :earth_americas:,JavaScript,https://github.com/CesiumGS/cesium,818.25 MB
366,paper.js,14996,1259,14996,430,07/02/2011,23/07/2024,108.55 MB,"The Swiss Army Knife of Vector Graphics Scripting – Scriptographer ported to JavaScript and the browser, using HTML5 Canvas. Created by @lehni & @puckey",JavaScript,https://github.com/paperjs/paper.js,108.55 MB
367,bower,14934,1815,14934,13,07/09/2012,13/10/2024,4.69 MB,A package manager for the web,JavaScript,https://github.com/bower/bower,4.69 MB
368,amphtml,14921,4093,14921,1008,01/09/2015,04/03/2026,944.31 MB,The AMP web component framework.,JavaScript,https://github.com/ampproject/amphtml,944.31 MB
369,KeepChatGPT,14917,741,14917,123,28/03/2023,12/02/2026,14.14 MB,这是一款提高ChatGPT的数据安全能力和效率的插件。并且免费共享大量创新功能，如：自动刷新、保持活跃、数据安全、取消审计、克隆对话、言无不尽、净化页面、展示大屏、拦截跟踪、日新月异、明察秋毫等。让我们的AI体验无比安全、顺畅、丝滑、高效、简洁。,JavaScript,https://github.com/xcanwin/KeepChatGPT,14.14 MB
370,riot,14906,962,14906,4,27/09/2013,21/11/2025,25.18 MB,Simple and elegant component-based UI library,JavaScript,https://github.com/riot/riot,25.18 MB
371,marketingskills,14842,2219,14842,13,15/01/2026,19/03/2026,915.00 KB,"Marketing skills for Claude Code and AI agents. CRO, copywriting, SEO, analytics, and growth engineering.",JavaScript,https://github.com/coreyhaines31/marketingskills,915.00 KB
372,showdown,14840,1584,14840,236,13/11/2008,02/01/2026,6.56 MB,A bidirectional Markdown to HTML to Markdown converter written in Javascript,JavaScript,https://github.com/showdownjs/showdown,6.56 MB
373,hapi,14783,1346,14783,58,06/08/2011,06/03/2026,16.71 MB,"The Simple, Secure Framework Developers Trust",JavaScript,https://github.com/hapijs/hapi,16.71 MB
374,bootswatch,14764,3653,14764,68,07/02/2012,03/03/2026,91.59 MB,Themes for Bootstrap,JavaScript,https://github.com/thomaspark/bootswatch,91.59 MB
375,graphql-spec,14754,1148,14754,194,01/07/2015,19/03/2026,5.89 MB,GraphQL is a query language and execution engine tied to any backend service.,JavaScript,https://github.com/graphql/graphql-spec,5.89 MB
376,browserify,14734,1198,14734,378,22/09/2010,21/12/2024,2.46 MB,browser-side require() the node.js way,JavaScript,https://github.com/browserify/browserify,2.46 MB
377,automerge-classic,14719,459,14719,79,19/04/2017,14/03/2023,3.95 MB,"A JSON-like data structure (a CRDT) that can be modified concurrently by different users, and merged again automatically.",JavaScript,https://github.com/automerge/automerge-classic,3.95 MB
378,mithril.js,14658,929,14658,27,17/03/2014,16/02/2026,10.45 MB,A JavaScript Framework for Building Brilliant Applications,JavaScript,https://github.com/MithrilJS/mithril.js,10.45 MB
379,x-spreadsheet,14615,1767,14615,412,06/09/2018,07/08/2024,3.97 MB,The project has been migrated to @wolf-table/table https://github.com/wolf-table/table,JavaScript,https://github.com/myliang/x-spreadsheet,3.97 MB
