Ranking,Project Name,Stars,Forks,Watchers,Open Issues,Created At,Last Commit,Size,Description,Language,Repo URL,Size
545,mason-nvim-dap.nvim,684,54,684,0,25/09/2022,20/10/2025,107.00 KB,,Lua,https://github.com/jay-babu/mason-nvim-dap.nvim,107.00 KB
546,mind.nvim,683,42,683,20,17/10/2021,22/03/2023,238.00 KB,The power of trees at your fingertips.,Lua,https://github.com/hadronized/mind.nvim,238.00 KB
547,lstm,681,285,681,11,13/02/2015,21/08/2018,2.21 MB,,Lua,https://github.com/wojzaremba/lstm,2.21 MB
548,Rime_collections,681,142,681,10,03/11/2013,25/03/2026,14.76 MB,All collections for Rime IME,Lua,https://github.com/LEOYoon-Tsaw/Rime_collections,14.76 MB
549,cmp-nvim-lsp-signature-help,680,30,680,29,19/11/2021,14/11/2025,17.00 KB,cmp-nvim-lsp-signature-help,Lua,https://github.com/hrsh7th/cmp-nvim-lsp-signature-help,17.00 KB
550,NTIRE2017,680,147,680,8,21/02/2017,06/01/2018,15.89 MB,"Torch implementation of ""Enhanced Deep Residual Networks for Single Image Super-Resolution""",Lua,https://github.com/limbee/NTIRE2017,15.89 MB
551,code_runner.nvim,680,38,680,6,26/04/2021,21/03/2026,279.00 KB,"Neovim plugin.The best code runner you could have, it is like the one in vscode but with super powers, it manages projects like in intellij but without being slow",Lua,https://github.com/CRAG666/code_runner.nvim,279.00 KB
552,monokai-pro.nvim,678,72,678,19,20/11/2022,02/02/2026,2.56 MB,"Monokai Pro theme for Neovim written in Lua, with multiple filters: Pro, Classic, Machine, Octagon, Ristretto, Spectrum",Lua,https://github.com/loctvl842/monokai-pro.nvim,2.56 MB
553,nvim-luapad,677,6,677,5,31/03/2020,23/03/2026,5.03 MB,Interactive real time neovim scratchpad for embedded lua engine - type and watch!,Lua,https://github.com/rafcamlet/nvim-luapad,5.03 MB
554,mpv-playlistmanager,677,44,677,9,16/06/2016,16/03/2026,5.87 MB,Mpv lua script to create and manage playlists,Lua,https://github.com/jonniek/mpv-playlistmanager,5.87 MB
555,protoc-gen-lua,677,338,677,41,03/04/2014,04/02/2021,236.00 KB,"Google's Protocol Buffers project, ported to Lua",Lua,https://github.com/sean-lin/protoc-gen-lua,236.00 KB
556,ElvUI,675,222,675,17,09/09/2021,26/03/2026,69.14 MB,User Interface replacement AddOn for World of Warcraft.,Lua,https://github.com/tukui-org/ElvUI,69.14 MB
557,fyler.nvim,675,43,675,21,19/05/2025,19/03/2026,778.00 KB,A neovim file manager which can edit file system like a buffer with tree view,Lua,https://github.com/A7Lavinraj/fyler.nvim,778.00 KB
558,FS25_UniversalAutoload,670,46,670,25,15/11/2024,24/03/2026,1.35 MB,Mod for FS25. Please download latest release below.,Lua,https://github.com/loki79uk/FS25_UniversalAutoload,1.35 MB
559,smart-open.nvim,670,34,670,18,20/09/2022,16/11/2025,122.00 KB,Neovim plugin for fast file-finding,Lua,https://github.com/danielfalk/smart-open.nvim,122.00 KB
560,NeuralKart,670,56,670,8,10/05/2017,21/12/2021,10.32 MB,A Real-time Mario Kart 64 AI using ConvNets.,Lua,https://github.com/rameshvarun/NeuralKart,10.32 MB
561,cmp-buffer,667,48,667,38,03/08/2021,01/04/2025,48.00 KB,nvim-cmp source for buffer words,Lua,https://github.com/hrsh7th/cmp-buffer,48.00 KB
562,lua-filters,666,170,666,51,21/11/2017,01/12/2025,840.00 KB,A collection of lua filters for pandoc,Lua,https://github.com/pandoc/lua-filters,840.00 KB
563,telescope-project.nvim,666,57,666,42,12/12/2020,23/04/2025,2.50 MB,,Lua,https://github.com/nvim-telescope/telescope-project.nvim,2.50 MB
564,colorful-winsep.nvim,665,33,665,1,31/10/2022,19/02/2026,118.00 KB,Make your nvim window separators colorful,Lua,https://github.com/nvim-zh/colorful-winsep.nvim,118.00 KB
565,community-a4e-c,665,96,665,88,17/12/2018,17/10/2025,1.37 GB,The Community Repo for A-4E-C and its Official Submods,Lua,https://github.com/Community-A-4E/community-a4e-c,1.37 GB
566,tween.lua,664,80,664,7,25/04/2011,02/02/2023,4.21 MB,Tweening/Easing/Interpolating functions for lua. Inspired on jQuery's animate method.,Lua,https://github.com/kikito/tween.lua,4.21 MB
567,compiler.nvim,660,48,660,9,16/06/2023,14/08/2025,3.00 MB,Neovim compiler for building and running your code without having to configure anything,Lua,https://github.com/Zeioth/compiler.nvim,3.00 MB
568,lsp-status.nvim,659,43,659,26,18/05/2020,31/08/2022,315.00 KB,"Utility functions for getting diagnostic status and progress messages from LSP servers, for use in the Neovim statusline",Lua,https://github.com/nvim-lua/lsp-status.nvim,315.00 KB
569,menu,655,14,655,3,11/09/2024,01/06/2025,55.00 KB,Menu plugin for neovim ( supports nested menus ) made using volt,Lua,https://github.com/nvzone/menu,55.00 KB
570,Moses,654,103,654,5,24/07/2012,18/12/2019,1.41 MB,Utility library for functional programming  in Lua,Lua,https://github.com/Yonaba/Moses,1.41 MB
571,GTA5-Stand-LuaAIO,651,377,651,32,25/01/2023,27/12/2024,327.55 MB,GTA5 Mod Stand Lua All in One:快捷任务、crash、模组(人物|车辆|地图|模型)、娱乐等多种拓展功能玩法的lua脚本,Lua,https://github.com/xhcherry/GTA5-Stand-LuaAIO,327.55 MB
572,vimade,651,11,651,8,07/01/2019,22/03/2026,809.00 KB,"Vimade let's you dim, fade, tint, animate, and customize colors in your windows and buffers for (Neo)vim",Lua,https://github.com/TaDaa/vimade,809.00 KB
573,mini.surround,650,17,650,0,24/10/2022,21/02/2026,170.00 KB,Neovim Lua plugin with fast and feature-rich surround actions. Part of 'mini.nvim' library.,Lua,https://github.com/nvim-mini/mini.surround,170.00 KB
574,.vim,648,184,648,5,19/07/2013,26/03/2026,1.33 MB,My .vim dotfiles and configurations.,Lua,https://github.com/jessfraz/.vim,1.33 MB
575,nv-ide,648,57,648,2,10/01/2020,23/03/2026,15.10 MB,"Neovim custom configuration, oriented for full stack developers (Ruby on Rails, ruby, php, html, css, SCSS, javascript)",Lua,https://github.com/crivotz/nv-ide,15.10 MB
576,Jumper,647,127,647,38,10/10/2012,21/10/2022,553.00 KB,"Fast, lightweight and easy-to-use pathfinding library for grid-based games",Lua,https://github.com/Yonaba/Jumper,553.00 KB
577,gh.nvim,645,31,645,33,05/04/2022,21/01/2025,341.00 KB,A fully featured GitHub integration for performing code reviews in Neovim.,Lua,https://github.com/ldelossa/gh.nvim,341.00 KB
578,dotfiles,644,88,644,2,14/07/2015,19/11/2025,590.00 KB,$HOME sweet $HOME,Lua,https://github.com/jessarcher/dotfiles,590.00 KB
579,dotfiles,643,95,643,0,15/06/2013,01/03/2026,4.99 MB,A collection of my personal dotfiles,Lua,https://github.com/hamvocke/dotfiles,4.99 MB
580,FloorplanTransformation,641,199,641,32,04/08/2017,21/06/2022,10.47 MB,Raster-to-Vector: Revisiting Floorplan Transformation,Lua,https://github.com/art-programmer/FloorplanTransformation,10.47 MB
581,windows.nvim,639,21,639,22,02/08/2022,08/07/2023,127.00 KB,Automatically expand width of the current window. Maximizes and restore it. And all this with nice animations!,Lua,https://github.com/anuvyklack/windows.nvim,127.00 KB
582,multicursors.nvim,639,17,639,13,01/07/2023,26/02/2025,248.00 KB,A multi cursor plugin for Neovim.,Lua,https://github.com/smoka7/multicursors.nvim,248.00 KB
583,sqlite-page-explorer,638,8,638,0,08/12/2024,09/12/2024,3.18 MB,"Visual tool to explore SQLite databases page-by-page, the way they're stored on disk and the way SQLite sees them.",Lua,https://github.com/QuadrupleA/sqlite-page-explorer,3.18 MB
584,autoclose.nvim,636,22,636,13,07/02/2022,22/03/2026,10.87 MB,A minimalist Neovim plugin that auto pairs & closes brackets,Lua,https://github.com/m4xshen/autoclose.nvim,10.87 MB
585,luaradio,635,67,635,11,30/01/2016,19/11/2025,18.28 MB,"A lightweight, embeddable software-defined radio framework built on LuaJIT",Lua,https://github.com/vsergeev/luaradio,18.28 MB
586,onenord.nvim,631,52,631,0,17/10/2021,25/12/2025,181.00 KB,🏔️ A Neovim theme that combines the Nord and Atom One Dark color palettes for a more vibrant programming experience.,Lua,https://github.com/rmehri01/onenord.nvim,181.00 KB
587,dqn,627,167,627,4,06/04/2017,06/04/2017,18.00 KB,"Lua/Torch implementation of DQN (Nature, 2015)",Lua,https://github.com/google-deepmind/dqn,18.00 KB
588,ProjectTemplate,626,141,626,8,13/11/2023,31/05/2024,1.69 MB,A little quick-start project template for C++ projects which utilise a Core/App project architecture,Lua,https://github.com/TheCherno/ProjectTemplate,1.69 MB
589,nmap-nse-vulnerability-scripts,626,59,626,2,18/05/2021,04/03/2022,16.00 KB,NMAP Vulnerability Scanning Scripts,Lua,https://github.com/nccgroup/nmap-nse-vulnerability-scripts,16.00 KB
590,base16-nvim,625,92,625,4,12/03/2021,05/03/2026,320.00 KB,Neovim plugin for building a sync base16 colorscheme. Includes support for Treesitter and LSP highlight groups.,Lua,https://github.com/RRethy/base16-nvim,320.00 KB
591,push,624,144,624,16,16/08/2015,25/09/2023,136.00 KB,A simple resolution-handling library for LÖVE,Lua,https://github.com/Ulydev/push,136.00 KB
592,nvim-cokeline,623,41,623,13,29/04/2021,24/01/2025,4.86 MB,:nose: A Neovim bufferline for people with addictive personalities,Lua,https://github.com/willothy/nvim-cokeline,4.86 MB
593,beacon.nvim,622,15,622,21,23/06/2020,25/06/2024,9.79 MB,"Whenever cursor jumps some distance or moves between windows, it will flash so you can see where it is",Lua,https://github.com/DanilaMihailov/beacon.nvim,9.79 MB
594,dotfiles,621,106,621,0,28/10/2014,10/10/2025,21.72 MB,,Lua,https://github.com/mhartington/dotfiles,21.72 MB
595,luaunit,621,138,621,5,26/07/2012,26/03/2026,2.30 MB,"LuaUnit is a popular unit-testing framework for Lua, with an interface typical of xUnit libraries (Python unittest, Junit, NUnit, ...). It supports several output formats (Text, TAP, JUnit, ...) to be used directly or work with Continuous Integration platforms (Jenkins, Maven, ...).",Lua,https://github.com/bluebird75/luaunit,2.30 MB
596,nvim,620,12,620,0,13/09/2023,21/03/2026,12.39 MB,:rose: a comfy neovim colorscheme for cozy morning coding.,Lua,https://github.com/everviolet/nvim,12.39 MB
597,registers.nvim,619,24,619,11,11/02/2021,20/11/2025,766.00 KB,📑 Neovim plugin to preview the contents of the registers,Lua,https://github.com/tversteeg/registers.nvim,766.00 KB
598,x-waf,619,216,619,2,05/08/2016,22/01/2018,29.00 KB,适用于中小企业的云waf,Lua,https://github.com/xsec-lab/x-waf,29.00 KB
599,mpv_sponsorblock,618,31,618,28,11/11/2019,01/05/2024,53.00 KB,mpv script to skip sponsored segments of YouTube videos,Lua,https://github.com/po5/mpv_sponsorblock,53.00 KB
600,cmp-cmdline,616,58,616,66,21/10/2021,18/05/2025,27.00 KB,nvim-cmp source for vim's cmdline,Lua,https://github.com/hrsh7th/cmp-cmdline,27.00 KB
601,neovim-session-manager,615,59,615,16,17/04/2021,26/01/2026,171.00 KB,A simple wrapper around :mksession.,Lua,https://github.com/Shatur/neovim-session-manager,171.00 KB
602,roact,615,140,615,70,03/11/2017,13/12/2023,1.06 MB,A view management library for Roblox Lua similar to React,Lua,https://github.com/Roblox/roact,1.06 MB
603,1808,615,49,615,2,13/03/2019,12/11/2019,6.64 MB,,Lua,https://github.com/Cocos-BCX/1808,6.64 MB
604,pandoc_docx_template,614,79,614,2,14/12/2023,25/01/2026,15.54 MB,Template for exporting Markdown to docx (Word) using pandoc丨使用pandoc将markdown导出为docx的模板，适用于obsidian、typora、思源笔记等Markdown笔记软件,Lua,https://github.com/Achuan-2/pandoc_docx_template,15.54 MB
605,factorio-data,613,40,613,0,24/04/2018,06/03/2026,9.38 MB,Tracks changes of the lua prototype definitions in factorio inbetween releases.,Lua,https://github.com/wube/factorio-data,9.38 MB
606,serpent,613,80,613,12,02/06/2012,21/05/2022,100.00 KB,Lua serializer and pretty printer.,Lua,https://github.com/pkulchenko/serpent,100.00 KB
607,guess-indent.nvim,612,21,612,16,19/02/2022,25/03/2025,64.00 KB,Automatic indentation style detection for Neovim,Lua,https://github.com/NMAC427/guess-indent.nvim,64.00 KB
608,surreal,612,105,612,17,13/04/2017,04/06/2021,12.92 MB,"Learning from Synthetic Humans, CVPR 2017",Lua,https://github.com/gulvarol/surreal,12.92 MB
609,nvim-dap-go,610,97,610,6,26/09/2021,11/07/2025,233.00 KB,An extension for nvim-dap providing configurations for launching go debugger (delve) and debugging individual tests,Lua,https://github.com/leoluz/nvim-dap-go,233.00 KB
610,fblualib,608,171,608,63,10/07/2014,19/02/2018,508.00 KB,Facebook libraries and utilities for Lua,Lua,https://github.com/facebookarchive/fblualib,508.00 KB
611,UniversalStyleTransfer,606,86,606,11,20/08/2017,05/04/2022,59.03 MB,The source code of NIPS17 'Universal Style Transfer via Feature Transforms'.,Lua,https://github.com/Yijunmaverick/UniversalStyleTransfer,59.03 MB
612,FS25_AutoDrive,605,33,605,56,12/11/2024,25/03/2026,5.26 MB,FS25 version of the AutoDrive mod,Lua,https://github.com/Stephan-S/FS25_AutoDrive,5.26 MB
613,torch-Video-Tutorials,604,97,604,0,02/09/2016,29/12/2025,16.25 MB,Light your way in Deep Learning with Torch 🔦,Lua,https://github.com/Atcold/torch-Video-Tutorials,16.25 MB
614,statuscol.nvim,603,31,603,9,21/11/2022,02/06/2025,110.00 KB,Status column plugin that provides a configurable 'statuscolumn' and click handlers.,Lua,https://github.com/luukvbaal/statuscol.nvim,110.00 KB
615,gitlinker.nvim,602,45,602,30,12/04/2021,02/05/2024,107.00 KB,A lua neovim plugin to generate shareable file permalinks (with line ranges) for several git web frontend hosts. Inspired by tpope/vim-fugitive's :GBrowse,Lua,https://github.com/ruifm/gitlinker.nvim,107.00 KB
616,mason-null-ls.nvim,601,28,601,0,08/09/2022,05/11/2025,122.00 KB,,Lua,https://github.com/jay-babu/mason-null-ls.nvim,122.00 KB
617,lsp-format.nvim,599,29,599,9,27/10/2020,08/05/2025,59.00 KB,A wrapper around Neovims native LSP formatting.,Lua,https://github.com/lukas-reineke/lsp-format.nvim,59.00 KB
618,eyescream,599,141,599,3,18/06/2015,16/10/2017,59.00 KB,natural image generation using ConvNets,Lua,https://github.com/facebookarchive/eyescream,59.00 KB
619,gluon,594,326,594,95,11/02/2013,23/03/2026,14.48 MB,a modular framework for creating OpenWrt-based firmwares for wireless mesh nodes,Lua,https://github.com/freifunk-gluon/gluon,14.48 MB
620,pragtical,594,29,594,26,20/05/2023,26/03/2026,15.00 MB,The practical and pragmatic code editor.,Lua,https://github.com/pragtical/pragtical,15.00 MB
621,treewalker.nvim,594,15,594,1,29/11/2024,26/03/2026,3.20 MB,A neovim plugin for moving around your code in a syntax tree aware manner,Lua,https://github.com/aaronik/treewalker.nvim,3.20 MB
622,tokyodark.nvim,593,23,593,3,20/04/2021,13/11/2025,63.00 KB,A clean dark theme written in lua for neovim.,Lua,https://github.com/tiagovla/tokyodark.nvim,63.00 KB
623,config.nvim,593,19,593,7,08/05/2024,29/12/2025,157.00 KB,my nvim config,Lua,https://github.com/tjdevries/config.nvim,157.00 KB
624,wtf.nvim,592,16,592,2,14/08/2023,02/03/2026,2.35 MB,Delicious diagnostic debugging in Neovim 🤤,Lua,https://github.com/piersolenski/wtf.nvim,2.35 MB
625,GameFrameX,592,80,592,4,10/03/2023,07/11/2025,135.69 MB,Unity前后端+管理端一体化解决方案-HybridCLR+YooAssets+LuBan+ProtoBuff+FairyGUI+DoTween+GameAnalytics+LitJson+UniTask+GameFramework+GeekServer+Admin.Net。,Lua,https://github.com/GameFrameX/GameFrameX,135.69 MB
626,typedlua,589,48,589,28,27/05/2013,11/03/2020,11.63 MB,An Optional Type System for Lua,Lua,https://github.com/andremm/typedlua,11.63 MB
627,package-info.nvim,589,39,589,26,01/08/2021,27/12/2025,356.00 KB,✍️ All the npm/yarn/pnpm commands I don't want to type,Lua,https://github.com/vuki656/package-info.nvim,356.00 KB
628,vaststars,589,64,589,0,06/02/2024,22/07/2024,625.45 MB,A game demo for Ant engine,Lua,https://github.com/ejoy/vaststars,625.45 MB
629,tailwind-tools.nvim,589,54,589,13,17/03/2024,23/05/2025,199.00 KB,An unofficial Tailwind CSS integration and tooling for Neovim,Lua,https://github.com/luckasRanarison/tailwind-tools.nvim,199.00 KB
630,Lmod,587,142,587,26,11/04/2013,12/03/2026,39.54 MB,"Lmod: An Environment Module System based on Lua, Reads TCL Modules, Supports a Software Hierarchy",Lua,https://github.com/TACC/Lmod,39.54 MB
631,http_study,587,207,587,0,07/03/2019,08/06/2022,717.00 KB,follow me to study http,Lua,https://github.com/chronolaw/http_study,717.00 KB
632,transitous,587,156,587,174,04/02/2024,26/03/2026,8.61 MB,Free and open public transport routing.,Lua,https://github.com/public-transport/transitous,8.61 MB
633,NativeVim,586,15,586,2,09/07/2024,10/04/2025,50.00 KB,Neovim config WITHOUT plugins,Lua,https://github.com/boltlessengineer/NativeVim,50.00 KB
634,WenJinMincho,585,12,585,3,03/07/2024,20/02/2026,1.38 GB,可免费商用的大字符集宋体字库，以OFL协议发布。/A large character set fonts in Songti(Mincho) style. Licensed under the SIL OFL 1.1.,Lua,https://github.com/takushun-wu/WenJinMincho,1.38 GB
635,docker-dst-server,585,113,585,17,06/12/2015,17/05/2023,145.00 KB,Don't Starve Together dedicated server in Docker!,Lua,https://github.com/Jamesits/docker-dst-server,145.00 KB
636,mini.ai,584,12,584,0,24/10/2022,21/02/2026,129.00 KB,Neovim Lua plugin to extend and create `a`/`i` textobjects. Part of 'mini.nvim' library.,Lua,https://github.com/nvim-mini/mini.ai,129.00 KB
637,FS22_AutoDrive,584,105,584,135,19/11/2021,26/12/2024,4.27 MB,FS22 version of the AutoDrive mod,Lua,https://github.com/Stephan-S/FS22_AutoDrive,4.27 MB
638,csvview.nvim,583,12,583,15,25/10/2023,14/02/2026,250.00 KB,A Neovim plugin for CSV file editing.,Lua,https://github.com/hat0uma/csvview.nvim,250.00 KB
639,Winshark,581,61,581,5,29/05/2020,28/01/2022,15.57 MB,A wireshark plugin to instrument ETW,Lua,https://github.com/airbus-cert/Winshark,15.57 MB
640,wire,580,348,580,88,07/05/2012,26/03/2026,26.16 MB,Garry's Mod add-on that allows users to wire up components in order to make more elaborate automatic and user-controlled contraptions.,Lua,https://github.com/wiremod/wire,26.16 MB
641,haskell-tools.nvim,580,19,580,22,15/10/2022,25/03/2026,1.27 MB, 🦥 Supercharge your Haskell experience in neovim!,Lua,https://github.com/mrcjkb/haskell-tools.nvim,1.27 MB
642,screenkey.nvim,580,18,580,9,14/04/2024,15/02/2026,261.00 KB,Screencast your keys in Neovim,Lua,https://github.com/NStefan002/screenkey.nvim,261.00 KB
643,minty,580,8,580,2,11/09/2024,28/02/2025,67.00 KB,Most Beautifully crafted color tools for Neovim ,Lua,https://github.com/nvzone/minty,67.00 KB
644,LuaMemorySnapshotDump,579,186,579,6,04/05/2017,06/06/2024,35.00 KB,"Lua memory snapshot dump utility, used for memory leak detection。",Lua,https://github.com/yaukeywang/LuaMemorySnapshotDump,35.00 KB
645,JSFX,579,19,579,11,05/05/2018,22/03/2026,33.61 MB,A bundle of JSFX and scripts for reaper.,Lua,https://github.com/JoepVanlier/JSFX,33.61 MB
646,slimming,576,75,576,11,22/08/2017,14/07/2019,43.00 KB,"Learning Efficient Convolutional Networks through Network Slimming, In ICCV 2017.",Lua,https://github.com/liuzhuang13/slimming,43.00 KB
647,YueScript,576,43,576,62,05/07/2017,26/03/2026,21.25 MB,A delightful language that compiles to Lua,Lua,https://github.com/IppClub/YueScript,21.25 MB
648,siggraph2017_inpainting,576,97,576,5,20/02/2018,17/09/2020,1.06 MB,Code for the paper 'Globally and Locally Consistent Image Completion'. http://iizuka.cs.tsukuba.ac.jp/projects/completion/,Lua,https://github.com/satoshiiizuka/siggraph2017_inpainting,1.06 MB
649,SFTGAN,574,101,574,16,10/04/2018,06/10/2018,11.41 MB,CVPR18 - Recovering Realistic Texture in Image Super-resolution by Deep Spatial Feature Transform,Lua,https://github.com/xinntao/SFTGAN,11.41 MB
650,clangd_extensions.nvim,574,19,574,8,05/02/2022,04/03/2026,161.00 KB,Clangd's off-spec features for neovim's LSP client. Use https://sr.ht/~chinmay/clangd_extensions.nvim instead,Lua,https://github.com/dchinmay2/clangd_extensions.nvim,161.00 KB
651,neoai.nvim,572,52,572,25,01/04/2023,25/07/2025,3.21 MB,Neovim plugin for intracting with GPT models from OpenAI,Lua,https://github.com/Bryley/neoai.nvim,3.21 MB
652,cord.nvim,571,23,571,0,07/04/2024,17/02/2026,6.83 MB,🚀 Discord Rich Presence for Neovim,Lua,https://github.com/vyfor/cord.nvim,6.83 MB
653,nvim-scissors,571,13,571,0,29/12/2023,11/03/2026,376.00 KB,Automagical editing and creation of snippets.,Lua,https://github.com/chrisgrieser/nvim-scissors,376.00 KB
654,sqlite.lua,571,34,571,21,29/12/2020,14/03/2025,722.00 KB,SQLite LuaJIT binding with a very simple api.,Lua,https://github.com/kkharji/sqlite.lua,722.00 KB
655,competitest.nvim,570,30,570,20,21/01/2022,13/05/2025,134.00 KB,"CompetiTest.nvim is a Neovim plugin for Competitive Programming: it can manage and check testcases, download problems and contests from online judges and much more",Lua,https://github.com/xeluxee/competitest.nvim,134.00 KB
656,nvim-code-action-menu,570,21,570,24,26/09/2021,11/12/2023,127.00 KB,Pop-up menu for code actions to show meta-information and diff preview,Lua,https://github.com/weilbith/nvim-code-action-menu,127.00 KB
657,ultimate-autopair.nvim,569,7,569,22,02/02/2023,24/03/2026,1.28 MB,"A treesitter supported autopairing plugin with extensions, and much more",Lua,https://github.com/altermo/ultimate-autopair.nvim,1.28 MB
658,ollama.nvim,568,36,568,23,07/11/2023,10/08/2024,53.00 KB,A plugin for managing and integrating your ollama workflows in neovim.,Lua,https://github.com/nomnivore/ollama.nvim,53.00 KB
659,RDN,564,110,564,18,30/03/2018,29/08/2022,43.36 MB,"Torch code for our CVPR 2018 paper ""Residual Dense Network for Image Super-Resolution"" (Spotlight)",Lua,https://github.com/yulunzhang/RDN,43.36 MB
660,NevermoreEngine,563,142,563,65,17/09/2013,06/03/2026,386.28 MB,ModuleScript loader with reusable and easy unified server-client modules for faster game development on Roblox,Lua,https://github.com/Quenty/NevermoreEngine,386.28 MB
661,Cryptid,561,166,561,14,20/03/2024,24/03/2026,111.69 MB,An unbalanced Balatro mod,Lua,https://github.com/SpectralPack/Cryptid,111.69 MB
662,hlargs.nvim,560,15,560,9,05/02/2022,23/09/2025,155.00 KB,"Highlight arguments' definitions and usages, using Treesitter",Lua,https://github.com/m-demare/hlargs.nvim,155.00 KB
663,torch-autograd,558,111,558,32,06/10/2015,21/10/2021,2.30 MB,Autograd automatically differentiates native Torch code,Lua,https://github.com/twitter-archive/torch-autograd,2.30 MB
664,crylia-theme,557,26,557,3,12/09/2021,22/03/2025,118.18 MB,A theme for AwesomeWM,Lua,https://github.com/Crylia/crylia-theme,118.18 MB
665,wow-voiceover,557,58,557,40,18/03/2023,03/07/2024,2.55 MB,ml world of warcraft voiceover addon,Lua,https://github.com/mrthinger/wow-voiceover,2.55 MB
666,VapourNvim,557,47,557,17,16/03/2021,31/03/2023,3.72 MB,A NeoVim config for THE ULTIMATE vim IDE-like experience.,Lua,https://github.com/VapourNvim/VapourNvim,3.72 MB
667,aider.nvim,557,33,557,8,11/07/2023,17/04/2025,124.00 KB,,Lua,https://github.com/joshuavial/aider.nvim,124.00 KB
668,nvim-metals,556,91,556,22,26/04/2020,22/03/2026,5.52 MB,A Metals plugin for Neovim,Lua,https://github.com/scalameta/nvim-metals,5.52 MB
669,mini.files,555,35,555,0,22/06/2023,19/03/2026,192.00 KB,Navigate and manipulate file system. Part of 'mini.nvim' library.,Lua,https://github.com/nvim-mini/mini.files,192.00 KB
670,text-case.nvim,554,26,554,31,03/06/2022,07/08/2024,979.00 KB,An all in one plugin for converting text case in Neovim,Lua,https://github.com/johmsalas/text-case.nvim,979.00 KB
671,canary,553,821,553,113,25/07/2021,20/03/2026,171.44 MB,Canary Server 15.00 for OpenTibia community. ,Lua,https://github.com/opentibiabr/canary,171.44 MB
672,windfield,552,64,552,11,08/09/2015,14/04/2020,3.55 MB,Physics module for LÖVE,Lua,https://github.com/a327ex/windfield,3.55 MB
673,turbo,552,85,552,39,22/01/2012,06/05/2025,4.63 MB,"Turbo is a framework built for LuaJIT 2 to simplify the task of building fast and scalable network applications. It uses a event-driven, non-blocking, no thread design to deliver excellent performance and minimal footprint to high-load applications while also providing excellent support for embedded uses. ",Lua,https://github.com/kernelsauce/turbo,4.63 MB
674,neovim-ayu,552,61,552,2,02/05/2021,09/01/2026,1.63 MB,Ayu theme for Neovim.,Lua,https://github.com/Shatur/neovim-ayu,1.63 MB
675,filetype.nvim,548,34,548,19,03/09/2021,06/05/2024,170.00 KB,A faster version of filetype.vim,Lua,https://github.com/nathom/filetype.nvim,170.00 KB
676,Spoons,547,165,547,63,04/04/2017,13/03/2026,26.31 MB,The official repository of Spoon plugins,Lua,https://github.com/Hammerspoon/Spoons,26.31 MB
677,FrskyTelemetryScript,546,165,546,29,23/01/2018,24/03/2026,96.13 MB,"A LUA telemetry script and widget for the Horus X10(S),X12 and Taranis X9D+,X9E,QX7 and X-Lite radios using ArduPilot frsky passthru protocol",Lua,https://github.com/yaapu/FrskyTelemetryScript,96.13 MB
678,ts-comments.nvim,544,28,544,3,20/05/2024,28/10/2025,118.00 KB,Tiny plugin to enhance Neovim's native comments,Lua,https://github.com/folke/ts-comments.nvim,118.00 KB
679,druid,544,55,544,8,25/03/2019,17/03/2026,54.39 MB,Powerful Defold UI component framework,Lua,https://github.com/Insality/druid,54.39 MB
680,ICS-pcap,544,156,544,2,21/06/2016,03/01/2020,7.74 MB,A collection of ICS/SCADA PCAPs,Lua,https://github.com/automayt/ICS-pcap,7.74 MB
681,FrackinUniverse,543,362,543,1,27/06/2016,03/03/2026,985.37 MB,1.4.4 SB release version of FrackinUniverse,Lua,https://github.com/sayterdarkwynd/FrackinUniverse,985.37 MB
682,AutoPlugin2,542,46,542,3,02/03/2020,29/09/2025,103.96 MB,Next AutoPlugin 2,Lua,https://github.com/ONElua/AutoPlugin2,103.96 MB
683,lua-resty-upstream-healthcheck,542,135,542,44,27/01/2014,17/12/2025,82.00 KB,Health Checker for Nginx Upstream Servers in Pure Lua,Lua,https://github.com/openresty/lua-resty-upstream-healthcheck,82.00 KB
684,hw,541,115,541,3,22/07/2013,26/02/2026,681.28 MB,Official Hedgewars mirror for GitHub!,Lua,https://github.com/hedgewars/hw,681.28 MB
685,eyeliner.nvim,541,18,541,8,05/07/2022,04/10/2024,137.00 KB,👀 Move faster with unique f/F indicators.,Lua,https://github.com/jinh0/eyeliner.nvim,137.00 KB
686,tsc.nvim,540,33,540,7,22/04/2023,14/01/2026,208.00 KB,"A Neovim plugin for seamless, asynchronous project-wide TypeScript type-checking using the TypeScript compiler (tsc)",Lua,https://github.com/dmmulroy/tsc.nvim,208.00 KB
