Ranking,Project Name,Stars,Forks,Watchers,Open Issues,Created At,Last Commit,Size,Description,Language,Repo URL,Size
687,live-command.nvim,540,5,540,10,11/07/2022,19/12/2025,129.00 KB,Easily create previewable commands in Neovim.,Lua,https://github.com/smjonas/live-command.nvim,129.00 KB
688,dotfiles,540,31,540,2,05/11/2021,28/02/2026,133.00 KB,"My config/dotfiles for tmux, nvim, i3, bla bla bla, nerd things. ",Lua,https://github.com/bashbunni/dotfiles,133.00 KB
689,cc-mek-scada,540,30,540,27,28/12/2021,22/03/2026,4.28 MB,"Configurable ComputerCraft SCADA system for multi-reactor control of Mekanism fission reactors with a GUI, automatic safety features, waste processing control, and more! Please be sure to take a look at the Wiki tab, this project has lots of docs!",Lua,https://github.com/MikaylaFischler/cc-mek-scada,4.28 MB
690,gesture.nvim,539,2,539,0,27/10/2018,08/10/2025,504.00 KB,Mouse gesture plugin for neovim,Lua,https://github.com/notomo/gesture.nvim,504.00 KB
691,lackluster.nvim,538,27,538,0,20/05/2024,06/10/2025,14.57 MB,"a delightful and customizable mostly monochrome colorscheme thats soft on the eyes and supports treesitter, lsp, and heaps of neovim plugins.",Lua,https://github.com/slugbyte/lackluster.nvim,14.57 MB
692,one-small-step-for-vimkind,538,18,538,7,23/03/2021,12/01/2026,280.00 KB,Debug adapter for Neovim plugins,Lua,https://github.com/jbyuki/one-small-step-for-vimkind,280.00 KB
693,Celeste2,537,37,537,4,22/01/2021,29/01/2021,635.00 KB,Celeste Classic 2 for PICO-8!,Lua,https://github.com/EXOK/Celeste2,635.00 KB
694,dotfiles,535,56,535,0,03/06/2024,24/03/2026,461.00 KB,⌨️ The never ending updates of my dotfiles config,Lua,https://github.com/Sin-cy/dotfiles,461.00 KB
695,RxLua,535,79,535,12,15/07/2015,21/06/2020,319.00 KB,Reactive Extensions for Lua,Lua,https://github.com/bjornbytes/RxLua,319.00 KB
696,kommentary,533,13,533,8,29/01/2021,29/11/2023,136.00 KB,"Neovim commenting plugin, written in lua.",Lua,https://github.com/b3nj5m1n/kommentary,136.00 KB
697,CommandPost,531,46,531,502,24/11/2016,01/03/2026,182.44 MB,Workflow Enhancements for Creatives,Lua,https://github.com/CommandPost/CommandPost,182.44 MB
698,persisted.nvim,531,33,531,0,07/09/2021,02/02/2026,286.00 KB,"💾 Simple session management for Neovim with git branching, autoloading and Telescope support",Lua,https://github.com/olimorris/persisted.nvim,286.00 KB
699,suit,529,75,529,18,07/02/2012,26/08/2023,2.04 MB,Immediate Mode GUI library for LÖVE,Lua,https://github.com/vrld/suit,2.04 MB
700,cat9,528,18,528,3,19/02/2022,03/05/2025,2.44 MB,A User shell for LASH,Lua,https://github.com/letoram/cat9,2.44 MB
701,ox_inventory,527,1026,527,20,08/04/2021,11/04/2025,35.13 MB,Slot-based inventory with metadata.,Lua,https://github.com/overextended/ox_inventory,35.13 MB
702,scope.nvim,527,25,527,9,02/03/2022,15/10/2025,30.00 KB,Revolutionize Your Neovim Tab Workflow: Introducing Enhanced Tab Scoping!,Lua,https://github.com/tiagovla/scope.nvim,30.00 KB
703,cmake-tools.nvim,526,106,526,20,08/05/2022,17/03/2026,8.40 MB,CMake integration in Neovim,Lua,https://github.com/Civitasv/cmake-tools.nvim,8.40 MB
704,Girellu,526,225,526,0,11/09/2021,26/03/2026,167.68 MB,Make Assetto Corsa suck less.,Lua,https://github.com/archibaldmilton/Girellu,167.68 MB
705,winshift.nvim,524,11,524,9,13/09/2021,20/05/2024,96.00 KB,Rearrange your windows with ease.,Lua,https://github.com/sindrets/winshift.nvim,96.00 KB
706,telescope-media-files.nvim,524,57,524,35,18/01/2021,30/03/2024,20.00 KB,Telescope extension to preview media files using Ueberzug.,Lua,https://github.com/nvim-telescope/telescope-media-files.nvim,20.00 KB
707,iswap.nvim,523,23,523,11,30/05/2021,25/03/2026,105.00 KB,"Interactively select and swap function arguments, list elements, and much more. Powered by tree-sitter.",Lua,https://github.com/mizlan/iswap.nvim,105.00 KB
708,lua-resty-websocket,522,111,522,32,10/09/2013,18/12/2025,161.00 KB,WebSocket support for the ngx_lua module (and OpenResty),Lua,https://github.com/openresty/lua-resty-websocket,161.00 KB
709,nvim-lspinstall,520,61,520,59,19/03/2021,20/10/2021,288.00 KB,Provides the missing :LspInstall for nvim-lspconfig,Lua,https://github.com/karimknaebel/nvim-lspinstall,288.00 KB
710,windline.nvim,519,18,519,0,14/05/2021,22/10/2025,1.09 MB,"Animation statusline, floating window statusline. Use lua + luv make some wind",Lua,https://github.com/windwp/windline.nvim,1.09 MB
711,kanso.nvim,518,21,518,7,06/05/2025,31/01/2026,6.26 MB,,Lua,https://github.com/webhooked/kanso.nvim,6.26 MB
712,bufdelete.nvim,517,22,517,1,25/05/2021,24/02/2024,51.00 KB,Delete Neovim buffers without losing window layout,Lua,https://github.com/famiu/bufdelete.nvim,51.00 KB
713,debugprint.nvim,517,27,517,10,08/08/2022,08/03/2026,826.00 KB,Debugging in NeoVim the print() way!,Lua,https://github.com/andrewferrier/debugprint.nvim,826.00 KB
714,koreader-sync-server,516,34,516,3,07/03/2015,16/03/2026,89.00 KB,self hostable synchronization service for koreader devices,Lua,https://github.com/koreader/koreader-sync-server,89.00 KB
715,advent-of-nvim,515,27,515,5,01/12/2024,20/12/2024,14.00 KB,,Lua,https://github.com/tjdevries/advent-of-nvim,14.00 KB
716,guard.nvim,515,26,515,0,15/02/2023,31/01/2026,397.00 KB,"Lightweight, fast and async formatting and linting plugin for Neovim",Lua,https://github.com/nvimdev/guard.nvim,397.00 KB
717,dotfiles,514,223,514,15,05/02/2015,20/02/2026,10.17 MB,,Lua,https://github.com/Parth/dotfiles,10.17 MB
718,cardpeek,512,132,512,54,12/08/2015,18/12/2023,6.77 MB,Automatically exported from code.google.com/p/cardpeek,Lua,https://github.com/L1L1/cardpeek,6.77 MB
719,ArkLights,512,50,512,2,25/08/2023,01/11/2025,8.49 MB,明日方舟速通 arknights,Lua,https://github.com/AegirTech/ArkLights,8.49 MB
720,actions-preview.nvim,510,18,510,11,29/09/2022,03/10/2025,99.00 KB,Fully customizable previewer for LSP code actions.,Lua,https://github.com/aznhe21/actions-preview.nvim,99.00 KB
721,DarkRP,509,710,509,0,29/09/2012,11/03/2026,7.17 MB,"DarkRP, a non-serious roleplay gamemode for Garry's Mod.",Lua,https://github.com/FPtje/DarkRP,7.17 MB
722,garbage-day.nvim,506,7,506,1,05/11/2023,25/02/2026,135.00 KB,Garbage collector that stops inactive LSP clients to free RAM,Lua,https://github.com/Zeioth/garbage-day.nvim,135.00 KB
723,knife,505,41,505,2,25/06/2015,17/09/2018,250.00 KB,A collection of useful micro-modules for Lua.,Lua,https://github.com/airstruck/knife,250.00 KB
724,oh-my-nvim,505,42,505,7,30/04/2023,23/06/2024,19.32 MB,"A theme-driven, out-of-the-box modern configuration of neovim (HardHackerNvim)💎",Lua,https://github.com/hardhackerlabs/oh-my-nvim,19.32 MB
725,WireHub,505,28,505,9,21/12/2018,02/07/2019,243.00 KB,"🌍 Decentralized, peer-to-peer and secure overlay networks",Lua,https://github.com/gawen/WireHub,243.00 KB
726,moonshine,504,34,504,23,16/05/2013,28/05/2021,4.90 MB,A lightweight Lua VM for the browser,Lua,https://github.com/gamesys/moonshine,4.90 MB
727,quarto-nvim,503,23,503,6,24/07/2022,29/01/2026,214.00 KB,Quarto mode for Neovim,Lua,https://github.com/quarto-dev/quarto-nvim,214.00 KB
728,hammerspoon-shiftit,501,30,501,8,23/01/2020,14/07/2023,3.63 MB,A ShiftIt like Hammerspoon window management configuration,Lua,https://github.com/peterklijn/hammerspoon-shiftit,3.63 MB
729,hekili,500,268,500,19,28/11/2016,21/01/2026,75.35 MB,Hekili Priority Helper for The War Within,Lua,https://github.com/Hekili/hekili,75.35 MB
730,startup.nvim,500,35,500,9,04/10/2021,30/10/2024,162.00 KB,A highly configurable neovim startup screen,Lua,https://github.com/max397574/startup.nvim,162.00 KB
731,kindlepdfviewer,500,94,500,62,14/11/2011,21/08/2013,7.99 MB,"(DEPRECATED, please use KOReader instead) A PDF (plus DJVU, ePub, TXT, CHM, FB2, HTML...) viewer made for e-ink framebuffer devices, using muPDF, djvulibre, crengine",Lua,https://github.com/koreader/kindlepdfviewer,7.99 MB
732,lean.nvim,498,46,498,38,30/12/2020,25/03/2026,2.44 MB,Neovim support for the Lean theorem prover,Lua,https://github.com/Julian/lean.nvim,2.44 MB
733,NobleEngine,498,40,498,16,17/03/2021,07/07/2024,5.84 MB,A li'l game engine for Playdate.,Lua,https://github.com/NobleRobot/NobleEngine,5.84 MB
734,nvim-comment,496,22,496,14,09/02/2021,29/05/2024,39.00 KB,"A comment toggler for Neovim, written in Lua",Lua,https://github.com/terrortylor/nvim-comment,39.00 KB
735,slardar,496,111,496,13,18/08/2016,11/11/2019,142.00 KB,Updating your upstream list and run lua scripts without reloading Nginx.,Lua,https://github.com/upyun/slardar,142.00 KB
736,pandoc-scholar,494,50,494,9,16/02/2017,27/01/2023,806.00 KB,Create beautiful and semantically meaningful articles with pandoc.,Lua,https://github.com/pandoc-scholar/pandoc-scholar,806.00 KB
737,lua-debug,493,105,493,59,21/09/2016,26/03/2026,9.78 MB,Lua Debug Adapter for Visual Studio Code,Lua,https://github.com/actboy168/lua-debug,9.78 MB
738,Shade.nvim,493,28,493,34,19/04/2021,06/01/2024,17.00 KB,An Nvim lua plugin that dims your inactive windows,Lua,https://github.com/sunjon/Shade.nvim,17.00 KB
739,legend-of-lua,493,67,493,9,15/10/2020,21/07/2025,78.80 MB,,Lua,https://github.com/challacade/legend-of-lua,78.80 MB
740,kong-oidc,492,365,492,106,14/06/2017,23/06/2023,212.00 KB,OIDC plugin for Kong,Lua,https://github.com/nokia/kong-oidc,212.00 KB
741,poimandres.nvim,491,44,491,8,16/07/2022,19/10/2024,67.00 KB,Poimandres colorscheme for Neovim written in Lua,Lua,https://github.com/olivercederborg/poimandres.nvim,67.00 KB
742,specs.nvim,489,20,489,21,14/03/2021,19/05/2024,30.00 KB,👓 A fast and lightweight Neovim lua plugin to keep an eye on where your cursor has jumped.,Lua,https://github.com/edluffy/specs.nvim,30.00 KB
743,neural-vqa,488,90,488,3,16/11/2015,03/05/2016,80.00 KB,:grey_question: Visual Question Answering in Torch,Lua,https://github.com/abhshkdz/neural-vqa,80.00 KB
744,lite-xl-plugins,488,118,488,113,18/12/2021,05/12/2025,1.48 MB,Plugins for the Lite XL editor,Lua,https://github.com/lite-xl/lite-xl-plugins,1.48 MB
745,fine-cmdline.nvim,486,7,486,8,19/11/2021,19/03/2026,59.00 KB,Enter ex-commands in a nice floating input.,Lua,https://github.com/VonHeikemen/fine-cmdline.nvim,59.00 KB
746,other.nvim,485,38,485,9,08/03/2022,09/05/2025,2.87 MB,Open alternative files for the current buffer,Lua,https://github.com/rgroli/other.nvim,2.87 MB
747,30log,484,53,484,9,24/08/2012,08/05/2021,732.00 KB,30 lines library for object orientation in Lua,Lua,https://github.com/Yonaba/30log,732.00 KB
748,opm,484,76,484,29,14/09/2016,17/12/2025,552.00 KB,OpenResty Package Manager,Lua,https://github.com/openresty/opm,552.00 KB
749,mpv-scripts,483,43,483,41,04/11/2016,01/11/2025,118.00 KB,Various scripts for mpv,Lua,https://github.com/occivink/mpv-scripts,118.00 KB
750,love-release,483,29,483,11,05/11/2013,10/07/2024,252.00 KB,:love_letter: Lua script that makes LÖVE game release easier,Lua,https://github.com/MisterDA/love-release,252.00 KB
751,hammerspoon-config,482,114,482,3,19/03/2019,09/01/2020,48.00 KB,🔨🥄 Laziness  constitute the primary productive force.,Lua,https://github.com/wangshub/hammerspoon-config,48.00 KB
752,lgi,482,77,482,95,28/11/2011,05/03/2026,3.51 MB,Dynamic Lua binding to GObject libraries using GObject-Introspection,Lua,https://github.com/lgi-devs/lgi,3.51 MB
753,awesome-wm-nice,482,30,482,14,01/09/2020,28/07/2025,4.11 MB,"An Awesome WM module that add MacOS-like window decorations, with seamless titlebars, double click to maximize, and window shade feature",Lua,https://github.com/mut-ex/awesome-wm-nice,4.11 MB
754,AfenarUI,481,177,481,4,12/07/2016,08/12/2022,843.01 MB,World of Warcraft User Interface,Lua,https://github.com/Afenar/AfenarUI,843.01 MB
755,Stochastic_Depth,481,77,481,1,01/04/2016,13/08/2018,19.00 KB,Deep Networks with Stochastic Depth,Lua,https://github.com/yueatsprograms/Stochastic_Depth,19.00 KB
756,comment-box.nvim,481,15,481,15,12/01/2022,10/08/2024,673.00 KB,:sparkles: Clarify and beautify your comments and plain text files using boxes and lines.,Lua,https://github.com/LudoPinelli/comment-box.nvim,673.00 KB
757,auto-dark-mode.nvim,481,37,481,12,08/02/2022,03/08/2025,2.48 MB,"A Neovim plugin for macOS, Linux & Windows that automatically changes the editor appearance based on system settings.",Lua,https://github.com/f-person/auto-dark-mode.nvim,2.48 MB
758,learning_to_execute,480,112,480,2,19/11/2014,09/04/2016,23.00 KB,Learning to Execute,Lua,https://github.com/wojciechz/learning_to_execute,23.00 KB
759,nvim-lsputils,479,18,479,17,17/09/2020,28/10/2023,130.00 KB,Better defaults for nvim-lsp actions,Lua,https://github.com/RishabhRD/nvim-lsputils,130.00 KB
760,codewindow.nvim,479,21,479,27,11/10/2022,22/05/2025,254.00 KB,,Lua,https://github.com/gorbit99/codewindow.nvim,254.00 KB
761,WolfHUD,479,233,479,133,17/02/2016,20/02/2024,18.51 MB,Payday 2 HUD,Lua,https://github.com/Kamikaze94/WolfHUD,18.51 MB
762,cloak.nvim,479,13,479,8,30/08/2022,12/06/2024,29.00 KB,Cloak allows you to overlay *'s over defined patterns in defined files.,Lua,https://github.com/laytan/cloak.nvim,29.00 KB
763,nvim-origami,478,13,478,3,27/07/2023,06/03/2026,182.00 KB,Fold with relentless elegance. A collection of quality-of-life features related to folding.,Lua,https://github.com/chrisgrieser/nvim-origami,182.00 KB
764,word-rnn,477,101,477,19,15/10/2015,16/10/2017,537.00 KB,Recurrent Neural Network that predicts word-by-word,Lua,https://github.com/larspars/word-rnn,537.00 KB
765,elixir-tools.nvim,477,34,477,17,23/03/2022,26/03/2026,135.80 MB,Neovim plugin for Elixir,Lua,https://github.com/elixir-tools/elixir-tools.nvim,135.80 MB
766,ArknightsGameResource,476,63,476,11,28/11/2021,27/03/2026,5.57 GB,明日方舟客户端素材,Lua,https://github.com/yuanyan3060/ArknightsGameResource,5.57 GB
767,Autoencoders,475,79,475,2,10/07/2016,28/08/2017,46.00 KB,Torch implementations of various types of autoencoders,Lua,https://github.com/Kaixhin/Autoencoders,46.00 KB
768,symbol-usage.nvim,474,12,474,2,17/09/2023,03/05/2025,155.00 KB,"Display references, definitions and implementations of document symbols",Lua,https://github.com/Wansmer/symbol-usage.nvim,155.00 KB
769,micro-auth,474,21,474,0,19/02/2017,23/03/2017,11.00 KB,A microservice that makes adding authentication with Google and Github to your application easy.,Lua,https://github.com/hypebeast/micro-auth,11.00 KB
770,lvim,474,63,474,0,21/07/2021,01/05/2025,1.26 MB,🧑‍🚀 Bloated LunarVim 🚀,Lua,https://github.com/abzcoding/lvim,1.26 MB
771,flux,472,42,472,9,22/04/2014,16/12/2020,17.00 KB,"A fast, lightweight tweening library for Lua",Lua,https://github.com/rxi/flux,17.00 KB
772,mpv-settings,471,49,471,0,16/02/2018,26/03/2026,12.97 MB,basically my settings for MPV,Lua,https://github.com/Tsubajashi/mpv-settings,12.97 MB
773,BlizzardInterfaceCode,471,157,471,4,11/04/2014,12/03/2026,43.36 MB,,Lua,https://github.com/tomrus88/BlizzardInterfaceCode,43.36 MB
774,HC,469,47,469,3,13/01/2011,31/12/2025,1.05 MB,General purpose collision detection library for the use with LÖVE.,Lua,https://github.com/vrld/HC,1.05 MB
775,3DreamEngine,469,19,469,14,30/03/2019,25/05/2023,99.07 MB,3DreamEngine is an *awesome* 3d engine for LÖVE.,Lua,https://github.com/3dreamengine/3DreamEngine,99.07 MB
776,ui,468,174,468,24,14/07/2022,24/01/2026,672.00 KB,Lightweight & high performance UI plugin for nvchad,Lua,https://github.com/NvChad/ui,672.00 KB
777,sceneparsing,468,192,468,11,22/06/2016,19/04/2019,683.00 KB,Development kit for MIT Scene Parsing Benchmark,Lua,https://github.com/CSAILVision/sceneparsing,683.00 KB
778,Hydroxide,468,196,468,21,16/03/2020,30/07/2024,303.00 KB,Lua runtime introspection and network capturing tool for games on the Roblox engine.,Lua,https://github.com/Upbolt/Hydroxide,303.00 KB
779,plugins,467,58,467,36,14/05/2024,27/02/2026,281.00 KB,"Place code snippets from docs into this monorepo, so that users can update more easily via package manager.",Lua,https://github.com/yazi-rs/plugins,281.00 KB
780,nvim-plugin-template,467,28,467,2,14/02/2022,08/10/2025,30.00 KB,A neovim plugin template for github repos,Lua,https://github.com/ellisonleao/nvim-plugin-template,30.00 KB
781,iproute2-cheatsheet,466,94,466,11,05/01/2014,17/09/2025,417.00 KB,iproute2 command reference,Lua,https://github.com/dmbaturin/iproute2-cheatsheet,417.00 KB
782,fugit2.nvim,466,15,466,16,13/10/2023,22/03/2026,1.42 MB,Neovim git GUI powered by libgit2,Lua,https://github.com/SuperBo/fugit2.nvim,1.42 MB
783,syntax-tree-surfer,465,9,465,5,13/04/2022,02/02/2024,68.00 KB,A plugin for Neovim that helps you surf through your document and move elements around using the nvim-treesitter API.,Lua,https://github.com/ziontee113/syntax-tree-surfer,68.00 KB
784,llm.nvim,465,36,465,1,17/08/2024,12/03/2026,835.00 KB,"A large language model (LLM) plugin for Neovim, provides commands to interact with LLM (like ChatGPT, Copilot, ChatGLM, kimi, deepseek, openrouter and local llms). Support Github models.",Lua,https://github.com/Kurama622/llm.nvim,835.00 KB
785,dirbuf.nvim,464,6,464,18,18/11/2020,19/10/2022,205.00 KB,A file manager for Neovim which lets you edit your filesystem like you edit text,Lua,https://github.com/elihunter173/dirbuf.nvim,205.00 KB
786,soundnet,464,94,464,14,07/10/2016,07/10/2017,46.00 KB,SoundNet: Learning Sound Representations from Unlabeled Video. NIPS 2016,Lua,https://github.com/cvondrick/soundnet,46.00 KB
787,luci-app-diskman,464,124,464,16,24/11/2019,24/12/2025,352.00 KB,Disk Manager for LuCI,Lua,https://github.com/lisaac/luci-app-diskman,352.00 KB
788,Redpoint,463,149,463,6,23/03/2014,10/03/2020,224.00 KB,Digital Bond's ICS Enumeration Tools,Lua,https://github.com/digitalbond/Redpoint,224.00 KB
789,ElvUI,463,174,463,100,07/06/2014,31/07/2024,16.39 MB,ElvUI for World of Warcraft - Wrath of the Lich King (3.3.5a),Lua,https://github.com/ElvUI-WotLK/ElvUI,16.39 MB
790,nvimpager,462,21,462,11,23/10/2017,18/02/2026,413.00 KB,"Use nvim as a pager to view manpages, diffs, etc with nvim's syntax highlighting",Lua,https://github.com/lucc/nvimpager,413.00 KB
791,nvim-cursorline,462,28,462,7,06/12/2020,14/02/2026,20.00 KB,A plugin for neovim that highlights cursor words and lines,Lua,https://github.com/ya2s/nvim-cursorline,20.00 KB
792,MSDNet,461,93,461,7,15/03/2017,03/04/2019,39.00 KB,Multi-Scale Dense Networks for Resource Efficient Image Classification （ICLR 2018 Oral）,Lua,https://github.com/gaohuang/MSDNet,39.00 KB
793,termtris,461,41,461,2,23/09/2014,09/12/2019,280.00 KB,A text-based game inspired by tetris.,Lua,https://github.com/tylerneylon/termtris,280.00 KB
794,nvim-treehopper,460,17,460,7,13/06/2021,16/06/2025,25.00 KB,Region selection with hints on the AST nodes of a document powered by treesitter,Lua,https://github.com/mfussenegger/nvim-treehopper,25.00 KB
795,colorful-menu.nvim,459,14,459,3,03/01/2025,25/11/2025,122.00 KB,Bring enjoyment to your auto completion.,Lua,https://github.com/xzbdmw/colorful-menu.nvim,122.00 KB
796,ledge,459,57,459,16,29/06/2011,07/05/2021,3.25 MB,"An RFC compliant and ESI capable HTTP cache for Nginx / OpenResty, backed by Redis",Lua,https://github.com/ledgetech/ledge,3.25 MB
797,litee.nvim,458,16,458,16,17/11/2021,06/06/2024,576.00 KB,A framework for building Neovim plugins,Lua,https://github.com/ldelossa/litee.nvim,576.00 KB
798,pegasus.lua,457,41,457,14,14/11/2014,08/03/2026,472.00 KB,:rocket: Pegasus.lua is an http server to work with web applications written in Lua language.,Lua,https://github.com/EvandroLG/pegasus.lua,472.00 KB
799,nnn.nvim,457,11,457,1,30/09/2021,18/04/2025,156.00 KB,File manager for Neovim powered by nnn.,Lua,https://github.com/luukvbaal/nnn.nvim,156.00 KB
800,server,457,839,457,758,01/04/2021,24/03/2026,693.54 MB,:sailboat: LandSandBoat - a server emulator for Final Fantasy XI,Lua,https://github.com/LandSandBoat/server,693.54 MB
801,Project-GLD,455,19,455,0,18/06/2023,16/03/2026,338.52 MB,"Project GLD is a game library and download manager, which supports community made Lua scripts for downloading and searching games.",Lua,https://github.com/Y0URD34TH/Project-GLD,338.52 MB
802,lua-resty-lrucache,455,113,455,15,30/04/2014,17/12/2025,115.00 KB,Lua-land LRU Cache based on LuaJIT FFI,Lua,https://github.com/openresty/lua-resty-lrucache,115.00 KB
803,visual-whitespace.nvim,454,8,454,0,09/03/2024,22/02/2026,77.00 KB,"Imitate VSCode's ""Render Whitespace"" feature in visual mode",Lua,https://github.com/mcauley-penney/visual-whitespace.nvim,77.00 KB
804,pretty-fold.nvim,454,23,454,12,21/12/2021,29/05/2024,110.00 KB,Foldtext customization in Neovim,Lua,https://github.com/anuvyklack/pretty-fold.nvim,110.00 KB
805,sent-conv-torch,453,126,453,13,08/09/2015,26/01/2020,58.85 MB,Text classification using a convolutional neural network.,Lua,https://github.com/harvardnlp/sent-conv-torch,58.85 MB
806,gruvbox-baby,453,32,453,8,26/12/2021,25/01/2024,137.00 KB,Gruvbox theme for neovim with full 🎄TreeSitter support. ,Lua,https://github.com/luisiacc/gruvbox-baby,137.00 KB
807,neovim-tips,453,11,453,2,06/08/2025,06/02/2026,51.77 MB,"Discover hundreds of Neovim tips, tricks, and shortcuts — and even add your own! You’ll also get a beautifully formatted PDF book with every tip inside.",Lua,https://github.com/saxon1964/neovim-tips,51.77 MB
808,tiny-code-action.nvim,452,21,452,0,22/07/2024,25/02/2026,480.00 KB,A Neovim plugin that provides a simple way to run and visualize code actions with Telescope.,Lua,https://github.com/rachartier/tiny-code-action.nvim,480.00 KB
809,nvimux,452,16,452,4,08/03/2016,19/05/2022,134.00 KB,Neovim as a TMUX replacement,Lua,https://github.com/hkupty/nvimux,134.00 KB
810,grab_beacon_config,451,98,451,2,23/11/2020,04/08/2021,329.00 KB,,Lua,https://github.com/whickey-r7/grab_beacon_config,329.00 KB
811,otclient,451,399,451,85,18/06/2020,15/03/2026,199.15 MB,"An alternative tibia client for otserv written in C++20 and Lua, made with a modular system that uses lua scripts for ingame interface and functionality, making otclient flexible and easy to customize",Lua,https://github.com/opentibiabr/otclient,199.15 MB
812,gvnn,450,71,450,9,03/07/2016,21/04/2017,12.61 MB,gvnn: Geometric Vision with Neural Networks,Lua,https://github.com/ankurhanda/gvnn,12.61 MB
813,bamboo.nvim,450,22,450,2,01/06/2023,25/11/2025,230.00 KB,Warm Green Theme for Neovim and Beyond,Lua,https://github.com/ribru17/bamboo.nvim,230.00 KB
814,ljsyscall,449,56,449,76,10/05/2011,30/12/2021,10.66 MB,LuaJIT Unix syscall FFI,Lua,https://github.com/justincormack/ljsyscall,10.66 MB
815,BeamMP,449,110,449,85,15/05/2019,26/03/2026,15.77 MB,Bringing multiplayer to BeamNG.drive,Lua,https://github.com/BeamMP/BeamMP,15.77 MB
816,neovim-for-beginner,449,99,449,7,24/12/2021,23/05/2023,643.00 KB,A configuration for Neovim beginners.,Lua,https://github.com/alpha2phi/neovim-for-beginner,643.00 KB
817,mpv-config,449,121,449,0,08/04/2015,23/03/2025,367.00 KB,Personal mpv configuration files and scripts (for syncing my computers). NOTE: my VO config is dynamic and relies on certain scripts (see corresponding comments in mpv.conf),Lua,https://github.com/Argon-/mpv-config,367.00 KB
818,croissant,448,10,448,9,16/02/2019,18/07/2024,605.00 KB,🥐 A Lua REPL and debugger,Lua,https://github.com/giann/croissant,605.00 KB
819,2DGD_F0TH,448,17,448,21,07/06/2019,12/01/2026,37.11 MB,[CC BY-NC-SA] A compendium of the community knowledge on game design and development,Lua,https://github.com/2DGD-F0TH/2DGD_F0TH,37.11 MB
820,rime-crane,447,24,447,5,27/04/2023,09/10/2024,62.69 MB,凇鹤拼音 —— Rime 简体中文输入法方案，整合了雾凇拼音和小鹤双拼/音形方案的拼音输入法。,Lua,https://github.com/kchen0x/rime-crane,62.69 MB
821,oldworld.nvim,446,28,446,0,03/05/2024,30/12/2025,252.00 KB,Dark theme with relaxing and no-saturated colors,Lua,https://github.com/dgox16/oldworld.nvim,252.00 KB
822,esx_core,446,797,446,27,16/05/2021,24/01/2026,35.63 MB,Official Repo For core resources for esx-legacy,Lua,https://github.com/esx-framework/esx_core,35.63 MB
823,learning-to-communicate,446,72,446,1,02/08/2016,21/02/2019,41.00 KB,Learning to Communicate with Deep Multi-Agent Reinforcement Learning,Lua,https://github.com/iassael/learning-to-communicate,41.00 KB
824,U7Revisited,445,27,445,16,25/07/2023,23/03/2026,599.81 MB,A replacement engine for Ultima VII The Black Gate (and eventually Serpent Isle) that presents a new camera angle and other improvements.,Lua,https://github.com/ViridianGames/U7Revisited,599.81 MB
825,nvim-window-picker,444,36,444,14,25/09/2021,26/02/2025,153.00 KB,This plugins prompts the user to pick a window and returns the window id of the picked window,Lua,https://github.com/s1n7ax/nvim-window-picker,153.00 KB
826,Activity-Recognition-with-CNN-and-RNN,444,146,444,5,29/04/2016,27/06/2020,120.50 MB,Temporal Segments LSTM and Temporal-Inception for Activity Recognition,Lua,https://github.com/chihyaoma/Activity-Recognition-with-CNN-and-RNN,120.50 MB
827,mellifluous.nvim,444,17,444,3,09/07/2022,22/01/2026,1.79 MB,Pleasant and productive colorscheme for Neovim,Lua,https://github.com/ramojus/mellifluous.nvim,1.79 MB
828,OPQ,444,88,444,8,03/08/2020,10/12/2025,5.91 MB,OPQ RST UVW XYZ,Lua,https://github.com/opq-osc/OPQ,5.91 MB
829,neocodeium,444,21,444,2,01/04/2024,15/10/2025,206.00 KB,free AI completion plugin for neovim,Lua,https://github.com/monkoose/neocodeium,206.00 KB
830,Windots,444,43,444,0,22/06/2023,12/02/2026,1.10 MB,"My personal ""Windows-friendly"" dotfiles.",Lua,https://github.com/scottmckendry/Windots,1.10 MB
831,copilot-lsp,443,19,443,16,17/04/2025,15/03/2026,79.00 KB,Copilot LSP: A lightweight and extensible Neovim plugin for integrating GitHub Copilot's AI-powered code suggestions via Language Server Protocol (LSP).,Lua,https://github.com/copilotlsp-nvim/copilot-lsp,79.00 KB
832,defold-games,443,60,443,0,31/10/2018,10/11/2025,101.95 MB,Collection of 2D games made with Defold,Lua,https://github.com/benjames-171/defold-games,101.95 MB
