Ranking,Project Name,Stars,Forks,Watchers,Open Issues,Created At,Last Commit,Size,Description,Language,Repo URL,Size
261,supermaven-nvim,1413,74,1413,69,08/05/2024,07/10/2024,135.00 KB,The official Neovim plugin for Supermaven,Lua,https://github.com/supermaven-inc/supermaven-nvim,135.00 KB
262,small,1401,881,1401,13,18/04/2020,26/03/2026,62.90 MB,clash homeprxoy mihomo 依赖,Lua,https://github.com/kenzok8/small,62.90 MB
263,nvim,1396,122,1396,1,12/03/2021,05/03/2026,10.67 MB,A non-minimal Neovim config built to work most efficiently with Frontend Development,Lua,https://github.com/ecosse3/nvim,10.67 MB
264,vlsub,1396,338,1396,103,23/01/2012,27/09/2023,276.00 KB,VLC extension to download subtitles from opensubtitles.org,Lua,https://github.com/exebetche/vlsub,276.00 KB
265,navigator.lua,1389,65,1389,23,19/04/2021,10/11/2025,1005.00 KB,Code analysis & navigation plugin for Neovim. Navigate codes like a breeze🎐  Exploring LSP and 🌲Treesitter symbols a piece of 🍰  Take control like a boss 🦍,Lua,https://github.com/ray-x/navigator.lua,1005.00 KB
266,flutter-tools.nvim,1372,111,1372,33,12/12/2020,14/01/2026,6.12 MB,Tools to help create flutter apps in neovim using the native lsp,Lua,https://github.com/nvim-flutter/flutter-tools.nvim,6.12 MB
267,LuaPanda,1367,366,1367,72,25/01/2019,11/03/2024,32.50 MB,lua debug and code tools for VS Code,Lua,https://github.com/Tencent/LuaPanda,32.50 MB
268,copilot-cmp,1364,53,1364,26,02/04/2022,11/12/2024,87.00 KB,Lua plugin to turn github copilot into a cmp source,Lua,https://github.com/zbirenbaum/copilot-cmp,87.00 KB
269,distant.nvim,1360,16,1360,26,01/08/2021,17/10/2024,838.00 KB,"🚧 (Alpha stage software) Edit files, run programs, and work with LSP on a remote machine from the comfort of your local environment 🚧",Lua,https://github.com/chipsenkbeil/distant.nvim,838.00 KB
270,nn,1358,963,1358,173,18/10/2013,12/01/2021,3.67 MB,,Lua,https://github.com/torch/nn,3.67 MB
271,dotfiles,1354,255,1354,17,02/02/2024,27/08/2025,24.91 MB,,Lua,https://github.com/typecraft-dev/dotfiles,24.91 MB
272,dotfiles-latest,1345,137,1345,0,30/01/2024,25/03/2026,15.30 MB,My most up to date dotfiles,Lua,https://github.com/linkarzu/dotfiles-latest,15.30 MB
273,git-conflict.nvim,1340,59,1340,31,13/03/2022,27/12/2024,129.00 KB,A plugin to visualise and resolve merge conflicts in neovim,Lua,https://github.com/akinsho/git-conflict.nvim,129.00 KB
274,glow.nvim,1333,54,1333,13,12/08/2020,21/03/2025,91.00 KB,A markdown preview directly in your neovim.,Lua,https://github.com/ellisonleao/glow.nvim,91.00 KB
275,multipathnet,1331,274,1331,23,18/08/2016,22/03/2019,76.00 KB,"A Torch implementation of the object detection network from ""A MultiPath Network for Object Detection"" (https://arxiv.org/abs/1604.02135)",Lua,https://github.com/facebookresearch/multipathnet,76.00 KB
276,awesome-hammerspoon,1326,172,1326,11,28/03/2016,10/04/2023,373.00 KB,awesome configuration for Hammerspoon.,Lua,https://github.com/ashfinal/awesome-hammerspoon,373.00 KB
277,precognition.nvim,1319,16,1319,13,26/12/2023,31/01/2026,209.00 KB,💭👀precognition.nvim - Precognition uses virtual text and gutter signs to show available motions.,Lua,https://github.com/tris203/precognition.nvim,209.00 KB
278,iron.nvim,1319,107,1319,56,02/05/2016,20/02/2026,498.00 KB,Interactive Repl Over Neovim,Lua,https://github.com/Vigemus/iron.nvim,498.00 KB
279,hump,1319,160,1319,17,09/08/2010,18/08/2024,846.00 KB,LÖVE Helper Utilities for Massive Progression,Lua,https://github.com/vrld/hump,846.00 KB
280,MPV-EASY-Player,1318,63,1318,1,26/03/2018,26/03/2026,4.32 MB,"MPV-EASY Player - An easy to use, modern video player based on mpv （一个基于MPV,易于使用,现代化的视频播放器）",Lua,https://github.com/422658476/MPV-EASY-Player,4.32 MB
281,learn-neovim-lua,1315,188,1315,1,02/11/2021,07/09/2024,12.31 MB,Neovim 配置实战：从 0 到 1 打造自己的 IDE,Lua,https://github.com/nshen/learn-neovim-lua,12.31 MB
282,awesome-dotfiles,1315,68,1315,18,25/11/2019,09/08/2024,152.88 MB,Dotfiles for awesome people using the awesomewm linux environment,Lua,https://github.com/WillPower3309/awesome-dotfiles,152.88 MB
283,gp.nvim,1313,126,1313,69,18/06/2023,11/08/2025,632.00 KB,"Gp.nvim (GPT prompt) Neovim AI plugin: ChatGPT sessions & Instructable text/code operations & Speech to text [OpenAI, Ollama, Anthropic, ..]",Lua,https://github.com/Robitx/gp.nvim,632.00 KB
284,wide-residual-networks,1312,298,1312,24,17/05/2016,20/08/2019,103.00 KB,3.8% and 18.3% on CIFAR-10 and CIFAR-100,Lua,https://github.com/szagoruyko/wide-residual-networks,103.00 KB
285,luadec,1311,404,1311,63,28/07/2014,25/02/2024,2.67 MB,"Lua Decompiler for lua 5.1 , 5.2 and 5.3",Lua,https://github.com/viruscamp/luadec,2.67 MB
286,treesj,1307,45,1307,5,11/11/2022,14/03/2026,345.00 KB,Neovim plugin for splitting/joining blocks of code,Lua,https://github.com/Wansmer/treesj,345.00 KB
287,Faster-High-Res-Neural-Inpainting,1297,210,1297,12,26/01/2017,29/05/2018,37.13 MB,High-Resolution Image Inpainting using Multi-Scale Neural Patch Synthesis,Lua,https://github.com/leehomyc/Faster-High-Res-Neural-Inpainting,37.13 MB
288,cyberdream.nvim,1292,51,1292,5,21/12/2023,27/01/2026,411.00 KB,"🤖💤 High-contrast, Futuristic & Vibrant Neovim Colorscheme",Lua,https://github.com/scottmckendry/cyberdream.nvim,411.00 KB
289,nvim-ts-context-commentstring,1285,44,1285,24,24/02/2021,07/12/2024,2.46 MB,Neovim treesitter plugin for setting the commentstring based on the cursor location in a file.,Lua,https://github.com/JoosepAlviste/nvim-ts-context-commentstring,2.46 MB
290,openstar,1284,420,1284,4,18/05/2016,10/10/2021,34.81 MB,"lua waf,nginx+lua,openresty,luajit,waf+,cdn,nginx",Lua,https://github.com/starjun/openstar,34.81 MB
291,seq2seq-attn,1282,280,1282,15,01/04/2016,30/12/2020,5.17 MB,Sequence-to-sequence model with LSTM encoder/decoders and attention,Lua,https://github.com/harvardnlp/seq2seq-attn,5.17 MB
292,xcodebuild.nvim,1277,38,1277,0,01/11/2023,08/02/2026,16.77 MB,"Neovim plugin to Build, Debug, and Test applications created for Apple devices (iOS, macOS, watchOS, etc.)",Lua,https://github.com/wojciech-kulik/xcodebuild.nvim,16.77 MB
293,nvim-compe,1277,52,1277,5,10/06/2020,02/10/2021,784.00 KB,Auto completion Lua plugin for nvim,Lua,https://github.com/hrsh7th/nvim-compe,784.00 KB
294,vim-moonfly-colors,1265,72,1265,0,10/05/2017,18/01/2026,843.00 KB,A dark charcoal theme for modern Neovim & classic Vim,Lua,https://github.com/bluz71/vim-moonfly-colors,843.00 KB
295,windsurf.nvim,1262,106,1262,115,29/01/2023,30/04/2025,310.00 KB,A native neovim extension for Codeium,Lua,https://github.com/Exafunction/windsurf.nvim,310.00 KB
296,remote-nvim.nvim,1259,57,1259,61,26/07/2023,22/08/2025,481.00 KB,Remote development in Neovim 🔥,Lua,https://github.com/amitds1997/remote-nvim.nvim,481.00 KB
297,heirline.nvim,1257,42,1257,28,01/01/2022,23/05/2025,1.33 MB,Heirline.nvim is a no-nonsense Neovim Statusline plugin designed around recursive inheritance to be exceptionally fast and versatile.,Lua,https://github.com/rebelot/heirline.nvim,1.33 MB
298,im2markup,1256,216,1256,20,16/09/2016,27/10/2023,4.35 MB,Neural model for converting Image-to-Markup (by Yuntian Deng yuntiandeng.com),Lua,https://github.com/harvardnlp/im2markup,4.35 MB
299,docker-alpine,1255,303,1255,197,05/03/2019,27/01/2026,368.57 MB,Official Alpine Linux Docker image. Win at minimalism!,Lua,https://github.com/alpinelinux/docker-alpine,368.57 MB
300,yanky.nvim,1225,32,1225,33,01/03/2022,12/03/2026,194.00 KB,Improved Yank and Put functionalities for Neovim,Lua,https://github.com/gbprod/yanky.nvim,194.00 KB
301,texture_nets,1225,216,1225,42,07/03/2016,07/01/2018,9.54 MB,"Code for ""Texture Networks: Feed-forward Synthesis of Textures and Stylized Images"" paper.",Lua,https://github.com/DmitryUlyanov/texture_nets,9.54 MB
302,legendary.nvim,1223,24,1223,12,02/02/2022,11/04/2025,1011.00 KB,"🗺️ A legend for your keymaps, commands, and autocmds, integrates with which-key.nvim, lazy.nvim, and more.",Lua,https://github.com/mrjones2014/legendary.nvim,1011.00 KB
303,codediff.nvim,1216,49,1216,58,23/10/2025,11/03/2026,2.27 MB,"A Neovim plugin that provides VSCode-style diff rendering with two-tier highlighting (line + character level) in side-by-side and inline layouts, using VSCode's algorithm implemented in C.",Lua,https://github.com/esmuellert/codediff.nvim,2.27 MB
304,lume,1213,88,1213,22,27/02/2014,19/11/2023,206.00 KB,Lua functions geared towards gamedev,Lua,https://github.com/rxi/lume,206.00 KB
305,config_manager,1210,114,1210,10,18/07/2015,20/05/2024,21.59 MB,My configuration files and tools,Lua,https://github.com/tjdevries/config_manager,21.59 MB
306,garrysmod,1198,836,1198,207,10/01/2013,25/03/2026,15.72 MB,Sandbox mod for the Source Engine,Lua,https://github.com/Facepunch/garrysmod,15.72 MB
307,wincent,1188,104,1188,4,20/05/2009,26/03/2026,690.42 MB,💾 Dot-files,Lua,https://github.com/wincent/wincent,690.42 MB
308,wordgrinder,1185,63,1185,38,07/06/2015,24/07/2025,8.57 MB,A word processor which gets the hell out of your way and lets you get some work done.,Lua,https://github.com/davidgiven/wordgrinder,8.57 MB
309,LIKO-12,1177,68,1177,38,16/09/2016,24/01/2024,10.09 MB,LIKO-12 is an open source fantasy computer made using LÖVE,Lua,https://github.com/LIKO-12/LIKO-12,10.09 MB
310,impatient.nvim,1176,26,1176,0,28/08/2021,05/05/2023,101.00 KB,Improve startup time for Neovim,Lua,https://github.com/lewis6991/impatient.nvim,101.00 KB
311,dotfiles,1173,43,1173,12,21/02/2022,11/01/2023,37.48 MB,The ArchLinux and AwesomeWM configs. 📂,Lua,https://github.com/saimoomedits/dotfiles,37.48 MB
312,venn.nvim,1159,25,1159,4,01/06/2021,16/08/2024,36.00 KB,Draw ASCII diagrams in Neovim,Lua,https://github.com/jbyuki/venn.nvim,36.00 KB
313,luci-app-shadowsocks,1154,417,1154,12,15/08/2016,28/05/2023,327.00 KB,OpenWrt/LEDE LuCI for Shadowsocks-libev,Lua,https://github.com/shadowsocks/luci-app-shadowsocks,327.00 KB
314,marks.nvim,1151,54,1151,56,08/10/2021,13/05/2025,1.86 MB,A better user experience for viewing and interacting with Vim marks.,Lua,https://github.com/chentoast/marks.nvim,1.86 MB
315,CosmicNvim,1148,64,1148,0,19/10/2021,26/03/2026,653.00 KB,"CosmicNvim is a lightweight and opinionated Neovim config for web development, specifically designed to provide a 💫 COSMIC programming experience!",Lua,https://github.com/CosmicNvim/CosmicNvim,653.00 KB
316,transparent.nvim,1148,26,1148,5,09/04/2021,22/06/2025,47.00 KB,Remove all background colors to make nvim transparent,Lua,https://github.com/xiyaowong/transparent.nvim,47.00 KB
317,llm.nvim,1146,61,1146,37,07/05/2023,09/01/2025,18.00 MB,LLM powered development for Neovim,Lua,https://github.com/huggingface/llm.nvim,18.00 MB
318,hawkthorne-journey,1146,455,1146,27,20/05/2012,26/11/2024,245.11 MB,Digital Estate Planning: The Game,Lua,https://github.com/hawkthorne/hawkthorne-journey,245.11 MB
319,hydra.nvim,1122,24,1122,52,06/06/2022,28/11/2023,273.00 KB,Create custom submodes and menus,Lua,https://github.com/anuvyklack/hydra.nvim,273.00 KB
320,nvim-neoclip.lua,1120,29,1120,28,15/08/2021,09/02/2025,193.00 KB,Clipboard manager neovim plugin with telescope integration,Lua,https://github.com/AckslD/nvim-neoclip.lua,193.00 KB
321,lua-nginx-redis,1119,381,1119,1,22/02/2017,26/10/2021,11.41 MB,:hibiscus: Redis、Lua、Nginx、OpenResty 入门教程,Lua,https://github.com/Tinywan/lua-nginx-redis,11.41 MB
322,MoonGen,1106,238,1106,79,27/09/2014,30/11/2025,20.62 MB,MoonGen is a fully scriptable high-speed packet generator built on DPDK and LuaJIT. It can saturate a 10 Gbit/s connection with 64 byte packets on a single CPU core while executing user-provided Lua scripts for each packet. Multi-core support allows for even higher rates. It also features precise and accurate timestamping and rate control.,Lua,https://github.com/emmericp/MoonGen,20.62 MB
323,edgy.nvim,1104,25,1104,3,30/05/2023,28/10/2025,267.00 KB,"Easily create and manage predefined window layouts, bringing a new edge to your workflow",Lua,https://github.com/folke/edgy.nvim,267.00 KB
324,nebula,1098,384,1098,8,29/08/2017,28/07/2023,16.90 MB,"""星云""业务风控系统，主工程",Lua,https://github.com/threathunterX/nebula,16.90 MB
325,crates.nvim,1084,44,1084,10,24/08/2021,23/08/2025,1.07 MB,A neovim plugin that helps managing crates.io dependencies,Lua,https://github.com/saecki/crates.nvim,1.07 MB
326,unnamed_game_1_v2,1080,95,1080,1,07/10/2025,08/10/2025,53.03 MB,The Release of Mordoria,Lua,https://github.com/Mordoria/unnamed_game_1_v2,53.03 MB
327,material.nvim,1079,140,1079,6,21/03/2021,23/02/2026,9.57 MB,":trident: Material colorscheme for NeoVim written in Lua with built-in support for native LSP, TreeSitter and many more plugins",Lua,https://github.com/marko-cerovac/material.nvim,9.57 MB
328,bump.lua,1077,84,1077,13,27/05/2012,29/09/2023,11.01 MB,A collision detection library for Lua,Lua,https://github.com/kikito/bump.lua,11.01 MB
329,lain,1075,212,1075,44,07/09/2013,25/01/2024,1.56 MB,Awesome WM complements,Lua,https://github.com/lcpz/lain,1.56 MB
330,git-blame.nvim,1075,52,1075,11,29/08/2020,05/11/2025,217.00 KB,Git Blame plugin for Neovim written in Lua,Lua,https://github.com/f-person/git-blame.nvim,217.00 KB
331,Stalker_GAMMA,1075,16,1075,7,04/12/2021,26/03/2026,1.84 GB,S.T.A.L.K.E.R. G.A.M.M.A. modpack for Anomaly,Lua,https://github.com/Grokitach/Stalker_GAMMA,1.84 GB
332,minuet-ai.nvim,1070,50,1070,13,20/07/2024,26/03/2026,930.00 KB,"💃 Dance with Intelligence in Your Code. Minuet offers code completion as-you-type from popular LLMs including OpenAI, Gemini, Claude, Ollama, Llama.cpp, Codestral, and more.",Lua,https://github.com/milanglacier/minuet-ai.nvim,930.00 KB
333,obs-zoom-to-mouse,1070,125,1070,62,04/11/2023,07/06/2024,13.10 MB,An OBS lua script to zoom a display-capture source to focus on the mouse,Lua,https://github.com/BlankSourceCode/obs-zoom-to-mouse,13.10 MB
334,Codes-for-Lane-Detection,1067,335,1067,6,12/10/2018,21/06/2022,46.84 MB,Learning Lightweight Lane Detection CNNs by Self Attention Distillation (ICCV 2019),Lua,https://github.com/cardwing/Codes-for-Lane-Detection,46.84 MB
335,nvim-dap-virtual-text,1063,34,1063,10,24/08/2020,25/05/2025,111.00 KB,,Lua,https://github.com/theHamsta/nvim-dap-virtual-text,111.00 KB
336,Questie,1063,333,1063,342,08/03/2015,26/03/2026,407.09 MB,Questie: The WoW Classic quest helper,Lua,https://github.com/Questie/Questie,407.09 MB
337,fbcunn,1061,243,1061,38,10/12/2014,21/07/2017,589.00 KB,Facebook's extensions to torch/cunn.,Lua,https://github.com/facebookarchive/fbcunn,589.00 KB
338,lua-resty-openidc,1058,254,1058,77,14/07/2015,08/04/2025,776.00 KB,OpenID Connect Relying Party and OAuth 2.0 Resource Server implementation in Lua for NGINX / OpenResty,Lua,https://github.com/zmartzone/lua-resty-openidc,776.00 KB
339,dial.nvim,1058,25,1058,17,22/11/2020,21/12/2025,388.00 KB,enhanced increment/decrement plugin for Neovim.,Lua,https://github.com/monaqa/dial.nvim,388.00 KB
340,feline.nvim,1053,68,1053,6,13/04/2021,20/09/2023,433.00 KB,"A minimal, stylish and customizable statusline for Neovim written in Lua",Lua,https://github.com/famiu/feline.nvim,433.00 KB
341,stackline,1050,56,1050,37,31/07/2020,24/07/2023,7.88 MB,Visualize yabai window stacks on macOS. Works with yabai & hammerspoon.,Lua,https://github.com/AdamWagner/stackline,7.88 MB
342,vague.nvim,1049,31,1049,1,12/07/2024,06/03/2026,117.00 KB,"A cool, dark, low contrast colorscheme for Neovim. Pastel yet vivid, like a fleeting memory...",Lua,https://github.com/vague-theme/vague.nvim,117.00 KB
343,Simple-Tiled-Implementation,1045,133,1045,31,14/01/2014,24/03/2024,2.20 MB,Tiled library for LÖVE,Lua,https://github.com/karai17/Simple-Tiled-Implementation,2.20 MB
344,onedarkpro.nvim,1039,55,1039,0,07/04/2021,10/03/2026,1.19 MB,"🎨 Atom's iconic One Dark theme. Cacheable, fully customisable, Tree-sitter and LSP semantic token support. Comes with variants",Lua,https://github.com/olimorris/onedarkpro.nvim,1.19 MB
345,nvim-scrollbar,1037,23,1037,30,07/01/2022,17/11/2025,1.86 MB,Extensible Neovim Scrollbar,Lua,https://github.com/petertriho/nvim-scrollbar,1.86 MB
346,classic,1036,103,1036,19,26/02/2014,31/12/2021,156.00 KB,Tiny class module for Lua,Lua,https://github.com/rxi/classic,156.00 KB
347,goto-preview,1030,37,1030,10,07/06/2021,26/12/2025,161.00 KB,A small Neovim plugin for previewing definitions using floating windows.,Lua,https://github.com/rmagatti/goto-preview,161.00 KB
348,lsofgraph,1027,33,1027,0,08/02/2016,20/04/2019,1.13 MB,lsof to graphviz,Lua,https://github.com/zevv/lsofgraph,1.13 MB
349,ComputerCraft,1022,193,1022,136,06/08/2012,13/05/2024,2.96 MB,Programmable Computers for Minecraft,Lua,https://github.com/dan200/ComputerCraft,2.96 MB
350,lor,1022,178,1022,12,14/01/2016,02/01/2024,352.00 KB,"a fast, minimalist web framework for lua based on OpenResty",Lua,https://github.com/sumory/lor,352.00 KB
351,doom-nvim,1022,104,1022,28,20/03/2021,08/02/2024,3.12 MB,A Neovim configuration for the advanced martian hacker,Lua,https://github.com/doom-neovim/doom-nvim,3.12 MB
352,telescope-ui-select.nvim,1020,24,1020,19,04/11/2021,02/08/2024,12.00 KB,,Lua,https://github.com/nvim-telescope/telescope-ui-select.nvim,12.00 KB
353,true-zen.nvim,1019,34,1019,34,16/04/2021,27/07/2024,799.00 KB,🦝 Clean and elegant distraction-free writing for NeoVim,Lua,https://github.com/pocco81/true-zen.nvim,799.00 KB
354,incline.nvim,1018,19,1018,9,08/04/2022,18/12/2025,281.00 KB,🎈 Floating statuslines for Neovim,Lua,https://github.com/b0o/incline.nvim,281.00 KB
355,rocks.nvim,1013,18,1013,55,05/07/2023,21/02/2026,1.19 MB,"🌒 Neovim plugin management inspired by Cargo, powered by luarocks",Lua,https://github.com/lumen-oss/rocks.nvim,1.19 MB
356,neovim-init.vim,1012,201,1012,3,14/10/2017,21/02/2023,1.22 MB,:izakaya_lantern: A hybrid Neovim configuration for productive developers who want a functional yet aesthetic Vim experience :izakaya_lantern:,Lua,https://github.com/Optixal/neovim-init.vim,1.22 MB
357,nordic.nvim,999,68,999,4,21/01/2023,08/02/2026,536.00 KB,"🌒  Nord for Neovim, but warmer and darker.  Supports a variety of plugins and other platforms.",Lua,https://github.com/AlexvZyl/nordic.nvim,536.00 KB
358,nvim-highlight-colors,999,64,999,22,17/07/2022,26/01/2026,237.00 KB,Highlight colors for neovim,Lua,https://github.com/brenoprata10/nvim-highlight-colors,237.00 KB
359,ssr.nvim,992,12,992,18,31/07/2022,07/09/2024,47.00 KB,Treesitter based structural search and replace plugin for Neovim.,Lua,https://github.com/cshuaimin/ssr.nvim,47.00 KB
360,torchnet,992,184,992,3,20/06/2016,27/03/2019,167.00 KB,Torch on steroids,Lua,https://github.com/facebookarchive/torchnet,167.00 KB
361,nord.nvim,989,123,989,33,14/05/2021,25/06/2024,238.00 KB,"Neovim theme based off of the Nord Color Palette, written in lua with tree sitter support",Lua,https://github.com/shaunsingh/nord.nvim,238.00 KB
362,nmap-nse-scripts,984,367,984,2,31/05/2011,22/01/2022,5.99 MB,My collection of nmap NSE scripts,Lua,https://github.com/cldrn/nmap-nse-scripts,5.99 MB
363,SchemaStore.nvim,982,21,982,11,07/10/2021,26/03/2026,2.30 MB,🛍 JSON schemas for Neovim,Lua,https://github.com/b0o/SchemaStore.nvim,2.30 MB
364,HLA-NoVR,981,45,981,59,12/03/2023,04/01/2026,460.28 MB,NoVR mod for Half-Life: Alyx,Lua,https://github.com/HLANoVR/HLA-NoVR,460.28 MB
365,awesome-streamerrc,980,232,980,8,04/03/2020,21/09/2021,9.65 MB,Dotfiles for various streamers on Twitch.,Lua,https://github.com/awesome-streamers/awesome-streamerrc,9.65 MB
366,wezterm-config,975,307,975,4,08/09/2022,24/02/2026,98.71 MB,My WezTerm Config,Lua,https://github.com/KevinSilvester/wezterm-config,98.71 MB
367,outline.nvim,974,36,974,35,31/10/2023,31/01/2026,783.00 KB,Fancy code outline sidebar to visualize and navigate code symbols in a tree hierarchy,Lua,https://github.com/hedyhli/outline.nvim,783.00 KB
368,nvim,973,240,973,33,15/12/2021,26/01/2026,801.00 KB,My neovim config,Lua,https://github.com/ChristianChiarulli/nvim,801.00 KB
369,2D-and-3D-face-alignment,972,210,972,5,16/03/2017,26/02/2018,39.00 KB,"This repository implements a demo of the networks described in ""How far are we from solving the 2D & 3D Face Alignment problem? (and a dataset of 230,000 3D facial landmarks)"" paper.",Lua,https://github.com/1adrianb/2D-and-3D-face-alignment,39.00 KB
370,completion-nvim,967,74,967,81,10/03/2020,12/10/2021,409.00 KB,A async completion framework aims to provide completion to neovim's built in LSP written in Lua,Lua,https://github.com/nvim-lua/completion-nvim,409.00 KB
371,persistence.nvim,966,43,966,9,02/07/2021,28/10/2025,100.00 KB,💾  Simple session management for Neovim,Lua,https://github.com/folke/persistence.nvim,100.00 KB
372,ccc.nvim,964,20,964,12,13/09/2022,06/05/2025,535.00 KB,Color picker and highlighter plugin for Neovim.,Lua,https://github.com/uga-rosa/ccc.nvim,535.00 KB
373,vscode.nvim,963,140,963,51,19/05/2021,03/12/2025,1.23 MB,Neovim/Vim color scheme inspired by Dark+ and Light+ theme in Visual Studio Code,Lua,https://github.com/Mofiqul/vscode.nvim,1.23 MB
374,solarized-osaka.nvim,956,62,956,4,15/09/2023,04/02/2026,843.00 KB,"🏯 A clean, dark Neovim theme written in Lua, with support for lsp, treesitter and lots of plugins.",Lua,https://github.com/craftzdog/solarized-osaka.nvim,843.00 KB
375,monstercat-visualizer,953,107,953,95,12/06/2016,17/06/2023,10.69 MB,A real time audio visualizer for Rainmeter similar to the ones used in the Monstercat videos.,Lua,https://github.com/marcopixel/monstercat-visualizer,10.69 MB
376,anim8,952,106,952,7,28/02/2012,20/01/2022,1.08 MB,An animation library for LÖVE,Lua,https://github.com/kikito/anim8,1.08 MB
377,rime-shuangpin-fuzhuma,950,65,950,16,25/01/2024,24/03/2026,817.16 MB,墨奇音形，打造最强双拼辅助码rime输入方案，让天下双拼用户人人用得上辅助码。基于雾凇-白霜词库，支持小鹤双拼、自然码双拼、搜狗双拼、微软双拼等多种双拼，辅助码支持墨奇码（原创拆分开源支持4万字）、自然码部首辅、小鹤音形（鹤形辅）等，支持双拼和辅助码之间排列组合，支持整句/字词输入。不认识的字可以笔画、部件拆字、仓颉码反查。支持aw、aj模式输入英文、日文，支持双拼并击输入、emoji、快符、日期、大写数字、计算器等高级功能。雾凇鹤|雾凇自然|墨奇码|墨奇音形,Lua,https://github.com/gaboolic/rime-shuangpin-fuzhuma,817.16 MB
378,icsmaster,950,340,950,0,12/02/2017,04/01/2019,474.07 MB,ICS/SCADA Security Resource（整合工控安全相关资源）,Lua,https://github.com/w3h/icsmaster,474.07 MB
379,presence.nvim,949,66,949,68,03/01/2021,06/04/2024,92.00 KB,Discord Rich Presence for Neovim,Lua,https://github.com/andweeb/presence.nvim,92.00 KB
380,neoconf.nvim,944,41,944,12,07/09/2022,25/03/2026,1.98 MB,💼 Neovim plugin to manage global and project-local settings,Lua,https://github.com/folke/neoconf.nvim,1.98 MB
381,rnn,943,308,943,78,19/03/2015,21/12/2017,2.23 MB,Recurrent Neural Network library for Torch7's nn,Lua,https://github.com/Element-Research/rnn,2.23 MB
382,DeepStack-Leduc,941,220,941,14,05/04/2017,06/01/2018,2.06 MB,Example implementation of the DeepStack algorithm for no-limit Leduc poker,Lua,https://github.com/lifrordi/DeepStack-Leduc,2.06 MB
383,dotfiles,939,49,939,0,21/10/2015,25/03/2026,6.91 MB,"The best and strongest dotfiles. Editor: Neovim; Shell: zsh(zinit, powerlevel10k); Terminal: WezTerm; Desktop: Hyprland, walker, dunst; OS: NixOS, ArchLinux (Ubuntu/Fedora/CentOS)",Lua,https://github.com/yutkat/dotfiles,6.91 MB
384,melange-nvim,939,80,939,12,07/02/2021,10/12/2025,4.72 MB,🗡️ Warm color scheme for Neovim and beyond,Lua,https://github.com/savq/melange-nvim,4.72 MB
385,quicker.nvim,939,13,939,17,26/07/2024,10/03/2026,96.00 KB,Improved UI and workflow for the Neovim quickfix,Lua,https://github.com/stevearc/quicker.nvim,96.00 KB
386,wow-ui-source,939,148,939,0,28/03/2013,26/03/2026,74.76 MB,git mirror of the user interface source code for World of Warcraft,Lua,https://github.com/Gethe/wow-ui-source,74.76 MB
387,sailor,937,125,937,48,02/01/2014,28/10/2022,1.83 MB,A Lua MVC Web Framework.,Lua,https://github.com/sailorproject/sailor,1.83 MB
388,MobDebug,935,201,935,22,04/12/2011,17/10/2023,331.00 KB,Remote debugger for Lua.,Lua,https://github.com/pkulchenko/MobDebug,331.00 KB
389,nvim-remote-containers,934,25,934,11,23/02/2020,22/12/2023,34.00 KB,"Develop inside docker containers, just like VSCode",Lua,https://github.com/jamestthompson3/nvim-remote-containers,34.00 KB
390,resnet-1k-layers,933,252,933,1,05/04/2016,24/05/2017,4.00 KB,Deep Residual Networks with 1K Layers,Lua,https://github.com/KaimingHe/resnet-1k-layers,4.00 KB
391,courseplay,926,516,926,1,15/02/2013,22/05/2023,42.52 MB,Courseplay for Farming Simulator 2019,Lua,https://github.com/Courseplay/courseplay,42.52 MB
392,playground,925,48,925,14,23/07/2020,15/09/2023,2.82 MB,Treesitter playground integrated into Neovim,Lua,https://github.com/nvim-treesitter/playground,2.82 MB
393,codesnap.nvim,925,33,925,28,13/02/2024,04/03/2026,101.71 MB,📸 Snapshot plugin with rich features that can make pretty code snapshots for Neovim,Lua,https://github.com/mistricky/codesnap.nvim,101.71 MB
394,lua-resty-template,924,208,924,15,21/02/2014,21/07/2023,420.00 KB,Templating Engine (HTML) for Lua and OpenResty.,Lua,https://github.com/bungle/lua-resty-template,420.00 KB
395,vim-nightfly-colors,921,54,921,0,23/01/2020,18/01/2026,413.00 KB,A dark midnight theme for modern Neovim & classic Vim,Lua,https://github.com/bluz71/vim-nightfly-colors,413.00 KB
396,no-neck-pain.nvim,920,25,920,16,23/10/2022,25/03/2026,1.17 MB,☕ Dead simple yet super extensible zen mode plugin to protect your neck.,Lua,https://github.com/shortcuts/no-neck-pain.nvim,1.17 MB
397,NAMAS,918,256,918,18,28/08/2015,25/04/2018,38.00 KB,Neural Attention Model for Abstractive Summarization,Lua,https://github.com/facebookarchive/NAMAS,38.00 KB
