Ranking,Project Name,Stars,Forks,Watchers,Open Issues,Created At,Last Commit,Size,Description,Language,Repo URL,Size
1,AFNetworking,33681,10479,33681,102,31/05/2011,17/01/2023,5.99 MB,"A delightful networking framework for iOS, macOS, watchOS, and tvOS.",Objective-C,https://github.com/AFNetworking/AFNetworking,5.99 MB
2,SDWebImage,25881,5992,25881,122,21/09/2009,26/02/2026,25.09 MB,Asynchronous image downloader with cache support as a UIImageView category,Objective-C,https://github.com/SDWebImage/SDWebImage,25.09 MB
3,WeChatExtension-ForMac,22672,3587,22672,905,25/04/2019,13/02/2025,203.75 MB,A plugin for Mac WeChat,Objective-C,https://github.com/MustangYM/WeChatExtension-ForMac,203.75 MB
4,TrollStore,21040,1497,21040,47,02/09/2022,02/09/2024,10.43 MB,Jailed iOS app that can install IPAs permanently with arbitary entitlements and root helpers because it trolls Apple,Objective-C,https://github.com/opa334/TrollStore,10.43 MB
5,GPUImage,20334,4584,20334,1001,13/02/2012,16/02/2024,43.81 MB,An open source iOS framework for GPU-based image and video processing,Objective-C,https://github.com/BradLarson/GPUImage,43.81 MB
6,Masonry,18344,3153,18344,151,22/07/2013,13/04/2023,767.00 KB,"Harness the power of AutoLayout NSLayoutConstraints with a simplified, chainable and expressive syntax. Supports iOS and OSX Auto Layout",Objective-C,https://github.com/SnapKit/Masonry,767.00 KB
7,iTerm2,17224,1328,17224,52,07/04/2011,19/03/2026,465.73 MB,iTerm2 is a terminal emulator for Mac OS X that does amazing things.,Objective-C,https://github.com/gnachman/iTerm2,465.73 MB
8,realm-swift,16602,2210,16602,490,16/04/2012,13/03/2026,66.12 MB,Realm is a mobile database: a replacement for Core Data & SQLite,Objective-C,https://github.com/realm/realm-swift,66.12 MB
9,MBProgressHUD,15974,3574,15974,94,31/05/2009,14/08/2024,1.22 MB,MBProgressHUD + Customizations,Objective-C,https://github.com/jdg/MBProgressHUD,1.22 MB
10,hammerspoon,15037,680,15037,659,08/10/2014,26/02/2026,159.28 MB,Staggeringly powerful macOS desktop automation with Lua,Objective-C,https://github.com/Hammerspoon/hammerspoon,159.28 MB
11,keycastr,14684,559,14684,93,19/02/2009,07/12/2025,56.87 MB,"KeyCastr, an open-source keystroke visualizer",Objective-C,https://github.com/keycastr/keycastr,56.87 MB
12,FLEX,14589,1779,14589,50,29/05/2014,04/02/2026,30.45 MB,An in-app debugging and exploration tool for iOS,Objective-C,https://github.com/FLEXTool/FLEX,30.45 MB
13,WebViewJavascriptBridge,14340,2976,14340,105,28/08/2011,01/08/2024,522.00 KB,An iOS/OSX bridge for sending messages between Obj-C and JavaScript in UIWebViews/WebViews,Objective-C,https://github.com/marcuswestin/WebViewJavascriptBridge,522.00 KB
14,WeChatPlugin-MacOS,14282,2477,14282,153,20/04/2017,09/06/2024,24.93 MB,微信小助手,Objective-C,https://github.com/TKkk-iOSer/WeChatPlugin-MacOS,24.93 MB
15,YYKit,14001,3697,14001,307,10/04/2013,25/06/2024,55.62 MB,A collection of iOS components.,Objective-C,https://github.com/ibireme/YYKit,55.62 MB
16,fmdb,13860,2744,13860,271,06/07/2010,15/03/2026,1.63 MB,A Cocoa / Objective-C wrapper around SQLite,Objective-C,https://github.com/ccgus/fmdb,1.63 MB
17,MJRefresh,13833,3531,13833,58,23/05/2014,11/11/2025,15.09 MB,An easy way to use pull-to-refresh.,Objective-C,https://github.com/CoderMJLee/MJRefresh,15.09 MB
18,spectacle,13644,843,13644,148,11/07/2010,15/01/2022,12.49 MB,Spectacle allows you to organize your windows without using a mouse.,Objective-C,https://github.com/eczarny/spectacle,12.49 MB
19,CocoaLumberjack,13344,2281,13344,7,31/03/2011,17/02/2026,6.02 MB,"A fast & simple, yet powerful & flexible logging framework for macOS, iOS, tvOS, watchOS and visionOS",Objective-C,https://github.com/CocoaLumberjack/CocoaLumberjack,6.02 MB
20,IGListKit,13063,1543,13063,60,07/09/2016,25/02/2026,9.12 MB,A data-driven UICollectionView framework for building fast and flexible lists.,Objective-C,https://github.com/Instagram/IGListKit,9.12 MB
21,darling,12649,488,12649,383,09/12/2012,16/03/2026,39.91 MB,Darwin/macOS emulation layer for Linux,Objective-C,https://github.com/darlinghq/darling,39.91 MB
22,SVProgressHUD,12480,2670,12480,85,28/03/2011,27/02/2026,1.38 MB,A clean and lightweight progress HUD for your iOS and tvOS app.,Objective-C,https://github.com/SVProgressHUD/SVProgressHUD,1.38 MB
23,CocoaAsyncSocket,12460,3011,12460,1,22/11/2011,20/07/2023,2.23 MB,Asynchronous socket networking library for Mac and iOS,Objective-C,https://github.com/robbiehanson/CocoaAsyncSocket,2.23 MB
24,chameleon,12373,1297,12373,66,26/07/2014,03/05/2021,11.49 MB,"Color framework for Swift & Objective-C (Gradient colors, hexcode support, colors from images & more).",Objective-C,https://github.com/vicc/chameleon,11.49 MB
25,iCarousel,12322,2550,12322,401,06/04/2011,27/06/2024,3.80 MB,"A simple, highly customisable, data-driven 3D carousel for iOS and Mac OS",Objective-C,https://github.com/nicklockwood/iCarousel,3.80 MB
26,LuLu,12169,553,12169,483,10/09/2017,17/03/2026,25.55 MB,LuLu is the free open-source macOS firewall,Objective-C,https://github.com/objective-see/LuLu,25.55 MB
27,DZNEmptyDataSet,12055,1729,12055,190,03/06/2014,06/07/2022,13.88 MB,A drop-in UITableView/UICollectionView superclass category for showing empty datasets whenever the view has no content to display,Objective-C,https://github.com/dzenbot/DZNEmptyDataSet,13.88 MB
28,GitUp,11958,1454,11958,372,13/08/2015,15/02/2026,63.73 MB,The Git interface you've been missing all your life has finally arrived.,Objective-C,https://github.com/git-up/GitUp,63.73 MB
29,JSPatch,11360,2231,11360,106,25/05/2015,01/12/2020,7.71 MB,JSPatch bridge Objective-C and Javascript using the Objective-C runtime. You can call any Objective-C class and method in JavaScript by just including a small engine. JSPatch is generally used to hotfix iOS App.,Objective-C,https://github.com/bang590/JSPatch,7.71 MB
30,Mantle,11277,1472,11277,0,05/09/2012,18/10/2022,1.60 MB,Model framework for Cocoa and Cocoa Touch,Objective-C,https://github.com/Mantle/Mantle,1.60 MB
31,JSQMessagesViewController,11105,2774,11105,0,17/02/2013,12/12/2018,19.94 MB,An elegant messages UI library for iOS,Objective-C,https://github.com/jessesquires/JSQMessagesViewController,19.94 MB
32,MagicalRecord,10735,1771,10735,242,27/07/2010,27/04/2021,7.97 MB,Super Awesome Easy Fetching for Core Data!,Objective-C,https://github.com/magicalpanda/MagicalRecord,7.97 MB
33,FSCalendar,10686,1950,10686,504,15/02/2015,10/08/2024,2.45 MB,"A fully customizable iOS calendar library, compatible with Objective-C and Swift",Objective-C,https://github.com/WenchaoD/FSCalendar,2.45 MB
34,RestKit,10137,2077,10137,365,09/02/2010,27/08/2022,42.47 MB,RestKit is a framework for consuming and modeling RESTful web resources on iOS and OS X,Objective-C,https://github.com/RestKit/RestKit,42.47 MB
35,UITableView-FDTemplateLayoutCell,9895,1993,9895,130,16/04/2015,07/03/2022,4.16 MB,Template auto layout cell for automatically UITableViewCell height calculating,Objective-C,https://github.com/forkingdog/UITableView-FDTemplateLayoutCell,4.16 MB
36,Alcatraz,9835,1131,9835,39,22/04/2013,28/09/2017,8.94 MB,Package manager for Xcode,Objective-C,https://github.com/alcatraz/Alcatraz,8.94 MB
37,PNChart,9665,1744,9665,174,06/11/2013,02/07/2018,676.00 KB,A simple and beautiful chart lib used in Piner and CoinsMan for iOS,Objective-C,https://github.com/kevinzhow/PNChart,676.00 KB
38,SocketRocket,9635,2013,9635,189,30/01/2012,04/12/2025,2.40 MB,A conforming Objective-C WebSocket client library.,Objective-C,https://github.com/facebookincubator/SocketRocket,2.40 MB
39,mac-mouse-fix,9448,287,9448,1044,07/08/2019,19/03/2026,122.07 MB,Mac Mouse Fix - Make Your $10 Mouse Better Than an Apple Trackpad!,Objective-C,https://github.com/noah-nuebling/mac-mouse-fix,122.07 MB
40,Shimmer,9349,1117,9349,21,18/02/2014,06/02/2021,2.71 MB,"An easy way to add a simple, shimmering effect to any view in an iOS app.",Objective-C,https://github.com/facebookarchive/Shimmer,2.71 MB
41,sequelpro,9194,838,9194,529,08/11/2013,25/02/2023,55.75 MB,MySQL/MariaDB database management for macOS,Objective-C,https://github.com/sequelpro/sequelpro,55.75 MB
42,YYText,8889,1730,8889,516,05/11/2015,16/07/2024,21.30 MB,Powerful text framework for iOS to display and edit rich text.,Objective-C,https://github.com/ibireme/YYText,21.30 MB
43,Sloth,8847,168,8847,3,28/03/2011,16/11/2025,13.16 MB,"Mac app that shows all open files, directories, sockets, pipes and devices in use by all running processes. Nice GUI for lsof.",Objective-C,https://github.com/sveinbjornt/Sloth,13.16 MB
44,BaiduNetdiskPlugin-macOS,8830,1767,8830,66,06/03/2018,17/10/2020,1.29 MB,For macOS.百度网盘 破解SVIP、下载速度限制~,Objective-C,https://github.com/CodeTips/BaiduNetdiskPlugin-macOS,1.29 MB
45,MWPhotoBrowser,8738,2675,8738,335,21/10/2010,27/06/2024,21.23 MB,"A simple iOS photo and video browser with grid view, captions and selections.",Objective-C,https://github.com/mwaterfall/MWPhotoBrowser,21.23 MB
46,TTTAttributedLabel,8725,1694,8725,176,06/05/2011,24/06/2024,1.61 MB,"A drop-in replacement for UILabel that supports attributes, data detectors, links, and more",Objective-C,https://github.com/TTTAttributedLabel/TTTAttributedLabel,1.61 MB
47,Sparkle,8720,1101,8720,19,11/08/2009,16/03/2026,43.92 MB,A software update framework for macOS,Objective-C,https://github.com/sparkle-project/Sparkle,43.92 MB
48,MJExtension,8512,2145,8512,27,23/05/2014,13/03/2024,2.65 MB,"A fast, convenient and nonintrusive conversion framework between JSON and model. Your model class doesn't need to extend any base class. You don't need to modify any model file.",Objective-C,https://github.com/CoderMJLee/MJExtension,2.65 MB
49,Aspects,8434,1269,8434,108,03/05/2014,25/11/2025,501.00 KB,"Delightful, simple library for aspect oriented programming in Objective-C and Swift.",Objective-C,https://github.com/steipete/Aspects,501.00 KB
50,SlackTextViewController,8278,1072,8278,79,18/08/2014,29/10/2018,15.88 MB,⛔️**DEPRECATED** ⛔️ A drop-in UIViewController subclass with a growing text input view and other useful messaging features,Objective-C,https://github.com/slackhq/SlackTextViewController,15.88 MB
51,VVDocumenter-Xcode,8267,1524,8267,63,16/07/2013,19/04/2017,4.27 MB,"Xcode plug-in which helps you write documentation comment easier, for both Objective-C and Swift.",Objective-C,https://github.com/onevcat/VVDocumenter-Xcode,4.27 MB
52,TZImagePickerController,8171,1894,8171,61,07/01/2016,06/02/2026,6.96 MB,"一个支持多选、选原图和视频的图片选择器，同时有预览、裁剪功能，支持iOS6+。  A clone of UIImagePickerController, support picking multiple photos、original photo、video, also allow preview photo and video, support iOS6+",Objective-C,https://github.com/banchichen/TZImagePickerController,6.96 MB
53,shadowsocks-iOS,8163,3425,8163,178,27/12/2012,17/05/2022,12.82 MB,Removed according to regulations.,Objective-C,https://github.com/shadowsocks/shadowsocks-iOS,12.82 MB
54,analyze,8116,1960,8116,11,19/03/2016,14/11/2021,101.01 MB,Draven's Blog,Objective-C,https://github.com/draveness/analyze,101.01 MB
55,FastImageCache,8089,928,8089,40,21/08/2013,12/07/2023,1.70 MB,iOS library for quickly displaying images while scrolling,Objective-C,https://github.com/path/FastImageCache,1.70 MB
56,iOS-Runtime-Headers,7982,1602,7982,59,09/01/2011,17/05/2022,167.84 MB,iOS Objective-C headers as derived from runtime introspection,Objective-C,https://github.com/nst/iOS-Runtime-Headers,167.84 MB
57,FLAnimatedImage,7975,1212,7975,84,19/05/2014,21/03/2024,3.98 MB,Performant animated GIF engine for iOS,Objective-C,https://github.com/Flipboard/FLAnimatedImage,3.98 MB
58,trip-to-iOS,7897,2225,7897,3,02/01/2015,17/05/2022,156.00 KB,A curated list of delightful iOS resources.,Objective-C,https://github.com/Aufree/trip-to-iOS,156.00 KB
59,slate,7836,510,7836,261,23/05/2011,23/06/2022,47.63 MB,A window management application (replacement for Divvy/SizeUp/ShiftIt),Objective-C,https://github.com/jigish/slate,47.63 MB
60,FlatUIKit,7779,934,7779,35,08/05/2013,29/09/2016,2.07 MB,A collection of awesome flat UI components for iOS.,Objective-C,https://github.com/Grouper/FlatUIKit,2.07 MB
61,V2RayX,7662,1124,7662,118,10/02/2016,20/03/2023,23.15 MB,GUI for v2ray-core on macOS,Objective-C,https://github.com/Cenmrev/V2RayX,23.15 MB
62,PureLayout,7604,731,7604,47,23/06/2014,16/03/2023,1.06 MB,"The ultimate API for iOS & OS X Auto Layout — impressively simple, immensely powerful. Objective-C and Swift compatible.",Objective-C,https://github.com/PureLayout/PureLayout,1.06 MB
63,Sequel-Ace,7333,293,7333,193,11/06/2020,19/03/2026,214.95 MB,MySQL/MariaDB database management for macOS,Objective-C,https://github.com/Sequel-Ace/Sequel-Ace,214.95 MB
64,KVOController,7311,918,7311,15,24/02/2014,25/01/2020,163.00 KB,"Simple, modern, thread-safe key-value observing for iOS and OS X.",Objective-C,https://github.com/facebookarchive/KVOController,163.00 KB
65,DateTools,7206,944,7206,110,19/03/2014,21/08/2024,673.00 KB,Dates and times made easy in iOS,Objective-C,https://github.com/MatthewYork/DateTools,673.00 KB
66,QMUI_iOS,7206,1443,7206,220,20/12/2016,21/09/2024,7.03 MB,QMUI iOS——致力于提高项目 UI 开发效率的解决方案,Objective-C,https://github.com/Tencent/QMUI_iOS,7.03 MB
67,three20,7174,1464,7174,204,19/02/2009,02/05/2017,32.45 MB,Three20 is an Objective-C library for iPhone developers,Objective-C,https://github.com/facebookarchive/three20,32.45 MB
68,JVFloatLabeledTextField,7166,723,7166,28,01/10/2013,17/04/2023,401.00 KB,UITextField subclass with floating labels - inspired by Matt D. Smith's design: http://dribbble.com/shots/1254439--GIF-Mobile-Form-Interaction?list=users,Objective-C,https://github.com/jverdi/JVFloatLabeledTextField,401.00 KB
69,ZFPlayer,7135,1763,7135,251,03/03/2016,24/05/2024,156.40 MB,Support customization of any player SDK and control layer(支持定制任何播放器SDK和控制层),Objective-C,https://github.com/renzifeng/ZFPlayer,156.40 MB
70,Dash-iOS,7114,917,7114,38,06/11/2016,28/03/2021,53.47 MB,Dash for iOS was discontinued. Please check out Dash for macOS instead.,Objective-C,https://github.com/Kapeli/Dash-iOS,53.47 MB
71,SWTableViewCell,7098,1256,7098,173,10/09/2013,20/05/2021,2.83 MB,An easy-to-use UITableViewCell subclass that implements a swippable content view which exposes utility buttons (similar to iOS 7 Mail Application),Objective-C,https://github.com/CEWendel/SWTableViewCell,2.83 MB
72,terminal-notifier,7077,349,7077,50,15/07/2012,02/11/2025,2.94 MB,Send User Notifications on macOS from the command-line.,Objective-C,https://github.com/julienXX/terminal-notifier,2.94 MB
73,RESideMenu,7055,1330,7055,132,17/06/2013,05/12/2017,11.68 MB,iOS 7/8 style side menu with parallax effect.,Objective-C,https://github.com/romaonthego/RESideMenu,11.68 MB
74,Reachability,6965,1249,6965,69,12/11/2011,02/03/2026,143.00 KB,ARC and GCD Compatible Reachability Class for iOS and MacOS. Drop in replacement for Apple Reachability,Objective-C,https://github.com/tonymillion/Reachability,143.00 KB
75,MGSwipeTableCell,6938,1063,6938,132,09/08/2014,22/03/2023,2.12 MB,An easy to use UITableViewCell subclass that allows to display swippable buttons with a variety of transitions.,Objective-C,https://github.com/MortimerGoro/MGSwipeTableCell,2.12 MB
76,xctool,6883,727,6883,9,24/04/2013,11/12/2019,9.30 MB,An extension for Apple's xcodebuild that makes it easier to test iOS and macOS apps.,Objective-C,https://github.com/facebookarchive/xctool,9.30 MB
77,BlocksKit,6850,1254,6850,91,17/05/2011,02/02/2018,5.72 MB,The Objective-C block utilities you always wish you had.,Objective-C,https://github.com/BlocksKit/BlocksKit,5.72 MB
78,MacPass,6837,469,6837,292,21/07/2012,07/05/2025,25.27 MB,A native macOS KeePass client ,Objective-C,https://github.com/MacPass/MacPass,25.27 MB
79,jsonmodel,6831,1051,6831,34,02/12/2012,06/11/2021,1.60 MB,"Magical Data Modeling Framework for JSON - allows rapid creation of smart data models. You can use it in your iOS, macOS, watchOS and tvOS apps.",Objective-C,https://github.com/jsonmodel/jsonmodel,1.60 MB
80,Onboard,6786,755,6786,45,19/08/2014,01/01/2025,78.16 MB,An iOS framework to easily create a beautiful and engaging onboarding experience with only a few lines of code.,Objective-C,https://github.com/mamaral/Onboard,78.16 MB
81,MonkeyDev,6779,1239,6779,184,27/06/2017,09/07/2022,19.74 MB,"CaptainHook Tweak、Logos Tweak and Command-line Tool、Patch iOS Apps,  Without Jailbreak.",Objective-C,https://github.com/AloneMonkey/MonkeyDev,19.74 MB
82,YTKNetwork,6758,1646,6758,126,31/10/2014,22/04/2021,653.00 KB,YTKNetwork is a high level request util based on AFNetworking.,Objective-C,https://github.com/kanyun-inc/YTKNetwork,653.00 KB
83,MMDrawerController,6733,1369,6733,189,07/05/2013,09/01/2023,2.86 MB," A lightweight, easy to use, Side Drawer Navigation Controller",Objective-C,https://github.com/mutualmobile/MMDrawerController,2.86 MB
84,GCDWebServer,6610,1314,6610,42,29/12/2012,05/10/2022,12.04 MB,"The #1 HTTP server for iOS, macOS & tvOS (also includes web based uploader & WebDAV server)",Objective-C,https://github.com/swisspol/GCDWebServer,12.04 MB
85,injectionforxcode,6545,568,6545,77,28/05/2012,04/08/2022,6.48 MB,Runtime Code Injection for Objective-C & Swift,Objective-C,https://github.com/johnno1962/injectionforxcode,6.48 MB
86,nimbus,6416,1282,6416,3,09/06/2011,25/04/2024,44.35 MB,The iOS framework that grows only as fast as its documentation,Objective-C,https://github.com/jverkoey/nimbus,44.35 MB
87,DTCoreText,6390,1191,6390,45,10/01/2011,29/07/2025,6.09 MB,Methods to allow using HTML code with CoreText,Objective-C,https://github.com/Cocoanetics/DTCoreText,6.09 MB
88,JazzHands,6375,669,6375,15,29/09/2013,30/07/2024,2.98 MB,A simple keyframe-based animation framework for UIKit. Perfect for scrolling app intros.,Objective-C,https://github.com/IFTTT/JazzHands,2.98 MB
89,KeepingYouAwake,6364,244,6364,36,19/10/2014,30/10/2025,7.00 MB,Prevents your Mac from going to sleep.,Objective-C,https://github.com/newmarcel/KeepingYouAwake,7.00 MB
90,react-native-image-crop-picker,6341,1606,6341,649,17/05/2016,21/01/2026,8.59 MB,"iOS/Android image picker with support for camera, video, configurable compression, multiple images and cropping",Objective-C,https://github.com/ivpusic/react-native-image-crop-picker,8.59 MB
91,NWPusher,6317,671,6317,29,09/09/2012,30/03/2021,2.77 MB,OS X and iOS application and framework to play with the Apple Push Notification service (APNs),Objective-C,https://github.com/noodlewerk/NWPusher,2.77 MB
92,ios-app-signer,6257,1147,6257,120,06/11/2015,01/09/2025,598.00 KB,This is an app for OS X that can (re)sign apps and bundle them into ipa files that are ready to be installed on an iOS device.,Objective-C,https://github.com/DanTheMan827/ios-app-signer,598.00 KB
93,ANE,6242,895,6242,27,28/02/2026,10/03/2026,500.00 KB,Training neural networks on Apple Neural Engine via reverse-engineered private APIs,Objective-C,https://github.com/maderix/ANE,500.00 KB
94,KIF,6240,919,6240,53,02/06/2011,17/03/2026,5.49 MB,Keep It Functional - An iOS Functional Testing Framework,Objective-C,https://github.com/kif-framework/KIF,5.49 MB
95,SDCycleScrollView,6204,1501,6204,505,24/03/2015,21/04/2023,1.93 MB,Autoscroll Banner.   无限循环图片、文字轮播器。,Objective-C,https://github.com/gsdios/SDCycleScrollView,1.93 MB
96,JSONKit,6196,1637,6196,104,27/07/2010,22/11/2020,1.16 MB,Objective-C JSON,Objective-C,https://github.com/johnezang/JSONKit,1.16 MB
97,JXCategoryView,6175,1162,6175,39,22/03/2018,07/08/2024,31.16 MB,"A powerful and easy to use category view (segmentedcontrol, segmentview, pagingview, pagerview, pagecontrol) (腾讯新闻、今日头条、QQ音乐、网易云音乐、京东、爱奇艺、腾讯视频、淘宝、天猫、简书、微博等所有主流APP分类切换滚动视图)",Objective-C,https://github.com/pujiaxin33/JXCategoryView,31.16 MB
98,lemon-cleaner,6156,783,6156,30,12/07/2022,04/12/2025,24.35 MB,腾讯柠檬清理是针对macOS系统专属制定的清理工具。主要功能包括重复文件和相似照片的识别、软件的定制化垃圾扫描、可视化的全盘空间分析、内存释放、浏览器隐私清理以及设备实时状态的监控等。重点聚焦清理功能，对上百款软件提供定制化的清理方案，提供专业的清理建议，帮助用户轻松完成一键式清理。,Objective-C,https://github.com/Tencent/lemon-cleaner,24.35 MB
99,AnyBar,6036,159,6036,17,02/03/2015,04/09/2025,1.05 MB,OS X menubar status indicator,Objective-C,https://github.com/tonsky/AnyBar,1.05 MB
100,MobileIMSDK,6011,1374,6011,17,07/10/2015,27/11/2025,264.27 MB,原创全平台IM通信层框架，轻量级、高度提炼，历经10年、久经考验。可能是市面上唯一同时支持UDP+TCP+WebSocket三种协议的同类开源框架，支持 iOS、Android、Java、H5、小程序、Uniapp、鸿蒙Next，服务端基于Netty。,Objective-C,https://github.com/JackJiang2011/MobileIMSDK,264.27 MB
101,FDFullscreenPopGesture,5900,1145,5900,111,29/05/2015,08/07/2021,1.04 MB,A UINavigationController's category to enable fullscreen pop gesture with iOS7+ system style.,Objective-C,https://github.com/forkingdog/FDFullscreenPopGesture,1.04 MB
102,XMPPFramework,5895,2072,5895,555,31/03/2011,22/04/2024,24.17 MB,An XMPP Framework in Objective-C for Mac and iOS,Objective-C,https://github.com/robbiehanson/XMPPFramework,24.17 MB
103,SDAutoLayout,5882,1267,5882,165,17/10/2015,12/05/2023,15.22 MB,One line of code to implement automatic layout.  一行代码搞定自动布局！支持Cell和Tableview高度自适应，Label和ScrollView内容自适应，致力于做最简单易用的AutoLayout库。The most easy way for autoLayout. Based on runtime.,Objective-C,https://github.com/gsdios/SDAutoLayout,15.22 MB
104,PonyDebugger,5858,585,5858,46,21/08/2012,18/03/2023,2.27 MB,Remote network and data debugging for your native iOS app using Chrome Developer Tools,Objective-C,https://github.com/square/PonyDebugger,2.27 MB
105,HexFiend,5820,450,5820,72,06/12/2011,29/06/2025,18.90 MB,A fast and clever hex editor for macOS,Objective-C,https://github.com/HexFiend/HexFiend,18.90 MB
106,TPKeyboardAvoiding,5808,917,5808,103,14/04/2011,15/09/2023,237.00 KB,A drop-in universal solution for moving text fields out of the way of the keyboard in iOS,Objective-C,https://github.com/michaeltyson/TPKeyboardAvoiding,237.00 KB
107,asi-http-request,5756,1393,5756,168,14/07/2008,15/01/2019,6.99 MB,"Easy to use CFNetwork wrapper for HTTP requests, Objective-C,  Mac OS X and iPhone",Objective-C,https://github.com/pokeb/asi-http-request,6.99 MB
108,XLForm,5746,937,5746,180,09/04/2014,03/06/2024,13.84 MB,XLForm is the most flexible and powerful iOS library to create dynamic table-view forms. Fully compatible with Swift & Obj-C. ,Objective-C,https://github.com/xmartlabs/XLForm,13.84 MB
109,JLRoutes,5720,690,5720,12,10/02/2013,21/02/2023,684.00 KB,URL routing library for iOS with a simple block-based API,Objective-C,https://github.com/joeldev/JLRoutes,684.00 KB
110,ResearchKit,5714,1172,5714,152,10/03/2015,11/02/2026,85.65 MB,ResearchKit is an open source software framework that makes it easy to create apps for medical research or for other research projects.,Objective-C,https://github.com/ResearchKit/ResearchKit,85.65 MB
111,EarlGrey,5680,735,5680,245,04/02/2016,18/02/2026,47.02 MB,:tea: iOS UI Automation Test Framework,Objective-C,https://github.com/google/EarlGrey,47.02 MB
112,CocoaHTTPServer,5640,1307,5640,129,17/12/2011,17/10/2023,1.69 MB,"A small, lightweight, embeddable HTTP server for Mac OS X or iOS applications",Objective-C,https://github.com/robbiehanson/CocoaHTTPServer,1.69 MB
113,Bolts-ObjC,5639,576,5639,42,30/01/2014,30/08/2021,638.00 KB,Bolts is a collection of low-level libraries designed to make developing mobile apps easier.,Objective-C,https://github.com/BoltsFramework/Bolts-ObjC,638.00 KB
114,ShiftIt,5548,364,5548,165,03/10/2010,20/11/2023,2.32 MB,Managing windows size and position in OSX,Objective-C,https://github.com/fikovnik/ShiftIt,2.32 MB
115,popping,5524,661,5524,4,27/05/2014,05/07/2017,392.00 KB,A collection of animation examples for iOS apps.,Objective-C,https://github.com/schneiderandre/popping,392.00 KB
116,iOSProject,5468,1620,5468,27,29/03/2017,05/09/2024,480.40 MB,"iOS project comprising a collection of demos for iOS Apps, developed in Objective-C;iOSProject iOSdemo iOSdemos ocdemo ocdemos",Objective-C,https://github.com/NJHu/iOSProject,480.40 MB
117,MLeaksFinder,5444,947,5444,72,14/12/2015,11/09/2023,57.00 KB,Find memory leaks in your iOS app at develop time.,Objective-C,https://github.com/Tencent/MLeaksFinder,57.00 KB
118,SAMKeychain,5386,955,5386,41,07/04/2010,20/07/2020,251.00 KB,Simple Objective-C wrapper for the keychain that works on Mac and iOS,Objective-C,https://github.com/soffes/SAMKeychain,251.00 KB
119,Canvas,5291,493,5291,36,05/12/2013,14/07/2019,977.00 KB,Animate in Xcode without code,Objective-C,https://github.com/CanvasPod/Canvas,977.00 KB
120,ViewDeck,5276,958,5276,21,05/12/2011,21/07/2022,4.72 MB,An implementation of the sliding menu found in various iOS apps.,Objective-C,https://github.com/ViewDeck/ViewDeck,4.72 MB
121,Knuff,5235,432,5235,21,13/10/2011,04/09/2022,5.48 MB,The debug application for Apple Push Notification Service (APNs).,Objective-C,https://github.com/KnuffApp/Knuff,5.48 MB
122,XVim,5133,587,5133,305,13/02/2012,09/01/2018,15.33 MB,Xcode plugin for Vim keybindings,Objective-C,https://github.com/XVimProject/XVim,15.33 MB
123,IPAPatch,5082,749,5082,40,18/03/2017,27/02/2026,4.64 MB,"Patch iOS Apps, The Easy Way, Without Jailbreak.",Objective-C,https://github.com/Naituw/IPAPatch,4.64 MB
124,OHHTTPStubs,5068,598,5068,61,10/07/2012,09/05/2024,2.05 MB,"Stub your network requests easily! Test your apps with fake network data and custom response time, response code and headers!",Objective-C,https://github.com/AliSoftware/OHHTTPStubs,2.05 MB
