Ranking,Project Name,Stars,Forks,Watchers,Open Issues,Created At,Last Commit,Size,Description,Language,Repo URL,Size
732,iOS_Tips,1251,332,1251,14,18/09/2019,28/08/2022,69.99 MB,iOS的一些示例，持续更新中：1、AVFoundation 高仿微信相机拍摄和编辑 2、AVFoundation 人脸检测、实时滤镜、音视频编解码、GPUImage框架的使用等音视频相关内容    3、OpenGLES    4、LeetCode算法练习   5、iOS Crash防护和APM监控    6、WKWebView相关的内容  等........,Objective-C,https://github.com/wsl2ls/iOS_Tips,69.99 MB
733,PhotoTweaks,1250,164,1250,14,28/11/2014,27/02/2021,970.00 KB,"Drag, Rotate, Scale and Crop",Objective-C,https://github.com/itouch2/PhotoTweaks,970.00 KB
734,scifihifi-iphone,1247,351,1247,9,22/10/2008,14/07/2023,28.00 KB,Open source iPhone code,Objective-C,https://github.com/ldandersen/scifihifi-iphone,28.00 KB
735,YUCIHighPassSkinSmoothing,1247,195,1247,6,20/01/2016,14/01/2021,2.57 MB,An implementation of High Pass Skin Smoothing using Apple's Core Image Framework,Objective-C,https://github.com/YuAo/YUCIHighPassSkinSmoothing,2.57 MB
736,SPTPersistentCache,1245,75,1245,17,18/02/2016,20/04/2024,3.86 MB,"Everyone tries to implement a cache at some point in their iOS app’s lifecycle, and this is ours.",Objective-C,https://github.com/spotify/SPTPersistentCache,3.86 MB
737,iOSSF,1244,362,1244,10,19/12/2012,26/08/2015,1.13 MB,SegmentFault官方App,Objective-C,https://github.com/gaosboy/iOSSF,1.13 MB
738,MJParallaxCollectionView,1239,107,1239,4,01/04/2014,27/12/2015,87.27 MB,This is a parallax for the cells inside UICollectionView. It gives us an effect just like scrolling the images in Whatsapp or scrolling through the Weather app for iOS,Objective-C,https://github.com/mayuur/MJParallaxCollectionView,87.27 MB
739,BCMeshTransformView,1239,122,1239,17,14/05/2014,14/05/2017,937.00 KB,Mesh transforms for UIView,Objective-C,https://github.com/Ciechan/BCMeshTransformView,937.00 KB
740,PHPHub-iOS,1239,324,1239,3,21/09/2015,15/11/2018,7.37 MB,PHPHub for iOS is the universal iPhone and iPad application for PHPHub,Objective-C,https://github.com/Aufree/PHPHub-iOS,7.37 MB
741,CocoaMarkdown,1239,161,1239,9,13/01/2015,13/12/2019,1.11 MB,Markdown parsing and rendering for iOS and OS X,Objective-C,https://github.com/indragiek/CocoaMarkdown,1.11 MB
742,iCloudDocumentSync,1237,179,1237,42,29/12/2012,24/08/2021,12.46 MB,"Integrate iCloud into iOS document projects with one-line code methods. Sync, upload, manage, and remove documents from iCloud quickly and easily. Helps to make iCloud ""just work"" for developers too.",Objective-C,https://github.com/nenosinc/iCloudDocumentSync,12.46 MB
743,react-native-facebook-login,1235,323,1235,125,27/03/2015,06/11/2019,62.98 MB,React Native component wrapping the native Facebook SDK login button and manager,Objective-C,https://github.com/magus/react-native-facebook-login,62.98 MB
744,UIDevice-with-UniqueIdentifier-for-iOS-5,1234,226,1234,11,20/08/2011,18/07/2013,152.00 KB,"Brings back the unique identifier support under iOS 5, it uses the device's mac address in combination with the bundle identifier to generate a new hashed unique identifier.",Objective-C,https://github.com/gekitz/UIDevice-with-UniqueIdentifier-for-iOS-5,152.00 KB
745,SimFinger,1231,132,1231,17,16/05/2009,19/11/2014,10.09 MB,Screencasting for iPhone,Objective-C,https://github.com/lorenbrichter/SimFinger,10.09 MB
746,vlc-ios,1229,325,1229,4,04/02/2018,19/03/2026,88.94 MB,VLC for iOS/iPadOS and tvOS official mirror,Objective-C,https://github.com/videolan/vlc-ios,88.94 MB
747,UIImage-PDF,1229,153,1229,21,16/10/2011,31/03/2023,2.14 MB,Simple UIImage PDF renderer category for iOS scalable assets,Objective-C,https://github.com/mindbrix/UIImage-PDF,2.14 MB
748,blueutil,1229,60,1229,34,29/01/2011,12/10/2025,137.00 KB,"CLI for bluetooth on OSX: power, discoverable state, list, inquire devices, connect, info, …",Objective-C,https://github.com/toy/blueutil,137.00 KB
749,WEPopover,1227,320,1227,15,06/11/2010,25/09/2020,233.00 KB,"Generic popover implementation for iOS with same API as the UIPopoverController for the iPad, but configurable with custom background and available for iPhone as well.",Objective-C,https://github.com/werner77/WEPopover,233.00 KB
750,KVNProgress,1225,196,1225,69,24/05/2014,21/12/2022,9.94 MB,KVNProgress is a fully customizable progress HUD that can be full screen or not.,Objective-C,https://github.com/AssistoLab/KVNProgress,9.94 MB
751,HWPanModal,1225,204,1225,13,05/05/2019,24/12/2025,17.29 MB,"HWPanModal presents controller from bottom and drag to dismiss, high customize. iOS13 default modalPresentationStyle. 任意形式的底部弹框动画；头条、知乎、抖音弹出评论效果；地图浮层，iOS13 present默认模态效果。",Objective-C,https://github.com/HeathWang/HWPanModal,17.29 MB
752,FastPdfKit,1225,323,1225,67,27/10/2010,03/02/2019,765.58 MB,A Static Library to be embedded on iOS applications to display pdf documents derived from Fast PDF,Objective-C,https://github.com/mobfarm/FastPdfKit,765.58 MB
753,UISS,1224,81,1224,21,07/10/2011,05/07/2017,2.31 MB,UIAppearance Stylesheets,Objective-C,https://github.com/robertwijas/UISS,2.31 MB
754,LLWeChat,1223,315,1223,22,18/11/2016,15/12/2016,143.84 MB,实现IM基本功能，并且在细节、完成度、bugfree上媲美任何主流IM应用,Objective-C,https://github.com/gyjzh/LLWeChat,143.84 MB
755,IGLDropDownMenu,1222,157,1222,7,30/08/2014,07/09/2020,3.60 MB,An iOS drop down menu with pretty animation and easy to customize.,Objective-C,https://github.com/bestwnh/IGLDropDownMenu,3.60 MB
756,ios-chat,1221,532,1221,26,23/01/2019,15/03/2026,1.53 GB,即时通讯，聊天，野火IM iOS客户端,Objective-C,https://github.com/wildfirechat/ios-chat,1.53 GB
757,HybridPageKit,1221,191,1221,9,10/03/2018,03/02/2023,38.92 MB,A high-performance、high-extensibility、easy integration framework for Hybrid content page. Support most content page types of News App.  ,Objective-C,https://github.com/dequan1331/HybridPageKit,38.92 MB
758,cordova-plugin-wechat,1220,505,1220,74,09/06/2013,18/01/2024,45.00 MB,"A cordova plugin, a JS version of Wechat SDK",Objective-C,https://github.com/xu-li/cordova-plugin-wechat,45.00 MB
759,SlowQuitApps,1219,57,1219,21,13/06/2014,28/12/2020,1.39 MB,Add a global delay to Command-Q to stop accidental app quits.,Objective-C,https://github.com/dteoh/SlowQuitApps,1.39 MB
760,Lin,1219,96,1219,9,11/03/2013,30/03/2016,1.41 MB, Xcode plugin that provides auto-completion for NSLocalizedString.,Objective-C,https://github.com/nek023/Lin,1.41 MB
761,ZipZap,1218,199,1218,32,27/10/2012,01/10/2021,1.22 MB,"zip file I/O library for iOS, macOS and tvOS",Objective-C,https://github.com/pixelglow/ZipZap,1.22 MB
762,Briefs,1216,85,1216,3,13/07/2009,22/05/2012,2.55 MB,Framework for iPhone wireframes,Objective-C,https://github.com/capttaco/Briefs,2.55 MB
763,PrettyKit,1214,150,1214,19,11/04/2012,29/11/2012,1011.00 KB,"PrettyKit for iOS is a small set of new widgets and UIKit subclasses that gives you a deeper UIKit customization. You will be able to change their background color, add gradients, shadows, etc. ",Objective-C,https://github.com/vicpenap/PrettyKit,1011.00 KB
764,Kal,1214,341,1214,60,19/12/2009,01/09/2015,625.00 KB,A calendar component for the iPhone (the UI is designed to match MobileCal),Objective-C,https://github.com/klazuka/Kal,625.00 KB
765,libpd,1213,284,1213,32,13/11/2011,07/01/2026,8.22 MB,Pure Data embeddable audio synthesis library,Objective-C,https://github.com/libpd/libpd,8.22 MB
766,LKDBHelper-SQLite-ORM,1211,288,1211,3,15/04/2013,22/09/2025,6.41 MB,"全自动的插入,查询,更新,删除， an automatic database operation  thread-safe and not afraid of recursive deadlock",Objective-C,https://github.com/li6185377/LKDBHelper-SQLite-ORM,6.41 MB
767,Reader,1210,330,1210,39,30/05/2016,09/10/2022,16.79 MB,iOS基于CoreText实现的电子书阅读器，支持txt，epub格式,Objective-C,https://github.com/GGGHub/Reader,16.79 MB
768,AFViewShaker,1209,162,1209,0,05/12/2013,18/11/2017,280.00 KB,,Objective-C,https://github.com/ArtFeel/AFViewShaker,280.00 KB
769,spaces-renamer,1208,37,1208,12,17/10/2017,30/06/2025,86.28 MB,💻 Ability to rename desktop spaces on macOS 10.10+,Objective-C,https://github.com/dado3212/spaces-renamer,86.28 MB
770,KafkaRefresh,1207,144,1207,2,05/01/2018,11/08/2025,1.20 MB,"Animated, customizable, and flexible pull-to-refresh framework for faster and easier iOS development. ",Objective-C,https://github.com/BeatsKitano/KafkaRefresh,1.20 MB
771,V2RayXS,1207,97,1207,36,04/03/2022,15/03/2026,31.83 MB,GUI for xray-core on macOS,Objective-C,https://github.com/tzmax/V2RayXS,31.83 MB
772,google-toolbox-for-mac,1206,270,1206,4,21/04/2015,18/03/2026,4.53 MB,Google Toolbox for Mac,Objective-C,https://github.com/google/google-toolbox-for-mac,4.53 MB
773,MLPAutoCompleteTextField,1206,218,1206,53,07/02/2013,14/11/2019,6.57 MB,UITextfield subclass with autocomplete menu. For iOS.,Objective-C,https://github.com/EddyBorja/MLPAutoCompleteTextField,6.57 MB
774,XCActionBar,1204,36,1204,9,13/03/2015,03/07/2017,4.43 MB,"""Alfred for Xcode"" plugin",Objective-C,https://github.com/pdcgomes/XCActionBar,4.43 MB
775,TGLStackedViewController,1204,116,1204,13,23/04/2014,27/09/2019,905.00 KB,A stacked view layout with gesture-based reordering using a UICollectionView -- inspired by Passbook and Reminders apps.,Objective-C,https://github.com/gleue/TGLStackedViewController,905.00 KB
776,WeChat,1204,264,1204,23,04/09/2017,16/04/2021,28.63 MB,🔥 iOS 利用MVVM + RAC + ViewModel-Based Navigation来搭建微信(WeChat 7.0.0+)的整体基本架构，以及实现微信朋友圈、通讯录、下拉小程序、搜索等主要功能，代码规范惊为天人、注释详解令人发指、细节处理精益求精、核心功能配备文档、接近98%还原度的原生App视觉体验，代码不多，注释多。（持续更新，敬请期待，欢迎Star和Fork…）,Objective-C,https://github.com/CoderMikeHe/WeChat,28.63 MB
777,LLSimpleCamera,1203,194,1203,64,18/11/2014,15/12/2017,455.00 KB,"A simple, customizable camera control - video recorder for iOS.",Objective-C,https://github.com/omergul/LLSimpleCamera,455.00 KB
778,qlImageSize,1203,66,1203,2,01/02/2012,03/03/2023,28.69 MB,"QuickLook and Spotlight plugins to display the dimensions, size and DPI of an image in the title bar instead of the filename. Also preview some unsupported formats like WebP & bpg.",Objective-C,https://github.com/Nyx0uf/qlImageSize,28.69 MB
779,Frank,1201,232,1201,56,20/07/2010,08/07/2014,67.88 MB,Automated acceptance tests for native iOS apps,Objective-C,https://github.com/moredip/Frank,67.88 MB
780,ClusterPrePermissions,1196,104,1196,11,08/04/2014,26/09/2017,88.00 KB,"Cluster's reusable pre-permissions utility that lets developers ask the users on their own dialog for photos or contacts access, before making the system-based request. This is based on the Medium post by Cluster describing the different ways to ask for iOS permissions (https://medium.com/p/96fa4eb54f2c).",Objective-C,https://github.com/rsattar/ClusterPrePermissions,88.00 KB
781,Mango,1196,218,1196,14,01/03/2018,19/06/2025,1.39 MB,MangoFix is a DSL which syntax is very similar to Objective-C，MangoFix is also an iOS  App hotfix SDK. You can use MangoFix method replace any Objective-C or Swift method.,Objective-C,https://github.com/YPLiang19/Mango,1.39 MB
782,SDSegmentedControl,1194,180,1194,22,26/09/2012,08/09/2015,3.99 MB,A drop-in remplacement for UISegmentedControl that mimic iOS 6 AppStore tab controls,Objective-C,https://github.com/rs/SDSegmentedControl,3.99 MB
783,calloutview,1193,185,1193,26,22/08/2012,14/06/2021,832.00 KB,A lightweight callout view class for iOS mimicking UICalloutView.,Objective-C,https://github.com/nfarina/calloutview,832.00 KB
784,MacGap2,1192,84,1192,47,21/05/2014,23/08/2022,217.00 KB,MacGap 2,Objective-C,https://github.com/MacGapProject/MacGap2,217.00 KB
785,TEAChart,1192,134,1192,0,11/11/2013,17/11/2017,139.00 KB,"Simple and intuitive iOS chart library. Contribution graph, clock chart, and bar chart.",Objective-C,https://github.com/xhacker/TEAChart,139.00 KB
786,SXWaveAnimate,1191,251,1191,12,17/05/2015,17/08/2017,3.28 MB,Achieve beautiful wavewater animate.,Objective-C,https://github.com/dsxNiubility/SXWaveAnimate,3.28 MB
787,BBUncrustifyPlugin-Xcode,1190,149,1190,6,16/03/2013,12/08/2019,10.83 MB,Xcode plugin to format source code using ClangFormat or Uncrustify,Objective-C,https://github.com/benoitsan/BBUncrustifyPlugin-Xcode,10.83 MB
788,DB5,1187,88,1187,9,25/06/2013,14/07/2018,36.00 KB,,Objective-C,https://github.com/brentsimmons/DB5,36.00 KB
789,WHC_DataModelFactory,1186,219,1186,9,04/05/2015,22/04/2021,5.33 MB,"Mac上iOS开发辅助工具，快速把json/xml数据转换生成对应模型类属性，省去麻烦手动创建，提高开发效率。Mac iOS development aid, quickly put the json/XML data transformation generates the corresponding model class attribute, save trouble created manually, improve the development efficiency.",Objective-C,https://github.com/netyouli/WHC_DataModelFactory,5.33 MB
790,YYStock,1185,300,1185,1,17/10/2016,10/09/2020,938.00 KB,"iOS YYStock-v2.0：timeline chart, long press, pinch, full-screen，K线图...",Objective-C,https://github.com/WillkYang/YYStock,938.00 KB
791,BMLongPressDragCellCollectionView,1185,161,1185,2,04/07/2016,25/05/2021,55.18 MB,"🎉 🎉 🎉 🎉 🎉  让你轻松实现类似支付宝的拖拽重排功能, 支持各种自定义操作。",Objective-C,https://github.com/liangdahong/BMLongPressDragCellCollectionView,55.18 MB
792,ADTransitionController,1184,182,1184,14,16/07/2013,21/06/2018,727.00 KB,UINavigationController with custom transitions,Objective-C,https://github.com/applidium/ADTransitionController,727.00 KB
793,MongoHub-Mac,1184,312,1184,60,29/04/2010,23/06/2015,11.75 MB,MongoHub mac native version.,Objective-C,https://github.com/bububa/MongoHub-Mac,11.75 MB
794,DFImageManager,1180,97,1180,0,31/10/2014,16/11/2019,2.67 MB,"Image loading, processing, caching and preheating",Objective-C,https://github.com/kean/DFImageManager,2.67 MB
795,LoveFreshBeen,1180,355,1180,4,03/02/2016,05/04/2016,22.07 MB,爱鲜蜂By Swift2.0,Objective-C,https://github.com/ZhongTaoTian/LoveFreshBeen,22.07 MB
796,AFOAuth2Manager,1179,338,1179,29,06/12/2011,06/06/2022,9.47 MB,AFNetworking Extension for OAuth 2 Authentication,Objective-C,https://github.com/AFNetworking/AFOAuth2Manager,9.47 MB
797,HAPaperViewController,1179,163,1179,8,04/02/2014,29/04/2016,13.01 MB,😵 [Deprecated] UICollectionView with layout transitions inspired by Facebook Paper App,Objective-C,https://github.com/hebertialmeida/HAPaperViewController,13.01 MB
798,AnimojiStudio,1175,88,1175,11,12/11/2017,03/08/2020,19.21 MB,"Make cute emoji videos with unlimited duration and share anywhere (iPhone X, XS and XS Max only!)",Objective-C,https://github.com/insidegui/AnimojiStudio,19.21 MB
799,PHFComposeBarView,1175,203,1175,3,07/05/2013,11/02/2021,450.00 KB,Compose bar from iOS 7 Messages.app,Objective-C,https://github.com/fphilipe/PHFComposeBarView,450.00 KB
800,v002-Camera-Live,1174,103,1174,83,02/11/2012,18/07/2024,209.00 KB,Live Syphon Camera,Objective-C,https://github.com/v002/v002-Camera-Live,209.00 KB
801,JTRevealSidebarDemo,1173,247,1173,18,11/10/2011,20/06/2014,1.62 MB,(demo) A carefully implemented iOS objective-c library to mimic the sidebar layout of the new Facebook app and Path 2.0 app.,Objective-C,https://github.com/jamztang/JTRevealSidebarDemo,1.62 MB
802,MacForge,1173,49,1173,34,07/07/2018,04/07/2023,117.53 MB,"📦 Plugin, App, and Theme store which includes plugin injection for macOS",Objective-C,https://github.com/MacEnhance/MacForge,117.53 MB
803,objective-git,1167,285,1167,37,01/03/2011,17/09/2023,59.85 MB,Objective-C bindings to libgit2,Objective-C,https://github.com/libgit2/objective-git,59.85 MB
804,Objective-C-RSA,1163,282,1163,39,03/02/2015,25/06/2021,43.00 KB,Doing RSA encryption and decryption with Objective-C on iOS,Objective-C,https://github.com/ideawu/Objective-C-RSA,43.00 KB
805,ZLCollectionView,1163,168,1163,15,23/06/2017,09/05/2023,15.49 MB,为应对类似淘宝首页，京东首页，国美首页等复杂布局而写的Collectionview。基于UICollectionView实现，目前支持标签布局，列布局，百分比布局，定位布局，填充式布局，瀑布流布局等。支持纵向布局和横向布局，可以根据不同的section设置不同的布局，支持拖动cell，头部悬浮，设置section背景色和自定义section背景view，向自定义背景view传递自定义方法。功能强大，超过Android的recyclerview，实现了电影选座等高难度的布局。,Objective-C,https://github.com/czl0325/ZLCollectionView,15.49 MB
806,react-native-audio,1161,535,1161,103,15/04/2015,16/07/2020,727.00 KB,Audio recorder library for React Native,Objective-C,https://github.com/Okelm/react-native-audio,727.00 KB
807,LDNetDiagnoService_IOS,1161,270,1161,26,15/09/2015,29/08/2018,404.00 KB,IOS平台利用ping和traceroute的原理，对指定域名（通常为后台API的提供域名）进行网络诊断，并收集诊断日志。,Objective-C,https://github.com/Lede-Inc/LDNetDiagnoService_IOS,404.00 KB
808,MFSideMenu,1161,287,1161,65,19/03/2012,17/04/2017,1.57 MB,Facebook-like side menu for iOS,Objective-C,https://github.com/mikefrederick/MFSideMenu,1.57 MB
809,AHKActionSheet,1151,123,1151,6,14/04/2014,13/09/2016,1.13 MB,An alternative to the UIActionSheet inspired by the Spotify app.,Objective-C,https://github.com/fastred/AHKActionSheet,1.13 MB
810,react-native-google-analytics-bridge,1151,245,1151,0,28/11/2015,15/03/2019,45.80 MB,React Native bridge to the Google Analytics libraries on both iOS and Android.,Objective-C,https://github.com/idehub/react-native-google-analytics-bridge,45.80 MB
811,TwitterCover,1150,148,1150,10,07/01/2014,11/01/2016,4.07 MB,"TwitterCover is a parallax top view with real time blur effect to any UIScrollView, inspired by Twitter for iOS.",Objective-C,https://github.com/cyndibaby905/TwitterCover,4.07 MB
812,QMUIDemo_iOS,1148,271,1148,19,21/12/2016,21/09/2024,52.59 MB,Sample Code for QMUI iOS,Objective-C,https://github.com/QMUI/QMUIDemo_iOS,52.59 MB
813,superdb,1147,80,1147,7,03/12/2012,06/11/2018,7.11 MB,"The Super Debugger, a realtime wireless debugger for iOS",Objective-C,https://github.com/Shopify/superdb,7.11 MB
814,What-s-New,1147,67,1147,0,17/05/2014,11/03/2018,7.10 MB,Easily present the latest changes and features to your users on app updates.,Objective-C,https://github.com/mdznr/What-s-New,7.10 MB
815,GBDeviceInfo,1146,197,1146,2,10/04/2012,02/01/2026,300.00 KB,"Detects the hardware, software and display of the current iOS or Mac OS X device at runtime.",Objective-C,https://github.com/lmirosevic/GBDeviceInfo,300.00 KB
816,TBCF,1144,326,1144,4,17/04/2017,30/11/2017,92.37 MB,Tracking Benchmark for Correlation Filters,Objective-C,https://github.com/Escheee/TBCF,92.37 MB
817,SimpleAuth,1143,128,1143,52,06/11/2013,24/04/2018,1.75 MB,Simple social authentication for iOS.,Objective-C,https://github.com/calebd/SimpleAuth,1.75 MB
818,CoconutKit,1143,109,1143,10,12/08/2011,25/01/2021,25.86 MB,"CoconutKit is a productivity framework for iOS, crafted with love and focusing on ease of use",Objective-C,https://github.com/defagos/CoconutKit,25.86 MB
819,SpriteKitWatchFace,1142,197,1142,17,10/10/2018,28/12/2019,254.00 KB,SpriteKit-based faux analog watch face example for watchOS,Objective-C,https://github.com/steventroughtonsmith/SpriteKitWatchFace,254.00 KB
820,react-native-icons,1142,137,1142,1,30/03/2015,01/10/2018,850.00 KB,Quick and easy icons in React Native,Objective-C,https://github.com/corymsmith/react-native-icons,850.00 KB
821,RMDateSelectionViewController,1140,164,1140,5,26/10/2013,30/10/2022,1.97 MB,This is an iOS control for selecting a date using UIDatePicker in an UIAlertController like manner,Objective-C,https://github.com/CooperRS/RMDateSelectionViewController,1.97 MB
822,AppPolice,1138,91,1138,34,28/11/2013,06/09/2023,11.36 MB,MacOS app for quickly limiting CPU usage by running applications,Objective-C,https://github.com/AppPolice/AppPolice,11.36 MB
823,XMLDictionary,1135,232,1135,30,14/07/2011,11/05/2024,56.00 KB,[DEPRECATED],Objective-C,https://github.com/nicklockwood/XMLDictionary,56.00 KB
824,AYVibrantButton,1133,67,1133,10,25/07/2014,09/10/2016,1017.00 KB,A stylish button with iOS 8 vibrancy effect,Objective-C,https://github.com/a1anyip/AYVibrantButton,1017.00 KB
825,MasterPassword,1133,235,1133,3,05/01/2012,03/06/2022,426.79 MB,Project moved to https://gitlab.com/spectre.app,Objective-C,https://github.com/Lyndir/MasterPassword,426.79 MB
826,react-native-health,1133,286,1133,147,21/09/2020,15/10/2024,2.80 MB,A React Native package to interact with Apple HealthKit,Objective-C,https://github.com/agencyenterprise/react-native-health,2.80 MB
827,nib2objc,1131,126,1131,0,13/03/2009,24/04/2012,2.31 MB,"Set of tools and utilities (command line, GUI, Mac Service) to transform NIB files for the iPhone into Objective-C code files",Objective-C,https://github.com/akosma/nib2objc,2.31 MB
828,BigShow1949,1130,331,1130,10,05/05/2016,23/05/2021,40.40 MB,iOS教学/各类知识点总结:运行时/贝塞尔曲线/水纹/粒子发射器/核心动画/渐变色/网络请求/按钮/标签/视图布局/视图效果/文字视图/表情键盘/旋转动画/2048/网易/微信/猿题库/阿里巴巴/设计模式/数据持久化/多次点击按钮/微信注册按钮/展开按钮/跑马灯/闪烁文字/球形滚动标签/自动布局标签/快播动态标签/水平滚动布局/瀑布流布局/浏览卡/半圆布局/滑动标题/抽卡效果/百度视图切换/领英动画/折卡效果/卡牌拖动翻页/滚动悬浮视图/侧滑形变效果/评分条/打印机特效/Masonry/生命周期/响应者链条/引导页/通知中心/抖动密码框/余额宝数字跳动/UIDynamic/碰撞行为/捕捉行为/推动行为/附着行为/动力元素行为/GCD/KVC&KVO/多继承/消息转发/二维码/MVC/MVP/MVVM/Router/Viper,Objective-C,https://github.com/BigShow1949/BigShow1949,40.40 MB
829,CocoaSecurity,1130,192,1130,6,14/05/2012,04/01/2020,522.00 KB,"Encrypt/Decrypt: AES. Hash: MD5, SHA(SHA1, SHA224, SHA256, SHA384, SHA512). Encode/Decode: Base64, Hex.",Objective-C,https://github.com/kelp404/CocoaSecurity,522.00 KB
830,MailTrackerBlocker,1128,24,1128,10,04/07/2020,11/02/2026,2.27 MB,"Email tracker, read receipt and spy pixel blocker plugin for macOS Mail (10.11-13.x)",Objective-C,https://github.com/apparition47/MailTrackerBlocker,2.27 MB
831,YNPageViewController,1128,218,1128,27,26/06/2018,21/05/2021,594.00 KB,特斯拉组件、QQ联系人布局、多页面嵌套滚动、悬停效果、美团、淘宝、京东、微博、腾讯新闻、网易新闻、今日头条等标题滚动视图,Objective-C,https://github.com/yongyuandouneng/YNPageViewController,594.00 KB
832,MGTwitterEngine,1128,162,1128,69,15/03/2010,04/09/2010,939.00 KB,Objective-C Twitter integration library for Mac OS X and iPhone. Official repository.,Objective-C,https://github.com/mattgemmell/MGTwitterEngine,939.00 KB
833,SVPulsingAnnotationView,1127,115,1127,14,04/03/2013,07/11/2024,118.00 KB,A customizable MKUserLocationView replica for your iOS app.,Objective-C,https://github.com/TransitApp/SVPulsingAnnotationView,118.00 KB
834,Player_iOS,1124,223,1124,0,12/09/2018,30/10/2025,90.10 MB,Super player for iOS...,Objective-C,https://github.com/LiteAVSDK/Player_iOS,90.10 MB
835,spacecommander,1124,171,1124,14,01/06/2015,26/08/2025,6.56 MB,Commit fully-formatted Objective-C as a team without even trying.,Objective-C,https://github.com/square/spacecommander,6.56 MB
836,iOSBlog,1122,189,1122,28,13/04/2016,14/09/2021,4.64 MB, 微博@iOS程序犭袁 的blog,Objective-C,https://github.com/ChenYilong/iOSBlog,4.64 MB
837,MMTweenAnimation,1122,135,1122,2,05/04/2015,14/12/2015,712.00 KB,"A extension of POP(from facebook) custom animation. Inspired by tweaner(https://code.google.com/p/tweaner), MMTweanerAnimation provide 10 types of custom animation while using POP.",Objective-C,https://github.com/adad184/MMTweenAnimation,712.00 KB
838,Rebel,1122,111,1122,12,29/07/2012,10/12/2015,857.00 KB,Cocoa framework for improving AppKit,Objective-C,https://github.com/github/Rebel,857.00 KB
839,RPFloatingPlaceholders,1120,120,1120,0,21/10/2013,04/01/2020,91.00 KB,UITextField and UITextView subclasses with placeholders that change into floating labels when the fields are populated with text.,Objective-C,https://github.com/iwasrobbed/RPFloatingPlaceholders,91.00 KB
840,PropertyMapper,1119,80,1119,3,24/07/2013,06/01/2021,1.28 MB,Property mapping for Objective-C iOS apps.,Objective-C,https://github.com/krzysztofzablocki/PropertyMapper,1.28 MB
841,2048,1117,497,1117,9,29/03/2014,11/04/2023,714.00 KB,"The iOS version of 2048, made using SpriteKit",Objective-C,https://github.com/danqing/2048,714.00 KB
842,dyci-main,1116,120,1116,19,31/10/2012,13/03/2017,2.75 MB,Dynamic Code Injection Tool for Objective-C,Objective-C,https://github.com/DyCI/dyci-main,2.75 MB
843,newsyc,1112,278,1112,19,05/04/2011,29/09/2016,6.12 MB,An iPhone Hacker News client.,Objective-C,https://github.com/grp/newsyc,6.12 MB
844,ASProgressPopUpView,1111,162,1111,10,16/04/2014,17/04/2017,1.34 MB,A progress view showing percentage complete in a popup view ,Objective-C,https://github.com/alskipp/ASProgressPopUpView,1.34 MB
845,SVGAPlayer-iOS,1109,353,1109,30,30/03/2017,06/02/2023,2.88 MB,"Similar to Lottie. Render After Effects / Animate CC (Flash) animations natively on Android and iOS, Web.  使用 SVGAPlayer 在 Android、iOS、Web中播放 After Effects / Animate CC (Flash) 动画。",Objective-C,https://github.com/svga/SVGAPlayer-iOS,2.88 MB
