Ranking,Project Name,Stars,Forks,Watchers,Open Issues,Created At,Last Commit,Size,Description,Language,Repo URL,Size
422,p5-ssl-tools,200,76,200,3,19/12/2011,11/05/2022,59.00 KB,various standalone perl scripts,Perl,https://github.com/noxxi/p5-ssl-tools,59.00 KB
423,Elymas,200,14,200,0,14/01/2013,11/06/2025,850.00 KB,A programming language I can like. Unholy and full of magic.,Perl,https://github.com/Drahflow/Elymas,850.00 KB
424,mongo-perl-driver,199,99,199,5,05/03/2009,15/07/2021,10.37 MB,Perl driver for the MongoDB,Perl,https://github.com/mongodb-labs/mongo-perl-driver,10.37 MB
425,alfred2-layout,199,16,199,3,24/09/2013,16/03/2019,677.00 KB,Alfred 2 Layout workflow,Perl,https://github.com/untoldwind/alfred2-layout,677.00 KB
426,AS-Stats,198,66,198,25,29/04/2013,24/04/2025,5.19 MB,A simple tool to generate per-AS traffic graphs from NetFlow/sFlow records,Perl,https://github.com/manuelkasper/AS-Stats,5.19 MB
427,Exploits,198,103,198,1,13/10/2017,17/04/2020,41.21 MB,Containing Self Made Perl Reproducers / PoC Codes,Perl,https://github.com/gottburgm/Exploits,41.21 MB
428,OshiUpload,197,28,197,16,11/05/2019,02/04/2025,328.00 KB,Ephemeral file sharing engine,Perl,https://github.com/somenonymous/OshiUpload,328.00 KB
429,PASApipeline,197,59,197,96,10/02/2015,12/02/2025,28.71 MB,PASA software,Perl,https://github.com/PASApipeline/PASApipeline,28.71 MB
430,Magento-mysql,196,82,196,0,13/11/2012,14/11/2025,90.00 KB,Magento default mysql settings,Perl,https://github.com/magenx/Magento-mysql,90.00 KB
431,NOVOPlasty,195,72,195,80,07/12/2015,04/02/2024,22.58 MB,NOVOPlasty - The organelle assembler and heteroplasmy caller,Perl,https://github.com/ndierckx/NOVOPlasty,22.58 MB
432,smtp-cli,195,33,195,14,19/10/2011,23/08/2020,113.00 KB,The ultimate command line SMTP client,Perl,https://github.com/mludvig/smtp-cli,113.00 KB
433,hls-fetch,194,47,194,10,12/09/2012,11/05/2017,242.00 KB,Download and decrypt videos served by the HTTP Live Streaming (HLS) protocol.,Perl,https://github.com/osklil/hls-fetch,242.00 KB
434,nagios-plugins-rabbitmq,194,104,194,23,07/01/2011,04/01/2024,235.00 KB,A set of nagios checks for RabbitMQ using the management interface,Perl,https://github.com/nagios-plugins-rabbitmq/nagios-plugins-rabbitmq,235.00 KB
435,pastemon,194,50,194,0,17/01/2012,31/10/2012,183.00 KB,pastebin.com Content Monitoring Tool,Perl,https://github.com/xme/pastemon,183.00 KB
436,Catmandu,193,35,193,32,01/07/2010,07/07/2025,54.55 MB,Catmandu - a data processing toolkit ,Perl,https://github.com/LibreCat/Catmandu,54.55 MB
437,email-outlook-message-perl,193,31,193,10,01/02/2009,02/01/2026,376.00 KB,Email::Outlook::Message Perl module for reading Outlook .msg files,Perl,https://github.com/mvz/email-outlook-message-perl,376.00 KB
438,openssh-ldap-publickey,192,41,192,5,31/07/2012,14/08/2020,49.00 KB,Wrapper for OpenSSH to store public keys inside the OpenLDAP entry.,Perl,https://github.com/AndriiGrytsenko/openssh-ldap-publickey,49.00 KB
439,non-planar-layer-fdm,192,42,192,3,21/07/2016,30/07/2016,4.61 MB,,Perl,https://github.com/makertum/non-planar-layer-fdm,4.61 MB
440,loftee,191,56,191,57,01/04/2014,20/06/2023,1.63 MB,,Perl,https://github.com/konradjk/loftee,1.63 MB
441,files2rouge,191,52,191,7,09/01/2017,08/07/2021,211.00 KB,Calculating ROUGE score between two files (line-by-line),Perl,https://github.com/pltrdy/files2rouge,211.00 KB
442,hoover,190,60,190,6,12/01/2012,31/08/2022,173.00 KB,Wireless Probe Requests Sniffer,Perl,https://github.com/xme/hoover,173.00 KB
443,Praeda,189,38,189,0,16/08/2012,03/08/2024,140.00 KB,,Perl,https://github.com/percx/Praeda,140.00 KB
444,NicTool,189,60,189,31,29/04/2011,03/10/2025,2.90 MB,NicTool: a DNS management solution,Perl,https://github.com/NicTool/NicTool,2.90 MB
445,its-pointless.github.io,188,34,188,27,13/03/2017,08/08/2021,43.95 GB,For info see https://github.com/its-pointless/gcc_termux,Perl,https://github.com/its-pointless/its-pointless.github.io,43.95 GB
446,Dist-Zilla,188,155,188,91,14/11/2008,25/01/2026,3.47 MB,scary tools for building CPAN distributions,Perl,https://github.com/rjbs/Dist-Zilla,3.47 MB
447,obmenu-generator,188,15,188,9,16/12/2013,28/08/2025,232.00 KB,A fast menu generator for the Openbox Window Manager.,Perl,https://github.com/trizen/obmenu-generator,232.00 KB
448,coreference-resolution,187,58,187,17,04/05/2018,11/01/2021,84.95 MB,"Efficient and clean PyTorch reimplementation of ""End-to-end Neural Coreference Resolution"" (Lee et al., EMNLP 2017). ",Perl,https://github.com/shayneobrien/coreference-resolution,84.95 MB
449,WeBaCoo,187,42,187,1,29/11/2011,11/03/2012,1.04 MB,Web Backdoor Cookie Script-Kit,Perl,https://github.com/anestisb/WeBaCoo,1.04 MB
450,Git-Mediawiki,187,27,187,58,26/08/2011,27/01/2026,292.00 KB,Gate between Git and Mediawiki,Perl,https://github.com/Git-Mediawiki/Git-Mediawiki,292.00 KB
451,Spotty-Plugin,187,32,187,23,04/04/2019,10/02/2026,267.44 MB,A Spotify plugin for the Lyrion Music Server (fka. Logitech Media Server) and Squeezebox compatible players,Perl,https://github.com/michaelherger/Spotty-Plugin,267.44 MB
452,plagger,187,41,187,9,09/03/2009,02/06/2015,3.67 MB,Pluggable RSS/Atom aggregator,Perl,https://github.com/miyagawa/plagger,3.67 MB
453,jpegrescan,186,23,186,4,30/05/2012,27/03/2019,28.00 KB,JPEGrescan: losslessly shrink any JPEG file - YOU PROBABLY SHOULD USE MozJPEG https://github.com/mozilla/mozjpeg,Perl,https://github.com/kud/jpegrescan,28.00 KB
454,djdt-flamegraph,186,14,186,4,07/10/2015,04/06/2020,415.00 KB,Flamegraphs for Django Debug Toolbar,Perl,https://github.com/blopker/djdt-flamegraph,415.00 KB
455,rakudobrew,183,41,183,12,09/07/2013,22/06/2020,245.00 KB,Perl 6 installation manager,Perl,https://github.com/tadzik/rakudobrew,245.00 KB
456,travelynx,183,30,183,97,03/09/2018,14/02/2026,5.60 MB,Traewelling-inspired journey logger with realtime data,Perl,https://github.com/derf/travelynx,5.60 MB
457,wagon,183,19,183,1,13/01/2015,19/04/2023,818.55 MB,免安裝可攜的 Laravel 開發環境,Perl,https://github.com/laravel-dojo/wagon,818.55 MB
458,Vimana,183,26,183,8,16/07/2009,31/08/2015,886.00 KB,"Vimana is an easy to use system for searching , installing, and downloading vim script.  Vimana provides a command-line interface such like aptitude programe on Debian linux, for you to search , download , install , upgrade scripts from http://www.vim.org (vimonline site).",Perl,https://github.com/c9s/Vimana,886.00 KB
459,sec,183,19,183,0,22/07/2015,12/02/2026,606.00 KB,Simple Event Correlator releases,Perl,https://github.com/simple-evcorr/sec,606.00 KB
460,mysql-sandbox,182,59,182,0,22/08/2015,09/04/2021,687.00 KB,Quick and painless install of one or more MySQL servers in the same host.,Perl,https://github.com/datacharmer/mysql-sandbox,687.00 KB
461,mashtree,182,26,182,18,12/05/2016,24/10/2023,51.44 MB,:deciduous_tree: Create a tree using Mash distances,Perl,https://github.com/lskatz/mashtree,51.44 MB
462,pgtoolkit,181,18,181,8,03/10/2013,28/04/2016,1.20 MB,Tools for PostgreSQL maintenance,Perl,https://github.com/grayhemp/pgtoolkit,1.20 MB
463,letsencrypt-cpanel,181,60,181,40,13/01/2016,30/01/2018,195.00 KB, cPanel/WHM plugin for Let's Encrypt client,Perl,https://github.com/Prajithp/letsencrypt-cpanel,195.00 KB
464,ZFS-TimeMachine,181,15,181,2,31/01/2012,05/03/2021,73.00 KB,TimeMachine style backup for ZFS,Perl,https://github.com/jollyjinx/ZFS-TimeMachine,73.00 KB
465,dada-mail,181,42,181,169,11/12/2008,28/07/2025,32.81 MB,"Self-Hosted, Full Featured, Email Mailing List Manager. Announcement + Discussion Lists, Web-based Installer, Installs with minimal dependencies, sendmail/SMTP/Amazon SES supported",Perl,https://github.com/justingit/dada-mail,32.81 MB
466,omnipitr,180,33,180,3,13/05/2011,25/06/2019,778.00 KB,Advanced WAL File Management Tools for PostgreSQL,Perl,https://github.com/omniti-labs/omnipitr,778.00 KB
467,check_pgactivity,180,52,180,54,02/09/2014,19/02/2026,2.53 MB,Nagios remote agent,Perl,https://github.com/OPMDG/check_pgactivity,2.53 MB
468,Roboo,180,35,180,2,14/02/2011,14/10/2012,1.03 MB,Roboo - HTTP Robot Mitigator,Perl,https://github.com/yuri-gushin/Roboo,1.03 MB
469,dategrep,179,12,179,0,20/03/2014,03/01/2025,1.76 MB,print lines matching a time range,Perl,https://github.com/mdom/dategrep,1.76 MB
470,YNABLinuxInstall,178,19,178,13,29/04/2013,26/12/2021,36.00 KB,Install script for YNAB 4 on Linux,Perl,https://github.com/WolverineFan/YNABLinuxInstall,36.00 KB
471,ALLHiC,177,36,177,86,13/11/2018,20/10/2024,22.93 MB,ALLHiC: phasing and scaffolding polyploid genomes based on Hi-C data,Perl,https://github.com/tangerzhang/ALLHiC,22.93 MB
472,linux-sysadmin-course,176,97,176,3,25/06/2013,05/09/2021,6.87 MB,Linux System Administration 101,Perl,https://github.com/hackman/linux-sysadmin-course,6.87 MB
473,cpm,176,35,176,46,16/06/2015,29/12/2025,7.75 MB,fast CPAN client,Perl,https://github.com/skaji/cpm,7.75 MB
474,caterwaul,176,10,176,1,24/09/2010,30/12/2021,28.78 MB,A Javascript-to-Javascript compiler,Perl,https://github.com/spencertipping/caterwaul,28.78 MB
475,parsyncfp,175,18,175,30,28/03/2017,01/03/2022,106.00 KB,follow-on to parsync (parallel rsync) with better startup perf,Perl,https://github.com/hjmangalam/parsyncfp,106.00 KB
476,Selenium-Remote-Driver,175,88,175,19,22/02/2010,06/10/2025,35.57 MB,Perl Bindings to the Selenium Webdriver server,Perl,https://github.com/teodesian/Selenium-Remote-Driver,35.57 MB
477,Gekko-Datasets,174,44,174,11,04/04/2018,31/05/2018,48.00 KB,Gekko Trading Bot dataset dumps. Ready to use and download history files in SQLite format.,Perl,https://github.com/xFFFFF/Gekko-Datasets,48.00 KB
478,textwrangler-bbedit-solarized,174,37,174,5,16/04/2011,15/10/2022,13.00 KB,solarized color scheme for BBEdit and TextWrangler,Perl,https://github.com/rcarmo/textwrangler-bbedit-solarized,13.00 KB
479,vnlog,174,7,174,0,23/12/2017,26/01/2026,971.00 KB,Process labelled tabular ASCII data using normal UNIX tools,Perl,https://github.com/dkogan/vnlog,971.00 KB
480,FreeRDP-Manuals,173,996,173,17,17/02/2013,22/01/2024,13.17 MB,FreeRDP Manuals,Perl,https://github.com/awakecoding/FreeRDP-Manuals,13.17 MB
481,aws-sdk-perl,173,95,173,156,27/09/2013,22/04/2024,72.96 MB,A community AWS SDK for Perl Programmers,Perl,https://github.com/pplu/aws-sdk-perl,72.96 MB
482,reolink-camera,172,15,172,2,20/01/2020,11/02/2024,302.00 KB,Reolink RLC-410-5MP IP camera reverse engineered technical details,Perl,https://github.com/hn/reolink-camera,302.00 KB
483,lua-resty-hmac,171,98,171,2,17/07/2014,31/05/2023,35.00 KB,HMAC functions for ngx_lua and LuaJIT,Perl,https://github.com/jkeys089/lua-resty-hmac,35.00 KB
484,autodoc,171,25,171,3,27/05/2013,21/09/2020,141.00 KB,PostgreSQL Autodoc - dumps a Postgres schema in several useful documentary forms,Perl,https://github.com/cbbrowne/autodoc,141.00 KB
485,whatsapp_discover,170,92,170,4,15/03/2014,01/04/2016,21.00 KB,"""Whatsapp Discover"" is a tool for getting phone numbers of devices using Whatsapp by real time sniffing from an interface (disabled in this first version) or from a list of pcap files, which can be processed in batch",Perl,https://github.com/deepakdaswani/whatsapp_discover,21.00 KB
486,figlet-fonts,170,19,170,0,13/01/2011,12/06/2012,7.15 MB,A collection of fonts for FIGlet,Perl,https://github.com/cmatsuoka/figlet-fonts,7.15 MB
487,os-autoinst,170,210,170,33,22/12/2011,19/02/2026,35.82 MB,OS-level test automation,Perl,https://github.com/os-autoinst/os-autoinst,35.82 MB
488,qqwry2mmdb,170,17,170,1,20/05/2020,01/10/2024,42.32 MB,为 Wireshark 能使用纯真网络 IP 数据库(QQwry)而提供的格式转换工具,Perl,https://github.com/leolovenet/qqwry2mmdb,42.32 MB
489,SMBCrunch,170,20,170,1,25/03/2016,07/03/2018,31.00 KB,3 tools that work together to simplify reconaissance of Windows File Shares,Perl,https://github.com/Raikia/SMBCrunch,31.00 KB
490,iOSMessageExport,169,59,169,24,03/01/2014,14/04/2022,26.00 KB,,Perl,https://github.com/chelseybadau/iOSMessageExport,26.00 KB
491,postgrey,169,48,169,18,17/02/2013,26/06/2024,1023.00 KB,Postfix Greylisting Policy-Daemon,Perl,https://github.com/schweikert/postgrey,1023.00 KB
492,wp-tools,169,26,169,0,10/02/2016,20/12/2022,200.00 KB,Tools to backup and upgrade WordPress installations,Perl,https://github.com/bluehost/wp-tools,200.00 KB
493,lua-resty-redis-ratelimit,168,40,168,2,18/09/2014,18/04/2023,51.00 KB,Limit the request processing rate between multiple NGINX instances backed by Redis,Perl,https://github.com/timebug/lua-resty-redis-ratelimit,51.00 KB
494,Moose,168,105,168,11,04/07/2010,04/07/2025,20.83 MB,Official repository for Moose,Perl,https://github.com/moose/Moose,20.83 MB
495,keepass4web,168,20,168,13,21/03/2016,27/10/2023,1.69 MB,[deprecated] KeePass databases served on the web,Perl,https://github.com/lixmal/keepass4web,1.69 MB
496,smarter-encryption,168,38,168,18,27/09/2019,24/11/2025,40.00 KB,,Perl,https://github.com/duckduckgo/smarter-encryption,40.00 KB
497,ipxe-buildweb,167,61,167,18,02/04/2013,16/11/2022,150.00 KB,iPXE Prebuilt binary web interface,Perl,https://github.com/xbgmsharp/ipxe-buildweb,150.00 KB
498,jailing,167,10,167,2,13/05/2015,21/08/2025,24.00 KB,super-easy chroot jail builder/runner for Linux,Perl,https://github.com/kazuho/jailing,24.00 KB
499,VEP_plugins,165,123,165,10,21/11/2011,16/02/2026,3.11 MB,Plugins for the Ensembl Variant Effect Predictor (VEP),Perl,https://github.com/Ensembl/VEP_plugins,3.11 MB
500,bmo,165,195,165,17,12/03/2014,05/02/2026,64.86 MB,bugzilla.mozilla.org source - report issues here: https://bugzilla.mozilla.org/enter_bug.cgi?product=bugzilla.mozilla.org,Perl,https://github.com/mozilla-bteam/bmo,64.86 MB
501,Amon,164,44,164,11,13/12/2009,01/11/2022,4.82 MB,yet another web application framework,Perl,https://github.com/tokuhirom/Amon,4.82 MB
502,xchataqua,164,43,164,125,11/07/2011,12/09/2023,65.53 MB,"An IRC client, OS X native front-end for XChat ( http://itunes.apple.com/app/id447521961 )",Perl,https://github.com/xchataqua/xchataqua,65.53 MB
503,Octopussy,164,28,164,112,18/11/2013,08/10/2020,10.08 MB,Octopussy - Open Source Log Management Solution,Perl,https://github.com/Octopussy-Project/Octopussy,10.08 MB
504,UnlinkMKV,164,7,164,10,29/06/2012,31/05/2023,375.71 MB,Merges ordered chapters / segmented MKVs back into a single file.,Perl,https://github.com/gnoling/UnlinkMKV,375.71 MB
505,redis-traffic-stats,163,30,163,2,24/02/2014,23/08/2017,37.00 KB,"Redis query analyzer for counting, traffic stats by command",Perl,https://github.com/hirose31/redis-traffic-stats,37.00 KB
506,Marpa--R2,163,24,163,4,22/10/2011,11/09/2023,40.89 MB,Parse any language you can describe in BNF,Perl,https://github.com/jeffreykegler/Marpa--R2,40.89 MB
507,pythonrouge,162,34,162,5,09/11/2015,25/05/2020,358.00 KB,Python wrapper for evaluating summarization quality by ROUGE package,Perl,https://github.com/tagucci/pythonrouge,358.00 KB
508,manservant,162,5,162,3,03/05/2012,18/02/2023,195.00 KB,Browse man pages in style with your personal manservant.,Perl,https://github.com/jimeh/manservant,195.00 KB
509,Corinna,162,19,162,12,20/03/2020,13/07/2024,408.00 KB,Corinna - Bring Modern OO to the Core of Perl,Perl,https://github.com/Perl-Apollo/Corinna,408.00 KB
510,Pester,162,14,162,10,24/05/2009,08/08/2021,12.29 MB,"Simple, disposable alarms and timers for macOS.",Perl,https://github.com/nriley/Pester,12.29 MB
511,docker-images,162,65,162,7,04/02/2015,01/06/2023,4.43 MB,Dreamcat4's Docker Images (Trusted Builds),Perl,https://github.com/dreamcat4/docker-images,4.43 MB
512,bti,162,31,162,14,25/06/2008,22/11/2021,319.00 KB,bash twitter ididocy,Perl,https://github.com/gregkh/bti,319.00 KB
513,GeoTag,162,15,162,8,12/05/2011,26/01/2026,299.05 MB,Image geo location editing for macOS Ventura (13) and later.  Instructions and a .dmg of the current version are on the application home page.,Perl,https://github.com/marchyman/GeoTag,299.05 MB
514,kill-close-wait-connections,161,58,161,3,14/11/2014,06/12/2019,13.00 KB,Kills all TCP CLOSE_WAIT connections,Perl,https://github.com/rghose/kill-close-wait-connections,13.00 KB
515,ParsCit,161,47,161,3,25/07/2010,06/05/2020,318.29 MB,An open-source CRF Reference String Parsing Package,Perl,https://github.com/knmnyn/ParsCit,318.29 MB
516,rsu-client,160,21,160,20,14/10/2012,19/03/2020,77.93 MB,A git repository for the RuneScape Linux/Unix Client Project,Perl,https://github.com/rsu-client/rsu-client,77.93 MB
517,Mega-Bot,160,73,160,0,05/01/2019,04/07/2020,15.45 MB,[NEW] : Mega Bot ☣ Scanner & Auto Exploiter,Perl,https://github.com/Aron-Tn/Mega-Bot,15.45 MB
518,py-rouge,159,26,159,7,23/08/2018,10/07/2019,1.17 MB,"Full Python implementation of the ROUGE metric, producing same results as in the official perl implementation.",Perl,https://github.com/diegoantognini/py-rouge,1.17 MB
519,frozen-bubble,159,38,159,34,02/09/2009,05/07/2024,56.13 MB,Making frozen bubble cross platform,Perl,https://github.com/kthakore/frozen-bubble,56.13 MB
520,colorgcc,159,45,159,13,23/11/2009,13/11/2018,27.00 KB,colorgcc is a perl script to colorize gcc output. I'm collecting random patches and changes,Perl,https://github.com/colorgcc/colorgcc,27.00 KB
521,mirdeep2,158,53,158,4,13/04/2017,11/12/2025,7.62 MB,Discovering known and novel miRNAs from small RNA sequencing data,Perl,https://github.com/rajewsky-lab/mirdeep2,7.62 MB
522,spotify-connect-resources,157,19,157,3,07/03/2015,21/07/2019,243.66 MB,"A repository to hold any data/stuff related to reversing the Spotify Connect protocol. Mostly just data dumps at the moment, but if you have something to add to it, be it an implementation, information or just another data dump, make a PR and I will add it asap.",Perl,https://github.com/librespot-org/spotify-connect-resources,243.66 MB
523,perl5i,157,38,157,117,23/04/2009,05/06/2018,1.44 MB,A single module to fix as much of Perl 5 as possible in one go,Perl,https://github.com/evalEmpire/perl5i,1.44 MB
524,Gitalist,157,32,157,3,25/08/2009,27/06/2014,2.26 MB,A modern git web viewer,Perl,https://github.com/broquaint/Gitalist,2.26 MB
525,munin-mysql,157,47,157,18,16/02/2009,23/05/2018,295.00 KB,Improved MySQL Graphs for Munin,Perl,https://github.com/kjellm/munin-mysql,295.00 KB
526,PortableHexo,156,26,156,4,20/03/2016,12/02/2022,92.42 MB,A Portable version of Hexo,Perl,https://github.com/BitMOE/PortableHexo,92.42 MB
527,webwork2,156,168,156,128,28/12/2011,17/02/2026,88.62 MB,Course management front end for WeBWorK,Perl,https://github.com/openwebwork/webwork2,88.62 MB
528,sec-tools,156,31,156,0,06/03/2015,14/07/2017,35.00 KB,Docker images for infosec tools,Perl,https://github.com/infoslack/sec-tools,35.00 KB
529,Template2,156,96,156,87,20/12/2011,14/02/2026,10.59 MB,Perl Template Toolkit v2,Perl,https://github.com/abw/Template2,10.59 MB
530,cowfiles,154,32,154,1,09/01/2013,06/07/2023,57.00 KB,ASCII cowfiles for cowsay,Perl,https://github.com/bkendzior/cowfiles,57.00 KB
531,iso-country-flags-svg-collection,154,91,154,10,03/06/2014,26/01/2018,10.40 MB,,Perl,https://github.com/joielechong/iso-country-flags-svg-collection,10.40 MB
532,Waldo,154,11,154,4,26/05/2011,28/06/2011,5.34 MB,"A generic port of TextMate's Find-In-Project, with associated MacVim plugin",Perl,https://github.com/jtaby/Waldo,5.34 MB
533,Colormake,154,25,154,10,18/02/2012,21/02/2017,27.00 KB,A simple wrapper around make to colorize the output.,Perl,https://github.com/pagekite/Colormake,27.00 KB
534,check_nwc_health,153,91,153,131,19/10/2010,03/02/2026,10.20 MB,"nwc = network component. This plugin checks lots of aspects of routers, switches, wlan controllers, firewalls,.....",Perl,https://github.com/lausser/check_nwc_health,10.20 MB
535,flac2mp3,152,30,152,20,10/01/2013,28/01/2021,430.00 KB,flac2mp3 is a tool to convert audio files from flac to mp3 format including the copying of tags.,Perl,https://github.com/robinbowes/flac2mp3,430.00 KB
536,cocos2d-x-3rd-party-libs-src,152,179,152,28,03/04/2014,12/01/2021,516.00 KB,Dependencies of cocos2d-x.,Perl,https://github.com/cocos2d/cocos2d-x-3rd-party-libs-src,516.00 KB
537,mytop,152,41,152,18,21/03/2009,07/03/2024,29.00 KB,"a ""top"" clone for MySQL",Perl,https://github.com/jzawodn/mytop,29.00 KB
538,newsroom,151,25,151,0,27/04/2018,08/08/2023,597.00 KB,Tools for downloading and analyzing summaries and evaluating summarization systems. https://summari.es/,Perl,https://github.com/lil-lab/newsroom,597.00 KB
539,irssi-scripts,151,24,151,19,07/01/2010,17/07/2021,1.63 MB,Repo to store some personal irssi scripts,Perl,https://github.com/shabble/irssi-scripts,1.63 MB
540,ReconCobra---Complete-Automated-Pentest-Framework-For-Information-Gathering,151,41,151,6,24/12/2019,12/05/2020,318.00 KB,"ReconCobra Reconcobra is Foot printing software for Ultimate Information Gathering Kali, Parrot OS, Black Arch, Termux, Android Led TV  Interface Software have 82 Options with full automation with powerful information gathering capability  Brief Introduction ReconCobra is useful in Banks, Private Organisations and Ethical hacker personnel for legal auditing. It serves as a defense method to find as much as information possible for gaining unauthorised access and intrusion. With the emergence of more advanced technology, cybercriminals have also found more ways to get into the system of many organizations. ReconCobra software can audit, firewall behaviour, if it is leaking backend machines/server and replying pings, it can find internal and external networks where many software’s like erp, mail firewalls are installed, exposing servers so it do Footprinting, Scanning & Enumeration as much as possible of target, to discover and collect most possible informations like username, web technologies, files, endpoint, api and much more.",Perl,https://github.com/nerodtm/ReconCobra---Complete-Automated-Pentest-Framework-For-Information-Gathering,318.00 KB
541,kiwi-legacy,151,75,151,0,13/07/2011,04/10/2022,459.20 MB,KIWI - Appliance Builder (legacy please read deprecation notice),Perl,https://github.com/OSInside/kiwi-legacy,459.20 MB
542,ensembl-rest,150,61,150,7,13/12/2013,09/02/2026,19.68 MB,Language agnostic RESTful data access to Ensembl data over HTTP,Perl,https://github.com/Ensembl/ensembl-rest,19.68 MB
543,dropbox-api-command,150,14,150,12,23/02/2011,20/11/2019,115.00 KB,command line interface to access Dropbox API,Perl,https://github.com/s-aska/dropbox-api-command,115.00 KB
544,asciidoc-cheatsheet,150,56,150,1,22/04/2015,16/11/2018,63.00 KB,Asciidoc cheatsheet for GitHub,Perl,https://github.com/powerman/asciidoc-cheatsheet,63.00 KB
545,pause,150,58,150,101,14/03/2009,13/07/2025,4.23 MB,Perl authors upload server,Perl,https://github.com/andk/pause,4.23 MB
546,zlb,149,32,149,40,05/07/2016,02/01/2025,8.65 MB,ZEVENET is now RELIANOID,Perl,https://github.com/zevenet/zlb,8.65 MB
547,gmetric,149,48,149,6,10/08/2010,18/10/2018,194.00 KB,Repository of user-contributed gmetric scripts,Perl,https://github.com/ganglia/gmetric,194.00 KB
548,cloudforecast,149,22,149,5,18/05/2010,29/03/2021,597.00 KB,the server metrics gathering,Perl,https://github.com/kazeburo/cloudforecast,597.00 KB
549,DBIx-Class,149,153,149,63,08/10/2010,16/01/2025,21.49 MB,GitHub side of the DBIx::Class ( DBIC ) repository,Perl,https://github.com/Perl5/DBIx-Class,21.49 MB
550,GALBA,148,6,148,13,27/10/2022,27/01/2025,10.26 MB,GALBA is a pipeline for fully automated prediction of protein coding gene structures with AUGUSTUS in novel eukaryotic genomes for the scenario where high quality proteins from one or several closely related species are available.,Perl,https://github.com/Gaius-Augustus/GALBA,10.26 MB
551,smokeping-3.x,148,19,148,1,26/08/2013,14/12/2016,381.00 KB,"reengineered SmokePing, using Extopus as its frontend",Perl,https://github.com/oetiker/smokeping-3.x,381.00 KB
552,learning_vcf_file,148,40,148,0,05/06/2015,04/08/2025,43.72 MB,Learning the Variant Call Format,Perl,https://github.com/davetang/learning_vcf_file,43.72 MB
553,smtp-user-enum,148,40,148,3,29/05/2015,20/04/2022,216.00 KB,"Username guessing tool primarily for use against the default Solaris SMTP service. Can use either EXPN, VRFY or RCPT TO.",Perl,https://github.com/pentestmonkey/smtp-user-enum,216.00 KB
554,finance-quote,147,111,147,1,16/09/2008,11/02/2026,2.78 MB,Finance::Quote module for Perl,Perl,https://github.com/finance-quote/finance-quote,2.78 MB
555,incubator-pagespeed-cpanel,147,49,147,40,13/03/2013,21/04/2023,43.00 KB,mod_pagespeed module for CPanel WHM,Perl,https://github.com/apache/incubator-pagespeed-cpanel,43.00 KB
556,irclogger,147,15,147,6,19/07/2008,12/01/2012,1.11 MB,Sinatra based irclogger.com,Perl,https://github.com/cschneid/irclogger,1.11 MB
557,any2fasta,147,17,147,7,09/10/2018,30/12/2025,8.47 MB,Convert various sequence formats to FASTA,Perl,https://github.com/tseemann/any2fasta,8.47 MB
558,usermin,147,52,147,29,08/07/2009,27/01/2026,4.53 MB,Usermin source code,Perl,https://github.com/webmin/usermin,4.53 MB
559,test-more,146,96,146,96,30/01/2009,14/02/2026,12.25 MB,"Test2, Test::More, Test::Simple and Test::Builder Perl modules for writing tests",Perl,https://github.com/Test-More/test-more,12.25 MB
560,obs-build,146,201,146,189,19/10/2011,19/02/2026,5.94 MB,"OBS build script, can be used with OBS or stand alone",Perl,https://github.com/openSUSE/obs-build,5.94 MB
561,Tools,145,31,145,1,22/10/2014,29/02/2024,9.01 MB,"Tools from WFA 4/e, timeline tools, etc.",Perl,https://github.com/keydet89/Tools,9.01 MB
562,RNAseqDB,145,40,145,7,22/03/2016,14/05/2018,1.36 GB,,Perl,https://github.com/mskcc/RNAseqDB,1.36 GB
563,verilog-perl,145,38,145,5,03/03/2020,23/01/2024,1.84 MB,"Verilog parser, preprocessor, and related tools for the Verilog-Perl package",Perl,https://github.com/veripool/verilog-perl,1.84 MB
564,pentest-tools,145,58,145,1,03/04/2015,14/05/2018,286.00 KB,Penetration testing scripts,Perl,https://github.com/reider-roque/pentest-tools,286.00 KB
565,irssi-smartfilter,145,8,145,5,02/01/2014,17/07/2016,28.00 KB,Irssi smart filter to selectively hide JOIN/QUIT in busy channels,Perl,https://github.com/lifeforms/irssi-smartfilter,28.00 KB
