Ranking,Project Name,Stars,Forks,Watchers,Open Issues,Created At,Last Commit,Size,Description,Language,Repo URL,Size
1,cloc,22547,1099,22547,25,07/09/2015,19/02/2026,6.97 MB,"cloc counts blank lines, comment lines, and physical lines of source code in many programming languages.",Perl,https://github.com/AlDanial/cloc,6.97 MB
2,FlameGraph,19306,2087,19306,173,16/12/2011,20/10/2024,1.87 MB,Stack trace visualizer,Perl,https://github.com/brendangregg/FlameGraph,1.87 MB
3,diff-so-fancy,17933,338,17933,33,04/02/2016,15/07/2025,666.00 KB,Good-lookin' diffs. Actually… nah… The best-lookin' diffs. :tada:,Perl,https://github.com/so-fancy/diff-so-fancy,666.00 KB
4,nikto,10102,1406,10102,0,24/11/2012,19/02/2026,5.20 MB,Nikto web server scanner,Perl,https://github.com/sullo/nikto,5.20 MB
5,MySQLTuner-perl,9436,1295,9436,34,29/05/2009,19/02/2026,34.71 MB,MySQLTuner is a script written in Perl that will assist you with your MySQL configuration and make recommendations for increased performance and stability.,Perl,https://github.com/major/MySQLTuner-perl,34.71 MB
6,gitolite,8566,1011,8566,6,24/08/2009,23/01/2026,3.11 MB,"Hosting git repositories -- Gitolite allows you to setup git hosting on a central server, with very fine-grained access control and many (many!) more powerful features.",Perl,https://github.com/sitaramc/gitolite,3.11 MB
7,git-it-electron,4860,1215,4860,138,08/05/2015,10/04/2024,78.53 MB,":computer: :mortar_board: Git-it is a (Mac, Win, Linux) Desktop App for Learning Git and GitHub",Perl,https://github.com/jlord/git-it-electron,78.53 MB
8,Expose,4433,257,4433,23,28/08/2015,16/03/2022,409.00 KB,A simple static site generator for photoessays,Perl,https://github.com/Jack000/Expose,409.00 KB
9,exiftool,4429,416,4429,17,09/05/2018,19/02/2026,65.86 MB,ExifTool meta information reader/writer,Perl,https://github.com/exiftool/exiftool,65.86 MB
10,sicp-pdf,4387,549,4387,20,21/06/2011,27/06/2024,36.21 MB,SICP PDF with Texinfo and LaTeX source,Perl,https://github.com/sarabander/sicp-pdf,36.21 MB
11,EQGRP,4198,2081,4198,17,08/04/2017,24/05/2017,150.60 MB,Decrypted content of eqgrp-auction-file.tar.xz,Perl,https://github.com/x0rz/EQGRP,150.60 MB
12,pgbadger,3951,374,3951,17,11/04/2012,05/02/2026,15.16 MB,A fast PostgreSQL Log Analyzer,Perl,https://github.com/darold/pgbadger,15.16 MB
13,sanoid,3668,338,3668,136,17/11/2014,18/02/2026,1.27 MB,These are policy-driven snapshot management and replication tools which use OpenZFS for underlying next-gen storage. (Btrfs support plans are shelved unless and until btrfs becomes reliable.),Perl,https://github.com/jimsalterjrs/sanoid,1.27 MB
14,rsnapshot,3586,274,3586,56,24/04/2012,20/07/2025,2.22 MB,"a tool for backing up your data using rsync (if you want to get help, use https://lists.sourceforge.net/lists/listinfo/rsnapshot-discuss)",Perl,https://github.com/rsnapshot/rsnapshot,2.22 MB
15,a-shell,3559,173,3559,594,10/07/2019,19/02/2026,137.33 MB,"A terminal for iOS, with multiple windows",Perl,https://github.com/holzschu/a-shell,137.33 MB
16,.dotfiles,3435,316,3435,36,15/06/2021,24/04/2024,18.89 MB,,Perl,https://github.com/ThePrimeagen/.dotfiles,18.89 MB
17,ddclient,3326,380,3326,125,14/08/2012,19/01/2025,2.62 MB,ddclient updates dynamic DNS entries for accounts on a wide range of dynamic DNS services.,Perl,https://github.com/ddclient/ddclient,2.62 MB
18,trurl,3317,115,3317,5,31/03/2023,29/01/2026,515.00 KB,a command line tool for URL parsing and manipulation.,Perl,https://github.com/curl/trurl,515.00 KB
19,rcm,3225,138,3225,32,07/06/2013,23/05/2025,2.07 MB,rc file (dotfile) management,Perl,https://github.com/thoughtbot/rcm,2.07 MB
20,openfortivpn,3210,362,3210,133,26/01/2015,11/01/2026,1.31 MB,Client for PPP+TLS VPN tunnel services,Perl,https://github.com/adrienverge/openfortivpn,1.31 MB
21,sqitch,3104,216,3104,77,27/01/2012,25/01/2026,13.48 MB,Sensible database change management,Perl,https://github.com/sqitchers/sqitch,13.48 MB
22,sherloq,3097,291,3097,22,24/06/2017,14/07/2025,194.02 MB,An open-source digital image forensic toolset,Perl,https://github.com/GuidoBartoli/sherloq,194.02 MB
23,nginx-tutorials,2877,438,2877,5,01/12/2011,05/03/2021,586.00 KB,Nginx Tutorials,Perl,https://github.com/openresty/nginx-tutorials,586.00 KB
24,LANraragi,2837,199,2837,98,31/07/2014,23/01/2026,85.85 MB,Web application for archival and reading of manga/doujinshi. Lightweight and Docker-ready for NAS/servers.,Perl,https://github.com/Difegue/LANraragi,85.85 MB
25,mojo,2719,588,2719,115,21/10/2008,12/02/2026,29.31 MB,:sparkles: Mojolicious - Perl real-time web framework,Perl,https://github.com/mojolicious/mojo,29.31 MB
26,postgresqltuner,2685,195,2685,13,15/12/2016,08/01/2024,152.00 KB,"Simple script to analyse your PostgreSQL database configuration, and give tuning advice",Perl,https://github.com/jfcoz/postgresqltuner,152.00 KB
27,Th3inspector,2569,514,2569,13,17/02/2018,21/04/2025,342.00 KB,Th3Inspector 🕵️ Best Tool For Information Gathering 🔎,Perl,https://github.com/Moham3dRiahi/Th3inspector,342.00 KB
28,owasp-modsecurity-crs,2488,731,2488,45,02/08/2012,16/06/2020,3.43 MB,OWASP ModSecurity Core Rule Set (CRS) Project (Official Repository),Perl,https://github.com/SpiderLabs/owasp-modsecurity-crs,3.43 MB
29,get_iplayer,2451,239,2451,1,11/03/2011,04/05/2025,5.60 MB,A utility for downloading TV and radio programmes from BBC iPlayer and BBC Sounds,Perl,https://github.com/get-iplayer/get_iplayer,5.60 MB
30,ABTestingGateway,2360,764,2360,75,19/07/2015,14/10/2018,12.73 MB,,Perl,https://github.com/CNSRE/ABTestingGateway,12.73 MB
31,nipe,2286,333,2286,15,07/09/2015,07/02/2026,378.00 KB,An engine to make Tor network your default gateway,Perl,https://github.com/htrgouvea/nipe,378.00 KB
32,perl5,2230,610,2230,2390,13/02/2013,19/02/2026,358.80 MB,🐪 The Perl programming language,Perl,https://github.com/Perl/perl5,358.80 MB
33,everything-curl,2219,333,2219,23,24/09/2015,28/01/2026,10.04 MB,"The book documenting the curl project, the curl tool, libcurl and more. Simply put: everything curl.",Perl,https://github.com/curl/everything-curl,10.04 MB
34,munin,2113,481,2113,215,31/05/2012,15/12/2025,19.59 MB,Main repository for munin master / node / plugins,Perl,https://github.com/munin-monitoring/munin,19.59 MB
35,afterglow-theme,2099,137,2099,47,09/04/2014,11/07/2023,8.56 MB,[DEPRECATED] A minimal dark Theme for Sublime Text 2 and 3,Perl,https://github.com/YabataDesign/afterglow-theme,8.56 MB
36,the-bastion,2088,125,2088,45,14/10/2020,30/01/2026,6.16 MB,"Authentication, authorization, traceability and auditability for SSH accesses.",Perl,https://github.com/ovh/the-bastion,6.16 MB
37,btrbk,2043,134,2043,264,10/02/2015,29/11/2025,2.22 MB,Tool for creating snapshots and remote backups of btrfs subvolumes,Perl,https://github.com/digint/btrbk,2.22 MB
38,ua-parser,1972,490,1972,0,15/09/2010,26/12/2016,4.93 MB,A multi-language port of Browserscope's user agent parser.,Perl,https://github.com/tobie/ua-parser,4.93 MB
39,slipstream,1964,214,1964,5,31/10/2020,14/01/2023,3.79 MB,"NAT Slipstreaming allows an attacker to remotely access any TCP/UDP services bound to a victim machine, bypassing the victim’s NAT/firewall, just by anyone on the victim's network visiting a website",Perl,https://github.com/samyk/slipstream,3.79 MB
40,linux-exploit-suggester-2,1961,301,1961,0,25/07/2016,28/01/2023,32.00 KB,Next-Generation Linux Kernel Exploit Suggester,Perl,https://github.com/jondonas/linux-exploit-suggester-2,32.00 KB
41,SmokePing,1820,205,1820,6,05/10/2011,19/02/2026,3.32 MB,The Active Monitoring System,Perl,https://github.com/oetiker/SmokePing,3.32 MB
42,duckduckgo,1814,241,1814,0,18/01/2011,14/10/2022,1.06 MB,DuckDuckGo Instant Answer Infrastructure,Perl,https://github.com/duckduckgo/duckduckgo,1.06 MB
43,ModSecurity-nginx,1814,306,1814,53,23/06/2015,06/02/2026,1.36 MB,ModSecurity v3 Nginx Connector,Perl,https://github.com/owasp-modsecurity/ModSecurity-nginx,1.36 MB
44,Linux_Exploit_Suggester,1810,410,1810,4,26/08/2013,19/05/2014,238.00 KB,Linux Exploit Suggester; based on operating system release number ,Perl,https://github.com/InteliSecureLabs/Linux_Exploit_Suggester,238.00 KB
45,dvcs-ripper,1777,316,1777,11,23/10/2012,19/07/2024,48.00 KB,Rip web accessible (distributed) version control systems: SVN/GIT/HG...,Perl,https://github.com/kost/dvcs-ripper,48.00 KB
46,XAttacker,1713,480,1713,31,07/11/2017,08/10/2023,214.00 KB,X Attacker Tool ☣ Website Vulnerability Scanner & Auto Exploiter,Perl,https://github.com/Moham3dRiahi/XAttacker,214.00 KB
47,Mojo-Webqq,1712,317,1712,13,28/05/2015,10/04/2019,5.46 MB,【重要通知：WebQQ将在2019年1月1日停止服务，此项目目前已停止维护，感谢大家四年来的一路陪伴】使用Perl语言（不会没关系）编写的smartqq/webqq客户端框架（非GUI），可通过插件提供基于HTTP协议的api接口供其他语言或系统调用,Perl,https://github.com/hexsum/Mojo-Webqq,5.46 MB
48,openresty-systemtap-toolkit,1674,353,1674,28,30/08/2012,14/03/2023,345.00 KB,"Real-time analysis and diagnostics tools for OpenResty (including NGINX, LuaJIT, ngx_lua, and more) based on SystemTap",Perl,https://github.com/openresty/openresty-systemtap-toolkit,345.00 KB
49,ggplot2-book,1664,715,1664,60,19/05/2008,12/03/2025,50.24 MB,ggplot2: elegant graphics for data analysis,Perl,https://github.com/hadley/ggplot2-book,50.24 MB
50,slimserver,1648,350,1648,98,08/05/2012,19/02/2026,884.35 MB,Server for Squeezebox and compatible players. This server is also called Lyrion Music Server.,Perl,https://github.com/LMS-Community/slimserver,884.35 MB
51,packetfence,1594,310,1594,851,01/03/2012,19/02/2026,380.38 MB,"PacketFence is a fully supported, trusted, Free and Open Source network access control (NAC) solution. Boasting an impressive feature set including a captive-portal for registration and remediation, centralized wired and wireless management, powerful BYOD management options, 802.1X support, layer-2 isolation of problematic devices; PacketFence can be used to effectively secure networks small to very large heterogeneous networks.",Perl,https://github.com/inverse-inc/packetfence,380.38 MB
52,backuppc,1565,197,1565,50,28/03/2013,17/12/2025,5.56 MB,"BackupPC is a high-performance, enterprise-grade system for backing up to a server's disk.",Perl,https://github.com/backuppc/backuppc,5.56 MB
53,ATSCAN,1551,359,1551,7,04/10/2015,10/08/2024,3.50 MB,Advanced dork Search & Mass Exploit Scanner,Perl,https://github.com/AlisamTechnology/ATSCAN,3.50 MB
54,vRain,1538,167,1538,8,18/02/2025,29/12/2025,407.55 MB,中文古籍刻本風格直排電子書製作工具 Chinese Ancient eBooks Generator,Perl,https://github.com/shanleiguang/vRain,407.55 MB
55,mha4mysql-manager,1519,506,1519,73,23/07/2011,14/08/2020,377.00 KB,"Development tree of Master High Availability Manager and tools for MySQL (MHA), Manager part",Perl,https://github.com/yoshinorim/mha4mysql-manager,377.00 KB
56,ack2,1466,137,1466,9,29/01/2011,19/03/2019,2.46 MB,**ack 2 is no longer being maintained.  ack 3 is the latest version.**,Perl,https://github.com/beyondgrep/ack2,2.46 MB
57,percona-toolkit,1450,364,1450,28,07/05/2013,19/02/2026,112.89 MB,Percona Toolkit: a collection of advanced open source command-line tools.,Perl,https://github.com/percona/percona-toolkit,112.89 MB
58,openkore,1445,1192,1445,116,28/02/2016,10/02/2026,264.64 MB,A free/open source client and automation tool for Ragnarok Online,Perl,https://github.com/OpenKore/openkore,264.64 MB
59,hydra,1414,336,1414,384,29/10/2011,16/02/2026,16.35 MB,"Hydra, the Nix-based continuous build system",Perl,https://github.com/NixOS/hydra,16.35 MB
60,checkinpanel,1412,339,1412,36,22/08/2021,11/08/2023,1.41 MB,一个主要运行在 𝐞𝐥𝐞𝐜𝐕𝟐𝐏 或 𝐪𝐢𝐧𝐠𝐥𝐨𝐧𝐠 等定时面板，同时支持系统运行环境的签到项目（环境：𝑷𝒚𝒕𝒉𝒐𝒏 3.8+ / 𝑵𝒐𝒅𝒆.𝒋𝒔 10+ / 𝑩𝒂𝒔𝒉 4+ / 𝑶𝒑𝒆𝒏𝑱𝑫𝑲8 / 𝑷𝒆𝒓𝒍5）,Perl,https://github.com/OreosLab/checkinpanel,1.41 MB
61,enum4linux,1370,247,1370,5,31/07/2015,23/04/2025,116.00 KB,enum4Linux is a Linux alternative to enum.exe for enumerating data from Windows and Samba hosts,Perl,https://github.com/CiscoCXSecurity/enum4linux,116.00 KB
62,evilgrade,1322,279,1322,11,22/04/2013,01/09/2021,7.88 MB,Evilgrade is a modular framework that allows the user to take advantage of poor upgrade implementations by injecting fake updates.,Perl,https://github.com/infobyte/evilgrade,7.88 MB
63,lua-resty-waf,1313,306,1313,35,04/11/2014,31/01/2024,1.41 MB,High-performance WAF built on the OpenResty stack,Perl,https://github.com/p0pr0ck5/lua-resty-waf,1.41 MB
64,fwknop,1309,249,1309,119,13/06/2011,26/11/2025,15.20 MB,Single Packet Authorization > Port Knocking,Perl,https://github.com/mrash/fwknop,15.20 MB
65,youtube-viewer,1295,91,1295,44,12/02/2011,20/12/2025,3.30 MB,Lightweight YouTube client for Linux,Perl,https://github.com/trizen/youtube-viewer,3.30 MB
66,pixload,1288,251,1288,8,15/09/2019,30/11/2023,118.00 KB,Image Payload Creating/Injecting tools,Perl,https://github.com/sighook/pixload,118.00 KB
67,Betty,1265,1748,1265,29,08/07/2016,01/12/2023,588.00 KB,Holberton-style C code checker written in Perl,Perl,https://github.com/alx-tools/Betty,588.00 KB
68,inxi,1257,91,1257,15,20/08/2015,12/01/2024,9.56 MB,"inxi is a full featured CLI system information tool. It is available in most Linux distribution repositories, and does its best to support the BSDs. ",Perl,https://github.com/smxi/inxi,9.56 MB
69,Mojo-Weixin,1247,255,1247,19,14/01/2016,19/09/2023,2.01 MB,使用Perl语言（不会没关系）编写的个人账号微信/weixin/wechat客户端框架（非GUI），可通过插件提供基于HTTP协议的api接口供其他语言或系统调用,Perl,https://github.com/hexsum/Mojo-Weixin,2.01 MB
70,swaks,1240,95,1240,46,16/02/2017,05/03/2024,3.18 MB,Swaks - Swiss Army Knife for SMTP,Perl,https://github.com/jetmore/swaks,3.18 MB
71,LaTeXML,1210,134,1210,333,22/10/2013,05/02/2026,63.27 MB,LaTeXML: a TeX and LaTeX to XML/HTML/ePub/MathML translator.,Perl,https://github.com/brucemiller/LaTeXML,63.27 MB
72,speedread,1205,102,1205,12,02/03/2014,11/06/2024,565.00 KB,A simple terminal-based open source Spritz-alike (per-word RSVP aligned on optimal reading points),Perl,https://github.com/pasky/speedread,565.00 KB
73,rainbarf,1200,65,1200,2,30/01/2013,03/06/2022,160.00 KB,"it's like Rainmeter, but for CLI!",Perl,https://github.com/creaktive/rainbarf,160.00 KB
74,Monitorix,1188,172,1188,45,22/10/2012,10/02/2026,4.36 MB,"Monitorix is a free, open source, lightweight system monitoring tool.",Perl,https://github.com/mikaku/Monitorix,4.36 MB
75,ora2pg,1175,374,1175,90,12/03/2012,19/02/2026,13.91 MB,"Ora2Pg is a free tool used to migrate an Oracle database to a PostgreSQL compatible schema. It connects your Oracle database, scan it automatically and extracts its structure or data, it then generates SQL scripts that you can load into PostgreSQL.",Perl,https://github.com/darold/ora2pg,13.91 MB
76,convos,1158,91,1158,47,30/11/2013,14/02/2026,51.42 MB, Convos :busts_in_silhouette: is the simplest way to use IRC in your browser,Perl,https://github.com/convos-chat/convos,51.42 MB
77,thinkpad-ec,1144,121,1144,101,23/04/2016,11/05/2025,849.00 KB,Infrastructure for examining and patching Thinkpad embedded controller firmware,Perl,https://github.com/hamishcoleman/thinkpad-ec,849.00 KB
78,Golang-Regex-Tutorial,1142,139,1142,1,08/09/2012,01/02/2023,107.00 KB,Golang - Regular Expression Tutorial,Perl,https://github.com/StefanSchroeder/Golang-Regex-Tutorial,107.00 KB
79,asciiquarium,1131,92,1131,18,14/12/2011,25/08/2023,108.00 KB,Enjoy the mysteries of the sea from the safety of your own terminal!,Perl,https://github.com/cmatsuoka/asciiquarium,108.00 KB
80,git-cal,1120,61,1120,18,22/09/2013,01/02/2017,518.00 KB,github like contributions calendar on terminal,Perl,https://github.com/k4rthik/git-cal,518.00 KB
81,dotdotpwn,1104,184,1104,2,10/02/2012,28/09/2022,88.00 KB,DotDotPwn - The Directory Traversal Fuzzer,Perl,https://github.com/wireghoul/dotdotpwn,88.00 KB
82,rt,1099,279,1099,79,07/07/2009,18/02/2026,197.95 MB,"Request Tracker, an enterprise-grade issue tracking system",Perl,https://github.com/bestpractical/rt,197.95 MB
83,sortphotos,1094,319,1094,60,06/03/2013,28/03/2023,5.34 MB,SortPhotos is a Python script that organizes photos and videos into folders using date/time information,Perl,https://github.com/andrewning/sortphotos,5.34 MB
84,AirChat,1092,149,1092,18,23/04/2014,09/12/2021,919.00 KB,Free Communications For Everyone.,Perl,https://github.com/lulzlabs/AirChat,919.00 KB
85,asbru-cm,1084,142,1084,129,23/08/2017,09/12/2025,9.18 MB,Ásbrú Connection Manager is a user interface that helps organizing remote terminal sessions and automating repetitive tasks.,Perl,https://github.com/asbru-cm/asbru-cm,9.18 MB
86,lm-sensors,1082,292,1082,303,20/12/2011,01/06/2024,20.04 MB,lm-sensors repository,Perl,https://github.com/lm-sensors/lm-sensors,20.04 MB
87,lcov,1073,263,1073,8,27/05/2014,12/02/2026,2.40 MB,LCOV,Perl,https://github.com/linux-test-project/lcov,2.40 MB
88,MultiMarkdown,1069,515,1069,5,20/06/2009,12/08/2023,1.93 MB,Expanded perl version of John Gruber's original Markdown --- No longer under active development since MMD 3,Perl,https://github.com/fletcher/MultiMarkdown,1.93 MB
89,nodebrew,1066,65,1066,17,15/11/2011,19/03/2022,222.00 KB,Node.js version manager,Perl,https://github.com/hokaccha/nodebrew,222.00 KB
90,broadcom-bt-firmware,1049,146,1049,15,28/07/2016,15/02/2024,1.01 MB,Repository for various Broadcom Bluetooth firmware,Perl,https://github.com/winterheart/broadcom-bt-firmware,1.01 MB
91,contrib,1048,670,1048,56,12/07/2011,18/02/2026,14.95 MB,"Contributed stuff for munin (plugins, tools, etc...)",Perl,https://github.com/munin-monitoring/contrib,14.95 MB
92,vanilla,1045,215,1045,3,12/08/2015,09/01/2019,1.86 MB,An OpenResty Lua MVC Web Framework,Perl,https://github.com/idevz/vanilla,1.86 MB
93,xcode_shell,1037,392,1037,1,24/09/2012,07/09/2019,61.00 KB,shell script that used to auto-build xcode project,Perl,https://github.com/webfrogs/xcode_shell,61.00 KB
94,halflife-list,1015,97,1015,0,10/06/2021,16/02/2026,166.05 MB,ABP/ublock 广告过滤规则（每周一早上 8 点更新）,Perl,https://github.com/sbwml/halflife-list,166.05 MB
95,musicbrainz-server,999,319,999,82,01/06/2010,18/02/2026,301.98 MB,"Server for the MusicBrainz project (website, API, database tools)",Perl,https://github.com/metabrainz/musicbrainz-server,301.98 MB
96,sysadmin-util,993,114,993,0,14/04/2013,30/03/2020,112.00 KB,Tools for Linux/Unix sysadmins.,Perl,https://github.com/skx/sysadmin-util,112.00 KB
97,zeroclickinfo-goodies,991,1736,991,0,06/08/2011,14/10/2022,22.14 MB,DuckDuckGo Instant Answers based on Perl & JavaScript,Perl,https://github.com/duckduckgo/zeroclickinfo-goodies,22.14 MB
98,clusterssh,973,77,973,35,11/08/2009,17/02/2026,1.85 MB,Cluster SSH - Cluster Admin Via SSH,Perl,https://github.com/duncs/clusterssh,1.85 MB
99,stow,965,50,965,41,09/11/2011,03/12/2025,1.23 MB,GNU Stow - mirror of savannah git repository occasionally with more bleeding-edge branches,Perl,https://github.com/aspiers/stow,1.23 MB
100,authentic-theme,958,162,958,11,22/09/2014,15/02/2026,463.90 MB,Official theme for the best server management panel of the 21st Century,Perl,https://github.com/webmin/authentic-theme,463.90 MB
101,prokka,957,236,957,241,26/03/2014,06/01/2026,408.24 MB,:zap: :aquarius: Rapid prokaryotic genome annotation,Perl,https://github.com/tseemann/prokka,408.24 MB
102,gdown.pl,942,187,942,5,22/09/2014,12/05/2023,38.00 KB,Google Drive direct download of big files,Perl,https://github.com/circulosmeos/gdown.pl,38.00 KB
103,gitprep,935,120,935,9,23/11/2012,19/02/2026,5.22 MB,Portable GitHub system into your own server,Perl,https://github.com/yuki-kimoto/gitprep,5.22 MB
104,st,933,67,933,13,02/09/2013,25/05/2023,69.00 KB,simple statistics from the command line,Perl,https://github.com/nferraz/st,69.00 KB
105,defects4j,931,365,931,55,17/04/2015,11/10/2025,146.70 MB,A Database of Real Faults and an Experimental Infrastructure to Enable Controlled Experiments in Software Engineering Research,Perl,https://github.com/rjust/defects4j,146.70 MB
106,vmware-scripts,931,505,931,55,22/11/2013,08/02/2026,1.82 MB,Various scripts for VMware based solutions,Perl,https://github.com/lamw/vmware-scripts,1.82 MB
107,altium2kicad,929,159,929,77,06/10/2014,04/06/2023,9.40 MB,Altium to KiCad converter for PCB and schematics,Perl,https://github.com/thesourcerer8/altium2kicad,9.40 MB
108,dejavu-fonts,886,125,886,64,17/05/2015,15/05/2024,332.67 MB,,Perl,https://github.com/dejavu-fonts/dejavu-fonts,332.67 MB
109,trinityrnaseq,882,321,882,308,07/08/2014,07/02/2025,276.75 MB,Trinity RNA-Seq de novo transcriptome assembly,Perl,https://github.com/trinityrnaseq/trinityrnaseq,276.75 MB
110,hw-probe,879,76,879,71,29/11/2015,03/05/2025,1.57 MB,"Probe for hardware, check operability and find drivers",Perl,https://github.com/linuxhw/hw-probe,1.57 MB
111,XcodeCoverage,859,307,859,1,29/11/2012,14/10/2022,539.00 KB,Code coverage for Xcode projects (Objective-C only),Perl,https://github.com/jonreid/XcodeCoverage,539.00 KB
112,netdisco,833,95,833,55,04/01/2017,21/01/2026,10.73 MB,A web-based network management tool.,Perl,https://github.com/netdisco/netdisco,10.73 MB
113,trizen,823,42,823,56,17/02/2011,11/08/2025,878.00 KB,Lightweight AUR Package Manager,Perl,https://github.com/trizen/trizen,878.00 KB
114,dotphiles,819,380,819,4,21/06/2012,07/05/2023,4.46 MB,A community driven framework of dotfiles.,Perl,https://github.com/dotphiles/dotphiles,4.46 MB
115,bugzilla,808,312,808,33,12/03/2014,19/02/2026,73.34 MB,Official repository for the Bugzilla bug tracking system. Report bugs to https://bugzilla.mozilla.org/enter_bug.cgi?product=Bugzilla&format=__default__ . Main website:,Perl,https://github.com/bugzilla/bugzilla,73.34 MB
116,git-deploy,806,59,806,20,07/11/2011,24/06/2017,738.00 KB,Tool to manage using git as a deployment management tool,Perl,https://github.com/git-deploy/git-deploy,738.00 KB
117,PadBuster,803,230,803,8,11/04/2011,13/07/2024,18.00 KB,Automated script for performing Padding Oracle attacks,Perl,https://github.com/strozfriedberg/PadBuster,18.00 KB
118,ack3,802,70,802,148,03/03/2017,19/08/2025,3.19 MB,ack is a grep-like search tool optimized for source code.,Perl,https://github.com/beyondgrep/ack3,3.19 MB
119,innotop,798,123,798,26,17/10/2014,22/10/2025,1.81 MB,A realtime terminal-based top-like monitor for MySQL,Perl,https://github.com/innotop/innotop,1.81 MB
120,IoTSeeker,796,234,796,4,31/10/2016,13/02/2025,15.00 KB,Created by Jin Qian via the GitHub Connector,Perl,https://github.com/rapid7/IoTSeeker,15.00 KB
121,ack1,796,95,796,0,01/03/2009,30/08/2013,2.42 MB,"This repository is for ack 1.x, which is **no longer being maintained**.  DO NOT SUBMIT ISSUES HERE.  ack 2.0 has a new GitHub project at",Perl,https://github.com/beyondgrep/ack1,2.42 MB
122,bucardo,792,107,792,51,08/05/2009,31/05/2025,9.31 MB,Bucardo multimaster and master/slave Postgres replication,Perl,https://github.com/bucardo/bucardo,9.31 MB
123,cpanminus,779,210,779,144,19/02/2010,24/01/2025,5.58 MB,"cpanminus - get, unpack, build and install modules from CPAN ",Perl,https://github.com/miyagawa/cpanminus,5.58 MB
124,zsh-autoenv,756,29,756,8,08/09/2013,21/06/2024,181.00 KB,Autoenv for zsh,Perl,https://github.com/Tarrasch/zsh-autoenv,181.00 KB
125,urxvt-perls,751,108,751,7,02/08/2010,19/07/2020,97.00 KB,Perl extensions for the rxvt-unicode terminal emulator,Perl,https://github.com/xyb3rt/urxvt-perls,97.00 KB
126,opencv-haar-classifier-training,736,465,736,10,12/07/2013,06/01/2020,38.00 KB,Learn how to train your own OpenCV Haar classifier,Perl,https://github.com/mrnugget/opencv-haar-classifier-training,38.00 KB
127,App-perlbrew,736,229,736,197,27/02/2010,25/11/2025,4.46 MB,Manage perl installations in your $HOME,Perl,https://github.com/gugod/App-perlbrew,4.46 MB
128,feedgnuplot,734,38,734,4,20/12/2009,28/01/2026,1.43 MB,"Tool to plot realtime and stored data from the commandline, using gnuplot.",Perl,https://github.com/dkogan/feedgnuplot,1.43 MB
129,Rex,730,220,730,212,05/11/2010,08/02/2026,9.06 MB,"Rex, the friendly automation framework",Perl,https://github.com/RexOps/Rex,9.06 MB
130,Dancer,727,203,727,86,18/07/2009,26/01/2026,6.69 MB,The easiest way to write web applications with Perl (Perl web micro-framework),Perl,https://github.com/PerlDancer/Dancer,6.69 MB
131,ctf-tools,726,421,726,4,13/10/2015,05/02/2021,215.80 MB,tổng hợp tool ctf,Perl,https://github.com/truongkma/ctf-tools,215.80 MB
132,cdhit,718,131,718,116,04/05/2015,11/10/2022,3.16 MB,Automatically exported from code.google.com/p/cdhit,Perl,https://github.com/weizhongli/cdhit,3.16 MB
133,dotfiles,711,92,711,0,02/12/2009,19/02/2026,23.48 MB,":floppy_disk:  Ian's dotfiles, utils, and Zsh/Vim/tmux configs",Perl,https://github.com/statico/dotfiles,23.48 MB
134,stapxx,710,204,710,21,09/08/2013,09/05/2022,327.00 KB,Simple macro language extentions to systemtap,Perl,https://github.com/openresty/stapxx,327.00 KB
135,awesome-perl,706,101,706,5,13/07/2014,07/08/2024,159.00 KB,A curated list of awesome Perl frameworks and libraries. Come on Pull Requests!,Perl,https://github.com/hachiojipm/awesome-perl,159.00 KB
136,vyatta-wireguard,703,37,703,45,19/04/2017,04/05/2020,10.16 MB,,Perl,https://github.com/Lochnair/vyatta-wireguard,10.16 MB
137,abi-compliance-checker,689,86,689,74,08/03/2012,06/06/2024,2.03 MB,A tool for checking backward API/ABI compatibility of a C/C++ library,Perl,https://github.com/lvc/abi-compliance-checker,2.03 MB
138,mlf,688,244,688,3,13/01/2014,13/12/2015,5.32 MB,大数据机器学习框架,Perl,https://github.com/huichen/mlf,5.32 MB
139,RegRipper3.0,683,145,683,6,27/05/2020,12/12/2024,5.60 MB,RegRipper3.0,Perl,https://github.com/keydet89/RegRipper3.0,5.60 MB
