Ranking,Project Name,Stars,Forks,Watchers,Open Issues,Created At,Last Commit,Size,Description,Language,Repo URL,Size
280,fetch-master-6000,311,29,311,0,02/04/2021,10/08/2023,2.04 MB,Simple Dilbert themed system info-fetching tool,Perl,https://github.com/anhsirk0/fetch-master-6000,2.04 MB
281,metacpan-api,310,195,310,114,30/10/2010,10/02/2026,6.38 MB,"A free, open API for everything you want to know about CPAN",Perl,https://github.com/metacpan/metacpan-api,6.38 MB
282,RecordStream,305,31,305,10,24/09/2010,29/06/2020,19.27 MB,commandline tools for slicing and dicing JSON records.,Perl,https://github.com/benbernard/RecordStream,19.27 MB
283,dockside,304,22,304,6,12/09/2021,19/11/2025,7.83 MB,"Create dev containers that mirror your prod environment. Develop over SSH, using VS Code/Jet Brains, or code right from your browser. Stage any number of containers to showcase your work to co-workers and clients. Dockside is an open source 'Codespaces' that runs on local machine, on prem, or in the cloud.",Perl,https://github.com/newsnowlabs/dockside,7.83 MB
284,latex2html,302,44,302,20,27/06/2016,31/01/2026,2.75 MB,Converts LaTeX documents to HTML,Perl,https://github.com/latex2html/latex2html,2.75 MB
285,DEPRECATED-bc,302,374,302,9,14/07/2013,26/07/2016,74.44 MB,DEPRECATED: This repository is now frozen - please see individual lesson repositories.,Perl,https://github.com/swcarpentry/DEPRECATED-bc,74.44 MB
286,TransDecoder,301,64,301,32,25/01/2015,29/09/2025,18.79 MB,TransDecoder source,Perl,https://github.com/TransDecoder/TransDecoder,18.79 MB
287,SuperSlicer_to_Orca_scripts,300,23,300,16,30/07/2023,10/03/2024,143.00 KB,Script(s) to convert SuperSlicer data for use in Orca Slicer,Perl,https://github.com/theophile/SuperSlicer_to_Orca_scripts,143.00 KB
288,fierce-domain-scanner,300,91,300,1,07/05/2013,18/07/2019,18.00 KB,Fierce.pl Domain Scanner,Perl,https://github.com/davidpepper/fierce-domain-scanner,18.00 KB
289,LANraragi_cn,296,17,296,4,03/10/2020,07/02/2023,14.36 MB,"This repo is a fork of Difegue / LANraragi , those things i've done was to translate this repo into chinese ,and fix chrome browser js problem.",Perl,https://github.com/uparrows/LANraragi_cn,14.36 MB
290,Starman,296,81,296,57,12/01/2010,11/02/2024,293.00 KB,Starman is a high-performance preforking Perl PSGI web server,Perl,https://github.com/miyagawa/Starman,293.00 KB
291,RepeatMasker,291,50,291,26,17/04/2017,17/12/2025,117.52 MB,RepeatMasker is a program that screens DNA sequences for interspersed repeats and low complexity DNA sequences.,Perl,https://github.com/Dfam-consortium/RepeatMasker,117.52 MB
292,mrtg,291,69,291,13,08/02/2016,23/05/2025,3.35 MB,MRTG - Multi Router Traffic Grapher,Perl,https://github.com/oetiker/mrtg,3.35 MB
293,git-number,289,26,289,14,24/03/2011,20/01/2026,89.00 KB,Use numbers for dealing with files in git,Perl,https://github.com/holygeek/git-number,89.00 KB
294,hexchat-addons,288,97,288,0,31/07/2012,02/05/2023,28.56 MB,Plugins and scripts made for HexChat,Perl,https://github.com/hexchat/hexchat-addons,28.56 MB
295,sympa,287,123,287,251,19/01/2017,11/02/2026,221.70 MB,"Sympa, Mailing List Management Software",Perl,https://github.com/sympa-community/sympa,221.70 MB
296,lingua-sinica-perlyuyan,284,27,284,1,30/10/2009,10/01/2015,146.00 KB,Perl in Classical Chinese in Perl,Perl,https://github.com/audreyt/lingua-sinica-perlyuyan,146.00 KB
297,csf-firewall,284,54,284,18,06/06/2024,19/02/2026,56.80 MB,ConfigServer Security & Firewall (CSF) - Robust linux iptables/nftables firewall & free ipset blocklist service.,Perl,https://github.com/Aetherinox/csf-firewall,56.80 MB
298,GrowingBugRepository,283,189,283,9,21/01/2021,01/04/2025,5.45 GB,A bug repository that keeps growing,Perl,https://github.com/liuhuigmail/GrowingBugRepository,5.45 GB
299,hsxkpasswd,281,47,281,18,09/05/2014,21/09/2024,35.57 MB,A Perl module and terminal command for generating secure memorable passwords inspired by the fabulous XKCD web comic and Steve Gibson's Password Hay Stacks. This is the library that powers www.xkpasswd.net,Perl,https://github.com/bbusschots/hsxkpasswd,35.57 MB
300,barrnap,280,45,280,24,03/08/2013,10/01/2026,65.08 MB,:microscope: :leo: Bacterial ribosomal RNA predictor,Perl,https://github.com/tseemann/barrnap,65.08 MB
301,fink,277,76,277,60,29/09/2011,22/09/2025,12.51 MB,The fink package manager,Perl,https://github.com/fink/fink,12.51 MB
302,rperl,277,33,277,30,04/01/2013,12/01/2021,76.26 MB,RPerl Compiler,Perl,https://github.com/wbraswell/rperl,76.26 MB
303,thinkpad-bios-software-flashing-guide,276,24,276,3,05/11/2019,15/02/2021,502.00 KB,flashing coreboot on thinkpads without external programmer,Perl,https://github.com/gch1p/thinkpad-bios-software-flashing-guide,502.00 KB
304,eep,275,68,275,1,22/03/2010,13/02/2026,1.29 MB,Erlang Enhancement Proposals,Perl,https://github.com/erlang/eep,1.29 MB
305,icons,275,64,275,29,26/06/2016,20/01/2024,15.40 MB,Source files for the custom icon-font used by the File-Icons package.,Perl,https://github.com/file-icons/icons,15.40 MB
306,archive,274,135,274,1,01/01/2015,25/06/2021,2.22 MB,Deprecated tools from HackMySQL.com,Perl,https://github.com/hackmysql/archive,2.22 MB
307,codeviz,274,70,274,0,23/07/2015,17/06/2019,2.43 MB,CodeViz: A CallGraph Visualiser,Perl,https://github.com/petersenna/codeviz,2.43 MB
308,defcon-vm,273,56,273,0,06/08/2016,06/09/2016,13.80 MB,Files from my DEFCON CTF VM.,Perl,https://github.com/fuzyll/defcon-vm,13.80 MB
309,resty-cli,270,59,270,10,25/11/2014,18/12/2025,265.00 KB,Fancy command-line utilities for OpenResty,Perl,https://github.com/openresty/resty-cli,265.00 KB
310,realtimeconfigquickscan,270,25,270,0,12/11/2012,07/12/2021,49.00 KB,Linux configuration checker for systems to be used for real-time audio,Perl,https://github.com/raboof/realtimeconfigquickscan,49.00 KB
311,h2c,269,23,269,5,28/08/2017,27/06/2022,54.00 KB,"headers 2 curl. Provided a set of HTTP request headers, output the curl command line for generating that set. Try the converter online at",Perl,https://github.com/curl/h2c,54.00 KB
312,openresty-devel-utils,268,115,268,2,09/08/2011,24/10/2025,347.00 KB,Utilities for nginx module development,Perl,https://github.com/openresty/openresty-devel-utils,347.00 KB
313,catalyst-runtime,268,100,268,35,29/12/2008,08/02/2025,13.59 MB,The Elegant MVC Web Application Framework,Perl,https://github.com/perl-catalyst/catalyst-runtime,13.59 MB
314,xv6-book,268,68,268,20,09/09/2016,10/08/2020,3.49 MB,Commentary for xv6-public,Perl,https://github.com/mit-pdos/xv6-book,3.49 MB
315,dotfiles,268,65,268,0,08/10/2010,09/09/2025,2.30 MB,My dotfiles. My Precious.,Perl,https://github.com/tangledhelix/dotfiles,2.30 MB
316,yandex-music-download,267,33,267,7,27/02/2014,06/11/2024,3.33 MB,Yandex Music Downloader,Perl,https://github.com/kaimi-io/yandex-music-download,3.33 MB
317,js-in-ten-minutes,266,16,266,1,08/05/2010,20/03/2013,2.46 MB,JavaScript in Ten (arbitrarily long) Minutes,Perl,https://github.com/spencertipping/js-in-ten-minutes,2.46 MB
318,mlst,266,55,266,32,03/05/2014,02/01/2026,204.58 MB,:id: Scan contig files against PubMLST typing schemes,Perl,https://github.com/tseemann/mlst,204.58 MB
319,fusioninventory-agent,265,125,265,65,08/04/2010,09/08/2023,33.72 MB,FusionInventory Agent,Perl,https://github.com/fusioninventory/fusioninventory-agent,33.72 MB
320,github-keygen,260,26,260,26,11/05/2011,21/06/2025,831.00 KB,Easy creation and upgrade of secure SSH configuration for your GitHub account(s),Perl,https://github.com/dolmen/github-keygen,831.00 KB
321,payphone,260,13,260,0,06/04/2013,10/04/2023,211.00 KB,notes and code for my payphone project,Perl,https://github.com/jcs/payphone,211.00 KB
322,clatd,257,23,257,2,10/03/2014,23/03/2025,150.00 KB,A 464XLAT CLAT implementation for Linux,Perl,https://github.com/toreanderson/clatd,150.00 KB
323,Perl-LanguageServer,256,53,256,52,03/05/2019,11/01/2025,1.79 MB,Language Server for Perl,Perl,https://github.com/richterger/Perl-LanguageServer,1.79 MB
324,shovill,255,47,255,21,05/09/2016,13/12/2025,12.17 MB,⚡♠️ Assemble bacterial isolate genomes from Illumina paired-end reads,Perl,https://github.com/tseemann/shovill,12.17 MB
325,bobby-tables,255,84,255,28,17/09/2009,23/08/2023,519.00 KB,"bobby-tables.com, the site for preventing SQL injections",Perl,https://github.com/petdance/bobby-tables,519.00 KB
326,asterisk-speech-recog,254,131,254,8,28/12/2011,17/02/2018,390.00 KB,Speech recognition script for Asterisk that uses google's speech engine.,Perl,https://github.com/zaf/asterisk-speech-recog,390.00 KB
327,collectd-web,254,73,254,2,11/04/2009,26/01/2026,1.63 MB,Collectd-web is a web-based front-end for RRD data collected by collectd,Perl,https://github.com/httpdss/collectd-web,1.63 MB
328,pkgdiff,252,53,252,30,26/01/2012,11/01/2025,6.73 MB,A tool for visualizing changes in Linux software packages,Perl,https://github.com/lvc/pkgdiff,6.73 MB
329,pgdsat,251,16,251,4,08/04/2024,19/02/2026,373.00 KB,PostgreSQL Database Security Assessment Tool,Perl,https://github.com/HexaCluster/pgdsat,373.00 KB
330,phptop,251,8,251,0,01/07/2013,04/11/2025,112.00 KB,"PHP basic ressource profiler (CPU/memory), safe and useful for production sites",Perl,https://github.com/bearstech/phptop,112.00 KB
331,zbx-smartctl,251,128,251,49,30/12/2015,06/11/2023,249.00 KB,Templates and scripts for monitoring disks health with Zabbix and smartmontools,Perl,https://github.com/v-zhuravlev/zbx-smartctl,249.00 KB
332,lua-resty-iputils,251,87,251,7,15/11/2014,03/05/2022,22.00 KB,Utility functions for working with IP addresses in Openresty,Perl,https://github.com/hamishforbes/lua-resty-iputils,22.00 KB
333,rla-es,249,52,249,15,21/07/2014,26/11/2025,7.67 MB,Recursos lingüísticos abiertos del español,Perl,https://github.com/sbosio/rla-es,7.67 MB
334,STAR-Fusion,248,82,248,152,13/04/2015,04/10/2025,196.66 MB,STAR-Fusion codebase,Perl,https://github.com/STAR-Fusion/STAR-Fusion,196.66 MB
335,nginx_ajp_module,246,63,246,24,26/05/2010,20/02/2024,422.00 KB,support AJP protocol proxy with Nginx,Perl,https://github.com/yaoweibin/nginx_ajp_module,422.00 KB
336,ntppool,245,146,245,47,12/07/2008,02/02/2026,3.78 MB,NTP Pool Project,Perl,https://github.com/abh/ntppool,3.78 MB
337,sendemail,245,79,245,34,12/09/2010,25/04/2024,608.00 KB,"lightweight, command line SMTP email client",Perl,https://github.com/mogaal/sendemail,608.00 KB
338,ACLPUB,243,236,243,12,03/03/2019,01/05/2025,12.34 MB,The official tool for creating proceedings for conferences of the Association for Computational Linguistics (ACL).,Perl,https://github.com/acl-org/ACLPUB,12.34 MB
339,infinitude,242,50,242,1,04/02/2013,08/02/2025,2.88 MB,Open control of Carrier/Bryant thermostats,Perl,https://github.com/nebulous/infinitude,2.88 MB
340,misterhouse,242,129,242,45,30/10/2012,21/01/2026,27.43 MB,"Perl open source home automation program. It's fun, it's free, and it's entirely geeky.",Perl,https://github.com/hollie/misterhouse,27.43 MB
341,dmarcts-report-parser,242,69,242,16,01/03/2016,19/08/2023,196.00 KB,"A Perl based tool to parse DMARC reports from an IMAP mailbox or from the filesystem, and insert the information into a database. ( Formerly known as imap-dmarcts )",Perl,https://github.com/techsneeze/dmarcts-report-parser,196.00 KB
342,get-flash-videos,242,65,242,25,03/04/2010,29/11/2020,1.19 MB,"Download or play videos from various Flash-based video hosting sites, without having to use the Flash player.",Perl,https://github.com/monsieurvideo/get-flash-videos,1.19 MB
343,rdp-sec-check,241,48,241,6,29/05/2015,29/03/2024,19.00 KB,rdp-sec-check is a Perl script to enumerate security settings of an RDP Service (AKA Terminal Services),Perl,https://github.com/CiscoCXSecurity/rdp-sec-check,19.00 KB
344,uroman,238,23,238,16,27/06/2018,26/07/2024,5.06 MB,Universal Romanizer that can convert any unicode script to roman (latin) script,Perl,https://github.com/isi-nlp/uroman,5.06 MB
345,qemu-server,238,61,238,2,09/12/2012,19/02/2026,5.14 MB,Proxmox VE's Virtual Machine Manager,Perl,https://github.com/proxmox/qemu-server,5.14 MB
346,emails,236,2,236,0,11/01/2024,25/01/2026,120.00 KB,emails I received,Perl,https://github.com/bagder/emails,120.00 KB
347,yaml-test-suite,236,82,236,50,08/12/2016,25/12/2025,4.45 MB,"Comprehensive, language independent Test Suite for YAML",Perl,https://github.com/yaml/yaml-test-suite,4.45 MB
348,lancache,235,44,235,0,09/10/2015,30/05/2019,20.00 KB,Dynamically Cache Game Installs at LAN’s using Nginx,Perl,https://github.com/multiplay/lancache,20.00 KB
349,minion,234,57,234,23,27/03/2014,22/08/2025,5.80 MB,:octopus: Perl high performance job queue,Perl,https://github.com/mojolicious/minion,5.80 MB
350,logos,233,37,233,21,28/01/2018,13/10/2025,533.00 KB,Preprocessor that simplifies Objective-C hooking.,Perl,https://github.com/theos/logos,533.00 KB
351,mib2zabbix,233,84,233,18,01/06/2016,15/07/2022,24.00 KB,SNMP Template generator for Zabbix,Perl,https://github.com/zabbix-tools/mib2zabbix,24.00 KB
352,Netdot,232,63,232,68,09/05/2011,11/02/2022,33.15 MB,Network Documentation Tool,Perl,https://github.com/cvicente/Netdot,33.15 MB
353,git-foresta,232,10,232,7,04/05/2017,15/05/2017,438.00 KB,git-foresta: Text-based git log graph viewer,Perl,https://github.com/takaaki-kasai/git-foresta,438.00 KB
354,serge,231,50,231,29,11/06/2014,13/06/2024,1.62 MB,Continuous localization platform,Perl,https://github.com/serge-community/serge,1.62 MB
355,RepeatModeler,231,25,231,20,05/04/2017,21/07/2025,1.17 MB,De-Novo Repeat Discovery Tool,Perl,https://github.com/Dfam-consortium/RepeatModeler,1.17 MB
356,Gekko-BacktestTool,230,82,230,36,25/02/2018,14/03/2020,2.66 MB,"Batch backtest, import and strategy params optimalization for Gekko Trading Bot. With one command you will run any number of backtests.",Perl,https://github.com/xFFFFF/Gekko-BacktestTool,2.66 MB
357,gas-preprocessor,230,294,230,16,01/10/2009,10/04/2013,240.00 KB,Perl script that implements a subset of the GNU as preprocessor that Apple's as doesn't,Perl,https://github.com/yuvi/gas-preprocessor,240.00 KB
358,GrowthForecast,230,43,230,3,18/11/2011,24/07/2023,5.66 MB,Lightning Fast Graphing/Visualization,Perl,https://github.com/kazeburo/GrowthForecast,5.66 MB
359,massive-octo-spice,229,60,229,0,06/01/2014,16/01/2018,1.90 MB,DEPRECATED - USE v3 (bearded-avenger),Perl,https://github.com/csirtgadgets/massive-octo-spice,1.90 MB
360,zm-build,228,102,228,13,22/03/2017,04/02/2026,14.74 MB,"zm-build for Zimbra Collaboration Suite, FOSS Edition",Perl,https://github.com/Zimbra/zm-build,14.74 MB
361,FLEXLoader,227,39,227,1,09/08/2014,23/03/2021,4.10 MB,A jailbreak iOS device tweak which can load FLEX dynamiclly,Perl,https://github.com/XueshiQiao/FLEXLoader,4.10 MB
362,Hacksby,226,39,226,5,20/01/2013,26/01/2013,375.00 KB,Description and unofficial implementation of Furby's audio protocol,Perl,https://github.com/iafan/Hacksby,375.00 KB
363,clerk,224,11,224,5,22/07/2014,04/06/2025,1.32 MB,"clerk - mpd client, based on rofi/fzf",Perl,https://github.com/carnager/clerk,1.32 MB
364,PerlPowerTools,224,55,224,15,12/09/2014,15/02/2026,6.99 MB,Perl Power Tools,Perl,https://github.com/briandfoy/PerlPowerTools,6.99 MB
365,perl-friday,223,10,223,0,29/11/2019,17/02/2022,4.00 KB,Perl code that is syntactically correct only on Fridays,Perl,https://github.com/jwilk-archive/perl-friday,4.00 KB
366,nix-serve,223,41,223,17,04/07/2013,24/11/2025,81.00 KB,A standalone Nix binary cache server,Perl,https://github.com/edolstra/nix-serve,81.00 KB
367,pcsc-tools,223,64,223,2,10/04/2015,16/02/2026,2.69 MB,Some tools to be used with smart cards and PC/SC,Perl,https://github.com/LudovicRousseau/pcsc-tools,2.69 MB
368,filebuster,223,48,223,2,06/10/2015,25/02/2023,945.00 KB,An extremely fast and flexible web fuzzer,Perl,https://github.com/henshin/filebuster,945.00 KB
369,vidir,223,11,223,7,22/10/2011,08/06/2024,19.00 KB,edit directory in $EDITOR (better than vim . with netrw),Perl,https://github.com/trapd00r/vidir,19.00 KB
370,asterisk-googletts,222,127,222,6,28/11/2011,17/02/2024,166.00 KB,Asterisk AGI script that uses Google's translate text to speech service.,Perl,https://github.com/zaf/asterisk-googletts,166.00 KB
371,urxvt-resize-font,222,36,222,3,06/11/2012,27/07/2020,21.00 KB,URxvt Perl extension for resizing the font,Perl,https://github.com/simmel/urxvt-resize-font,21.00 KB
372,mtk-tools,221,176,221,2,31/07/2012,15/08/2018,824.00 KB,"Unpack / repack MT65xx/MT83xx boot.img, recovery.img or logo.bin",Perl,https://github.com/bgcngm/mtk-tools,824.00 KB
373,towncrier,220,18,220,10,15/04/2014,13/10/2022,343.00 KB,A status dashboard,Perl,https://github.com/fastmail/towncrier,343.00 KB
374,cowsay,219,31,219,22,01/08/2016,24/12/2025,338.00 KB,apjanke's fork of the classic cowsay project,Perl,https://github.com/cowsay-org/cowsay,338.00 KB
375,network-testing,219,11,219,2,10/05/2017,01/08/2022,134.00 KB,"This is a small collection of GPLv3-licensed tools to assist an intrepid researcher in testing the performance of networks, wired or wireless.",Perl,https://github.com/jimsalterjrs/network-testing,134.00 KB
376,NGenomeSyn,218,20,218,5,31/03/2022,04/07/2025,18.88 MB,Any Way to Show  Multi genomic Synteny ,Perl,https://github.com/hewm2008/NGenomeSyn,18.88 MB
377,METABOLIC,218,53,218,125,28/08/2019,27/01/2025,191.04 MB,A scalable high-throughput metabolic and biogeochemical functional trait profiler,Perl,https://github.com/AnantharamanLab/METABOLIC,191.04 MB
378,tools,217,51,217,6,16/05/2014,18/02/2026,33.21 MB,Various utilities for processing the data.,Perl,https://github.com/UniversalDependencies/tools,33.21 MB
379,exobrain,217,25,217,38,22/06/2013,04/01/2017,350.00 KB,Automate your life with Exobrain,Perl,https://github.com/pjf/exobrain,350.00 KB
380,GAAS,217,46,217,11,09/03/2016,18/12/2023,30.02 MB,Genome Assembly and Annotation Service code,Perl,https://github.com/NBISweden/GAAS,30.02 MB
381,Introducing-Regular-Expressions,216,136,216,4,25/10/2011,21/08/2012,141.00 KB,Example code and target text files for the O'Reilly book Introducing Regular Expressions,Perl,https://github.com/michaeljamesfitzgerald/Introducing-Regular-Expressions,141.00 KB
382,nginx-openid-connect,216,94,216,27,16/03/2018,11/02/2026,166.00 KB,Reference implementation of OpenID Connect integration for NGINX Plus,Perl,https://github.com/nginxinc/nginx-openid-connect,166.00 KB
383,lstu,216,31,216,1,21/09/2013,02/09/2025,2.90 MB,Lightweight URL shortener. Read-only mirror of https://framagit.org/fiat-tux/hat-softwares/lstu,Perl,https://github.com/ldidry/lstu,2.90 MB
384,pacmanager,215,51,215,63,03/03/2011,14/08/2023,1.80 MB,"Perl/GTK Gnome SSH GUI on steroids. Configure SSH/Telnet connections: users, passwords, EXPECT regular expressions, macros, ...",Perl,https://github.com/perseo22/pacmanager,1.80 MB
385,LTR_retriever,215,42,215,7,18/05/2017,25/06/2025,52.66 MB,LTR_retriever is a highly accurate and sensitive program for identification of LTR retrotransposons; The LTR Assembly Index (LAI) is also included in this package.,Perl,https://github.com/oushujun/LTR_retriever,52.66 MB
386,ColoredConsole,215,11,215,4,17/08/2019,01/01/2020,1.03 MB,Reenabling colors in Xcode's console,Perl,https://github.com/jjrscott/ColoredConsole,1.03 MB
387,github-growler,214,10,214,4,14/03/2009,31/10/2011,1.04 MB,Growl github updates,Perl,https://github.com/miyagawa/github-growler,1.04 MB
388,HostDB,214,31,214,4,30/10/2013,25/04/2022,3.43 MB,HostDB: a new tool to help manage data center inventory and write applications around it. ,Perl,https://github.com/Flipkart/HostDB,3.43 MB
389,hack_autosar,213,67,213,0,18/05/2021,29/06/2022,161.00 KB,"learning autosar documents, aha, very hard!",Perl,https://github.com/GreyZhang/hack_autosar,161.00 KB
390,md2inao,213,32,213,18,01/03/2013,07/03/2023,922.00 KB,Convert markdown to inao-format for WEB+DB PRESS,Perl,https://github.com/naoya/md2inao,922.00 KB
391,void-bspwm-dotfiles,212,15,212,7,16/11/2017,03/05/2023,9.10 MB,My personal backup of my dotfiles (Void Linux).,Perl,https://github.com/addy-dclxvi/void-bspwm-dotfiles,9.10 MB
392,johnny-deps,212,7,212,3,19/07/2013,15/12/2020,79.00 KB,Barebones dependency manager for Go.,Perl,https://github.com/VividCortex/johnny-deps,79.00 KB
393,velocity-painting,211,32,211,4,06/02/2017,15/04/2017,4.35 MB,#VelocityPainting: patterning 3D prints by modulating the print speed,Perl,https://github.com/MarkWheadon/velocity-painting,4.35 MB
394,libwww-perl,211,129,211,143,19/01/2009,25/01/2026,7.36 MB,"The libwww-perl collection is a set of Perl modules that provides a simple, consistent application programming interface to the World-Wide Web. The main focus of the library is providing classes and functions allowing to write WWW clients. It also contains modules that are of more general use and even classes to help implement simple HTTP servers.",Perl,https://github.com/libwww-perl/libwww-perl,7.36 MB
395,elsa,211,51,211,31,09/09/2014,22/12/2018,1.00 MB,Enterprise Log Search and Archive,Perl,https://github.com/mcholste/elsa,1.00 MB
396,dotfiles,210,199,210,0,30/08/2010,08/08/2020,1.19 MB,Dotfiles,Perl,https://github.com/justone/dotfiles,1.19 MB
397,amusewiki,210,27,210,20,01/03/2014,27/12/2025,42.44 MB,Text::Amuse-based publishing platform,Perl,https://github.com/melmothx/amusewiki,42.44 MB
398,dreamwidth,210,181,210,376,08/05/2012,18/02/2026,102.21 MB,Dreamwidth's open source repository,Perl,https://github.com/dreamwidth/dreamwidth,102.21 MB
399,git-autofixup,209,9,209,0,25/05/2017,02/02/2026,301.00 KB,create fixup commits for topic branches,Perl,https://github.com/torbiak/git-autofixup,301.00 KB
400,perlweeklychallenge-club,209,346,209,6,30/03/2019,19/02/2026,148.76 MB,"Knowledge base for The Weekly Challenge club members using Perl, Raku, Ada, APL, Awk, Bash, BASIC, Bc, Befunge-93, Bourne Shell, BQN, Brainfuck, C3, C, CESIL, C++, C#, Clojure, COBOL, Coconut, Crystal, D, Dart, Dc, Elm, Emacs Lisp, Erlang, Excel VBA, Fennel, Fish, Forth, Fortran, Gembase, GNAT, Go, Haskell, Haxe, HTML, Idris, IO, J, Janet, Java, JavaScript, Julia, Kotlin, Lisp, Lua, M4, Miranda, Modula 3, MMIX, Mumps, Myrddin, Nim, Nix, Node.js, Nuweb, OCaml, Odin, Ook, Pascal, PHP, Python, Postscript, Prolog, R, Ring, Ruby, Rust, Scala, Scheme, Sed, Smalltalk, SQL, Swift, Tcl, TypeScript, Visual BASIC, WebAssembly, Wolfram, XSLT and Zig.",Perl,https://github.com/manwar/perlweeklychallenge-club,148.76 MB
401,vMass,209,48,209,0,25/08/2022,05/06/2023,79.00 KB,vMass Bot :hook: Vulnerability Scanner & Auto Exploiter Tool Written in Perl.,Perl,https://github.com/aziz0x48/vMass,79.00 KB
402,google-cloud-pricing-cost-calculator,208,40,208,46,09/02/2022,19/02/2026,25.93 MB,"💸 Calculate estimated monthly costs of Google Cloud Platform products and resources via YAML files and CLI program (Linux, macOS, Windows)",Perl,https://github.com/Cyclenerd/google-cloud-pricing-cost-calculator,25.93 MB
403,homedir,208,20,208,0,09/08/2012,03/02/2026,8.57 MB,My home directory dotfiles and customizations,Perl,https://github.com/brandon-rhodes/homedir,8.57 MB
404,lua-resty-jit-uuid,207,41,207,0,23/03/2016,10/01/2020,89.00 KB,Fast and dependency-free UUID library for LuaJIT/ngx_lua,Perl,https://github.com/thibaultcha/lua-resty-jit-uuid,89.00 KB
405,dockerana,207,26,207,19,08/06/2014,21/06/2015,2.61 MB,Docker Monitoring with support for Grafana and Graphite,Perl,https://github.com/dockerana/dockerana,2.61 MB
406,shocco,206,38,206,16,10/03/2010,21/02/2018,63.00 KB,"shocco is  a quick-and-dirty, literate-programming-style documentation generator for / in POSIX shell",Perl,https://github.com/rtomayko/shocco,63.00 KB
407,dklab_realsync,204,42,204,20,22/10/2011,18/11/2021,5.47 MB,dkLab RealSync: replicate developer's files over SSH in realtime,Perl,https://github.com/dimikot/dklab_realsync,5.47 MB
408,difff,204,12,204,1,21/10/2012,07/11/2025,194.00 KB,Webベースのテキスト比較ツール difff《ﾃﾞｭﾌﾌ》,Perl,https://github.com/meso-cacase/difff,194.00 KB
409,LISA,203,27,203,6,05/07/2018,15/05/2019,2.39 MB,Linguistically-Informed Self-Attention implemented in TensorFlow,Perl,https://github.com/strubell/LISA,2.39 MB
410,LDBlockShow,203,44,203,8,24/02/2020,05/07/2025,25.81 MB,LDBlockShow: a fast and convenient tool for visualizing linkage disequilibrium and haplotype blocks based on VCF files,Perl,https://github.com/BGI-shenzhen/LDBlockShow,25.81 MB
411,abi-tracker,203,16,203,14,08/09/2015,04/10/2021,256.00 KB,A tool to visualize ABI changes timeline of a C/C++ software library,Perl,https://github.com/lvc/abi-tracker,256.00 KB
412,abi-dumper,202,37,202,27,24/05/2013,11/01/2025,710.00 KB,Dump ABI of an ELF object containing DWARF debug info,Perl,https://github.com/lvc/abi-dumper,710.00 KB
413,dj_voice_organize,202,15,202,7,06/08/2018,26/08/2018,424.00 KB,同人音声资料库系统,Perl,https://github.com/bandiaozimu/dj_voice_organize,424.00 KB
414,squid-windows,202,41,202,39,07/11/2014,29/09/2024,505.13 MB,Squid Proxy built for Microsoft Windows,Perl,https://github.com/diladele/squid-windows,505.13 MB
415,gmusicbrowser,201,42,201,122,27/08/2009,14/08/2024,7.93 MB,jukebox for large collections of music,Perl,https://github.com/squentin/gmusicbrowser,7.93 MB
416,asemica,201,16,201,1,28/01/2011,24/08/2020,92.00 KB,An asemic Markov-chained cipher,Perl,https://github.com/linenoise/asemica,92.00 KB
417,Perl-Critic,201,107,201,395,22/07/2013,23/10/2024,19.69 MB,"The leading static analyzer for Perl.  Configurable, extensible, powerful.",Perl,https://github.com/Perl-Critic/Perl-Critic,19.69 MB
418,VarDict,201,65,201,43,15/07/2014,05/01/2024,1.46 MB,VarDict,Perl,https://github.com/AstraZeneca-NGS/VarDict,1.46 MB
419,lua-resty-etcd,200,56,200,19,09/04/2019,11/04/2024,294.00 KB,Nonblocking Lua etcd driver library for OpenResty,Perl,https://github.com/api7/lua-resty-etcd,294.00 KB
420,v5,200,64,200,52,23/04/2016,06/11/2024,30.53 MB,MailScanner v5,Perl,https://github.com/MailScanner/v5,30.53 MB
421,donna,200,41,200,5,12/10/2024,04/01/2025,830.00 KB,OpenAI x PearVC hackathon (built in 6 hours),Perl,https://github.com/raviriley/donna,830.00 KB
