Ranking,Project Name,Stars,Forks,Watchers,Open Issues,Created At,Last Commit,Size,Size (KB),Description,Language,Repo URL
542,scotch-box,2684,535,2684,43,07/10/2014,25/05/2018,81.00 KB,81,Scotch Box is a preconfigured Vagrant Box with a full array of LAMP Stack features to get you up and running with Vagrant in no time.,PHP,https://github.com/scotch-io/scotch-box
543,ui,2681,474,2681,0,28/05/2019,25/02/2025,308.00 KB,308,Laravel UI utilities and presets.,PHP,https://github.com/laravel/ui
544,WordPress-Coding-Standards,2680,519,2680,250,02/05/2011,30/09/2025,6.56 MB,6713,PHP_CodeSniffer rules (sniffs) to enforce WordPress coding conventions,PHP,https://github.com/WordPress/WordPress-Coding-Standards
545,validator,2677,104,2677,5,22/02/2011,02/10/2025,12.59 MB,12889,Provides tools to validate values,PHP,https://github.com/symfony/validator
546,flash,2674,359,2674,38,30/06/2014,06/02/2025,77.00 KB,77,Easy flash notifications,PHP,https://github.com/laracasts/flash
547,laravel-responsecache,2673,236,2673,0,16/07/2015,08/09/2025,848.00 KB,848,Speed up a Laravel app by caching the entire response,PHP,https://github.com/spatie/laravel-responsecache
548,error-handler,2672,18,2672,1,18/07/2019,27/09/2025,999.00 KB,999,Provides tools to manage errors and ease debugging PHP code,PHP,https://github.com/symfony/error-handler
549,vito,2667,342,2667,8,02/07/2023,01/10/2025,12.44 MB,12743,Free and Self-Hosted  Server Management Tool,PHP,https://github.com/vitodeploy/vito
550,php-option,2665,64,2665,4,05/11/2012,21/08/2025,164.00 KB,164,Option Type for PHP,PHP,https://github.com/schmittjoh/php-option
551,klein.php,2664,288,2664,94,04/04/2011,30/01/2024,1.75 MB,1792,A fast & flexible router,PHP,https://github.com/klein/klein.php
552,crawler,2661,366,2661,1,02/11/2015,08/09/2025,518.00 KB,518,"An easy to use,  powerful crawler implemented in PHP. Can execute Javascript.",PHP,https://github.com/spatie/crawler
553,Pimple,2659,305,2659,0,15/06/2009,21/03/2024,268.00 KB,268,A small PHP dependency injection container,PHP,https://github.com/silexphp/Pimple
554,gptlink,2651,374,2651,5,22/05/2023,27/03/2024,19.36 MB,19824,10分钟搭建可免费商用的AI对话环境，搭建简单，包含用户，订单，任务，付费等功能,PHP,https://github.com/gptlink/gptlink
555,rocketeer,2645,217,2645,132,22/06/2013,05/09/2020,4.68 MB,4789,Send your projects up in the clouds,PHP,https://github.com/rocketeers/rocketeer
556,maccms10,2642,902,2642,22,08/07/2019,27/09/2025,9.81 MB,10048,"苹果cms官网,苹果cmsv10,maccmsv10,麦克cms,开源cms,内容管理系统,视频分享程序,分集剧情程序,网址导航程序,文章程序,漫画程序,图片程序",PHP,https://github.com/magicblack/maccms10
557,intl,2638,51,2638,0,22/04/2013,01/10/2025,33.23 MB,34025,Provides access to the localization data of the ICU library,PHP,https://github.com/symfony/intl
558,service-contracts,2632,9,2632,0,27/05/2019,21/07/2025,108.00 KB,108,A set of service abstractions extracted out of the Symfony components,PHP,https://github.com/symfony/service-contracts
559,IP-Tracer,2629,479,2629,2,06/08/2018,21/09/2024,171.00 KB,171,Track any ip address with IP-Tracer. IP-Tracer is developed for Linux and Termux. you can retrieve any ip address information using IP-Tracer. ,PHP,https://github.com/rajkumardusad/IP-Tracer
560,php-must-watch,2616,205,2616,0,25/02/2015,18/10/2018,33.00 KB,33,list of interesting conference talks and videos on PHP - ,PHP,https://github.com/phptodayorg/php-must-watch
561,xhprof,2614,921,2614,35,02/04/2009,28/05/2019,1.68 MB,1723,XHProf is a function-level hierarchical profiler for PHP and has a simple HTML based user interface.,PHP,https://github.com/phacility/xhprof
562,glide,2611,205,2611,42,22/12/2014,25/03/2025,753.00 KB,753,Wonderfully easy on-demand image manipulation library with an HTTP based API.,PHP,https://github.com/thephpleague/glide
563,translation-contracts,2608,3,2608,0,27/05/2019,21/07/2025,108.00 KB,108,A set of translation abstractions extracted out of the Symfony components,PHP,https://github.com/symfony/translation-contracts
564,pdfparser,2604,565,2604,197,30/08/2013,04/09/2025,64.70 MB,66250,"PdfParser, a standalone PHP library, provides various tools to extract data from a PDF file.",PHP,https://github.com/smalot/pdfparser
565,revisionable,2603,348,2603,122,06/03/2013,16/02/2025,299.00 KB,299,Easily create a revision history for any laravel model,PHP,https://github.com/VentureCraft/revisionable
566,polyfill-intl-icu,2603,7,2603,1,22/10/2015,19/08/2025,154.00 KB,154,Symfony polyfill for intl's ICU-related data and classes,PHP,https://github.com/symfony/polyfill-intl-icu
567,Open-Web-Analytics,2603,480,2603,115,01/04/2012,07/09/2025,16.64 MB,17035,Official repository for Open Web Analytics which is an open source alternative to commercial tools such as Google Analytics. Stay in control of the data you collect about the use of your website or app.  Please consider sponsoring this project.,PHP,https://github.com/Open-Web-Analytics/Open-Web-Analytics
568,boost,2603,156,2603,51,15/07/2025,02/10/2025,1004.00 KB,1004,Laravel-focused MCP server for augmenting your AI powered local development experience.,PHP,https://github.com/laravel/boost
569,versionpress,2602,240,2602,231,19/10/2015,23/07/2024,7.42 MB,7598,Git-based version control for WordPress. Whoa!,PHP,https://github.com/versionpress/versionpress
570,monolog-bridge,2595,23,2595,0,25/10/2011,27/09/2025,876.00 KB,876,Provides integration for Monolog with various Symfony components,PHP,https://github.com/symfony/monolog-bridge
571,multi-tenant,2594,400,2594,76,23/07/2015,11/05/2024,1.55 MB,1586,"Run multiple websites using the same Laravel installation while keeping tenant specific data separated for fully independent multi-domain setups, previously github.com/hyn/multi-tenant",PHP,https://github.com/tenancy/multi-tenant
572,httplug,2588,39,2588,1,25/04/2015,23/09/2024,195.00 KB,195,"HTTPlug, the HTTP client abstraction for PHP",PHP,https://github.com/php-http/httplug
573,LexikJWTAuthenticationBundle,2572,619,2572,113,10/04/2014,02/09/2025,1.52 MB,1555,JWT authentication for your Symfony API,PHP,https://github.com/lexik/LexikJWTAuthenticationBundle
574,valet,2570,721,2570,2,03/05/2016,16/09/2025,86.15 MB,88218,A more enjoyable local development experience for Mac.,PHP,https://github.com/laravel/valet
575,php-reverse-shell,2566,1872,2566,25,29/05/2015,07/08/2024,140.00 KB,140,,PHP,https://github.com/pentestmonkey/php-reverse-shell
576,PhpMetrics,2566,266,2566,3,13/12/2013,25/09/2025,108.66 MB,111268,Beautiful and understandable static analysis tool for PHP,PHP,https://github.com/phpmetrics/PhpMetrics
577,demo,2564,1689,2564,24,24/03/2015,23/09/2025,22.32 MB,22855,Symfony Demo Application,PHP,https://github.com/symfony/demo
578,p0wny-shell,2562,673,2562,3,09/11/2016,11/08/2025,111.00 KB,111,Single-file PHP shell,PHP,https://github.com/flozz/p0wny-shell
579,Awesome-TTRSS,2558,492,2558,25,13/07/2017,08/09/2025,3.39 MB,3468,"🐋 Awesome TTRSS, a powerful Dockerised all-in-one RSS solution.",PHP,https://github.com/HenryQW/Awesome-TTRSS
580,phpipam,2557,766,2557,1840,18/06/2015,24/03/2025,26.23 MB,26859,phpipam development repository,PHP,https://github.com/phpipam/phpipam
581,laravel-messenger,2550,521,2550,3,29/10/2014,09/03/2025,401.00 KB,401,Simple user messaging package for Laravel,PHP,https://github.com/cmgmyr/laravel-messenger
582,captcha,2544,469,2544,133,27/03/2013,16/04/2025,1.24 MB,1273,Captcha for Laravel 5+,PHP,https://github.com/mewebstudio/captcha
583,closure,2543,93,2543,0,10/02/2014,08/07/2025,526.00 KB,526,"Serialize closures, anonymous classes, and arbitrary data",PHP,https://github.com/opis/closure
584,serializer,2541,79,2541,0,22/02/2011,02/10/2025,4.89 MB,5008,"Handles serializing and deserializing data structures, including object graphs, into array structures or other formats like XML and JSON.",PHP,https://github.com/symfony/serializer
585,xdebug-handler,2539,33,2539,0,22/11/2017,03/09/2025,361.00 KB,361,Restart a CLI process without loading the xdebug extension.,PHP,https://github.com/composer/xdebug-handler
586,alice,2536,328,2536,49,27/10/2012,30/09/2025,5.23 MB,5358,Expressive fixtures generator,PHP,https://github.com/nelmio/alice
587,filament-shield,2532,259,2532,10,02/01/2022,13/09/2025,1.10 MB,1124,"The easiest and most intuitive way to add access management to your Filament Panel; Resources, Pages & Widgets through `spatie/laravel-permission`",PHP,https://github.com/bezhanSalleh/filament-shield
588,core,2526,933,2526,227,19/01/2015,01/10/2025,56.99 MB,58362,The server component of API Platform: hypermedia and GraphQL APIs in minutes,PHP,https://github.com/api-platform/core
589,laravel-sitemap,2525,293,2525,0,12/08/2016,08/09/2025,625.00 KB,625,Create and generate sitemaps with ease,PHP,https://github.com/spatie/laravel-sitemap
590,espocrm,2521,733,2521,53,25/09/2014,02/10/2025,82.99 MB,84986,EspoCRM – Open Source CRM Application,PHP,https://github.com/espocrm/espocrm
591,twig-bridge,2520,49,2520,0,04/04/2011,24/09/2025,3.27 MB,3344,Provides integration for Twig with various Symfony components,PHP,https://github.com/symfony/twig-bridge
592,webman,2517,244,2517,103,26/04/2020,13/09/2025,314.00 KB,314,Probably the fastest PHP web framework in the world.,PHP,https://github.com/walkor/webman
593,chrome,2515,303,2515,22,17/11/2017,27/08/2025,571.00 KB,571,Instrument headless chrome/chromium instances from PHP,PHP,https://github.com/chrome-php/chrome
594,twig-bundle,2510,25,2510,0,25/10/2011,02/10/2025,2.01 MB,2063,Provides a tight integration of Twig into the Symfony full-stack framework,PHP,https://github.com/symfony/twig-bundle
595,CMS,2510,800,2510,8,19/07/2013,28/06/2016,7.25 MB,7420,A PHP CMS powered by Laravel 5 and Sentry,PHP,https://github.com/BootstrapCMS/CMS
596,30-seconds-of-php,2508,307,2508,0,03/06/2018,22/01/2021,2.99 MB,3062,Short PHP code snippets for all your development needs,PHP,https://github.com/Chalarangelo/30-seconds-of-php
597,DoctrineFixturesBundle,2508,211,2508,37,22/04/2011,18/08/2025,574.00 KB,574,Symfony integration for the doctrine/data-fixtures library ,PHP,https://github.com/doctrine/DoctrineFixturesBundle
598,security-bundle,2498,28,2498,0,25/10/2011,02/10/2025,3.97 MB,4066,Provides a tight integration of the Security component into the Symfony full-stack framework,PHP,https://github.com/symfony/security-bundle
599,link,2493,13,2493,0,04/08/2016,21/06/2022,32.00 KB,32,A repository for the PSR-13 [Hyperlink] interface,PHP,https://github.com/php-fig/link
600,laravel.io,2491,667,2491,9,17/09/2013,02/10/2025,29.87 MB,30588,The Laravel.io Community Portal.,PHP,https://github.com/laravelio/laravel.io
601,cashier-stripe,2484,709,2484,7,04/03/2014,25/09/2025,46.97 MB,48098,"Laravel Cashier provides an expressive, fluent interface to Stripe's subscription billing services.",PHP,https://github.com/laravel/cashier-stripe
602,phpunit-bridge,2475,47,2475,0,21/02/2015,01/10/2025,1.41 MB,1447,"Provides utilities for PHPUnit, especially user deprecation notices management",PHP,https://github.com/symfony/phpunit-bridge
603,larecipe,2472,270,2472,27,29/07/2018,30/09/2025,6.62 MB,6781,✏️ Write and ship beautiful documentation with your Laravel applications using MarkDown,PHP,https://github.com/saleem-hadad/larecipe
604,Gaufrette,2472,354,2472,87,18/01/2011,25/09/2025,2.30 MB,2355,PHP library that provides a filesystem abstraction layer − will be a feast for your files!,PHP,https://github.com/KnpLabs/Gaufrette
605,mochat,2469,518,2469,9,18/01/2021,15/09/2025,7.33 MB,7508,基于企业微信的开源SCRM应用开发框架&引擎，也是一套通用的企业私域流量管理系统!,PHP,https://github.com/mochat-cloud/mochat
606,safe,2464,164,2464,30,03/09/2018,16/05/2025,2.81 MB,2882,"All PHP functions, rewritten to throw exceptions instead of returning false",PHP,https://github.com/thecodingmachine/safe
607,termwind,2459,88,2459,14,26/09/2021,08/05/2025,8.79 MB,9002,"🍃 In short, it's like Tailwind CSS, but for the PHP command-line applications. ",PHP,https://github.com/nunomaduro/termwind
608,laravel-page-speed,2455,291,2455,48,10/09/2017,12/08/2024,216.00 KB,216,Package to optimize your site automatically which results in a 35%+ optimization,PHP,https://github.com/renatomarinho/laravel-page-speed
609,Stringy,2453,216,2453,32,09/07/2013,09/01/2022,1.42 MB,1459,A PHP string manipulation library with multibyte support,PHP,https://github.com/danielstjules/Stringy
610,laravel-shop,2449,784,2449,25,12/06/2018,07/01/2023,8.30 MB,8504,Laravel 电商实战教程的项目代码,PHP,https://github.com/summerblue/laravel-shop
611,promise,2448,150,2448,0,24/10/2012,19/08/2025,835.00 KB,835,Promises/A implementation for PHP.,PHP,https://github.com/reactphp/promise
612,GeoIP2-php,2445,288,2445,2,07/05/2013,01/10/2025,5.40 MB,5531,PHP API for GeoIP2 webservice client and database reader ,PHP,https://github.com/maxmind/GeoIP2-php
613,Laravel-5-Generators-Extended,2439,347,2439,31,26/02/2015,03/04/2024,138.00 KB,138,This package extends the core file generators that are included with Laravel 5,PHP,https://github.com/laracasts/Laravel-5-Generators-Extended
614,assert,2429,187,2429,45,20/05/2012,11/09/2025,785.00 KB,785,Thin assertion library for use in libraries and business-model,PHP,https://github.com/beberlei/assert
615,DirectoryLister,2416,523,2416,26,16/02/2011,01/10/2025,6.66 MB,6818,📂 Directory Lister is the easiest way to expose the contents of any web-accessible folder for browsing and sharing.,PHP,https://github.com/DirectoryLister/DirectoryLister
616,PHPVerbalExpressions,2415,143,2415,2,22/07/2013,13/06/2020,83.00 KB,83,PHP Regular expressions made easy,PHP,https://github.com/VerbalExpressions/PHPVerbalExpressions
617,paratest,2410,243,2410,8,17/10/2012,02/10/2025,2.82 MB,2890,:computer: Parallel testing for PHPUnit,PHP,https://github.com/paratestphp/paratest
618,PHPCI,2410,434,2410,226,10/05/2013,11/06/2020,8.49 MB,8696,PHPCI is a free and open source continuous integration tool specifically designed for PHP.,PHP,https://github.com/dancryer/PHPCI
619,plugin-update-checker,2410,437,2410,96,06/11/2012,25/09/2025,1.13 MB,1157,"A custom update checker for WordPress plugins. Useful if you don't want to host your project in the official WP repository, but would still like it to support automatic updates. Despite the name, it also works with themes.",PHP,https://github.com/YahnisElsts/plugin-update-checker
620,PHP,2407,536,2407,4,04/07/2020,11/01/2025,397.00 KB,397,All Algorithms implemented in PHP,PHP,https://github.com/TheAlgorithms/PHP
621,skeleton,2396,169,2396,8,06/12/2016,11/12/2023,38.00 KB,38,Standard PHP package skeleton.,PHP,https://github.com/php-pds/skeleton
622,phpfastcache,2396,453,2396,6,27/04/2013,30/04/2025,21.30 MB,21813,"A high-performance backend cache system.  It is intended for use in speeding up dynamic web applications by alleviating database load.  Well implemented, it can drops the database load to almost nothing, yielding faster page load times for users, better resource utilization.  It is simple yet powerful. ",PHP,https://github.com/PHPSocialNetwork/phpfastcache
623,polyfill-php73,2393,8,2393,0,25/04/2018,19/08/2025,26.00 KB,26,Symfony polyfill backporting some PHP 7.3+ features to lower PHP versions,PHP,https://github.com/symfony/polyfill-php73
624,LogViewer,2390,349,2390,22,01/09/2015,25/07/2024,1.45 MB,1484,:page_with_curl: Provides a log viewer for Laravel,PHP,https://github.com/ARCANEDEV/LogViewer
625,math-php,2387,242,2387,56,03/04/2016,30/09/2025,5.79 MB,5931,"Powerful modern math library for PHP: Features descriptive statistics and regressions; Continuous and discrete probability distributions; Linear algebra with matrices and vectors, Numerical analysis; special mathematical functions; Algebra",PHP,https://github.com/markrogoyski/math-php
626,phpmd,2387,343,2387,153,29/01/2011,07/04/2025,7.93 MB,8123,PHPMD is a spin-off project of PHP Depend and aims to be a PHP equivalent of the well known Java tool PMD. PHPMD can be seen as an user friendly frontend application for the raw metrics stream measured by PHP Depend.,PHP,https://github.com/phpmd/phpmd
627,firebase-php,2381,450,2381,17,07/01/2015,29/09/2025,4.25 MB,4357,Unofficial Firebase Admin SDK for PHP,PHP,https://github.com/kreait/firebase-php
628,cache-contracts,2373,7,2373,0,27/05/2019,21/07/2025,74.00 KB,74,A set of cache abstractions extracted out of the Symfony components,PHP,https://github.com/symfony/cache-contracts
629,drush,2369,1103,2369,468,16/01/2012,02/10/2025,122.39 MB,125329,"Drush is a command-line shell and scripting interface for Drupal, a veritable Swiss Army knife designed to make life easier for those who spend their working hours hacking away at the command prompt.",PHP,https://github.com/drush-ops/drush
630,blade-icons,2364,158,2364,1,30/08/2016,08/08/2025,552.00 KB,552,A package to easily make use of SVG icons in your Laravel Blade views.,PHP,https://github.com/driesvints/blade-icons
631,debug-bundle,2363,11,2363,0,26/09/2014,02/10/2025,371.00 KB,371,Provides a tight integration of the Symfony VarDumper component and the ServerLogCommand from MonologBridge into the Symfony full-stack framework,PHP,https://github.com/symfony/debug-bundle
632,laravel-translatable,2361,294,2361,3,07/04/2016,08/09/2025,352.00 KB,352,Making Eloquent models translatable,PHP,https://github.com/spatie/laravel-translatable
633,oauth2-server-laravel,2359,529,2359,11,03/10/2013,18/08/2023,746.00 KB,746,An OAuth 2.0 bridge for Laravel and Lumen [DEPRECATED FOR LARAVEL 5.3+],PHP,https://github.com/lucadegasperi/oauth2-server-laravel
634,open-ai,2359,302,2359,29,21/12/2021,12/03/2025,2.07 MB,2119,"OpenAI PHP SDK : Most downloaded, forked, contributed, huge community supported, and used PHP (Laravel , Symfony, Yii, Cake PHP or any PHP framework) SDK for OpenAI GPT-3 and DALL-E. It also supports chatGPT-like streaming. (ChatGPT AI is supported)",PHP,https://github.com/orhanerday/open-ai
635,upscheme,2358,4,2358,1,09/03/2020,01/01/2025,440.00 KB,440,Database migrations and schema updates made easy,PHP,https://github.com/aimeos/upscheme
636,payment,2356,670,2356,40,15/06/2016,01/12/2022,1.33 MB,1358,Payment是php版本的支付聚合第三方sdk，集成了微信支付、支付宝支付、招商一网通支付。提供统一的调用接口，方便快速接入各种支付、查询、退款、转账能力。服务端接入支付功能，方便、快捷。,PHP,https://github.com/helei112g/payment
637,chatify,2347,488,2347,1,30/12/2019,06/11/2024,4.28 MB,4384,"Laravel's #1 one-to-one chatting system package, helps you add a complete real-time chatting system to your new/existing Laravel application with only one command.",PHP,https://github.com/munafio/chatify
638,phploc,2346,164,2346,0,22/01/2009,12/04/2025,21.62 MB,22142,A tool for quickly measuring the size of a PHP project.,PHP,https://github.com/sebastianbergmann/phploc
639,serializer,2342,588,2342,168,01/12/2012,04/08/2025,5.04 MB,5160,"Library for (de-)serializing data of any complexity (supports JSON, and XML)",PHP,https://github.com/schmittjoh/serializer
640,CodeIgniter-Ion-Auth,2337,1121,2337,14,20/01/2010,02/11/2024,3.14 MB,3216,Simple and Lightweight Auth System for CodeIgniter,PHP,https://github.com/benedmunds/CodeIgniter-Ion-Auth
641,smarty,2335,714,2335,104,30/10/2014,26/08/2025,23.78 MB,24354,"Smarty is a template engine for PHP, facilitating the separation of presentation (HTML/CSS) from application logic.",PHP,https://github.com/smarty-php/smarty
642,package-skeleton-laravel,2333,657,2333,0,04/06/2015,08/09/2025,509.00 KB,509,A skeleton repository for Spatie's Laravel Packages,PHP,https://github.com/spatie/package-skeleton-laravel
643,laravel-model-caching,2329,231,2329,8,17/09/2017,23/07/2025,2.19 MB,2246,Eloquent model-caching made easy.,PHP,https://github.com/mikebronner/laravel-model-caching
644,laravel-breadcrumbs,2328,411,2328,1,28/04/2013,18/10/2020,791.00 KB,791,Please see the Diglactic fork.,PHP,https://github.com/d13r/laravel-breadcrumbs
645,saloon,2328,112,2328,32,08/10/2021,21/06/2025,3.35 MB,3429,🤠 Build beautiful API integrations and SDKs with Saloon,PHP,https://github.com/saloonphp/saloon
646,phpsocket.io,2324,513,2324,56,06/08/2015,08/04/2025,411.00 KB,411,A server side alternative implementation of socket.io in PHP based on workerman.,PHP,https://github.com/walkor/phpsocket.io
647,inertia-laravel,2321,264,2321,9,07/03/2019,28/09/2025,536.00 KB,536,The Laravel adapter for Inertia.js.,PHP,https://github.com/inertiajs/inertia-laravel
648,redbean,2316,277,2316,4,29/05/2009,29/05/2025,8.06 MB,8251,"ORM layer that creates models, config and database on the fly",PHP,https://github.com/gabordemooij/redbean
649,HWIOAuthBundle,2311,793,2311,2,02/03/2012,05/09/2025,3.68 MB,3770,OAuth client integration for Symfony. Supports both OAuth1.0a and OAuth2.,PHP,https://github.com/hwi/HWIOAuthBundle
650,DaybydayCRM,2309,772,2309,28,14/01/2016,08/03/2025,17.49 MB,17905,"DaybydayCRM an open-source CRM, to help you keep track of your daily workflow.",PHP,https://github.com/Bottelet/DaybydayCRM
651,php-langspec,2305,272,2305,21,28/07/2014,04/05/2024,1.82 MB,1867,PHP Language Specification,PHP,https://github.com/php/php-langspec
652,GoogleAuthenticator,2302,717,2302,60,11/03/2012,30/04/2024,39.00 KB,39,PHP class to generate and verify Google Authenticator 2-factor authentication,PHP,https://github.com/PHPGangsta/GoogleAuthenticator
653,NelmioApiDocBundle,2299,877,2299,115,12/04/2012,29/09/2025,23.70 MB,24272,Generates documentation for your REST API from attributes,PHP,https://github.com/nelmio/NelmioApiDocBundle
654,event-dispatcher,2280,20,2280,2,24/04/2018,04/04/2024,33.00 KB,33,,PHP,https://github.com/php-fig/event-dispatcher
655,vuedo,2278,535,2278,24,15/07/2016,01/10/2020,1014.00 KB,1014,"Vuedo is a blog platform, built with Laravel and Vue.js.",PHP,https://github.com/Vuedo/vuedo
656,wizard,2278,358,2278,107,27/07/2017,22/03/2023,14.63 MB,14981,Wizard是一款开源的文档管理工具，支持Markdown/Swagger/Table类型的文档。,PHP,https://github.com/mylxsw/wizard
657,pingcrm,2278,825,2278,6,05/03/2019,06/02/2025,2.31 MB,2364,A demo application to illustrate how Inertia.js works.,PHP,https://github.com/inertiajs/pingcrm
658,symfony-docs,2272,5265,2272,185,17/02/2010,02/10/2025,92.73 MB,94954,The Symfony documentation,PHP,https://github.com/symfony/symfony-docs
659,Elastica,2268,731,2268,114,19/10/2010,01/10/2025,24.41 MB,24997,Elastica is a PHP client for elasticsearch,PHP,https://github.com/ruflin/Elastica
660,laratrust,2265,384,2265,12,25/05/2016,11/09/2025,1.91 MB,1955,Handle roles and permissions in your Laravel application,PHP,https://github.com/santigarcor/laratrust
661,fast-excel,2260,261,2260,92,05/04/2018,18/02/2025,229.00 KB,229,🦉 Fast Excel import/export for Laravel,PHP,https://github.com/rap2hpoutre/fast-excel
662,PHPCompatibility,2257,204,2257,82,03/03/2012,19/09/2025,11.08 MB,11343,PHP Compatibility check for PHP_CodeSniffer,PHP,https://github.com/PHPCompatibility/PHPCompatibility
663,icon-workshop,2250,224,2250,14,05/05/2018,06/11/2021,13.36 MB,13676,图标工场 - 移动应用图标生成工具，一键生成所有尺寸的应用图标和启动图,PHP,https://github.com/zhanghuanchong/icon-workshop
664,php-gui,2249,175,2249,35,25/03/2016,29/05/2022,139.99 MB,143353,Extensionless PHP Graphic User Interface library,PHP,https://github.com/gabrielrcouto/php-gui
665,FruityWifi,2246,504,2246,50,13/10/2013,18/12/2021,1.21 MB,1236,"FruityWiFi is a wireless network auditing tool. The application can be installed in any Debian based system (Jessie) adding the extra packages. Tested in Debian, Kali Linux, Kali Linux ARM (Raspberry Pi), Raspbian (Raspberry Pi), Pwnpi (Raspberry Pi), Bugtraq, NetHunter.",PHP,https://github.com/xtr4nge/FruityWifi
666,PHP-backdoors,2246,471,2246,1,06/05/2016,09/03/2024,15.20 MB,15568,A collection of PHP backdoors. For educational or testing purposes only.,PHP,https://github.com/bartblaze/PHP-backdoors
667,php-qrcode,2244,321,2244,2,30/11/2015,19/09/2025,24.48 MB,25065,A PHP QR Code generator and reader with a user-friendly API.,PHP,https://github.com/chillerlan/php-qrcode
668,data-transfer-object,2238,187,2238,0,18/10/2018,01/11/2022,453.00 KB,453,Data transfer objects with batteries included,PHP,https://github.com/spatie/data-transfer-object
669,baum,2237,458,2237,160,04/05/2013,11/06/2024,638.00 KB,638,Baum is an implementation of the Nested Set pattern for Laravel's Eloquent ORM.,PHP,https://github.com/etrepat/baum
670,ThinkAdmin,2231,844,2231,12,13/02/2017,15/09/2025,70.23 MB,71911,基于 ThinkPHP6&8 的极简后台管理系统，内置注解权限、异步多任务、应用插件生态等，支持类 PaaS 更新公共模块和应用插件，插件可本地化定制开发。,PHP,https://github.com/zoujingli/ThinkAdmin
671,OLAINDEX,2227,594,2227,10,29/09/2018,06/05/2025,3.81 MB,3897,✨ Another OneDrive Directory Index,PHP,https://github.com/WangNingkai/OLAINDEX
672,laravel-impersonate,2226,225,2226,79,10/02/2017,24/02/2025,148.00 KB,148,Laravel Impersonate is a plugin that allows you to authenticate as your users.,PHP,https://github.com/404labfr/laravel-impersonate
673,property-info,2225,13,2225,0,26/09/2015,27/09/2025,1.23 MB,1264,Extracts information about PHP class' properties using metadata of popular sources,PHP,https://github.com/symfony/property-info
674,boinc,2223,492,2223,469,03/02/2015,03/10/2025,278.16 MB,284833,Open-source software for volunteer computing and grid computing.,PHP,https://github.com/BOINC/boinc
675,php-generator,2222,146,2222,4,13/03/2014,06/08/2025,1.01 MB,1036,🐘 Generates neat PHP code for you. Supports new PHP 8.5 features.,PHP,https://github.com/nette/php-generator
676,invobook,2215,618,2215,5,13/02/2017,11/09/2025,3.17 MB,3249,"Self-hosted app for Time Tracking, Invoice Generation, Project & Client Management, built with Laravel & Filament.",PHP,https://github.com/Hasnayeen/invobook
