Ranking,Project Name,Stars,Forks,Watchers,Open Issues,Created At,Last Commit,Size,Size (KB),Description,Language,Repo URL
273,easyswoole,4764,509,4764,34,15/03/2017,19/09/2025,2.87 MB,2937,"swoole,easyswoole,swoole framework",PHP,https://github.com/easy-swoole/easyswoole
274,mediawiki,4755,1480,4755,0,01/11/2012,03/10/2025,2.34 GB,2453023,🌻 The collaborative editing software that runs Wikipedia. Mirror from https://gerrit.wikimedia.org/g/mediawiki/core. See https://mediawiki.org/wiki/Developer_access for contributing.,PHP,https://github.com/wikimedia/mediawiki
275,migrations,4740,392,4740,127,23/03/2010,19/08/2025,5.01 MB,5127,Doctrine Database Migrations Library,PHP,https://github.com/doctrine/migrations
276,platform,4701,666,4701,164,15/11/2016,10/09/2025,123.22 MB,126175,"Orchid is a @laravel package that allows for rapid application development of back-office applications, admin/user panels, and dashboards.",PHP,https://github.com/orchidsoftware/platform
277,qr-code,4689,764,4689,9,27/10/2012,13/07/2025,14.76 MB,15114,QR Code Generator,PHP,https://github.com/endroid/qr-code
278,graphql-php,4686,570,4686,57,15/07/2015,02/10/2025,8.43 MB,8631,PHP implementation of the GraphQL specification based on the reference implementation in JavaScript,PHP,https://github.com/webonyx/graphql-php
279,agent,4686,507,4686,84,10/08/2013,05/08/2024,232.00 KB,232,"👮 A PHP desktop/mobile user agent parser with support for Laravel, based on Mobiledetect",PHP,https://github.com/jenssegers/agent
280,filesystem,4650,51,4650,1,06/01/2012,13/08/2025,1.16 MB,1187,Provides basic utilities for the filesystem,PHP,https://github.com/symfony/filesystem
281,collision,4626,170,4626,27,28/09/2017,31/08/2025,2.29 MB,2348,💥 Collision is a beautiful error reporting tool for command-line applications,PHP,https://github.com/nunomaduro/collision
282,github-profile-views-counter,4602,399,4602,11,11/07/2020,22/09/2025,142.00 KB,142,It counts how many times your GitHub profile has been viewed. Free cloud micro-service.,PHP,https://github.com/antonkomarev/github-profile-views-counter
283,mpdf,4592,1089,4592,342,03/03/2015,10/09/2025,95.67 MB,97961,PHP library generating PDF files from UTF-8 encoded HTML,PHP,https://github.com/mpdf/mpdf
284,php-amqplib,4571,1037,4571,20,15/11/2011,15/09/2025,8.86 MB,9074,The most widely used PHP client for RabbitMQ,PHP,https://github.com/php-amqplib/php-amqplib
285,cms,4563,588,4563,333,21/11/2017,02/10/2025,63.85 MB,65381,The core Laravel CMS Composer package,PHP,https://github.com/statamic/cms
286,phinx,4511,888,4511,156,27/12/2011,02/09/2025,9.00 MB,9221,PHP Database Migrations for Everyone,PHP,https://github.com/cakephp/phinx
287,devilbox,4479,659,4479,89,07/10/2016,19/04/2024,48.96 MB,50133,A modern Docker LAMP stack and MEAN stack for local development,PHP,https://github.com/cytopia/devilbox
288,snappy,4463,437,4463,12,16/06/2010,05/06/2025,583.00 KB,583,"PHP library allowing thumbnail, snapshot or PDF generation from a url or a html page. Wrapper for wkhtmltopdf/wkhtmltoimage",PHP,https://github.com/KnpLabs/snappy
289,Imagine,4454,532,4454,27,20/05/2010,18/01/2025,14.88 MB,15238,PHP Object Oriented image manipulation library,PHP,https://github.com/php-imagine/Imagine
290,emojione,4444,530,4444,131,27/08/2014,22/07/2019,440.53 MB,451105,[Archived] The world's largest independent emoji font. Maintained at https://github.com/joypixels/emoji-toolkit.,PHP,https://github.com/joypixels/emojione
291,expose,4441,294,4441,13,14/04/2020,17/09/2025,217.50 MB,222724,"A beautiful, fully open-source, tunneling service - written in pure PHP",PHP,https://github.com/exposedev/expose
292,TCPDF,4438,1562,4438,362,08/08/2014,27/05/2025,68.04 MB,69672,Official clone of PHP library to generate PDF documents and barcodes,PHP,https://github.com/tecnickcom/TCPDF
293,wechat-php-sdk,4428,2303,4428,154,03/04/2013,09/03/2023,1.04 MB,1070,"微信公众平台php开发包, weixin developer SDK.",PHP,https://github.com/dodgepudding/wechat-php-sdk
294,dokuwiki,4423,898,4423,494,03/01/2010,27/09/2025,42.82 MB,43845,The DokuWiki Open Source Wiki Engine,PHP,https://github.com/dokuwiki/dokuwiki
295,pinyin,4415,775,4415,0,16/07/2014,08/09/2025,23.35 MB,23910,🇨🇳 基于词库的中文转拼音优质解决方案,PHP,https://github.com/overtrue/pinyin
296,wooyun_public,4408,1936,4408,29,20/09/2015,17/07/2019,1.97 MB,2019,This repo is archived. Thanks for wooyun!  乌云公开漏洞、知识库爬虫和搜索   crawl and search for wooyun.org public bug(vulnerability) and drops,PHP,https://github.com/hanc00l/wooyun_public
297,librenms,4404,2510,4404,231,28/10/2013,02/10/2025,322.59 MB,330335,Community-based GPL-licensed network monitoring system,PHP,https://github.com/librenms/librenms
298,amp,4379,261,4379,17,05/08/2013,03/09/2025,2.60 MB,2661,A non-blocking concurrency framework for PHP applications. 🐘,PHP,https://github.com/amphp/amp
299,speedtest-tracker,4347,163,4347,41,11/09/2022,01/10/2025,15.18 MB,15540,Speedtest Tracker is a self-hosted application that monitors the performance and uptime of your internet connection.,PHP,https://github.com/alexjustesen/speedtest-tracker
300,vbot,4343,734,4343,64,07/12/2016,07/08/2025,1.37 MB,1400,微信，企微，机器人，企业微信，企微机器人，微信机器人，视频号下载，聚合聊天，RPA，协议，hook，逆向，群发，自动回复，chatgpt，API对接，稳定防封全语言通用，企业定制/SCRM/SAAS专用,PHP,https://github.com/Hanson/vbot
301,shlink,4338,351,4338,29,08/04/2016,11/09/2025,37.24 MB,38136,The definitive self-hosted URL shortener,PHP,https://github.com/shlinkio/shlink
302,twitteroauth,4308,1703,4308,13,14/02/2009,29/09/2025,3.16 MB,3234,The most popular PHP library for use with the Twitter OAuth REST API.,PHP,https://github.com/abraham/twitteroauth
303,laravel-query-builder,4307,405,4307,2,15/01/2018,08/09/2025,1.27 MB,1297,Easily build Eloquent queries from API requests,PHP,https://github.com/spatie/laravel-query-builder
304,phpDocumentor,4277,636,4277,170,07/07/2010,29/09/2025,44.87 MB,45951,Documentation Generator for PHP ,PHP,https://github.com/phpDocumentor/phpDocumentor
305,php-debugbar,4277,414,4277,131,07/06/2013,02/10/2025,23.00 MB,23548,Debug bar for PHP,PHP,https://github.com/php-debugbar/php-debugbar
306,config,4276,44,4276,0,22/02/2011,02/10/2025,2.54 MB,2596,"Helps you find, load, combine, autofill and validate configuration values of any kind",PHP,https://github.com/symfony/config
307,DoctrineMigrationsBundle,4274,218,4274,48,22/04/2011,02/09/2025,772.00 KB,772,Symfony integration for the doctrine/migrations library,PHP,https://github.com/doctrine/DoctrineMigrationsBundle
308,magic,4264,435,4264,29,14/05/2025,19/09/2025,14.38 MB,14725,Super Magic. The first open-source all-in-one AI productivity platform (Generalist AI Agent + Workflow Engine + IM + Online collaborative office system),PHP,https://github.com/dtyq/magic
309,grumphp,4243,439,4243,3,18/03/2015,28/08/2025,20.48 MB,20970,A PHP code-quality tool,PHP,https://github.com/phpro/grumphp
310,spout,4242,648,4242,48,14/01/2015,26/05/2022,9.76 MB,9998,"Read and write spreadsheet files (CSV, XLSX and ODS), in a fast and scalable way",PHP,https://github.com/box/spout
311,l5-repository,4221,889,4221,258,12/02/2015,10/03/2025,538.00 KB,538,Laravel 5 - Repositories to abstract the database layer,PHP,https://github.com/andersao/l5-repository
312,flex,4218,196,4218,12,07/10/2016,22/08/2025,1.26 MB,1295,Composer plugin for Symfony,PHP,https://github.com/symfony/flex
313,Attendize,4205,1232,4205,294,03/03/2016,20/08/2024,26.45 MB,27080,Attendize is an open-source ticket selling and event management platform built on Laravel.,PHP,https://github.com/Attendize/Attendize
314,drupal,4202,1946,4202,1,04/01/2009,02/10/2025,397.49 MB,407030,Verbatim mirror of the git.drupal.org repository for Drupal core. Please see the https://github.com/drupal/drupal#contributing. PRs are not accepted on GitHub.,PHP,https://github.com/drupal/drupal
315,EasyAdminBundle,4197,1064,4197,406,12/01/2015,29/09/2025,44.22 MB,45282,"EasyAdmin is a fast, beautiful and modern admin generator for Symfony applications.",PHP,https://github.com/EasyCorp/EasyAdminBundle
316,aimeos-core,4186,122,4186,6,19/11/2014,17/09/2025,96.93 MB,99261,"Aimeos PHP e-commerce framework for ultra fast online shops, scalable marketplaces, complex B2B applications and #gigacommerce",PHP,https://github.com/aimeos/aimeos-core
317,kimai,4186,690,4186,291,20/10/2016,02/10/2025,51.93 MB,53178,"Kimai is a web-based multi-user time-tracking application. Works great for everyone: freelancers, companies, organizations - everyone can track their times, generate reports, create invoices and do so much more. SaaS version available at https://www.kimai.cloud",PHP,https://github.com/kimai/kimai
318,dependency-injection,4159,93,4159,0,22/02/2011,02/10/2025,14.32 MB,14666,Allows you to standardize and centralize the way objects are constructed in your application,PHP,https://github.com/symfony/dependency-injection
319,cache,4158,62,4158,0,19/01/2016,27/09/2025,3.19 MB,3266,"Provides extended PSR-6, PSR-16 (and tags) implementations",PHP,https://github.com/symfony/cache
320,bolt,4150,810,4150,55,14/06/2012,27/06/2023,78.53 MB,80417,"Bolt is a simple CMS written in PHP. It is based on Silex and Symfony components, uses Twig and either SQLite, MySQL or PostgreSQL.",PHP,https://github.com/bolt/bolt
321,rainloop-webmail,4134,942,4134,934,24/09/2013,20/08/2024,44.32 MB,45388,"Simple, modern & fast web-based email client",PHP,https://github.com/RainLoop/rainloop-webmail
322,acg-faka,4127,796,4127,6,27/11/2021,30/09/2025,15.65 MB,16029,个人发卡源码，发卡系统，二次元发卡系统，二次元发卡源码，发卡程序，动漫发卡，PHP发卡源码，异次元发卡,PHP,https://github.com/lizhipay/acg-faka
323,pikachu,4122,781,4122,26,24/07/2018,19/12/2023,3.46 MB,3548,一个好玩的Web安全-漏洞测试平台,PHP,https://github.com/zhuifengshaonianhanlu/pikachu
324,anonaddy,4111,221,4111,41,21/06/2019,30/09/2025,3.82 MB,3909,Anonymous email forwarding,PHP,https://github.com/anonaddy/anonaddy
325,Xiaomi-HyperOS-BootLoader-Bypass,4104,419,4104,137,20/11/2023,26/09/2024,59.00 KB,59,A PoC that exploits a vulnerability to bypass the Xiaomi HyperOS community restrictions of BootLoader unlocked account bindings.,PHP,https://github.com/MlgmXyysd/Xiaomi-HyperOS-BootLoader-Bypass
326,DoctrineExtensions,4094,1255,4094,55,03/09/2010,22/09/2025,9.35 MB,9573,"Doctrine2 behavioral extensions, Translatable, Sluggable, Tree-NestedSet, Timestampable, Loggable, Sortable",PHP,https://github.com/doctrine-extensions/DoctrineExtensions
327,tenancy,4087,476,4087,13,17/01/2019,26/09/2025,3.53 MB,3616,Automatic multi-tenancy for Laravel. No code changes needed.,PHP,https://github.com/archtechx/tenancy
328,Search-Replace-DB,4066,858,4066,33,05/12/2011,11/04/2025,1.31 MB,1345,This script was made to aid the process of migrating PHP and MySQL based websites. Works with most common CMSes.,PHP,https://github.com/interconnectit/Search-Replace-DB
329,stack-roadmap,4060,344,4060,1,31/12/2022,28/03/2024,46.54 MB,47659,方糖全栈路线图2023，为「从螺丝钉到一人企业」补全技能栈,PHP,https://github.com/easychen/stack-roadmap
330,polyfill-ctype,4054,7,4054,0,01/05/2018,19/08/2025,25.00 KB,25,Symfony polyfill for ctype functions,PHP,https://github.com/symfony/polyfill-ctype
331,jetstream,4047,842,4047,2,31/08/2020,22/07/2025,2.09 MB,2144,Tailwind scaffolding for the Laravel framework.,PHP,https://github.com/laravel/jetstream
332,laravel-swoole,4040,389,4040,40,06/11/2017,24/03/2025,787.00 KB,787,High performance HTTP server based on Swoole. Speed up your Laravel or Lumen applications.,PHP,https://github.com/swooletw/laravel-swoole
333,upload-labs,4033,826,4033,24,25/05/2018,26/06/2023,1.55 MB,1592,一个想帮你总结所有类型的上传漏洞的靶场,PHP,https://github.com/c0ny1/upload-labs
334,dom-crawler,4033,123,4033,0,22/02/2011,09/09/2025,1.99 MB,2042,Eases DOM navigation for HTML and XML documents,PHP,https://github.com/symfony/dom-crawler
335,persistence,4020,72,4020,25,06/06/2018,29/09/2025,1.58 MB,1617,The Doctrine Persistence project is a library that provides common abstractions for object mapper persistence.,PHP,https://github.com/doctrine/persistence
336,log-viewer,4019,296,4019,14,15/08/2022,25/07/2025,4.56 MB,4674,Fast and beautiful Log Viewer for Laravel,PHP,https://github.com/opcodesio/log-viewer
337,html,4017,959,4017,177,05/02/2015,16/07/2024,542.00 KB,542,HTML and Form Builders for the Laravel Framework,PHP,https://github.com/LaravelCollective/html
338,horizon,4017,693,4017,8,14/07/2017,02/10/2025,26.41 MB,27042,Dashboard and code-driven configuration for Laravel queues.,PHP,https://github.com/laravel/horizon
339,core,4011,963,4011,81,26/06/2015,20/03/2025,3.86 MB,3948,PHP Telegram Bot based on the official Telegram Bot API,PHP,https://github.com/php-telegram-bot/core
340,core,4007,850,4007,294,13/12/2014,02/10/2025,94.09 MB,96351,"OPNsense GUI, API and systems backend",PHP,https://github.com/opnsense/core
341,dcat-admin,4006,766,4006,162,20/04/2019,25/06/2025,81.05 MB,82997,🔥 基于 Laravel 的后台系统构建工具 (Laravel Admin)，使用很少的代码快速构建一个功能完善的高颜值后台系统，内置丰富的后台常用组件，开箱即用，让开发者告别冗杂的HTML代码,PHP,https://github.com/jqhph/dcat-admin
342,Laravel-AdminLTE,3986,1090,3986,9,28/06/2015,11/09/2025,7.55 MB,7732,Easy AdminLTE integration with Laravel,PHP,https://github.com/jeroennoten/Laravel-AdminLTE
343,eloquent-sluggable,3980,455,3980,0,05/06/2013,26/02/2025,714.00 KB,714,Easy creation of slugs for your Eloquent models in Laravel,PHP,https://github.com/cviebrock/eloquent-sluggable
344,dzzoffice,3978,814,3978,24,10/01/2015,30/09/2025,52.99 MB,54259,dzzoffice,PHP,https://github.com/zyx0814/dzzoffice
345,map,3965,16,3965,1,18/11/2019,07/03/2025,964.00 KB,964,PHP arrays and collections made easy,PHP,https://github.com/aimeos/map
346,Geocoder,3958,523,3958,56,07/11/2011,02/09/2025,40.40 MB,41371,The most featured Geocoder library written in PHP.,PHP,https://github.com/geocoder-php/Geocoder
347,Behat,3951,615,3951,53,15/02/2011,02/10/2025,6.90 MB,7064,BDD in PHP,PHP,https://github.com/Behat/Behat
348,WP-API,3940,653,3940,52,01/06/2013,31/08/2017,7.86 MB,8045,The WP REST API has been merged into WordPress core. Please do not create issues or send pull requests. Submit support requests to the forums or patches to Trac (see README below for links).,PHP,https://github.com/WP-API/WP-API
349,stripe-php,3939,885,3939,15,25/06/2011,02/10/2025,8.62 MB,8828,PHP library for the Stripe API.    ,PHP,https://github.com/stripe/stripe-php
350,contracts,3933,21,3933,0,13/07/2018,12/08/2025,545.00 KB,545,A set of abstractions extracted out of the Symfony components,PHP,https://github.com/symfony/contracts
351,octane,3929,320,3929,9,21/03/2021,23/09/2025,1001.00 KB,1001,Supercharge your Laravel application's performance.,PHP,https://github.com/laravel/octane
352,twill,3917,589,3917,122,29/06/2018,30/09/2025,58.65 MB,60061,"Twill is an open source CMS toolkit for Laravel that helps developers rapidly create a custom admin console that is intuitive, powerful and flexible. Chat with us on Discord at https://discord.gg/cnWk7EFv8R.",PHP,https://github.com/area17/twill
353,Lychee,3907,354,3907,77,08/08/2018,30/09/2025,158.50 MB,162301,"A great looking and easy-to-use photo-management-system you can run on your server, to manage and share photos.",PHP,https://github.com/LycheeOrg/Lychee
354,easyappointments,3899,1441,3899,171,26/11/2014,02/10/2025,38.64 MB,39567,:date: Easy!Appointments - Self Hosted Appointment Scheduler,PHP,https://github.com/alextselegidis/easyappointments
355,Pico,3890,616,3890,16,04/04/2012,03/03/2025,1.84 MB,1882,"Pico is a stupidly simple, blazing fast, flat file CMS.",PHP,https://github.com/picocms/Pico
356,laravel-zero,3889,206,3889,57,26/01/2017,13/06/2025,6.57 MB,6725,A PHP framework for console artisans,PHP,https://github.com/laravel-zero/laravel-zero
357,laravel-s,3881,474,3881,73,16/01/2018,27/09/2025,5.35 MB,5482,LaravelS is an out-of-the-box adapter between Laravel/Lumen and Swoole.,PHP,https://github.com/hhxsv5/laravel-s
358,opensourcepos,3878,2369,3878,321,26/11/2013,17/09/2025,55.95 MB,57293,Open Source Point of Sale is a web based point of sale application written in PHP using CodeIgniter framework. It uses MySQL as the data back end and has a Bootstrap 3 based user interface.,PHP,https://github.com/opensourcepos/opensourcepos
359,manong,3874,947,3874,1,14/05/2014,25/09/2017,4.83 MB,4945,码农周刊整理,PHP,https://github.com/nemoTyrant/manong
360,php-encryption,3852,313,3852,10,06/02/2014,02/01/2024,13.16 MB,13471,Simple Encryption in PHP.,PHP,https://github.com/defuse/php-encryption
361,yaml,3849,131,3849,0,18/02/2011,27/09/2025,2.56 MB,2623,Loads and dumps YAML files,PHP,https://github.com/symfony/yaml
362,laravel-generator,3829,838,3829,84,14/02/2016,07/05/2024,1.25 MB,1279,API and Admin Panel CRUD Generator for Laravel.,PHP,https://github.com/InfyOmLabs/laravel-generator
363,laravel,3811,204,3811,16,09/04/2023,27/09/2025,17.59 MB,18011,Laravel wrapper for the NativePHP framework,PHP,https://github.com/NativePHP/laravel
364,freescout,3809,602,3809,41,22/06/2018,06/09/2025,21.74 MB,22257,FreeScout — Free self-hosted help desk & shared mailbox (Zendesk / Help Scout alternative),PHP,https://github.com/freescout-help-desk/freescout
365,getallheaders,3802,35,3802,2,02/06/2014,20/12/2019,204.00 KB,204,PHP getallheaders polyfill,PHP,https://github.com/ralouphie/getallheaders
366,dotenv,3794,29,3794,0,12/01/2017,12/08/2025,389.00 KB,389,Registers environment variables from a .env file,PHP,https://github.com/symfony/dotenv
367,laravel-nestedset,3767,475,3767,209,28/09/2013,26/05/2025,411.00 KB,411,Effective tree structures in Laravel 4-8,PHP,https://github.com/lazychaser/laravel-nestedset
368,oauth2-client,3753,763,3753,54,29/01/2013,17/09/2025,1.29 MB,1317,Easy integration with OAuth 2.0 service providers.,PHP,https://github.com/thephpleague/oauth2-client
369,wp-graphql,3744,465,3744,123,31/10/2016,02/10/2025,82.09 MB,84060,:rocket: GraphQL API for WordPress,PHP,https://github.com/wp-graphql/wp-graphql
370,sakura,3743,597,3743,26,26/05/2018,20/02/2024,44.65 MB,45721,A Wonderful WordPress Theme: 樱花庄的白猫博客主题,PHP,https://github.com/mashirozx/sakura
371,assetic,3734,551,3734,294,10/01/2011,03/02/2022,1.82 MB,1867,Asset Management for PHP,PHP,https://github.com/kriswallsmith/assetic
372,dnscat2,3715,627,3715,97,04/01/2013,14/03/2024,3.82 MB,3916,,PHP,https://github.com/iagox86/dnscat2
373,ampache,3714,601,3714,371,21/03/2013,22/09/2025,236.98 MB,242668,"A web based audio/video streaming application and file manager allowing you to access your music & videos from anywhere, using almost any internet enabled device.",PHP,https://github.com/ampache/ampache
374,php-crud-api,3711,1030,3711,91,10/02/2015,15/05/2025,3.95 MB,4042,Single file PHP script that adds a REST API to a SQL database,PHP,https://github.com/mevdschee/php-crud-api
375,LaravelShoppingcart,3711,1757,3711,240,22/05/2013,30/03/2024,153.00 KB,153,A simple shopping cart implementation for Laravel,PHP,https://github.com/Crinsane/LaravelShoppingcart
376,openemr,3706,2512,3706,512,21/05/2010,02/10/2025,615.79 MB,630564,The most popular open source electronic health records and medical practice management solution.,PHP,https://github.com/openemr/openemr
377,Sakurairo,3697,401,3697,11,25/03/2020,24/09/2025,132.59 MB,135771,"A WordPress theme that is built with AI-assisted reading features, colorful, user-friendly, well-rounded, and rich in functionalities. Support Chinese, English, Japanese, Français (soutien de base) languages. Based on Theme Sakura.  一款具有 AI 辅助阅读功能的 WordPress 主题，多彩、友好、功能全面、体验完善。 支持中、英、日、法（基础适配）多语言。基于 Sakura 主题。",PHP,https://github.com/mirai-mamori/Sakurairo
378,pimcore,3643,1478,3643,524,01/11/2011,02/10/2025,514.15 MB,526493,"Core Framework for the Open Core Data & Experience Management Platform (PIM, MDM, CDP, DAM, DXP/CMS & Digital Commerce)",PHP,https://github.com/pimcore/pimcore
379,ss-panel,3627,1579,3627,108,09/11/2014,11/11/2022,30.15 MB,30869,rm,PHP,https://github.com/orvice/ss-panel
380,json-schema,3613,362,3613,7,16/03/2011,20/09/2025,1.14 MB,1167,JSON Schema for PHP,PHP,https://github.com/jsonrainbow/json-schema
381,phpggc,3602,530,3602,6,03/07/2017,29/09/2025,670.00 KB,670,"PHPGGC is a library of PHP unserialize() payloads along with a tool to generate them, from command line or programmatically. ",PHP,https://github.com/ambionics/phpggc
382,Requests,3581,504,3581,129,07/02/2012,20/09/2025,6.29 MB,6444,Requests for PHP is a humble HTTP request library. It simplifies how you interact with other sites and takes away all your worries.,PHP,https://github.com/WordPress/Requests
383,personal-management-system,3581,289,3581,2,26/03/2019,02/10/2025,142.99 MB,146418,Your web application for managing personal data.  personal.management.system.inbox@gmail.com,PHP,https://github.com/Volmarg/personal-management-system
384,Piwigo,3574,458,3574,718,25/07/2015,02/10/2025,67.44 MB,69054,"Manage your photos with Piwigo, a full featured open source photo gallery application for the web. Star us on Github! More than 200 plugins and themes available. Join us and contribute!",PHP,https://github.com/Piwigo/Piwigo
385,framework-bundle,3568,124,3568,1,25/10/2011,02/10/2025,17.48 MB,17902,Provides a tight integration between Symfony components and the Symfony full-stack framework,PHP,https://github.com/symfony/framework-bundle
386,osTicket,3552,1759,3552,1162,12/08/2013,04/02/2025,74.69 MB,76480,"The osTicket open source ticketing system official project repository, for versions 1.8 and later",PHP,https://github.com/osTicket/osTicket
387,bouncer,3551,339,3551,51,17/09/2015,19/08/2025,2.94 MB,3006,Laravel Eloquent roles and abilities.,PHP,https://github.com/JosephSilber/bouncer
388,Silex,3551,710,3551,0,16/09/2010,02/06/2018,3.58 MB,3661,[DEPRECATED -- Use Symfony instead] The PHP micro-framework based on the Symfony Components,PHP,https://github.com/silexphp/Silex
389,fractal,3544,347,3544,58,26/11/2013,14/02/2025,2.15 MB,2198,"Output complex, flexible, AJAX/RESTful data structures.",PHP,https://github.com/thephpleague/fractal
390,laravel,3538,248,3538,12,26/12/2022,02/10/2025,107.00 KB,107,⚡️ OpenAI PHP for Laravel is a supercharged PHP API client that allows you to interact with OpenAI API,PHP,https://github.com/openai-php/laravel
391,recaptcha,3531,779,3531,104,30/09/2014,26/06/2025,303.00 KB,303,"PHP client library for reCAPTCHA, a free service to protect your website from spam and abuse.",PHP,https://github.com/google/recaptcha
392,AzuraCast,3527,659,3527,87,30/04/2016,02/10/2025,262.04 MB,268330,"A self-hosted web radio management suite, including turnkey installer tools for the full radio software stack and a modern, easy-to-use web app to manage your stations.",PHP,https://github.com/AzuraCast/AzuraCast
393,laravel-localization,3518,514,3518,50,25/08/2013,30/07/2025,823.00 KB,823,Easy localization for Laravel,PHP,https://github.com/mcamara/laravel-localization
394,openbay,3515,894,3515,89,19/12/2014,09/09/2019,15.13 MB,15491,,PHP,https://github.com/isohuntto/openbay
395,EasyImages2.0,3513,497,3513,15,23/05/2019,04/07/2025,86.28 MB,88346,简单图床 - 一款功能强大无数据库的图床 2.0版,PHP,https://github.com/icret/EasyImages2.0
396,zguide,3499,1658,3499,123,16/08/2010,19/05/2025,52.63 MB,53893,Learning and Using ØMQ,PHP,https://github.com/booksbyus/zguide
397,phpspider,3485,1168,3485,121,06/08/2015,15/12/2024,5.35 MB,5478,《我用爬虫一天时间“偷了”知乎一百万用户，只为证明PHP是世界上最好的语言 》所使用的程序,PHP,https://github.com/owner888/phpspider
398,cms,3483,679,3483,512,27/01/2017,03/10/2025,825.29 MB,845095,Build bespoke content experiences with Craft.,PHP,https://github.com/craftcms/cms
399,Learn-Laravel-5,3475,569,3475,6,07/03/2015,22/07/2023,413.00 KB,413,Laravel 5 系列入门教程,PHP,https://github.com/johnlui/Learn-Laravel-5
400,Hello-CTF,3465,226,3465,2,16/04/2023,03/10/2025,180.72 MB,185059,【Hello CTF】题目配套，免费开源的CTF入门教程，针对0基础新手编写，同时兼顾信息差的填补，对各阶段的CTFer都友好的开源教程，致力于CTF和网络安全的开源生态！,PHP,https://github.com/ProbiusOfficial/Hello-CTF
401,laravel-apidoc-generator,3463,605,3463,56,03/05/2016,23/05/2024,1.41 MB,1444,Laravel API Documentation Generator,PHP,https://github.com/mpociot/laravel-apidoc-generator
402,lighthouse,3454,459,3454,129,29/05/2016,11/09/2025,15.54 MB,15911,A framework for serving GraphQL from Laravel,PHP,https://github.com/nuwave/lighthouse
403,php-markdown,3449,526,3449,99,06/06/2010,17/06/2025,821.00 KB,821,Parser for Markdown and Markdown Extra derived from the original Markdown.pl by John Gruber.,PHP,https://github.com/michelf/php-markdown
404,event-dispatcher-contracts,3438,3,3438,0,27/05/2019,25/05/2025,52.00 KB,52,A set of event dispatcher abstractions extracted out of the Symfony components,PHP,https://github.com/symfony/event-dispatcher-contracts
405,csv,3434,340,3434,2,02/12/2013,01/10/2025,10.41 MB,10662,CSV data manipulation made easy in PHP,PHP,https://github.com/thephpleague/csv
406,2FAuth,3429,239,3429,45,15/05/2019,29/08/2025,17.72 MB,18144,A Web app to manage your Two-Factor Authentication (2FA) accounts and generate their security codes,PHP,https://github.com/Bubka/2FAuth
407,php-resque,3428,749,3428,102,18/04/2010,01/08/2023,316.00 KB,316,PHP port of resque (Workers and Queueing),PHP,https://github.com/chrisboulton/php-resque
