Ranking,Project Name,Stars,Forks,Watchers,Open Issues,Created At,Last Commit,Size,Size (KB),Description,Language,Repo URL
677,DiDOM,2211,202,2211,27,15/08/2015,15/03/2024,468.00 KB,468,Simple and fast HTML and XML parser,PHP,https://github.com/Imangazaliev/DiDOM
678,PHP-Vars-To-Js-Transformer,2211,216,2211,25,25/02/2014,27/02/2025,82.00 KB,82,Transform PHP data to JavaScript.,PHP,https://github.com/laracasts/PHP-Vars-To-Js-Transformer
679,WebStack,2207,567,2207,34,26/08/2019,01/04/2025,4.38 MB,4490,WordPress 版 WebStack 导航主题 https://nav.iowen.cn,PHP,https://github.com/owen0o0/WebStack
680,phpcpd,2207,188,2207,0,24/01/2009,10/01/2023,45.31 MB,46402,Copy/Paste Detector (CPD) for PHP code.,PHP,https://github.com/sebastianbergmann/phpcpd
681,testbench,2206,139,2206,0,08/06/2013,20/08/2025,1.36 MB,1391,Laravel Testing Helper for Packages Development,PHP,https://github.com/orchestral/testbench
682,UNIT3D,2206,417,2206,134,07/12/2017,01/10/2025,81.38 MB,83332,"UNIT3D is a private torrent tracker built using Laravel, Livewire and AlpineJS.",PHP,https://github.com/HDInnovations/UNIT3D
683,enqueue-dev,2203,440,2203,59,29/12/2016,21/06/2025,19.72 MB,20190,"Message Queue, Job Queue, Broadcasting, WebSockets packages for PHP, Symfony, Laravel, Magento. DEVELOPMENT REPOSITORY - provided by Forma-Pro",PHP,https://github.com/php-enqueue/enqueue-dev
684,plus,2203,469,2203,112,16/12/2016,14/03/2022,86.01 MB,88079,"💝The Plus (ThinkSNS+) is a powerful, easy-to-develop social system built with Laravel.",PHP,https://github.com/slimkit/plus
685,laravel-geoip,2201,377,2201,79,11/12/2013,25/02/2025,166.00 KB,166,Determine the geographical location of website visitors based on their IP addresses.,PHP,https://github.com/Torann/laravel-geoip
686,graphql-laravel,2200,270,2200,13,19/09/2016,01/09/2025,2.48 MB,2542,Laravel wrapper for Facebook's GraphQL,PHP,https://github.com/rebing/graphql-laravel
687,php-github-api,2193,598,2193,48,06/04/2012,20/08/2025,2.16 MB,2211,"A simple PHP GitHub API client, Object Oriented, tested and documented.",PHP,https://github.com/KnpLabs/php-github-api
688,inflector,2191,11,2191,0,31/03/2016,13/11/2024,188.00 KB,188,Converts words between their singular and plural forms (English only),PHP,https://github.com/symfony/inflector
689,lessphp,2186,521,2186,219,21/07/2009,16/05/2024,840.00 KB,840,LESS compiler written in PHP,PHP,https://github.com/leafo/lessphp
690,easyengine,2176,433,2176,101,14/08/2012,01/10/2025,5.95 MB,6088,"Command-line control panel for Nginx Server to manage WordPress sites running on Nginx, PHP, MySQL, and Let's Encrypt",PHP,https://github.com/EasyEngine/easyengine
691,ApiGen,2166,310,2166,24,26/02/2011,21/02/2025,10.67 MB,10929,PHP 7.1 ready Smart and Simple Documentation for your PHP project,PHP,https://github.com/ApiGen/ApiGen
692,ML,2162,194,2162,62,14/02/2018,01/10/2025,34.19 MB,35008,A high-level machine learning and deep learning library for the PHP language.,PHP,https://github.com/RubixML/ML
693,tsf,2159,479,2159,27,03/07/2015,24/10/2019,298.00 KB,298,coroutine and Swoole based php server framework in tencent,PHP,https://github.com/Tencent/tsf
694,boris,2153,115,2153,26,13/11/2011,04/06/2021,1016.00 KB,1016,A tiny REPL for PHP,PHP,https://github.com/borisrepl/boris
695,wordplate,2152,157,2152,0,04/10/2013,22/09/2025,1.98 MB,2028,"A boilerplate for WordPress, built with Composer and designed with sensible defaults.",PHP,https://github.com/vinkla/wordplate
696,password_compat,2143,414,2143,19,25/06/2012,05/02/2024,63.00 KB,63,Compatibility with the password_* functions that ship with PHP 5.5,PHP,https://github.com/ircmaxell/password_compat
697,scribe,2141,359,2141,110,02/05/2020,28/07/2025,5.12 MB,5245,Generate API documentation for humans from your Laravel codebase.✍,PHP,https://github.com/knuckleswtf/scribe
698,huge,2139,782,2139,48,06/05/2012,04/09/2024,6.66 MB,6818,"Simple user-authentication solution, embedded into a small framework.",PHP,https://github.com/panique/huge
699,laravel-filemanager,2132,738,2132,272,29/07/2015,21/08/2025,4.59 MB,4699,"Media gallery with CKEditor, TinyMCE and Summernote support. Built on Laravel file system.",PHP,https://github.com/UniSharp/laravel-filemanager
700,infection,2131,169,2131,170,29/06/2017,02/10/2025,49.69 MB,50887,PHP Mutation Testing library,PHP,https://github.com/infection/infection
701,ezXSS,2131,371,2131,3,06/03/2017,12/08/2025,5.00 MB,5121,ezXSS is an easy way for penetration testers and bug bounty hunters to test (blind) Cross Site Scripting.,PHP,https://github.com/ssl/ezXSS
702,livehelperchat,2130,726,2130,134,08/12/2012,02/10/2025,374.08 MB,383061,"Live Helper Chat - live support for your website. Featuring web and mobile apps, Voice & Video & ScreenShare. Supports Telegram, Twilio (whatsapp), Facebook messenger including building a bot.",PHP,https://github.com/LiveHelperChat/livehelperchat
703,Crawler-Detect,2129,266,2129,13,23/03/2015,30/09/2025,9.02 MB,9234,🕷 CrawlerDetect is a PHP class for detecting bots/crawlers/spiders via the user agent,PHP,https://github.com/JayBizzle/Crawler-Detect
704,h-m-m,2121,58,2121,0,30/08/2022,20/06/2025,217.00 KB,217,"h-m-m, or Hackers Mind Map, is a simple, fast, keyboard-centric terminal-based tool for working with mind maps.",PHP,https://github.com/nadrad/h-m-m
705,Embed,2121,315,2121,73,09/10/2012,13/05/2025,15.59 MB,15966,Get info from any web service or page,PHP,https://github.com/php-embed/Embed
706,SonataAdminBundle,2115,1253,2115,11,19/11/2010,29/09/2025,46.98 MB,48112,The missing Symfony Admin Generator,PHP,https://github.com/sonata-project/SonataAdminBundle
707,music,2111,706,2111,32,12/06/2015,25/06/2019,358.00 KB,358,音乐搜索器 - 多站合一音乐搜索解决方案,PHP,https://github.com/maicong/music
708,utils,2109,151,2109,22,17/03/2014,06/08/2025,2.07 MB,2124,"🛠 Lightweight utilities for string & array manipulation, image handling, safe JSON encoding/decoding, validation, slug or strong password generating etc.",PHP,https://github.com/nette/utils
709,LittleProxy,2108,785,2108,111,21/12/2010,08/07/2024,7.22 MB,7397,High performance HTTP proxy originally written by your friends at Lantern and now maintained by a stellar group of volunteer open source programmers.,PHP,https://github.com/adamfisk/LittleProxy
710,deprecation-contracts,2103,9,2103,0,08/02/2020,25/05/2025,29.00 KB,29,A generic function and convention to trigger deprecation notices,PHP,https://github.com/symfony/deprecation-contracts
711,var-exporter,2103,7,2103,0,29/08/2018,27/09/2025,508.00 KB,508,Allows exporting any serializable PHP data structure to plain PHP code,PHP,https://github.com/symfony/var-exporter
712,security-advisories,2097,308,2097,2,24/01/2013,29/08/2025,1.34 MB,1372,A database of PHP security advisories,PHP,https://github.com/FriendsOfPHP/security-advisories
713,WDScanner,2094,549,2094,7,21/01/2019,22/06/2020,26.88 MB,27526,WDScanner平台目前实现了如下功能：分布式web漏洞扫描、客户管理、漏洞定期扫描、子域名枚举、端口扫描、网站爬虫、暗链检测、坏链检测、网站指纹搜集、专项漏洞检测、代理搜集及部署等功能。,PHP,https://github.com/TideSec/WDScanner
714,ignition,2080,183,2080,5,26/08/2019,16/02/2023,2.62 MB,2687,A beautiful error page for Laravel apps,PHP,https://github.com/facade/ignition
715,DoctrineExtensions,2080,425,2080,45,28/02/2010,26/09/2024,715.00 KB,715,A set of Doctrine 2 extensions,PHP,https://github.com/beberlei/DoctrineExtensions
716,macro,2069,1,2069,0,02/12/2021,07/11/2024,82.00 KB,82,Customize code using closures,PHP,https://github.com/aimeos/macro
717,polyfill-intl-normalizer,2068,4,2068,0,22/10/2015,19/08/2025,121.00 KB,121,Symfony polyfill for intl's Normalizer class and related functions,PHP,https://github.com/symfony/polyfill-intl-normalizer
718,Transliterator,2071,32,2071,0,12/01/2014,07/05/2025,250.00 KB,250,Behat Transliterator library inherited from Doctrine1 and used in Behat for snippet generation,PHP,https://github.com/Behat/Transliterator
719,S3-Uploads,2064,401,2064,68,21/11/2013,21/08/2025,10.25 MB,10494,The WordPress Plugin to Store Uploads on Amazon S3,PHP,https://github.com/humanmade/S3-Uploads
720,laravel-queue-rabbitmq,2054,426,2054,31,06/12/2013,22/08/2025,615.00 KB,615,RabbitMQ driver for Laravel Queue. Supports Laravel Horizon.,PHP,https://github.com/vyuldashev/laravel-queue-rabbitmq
721,laravel-hashids,2043,176,2043,0,03/02/2015,24/08/2025,232.00 KB,232,A Hashids bridge for Laravel,PHP,https://github.com/vinkla/laravel-hashids
722,fusio,2043,233,2043,171,29/07/2015,28/09/2025,30.19 MB,30917,Self-Hosted API Management for Builders,PHP,https://github.com/apioo/fusio
723,math,2041,85,2041,5,31/08/2014,04/09/2025,1.43 MB,1469,Arbitrary-precision arithmetic library for PHP,PHP,https://github.com/brick/math
724,ProxiTok,2040,146,2040,50,01/01/2022,31/05/2025,670.00 KB,670,Open source alternative frontend for TikTok made using PHP,PHP,https://github.com/pablouser1/ProxiTok
725,laravel-enum,2035,161,2035,2,07/09/2017,12/08/2025,625.00 KB,625,"Simple, extensible and powerful enumeration implementation for Laravel.",PHP,https://github.com/BenSampo/laravel-enum
726,skycaiji,2035,600,2035,39,26/02/2018,22/08/2025,25.85 MB,26475,蓝天采集器是一款开源免费的爬虫系统，仅需点选编辑规则即可采集数据，可运行在本地、虚拟主机或云服务器中，几乎能采集所有类型的网页，无缝对接各类CMS建站程序，免登录实时发布数据，全自动无需人工干预！是网页大数据采集软件中完全跨平台的云端爬虫系统,PHP,https://github.com/zorlan/skycaiji
727,laravel-query-detector,2031,140,2031,3,15/07/2018,11/03/2025,97.00 KB,97,Laravel N+1 Query Detector,PHP,https://github.com/beyondcode/laravel-query-detector
728,sendportal,2029,430,2029,45,04/06/2020,19/04/2024,292.00 KB,292,Open-source self-hosted email marketing. Manage your own newsletters at a fraction of the cost. ,PHP,https://github.com/mettle/sendportal
729,minify,2029,327,2029,117,09/10/2012,25/06/2025,927.00 KB,927,"CSS & JavaScript minifier, in PHP. Removes whitespace, strips comments, combines files (incl. @import statements and small assets in CSS files), and optimizes/shortens a few common programming patterns.",PHP,https://github.com/matthiasmullie/minify
730,imagehash,2021,175,2021,38,04/12/2014,17/09/2025,1.34 MB,1371,🌄 Perceptual image hashing for PHP,PHP,https://github.com/jenssegers/imagehash
731,http-client,2020,52,2020,0,07/03/2019,01/10/2025,2.01 MB,2056,Provides powerful methods to fetch HTTP resources synchronously or asynchronously,PHP,https://github.com/symfony/http-client
732,easy-log-handler,2016,29,2016,0,16/08/2016,07/04/2020,36.00 KB,36,Human-friendly log files that make you more productive,PHP,https://github.com/EasyCorp/easy-log-handler
733,searchable,2005,293,2005,107,17/06/2014,26/07/2025,118.00 KB,118,A php trait to search laravel models,PHP,https://github.com/nicolaslopezj/searchable
734,BaconQrCode,2004,217,2004,22,23/03/2013,25/02/2025,403.00 KB,403,QR Code Generator for PHP,PHP,https://github.com/Bacon/BaconQrCode
735,idiorm,1998,368,1998,4,11/02/2010,14/03/2024,739.00 KB,739,A lightweight nearly-zero-configuration object-relational mapper and fluent query builder for PHP5.,PHP,https://github.com/j4mie/idiorm
736,ibis,1994,161,1994,22,11/06/2020,06/05/2025,621.00 KB,621,A PHP tool that helps you write eBooks in markdown and convert to PDF.,PHP,https://github.com/themsaid/ibis
737,laravel-er-diagram-generator,1992,199,1992,16,03/07/2018,13/06/2025,88.00 KB,88,Generate entity relation diagrams from your Laravel model files.,PHP,https://github.com/beyondcode/laravel-er-diagram-generator
738,jmespath.php,1992,55,1992,14,06/07/2013,04/09/2024,633.00 KB,633,"Declaratively specify how to extract elements from a JSON document, in PHP",PHP,https://github.com/jmespath/jmespath.php
739,http-client-contracts,1990,3,1990,0,27/05/2019,21/07/2025,176.00 KB,176,A set of HTTP client abstractions extracted out of the Symfony components,PHP,https://github.com/symfony/http-client-contracts
740,laracom,1987,862,1987,0,15/08/2017,06/04/2025,13.04 MB,13351,Laravel FREE E-Commerce Software,PHP,https://github.com/jsdecena/laracom
741,functional-php,1985,211,1985,23,22/05/2011,12/05/2024,1.08 MB,1101,Primitives for functional programming in PHP,PHP,https://github.com/lstrojny/functional-php
742,mailchimp-api,1985,501,1985,67,30/07/2013,14/11/2022,160.00 KB,160,"Super-simple, minimum abstraction MailChimp API v3 wrapper, in PHP",PHP,https://github.com/drewm/mailchimp-api
743,prism,1984,201,1984,51,23/02/2024,02/10/2025,35.02 MB,35858,A unified interface for working with LLMs in Laravel,PHP,https://github.com/prism-php/prism
744,Sami,1982,288,1982,41,15/05/2012,13/09/2018,758.00 KB,758,An API documentation generator,PHP,https://github.com/FriendsOfPHP/Sami
745,security-checker,1982,116,1982,0,01/02/2013,15/01/2021,128.00 KB,128,PHP frontend for security.symfony.com,PHP,https://github.com/sensiolabs/security-checker
746,phpbb,1982,989,1982,48,01/03/2010,29/09/2025,92.24 MB,94453, phpBB Development: phpBB is a popular open-source bulletin board written in PHP. This repository also contains the history of version 2.,PHP,https://github.com/phpbb/phpbb
747,framework,1976,88,1976,43,13/02/2012,27/09/2025,14.02 MB,14361,High-Performance PHP Framework,PHP,https://github.com/spiral/framework
748,avatar,1976,182,1976,0,12/10/2015,27/08/2025,507.00 KB,507,"Plug n play avatar, turn name, email, and any other string into beautiful avatar (or gravatar), effortless. ",PHP,https://github.com/laravolt/avatar
749,health,1971,200,1971,47,26/11/2016,15/10/2024,4.28 MB,4380,Laravel Health Panel,PHP,https://github.com/antonioribeiro/health
750,book,1968,764,1968,7,05/02/2018,22/09/2021,1.18 GB,1238870,Book PDF,PHP,https://github.com/3masterplus/book
751,phpbench,1962,125,1962,32,03/05/2015,04/09/2025,6.76 MB,6920,PHP Benchmarking framework,PHP,https://github.com/phpbench/phpbench
752,hprose-php,1957,385,1957,42,13/02/2014,06/02/2024,1.13 MB,1161,Hprose is a cross-language RPC. This project is Hprose 3.0 for PHP,PHP,https://github.com/hprose/hprose-php
753,laravel-livewire-tables,1949,363,1949,10,26/03/2020,04/06/2025,3.39 MB,3474,A dynamic table component for Laravel Livewire,PHP,https://github.com/rappasoft/laravel-livewire-tables
754,Purifier,1948,232,1948,75,22/03/2013,07/05/2025,498.00 KB,498,HTMLPurifier for Laravel 5+,PHP,https://github.com/mewebstudio/Purifier
755,cli-menu,1947,108,1947,8,19/10/2015,11/08/2025,915.00 KB,915,🖥  Build beautiful PHP CLI menus. Simple yet Powerful. Expressive DSL.,PHP,https://github.com/php-school/cli-menu
756,dashboard.spatie.be,1946,423,1946,0,06/05/2016,26/01/2024,7.93 MB,8117,The source code of dashboard.spatie.be,PHP,https://github.com/spatie/dashboard.spatie.be
757,laravel-translatable,1946,320,1946,0,03/02/2014,18/06/2019,926.00 KB,926,[Deprecated] A Laravel package for multilingual models,PHP,https://github.com/dimsav/laravel-translatable
758,LaravelInstaller,1944,483,1944,30,07/07/2015,28/11/2023,2.13 MB,2179,A web installer for Laravel,PHP,https://github.com/rashidlaasri/LaravelInstaller
759,google2fa,1943,199,1943,3,21/09/2014,19/09/2025,573.00 KB,573,"A One Time Password Authentication package, compatible with Google Authenticator.",PHP,https://github.com/antonioribeiro/google2fa
760,phphub5,1942,480,1942,33,11/07/2016,09/03/2020,20.09 MB,20573,"PHPHub Ver 5 is a Forum project Powered by Laravel 5.1, and it is also the project build up PHP & Laravel China community （此项目已弃用）",PHP,https://github.com/summerblue/phphub5
761,WebShell,1941,1038,1941,8,16/10/2015,06/04/2020,23.98 MB,24551,Webshell && Backdoor Collection,PHP,https://github.com/xl7dev/WebShell
762,mix,1940,214,1940,4,24/06/2017,28/08/2025,8.26 MB,8455,"☄️  PHP CLI mode development framework, supports Swoole, WorkerMan, FPM, CLI-Server / PHP 命令行模式开发框架，支持 Swoole、Swow、WorkerMan、FPM、CLI-Server",PHP,https://github.com/mix-php/mix
763,vmqphp,1939,718,1939,50,18/04/2019,14/07/2024,23.76 MB,24330,V免签PHP版 完全开源免费的个人免签约解决方案,PHP,https://github.com/szvone/vmqphp
764,dusk,1935,330,1935,5,06/12/2016,10/06/2025,105.43 MB,107960,Laravel Dusk provides simple end-to-end testing and browser automation.,PHP,https://github.com/laravel/dusk
765,Laravel-Administrator,1931,499,1931,146,12/11/2012,08/09/2020,7.40 MB,7573,An administrative interface package for Laravel,PHP,https://github.com/FrozenNode/Laravel-Administrator
766,pheanstalk,1925,281,1925,4,14/10/2008,22/09/2025,2.49 MB,2549,PHP client for beanstalkd queue,PHP,https://github.com/pheanstalk/pheanstalk
767,NelmioCorsBundle,1923,107,1923,7,04/11/2011,28/06/2024,209.00 KB,209,Adds CORS (Cross-Origin Resource Sharing) headers support in your Symfony application,PHP,https://github.com/nelmio/NelmioCorsBundle
768,AWSGoat,1920,1372,1920,7,13/07/2022,20/05/2025,33.54 MB,34341,AWSGoat : A Damn Vulnerable AWS Infrastructure,PHP,https://github.com/ine-labs/AWSGoat
769,Buzz,1920,252,1920,10,26/01/2010,07/07/2025,2.04 MB,2089,PHP's lightweight HTTP client,PHP,https://github.com/kriswallsmith/Buzz
770,StofDoctrineExtensionsBundle,1919,381,1919,38,09/11/2010,01/10/2025,351.00 KB,351,Integration bundle for DoctrineExtensions by l3pp4rd in Symfony,PHP,https://github.com/stof/StofDoctrineExtensionsBundle
771,php-webshells,1918,781,1918,9,25/07/2014,03/03/2021,2.37 MB,2427,Common PHP webshells you might need for your Penetration Testing assignments or CTF challenges. Do not host the file(s) on your server!,PHP,https://github.com/JohnTroony/php-webshells
772,laravel-fractal,1909,188,1909,2,06/10/2015,08/09/2025,355.00 KB,355,An easy to use Fractal wrapper built for Laravel and Lumen applications,PHP,https://github.com/spatie/laravel-fractal
773,google-translate-php,1908,389,1908,8,18/07/2013,20/06/2025,345.00 KB,345,🔤 Free Google Translate API PHP Package. Translates totally free of charge.,PHP,https://github.com/Stichoza/google-translate-php
774,Tieba-Cloud-Sign,1905,417,1905,76,13/04/2014,10/03/2025,5.06 MB,5185,百度贴吧云签到，在服务器上配置好就无需进行任何操作便可以实现贴吧的全自动签到。配合插件使用还可实现云灌水、点赞、封禁、删帖、审查等功能。注意：Gitee (原Git@osc) 仓库将不再维护，目前唯一指定的仓库为 Github。本项目没有官方交流群，如需交流可以直接使用Github的Discussions。没有商业版本，目前贴吧云签到由社区共同维护，不会停止更新（PR 通常在一天内处理）。,PHP,https://github.com/MoeNetwork/Tieba-Cloud-Sign
775,Payum,1904,343,1904,96,23/11/2012,31/07/2025,12.25 MB,12540,"PHP Payment processing library. It offers everything you need to work with payments: Credit card & offsite purchasing, subscriptions, payouts etc.",PHP,https://github.com/Payum/Payum
776,PHP-Audit-Labs,1903,339,1903,10,12/07/2018,17/09/2019,167.23 MB,171240,一个关于PHP的代码审计项目,PHP,https://github.com/hongriSec/PHP-Audit-Labs
777,phpspec,1895,283,1895,139,07/04/2011,06/09/2025,5.01 MB,5132,SpecBDD Framework for PHP,PHP,https://github.com/phpspec/phpspec
778,laminas-code,1896,85,1896,28,31/12/2019,14/08/2025,4.73 MB,4845,"Extensions to the PHP Reflection API, static code scanning, and code generation",PHP,https://github.com/laminas/laminas-code
779,countries,1893,298,1893,70,05/02/2017,19/08/2025,79.40 MB,81301,Laravel countries and currencies,PHP,https://github.com/antonioribeiro/countries
780,speedtest-x,1893,428,1893,10,13/11/2020,23/03/2025,160.00 KB,160,A self-hosted speedtest appilication with an awesome test result datasheet.,PHP,https://github.com/MortyFx/speedtest-x
781,VichUploaderBundle,1892,520,1892,58,01/12/2011,26/09/2025,1.95 MB,1993,A simple Symfony bundle to ease file uploads with ORM entities and ODM documents.,PHP,https://github.com/dustin10/VichUploaderBundle
782,sentry-php,1888,463,1888,30,23/01/2012,29/09/2025,4.19 MB,4290,The official PHP SDK for Sentry (sentry.io),PHP,https://github.com/getsentry/sentry-php
783,security-core,1878,33,1878,0,18/09/2013,02/10/2025,2.96 MB,3026,Symfony Security Component - Core Library,PHP,https://github.com/symfony/security-core
784,http-factory,1876,26,1876,0,30/07/2018,10/05/2024,25.00 KB,25,Implementation of PSR-17 (HTTP Message Factories),PHP,https://github.com/php-fig/http-factory
785,Gazelle,1873,357,1873,48,30/06/2013,08/11/2016,28.88 MB,29575,,PHP,https://github.com/WhatCD/Gazelle
786,Torch,1873,213,1873,14,21/08/2014,27/01/2024,721.00 KB,721,Examples of using each Illuminate component in non-Laravel applications,PHP,https://github.com/mattstauffer/Torch
787,climate,1872,126,1872,15,17/08/2014,24/11/2024,1.44 MB,1472,PHP's best friend for the terminal.,PHP,https://github.com/thephpleague/climate
788,tempest-framework,1870,129,1870,58,10/07/2023,02/10/2025,7.41 MB,7590,The PHP framework that gets out of your way,PHP,https://github.com/tempestphp/tempest-framework
789,laravel-collection-macros,1870,145,1870,0,26/07/2016,15/09/2025,428.00 KB,428,A set of useful Laravel collection macros,PHP,https://github.com/spatie/laravel-collection-macros
790,PHP_XLSXWriter,1859,663,1859,48,11/09/2013,25/09/2023,295.00 KB,295,Lightweight XLSX Excel Spreadsheet Writer in PHP,PHP,https://github.com/mk-j/PHP_XLSXWriter
791,ZipStream-PHP,1858,112,1858,4,13/11/2013,29/09/2025,605.00 KB,605,:floppy_disk: PHP ZIP Streaming Library,PHP,https://github.com/maennchen/ZipStream-PHP
792,plugins,1854,597,1854,34,04/11/2013,30/08/2025,228.48 MB,233966,Typecho Fans插件作品目录,PHP,https://github.com/typecho-fans/plugins
793,WordPress-Skeleton,1850,597,1850,30,26/05/2012,01/10/2025,27.00 KB,27,Basic layout of a WordPress Git repository. I use this as a base when creating a new repo.,PHP,https://github.com/markjaquith/WordPress-Skeleton
794,Carbon-Forum,1849,426,1849,89,04/11/2014,05/01/2020,14.12 MB,14463,A high performance open-source forum software written in PHP. Discussions Tags based with Quora/StackOverflow style.,PHP,https://github.com/lincanbin/Carbon-Forum
795,PentesterSpecialDict,1847,331,1847,1,11/08/2020,17/06/2025,57.10 MB,58469,构建优化高效的渗透 fuzz 字典合集,PHP,https://github.com/evilc0deooo/PentesterSpecialDict
796,workerman-todpole,1843,671,1843,14,30/04/2014,24/08/2022,994.00 KB,994,"HTML5+WebSocket+PHP(Workerman) , rumpetroll server writen using php",PHP,https://github.com/walkor/workerman-todpole
797,msphpsql,1840,375,1840,40,22/04/2014,30/09/2025,87.83 MB,89933,Microsoft Drivers for PHP for SQL Server,PHP,https://github.com/microsoft/msphpsql
798,Parser-PHP,1837,242,1837,28,28/06/2013,19/05/2024,10.98 MB,11247,Browser sniffing gone too far — A useragent parser library for PHP,PHP,https://github.com/WhichBrowser/Parser-PHP
799,link-util,1832,9,1832,1,04/08/2016,11/03/2021,69.00 KB,69,,PHP,https://github.com/php-fig/link-util
800,edusoho,1832,728,1832,49,22/10/2013,30/09/2025,714.66 MB,731811,EduSoho 网络课堂是由杭州阔知网络科技有限公司研发的开源网校系统。EduSoho 包含了在线教学、招生和管理等完整功能，让教育机构可以零门槛建立网校，成功转型在线教育。EduSoho 也可作为企业内训平台，帮助企业实现人才培养。,PHP,https://github.com/edusoho/edusoho
801,aimeos-base,1830,1,1830,0,12/02/2022,09/07/2025,406.00 KB,406,Aimeos abstraction layer for host applications,PHP,https://github.com/aimeos/aimeos-base
802,no-captcha,1830,233,1830,53,03/12/2014,25/02/2025,78.00 KB,78,No CAPTCHA reCAPTCHA For Laravel.,PHP,https://github.com/anhskohbo/no-captcha
803,html-to-markdown,1827,211,1827,21,21/10/2011,10/09/2025,425.00 KB,425,Convert HTML to Markdown with PHP,PHP,https://github.com/thephpleague/html-to-markdown
804,94list,1825,327,1825,16,20/08/2023,02/08/2024,341.00 KB,341,百度网盘分享链接分析渲染列表辅助下载开源程序,PHP,https://github.com/codehub666/94list
805,web-push-php,1825,310,1825,25,27/11/2015,01/10/2025,374.00 KB,374,Web Push library for PHP,PHP,https://github.com/web-push-libs/web-push-php
806,Meting,1825,485,1825,4,05/01/2017,28/08/2025,206.00 KB,206,":cake: Wow, such a powerful music API framework",PHP,https://github.com/metowolf/Meting
807,plugin-php,1818,136,1818,119,24/12/2017,11/08/2025,6.13 MB,6280,Prettier PHP Plugin,PHP,https://github.com/prettier/plugin-php
808,metadata,1818,71,1818,7,06/05/2011,01/08/2025,244.00 KB,244,Metadata is a library for metadata management in PHP,PHP,https://github.com/schmittjoh/metadata
809,money,1818,105,1818,15,31/05/2015,04/09/2025,515.00 KB,515,A money and currency library for PHP,PHP,https://github.com/brick/money
810,scramble,1818,173,1818,24,05/08/2022,28/09/2025,2.33 MB,2383,Modern Laravel OpenAPI (Swagger) documentation generator. No PHPDoc annotations required. ,PHP,https://github.com/dedoc/scramble
811,actionview,1817,369,1817,32,01/08/2016,03/09/2023,66.54 MB,68134,"An issue tracking tool based on laravel+reactjs for small and medium-sized enterprises, open-source and free, similar to Jira.",PHP,https://github.com/lxerxa/actionview
812,twitter-api-php,1816,791,1816,0,08/03/2013,14/04/2020,89.00 KB,89,The simplest PHP Wrapper for Twitter API v1.1 calls,PHP,https://github.com/J7mbo/twitter-api-php
813,laravel-totem,1816,228,1816,1,01/08/2017,16/08/2025,12.13 MB,12423,Manage Your Laravel Schedule From A Web Dashboard,PHP,https://github.com/always-open/laravel-totem
814,date,1814,251,1814,8,28/04/2013,04/12/2023,530.00 KB,530,"🗓 A library to help you work with dates in multiple languages, based on Carbon.",PHP,https://github.com/jenssegers/date
815,phphub,1811,509,1811,21,13/08/2014,25/01/2023,5.44 MB,5567,"(Deprecated See - https://github.com/summerblue/phphub5 ) PHPHub is a Forum project written in Laravel 4.2, and it is also the project build up PHP & Laravel China community - http://phphub.org.",PHP,https://github.com/summerblue/phphub
