Ranking,Project Name,Stars,Forks,Watchers,Open Issues,Created At,Last Commit,Size,Description,Language,Repo URL,Size
468,Crescendo,427,40,427,13,04/05/2020,27/09/2024,1.03 MB,a module for wrapping native applications in a PowerShell function and module,PowerShell,https://github.com/PowerShell/Crescendo,1.03 MB
469,Public-AD-Scripts,426,101,426,5,01/04/2020,16/02/2026,26.25 MB,AD Scripts,PowerShell,https://github.com/zjorz/Public-AD-Scripts,26.25 MB
470,VMwareCloak,425,67,425,3,02/01/2021,25/01/2025,67.00 KB,A PowerShell script that attempts to help malware analysts hide their VMware Windows VM's from malware that may be trying to evade analysis.,PowerShell,https://github.com/d4rksystem/VMwareCloak,67.00 KB
471,scripts,424,158,424,7,29/06/2015,29/08/2017,314.00 KB,,PowerShell,https://github.com/shellntel-acct/scripts,314.00 KB
472,Cobaltstrike-MS17-010,419,62,419,1,24/05/2019,13/06/2019,244.00 KB,cobaltstrike ms17-010 module and some other,PowerShell,https://github.com/phink-team/Cobaltstrike-MS17-010,244.00 KB
473,AzOps,418,171,418,15,20/06/2019,12/12/2025,9.71 MB,AzOps is a PowerShell module which deploys (Push) ARM Resource Templates & Bicep files at all Azure scope levels and exports (Pull) ARM resource hierarchy.,PowerShell,https://github.com/Azure/AzOps,9.71 MB
474,7Zip4Powershell,418,68,418,18,26/10/2012,16/02/2026,17.78 MB,Powershell module for creating and extracting 7-Zip archives,PowerShell,https://github.com/thoemmi/7Zip4Powershell,17.78 MB
475,RunAsUser,418,94,418,4,13/07/2020,09/01/2025,94.00 KB,"a PowerShell module that allows you to impersonate the currently logged on user, while running PowerShell.exe as system.",PowerShell,https://github.com/KelvinTegelaar/RunAsUser,94.00 KB
476,dpst-control,416,31,416,6,16/02/2019,30/07/2021,5.00 KB,Easily disable/enable Intel Display Power Saving Technology (DPST),PowerShell,https://github.com/orev/dpst-control,5.00 KB
477,dotfiles-win,416,156,416,3,25/03/2022,26/09/2023,14.00 KB,These are my user-specific configuration files that I use to personalize my Windows experience.,PowerShell,https://github.com/ChristianLempa/dotfiles-win,14.00 KB
478,MAAD-AF,414,62,414,2,09/02/2023,13/01/2026,540.00 KB,"MAAD Attack Framework - An attack tool for simple, fast & effective security testing of M365 & Entra ID (Azure AD).",PowerShell,https://github.com/vectra-ai-research/MAAD-AF,540.00 KB
479,Cloudtopolis,414,62,414,2,16/06/2020,22/08/2024,15.33 MB,Zero Infrastructure Password Cracking,PowerShell,https://github.com/JoelGMSec/Cloudtopolis,15.33 MB
480,Aggressor-scripts,413,91,413,2,02/03/2016,29/07/2023,2.87 MB,Aggressor scripts I've made for Cobalt Strike,PowerShell,https://github.com/Und3rf10w/Aggressor-scripts,2.87 MB
481,get-shit-done-for-antigravity,413,44,413,0,17/01/2026,19/02/2026,240.00 KB,,PowerShell,https://github.com/toonight/get-shit-done-for-antigravity,240.00 KB
482,CSPlugins,413,105,413,0,16/08/2020,26/12/2020,10.84 MB,Cobaltstrike Plugins,PowerShell,https://github.com/Al1ex/CSPlugins,10.84 MB
483,restic-windows-backup,413,78,413,24,08/02/2020,21/02/2025,114.00 KB,Powershell scripts to run Restic backups on Windows,PowerShell,https://github.com/kmwoley/restic-windows-backup,114.00 KB
484,windows-vagrant,412,111,412,9,15/01/2017,14/02/2026,474.00 KB,Windows 11/2022/2025 Base Vagrant Box (https://app.vagrantup.com/rgl),PowerShell,https://github.com/rgl/windows-vagrant,474.00 KB
485,Downloads,409,119,409,2,28/03/2020,16/02/2025,6.84 MB,"AD Health Check, Send HTML Email,  Ping machines, Encrypt Password,Bulk Password,Microsoft Teams,Monitor Certificate expiry, Monitor cert expiry, AD attributes, IP to Hostname, Export AD group, CSV to SQL,Shutdown, Restart, Local Admin, Disk Space, Account expiry,Restore Permissions, Backup permissions, Delete Files Older Than X-Days, export DHCP options,Read Registry,Distribution group AD attributes,Monitor Windows Services,Export Reverse DNS,Task Monitor,Monitor and alert, Exchange Health check,Get Network Info, Export AD Attributes,AD group members, Office 365 Group member, SQL to CSV, Outlook save send attachments, Upload files to FTP,Exchange – Total Messages Sent Received, Set Teams Only Mode, Intune Duplicate Device,Intune Cleanup Not Evaluated, Ownership and Grant Permissions, Write Create Modify Registry , Organization Hierarchy from AD,Azure AD Privileged Identity Management,Intune – Export MAM Devices,Intune Marking devices as Corporate, Dynamic to Static Distribution Group,Monitor Alert Office 365 services,Group Member Count,Bulk Addition external users sharepoint, ADD to Exchange online License Group,All in One Office 365 Powershell,Bulk Addition of Secondary Email, Automate move mailboxes to o365, Addition Modification Termination Exchange users, Monitoring Unified Messaging port,Unified Messaging Extensions Report, Set Default Quota for SharePoint,Bulk Contact Creation and Forwarding, Uploading and Downloading files sftp, Monitoring Sftp file and download, Office 365 groups Write back, CSV parser, Email address update, Email address modify, MDM enrollment, Welcome Email, Intune Welcome Email, remove messages, remove email, SKOB to AD, SKOB to group, PowerApps report, Powerautomate Report, Flow report, Server QA, Server Check List, O365 IP range, IP range Monitor, o365 Admin Roles, memberof extraction, CSV to Excel,  Skype Policy, UPN Flip, Rooms Report, License Reconciliation,Intune Bulk Device Removal, Device Removal, Clear Activesync, Lync Account Termination,Lync Account Removal, Enable office 365 services, Enable o365 Services, Export PST, Site collection Report, Office 365 Group Sites, System Admin,ActiveSync Report,White Space,Active Directory attributes, outlook automation, Intune Detect App, Distribution list Fix, Legacy DN, start service, stop service, disable service, Message tracking, Distribution lists report,Distribution groups report,Quota Report, Auto reply, out of office, robocopy multi session, Home Folder, local admin, Database, UPN SIP Mismatch, Recoverable deleted, teams number, Number assignment, teams phone, AD Group Hierarchy, Hierarchy membership, Sync Groups, Powerapps, Powerapps DLP, AzureAD application, Azure AD Secret, AzureAD Certificate, AzureAD Cert, Powerapps DLP, Download SPO file, Download Sharepoint file, Sharepoint item download",PowerShell,https://github.com/VikasSukhija/Downloads,6.84 MB
486,DRFiles,407,330,407,18,14/03/2017,18/02/2026,4.56 MB,Sample files for the Deployment Research Blog,PowerShell,https://github.com/DeploymentResearch/DRFiles,4.56 MB
487,pymetasploit3,407,95,407,25,26/02/2019,15/07/2025,1.27 MB,Automation library for Metasploit,PowerShell,https://github.com/DanMcInerney/pymetasploit3,1.27 MB
488,FakeSign,406,119,406,1,06/04/2023,11/12/2025,33.92 MB,自建时间戳服务器实现伪签名驱动证书 Implementing Pseudo Signature with Self-Sign Timestamp Servers,PowerShell,https://github.com/PIKACHUIM/FakeSign,33.92 MB
489,Master-User-Creator,404,89,404,40,26/06/2018,24/01/2020,21.04 MB,"GUI Application written in PowerShell to easily and quickly create, and configure Active Directory and/or Office 365 Users in a single window. Enable MFA, apply licenses, add to groups, and much more",PowerShell,https://github.com/bwya77/Master-User-Creator,21.04 MB
490,adaudit,404,107,404,6,20/04/2018,17/02/2026,153.00 KB,Powershell script to do domain auditing automation ,PowerShell,https://github.com/phillips321/adaudit,153.00 KB
491,flipperzero,403,40,403,1,17/08/2022,16/04/2024,40.00 KB,A collection of flipper zero stuff,PowerShell,https://github.com/rf-bandit/flipperzero,40.00 KB
492,DockerCompletion,403,68,403,1,15/08/2017,25/01/2026,435.00 KB,Docker command completion for PowerShell.,PowerShell,https://github.com/matt9ucci/DockerCompletion,435.00 KB
493,ShadowHound,400,39,400,1,21/11/2024,14/01/2026,940.00 KB,"PowerShell scripts for alternative SharpHound enumeration, including users, groups, computers, and certificates, using the ActiveDirectory module (ADWS) or System.DirectoryServices class (LDAP).",PowerShell,https://github.com/Friends-Security/ShadowHound,940.00 KB
494,powershell-profile,399,38,399,3,22/08/2016,11/01/2020,6.03 MB,Mike's Powershell Profile (and how to set up Windows console if you've been using *nix for 20 years),PowerShell,https://github.com/mikemaccana/powershell-profile,6.03 MB
495,ios-safari-remote-debug-kit,398,32,398,8,03/06/2021,02/09/2025,101.00 KB,Remotely debugging iOS Safari on Windows and Linux,PowerShell,https://github.com/HimbeersaftLP/ios-safari-remote-debug-kit,101.00 KB
496,PSAmsi,398,73,398,3,22/09/2017,22/04/2018,151.00 KB,PSAmsi is a tool for auditing and defeating AMSI signatures.,PowerShell,https://github.com/cobbr/PSAmsi,151.00 KB
497,IntuneDeviceDetailsGUI,397,40,397,10,31/03/2022,23/01/2026,3.52 MB,Intune Device Details GUI HTML v4.2 (New Updated!),PowerShell,https://github.com/petripaavola/IntuneDeviceDetailsGUI,3.52 MB
498,PowerLurk,397,67,397,0,13/07/2016,25/07/2016,1.24 MB,Malicious WMI Events using PowerShell,PowerShell,https://github.com/Sw4mpf0x/PowerLurk,1.24 MB
499,VBoxCloak,397,35,397,1,29/05/2020,04/07/2025,55.00 KB,A PowerShell script that attempts to help malware analysts hide their Windows VirtualBox Windows VM's from malware that may be trying to evade analysis. Guaranteed to bring down your pafish ratings by at least a few points ;),PowerShell,https://github.com/d4rksystem/VBoxCloak,55.00 KB
500,Invoke-Parallel,395,82,395,21,20/01/2015,17/02/2022,1.16 MB,Speed up PowerShell with simplified multithreading,PowerShell,https://github.com/RamblingCookieMonster/Invoke-Parallel,1.16 MB
501,IntuneAssignmentChecker,394,64,394,10,25/02/2024,19/02/2026,1.01 MB,"This script enables IT administrators to analyze and audit Intune assignments. It checks assignments for specific users, groups, or devices, displays all policies and their assignments, identifies unassigned policies and detects empty groups in assignments.",PowerShell,https://github.com/ugurkocde/IntuneAssignmentChecker,1.01 MB
502,TokenTacticsV2,391,48,391,2,16/08/2022,09/02/2026,1.71 MB,A fork of the great TokenTactics with support for CAE and token endpoint v2,PowerShell,https://github.com/f-bader/TokenTacticsV2,1.71 MB
503,Red-Team-Playbooks,391,97,391,0,09/12/2021,02/02/2026,1.55 MB,This repository contains cutting-edge open-source security notes and tools that will help you during your Red Team assessments.,PowerShell,https://github.com/0xsyr0/Red-Team-Playbooks,1.55 MB
504,servicenow-powershell,390,171,390,7,03/05/2015,01/02/2026,601.00 KB,PowerShell module to automate ServiceNow service and asset management.  This module can be used standalone or with Docker.,PowerShell,https://github.com/Snow-Shell/servicenow-powershell,601.00 KB
505,Optimize-WsusServer,390,70,390,18,31/07/2020,04/08/2023,139.00 KB,"Comprehensive Windows Server Update Services (WSUS) cleanup, optimization, maintenance, and configuration PowerShell script.",PowerShell,https://github.com/awarre/Optimize-WsusServer,139.00 KB
506,BadUSB-code,390,133,390,2,11/01/2016,19/06/2018,14.44 MB,收集badusb的一些利用方式及代码,PowerShell,https://github.com/Xyntax/BadUSB-code,14.44 MB
507,Microsoft-365,390,160,390,4,13/05/2019,20/09/2024,45.63 MB,Scripts to help configure Microsoft 365 ,PowerShell,https://github.com/vanvfields/Microsoft-365,45.63 MB
508,SqlServerDsc,389,226,389,299,15/04/2015,19/02/2026,21.35 MB,"This module contains commands and DSC resources for deployment and configuration of Microsoft SQL Server, SQL Server Reporting Services and Power BI Report Server.",PowerShell,https://github.com/dsccommunity/SqlServerDsc,21.35 MB
509,PSHTML-AD-Report,388,131,388,30,01/12/2018,23/12/2022,59.00 KB,Create a high level interactive HTML report for you Active Directory environment using PowerShell,PowerShell,https://github.com/bwya77/PSHTML-AD-Report,59.00 KB
510,WMIOps,388,84,388,2,20/11/2015,25/06/2024,81.00 KB,"This repo is for WMIOps, a powershell script which uses WMI for various purposes across a network.",PowerShell,https://github.com/RedSiege/WMIOps,81.00 KB
511,RDPWrap,386,129,386,0,14/10/2019,10/07/2025,9.16 MB,RDPwrap  + win10 privacy,PowerShell,https://github.com/SobieskiCodes/RDPWrap,9.16 MB
512,heat-templates,385,386,385,0,25/04/2013,20/08/2025,886.00 KB,OpenStack Orchestration (Heat) Templates. Mirror of code maintained at opendev.org.,PowerShell,https://github.com/openstack/heat-templates,886.00 KB
513,Set-OutlookSignatures,385,34,385,0,04/04/2021,11/02/2026,95.77 MB,"Email signatures and out-of-office replies for Exchange and Outlook. Full-featured, cost-effective, unsurpassed data privacy.",PowerShell,https://github.com/Set-OutlookSignatures/Set-OutlookSignatures,95.77 MB
514,DAMP,381,75,381,5,06/04/2018,25/07/2019,28.00 KB,The Discretionary ACL Modification Project: Persistence Through Host-based Security Descriptor Modification,PowerShell,https://github.com/HarmJ0y/DAMP,28.00 KB
515,nathanmcnulty,381,41,381,3,09/07/2020,14/02/2026,9.83 MB,,PowerShell,https://github.com/nathanmcnulty/nathanmcnulty,9.83 MB
516,kbupdate,379,60,379,37,07/07/2019,09/07/2024,15.89 MB,"🛡 KB Viewer, Saver, Installer and Uninstaller",PowerShell,https://github.com/potatoqualitee/kbupdate,15.89 MB
517,My-Payloads,378,217,378,0,09/08/2022,17/11/2024,14.96 MB,"A collection of my payloads for the bash bunny, rubber ducky, FlipperZero, and OMG cable",PowerShell,https://github.com/atomiczsec/My-Payloads,14.96 MB
518,Amsi_Bypass_In_2023,377,67,377,0,30/07/2023,30/07/2023,715.00 KB,Amsi Bypass payload that works on Windwos 11,PowerShell,https://github.com/senzee1984/Amsi_Bypass_In_2023,715.00 KB
519,EventList,377,42,377,10,03/06/2019,21/03/2021,345.00 KB,EventList,PowerShell,https://github.com/miriamxyra/EventList,345.00 KB
520,HardenAD,376,54,376,3,29/05/2021,10/12/2025,92.92 MB,Hardening Active Directory version 2,PowerShell,https://github.com/LoicVeirman/HardenAD,92.92 MB
521,EdgeRemover,376,19,376,7,16/07/2023,13/06/2025,2.37 MB,A PowerShell script that correctly uninstalls or reinstalls Microsoft Edge on Windows 10 & 11.,PowerShell,https://github.com/he3als/EdgeRemover,2.37 MB
522,FzDumps,374,37,374,4,07/12/2022,21/01/2023,247.66 MB,I compiled all the dumps from https://github.com/djsime1/awesome-flipperzero and https://github.com/UberGuidoZ/Flipper into 2 organised folders.,PowerShell,https://github.com/Z3BRO/FzDumps,247.66 MB
523,ActiveDirectoryDsc,373,143,373,44,08/04/2015,06/12/2025,3.10 MB,This module contains DSC resources for deployment and configuration of Active Directory Domain Services.,PowerShell,https://github.com/dsccommunity/ActiveDirectoryDsc,3.10 MB
524,PSVirtualDesktop,372,23,372,1,19/05/2019,25/08/2025,288.00 KB,VirtualDesktop is a Powershell module that provides commandlets to manage virtual desktops of Windows 10.,PowerShell,https://github.com/MScholtes/PSVirtualDesktop,288.00 KB
525,Screwed-Drivers,372,54,372,0,25/07/2019,19/03/2020,71.58 MB,"""Screwed Drivers"" centralized information source for code references, links, etc.",PowerShell,https://github.com/eclypsium/Screwed-Drivers,71.58 MB
526,DCToolbox,372,54,372,50,08/11/2020,26/11/2024,289.00 KB,Tools for Microsoft cloud fans,PowerShell,https://github.com/DanielChronlund/DCToolbox,289.00 KB
527,PowerSCCM,371,116,371,2,28/01/2016,22/01/2022,93.00 KB,PowerSCCM - PowerShell module to interact with SCCM deployments,PowerShell,https://github.com/PowerShellMafia/PowerSCCM,93.00 KB
528,Invoke-ATTACKAPI,370,83,370,0,21/08/2017,07/02/2019,3.09 MB,A PowerShell script to interact with the MITRE ATT&CK Framework via its own API,PowerShell,https://github.com/Cyb3rWard0g/Invoke-ATTACKAPI,3.09 MB
529,Apple-Mobile-Drivers-Installer,368,29,368,2,05/12/2023,23/04/2025,30.00 KB,Powershell script to easily install Apple USB and Mobile Device Ethernet (USB Tethering) drivers on Windows!,PowerShell,https://github.com/NelloKudo/Apple-Mobile-Drivers-Installer,30.00 KB
530,SC-200T00A-Microsoft-Security-Operations-Analyst,366,277,366,1,14/01/2021,13/02/2026,5.08 MB,,PowerShell,https://github.com/MicrosoftLearning/SC-200T00A-Microsoft-Security-Operations-Analyst,5.08 MB
531,Force-Windows-11-Install,364,75,364,4,02/07/2021,28/03/2024,4.85 MB,Modifies Windows 11 installation ISO to bypass compatibility checks both pre and post installation,PowerShell,https://github.com/JosephM101/Force-Windows-11-Install,4.85 MB
532,IntuneDocumentation,363,88,363,0,25/06/2017,06/02/2025,629.00 KB,Automatic Intune Documentation to simplify the life of admins and consultants.,PowerShell,https://github.com/ThomasKur/IntuneDocumentation,629.00 KB
533,EventLogMaster,363,71,363,0,17/12/2019,23/12/2019,467.00 KB,Cobalt Strike插件 - RDP日志取证&清除,PowerShell,https://github.com/QAX-A-Team/EventLogMaster,467.00 KB
534,PowerShell,361,95,361,10,13/01/2016,17/06/2025,4.28 MB,My PS Scripts,PowerShell,https://github.com/gangstanthony/PowerShell,4.28 MB
535,PowerShell-Beautifier,361,37,361,25,11/06/2017,11/02/2020,305.00 KB,A whitespace reformatter and code cleaner for Windows PowerShell and PowerShell Core,PowerShell,https://github.com/DTW-DanWard/PowerShell-Beautifier,305.00 KB
536,Invoke-SharpLoader,360,73,360,0,20/03/2020,24/04/2021,20.64 MB,,PowerShell,https://github.com/S3cur3Th1sSh1t/Invoke-SharpLoader,20.64 MB
537,AzurePipelines,360,430,360,24,08/09/2015,19/02/2026,36.12 MB,A single Repo to contain the source for ALL my Azure DevOps Build/Release Extensions. The packages can be found in the Azure DevOps Marketplace,PowerShell,https://github.com/rfennell/AzurePipelines,36.12 MB
538,AzureOptimizationEngine,359,107,359,1,04/05/2020,12/07/2024,13.83 MB,The Azure Optimization Engine is an extensible solution designed to generate optimization recommendations for your Azure environment. See it like a fully customizable Azure Advisor.,PowerShell,https://github.com/helderpinto/AzureOptimizationEngine,13.83 MB
539,Office365,359,71,359,2,22/02/2019,09/08/2023,162.00 KB,Office 365 Powershell scripts,PowerShell,https://github.com/Scine/Office365,162.00 KB
540,Graphical,358,33,358,18,04/09/2017,30/11/2023,13.83 MB,"Open-Source, Platform independent module that consumes data points as input and plots them on a 2D graph 📈📊💹 [Scatter / Bar / Line] on the PowerShell Console/Terminal",PowerShell,https://github.com/PrateekKumarSingh/Graphical,13.83 MB
541,orca,358,62,358,29,13/11/2019,20/06/2024,692.00 KB,The Microsoft Defender for Office 365 Recommended Configuration Analyzer (ORCA),PowerShell,https://github.com/cammurray/orca,692.00 KB
542,jax-windows-builder,356,19,356,11,30/07/2021,09/12/2023,33.00 KB,A community supported Windows build for jax.,PowerShell,https://github.com/cloudhan/jax-windows-builder,33.00 KB
543,WinRice,356,28,356,0,29/07/2020,04/02/2026,12.17 MB,Set up your brand new Windows device up to a breathtaking 60 times faster.,PowerShell,https://github.com/pratyakshm/WinRice,12.17 MB
544,LudusHound,356,28,356,2,11/07/2025,03/09/2025,61.64 MB,"LudusHound is a tool for red and blue teams that transforms BloodHound data into a fully functional, Active Directory replica environment via Ludus for controlled testing.",PowerShell,https://github.com/bagelByt3s/LudusHound,61.64 MB
545,Extras-CN,355,73,355,0,17/11/2019,17/02/2026,1.29 MB,🍨 专注于服务国人的 Scoop 扩展库 🍨,PowerShell,https://github.com/Scoopforge/Extras-CN,1.29 MB
546,PS-SFTA,355,72,355,11,07/09/2020,10/10/2022,23.00 KB,PowerShell Set File Type Association,PowerShell,https://github.com/DanysysTeam/PS-SFTA,23.00 KB
547,PowershellKerberos,355,46,355,0,22/04/2023,27/07/2023,17.00 KB,Some scripts to abuse kerberos using Powershell,PowerShell,https://github.com/MzHmO/PowershellKerberos,17.00 KB
548,ATTACKdatamap,355,61,355,2,06/04/2019,03/11/2020,2.56 MB,A datasource assessment on an event level to show potential coverage or the MITRE ATT&CK framework,PowerShell,https://github.com/olafhartong/ATTACKdatamap,2.56 MB
549,Oh-My-Posh,354,35,354,7,03/12/2015,10/01/2023,115.00 KB,"Powershell amazingness inspired on Oh-My-Zsh, pshazz, fish. This provides a repository for PowerShell Customizations",PowerShell,https://github.com/pecigonzalo/Oh-My-Posh,115.00 KB
550,AI-900-AIFundamentals,352,317,352,0,20/09/2021,06/09/2024,129.08 MB,Includes labs for AI Fundamentals. ,PowerShell,https://github.com/MicrosoftLearning/AI-900-AIFundamentals,129.08 MB
551,FFU,352,36,352,17,15/02/2023,20/02/2026,17.81 MB,Using Full Flash Update files to speed up Windows Deployment,PowerShell,https://github.com/rbalsleyMSFT/FFU,17.81 MB
552,qt-minimalistic-builds,352,58,352,0,22/01/2018,03/02/2026,5.27 MB,Precompiled x64 Qt 5/6 library in minimalistic configuration for Windows.,PowerShell,https://github.com/martinrotter/qt-minimalistic-builds,5.27 MB
553,PSSQLite,351,66,351,15,14/03/2015,15/03/2024,5.75 MB,PowerShell module to query SQLite databases,PowerShell,https://github.com/RamblingCookieMonster/PSSQLite,5.75 MB
554,tinytex-releases,350,34,350,13,14/09/2020,02/02/2026,164.00 KB,Windows/macOS/Linux binaries and installation methods of TinyTeX,PowerShell,https://github.com/rstudio/tinytex-releases,164.00 KB
555,CVE-2021-44228_scanner,350,86,350,0,14/12/2021,23/03/2022,450.00 KB,Scanners for Jar files that may be vulnerable to CVE-2021-44228,PowerShell,https://github.com/CERTCC/CVE-2021-44228_scanner,450.00 KB
556,PSDeploy,350,72,350,23,07/08/2015,13/01/2021,1.30 MB,Simple PowerShell based deployments,PowerShell,https://github.com/RamblingCookieMonster/PSDeploy,1.30 MB
557,ADPE2E,348,234,348,6,08/05/2019,12/02/2023,213.19 MB,Azure Data Platform End-to-End,PowerShell,https://github.com/fabragaMS/ADPE2E,213.19 MB
558,CVE-2023-23397-POC-Powershell,347,60,347,0,16/03/2023,17/03/2023,4.00 KB,,PowerShell,https://github.com/api0cradle/CVE-2023-23397-POC-Powershell,4.00 KB
559,JiraPS,347,140,347,159,08/07/2015,02/02/2026,3.04 MB,PowerShell module to interact with Atlassian JIRA,PowerShell,https://github.com/AtlassianPS/JiraPS,3.04 MB
560,scloud,345,139,345,12,12/11/2021,02/12/2025,282.60 MB,Code Snippets mentioned at my Blog: scloud.work,PowerShell,https://github.com/FlorianSLZ/scloud,282.60 MB
561,PenTesting-Scripts,344,126,344,1,15/05/2015,08/10/2021,42.00 KB,A ton of helpful tools,PowerShell,https://github.com/killswitch-GUI/PenTesting-Scripts,42.00 KB
562,PowerShell,343,109,343,1,27/07/2015,10/02/2026,2.44 MB,NetSPI PowerShell Scripts,PowerShell,https://github.com/NetSPI/PowerShell,2.44 MB
563,CyberPipe,342,52,342,0,13/01/2021,03/12/2025,30.93 MB,An easy to use PowerShell script to collect memory and disk forensics for DFIR investigations.,PowerShell,https://github.com/dwmetz/CyberPipe,30.93 MB
564,ci,342,64,342,799,15/08/2014,10/08/2024,205.00 KB,AppVeyor community support repository,PowerShell,https://github.com/appveyor/ci,205.00 KB
565,garytown,341,114,341,2,26/05/2017,19/02/2026,743.20 MB,"GaryTown Scripts, Downloads, Etc",PowerShell,https://github.com/gwblok/garytown,743.20 MB
566,DLLHijackTest,340,59,340,2,20/06/2020,01/10/2020,427.00 KB,DLL and PowerShell script to assist with finding DLL hijacks,PowerShell,https://github.com/slyd0g/DLLHijackTest,427.00 KB
567,windows-terminal,338,23,338,1,22/06/2019,29/05/2025,1.28 MB,🧛🏻‍♂️ Dark theme for Windows Terminal,PowerShell,https://github.com/dracula/windows-terminal,1.28 MB
568,RandomStuff,338,290,338,0,03/02/2020,16/02/2026,126.02 MB,Random Stuff,PowerShell,https://github.com/johnthebrit/RandomStuff,126.02 MB
569,packer-plugin-windows-update,337,74,337,49,26/04/2017,27/01/2026,271.00 KB,Packer plugin for installing Windows updates,PowerShell,https://github.com/rgl/packer-plugin-windows-update,271.00 KB
570,RedRabbit,336,78,336,7,20/02/2020,31/07/2023,1.28 MB,Red Team PowerShell Script,PowerShell,https://github.com/securethelogs/RedRabbit,1.28 MB
571,ComputerManagementDsc,336,81,336,74,15/04/2015,30/01/2026,1.95 MB,"DSC resources for for configuration of a Windows computer. These DSC resources allow you to perform computer management tasks, such as renaming the computer, joining a domain and scheduling tasks as well as configuring items such as virtual memory, event logs, time zones and power settings.",PowerShell,https://github.com/dsccommunity/ComputerManagementDsc,1.95 MB
572,catppuccin,336,8,336,7,05/07/2023,18/12/2025,14.79 MB,soothing pastel suite for rainmeter,PowerShell,https://github.com/modkavartini/catppuccin,14.79 MB
573,PowerShell-Scripts,335,93,335,3,04/09/2015,14/02/2023,257.00 KB,"PowerShell scripts ranging from SCCM, MSO, AD, and other corporate enterprise uses... to sending cat facts to coworkers.",PowerShell,https://github.com/nickrod518/PowerShell-Scripts,257.00 KB
574,VSCELicense,335,100,335,2,23/12/2018,15/10/2022,27.00 KB,PowerShell module to get and set Visual Studio Community Edition license expiration date in registry,PowerShell,https://github.com/beatcracker/VSCELicense,27.00 KB
575,PowerShell,335,81,335,5,23/08/2011,29/01/2026,420.00 KB,Support for the MS PowerShell programming language.,PowerShell,https://github.com/SublimeText/PowerShell,420.00 KB
576,scoop-games,334,189,334,124,08/05/2018,20/02/2026,13.81 MB,Scoop bucket for open source/freeware games and game-related tools,PowerShell,https://github.com/Calinou/scoop-games,13.81 MB
577,docker-agents,333,249,333,19,17/09/2015,18/02/2026,2.17 MB,Jenkins agent (base image) and inbound agent Docker images,PowerShell,https://github.com/jenkinsci/docker-agents,2.17 MB
578,acCOMplice,332,51,332,0,04/09/2019,15/10/2019,37.90 MB,Tools for discovery and abuse of COM hijacks,PowerShell,https://github.com/nccgroup/acCOMplice,37.90 MB
579,Tools,332,272,332,1,05/07/2012,18/03/2024,957.28 MB,GitHub repository for sysadmin related tools,PowerShell,https://github.com/chrisdee/Tools,957.28 MB
580,OSEPlayground,331,78,331,0,20/11/2024,09/08/2025,4.00 MB,A collection of useful tools and scripts were developed and gathered throughout the Offensive Security's PEN-300 (OSEP) course.,PowerShell,https://github.com/Extravenger/OSEPlayground,4.00 MB
