Ranking,Project Name,Stars,Forks,Watchers,Open Issues,Created At,Last Commit,Size,Description,Language,Repo URL,Size
707,covid19,265,573,265,5,23/12/2020,10/02/2024,1.53 MB,Resources for the Udemy Course - Azure Data Factory For Data Engineers - Project on Covid19 by Ramesh Retnasamy,PowerShell,https://github.com/cloudboxacademy/covid19,1.53 MB
708,PSGumshoe,265,51,265,6,24/08/2016,25/10/2025,581.00 KB,,PowerShell,https://github.com/PSGumshoe/PSGumshoe,581.00 KB
709,ProcessSpawnControl,264,57,264,3,26/11/2018,15/01/2022,38.23 MB,"Process Spawn Control is a Powershell tool which aims to help in the behavioral (process) analysis of malware. PsC suspends newly launched processes, and gives the analyst the option to either keep the process suspended, or to resume it.",PowerShell,https://github.com/felixweyne/ProcessSpawnControl,38.23 MB
710,MakeMeEnterpriseAdmin,264,57,264,0,26/08/2016,15/07/2022,44.00 KB,,PowerShell,https://github.com/vletoux/MakeMeEnterpriseAdmin,44.00 KB
711,active-directory-dotnetcore-daemon-v2,264,158,264,4,14/09/2018,27/01/2025,2.22 MB,A .NET Core daemon console application calling Microsoft Graph or your own WebAPI with its own identity,PowerShell,https://github.com/Azure-Samples/active-directory-dotnetcore-daemon-v2,2.22 MB
712,Microsoft-Sentinel-SecOps,264,66,264,0,27/02/2020,10/07/2024,7.13 MB,Microsoft Sentinel SOC Operations,PowerShell,https://github.com/eshlomo1/Microsoft-Sentinel-SecOps,7.13 MB
713,LSUClient,264,27,264,5,30/07/2019,12/10/2025,410.00 KB,"Orchestrate driver, BIOS/UEFI and firmware updates for Lenovo computers 👨‍💻",PowerShell,https://github.com/jantari/LSUClient,410.00 KB
714,compact-wsl2-disk,264,28,264,5,10/11/2020,07/03/2023,18.00 KB,A small script for Windows 10 Home users to compact their WSL2 disks,PowerShell,https://github.com/mikemaccana/compact-wsl2-disk,18.00 KB
715,Uproot,262,35,262,2,07/10/2014,23/02/2016,216.00 KB,Currently not updated for WMIEvent module...,PowerShell,https://github.com/Invoke-IR/Uproot,216.00 KB
716,lockdown-browser,262,48,262,12,28/11/2020,16/01/2026,2.64 MB,Run the ”Respondus Lockdown Browser“ in the ”Windows Sandbox“,PowerShell,https://github.com/gucci-on-fleek/lockdown-browser,2.64 MB
717,Versions,261,245,261,66,23/01/2016,19/02/2026,36.27 MB,📦 A Scoop bucket for alternative versions of apps.,PowerShell,https://github.com/ScoopInstaller/Versions,36.27 MB
718,Cloud-Katana,261,33,261,1,20/07/2021,15/03/2024,10.74 MB,Unlocking Serverless Computing to Assess Security Controls,PowerShell,https://github.com/Azure/Cloud-Katana,10.74 MB
719,MalwareLab_VM-Setup,261,47,261,0,12/12/2020,20/02/2022,5.29 MB,Setup scripts for my Malware Analysis VMs,PowerShell,https://github.com/f0wl/MalwareLab_VM-Setup,5.29 MB
720,Invoke-Bof,260,35,260,1,09/12/2021,09/12/2021,20.00 KB,Load any Beacon Object File using Powershell!,PowerShell,https://github.com/airbus-cert/Invoke-Bof,20.00 KB
721,Toast-Notification-Script,260,65,260,0,03/07/2020,16/02/2026,9.95 MB,My Windows Toast Notification Script explained in details here: https://imab.dk/windows-10-toast-notification-script/,PowerShell,https://github.com/imabdk/Toast-Notification-Script,9.95 MB
722,PowerShell-Script-Menu-Gui,260,32,260,4,08/10/2019,11/05/2021,21.04 MB,Make a graphical menu of PowerShell scripts with a CSV file. Easy to customise and fast to launch.,PowerShell,https://github.com/dan-osull/PowerShell-Script-Menu-Gui,21.04 MB
723,meta-runner-power-pack,259,121,259,54,27/06/2013,07/02/2024,5.18 MB,A set of Meta-runners for TeamCity,PowerShell,https://github.com/JetBrains/meta-runner-power-pack,5.18 MB
724,azure-blueprints,259,149,259,24,29/10/2018,28/07/2022,629.00 KB,A library of sample Blueprints that can be easily imported via API or PowerShell,PowerShell,https://github.com/Azure/azure-blueprints,629.00 KB
725,win10-storage-spaces,259,44,259,12,02/04/2020,25/03/2024,140.00 KB,Scripts for creating an destroying Fault Tolerant multi-tier storage spaces on Windows 10,PowerShell,https://github.com/freemansoft/win10-storage-spaces,140.00 KB
726,pbimonitor,258,97,258,35,05/06/2021,10/04/2025,13.07 MB,,PowerShell,https://github.com/RuiRomano/pbimonitor,13.07 MB
727,azure.datafactory.tools,258,86,258,28,08/04/2020,24/10/2025,1012.00 KB,Tools for deploying Data Factory (v2) in Microsoft Azure,PowerShell,https://github.com/Azure-Player/azure.datafactory.tools,1012.00 KB
728,blackhat-usa-2022-demos,258,25,258,0,13/08/2022,14/08/2022,4.11 MB,"Demos for the Blackhat USA 2022 talk ""Taking Kerberos to the Next Level""",PowerShell,https://github.com/tyranid/blackhat-usa-2022-demos,4.11 MB
729,securedworkstation,258,59,258,19,09/05/2019,13/08/2024,224.00 KB,Intune managed Secured workstation,PowerShell,https://github.com/Azure/securedworkstation,224.00 KB
730,AzureStack-Tools,258,282,258,26,26/08/2016,11/12/2025,162.08 MB,Scripts and tools that help customers use Azure and Azure Stack,PowerShell,https://github.com/Azure/AzureStack-Tools,162.08 MB
731,AD-Canaries,258,14,258,1,24/11/2023,24/11/2023,16.02 MB,The purpose of this project is to publish and maintain the deployment PowerShell script that automates deployments for Active Directory Canary objects.,PowerShell,https://github.com/AirbusProtect/AD-Canaries,16.02 MB
732,PSWinDocumentation,257,42,257,13,29/06/2018,14/02/2026,1019.00 KB,"PowerShell Module that creates Word/Excel/SQL documentation from Active Directory (AD), AWS, Office 365 and others. It's a work in progress!",PowerShell,https://github.com/EvotecIT/PSWinDocumentation,1019.00 KB
733,CobaltStrike-KunKun,257,44,257,13,26/03/2025,18/04/2025,150.89 MB,坤坤CS 基于CobaltStrike cat 4.5二开项目 添加反沙箱、反测绘。集成常用后渗透插件，开箱即用,PowerShell,https://github.com/D13Xian/CobaltStrike-KunKun,150.89 MB
734,wuwatracker,256,59,256,3,29/05/2024,28/12/2025,19.47 MB,"✨ ~ a collection of Wuthering Waves tools; pity tracker, waveplate tracker, event timeline, global statistics, planner, database, and more!",PowerShell,https://github.com/wuwatracker/wuwatracker,19.47 MB
735,BCF-XML,256,88,256,17,16/08/2013,21/10/2024,18.04 MB,XML specification for BIM Collaboration Format,PowerShell,https://github.com/buildingSMART/BCF-XML,18.04 MB
736,scripts,256,61,256,2,16/01/2023,06/02/2026,180.37 MB,平台：Windows/Mac/Linux。脚本语言：多种、不限；我流，按需编写。涉及：桌面基线排查、软件激活破解、免杀及特权执行、渗透式支援固件识别读写、主机账户密码空值检测、Wi-Fi密码扫描、云主机终端安全加固、主机系统日志分析、自然语言处理、人文社科信息数据分析等。,PowerShell,https://github.com/hoochanlon/scripts,180.37 MB
737,Java-Android-Magisk-Burp-Objection-Root-Emulator-Easy,256,29,256,45,20/09/2022,04/02/2026,1.04 MB,Java Android Magisk Burp Objection Root Emulator Easy (JAMBOREE),PowerShell,https://github.com/freeload101/Java-Android-Magisk-Burp-Objection-Root-Emulator-Easy,1.04 MB
738,Payload-Download-Cradles,256,55,256,1,14/05/2021,07/07/2022,49.00 KB,This are different types of download cradles which should be an inspiration to play and create new download cradles to bypass AV/EPP/EDR in context of download cradle detections.,PowerShell,https://github.com/VirtualAlllocEx/Payload-Download-Cradles,49.00 KB
739,PoShKeePass,255,58,255,56,05/10/2015,18/01/2020,1.15 MB,PowerShell module for KeePass,PowerShell,https://github.com/PSKeePass/PoShKeePass,1.15 MB
740,vGPU_LicenseBypass,255,45,255,3,13/07/2021,23/08/2022,14.00 KB,A simple script that works around Nvidia vGPU licensing with a scheduled task.,PowerShell,https://github.com/KrutavShah/vGPU_LicenseBypass,14.00 KB
741,Azurite,254,70,254,6,17/08/2016,20/02/2019,34.00 KB,Enumeration and reconnaissance activities in the Microsoft Azure Cloud.,PowerShell,https://github.com/FSecureLABS/Azurite,34.00 KB
742,DVS,254,45,254,0,20/08/2020,13/10/2020,132.00 KB,D(COM) V(ulnerability) S(canner) AKA Devious swiss army knife - Lateral movement using DCOM Objects,PowerShell,https://github.com/ScorpionesLabs/DVS,132.00 KB
743,SnipScripts,254,272,254,0,06/06/2018,25/07/2019,3.57 MB,This is where all scripts demonstrated by our TechSnips contributors will be provided free of charge.,PowerShell,https://github.com/TechSnips/SnipScripts,3.57 MB
744,Collect-MemoryDump,253,30,253,0,14/07/2022,29/10/2025,6.98 MB,Collect-MemoryDump - Automated Creation of Windows Memory Snapshots for DFIR,PowerShell,https://github.com/LETHAL-FORENSICS/Collect-MemoryDump,6.98 MB
745,azure-files-samples,253,201,253,82,21/02/2019,05/02/2026,4.21 MB,"This repository contains supporting code (PowerShell modules/scripts, ARM templates, etc.) for deploying, configuring, and using Azure Files.",PowerShell,https://github.com/Azure-Samples/azure-files-samples,4.21 MB
746,PSInject,252,82,252,0,11/04/2017,11/02/2019,228.00 KB,Inject PowerShell into any process,PowerShell,https://github.com/EmpireProject/PSInject,228.00 KB
747,dfirt,252,41,252,3,17/09/2021,05/06/2023,9.00 KB,Collect information of Windows PC when doing incident response,PowerShell,https://github.com/mamun-sec/dfirt,9.00 KB
748,PScribo,250,40,250,25,13/09/2015,07/03/2025,1.09 MB,PowerShell documentation framework,PowerShell,https://github.com/iainbrighton/PScribo,1.09 MB
749,PSReflect-Functions,250,59,250,6,22/05/2017,06/06/2024,456.00 KB,Module to provide PowerShell functions that abstract Win32 API functions,PowerShell,https://github.com/jaredcatkinson/PSReflect-Functions,456.00 KB
750,sliver-cheatsheet,250,57,250,0,11/05/2025,29/11/2025,30.67 MB,Sliver CheatSheet for OSEP,PowerShell,https://github.com/Anon-Exploiter/sliver-cheatsheet,30.67 MB
751,AMSI-ETW-Patch,249,34,249,0,10/11/2022,08/05/2024,233.00 KB,Patch AMSI and ETW,PowerShell,https://github.com/Mr-Un1k0d3r/AMSI-ETW-Patch,233.00 KB
752,PSGSuite,249,69,249,100,02/08/2016,16/12/2025,25.76 MB,Powershell module for Google / G Suite API calls wrapped in handy functions. Authentication is established using a service account via P12 key to negate the consent popup and allow for greater handsoff automation capabilities,PowerShell,https://github.com/SCRT-HQ/PSGSuite,25.76 MB
753,PSExcel,249,66,249,42,28/03/2015,31/08/2021,1.14 MB,A simple Excel PowerShell module,PowerShell,https://github.com/RamblingCookieMonster/PSExcel,1.14 MB
754,PowerUp,249,102,249,2,22/04/2014,18/04/2017,704.00 KB,This version of PowerUp is now unsupported. See https://github.com/Veil-Framework/PowerTools/tree/master/PowerUp for the most current version.,PowerShell,https://github.com/HarmJ0y/PowerUp,704.00 KB
755,Files,248,114,248,1,21/11/2015,19/02/2025,445.00 KB,The Bunny Files,PowerShell,https://github.com/DeploymentBunny/Files,445.00 KB
756,csplugin,248,38,248,0,13/08/2020,10/02/2023,20.17 MB,自己开的cs插件,PowerShell,https://github.com/jiushill/csplugin,20.17 MB
757,Patcher64Plus-Tool,247,17,247,13,06/06/2020,05/01/2026,620.04 MB,Patcher64+ Tool,PowerShell,https://github.com/Admentus64/Patcher64Plus-Tool,620.04 MB
758,AzADServicePrincipalInsights,247,54,247,0,13/09/2021,30/04/2025,1.90 MB,"Insights and change tracking on Microsoft Entra ID Service Principals (Enterprise Applications, Applications and Managed Identities)",PowerShell,https://github.com/JulianHayward/AzADServicePrincipalInsights,1.90 MB
759,StarterProject,246,19,246,2,02/01/2025,05/11/2025,5.42 MB,"A lightweight uproject that debloats Unreal Engine, reducing package size and increasing editor and game performance.",PowerShell,https://github.com/daftsoftware/StarterProject,5.42 MB
760,iot-adk-addonkit,246,211,246,15,03/03/2016,08/01/2023,180.83 MB,Contains command line scripts for package creation and image creation process and samples for iot products,PowerShell,https://github.com/ms-iot/iot-adk-addonkit,180.83 MB
761,Slacker,245,26,245,3,05/07/2022,09/09/2025,66.59 MB,懒鬼插件/审计过的后的渗透插件/我凭本事打的SESSION凭什么还要我自己动手后渗透？,PowerShell,https://github.com/9bie/Slacker,66.59 MB
762,melody_windows,245,24,245,9,30/12/2021,02/02/2026,11.30 MB,Melody Optimization Script for Windows,PowerShell,https://github.com/ionuttbara/melody_windows,11.30 MB
763,ZTW-2025,245,77,245,0,24/01/2025,21/02/2025,8.82 MB,,PowerShell,https://github.com/ztwAdmin/ZTW-2025,8.82 MB
764,misc-powershell,245,74,245,9,10/05/2016,13/02/2026,3.15 MB,Miscellaneous PowerShell Scripts,PowerShell,https://github.com/pldmgg/misc-powershell,3.15 MB
765,APEX,244,22,244,0,12/01/2025,27/10/2025,984.00 KB,Azure Post Exploitation Framework,PowerShell,https://github.com/LuemmelSec/APEX,984.00 KB
766,PSAI,244,28,244,0,14/04/2024,13/01/2026,3.59 MB,PowerShell AI module. Think ChatGPT meets PowerShell - Includes Autonomous Agents,PowerShell,https://github.com/dfinke/PSAI,3.59 MB
767,ADB-Debloating,243,35,243,0,05/02/2020,26/08/2025,161.00 KB,"Debloat MIUI/HyperOS, One UI, and Pixel Launcher via ADB",PowerShell,https://github.com/farag2/ADB-Debloating,161.00 KB
768,powershell_scripts,243,58,243,0,09/03/2012,20/08/2020,1.60 MB,Powershell Scripts ,PowerShell,https://github.com/darkoperator/powershell_scripts,1.60 MB
769,precompiled-binaries,243,59,243,0,08/08/2023,16/02/2026,11.26 MB,Collection of useful pre-compiled .NET binaries or other executables for penetration testing Windows Active Directory environments,PowerShell,https://github.com/jakobfriedl/precompiled-binaries,11.26 MB
770,ConvertOneNote2MarkDown,242,132,242,7,19/05/2019,07/09/2023,36.00 KB,"Ready to make the step to Markdown and saying farewell to your OneNote, EverNote or whatever proprietary note taking tool you are using? Nothing beats clear text, right? Read on!",PowerShell,https://github.com/SjoerdV/ConvertOneNote2MarkDown,36.00 KB
771,vsphere-automated-lab-deployment,242,131,242,13,19/11/2016,28/02/2023,1.46 MB,"vSphere Automated Lab Deployment for vSphere 6.x (6.0, 6.5 & 6.7)",PowerShell,https://github.com/lamw/vsphere-automated-lab-deployment,1.46 MB
772,RACE,242,66,242,2,25/07/2019,05/05/2023,92.00 KB,RACE is a PowerShell module for executing ACL attacks against Windows targets.,PowerShell,https://github.com/samratashok/RACE,92.00 KB
773,HTTP-Shell,242,40,242,0,05/09/2023,31/12/2025,1.18 MB,MultiPlatform HTTP Reverse Shell,PowerShell,https://github.com/JoelGMSec/HTTP-Shell,1.18 MB
774,Scripts,241,157,241,4,19/06/2012,12/09/2021,82.87 MB,GitHub repository for sysadmin related scripts ,PowerShell,https://github.com/chrisdee/Scripts,82.87 MB
775,UAC-bypass,241,48,241,0,15/05/2017,23/05/2017,2.00 KB,,PowerShell,https://github.com/winscripting/UAC-bypass,2.00 KB
776,epv-api-scripts,241,196,241,1,26/10/2017,02/02/2026,2.44 MB,"These API scripts enable CyberArk users to automate privileged account management task like account creation, user management, and more.",PowerShell,https://github.com/cyberark/epv-api-scripts,2.44 MB
777,tau-tools,240,72,240,1,28/11/2018,22/07/2021,584.00 KB,A repo containing tools developed by Carbon Black's Threat Research Team: Threat Analysis Unit,PowerShell,https://github.com/carbonblack/tau-tools,584.00 KB
778,PowerShell_IPv4PortScanner,240,59,240,1,30/12/2015,13/09/2022,828.00 KB,Powerful asynchronus IPv4 port scanner for PowerShell,PowerShell,https://github.com/BornToBeRoot/PowerShell_IPv4PortScanner,828.00 KB
779,Shovel-Ash258,240,26,240,13,17/05/2018,10/10/2025,7.55 MB,Personal Shovel bucket with a wide variety of applications of all kinds.,PowerShell,https://github.com/Ash258/Shovel-Ash258,7.55 MB
780,icons,240,52,240,0,14/09/2022,21/01/2026,63.84 MB,Icons for use with applications deployed via Microsoft Intune / MDM / ConfigMgr etc.,PowerShell,https://github.com/aaronparker/icons,63.84 MB
781,BoomBox,240,38,240,18,31/07/2019,19/04/2023,186.00 KB,Automatic deployment of Cuckoo Sandbox malware lab using Packer and Vagrant,PowerShell,https://github.com/nbeede/BoomBox,186.00 KB
782,Deploy-Deception,240,55,240,1,16/10/2018,17/11/2019,18.00 KB,A PowerShell module to deploy active directory decoy objects.,PowerShell,https://github.com/samratashok/Deploy-Deception,18.00 KB
783,PowerShell-AdminScripts,240,59,240,1,26/08/2015,26/07/2025,2.46 MB,PowerShell Administration scripts,PowerShell,https://github.com/wikijm/PowerShell-AdminScripts,2.46 MB
784,Javascript-Backdoor,240,107,240,1,04/01/2016,18/07/2017,17.00 KB,Learn from  Casey Smith @subTee,PowerShell,https://github.com/3gstudent/Javascript-Backdoor,17.00 KB
785,microsoft-teams-apps-requestateam,239,63,239,138,20/04/2020,29/09/2024,6.96 MB,Power Platform based solution that allows users to request teams and automates team creation. NO LONGER MAINTAINED. Please use 'Provision Assist' - https://github.com/pnp/provision-assist-m365/ instead.,PowerShell,https://github.com/OfficeDev/microsoft-teams-apps-requestateam,6.96 MB
786,RanSim,239,34,239,1,17/09/2021,14/10/2024,203.00 KB,Ransomware simulation script written in PowerShell. Useful for testing your defenses and backups against real ransomware-like activity in a controlled setting.,PowerShell,https://github.com/lawndoc/RanSim,203.00 KB
787,PSWriteWord,239,32,239,22,16/06/2018,11/04/2022,2.18 MB,PSWriteWord is powershell module to create Microsoft Word documents without Microsoft Word installed...,PowerShell,https://github.com/EvotecIT/PSWriteWord,2.18 MB
788,jquery-resizable,238,91,238,18,18/12/2015,29/04/2020,170.00 KB,A small jQuery plug-in to make DOM components resizable,PowerShell,https://github.com/RickStrahl/jquery-resizable,170.00 KB
789,UnderlayCopy,238,24,238,1,22/10/2025,30/10/2025,13.00 KB,"PowerShell toolkit that extracts locked Windows files (SAM, SYSTEM, NTDS, ...) using MFT parsing and raw disk reads",PowerShell,https://github.com/kfallahi/UnderlayCopy,13.00 KB
790,DefendTheFlag,238,35,238,5,30/08/2019,25/06/2020,317.78 MB,"Get started fast with a built out lab, built from scratch via Azure Resource Manager (ARM) and Desired State Configuration (DSC), to test out Microsoft's security products.",PowerShell,https://github.com/microsoft/DefendTheFlag,317.78 MB
791,Rollback-Spotify,237,5,237,0,11/10/2021,07/01/2026,149.00 KB,Downgrade Spotify and block update for Windows,PowerShell,https://github.com/amd64fox/Rollback-Spotify,149.00 KB
792,NetworkingDsc,237,89,237,51,15/04/2015,08/11/2025,2.57 MB,DSC resources for configuring settings related to networking.,PowerShell,https://github.com/dsccommunity/NetworkingDsc,2.57 MB
793,WDACTools,237,39,237,2,08/02/2020,02/03/2022,149.00 KB,"A PowerShell module to facilitate building, configuring, deploying, and auditing Windows Defender Application Control (WDAC) policies",PowerShell,https://github.com/mattifestation/WDACTools,149.00 KB
794,Pode.Web,237,33,237,89,15/11/2020,18/02/2026,10.06 MB,Web template framework for use with the Pode PowerShell web server,PowerShell,https://github.com/Badgerati/Pode.Web,10.06 MB
795,PowerShellForSysadmins,237,119,237,0,09/12/2017,27/08/2024,306.00 KB,,PowerShell,https://github.com/adbertram/PowerShellForSysadmins,306.00 KB
796,AspNet.Security.OpenId.Providers,236,42,236,5,28/06/2015,16/02/2026,1.27 MB,OpenID 2.0 authentication middleware for ASP.NET Core,PowerShell,https://github.com/aspnet-contrib/AspNet.Security.OpenId.Providers,1.27 MB
797,one-script-wsl2-systemd,236,38,236,15,04/08/2020,23/08/2022,128.00 KB,The one-script variant of the systemd hack for WSL2,PowerShell,https://github.com/lucyllewy/one-script-wsl2-systemd,128.00 KB
798,BadSuccessor,236,24,236,3,12/05/2025,19/05/2025,9.00 KB,,PowerShell,https://github.com/akamai/BadSuccessor,9.00 KB
799,ConfigMgr,235,57,235,17,16/06/2016,22/09/2023,14.39 MB,,PowerShell,https://github.com/windows-admins/ConfigMgr,14.39 MB
800,Compressed2TXT,235,38,235,5,21/07/2015,14/11/2021,228.00 KB,"File(s)/Folder(s) ""Send to"" menu .bat ascii encoder with optional password and makecab lzx compression",PowerShell,https://github.com/AveYo/Compressed2TXT,228.00 KB
801,PoshWSUS,235,64,235,47,01/11/2013,05/04/2023,834.00 KB,PowerShell module to manage Windows Server Update Services (WSUS),PowerShell,https://github.com/proxb/PoshWSUS,834.00 KB
802,PoShFuck,235,19,235,8,04/05/2015,17/02/2023,36.00 KB,"PowerShell implementation of ""The Fuck"" (https://github.com/nvbn/thefuck)",PowerShell,https://github.com/mattparkes/PoShFuck,36.00 KB
803,mggraph-intune-samples,235,54,235,4,05/12/2022,24/10/2025,235.00 KB,Repository to hold Microsoft Intune script samples for the Microsoft Graph PowerShell SDK,PowerShell,https://github.com/microsoft/mggraph-intune-samples,235.00 KB
804,MakeWindows10GreatAgain,234,66,234,0,12/03/2017,24/12/2020,28.00 KB,Tweaks to make Windows 10 less annoying and more usable,PowerShell,https://github.com/clong/MakeWindows10GreatAgain,28.00 KB
805,AzureRT,233,31,233,1,22/01/2022,17/06/2022,72.00 KB,AzureRT - A Powershell module implementing various Azure Red Team tactics,PowerShell,https://github.com/mgeeky/AzureRT,72.00 KB
806,Github-Game-Configs,233,11,233,1,19/09/2024,14/11/2025,6.66 MB,,PowerShell,https://github.com/FR33THYFR33THY/Github-Game-Configs,6.66 MB
807,AZSentinel,233,80,233,29,05/09/2019,03/08/2022,398.00 KB,PowerShell module for Azure Sentinel,PowerShell,https://github.com/wortell/AZSentinel,398.00 KB
808,PST-Bucket,233,45,233,4,24/04/2023,19/02/2026,1.56 MB,Scoop-Buket for Penetration Suite Toolkit  -  Windows渗透测试工具仓库For Scoop,PowerShell,https://github.com/arch3rPro/PST-Bucket,1.56 MB
809,PSSysmonTools,232,47,232,2,25/12/2017,17/08/2018,3.21 MB,Sysmon Tools for PowerShell,PowerShell,https://github.com/mattifestation/PSSysmonTools,3.21 MB
810,Invoke-BuildAnonymousSMBServer,232,43,232,2,10/07/2021,20/08/2021,6.00 KB,Use to build an anonymous SMB file server.,PowerShell,https://github.com/3gstudent/Invoke-BuildAnonymousSMBServer,6.00 KB
811,Babadook,232,58,232,0,23/09/2015,23/09/2015,120.00 KB,Connection-less Powershell Persistent and Resilient Backdoor,PowerShell,https://github.com/jseidl/Babadook,120.00 KB
812,AppLocker-Guidance,232,71,232,1,01/05/2015,31/10/2025,80.00 KB,Configuration guidance for implementing application whitelisting with AppLocker. #nsacyber,PowerShell,https://github.com/nsacyber/AppLocker-Guidance,80.00 KB
813,windows-pentest,232,66,232,0,22/06/2016,10/01/2018,338.00 KB,Windows Pentest Scripts,PowerShell,https://github.com/ankh2054/windows-pentest,338.00 KB
814,OSD,231,97,231,103,25/09/2019,18/02/2026,900.28 MB,PowerShell Module OSD,PowerShell,https://github.com/OSDeploy/OSD,900.28 MB
815,PoShLog,231,21,231,12,28/07/2019,21/11/2022,638.00 KB,":nut_and_bolt:  PoShLog is PowerShell cross-platform logging module. It allows you to log structured event data into console, file and much more places easily. It's built upon great C# logging library Serilog - https://serilog.net/",PowerShell,https://github.com/PoShLog/PoShLog,638.00 KB
816,Powershell-to-Ducky-Converter,231,30,231,3,09/07/2022,16/07/2022,1.43 MB,This is an application I am developing to automatically convert powershell scripts into ready to use Ducky scripts,PowerShell,https://github.com/I-Am-Jakoby/Powershell-to-Ducky-Converter,1.43 MB
817,AutomaticPackageRestoreMigrationScript,231,64,231,3,06/06/2014,10/11/2017,20.00 KB,to help you move to automatic nuget package restore,PowerShell,https://github.com/owen2/AutomaticPackageRestoreMigrationScript,20.00 KB
818,lcow,230,41,230,12,17/11/2017,23/03/2020,13.41 MB,Linux containers on Windows built with LinuxKit,PowerShell,https://github.com/linuxkit/lcow,13.41 MB
819,Invoke-WMILM,230,61,230,0,08/05/2018,10/05/2018,29.00 KB,,PowerShell,https://github.com/Cybereason/Invoke-WMILM,29.00 KB
820,Logging,230,46,230,18,17/09/2015,27/05/2024,442.00 KB,Powershell Logging Module,PowerShell,https://github.com/RootITUp/Logging,442.00 KB
821,LabBuilder,229,39,229,66,20/08/2015,10/06/2024,3.22 MB,PowerShell Module for building a Hyper-V Lab environment from a simple XML configuration file.,PowerShell,https://github.com/PlagueHO/LabBuilder,3.22 MB
822,community.windows,229,174,229,152,05/03/2020,27/01/2026,16.77 MB, Windows community collection for Ansible ,PowerShell,https://github.com/ansible-collections/community.windows,16.77 MB
823,powershell-phpmanager,229,21,229,2,21/04/2018,21/01/2026,1.57 MB," A PowerShell module to install/update PHP, PHP extensions and Composer on Windows",PowerShell,https://github.com/mlocati/powershell-phpmanager,1.57 MB
824,Win10Script,229,28,229,2,25/01/2017,31/07/2021,1.28 MB,Win 10 Powershell Script to tweak and change windows settings,PowerShell,https://github.com/madbomb122/Win10Script,1.28 MB
825,PowerDecode,228,17,228,1,24/12/2020,28/04/2024,12.22 MB,"PowerDecode is a PowerShell-based tool that allows to deobfuscate PowerShell scripts obfuscated across multiple layers. The tool performs code dynamic analysis, extracting malware hosting URLs and checking http response.It can also detect if the malware attempts to inject shellcode into memory.",PowerShell,https://github.com/Malandrone/PowerDecode,12.22 MB
826,AnyBox,228,27,228,9,03/03/2018,06/09/2022,578.00 KB,The easiest way to develop apps for Windows.,PowerShell,https://github.com/fresh2dev/AnyBox,578.00 KB
827,zed-windows-stable,228,9,228,6,14/08/2024,20/02/2026,66.00 KB,"automated windows builds for Zed code editor, built from source, stable channel",PowerShell,https://github.com/sonercirit/zed-windows-stable,66.00 KB
828,windows_event_logging,227,52,227,1,17/07/2017,05/02/2025,74.00 KB,"Windows Event Forwarding subscriptions, configuration files and scripts that assist with implementing ACSC's protect publication, Technical Guidance for Windows Event Logging.",PowerShell,https://github.com/AustralianCyberSecurityCentre/windows_event_logging,74.00 KB
829,Toolies,227,51,227,0,13/02/2020,03/08/2023,137.13 MB,Ad hoc collection of Red Teaming & Active Directory tooling.,PowerShell,https://github.com/expl0itabl3/Toolies,137.13 MB
830,PSReflect,227,61,227,3,20/09/2014,14/10/2018,31.00 KB,"Easily define in-memory enums, structs, and Win32 functions in PowerShell",PowerShell,https://github.com/mattifestation/PSReflect,31.00 KB
