Ranking,Project Name,Stars,Forks,Watchers,Open Issues,Created At,Last Commit,Size,Description,Language,Repo URL,Size
413,SuperAGI,17238,2170,17238,215,13/05/2023,22/01/2025,61.96 MB,"<⚡️> SuperAGI - A dev-first open source autonomous AI agent framework. Enabling developers to build, manage & run useful autonomous agents quickly and reliably.",Python,https://github.com/TransformerOptimus/SuperAGI,61.96 MB
414,fail2ban,17116,1463,17116,262,28/09/2011,12/02/2026,12.65 MB,Daemon to ban hosts that cause multiple authentication errors,Python,https://github.com/fail2ban/fail2ban,12.65 MB
415,gallery-dl,17067,1341,17067,1120,12/10/2014,05/03/2026,18.18 MB,Command-line program to download image galleries and collections from several image hosting sites,Python,https://github.com/mikf/gallery-dl,18.18 MB
416,tensor2tensor,17035,3721,17035,590,15/06/2017,02/06/2023,17.10 MB,Library of deep learning models and datasets designed to make deep learning more accessible and accelerate ML research.,Python,https://github.com/tensorflow/tensor2tensor,17.10 MB
417,pyspider,17001,3660,17001,301,21/02/2014,30/04/2024,4.07 MB,A Powerful Spider(Web Crawler) System in Python.,Python,https://github.com/binux/pyspider,4.07 MB
418,ranger,16982,928,16982,928,04/06/2009,25/02/2026,10.48 MB,A VIM-inspired filemanager for the console,Python,https://github.com/ranger/ranger,10.48 MB
419,olmocr,16973,1355,16973,59,17/09/2024,19/02/2026,345.33 MB,Toolkit for linearizing PDFs for LLM datasets/training,Python,https://github.com/allenai/olmocr,345.33 MB
420,reddit,16951,2867,16951,304,18/06/2008,17/10/2017,39.15 MB,historical code from reddit.com,Python,https://github.com/reddit-archive/reddit,39.15 MB
421,activitywatch,16865,835,16865,179,27/04/2016,23/02/2026,1.24 MB,"The best free and open-source automated time tracker. Cross-platform, extensible, privacy-focused.",Python,https://github.com/ActivityWatch/activitywatch,1.24 MB
422,NeMo,16857,3355,16857,179,05/08/2019,05/03/2026,475.99 MB,"A scalable generative AI framework built for researchers and developers working on Large Language Models, Multimodal, and Speech AI (Automatic Speech Recognition and Text-to-Speech)",Python,https://github.com/NVIDIA-NeMo/NeMo,475.99 MB
423,autojump,16842,711,16842,226,14/01/2009,27/02/2025,804.00 KB,A cd command that learns - easily navigate directories from the command line,Python,https://github.com/wting/autojump,804.00 KB
424,spiderfoot,16837,2834,16837,244,28/04/2012,15/12/2024,16.38 MB,SpiderFoot automates OSINT for threat intelligence and mapping your attack surface.,Python,https://github.com/smicallef/spiderfoot,16.38 MB
425,akshare,16802,2881,16802,2,01/10/2019,05/03/2026,5.05 MB,"AKShare is an elegant and simple financial data interface library for Python, built for human beings! 开源财经数据接口库",Python,https://github.com/akfamily/akshare,5.05 MB
426,OpenCore-Legacy-Patcher,16799,1746,16799,25,24/11/2020,30/12/2025,787.22 MB,Experience macOS just like before,Python,https://github.com/dortania/OpenCore-Legacy-Patcher,787.22 MB
427,aws-cli,16796,4486,16796,612,20/11/2012,05/03/2026,423.47 MB,Universal Command Line Interface for Amazon Web Services,Python,https://github.com/aws/aws-cli,423.47 MB
428,ktransformers,16697,1223,16697,405,26/07/2024,04/03/2026,60.74 MB,A Flexible Framework for Experiencing Heterogeneous LLM Inference/Fine-tune Optimizations,Python,https://github.com/kvcache-ai/ktransformers,60.74 MB
429,networkx,16685,3473,16685,348,06/09/2010,04/03/2026,94.02 MB,Network Analysis in Python,Python,https://github.com/networkx/networkx,94.02 MB
430,ipython,16683,4464,16683,1573,10/05/2010,05/03/2026,79.47 MB,"Official repository for IPython itself. Other repos in the IPython organization contain things like the website, documentation builds, etc.",Python,https://github.com/ipython/ipython,79.47 MB
431,baselines,16655,4949,16655,502,24/05/2017,01/08/2024,6.46 MB,OpenAI Baselines: high-quality implementations of reinforcement learning algorithms,Python,https://github.com/openai/baselines,6.46 MB
432,codon,16652,594,16652,94,27/09/2021,04/03/2026,7.98 MB,"A high-performance, zero-overhead, extensible Python compiler with built-in NumPy support",Python,https://github.com/exaloop/codon,7.98 MB
433,FramePack,16649,1647,16649,475,12/04/2025,16/10/2025,76.00 KB,Lets make video diffusion practical!,Python,https://github.com/lllyasviel/FramePack,76.00 KB
434,PySnooper,16607,957,16607,30,18/04/2019,31/05/2025,502.00 KB,Never use print for debugging again,Python,https://github.com/cool-RR/PySnooper,502.00 KB
435,avatarify-python,16544,4317,16544,318,06/04/2020,30/08/2024,5.69 MB,"Avatars for Zoom, Skype and other video-conferencing apps.",Python,https://github.com/alievk/avatarify-python,5.69 MB
436,Douyin_TikTok_Download_API,16535,2425,16535,136,07/11/2021,12/10/2025,8.72 MB,🚀「Douyin_TikTok_Download_API」是一个开箱即用的高性能异步抖音、快手、TikTok、Bilibili数据爬取工具，支持API调用，在线批量解析及下载。,Python,https://github.com/Evil0ctal/Douyin_TikTok_Download_API,8.72 MB
437,WeClone,16383,1335,16383,36,31/01/2024,02/03/2026,2.40 MB,"🚀 One-stop solution for creating your digital avatar from chat history 💡 Fine-tune LLMs with your chat logs to capture your unique style, then bind to a chatbot to bring your digital self to life.  从聊天记录创造数字分身的一站式解决方案  ",Python,https://github.com/xming521/WeClone,2.40 MB
438,aiohttp,16375,2208,16375,275,01/10/2013,06/03/2026,38.27 MB,Asynchronous HTTP client/server framework for asyncio and Python,Python,https://github.com/aio-libs/aiohttp,38.27 MB
439,abu,16374,4433,16374,3,19/09/2016,24/01/2026,93.95 MB,阿布量化交易系统(股票，期权，期货，比特币，机器学习) 基于python的开源量化交易，量化投资架构,Python,https://github.com/bbfamily/abu,93.95 MB
440,gensim,16373,4409,16373,434,10/02/2011,01/11/2025,104.07 MB,Topic Modelling for Humans,Python,https://github.com/piskvorky/gensim,104.07 MB
441,pyvideotrans,16351,1922,16351,324,02/10/2023,05/03/2026,475.38 MB,Translate the video from one language to another and embed dubbing & subtitles.,Python,https://github.com/jianchang512/pyvideotrans,475.38 MB
442,source-han-sans,16345,1369,16345,151,11/07/2014,25/06/2025,19.78 GB,Source Han Sans | 思源黑体 | 思源黑體 | 思源黑體 香港 | 源ノ角ゴシック | 본고딕,Python,https://github.com/adobe-fonts/source-han-sans,19.78 GB
443,codellama,16343,1938,16343,116,24/08/2023,12/08/2024,26.00 KB,Inference code for CodeLlama models,Python,https://github.com/meta-llama/codellama,26.00 KB
444,twint,16337,2784,16337,589,10/06/2017,23/02/2023,4.47 MB,"An advanced Twitter scraping & OSINT tool written in Python that doesn't use Twitter's API, allowing you to scrape a user's followers, following, Tweets and more while evading most API limitations.",Python,https://github.com/twintproject/twint,4.47 MB
445,Shadowrocket-ADBlock-Rules,16334,2365,16334,71,13/08/2016,12/04/2021,3.77 MB,提供多款 Shadowrocket 规则，带广告过滤功能。用于 iOS 未越狱设备选择性地自动翻墙。,Python,https://github.com/h2y/Shadowrocket-ADBlock-Rules,3.77 MB
446,numpy-ml,16294,3778,16294,40,06/04/2019,29/10/2023,10.27 MB,"Machine learning, in numpy",Python,https://github.com/ddbourgin/numpy-ml,10.27 MB
447,WSABuilds,16250,2218,16250,196,30/12/2022,16/01/2026,153.09 MB,Run Windows Subsystem For Android on your Windows 10 and Windows 11 PC using prebuilt binaries with Google Play Store (MindTheGapps) and/or Magisk or KernelSU (root solutions) built in. ,Python,https://github.com/MustardChef/WSABuilds,153.09 MB
448,awesome-python-login-model,16240,3274,16240,78,20/01/2019,26/07/2022,18.22 MB,😮python模拟登陆一些大型网站，还有一些简单的爬虫，希望对你们有所帮助❤️，如果喜欢记得给个star哦🌟,Python,https://github.com/Kr1s77/awesome-python-login-model,18.22 MB
449,LaTeX-OCR,16231,1285,16231,157,11/12/2020,18/01/2025,9.28 MB,pix2tex: Using a ViT to convert images of equations into LaTeX code.,Python,https://github.com/lukas-blecher/LaTeX-OCR,9.28 MB
450,daily_stock_analysis,16225,16799,16225,44,10/01/2026,05/03/2026,51.23 MB,LLM驱动的 A/H/美股智能分析器，多数据源行情 + 实时新闻 + Gemini 决策仪表盘 + 多渠道推送，零成本，纯白嫖，定时运行,Python,https://github.com/ZhuLinsen/daily_stock_analysis,51.23 MB
451,docs,16201,548,16201,322,09/01/2024,05/03/2026,136.91 MB,"A collaborative note taking, wiki and documentation platform that scales. Built with Django and React. ",Python,https://github.com/suitenumerique/docs,136.91 MB
452,camel,16192,1805,16192,442,17/03/2023,05/03/2026,473.49 MB,🐫 CAMEL: The first and the best multi-agent framework. Finding the Scaling Law of Agents. https://www.camel-ai.org,Python,https://github.com/camel-ai/camel,473.49 MB
453,github-trends,16104,118,16104,46,18/12/2020,25/01/2025,4.18 MB,🚀 Level up your GitHub profile readme with customizable cards including LOC statistics!,Python,https://github.com/avgupta456/github-trends,4.18 MB
454,RagaAI-Catalyst,16101,3634,16101,28,26/08/2024,11/02/2026,57.15 MB,"Python SDK for Agent AI Observability, Monitoring and Evaluation Framework. Includes features like agent, llm and tools tracing, debugging multi-agentic system, self-hosted dashboard and advanced analytics with timeline and execution graph view ",Python,https://github.com/raga-ai-hub/RagaAI-Catalyst,57.15 MB
455,VideoLingo,16085,1658,16085,169,09/08/2024,28/02/2026,15.22 MB,"Netflix-level subtitle cutting, translation, alignment, and even dubbing - one-click fully automated AI video subtitle team | Netflix级字幕切割、翻译、对齐、甚至加上配音，一键全自动视频搬运AI字幕组",Python,https://github.com/Huanshere/VideoLingo,15.22 MB
456,YYeTsBot,15984,1864,15984,4,15/08/2019,05/03/2026,19.60 MB,🎬 人人影视 机器人和网站，包含人人影视全部资源以及众多网友的网盘分享,Python,https://github.com/tgbot-collection/YYeTsBot,19.60 MB
457,apprise,15978,565,15978,79,25/11/2017,05/03/2026,10.23 MB,Apprise - Push Notifications that work with just about every platform!,Python,https://github.com/caronc/apprise,10.23 MB
458,discord.py,15962,3931,15962,149,21/08/2015,04/03/2026,22.22 MB,An API wrapper for Discord written in Python.,Python,https://github.com/Rapptz/discord.py,22.22 MB
459,Qwen3-Coder,15885,1120,15885,116,16/04/2024,03/02/2026,1.10 GB,"Qwen3-Coder is the code version of Qwen3, the large language model series developed by Qwen team.",Python,https://github.com/QwenLM/Qwen3-Coder,1.10 GB
460,rendercv,15863,1101,15863,48,11/06/2023,04/03/2026,255.95 MB,Resume builder for academics and engineers,Python,https://github.com/rendercv/rendercv,255.95 MB
461,agent-zero,15808,3260,15808,387,10/06/2024,05/03/2026,36.65 MB,Agent Zero AI framework,Python,https://github.com/agent0ai/agent-zero,36.65 MB
462,theHarvester,15750,2431,15750,7,01/01/2011,05/03/2026,8.48 MB,"E-mails, subdomains and names Harvester - OSINT ",Python,https://github.com/laramies/theHarvester,8.48 MB
463,pyecharts,15730,2867,15730,1,22/06/2017,10/02/2026,97.40 MB,🎨 Python Echarts Plotting Library,Python,https://github.com/pyecharts/pyecharts,97.40 MB
464,Swin-Transformer,15728,2214,15728,204,25/03/2021,24/07/2024,1.07 MB,"This is an official implementation for ""Swin Transformer: Hierarchical Vision Transformer using Shifted Windows"".",Python,https://github.com/microsoft/Swin-Transformer,1.07 MB
465,Bringing-Old-Photos-Back-to-Life,15694,2090,15694,109,24/06/2020,26/10/2023,40.91 MB,Bringing Old Photo Back to Life (CVPR 2020 oral),Python,https://github.com/microsoft/Bringing-Old-Photos-Back-to-Life,40.91 MB
466,flet,15692,626,15692,345,24/03/2022,05/03/2026,133.39 MB,"Flet enables developers to easily build realtime web, mobile and desktop apps in Python. No frontend experience required.",Python,https://github.com/flet-dev/flet,133.39 MB
467,pygwalker,15669,853,15669,74,16/02/2023,02/03/2026,73.13 MB,PyGWalker: Turn your dataframe into an interactive UI for visual analysis,Python,https://github.com/Kanaries/pygwalker,73.13 MB
468,web-ui,15669,2691,15669,313,02/01/2025,31/08/2025,18.83 MB,🖥️ Run AI Agent in your browser.,Python,https://github.com/browser-use/web-ui,18.83 MB
469,ChatGLM2-6B,15651,1820,15651,453,24/06/2023,27/06/2024,7.29 MB,ChatGLM2-6B: An Open Bilingual Chat LLM | 开源双语对话语言模型,Python,https://github.com/zai-org/ChatGLM2-6B,7.29 MB
470,labelme,15623,3643,15623,174,09/05/2016,06/03/2026,49.93 MB,"Image annotation with Python. Supports polygon, rectangle, circle, line, point, and AI-assisted annotation.",Python,https://github.com/wkentaro/labelme,49.93 MB
471,MHDDoS,15606,3505,15606,6,13/10/2020,04/01/2026,928.00 KB,"Best DDoS Attack Script  Python3, (Cyber / DDos) Attack With 56 Methods",Python,https://github.com/MatrixTM/MHDDoS,928.00 KB
472,Megatron-LM,15522,3657,15522,617,21/03/2019,06/03/2026,58.54 MB,Ongoing research training transformer models at scale,Python,https://github.com/NVIDIA/Megatron-LM,58.54 MB
473,impacket,15515,3874,15515,343,15/04/2015,05/03/2026,10.67 MB,Impacket is a collection of Python classes for working with network protocols.,Python,https://github.com/fortra/impacket,10.67 MB
474,Wan2.1,15486,2426,15486,355,25/02/2025,05/03/2026,10.08 MB,Wan: Open and Advanced Large-Scale Video Generative Models,Python,https://github.com/Wan-Video/Wan2.1,10.08 MB
475,nicegui,15470,905,15470,70,07/05/2021,05/03/2026,105.88 MB,Create web-based user interfaces with Python. The nice way.,Python,https://github.com/zauberzeug/nicegui,105.88 MB
476,LangBot,15470,1327,15470,113,07/12/2022,05/03/2026,38.95 MB,"Production-grade platform for building agentic IM bots - 生产级多平台智能机器人开发平台. 提供 Agent、知识库编排、插件系统 / Bots for Discord / Slack / LINE / Telegram / WeChat(企业微信, 企微智能机器人, 公众号) / 飞书 / 钉钉 / QQ / Satori e.g. Integrated with ChatGPT(GPT), DeepSeek, Dify, n8n, Langflow, Coze, Claude, Gemini, MiniMax, Ollama, SiliconFlow, Moonshot, GLM, clawdbot / openclaw",Python,https://github.com/langbot-app/LangBot,38.95 MB
477,AutoEq,15468,2529,15468,179,04/03/2018,20/07/2025,4.22 GB,Automatic headphone equalization from frequency responses,Python,https://github.com/jaakkopasanen/AutoEq,4.22 GB
478,dvc,15416,1282,15416,171,04/03/2017,02/03/2026,20.44 MB,🦉 Data Versioning and ML Experiments,Python,https://github.com/treeverse/dvc,20.44 MB
479,cvat,15406,3587,15406,571,29/06/2018,05/03/2026,341.08 MB,"Annotate better with CVAT, the industry-leading data engine for machine learning. Used and trusted by teams at any scale, for data of any scale.",Python,https://github.com/cvat-ai/cvat,341.08 MB
480,fabric,15403,1961,15403,497,01/05/2009,20/07/2025,18.84 MB,"Simple, Pythonic remote execution and deployment.",Python,https://github.com/fabric/fabric,18.84 MB
481,ChuanhuChatGPT,15375,2255,15375,127,02/03/2023,28/02/2026,3.19 MB,"GUI for ChatGPT API and many LLMs. Supports agents, file-based QA, GPT finetuning and query with web search. All with a neat UI.",Python,https://github.com/GaiZhenbiao/ChuanhuChatGPT,3.19 MB
482,planning-with-files,15357,1416,15357,5,03/01/2026,05/03/2026,466.00 KB,Claude Code skill implementing Manus-style persistent markdown planning — the workflow pattern behind the $2B acquisition.,Python,https://github.com/OthmanAdi/planning-with-files,466.00 KB
483,agent-lightning,15325,1308,15325,138,18/06/2025,28/02/2026,49.62 MB,The absolute trainer to light up AI agents.,Python,https://github.com/microsoft/agent-lightning,49.62 MB
484,llm-council,15309,3088,15309,110,22/11/2025,22/11/2025,262.00 KB,LLM Council works together to answer your hardest questions,Python,https://github.com/karpathy/llm-council,262.00 KB
485,SuperTinyIcons,15308,972,15308,32,13/04/2017,01/03/2026,41.19 MB,Under 1KB each! Super Tiny Icons are miniscule SVG versions of your favourite website and app logos,Python,https://github.com/edent/SuperTinyIcons,41.19 MB
486,awx,15303,3622,15303,1820,17/05/2017,05/03/2026,345.47 MB,"AWX provides a web-based user interface, REST API, and task engine built on top of Ansible. It is one of the upstream projects for Red Hat Ansible Automation Platform.",Python,https://github.com/ansible/awx,345.47 MB
487,jupyter,15288,4448,15288,44,04/06/2015,17/12/2025,7.82 MB,Jupyter metapackage for installation and documentation,Python,https://github.com/jupyter/jupyter,7.82 MB
488,SMSBoom,15287,3630,15287,191,10/08/2021,20/03/2024,17.88 MB,"SMSBoom - Deprecate: Due to judicial reasons, the repository has been suspended!",Python,https://github.com/OpenEthan/SMSBoom,17.88 MB
489,pyright,15277,1776,15277,221,12/03/2019,05/03/2026,125.28 MB,Static Type Checker for Python,Python,https://github.com/microsoft/pyright,125.28 MB
490,albumentations,15267,1706,15267,0,06/06/2018,25/06/2025,102.68 MB,Fast and flexible image augmentation library. Paper about the library: https://www.mdpi.com/2078-2489/11/2/125,Python,https://github.com/albumentations-team/albumentations,102.68 MB
491,salt,15262,5572,15262,2490,20/02/2011,03/03/2026,549.22 MB,Software to automate the management and configuration of infrastructure and applications at scale.,Python,https://github.com/saltstack/salt,549.22 MB
492,Second-Me,15255,1180,15255,146,16/03/2025,30/09/2025,347.33 MB,"Train your AI self, amplify you, bridge the world",Python,https://github.com/mindverse/Second-Me,347.33 MB
493,pydantic-ai,15252,1719,15252,551,21/06/2024,06/03/2026,212.71 MB,"GenAI Agent Framework, the Pydantic way",Python,https://github.com/pydantic/pydantic-ai,212.71 MB
494,mailinabox,15206,1532,15206,598,21/08/2013,01/02/2026,3.71 MB,"Mail-in-a-Box helps individuals take back control of their email by defining a one-click, easy-to-deploy SMTP+everything else server: a mail server in a box.",Python,https://github.com/mail-in-a-box/mailinabox,3.71 MB
495,httpx,15136,1055,15136,149,04/04/2019,01/03/2026,8.39 MB,A next generation HTTP client for Python. 🦋,Python,https://github.com/encode/httpx,8.39 MB
496,detr,15134,2662,15134,255,26/05/2020,12/03/2024,12.88 MB,End-to-End Object Detection with Transformers,Python,https://github.com/facebookresearch/detr,12.88 MB
497,mackup,15121,934,15121,292,06/04/2013,17/02/2026,2.59 MB,Backup and keep your application settings in sync.,Python,https://github.com/lra/mackup,2.59 MB
498,DeDRM_tools,15118,1606,15118,904,09/03/2015,20/08/2024,24.28 MB,DeDRM tools for ebooks,Python,https://github.com/apprenticeharper/DeDRM_tools,24.28 MB
499,pre-commit,15108,932,15108,30,13/03/2014,01/03/2026,4.48 MB,A framework for managing and maintaining multi-language pre-commit hooks.,Python,https://github.com/pre-commit/pre-commit,4.48 MB
500,FunASR,15070,1594,15070,534,24/11/2022,28/02/2026,104.86 MB,"A Fundamental End-to-End Speech Recognition Toolkit and Open Source SOTA Pretrained Models, Supporting Speech Recognition, Voice Activity Detection, Text Post-processing etc.",Python,https://github.com/modelscope/FunASR,104.86 MB
501,claude-quickstarts,15061,2530,15061,148,29/08/2024,05/02/2026,3.23 MB,A collection of projects designed to help developers quickly get started with building deployable applications using the Claude API,Python,https://github.com/anthropics/claude-quickstarts,3.23 MB
502,dagster,15058,2009,15058,2782,30/04/2018,05/03/2026,1.36 GB,"An orchestration platform for the development, production, and observation of data assets.",Python,https://github.com/dagster-io/dagster,1.36 GB
503,Cookbook,14974,2696,14974,125,10/03/2019,17/01/2026,37.57 MB,The Data Engineering Cookbook,Python,https://github.com/andkret/Cookbook,37.57 MB
504,memray,14913,433,14913,51,08/04/2022,06/03/2026,33.58 MB,Memray is a memory profiler for Python,Python,https://github.com/bloomberg/memray,33.58 MB
505,py12306,14868,3611,14868,194,07/01/2019,20/02/2026,2.40 MB,🚂 12306 购票助手，支持集群，多账号，多任务购票以及 Web 页面管理 ,Python,https://github.com/pjialin/py12306,2.40 MB
506,llmware,14859,2964,14859,86,29/09/2023,21/02/2026,1.16 GB,"Unified framework for building enterprise RAG pipelines with small, specialized models",Python,https://github.com/llmware-ai/llmware,1.16 GB
507,beets,14806,1987,14806,750,09/08/2010,05/03/2026,31.15 MB,music library manager and MusicBrainz tagger,Python,https://github.com/beetbox/beets,31.15 MB
508,XSStrike,14792,2073,14792,86,26/06/2017,26/04/2025,1.17 MB,Most advanced XSS scanner.,Python,https://github.com/s0md3v/XSStrike,1.17 MB
509,dalle-mini,14787,1219,14787,100,03/07/2021,09/11/2023,18.32 MB,DALL·E Mini - Generate images from a text prompt,Python,https://github.com/borisdayma/dalle-mini,18.32 MB
510,fauxpilot,14767,643,14767,63,03/08/2022,09/04/2024,2.97 MB,FauxPilot - an open-source alternative to GitHub Copilot server,Python,https://github.com/fauxpilot/fauxpilot,2.97 MB
511,DeepCode,14755,1979,14755,31,14/05/2025,03/03/2026,78.68 MB,"""DeepCode: Open Agentic Coding (Paper2Code & Text2Web & Text2Backend)""",Python,https://github.com/HKUDS/DeepCode,78.68 MB
512,Llama-Chinese,14745,1307,14745,195,19/07/2023,06/04/2025,19.63 MB,Llama中文社区，实时汇总最新Llama学习资料，构建最好的中文Llama大模型开源生态，完全开源可商用,Python,https://github.com/LlamaFamily/Llama-Chinese,19.63 MB
513,imgaug,14734,2465,14734,309,10/07/2015,30/07/2024,27.95 MB,Image augmentation for machine learning experiments.,Python,https://github.com/aleju/imgaug,27.95 MB
514,powerline,14711,1006,14711,239,12/06/2012,30/09/2024,4.17 MB,"Powerline is a statusline plugin for vim, and provides statuslines and prompts for several other applications, including zsh, bash, tmux, IPython, Awesome and Qtile.",Python,https://github.com/powerline/powerline,4.17 MB
515,MoneyPrinterV2,14699,1473,14699,18,12/02/2024,03/03/2026,183.00 KB,Automate the process of making money online.,Python,https://github.com/FujiwaraChoki/MoneyPrinterV2,183.00 KB
516,the-gan-zoo,14693,2554,14693,39,14/04/2017,06/10/2023,2.15 MB,A list of all named GANs!,Python,https://github.com/hindupuravinash/the-gan-zoo,2.15 MB
517,horovod,14676,2253,14676,406,09/08/2017,01/12/2025,6.92 MB,"Distributed training framework for TensorFlow, Keras, PyTorch, and Apache MXNet.",Python,https://github.com/horovod/horovod,6.92 MB
518,deepwiki-open,14661,1644,14661,232,30/04/2025,05/03/2026,3.89 MB,Open Source DeepWiki: AI-Powered Wiki Generator for GitHub/Gitlab/Bitbucket Repositories. Join the discord: https://discord.gg/gMwThUMeme,Python,https://github.com/AsyncFuncAI/deepwiki-open,3.89 MB
519,social-engineer-toolkit,14632,3324,14632,438,31/12/2012,21/10/2024,175.40 MB,The Social-Engineer Toolkit (SET) repository from TrustedSec - All new versions of SET will be deployed here.,Python,https://github.com/trustedsec/social-engineer-toolkit,175.40 MB
520,Nuitka,14608,765,14608,186,23/04/2013,04/03/2026,63.69 MB,"Nuitka is a Python compiler written in Python.  It's fully compatible with Python 2.6, 2.7, 3.4-3.13. You feed it your Python app, it does a lot of clever things, and spits out an executable or extension module. ",Python,https://github.com/Nuitka/Nuitka,63.69 MB
521,reinforcement-learning-an-introduction,14573,4966,14573,22,13/09/2016,09/08/2024,5.94 MB,Python Implementation of Reinforcement Learning: An Introduction,Python,https://github.com/ShangtongZhang/reinforcement-learning-an-introduction,5.94 MB
522,nltk,14539,2990,14539,295,07/09/2009,03/03/2026,346.24 MB,NLTK Source,Python,https://github.com/nltk/nltk,346.24 MB
523,tushare,14528,4407,14528,697,07/01/2015,13/03/2024,7.37 MB,TuShare is a utility for crawling historical data of China stocks,Python,https://github.com/waditu/tushare,7.37 MB
524,csm,14527,1464,14527,12,26/02/2025,27/05/2025,29.00 KB,A Conversational Speech Generation Model,Python,https://github.com/SesameAILabs/csm,29.00 KB
525,scipy,14505,5642,14505,1784,09/03/2011,05/03/2026,188.04 MB,SciPy library main repository,Python,https://github.com/scipy/scipy,188.04 MB
526,Wan2.2,14495,1746,14495,263,28/07/2025,05/03/2026,8.15 MB,Wan: Open and Advanced Large-Scale Video Generative Models,Python,https://github.com/Wan-Video/Wan2.2,8.15 MB
527,wifiphisher,14479,2727,14479,350,26/09/2014,04/02/2025,12.59 MB,The Rogue Access Point Framework,Python,https://github.com/wifiphisher/wifiphisher,12.59 MB
528,ChatterBot,14479,4444,14479,74,28/09/2014,17/02/2026,8.16 MB,"ChatterBot is a machine learning, conversational dialog engine for creating chat bots",Python,https://github.com/gunthercox/ChatterBot,8.16 MB
529,sympy,14436,5141,14436,5572,30/04/2010,05/03/2026,191.10 MB,A computer algebra system written in pure Python,Python,https://github.com/sympy/sympy,191.10 MB
530,stylegan,14422,3160,14422,12,04/02/2019,10/04/2024,1.68 MB,StyleGAN - Official TensorFlow Implementation,Python,https://github.com/NVlabs/stylegan,1.68 MB
531,RWKV-LM,14401,991,14401,143,08/08/2021,05/03/2026,30.08 MB,"RWKV (pronounced RwaKuv) is an RNN with great LLM performance, which can also be directly trained like a GPT transformer (parallelizable). We are at RWKV-7 ""Goose"". So it's combining the best of RNN and transformer - great performance, linear time, constant space (no kv-cache), fast training, infinite ctx_len, and free sentence embedding.",Python,https://github.com/BlinkDL/RWKV-LM,30.08 MB
532,moviepy,14393,2034,14393,79,12/08/2013,25/09/2025,166.00 MB,Video editing with Python,Python,https://github.com/Zulko/moviepy,166.00 MB
533,docker-android,14356,1646,14356,157,22/12/2016,06/03/2026,237.07 MB,Android in docker solution with noVNC supported and video recording,Python,https://github.com/budtmo/docker-android,237.07 MB
534,flair,14355,2123,14355,28,11/06/2018,27/10/2025,386.31 MB,A very simple framework for state-of-the-art Natural Language Processing (NLP),Python,https://github.com/flairNLP/flair,386.31 MB
