Ranking,Project Name,Stars,Forks,Watchers,Open Issues,Created At,Last Commit,Size,Description,Language,Repo URL,Size
1,public-apis,404548,43656,404548,931,20/03/2016,19/02/2026,4.89 MB,A collective list of free APIs,Python,https://github.com/public-apis/public-apis,4.89 MB
2,free-programming-books,383638,66010,383638,78,11/10/2013,28/02/2026,20.53 MB,:books: Freely available programming books,Python,https://github.com/EbookFoundation/free-programming-books,20.53 MB
3,system-design-primer,337398,54674,337398,534,26/02/2017,03/11/2025,10.98 MB,Learn how to design large-scale systems. Prep for the system design interview.  Includes Anki flashcards.,Python,https://github.com/donnemartin/system-design-primer,10.98 MB
4,awesome-python,285764,27300,285764,16,27/06/2014,04/03/2026,4.65 MB,"An opinionated list of awesome Python frameworks, libraries, software and resources.",Python,https://github.com/vinta/awesome-python,4.65 MB
5,Python,218369,50126,218369,925,16/07/2016,02/03/2026,15.31 MB,All Algorithms implemented in Python,Python,https://github.com/TheAlgorithms/Python,15.31 MB
6,AutoGPT,182202,46205,182202,344,16/03/2023,06/03/2026,337.49 MB,"AutoGPT is the vision of accessible AI for everyone, to use and to build on. Our mission is to provide the tools, so that you can focus on what matters.",Python,https://github.com/Significant-Gravitas/AutoGPT,337.49 MB
7,stable-diffusion-webui,161509,30119,161509,2464,22/08/2022,02/03/2026,35.70 MB,Stable Diffusion web UI,Python,https://github.com/AUTOMATIC1111/stable-diffusion-webui,35.70 MB
8,transformers,157451,32304,157451,2272,29/10/2018,05/03/2026,443.32 MB,"🤗 Transformers: the model-definition framework for state-of-the-art machine learning models in text, vision, audio, and multimodal models, for both inference and training. ",Python,https://github.com/huggingface/transformers,443.32 MB
9,yt-dlp,149776,12125,149776,2355,26/10/2020,03/03/2026,58.71 MB,A feature-rich command-line audio/video downloader,Python,https://github.com/yt-dlp/yt-dlp,58.71 MB
10,langflow,145285,8518,145285,891,08/02/2023,06/03/2026,1.11 GB,Langflow is a powerful tool for building and deploying AI-powered agents and workflows.,Python,https://github.com/langflow-ai/langflow,1.11 GB
11,HelloGitHub,144899,11170,144899,285,04/05/2016,28/02/2026,8.72 MB,":octocat: 分享 GitHub 上有趣、入门级的开源项目。Share interesting, entry-level open source projects on GitHub.",Python,https://github.com/521xueweihan/HelloGitHub,8.72 MB
12,youtube-dl,139801,10602,139801,4118,31/10/2010,19/02/2026,63.97 MB,Command-line program to download videos from YouTube.com and other video sites,Python,https://github.com/ytdl-org/youtube-dl,63.97 MB
13,langchain,128377,21082,128377,448,17/10/2022,05/03/2026,508.50 MB,The agent engineering platform,Python,https://github.com/langchain-ai/langchain,508.50 MB
14,open-webui,125883,17812,125883,315,06/10/2023,06/03/2026,327.70 MB,"User-friendly AI Interface (Supports Ollama, OpenAI API, ...)",Python,https://github.com/open-webui/open-webui,327.70 MB
15,ComfyUI,104959,12033,104959,3789,17/01/2023,05/03/2026,79.41 MB,"The most powerful and modular diffusion model GUI, api and backend with a graph/nodes interface.",Python,https://github.com/Comfy-Org/ComfyUI,79.41 MB
16,DeepSeek-V3,101897,16545,101897,100,26/12/2024,28/08/2025,1.73 MB,,Python,https://github.com/deepseek-ai/DeepSeek-V3,1.73 MB
17,awesome-llm-apps,99842,14511,99842,8,29/04/2024,02/03/2026,192.34 MB,"Collection of awesome LLM apps with AI Agents and RAG using OpenAI, Anthropic, Gemini and opensource models.",Python,https://github.com/Shubhamsaboo/awesome-llm-apps,192.34 MB
18,pytorch,97986,27083,97986,18078,13/08/2016,06/03/2026,1.21 GB,Tensors and Dynamic neural networks in Python with strong GPU acceleration,Python,https://github.com/pytorch/pytorch,1.21 GB
19,fastapi,95921,8789,95921,144,08/12/2018,05/03/2026,35.62 MB,"FastAPI framework, high performance, easy to learn, fast to code, ready for production",Python,https://github.com/fastapi/fastapi,35.62 MB
20,thefuck,95606,3845,95606,408,08/04/2015,19/07/2024,3.95 MB,Magnificent app which corrects your previous console command.,Python,https://github.com/nvbn/thefuck,3.95 MB
21,whisper,95496,11824,95496,115,16/09/2022,15/12/2025,12.49 MB,Robust Speech Recognition via Large-Scale Weak Supervision,Python,https://github.com/openai/whisper,12.49 MB
22,markitdown,90163,5293,90163,445,13/11/2024,20/02/2026,3.66 MB,Python tool for converting files and office documents to Markdown.,Python,https://github.com/microsoft/markitdown,3.66 MB
23,django,86975,33716,86975,423,28/04/2012,05/03/2026,271.07 MB,The Web framework for perfectionists with deadlines.,Python,https://github.com/django/django,271.07 MB
24,core,85157,36914,85157,3497,17/09/2013,05/03/2026,773.50 MB,:house_with_garden: Open source home automation that puts local control and privacy first.,Python,https://github.com/home-assistant/core,773.50 MB
25,manim,84989,7149,84989,474,22/03/2015,13/02/2026,74.80 MB,Animation engine for explanatory math videos,Python,https://github.com/3b1b/manim,74.80 MB
26,skills,84968,8953,84968,391,22/09/2025,04/03/2026,3.24 MB,Public repository for Agent Skills,Python,https://github.com/anthropics/skills,3.24 MB
27,devops-exercises,81402,18801,81402,41,03/10/2019,27/12/2025,7.82 MB,"Linux, Jenkins, AWS, SRE, Prometheus, Docker, Python, Ansible, Git, Kubernetes, Terraform, OpenStack, SQL, NoSQL, Azure, GCP, DNS, Elastic, Network, Virtualization. DevOps Interview Questions",Python,https://github.com/bregman-arie/devops-exercises,7.82 MB
28,Deep-Live-Cam,79854,11635,79854,128,24/09/2023,03/03/2026,152.25 MB,real time face swap and one-click video deepfake with only a single image,Python,https://github.com/hacksider/Deep-Live-Cam,152.25 MB
29,browser-use,79689,9422,79689,230,31/10/2024,03/03/2026,28.73 MB,🌐 Make websites accessible for AI agents. Automate tasks online with ease.,Python,https://github.com/browser-use/browser-use,28.73 MB
30,funNLP,79210,15147,79210,44,21/08/2018,10/05/2024,170.11 MB,"中英文敏感词、语言检测、中外手机/电话归属地/运营商查询、名字推断性别、手机号抽取、身份证抽取、邮箱抽取、中日文人名库、中文缩写库、拆字词典、词汇情感值、停用词、反动词表、暴恐词表、繁简体转换、英文模拟中文发音、汪峰歌词生成器、职业名称词库、同义词库、反义词库、否定词库、汽车品牌词库、汽车零件词库、连续英文切割、各种中文词向量、公司名字大全、古诗词库、IT词库、财经词库、成语词库、地名词库、历史名人词库、诗词词库、医学词库、饮食词库、法律词库、汽车词库、动物词库、中文聊天语料、中文谣言数据、百度中文问答数据集、句子相似度匹配算法集合、bert资源、文本生成&摘要相关工具、cocoNLP信息抽取工具、国内电话号码正则匹配、清华大学XLORE:中英文跨语言百科知识图谱、清华大学人工智能技术系列报告、自然语言生成、NLU太难了系列、自动对联数据及机器人、用户名黑名单列表、罪名法务名词及分类模型、微信公众号语料、cs224n深度学习自然语言处理课程、中文手写汉字识别、中文自然语言处理 语料/数据集、变量命名神器、分词语料库+代码、任务型对话英文数据集、ASR 语音数据集 + 基于深度学习的中文语音识别系统、笑声检测器、Microsoft多语言数字/单位/如日期时间识别包、中华新华字典数据库及api(包括常用歇后语、成语、词语和汉字)、文档图谱自动生成、SpaCy 中文模型、Common Voice语音识别数据集新版、神经网络关系抽取、基于bert的命名实体识别、关键词(Keyphrase)抽取包pke、基于医疗领域知识图谱的问答系统、基于依存句法与语义角色标注的事件三元组抽取、依存句法分析4万句高质量标注数据、cnocr：用来做中文OCR的Python3包、中文人物关系知识图谱项目、中文nlp竞赛项目及代码汇总、中文字符数据、speech-aligner: 从“人声语音”及其“语言文本”产生音素级别时间对齐标注的工具、AmpliGraph: 知识图谱表示学习(Python)库：知识图谱概念链接预测、Scattertext 文本可视化(python)、语言/知识表示工具：BERT & ERNIE、中文对比英文自然语言处理NLP的区别综述、Synonyms中文近义词工具包、HarvestText领域自适应文本挖掘工具（新词发现-情感分析-实体链接等）、word2word：(Python)方便易用的多语言词-词对集：62种语言/3,564个多语言对、语音识别语料生成工具：从具有音频/字幕的在线视频创建自动语音识别(ASR)语料库、构建医疗实体识别的模型（包含词典和语料标注）、单文档非监督的关键词抽取、Kashgari中使用gpt-2语言模型、开源的金融投资数据提取工具、文本自动摘要库TextTeaser: 仅支持英文、人民日报语料处理工具集、一些关于自然语言的基本模型、基于14W歌曲知识库的问答尝试--功能包括歌词接龙and已知歌词找歌曲以及歌曲歌手歌词三角关系的问答、基于Siamese bilstm模型的相似句子判定模型并提供训练数据集和测试数据集、用Transformer编解码模型实现的根据Hacker News文章标题自动生成评论、用BERT进行序列标记和文本分类的模板代码、LitBank：NLP数据集——支持自然语言处理和计算人文学科任务的100部带标记英文小说语料、百度开源的基准信息抽取系统、虚假新闻数据集、Facebook: LAMA语言模型分析，提供Transformer-XL/BERT/ELMo/GPT预训练语言模型的统一访问接口、CommonsenseQA：面向常识的英文QA挑战、中文知识图谱资料、数据及工具、各大公司内部里大牛分享的技术文档 PDF 或者 PPT、自然语言生成SQL语句（英文）、中文NLP数据增强（EDA）工具、英文NLP数据增强工具 、基于医药知识图谱的智能问答系统、京东商品知识图谱、基于mongodb存储的军事领域知识图谱问答项目、基于远监督的中文关系抽取、语音情感分析、中文ULMFiT-情感分析-文本分类-语料及模型、一个拍照做题程序、世界各国大规模人名库、一个利用有趣中文语料库 qingyun 训练出来的中文聊天机器人、中文聊天机器人seqGAN、省市区镇行政区划数据带拼音标注、教育行业新闻语料库包含自动文摘功能、开放了对话机器人-知识图谱-语义理解-自然语言处理工具及数据、中文知识图谱：基于百度百科中文页面-抽取三元组信息-构建中文知识图谱、masr: 中文语音识别-提供预训练模型-高识别率、Python音频数据增广库、中文全词覆盖BERT及两份阅读理解数据、ConvLab：开源多域端到端对话系统平台、中文自然语言处理数据集、基于最新版本rasa搭建的对话系统、基于TensorFlow和BERT的管道式实体及关系抽取、一个小型的证券知识图谱/知识库、复盘所有NLP比赛的TOP方案、OpenCLaP：多领域开源中文预训练语言模型仓库、UER：基于不同语料+编码器+目标任务的中文预训练模型仓库、中文自然语言处理向量合集、基于金融-司法领域(兼有闲聊性质)的聊天机器人、g2pC：基于上下文的汉语读音自动标记模块、Zincbase 知识图谱构建工具包、诗歌质量评价/细粒度情感诗歌语料库、快速转化「中文数字」和「阿拉伯数字」、百度知道问答语料库、基于知识图谱的问答系统、jieba_fast 加速版的jieba、正则表达式教程、中文阅读理解数据集、基于BERT等最新语言模型的抽取式摘要提取、Python利用深度学习进行文本摘要的综合指南、知识图谱深度学习相关资料整理、维基大规模平行文本语料、StanfordNLP 0.2.0：纯Python版自然语言处理包、NeuralNLP-NeuralClassifier：腾讯开源深度学习文本分类工具、端到端的封闭域对话系统、中文命名实体识别：NeuroNER vs. BertNER、新闻事件线索抽取、2019年百度的三元组抽取比赛：“科学空间队”源码、基于依存句法的开放域文本知识三元组抽取和知识库构建、中文的GPT2训练代码、ML-NLP - 机器学习(Machine Learning)NLP面试中常考到的知识点和代码实现、nlp4han:中文自然语言处理工具集(断句/分词/词性标注/组块/句法分析/语义分析/NER/N元语法/HMM/代词消解/情感分析/拼写检查、XLM：Facebook的跨语言预训练语言模型、用基于BERT的微调和特征提取方法来进行知识图谱百度百科人物词条属性抽取、中文自然语言处理相关的开放任务-数据集-当前最佳结果、CoupletAI - 基于CNN+Bi-LSTM+Attention 的自动对对联系统、抽象知识图谱、MiningZhiDaoQACorpus - 580万百度知道问答数据挖掘项目、brat rapid annotation tool: 序列标注工具、大规模中文知识图谱数据：1.4亿实体、数据增强在机器翻译及其他nlp任务中的应用及效果、allennlp阅读理解:支持多种数据和模型、PDF表格数据提取工具 、 Graphbrain：AI开源软件库和科研工具，目的是促进自动意义提取和文本理解以及知识的探索和推断、简历自动筛选系统、基于命名实体识别的简历自动摘要、中文语言理解测评基准，包括代表性的数据集&基准模型&语料库&排行榜、树洞 OCR 文字识别 、从包含表格的扫描图片中识别表格和文字、语声迁移、Python口语自然语言处理工具集(英文)、 similarity：相似度计算工具包，java编写、海量中文预训练ALBERT模型 、Transformers 2.0 、基于大规模音频数据集Audioset的音频增强 、Poplar：网页版自然语言标注工具、图片文字去除，可用于漫画翻译 、186种语言的数字叫法库、Amazon发布基于知识的人-人开放领域对话数据集 、中文文本纠错模块代码、繁简体转换 、 Python实现的多种文本可读性评价指标、类似于人名/地名/组织机构名的命名体识别数据集 、东南大学《知识图谱》研究生课程(资料)、. 英文拼写检查库 、 wwsearch是企业微信后台自研的全文检索引擎、CHAMELEON：深度学习新闻推荐系统元架构 、 8篇论文梳理BERT相关模型进展与反思、DocSearch：免费文档搜索引擎、 LIDA：轻量交互式对话标注工具 、aili - the fastest in-memory index in the East 东半球最快并发索引 、知识图谱车音工作项目、自然语言生成资源大全 、中日韩分词库mecab的Python接口库、中文文本摘要/关键词提取、汉字字符特征提取器 (featurizer)，提取汉字的特征（发音特征、字形特征）用做深度学习的特征、中文生成任务基准测评 、中文缩写数据集、中文任务基准测评 - 代表性的数据集-基准(预训练)模型-语料库-baseline-工具包-排行榜、PySS3：面向可解释AI的SS3文本分类器机器可视化工具 、中文NLP数据集列表、COPE - 格律诗编辑程序、doccano：基于网页的开源协同多语言文本标注工具 、PreNLP：自然语言预处理库、简单的简历解析器，用来从简历中提取关键信息、用于中文闲聊的GPT2模型：GPT2-chitchat、基于检索聊天机器人多轮响应选择相关资源列表(Leaderboards、Datasets、Papers)、(Colab)抽象文本摘要实现集锦(教程 、词语拼音数据、高效模糊搜索工具、NLP数据增广资源集、微软对话机器人框架 、 GitHub Typo Corpus：大规模GitHub多语言拼写错误/语法错误数据集、TextCluster：短文本聚类预处理模块 Short text cluster、面向语音识别的中文文本规范化、BLINK：最先进的实体链接库、BertPunc：基于BERT的最先进标点修复模型、Tokenizer：快速、可定制的文本词条化库、中文语言理解测评基准，包括代表性的数据集、基准(预训练)模型、语料库、排行榜、spaCy 医学文本挖掘与信息提取 、 NLP任务示例项目代码集、 python拼写检查库、chatbot-list - 行业内关于智能客服、聊天机器人的应用和架构、算法分享和介绍、语音质量评价指标(MOSNet, BSSEval, STOI, PESQ, SRMR)、 用138GB语料训练的法文RoBERTa预训练语言模型 、BERT-NER-Pytorch：三种不同模式的BERT中文NER实验、无道词典 - 有道词典的命令行版本，支持英汉互查和在线查询、2019年NLP亮点回顾、 Chinese medical dialogue data 中文医疗对话数据集 、最好的汉字数字(中文数字)-阿拉伯数字转换工具、 基于百科知识库的中文词语多词义/义项获取与特定句子词语语义消歧、awesome-nlp-sentiment-analysis - 情感分析、情绪原因识别、评价对象和评价词抽取、LineFlow：面向所有深度学习框架的NLP数据高效加载器、中文医学NLP公开资源整理 、MedQuAD：(英文)医学问答数据集、将自然语言数字串解析转换为整数和浮点数、Transfer Learning in Natural Language Processing (NLP) 、面向语音识别的中文/英文发音辞典、Tokenizers：注重性能与多功能性的最先进分词器、CLUENER 细粒度命名实体识别 Fine Grained Named Entity Recognition、 基于BERT的中文命名实体识别、中文谣言数据库、NLP数据集/基准任务大列表、nlp相关的一些论文及代码, 包括主题模型、词向量(Word Embedding)、命名实体识别(NER)、文本分类(Text Classificatin)、文本生成(Text Generation)、文本相似性(Text Similarity)计算等，涉及到各种与nlp相关的算法，基于keras和tensorflow 、Python文本挖掘/NLP实战示例、 Blackstone：面向非结构化法律文本的spaCy pipeline和NLP模型通过同义词替换实现文本“变脸” 、中文 预训练 ELECTREA 模型: 基于对抗学习 pretrain Chinese Model 、albert-chinese-ner - 用预训练语言模型ALBERT做中文NER 、基于GPT2的特定主题文本生成/文本增广、开源预训练语言模型合集、多语言句向量包、编码、标记和实现：一种可控高效的文本生成方法、 英文脏话大列表 、attnvis：GPT2、BERT等transformer语言模型注意力交互可视化、CoVoST：Facebook发布的多语种语音-文本翻译语料库，包括11种语言(法语、德语、荷兰语、俄语、西班牙语、意大利语、土耳其语、波斯语、瑞典语、蒙古语和中文)的语音、文字转录及英文译文、Jiagu自然语言处理工具 - 以BiLSTM等模型为基础，提供知识图谱关系抽取 中文分词 词性标注 命名实体识别 情感分析 新词发现 关键词 文本摘要 文本聚类等功能、用unet实现对文档表格的自动检测，表格重建、NLP事件提取文献资源列表 、 金融领域自然语言处理研究资源大列表、CLUEDatasetSearch - 中英文NLP数据集：搜索所有中文NLP数据集，附常用英文NLP数据集 、medical_NER - 中文医学知识图谱命名实体识别 、(哈佛)讲因果推理的免费书、知识图谱相关学习资料/数据集/工具资源大列表、Forte：灵活强大的自然语言处理pipeline工具集 、Python字符串相似性算法库、PyLaia：面向手写文档分析的深度学习工具包、TextFooler：针对文本分类/推理的对抗文本生成模块、Haystack：灵活、强大的可扩展问答(QA)框架、中文关键短语抽取工具",Python,https://github.com/fighting41love/funNLP,170.11 MB
31,models,77687,45254,77687,1282,05/02/2016,05/03/2026,644.84 MB,Models and examples built with TensorFlow,Python,https://github.com/tensorflow/models,644.84 MB
32,d2l-zh,75984,12133,75984,121,23/08/2017,30/07/2024,309.54 MB,《动手学深度学习》：面向中文读者、能运行、可讨论。中英文版被70多个国家的500多所大学用于教学。,Python,https://github.com/d2l-ai/d2l-zh,309.54 MB
33,PayloadsAllTheThings,75745,16708,75745,13,18/10/2016,04/03/2026,22.51 MB,A list of useful payloads and bypass for Web Application Security and Pentest/CTF,Python,https://github.com/swisskyrepo/PayloadsAllTheThings,22.51 MB
34,spec-kit,74386,6345,74386,628,21/08/2025,05/03/2026,5.42 MB,💫 Toolkit to help you get started with Spec-Driven Development,Python,https://github.com/github/spec-kit,5.42 MB
35,ragflow,74243,8259,74243,3043,12/12/2023,05/03/2026,109.35 MB,RAGFlow is a leading open-source Retrieval-Augmented Generation (RAG) engine that fuses cutting-edge RAG with Agent capabilities to create a superior context layer for LLMs,Python,https://github.com/infiniflow/ragflow,109.35 MB
36,sherlock,73399,8708,73399,202,24/12/2018,05/03/2026,17.94 MB,Hunt down social media accounts by username across social networks,Python,https://github.com/sherlock-project/sherlock,17.94 MB
37,vllm,72142,13991,72142,3537,09/02/2023,06/03/2026,167.41 MB,A high-throughput and memory-efficient inference and serving engine for LLMs,Python,https://github.com/vllm-project/vllm,167.41 MB
38,awesome-machine-learning,71856,15333,71856,21,15/07/2014,29/01/2026,2.82 MB,"A curated list of awesome Machine Learning frameworks, libraries and software.",Python,https://github.com/josephmisiti/awesome-machine-learning,2.82 MB
39,cpython,71848,34180,71848,9284,10/02/2017,06/03/2026,778.56 MB,The Python programming language,Python,https://github.com/python/cpython,778.56 MB
40,PaddleOCR,71639,9899,71639,265,08/05/2020,05/03/2026,1.73 GB,"Turn any PDF or image document into structured data for your AI. A powerful, lightweight OCR toolkit that bridges the gap between images/PDFs and LLMs. Supports 100+ languages.",Python,https://github.com/PaddlePaddle/PaddleOCR,1.73 GB
41,flask,71325,16741,71325,3,06/04/2010,04/03/2026,11.50 MB,The Python micro framework for building web applications.,Python,https://github.com/pallets/flask,11.50 MB
42,gpt_academic,70171,8401,70171,300,20/03/2023,25/01/2026,71.05 MB,"为GPT/GLM等LLM大语言模型提供实用化交互接口，特别优化论文阅读/润色/写作体验，模块化设计，支持自定义快捷按钮&函数插件，支持Python和C++等项目剖析&自译解功能，PDF/LaTex论文翻译&总结功能，支持并行问询多种LLM模型，支持chatglm3等本地模型。接入通义千问, deepseekcoder, 讯飞星火, 文心一言, llama2, rwkv, claude2, moss等。",Python,https://github.com/binary-husky/gpt_academic,71.05 MB
43,OpenHands,68621,8567,68621,358,13/03/2024,06/03/2026,280.64 MB,🙌 OpenHands: AI-Driven Development,Python,https://github.com/OpenHands/OpenHands,280.64 MB
44,ansible,68207,24180,68207,827,06/03/2012,05/03/2026,257.04 MB,"Ansible is a radically simple IT automation platform that makes your applications and systems easier to deploy and maintain. Automate everything from code deployment to network configuration to cloud management, in a language that approaches plain English, using SSH, with no agents to install on remote systems. https://docs.ansible.com.",Python,https://github.com/ansible/ansible,257.04 MB
45,LlamaFactory,67932,8285,67932,917,28/05/2023,05/03/2026,12.78 MB,Unified Efficient Fine-Tuning of 100+ LLMs & VLMs (ACL 2024),Python,https://github.com/hiyouga/LlamaFactory,12.78 MB
46,annotated_deep_learning_paper_implementations,65862,6618,65862,29,25/08/2020,22/01/2026,152.71 MB,"🧑‍🏫 60+ Implementations/tutorials of deep learning papers with side-by-side notes 📝; including transformers (original, xl, switch, feedback, vit, ...), optimizers (adam, adabelief, sophia, ...), gans(cyclegan, stylegan2, ...), 🎮 reinforcement learning (ppo, dqn), capsnet, distillation, ... 🧠",Python,https://github.com/labmlai/annotated_deep_learning_paper_implementations,152.71 MB
47,gpt4free,65714,13661,65714,10,29/03/2023,04/03/2026,166.97 MB,The official gpt4free repository | various collection of powerful language models | opus 4.6 gpt 5.3 kimi 2.5 deepseek v3.2 gemini 3,Python,https://github.com/xtekky/gpt4free,166.97 MB
48,scikit-learn,65298,26752,65298,2137,17/08/2010,05/03/2026,175.45 MB,scikit-learn: machine learning in Python,Python,https://github.com/scikit-learn/scikit-learn,175.45 MB
49,MetaGPT,64799,8156,64799,88,30/06/2023,21/01/2026,179.72 MB,"🌟 The Multi-Agent Framework: First AI Software Company, Towards Natural Language Programming",Python,https://github.com/FoundationAgents/MetaGPT,179.72 MB
50,localstack,64564,4588,64564,330,25/10/2016,05/03/2026,61.16 MB,💻 A fully functional local AWS cloud stack. Develop and test your cloud & Serverless apps offline,Python,https://github.com/localstack/localstack,61.16 MB
51,keras,63911,19714,63911,279,28/03/2015,06/03/2026,49.36 MB,Deep Learning for humans,Python,https://github.com/keras-team/keras,49.36 MB
52,OpenBB,62604,6124,62604,59,20/12/2020,05/03/2026,2.29 GB,"Financial data platform for analysts, quants and AI agents.",Python,https://github.com/OpenBB-finance/OpenBB,2.29 GB
53,open-interpreter,62542,5384,62542,302,14/07/2023,09/02/2026,98.18 MB,A natural language interface for computers,Python,https://github.com/openinterpreter/open-interpreter,98.18 MB
54,crawl4ai,61419,6271,61419,272,09/05/2024,03/03/2026,145.05 MB,"🚀🤖 Crawl4AI: Open-source LLM Friendly Web Crawler & Scraper. Don't be shy, join here: https://discord.gg/jP8KfhDhyN",Python,https://github.com/unclecode/crawl4ai,145.05 MB
55,scrapy,60596,11336,60596,656,22/02/2010,02/03/2026,28.69 MB,"Scrapy, a fast high-level web crawling & scraping framework for Python.",Python,https://github.com/scrapy/scrapy,28.69 MB
56,openpilot,60230,10675,60230,280,24/11/2016,06/03/2026,863.35 MB,"openpilot is an operating system for robotics. Currently, it upgrades the driver assistance system on 300+ supported cars.",Python,https://github.com/commaai/openpilot,863.35 MB
