Ranking,Project Name,Stars,Forks,Watchers,Open Issues,Created At,Last Commit,Size,Description,Language,Repo URL,Size
174,marker,32190,2212,32190,388,30/10/2023,04/03/2026,18.01 MB,Convert PDF to markdown + JSON quickly with high accuracy,Python,https://github.com/datalab-to/marker,18.01 MB
175,fairseq,32179,6668,32179,1353,29/08/2017,30/09/2025,25.46 MB,Facebook AI Research Sequence-to-Sequence Toolkit written in Python.,Python,https://github.com/facebookresearch/fairseq,25.46 MB
176,erpnext,32087,10580,32087,2024,08/06/2011,05/03/2026,1.54 GB,Free and Open Source Enterprise Resource Planning (ERP),Python,https://github.com/frappe/erpnext,1.54 GB
177,PDFMathTranslate,32048,2883,32048,135,06/09/2024,25/11/2025,53.12 MB,[EMNLP 2025 Demo] PDF scientific paper translation with preserved formats - 基于 AI 完整保留排版的 PDF 文档全文双语翻译，支持 Google/DeepL/Ollama/OpenAI 等服务，提供 CLI/GUI/MCP/Docker/Zotero,Python,https://github.com/PDFMathTranslate/PDFMathTranslate,53.12 MB
178,glances,31945,1694,31945,155,04/12/2011,05/03/2026,49.91 MB,"Glances an Eye on your system. A top/htop alternative for GNU/Linux, BSD, Mac OS and Windows operating systems.",Python,https://github.com/nicolargo/glances,49.91 MB
179,posthog,31899,2366,31899,3198,23/01/2020,06/03/2026,4.44 GB,"🦔 PostHog is an all-in-one developer platform for building successful products. We offer product analytics, web analytics, session replay, error tracking, feature flags, experimentation, surveys, data warehouse, a CDP, and an AI product assistant to help debug your code, ship features faster, and keep all your usage and customer data in one stack.",Python,https://github.com/PostHog/posthog,4.44 GB
180,kitty,31667,1300,31667,19,16/10/2016,05/03/2026,66.57 MB,"If you live in the terminal, kitty is made for you! Cross-platform, fast, feature-rich, GPU based.",Python,https://github.com/kovidgoyal/kitty,66.57 MB
181,numpy,31562,12118,31562,2330,13/09/2010,06/03/2026,167.65 MB,The fundamental package for scientific computing with Python.,Python,https://github.com/numpy/numpy,167.65 MB
182,tinygrad,31496,3937,31496,229,18/10/2020,06/03/2026,100.41 MB,You like pytorch? You like micrograd? You love tinygrad! ❤️ ,Python,https://github.com/tinygrad/tinygrad,100.41 MB
183,CheatSheetSeries,31484,4401,31484,67,21/12/2018,03/03/2026,2.08 GB,The OWASP Cheat Sheet Series was created to provide a concise collection of high value information on specific application security topics.,Python,https://github.com/OWASP/CheatSheetSeries,2.08 GB
184,ChatDev,31400,3881,31400,45,28/08/2023,27/02/2026,372.61 MB,ChatDev 2.0: Dev All through LLM-powered Multi-Agent Collaboration,Python,https://github.com/OpenBMB/ChatDev,372.61 MB
185,TradingAgents,31357,6030,31357,238,28/12/2024,25/02/2026,4.06 MB,TradingAgents: Multi-Agents LLM Financial Trading Framework,Python,https://github.com/TauricResearch/TradingAgents,4.06 MB
186,graphrag,31252,3297,31252,70,27/03/2024,05/03/2026,199.92 MB,A modular graph-based Retrieval-Augmented Generation (RAG) system,Python,https://github.com/microsoft/graphrag,199.92 MB
187,interactive-coding-challenges,31210,4642,31210,75,28/04/2015,08/05/2024,7.59 MB,120+ interactive Python coding interview challenges (algorithms and data structures).  Includes Anki flashcards.,Python,https://github.com/donnemartin/interactive-coding-challenges,7.59 MB
188,tqdm,31003,1439,31003,591,03/06/2015,14/02/2026,5.91 MB,":zap: A Fast, Extensible Progress Bar for Python and CLI",Python,https://github.com/tqdm/tqdm,5.91 MB
189,ML-From-Scratch,30954,5198,30954,71,05/02/2017,15/10/2023,553.00 KB,Machine Learning From Scratch. Bare bones NumPy implementations of machine learning models and algorithms with a focus on accessibility. Aims to cover everything from linear regression to deep learning.,Python,https://github.com/eriklindernoren/ML-From-Scratch,553.00 KB
190,pytorch-lightning,30902,3671,30902,969,31/03/2019,05/03/2026,130.28 MB,"Pretrain, finetune ANY AI model of ANY size on 1 or 10,000+ GPUs with zero code changes.",Python,https://github.com/Lightning-AI/pytorch-lightning,130.28 MB
191,DeepFaceLive,30592,1146,30592,1,15/12/2020,08/11/2024,1.47 GB,Real-time face swap for PC streaming or video calls,Python,https://github.com/iperov/DeepFaceLive,1.47 GB
192,roop,30546,6904,30546,5,28/05/2023,19/08/2024,97.43 MB,one-click face swap,Python,https://github.com/s0md3v/roop,97.43 MB
193,changedetection.io,30452,1701,30452,326,27/01/2021,06/03/2026,17.50 MB,"Best and simplest tool for website change detection, web page monitoring, and website change alerts. Perfect for tracking content changes, price drops, restock alerts, and website defacement monitoring—all for free or enjoy our SaaS plan!",Python,https://github.com/dgtlmoon/changedetection.io,17.50 MB
194,agents,30337,3319,30337,8,24/07/2025,21/02/2026,2.22 MB,Intelligent automation and multi-agent orchestration for Claude Code,Python,https://github.com/wshobson/agents,2.22 MB
195,algo,30324,2364,30324,68,15/05/2016,04/03/2026,4.17 MB,Set up a personal VPN in the cloud,Python,https://github.com/trailofbits/algo,4.17 MB
196,stanford_alpaca,30268,4009,30268,189,10/03/2023,17/07/2024,8.45 MB,"Code and documentation to train Stanford's Alpaca models, and generate the data.",Python,https://github.com/tatsu-lab/stanford_alpaca,8.45 MB
197,openai-python,30153,4593,30153,299,25/10/2020,05/03/2026,7.47 MB,The official Python library for the OpenAI API,Python,https://github.com/openai/openai-python,7.47 MB
198,jumpserver,30038,5667,30038,76,04/07/2014,05/03/2026,111.38 MB,"JumpServer is an open-source Privileged Access Management (PAM) platform that provides DevOps and IT teams with on-demand and secure access to SSH, RDP, Kubernetes, Database and RemoteApp endpoints through a web browser.",Python,https://github.com/jumpserver/jumpserver,111.38 MB
199,hosts,29952,2393,29952,137,12/04/2012,01/03/2026,1.68 GB,"🔒 Consolidating and extending hosts files from several well-curated sources. Optionally pick extensions for porn, social media, and other categories.",Python,https://github.com/StevenBlack/hosts,1.68 GB
200,django-rest-framework,29923,7077,29923,79,02/03/2011,04/03/2026,61.10 MB,Web APIs for Django. 🎸,Python,https://github.com/encode/django-rest-framework,61.10 MB
201,Jobs_Applier_AI_Agent_AIHawk,29409,4473,29409,27,04/08/2024,16/11/2025,194.00 KB,"AIHawk aims to easy job hunt process by automating the job application process. Utilizing artificial intelligence, it enables users to apply for multiple jobs in a tailored way.",Python,https://github.com/feder-cr/Jobs_Applier_AI_Agent_AIHawk,194.00 KB
202,llama3,29279,3519,29279,217,15/03/2024,26/01/2025,569.00 KB,The official Meta Llama 3 GitHub site,Python,https://github.com/meta-llama/llama3,569.00 KB
203,nanobot,29220,4749,29220,888,01/02/2026,05/03/2026,33.21 MB,"""🐈 nanobot: The Ultra-Lightweight OpenClaw""",Python,https://github.com/HKUDS/nanobot,33.21 MB
204,EasyOCR,29043,3535,29043,526,14/03/2020,05/12/2025,157.85 MB,"Ready-to-use OCR with 80+ supported languages and all popular writing scripts including Latin, Chinese, Arabic, Devanagari, Cyrillic and etc.",Python,https://github.com/JaidedAI/EasyOCR,157.85 MB
205,LightRAG,29008,4155,29008,199,02/10/2024,05/03/2026,86.02 MB,"[EMNLP2025] ""LightRAG: Simple and Fast Retrieval-Augmented Generation""",Python,https://github.com/HKUDS/LightRAG,86.02 MB
206,wttr.in,28929,1211,28929,365,26/12/2015,13/10/2025,3.97 MB,:partly_sunny: The right way to check the weather,Python,https://github.com/chubin/wttr.in,3.97 MB
207,data-science-ipython-notebooks,28905,8033,28905,42,23/01/2015,20/03/2024,47.88 MB,"Data science Python notebooks: Deep learning (TensorFlow, Theano, Caffe, Keras), scikit-learn, Kaggle, big data (Spark, Hadoop MapReduce, HDFS), matplotlib, pandas, NumPy, SciPy, Python essentials, AWS, and various command lines.",Python,https://github.com/donnemartin/data-science-ipython-notebooks,47.88 MB
208,python-telegram-bot,28882,5995,28882,22,07/07/2015,03/03/2026,18.53 MB,We have made you a wrapper you can't refuse,Python,https://github.com/python-telegram-bot/python-telegram-bot,18.53 MB
209,PythonRobotics,28795,7231,28795,32,21/03/2016,02/03/2026,296.66 MB,Python sample codes and textbook for robotics algorithms.,Python,https://github.com/AtsushiSakai/PythonRobotics,296.66 MB
210,BitNet,28693,2368,28693,212,05/08/2024,03/02/2026,8.10 MB,Official inference framework for 1-bit LLMs,Python,https://github.com/microsoft/BitNet,8.10 MB
211,linkedin-skill-assessments-quizzes,28676,13055,28676,20,13/07/2019,28/11/2025,152.41 MB,"Full reference of LinkedIn answers 2024 for skill assessments (aws-lambda, rest-api, javascript, react, git, html, jquery, mongodb, java, Go, python, machine-learning, power-point) linkedin excel test lösungen, linkedin machine learning test LinkedIn test questions and answers ",Python,https://github.com/Ebazhanov/linkedin-skill-assessments-quizzes,152.41 MB
212,Open-Sora,28648,2902,28648,11,20/02/2024,30/04/2025,33.54 MB,Open-Sora: Democratizing Efficient Video Production for All,Python,https://github.com/hpcaitech/Open-Sora,33.54 MB
213,d2l-en,28353,4981,28353,183,09/10/2018,18/08/2024,310.45 MB,"Interactive deep learning book with multi-framework code, math, and discussions. Adopted at 500 universities from 70 countries including Stanford, MIT, Harvard, and Cambridge.",Python,https://github.com/d2l-ai/d2l-en,310.45 MB
214,redash,28252,4559,28252,741,28/10/2013,02/03/2026,28.71 MB,"Make Your Company Data Driven. Connect to any data source, easily visualize, dashboard and share your data.",Python,https://github.com/getredash/redash,28.71 MB
215,Genesis,28220,2617,28220,115,31/10/2023,05/03/2026,93.60 MB,A generative world for general-purpose robotics & embodied AI learning.,Python,https://github.com/Genesis-Embodied-AI/Genesis,93.60 MB
216,celery,28197,4979,28197,772,24/04/2009,05/03/2026,35.50 MB,Distributed Task Queue (development branch),Python,https://github.com/celery/celery,35.50 MB
217,reflex,28195,1692,28195,285,25/10/2022,06/03/2026,28.73 MB,🕸️ Web apps in pure Python 🐍,Python,https://github.com/reflex-dev/reflex,28.73 MB
218,python-fire,28144,1469,28144,165,21/02/2017,01/03/2026,6.11 MB,Python Fire is a library for automatically generating command line interfaces (CLIs) from absolutely any Python object.,Python,https://github.com/google/python-fire,6.11 MB
219,spleeter,28081,3064,28081,273,26/09/2019,02/04/2025,9.40 MB,Deezer source separation library including pretrained models.,Python,https://github.com/deezer/spleeter,9.40 MB
220,so-vits-svc,28014,5081,28014,27,10/03/2023,11/11/2023,10.88 MB,SoftVC VITS Singing Voice Conversion,Python,https://github.com/svc-develop-team/so-vits-svc,10.88 MB
221,insightface,28000,5943,28000,1258,01/09/2017,02/02/2026,58.44 MB,State-of-the-art 2D and 3D Face Analysis Project,Python,https://github.com/deepinsight/insightface,58.44 MB
222,GitHub520,27982,2654,27982,14,13/05/2020,06/03/2026,14.70 MB,:kissing_heart: 让你“爱”上 GitHub，解决访问时图裂、加载慢的问题。（无需安装）,Python,https://github.com/521xueweihan/GitHub520,14.70 MB
223,ChatGPT,27972,4419,27972,11,03/12/2022,02/08/2023,1.89 MB,Reverse engineered ChatGPT API,Python,https://github.com/acheong08/ChatGPT,1.89 MB
224,storm,27969,2543,27969,92,24/03/2024,30/09/2025,8.02 MB,An LLM-powered knowledge curation system that researches a topic and generates a full-length report with citations.,Python,https://github.com/stanford-oval/storm,8.02 MB
225,locust,27564,3182,27564,11,17/02/2011,02/03/2026,38.23 MB,Write scalable load tests in plain Python 🚗💨,Python,https://github.com/locustio/locust,38.23 MB
226,Hitomi-Downloader,27560,2471,27560,4115,26/11/2017,28/09/2025,3.64 MB,":cake: Desktop utility to download images/videos/music/text from various websites, and more.",Python,https://github.com/KurtBestor/Hitomi-Downloader,3.64 MB
227,cascadia-code,27557,840,27557,153,10/07/2019,06/03/2025,28.24 MB,"This is a fun, new monospaced font that includes programming ligatures and is designed to enhance the modern look and feel of the Windows Terminal.",Python,https://github.com/microsoft/cascadia-code,28.24 MB
228,mihomo,27373,3707,27373,375,20/05/2021,06/03/2026,10.79 MB,A simple Python Pydantic model for Honkai: Star Rail parsed data from the Mihomo API.,Python,https://github.com/MetaCubeX/mihomo,10.79 MB
229,pydantic,27111,2481,27111,542,03/05/2017,05/03/2026,360.01 MB,Data validation using Python type hints,Python,https://github.com/pydantic/pydantic,360.01 MB
230,ArchiveBox,27004,1490,27004,209,05/05/2017,26/02/2026,14.82 MB,"🗃 Open source self-hosted web archiving. Takes URLs/browser history/bookmarks/Pocket/Pinboard/etc., saves HTML, JS, PDFs, media, and more...",Python,https://github.com/ArchiveBox/ArchiveBox,14.82 MB
231,facefusion,26994,4329,26994,0,17/08/2023,05/03/2026,26.15 MB,Industry leading face manipulation platform,Python,https://github.com/facefusion/facefusion,26.15 MB
232,generative-models,26963,3058,26963,338,22/06/2023,16/12/2025,86.59 MB,Generative Models by Stability AI,Python,https://github.com/Stability-AI/generative-models,86.59 MB
233,Qwen3,26825,1917,26825,44,05/02/2024,09/01/2026,6.84 MB,"Qwen3 is the large language model series developed by Qwen team, Alibaba Cloud.",Python,https://github.com/QwenLM/Qwen3,6.84 MB
234,ItChat,26670,5669,26670,304,19/01/2016,28/09/2023,955.00 KB,A complete and graceful API for Wechat. 微信个人号接口、微信机器人及命令行微信，三十行即可自定义个人号机器人。,Python,https://github.com/littlecodersh/ItChat,955.00 KB
235,awesome-claude-code,26455,1657,26455,69,19/04/2025,06/03/2026,18.29 MB,"A curated list of awesome skills, hooks, slash-commands, agent orchestrators, applications, and plugins for Claude Code by Anthropic",Python,https://github.com/hesreallyhim/awesome-claude-code,18.29 MB
236,Detectron,26404,5418,26404,331,05/10/2017,20/11/2023,4.42 MB,"FAIR's research platform for object detection research, implementing popular algorithms like Mask R-CNN and RetinaNet.",Python,https://github.com/facebookresearch/Detectron,4.42 MB
237,YouCompleteMe,26284,2779,26284,32,16/04/2012,04/03/2026,35.91 MB,A code-completion engine for Vim,Python,https://github.com/ycm-core/YouCompleteMe,35.91 MB
238,mkdocs-material,26187,4049,26187,2,28/01/2016,05/03/2026,142.84 MB,Documentation that simply works,Python,https://github.com/squidfunk/mkdocs-material,142.84 MB
239,deep-learning-for-image-processing,26101,8261,26101,102,14/11/2019,01/01/2026,25.04 MB,deep learning for image processing including classification and object-detection etc.,Python,https://github.com/WZMIAOMIAO/deep-learning-for-image-processing,25.04 MB
240,open-r1,25923,2414,25923,336,24/01/2025,24/11/2025,6.64 MB,Fully open reproduction of DeepSeek-R1,Python,https://github.com/huggingface/open-r1,6.64 MB
241,ungoogled-chromium,25915,1100,25915,172,12/06/2015,04/03/2026,17.45 MB,"Google Chromium, sans integration with Google",Python,https://github.com/ungoogled-software/ungoogled-chromium,17.45 MB
242,smolagents,25768,2341,25768,407,05/12/2024,01/03/2026,7.18 MB,🤗 smolagents: a barebones library for agents that think in code.,Python,https://github.com/huggingface/smolagents,7.18 MB
243,MiniGPT-4,25763,2916,25763,377,15/04/2023,02/09/2024,65.02 MB,"Open-sourced codes for MiniGPT-4 and MiniGPT-v2 (https://minigpt-4.github.io, https://minigpt-v2.github.io/)",Python,https://github.com/Vision-CAIR/MiniGPT-4,65.02 MB
244,searxng,25762,2522,25762,231,12/04/2021,05/03/2026,109.59 MB,SearXNG is a free internet metasearch engine which aggregates results from various search services and databases. Users are neither tracked nor profiled.,Python,https://github.com/searxng/searxng,109.59 MB
245,langgraph,25660,4458,25660,401,09/08/2023,06/03/2026,497.38 MB,Build resilient language agents as graphs.,Python,https://github.com/langchain-ai/langgraph,497.38 MB
246,gpt-researcher,25555,3397,25555,183,12/05/2023,01/03/2026,40.34 MB,An autonomous agent that conducts deep research on any data using any LLM providers,Python,https://github.com/assafelovic/gpt-researcher,40.34 MB
247,Mask_RCNN,25528,11702,25528,2022,19/10/2017,07/06/2024,119.72 MB,Mask R-CNN for object detection and instance segmentation on Keras and TensorFlow,Python,https://github.com/matterport/Mask_RCNN,119.72 MB
248,agenticSeek,25431,2825,25431,35,19/02/2025,02/03/2026,23.67 MB,"Fully Local Manus AI. No APIs, No $200 monthly bills. Enjoy an autonomous agent that thinks, browses the web, and code for the sole cost of electricity. 🔔 Official updates only via twitter @Martin993886460 (Beware of fake account)",Python,https://github.com/Fosowl/agenticSeek,23.67 MB
249,hello-agents,25416,2854,25416,48,07/09/2025,03/03/2026,178.23 MB,📚 《从零开始构建智能体》——从零开始的智能体原理与实践教程,Python,https://github.com/datawhalechina/hello-agents,178.23 MB
250,algorithms,25357,4733,25357,0,17/11/2016,23/02/2026,1.88 MB,Minimal examples of data structures and algorithms in Python,Python,https://github.com/keon/algorithms,1.88 MB
251,flux,25257,1859,25257,216,01/08/2024,31/07/2025,36.61 MB,Official inference repo for FLUX.1 models,Python,https://github.com/black-forest-labs/flux,36.61 MB
252,kotaemon,25181,2108,25181,226,25/03/2024,04/03/2026,42.70 MB,An open-source RAG-based tool for chatting with your documents.,Python,https://github.com/Cinnamon/kotaemon,42.70 MB
253,fish-speech,25126,2100,25126,27,10/10/2023,05/03/2026,19.21 MB,SOTA Open Source TTS,Python,https://github.com/fishaudio/fish-speech,19.21 MB
254,pipenv,25101,1878,25101,157,20/01/2017,16/02/2026,252.97 MB, Python Development Workflow for Humans.,Python,https://github.com/pypa/pipenv,252.97 MB
255,pytorch-CycleGAN-and-pix2pix,24981,6571,24981,588,18/04/2017,06/08/2025,8.27 MB,Image-to-Image Translation in PyTorch,Python,https://github.com/junyanz/pytorch-CycleGAN-and-pix2pix,8.27 MB
256,labelImg,24818,6588,24818,451,17/09/2015,07/06/2024,237.14 MB,"LabelImg is now part of the Label Studio community. The popular image annotation tool created by Tzutalin is no longer actively being developed, but you can check out Label Studio, the open source data labeling tool for images, text, hypertext, audio, video and time-series data.",Python,https://github.com/HumanSignal/labelImg,237.14 MB
257,zulip,24794,9648,24794,2018,25/09/2015,06/03/2026,593.44 MB,Zulip server and web application. Open-source team chat that helps teams stay productive and focused.,Python,https://github.com/zulip/zulip,593.44 MB
258,deer-flow,24740,2929,24740,225,07/05/2025,05/03/2026,21.77 MB,"An open-source SuperAgent harness that researches, codes, and creates. With the help of sandboxes, memories, tools, skills and subagents, it handles different levels of tasks that could take minutes to hours.",Python,https://github.com/bytedance/deer-flow,21.77 MB
259,cookiecutter,24722,2201,24722,269,14/07/2013,04/03/2026,3.61 MB,"A cross-platform command-line utility that creates projects from cookiecutters (project templates), e.g. Python package projects, C projects.",Python,https://github.com/cookiecutter/cookiecutter,3.61 MB
260,gpt-2,24662,5865,24662,197,11/02/2019,14/08/2024,4.38 MB,"Code for the paper ""Language Models are Unsupervised Multitask Learners""",Python,https://github.com/openai/gpt-2,4.38 MB
261,mlflow,24588,5353,24588,2072,05/06/2018,06/03/2026,1.28 GB,"The open source developer platform to build AI agents and models with confidence. Enhance your AI applications with end-to-end tracking, observability, and evaluations, all in one integrated platform.",Python,https://github.com/mlflow/mlflow,1.28 GB
262,JARVIS,24560,2069,24560,529,30/03/2023,29/07/2025,40.70 MB,"JARVIS, a system to connect LLMs with ML community. Paper: https://arxiv.org/pdf/2303.17580.pdf",Python,https://github.com/microsoft/JARVIS,40.70 MB
263,LLaVA,24510,2735,24510,1137,17/04/2023,12/08/2024,13.73 MB,[NeurIPS'23 Oral] Visual Instruction Tuning (LLaVA) built towards GPT-4V level capabilities and beyond.,Python,https://github.com/haotian-liu/LLaVA,13.73 MB
264,dash,24434,2263,24434,574,10/04/2015,04/03/2026,194.45 MB,Data Apps & Dashboards for Python. No JavaScript Required.,Python,https://github.com/plotly/dash,194.45 MB
265,calibre,24282,2561,24282,7,28/05/2013,05/03/2026,310.71 MB,The official source code repository for the calibre ebook manager,Python,https://github.com/kovidgoyal/calibre,310.71 MB
266,maple-font,24277,961,24277,18,08/04/2022,01/03/2026,167.65 MB,"Maple Mono: Open source monospace font with round corner, ligatures and Nerd-Font icons for IDE and terminal, fine-grained customization options. 带连字和控制台图标的圆角等宽字体，中英文宽度完美2:1，细粒度的自定义选项",Python,https://github.com/subframe7536/maple-font,167.65 MB
267,sglang,24130,4669,24130,2294,08/01/2024,06/03/2026,90.32 MB,SGLang is a high-performance serving framework for large language models and multimodal models.,Python,https://github.com/sgl-project/sglang,90.32 MB
268,spotify-downloader,24129,2082,24129,113,06/07/2016,24/02/2026,155.80 MB,Download your Spotify playlists and songs along with album art and metadata (from YouTube if a match is found).,Python,https://github.com/spotDL/spotify-downloader,155.80 MB
269,Open-AutoGLM,24034,3806,24034,231,08/12/2025,27/02/2026,5.30 MB,An Open Phone Agent Model & Framework. Unlocking the AI Phone for Everyone,Python,https://github.com/zai-org/Open-AutoGLM,5.30 MB
270,MiniCPM-o,24030,1857,24030,39,29/01/2024,23/02/2026,519.73 MB,"A Gemini 2.5 Flash Level MLLM for Vision, Speech, and Full-Duplex Multimodal Live Streaming on Your Phone",Python,https://github.com/OpenBMB/MiniCPM-o,519.73 MB
271,Scrapling,23961,1711,23961,4,13/10/2024,05/03/2026,5.66 MB,🕷️ An adaptive Web Scraping framework that handles everything from a single request to a full-scale crawl!,Python,https://github.com/D4Vinci/Scrapling,5.66 MB
272,ultimatevocalremovergui,23817,1779,23817,1358,20/07/2020,13/03/2025,547.95 MB, GUI for a Vocal Remover that uses Deep Neural Networks.,Python,https://github.com/Anjok07/ultimatevocalremovergui,547.95 MB
273,awesome-copilot,23815,2717,23815,28,11/06/2025,06/03/2026,6.93 MB,"Community-contributed instructions, prompts, and configurations to help you make the most of GitHub Copilot.",Python,https://github.com/github/awesome-copilot,6.93 MB
274,minGPT,23812,3142,23812,81,17/08/2020,15/08/2024,1.45 MB,A minimal PyTorch re-implementation of the OpenAI GPT (Generative Pretrained Transformer) training,Python,https://github.com/karpathy/minGPT,1.45 MB
275,examples,23765,9797,23765,247,24/08/2016,01/09/2025,41.75 MB,"A set of examples around pytorch in Vision, Text, Reinforcement Learning, etc.",Python,https://github.com/pytorch/examples,41.75 MB
276,loguru,23665,768,23665,249,15/08/2017,22/02/2026,2.37 MB,Python logging made (stupidly) simple,Python,https://github.com/Delgan/loguru,2.37 MB
277,VibeVoice,23619,2613,23619,105,25/08/2025,28/02/2026,174.58 MB,Open-Source Frontier Voice AI,Python,https://github.com/microsoft/VibeVoice,174.58 MB
278,pytorch_geometric,23527,3956,23527,1253,06/10/2017,02/03/2026,24.15 MB,Graph Neural Network Library for PyTorch,Python,https://github.com/pyg-team/pytorch_geometric,24.15 MB
279,fastmcp,23434,1795,23434,226,30/11/2024,04/03/2026,37.05 MB,"🚀 The fast, Pythonic way to build MCP servers and clients.",Python,https://github.com/PrefectHQ/fastmcp,37.05 MB
280,pandas-ai,23301,2290,23301,21,22/04/2023,28/10/2025,56.09 MB,"Chat with your database or your datalake (SQL, CSV, parquet). PandasAI makes data analysis conversational using LLMs and RAG.",Python,https://github.com/sinaptik-ai/pandas-ai,56.09 MB
281,graphiti,23301,2304,23301,300,08/08/2024,04/03/2026,13.20 MB,Build Real-Time Knowledge Graphs for AI Agents,Python,https://github.com/getzep/graphiti,13.20 MB
282,algo,23194,7026,23194,157,24/09/2018,21/08/2024,1.15 MB,数据结构和算法必知必会的50个代码实现,Python,https://github.com/wangzheng0822/algo,1.15 MB
283,proxy_pool,23190,5381,23190,301,25/11/2016,20/11/2025,594.00 KB,Python ProxyPool for web spider,Python,https://github.com/jhao104/proxy_pool,594.00 KB
284,chatterbox,23068,3049,23068,312,23/04/2025,05/03/2026,1.49 MB,SoTA open-source TTS,Python,https://github.com/resemble-ai/chatterbox,1.49 MB
285,NLP-progress,22978,3611,22978,40,22/06/2018,28/07/2024,1.37 MB,"Repository to track the progress in Natural Language Processing (NLP), including the datasets and the current state-of-the-art for the most common NLP tasks.",Python,https://github.com/sebastianruder/NLP-progress,1.37 MB
286,chinese-independent-blogs,22932,2634,22932,24,22/10/2019,28/02/2026,9.88 MB,中文独立博客列表,Python,https://github.com/timqian/chinese-independent-blogs,9.88 MB
287,vanna,22874,2221,22874,278,13/05/2023,02/02/2026,8.40 MB,🤖 Chat with your SQL database 📊. Accurate Text-to-SQL Generation via LLMs using Agentic Retrieval 🔄.,Python,https://github.com/vanna-ai/vanna,8.40 MB
288,DeepSeek-Coder,22873,2740,22873,151,20/10/2023,11/11/2025,12.40 MB,DeepSeek Coder: Let the Code Write Itself,Python,https://github.com/deepseek-ai/DeepSeek-Coder,12.40 MB
289,Scrapegraph-ai,22861,1995,22861,2,27/01/2024,24/02/2026,16.50 MB,Python scraper based on AI,Python,https://github.com/ScrapeGraphAI/Scrapegraph-ai,16.50 MB
290,iptv-api,22841,7258,22841,0,04/02/2024,05/03/2026,1.24 GB,⚡️IPTV直播源自动更新平台『🤖全自动采集、筛选、测速、生成🚀』：自定义获取频道；IPv4/IPv6；接口验效；推流；多平台支持；工作流、Docker、命令行、GUI多端部署 | IPTV live streaming source automatic update platform,Python,https://github.com/Guovin/iptv-api,1.24 GB
