Ranking,Project Name,Stars,Forks,Watchers,Open Issues,Created At,Last Commit,Size,Description,Language,Repo URL,Size
655,External-Attention-pytorch,12164,1957,12164,70,08/05/2021,06/12/2024,5.56 MB,"🍀 Pytorch implementation of various Attention Mechanisms, MLP, Re-parameter, Convolution, which is helpful to further understand papers.⭐⭐⭐",Python,https://github.com/xmu-xiaoma666/External-Attention-pytorch,5.56 MB
656,open-source-games,12163,959,12163,17,15/09/2021,25/02/2026,94.00 KB,A list of open source games.,Python,https://github.com/bobeff/open-source-games,94.00 KB
657,gdb-dashboard,12147,818,12147,19,09/09/2015,06/11/2025,376.00 KB,Modular visual interface for GDB in Python,Python,https://github.com/cyrus-and/gdb-dashboard,376.00 KB
658,OpenLLM,12145,800,12145,11,19/04/2023,02/03/2026,41.80 MB,"Run any open-source LLMs, such as DeepSeek and Llama, as OpenAI compatible API endpoint in the cloud.",Python,https://github.com/bentoml/OpenLLM,41.80 MB
659,Open-Sora-Plan,12134,1063,12134,267,20/02/2024,29/10/2025,13.09 MB,"This project aim to reproduce Sora (Open AI T2V model), we wish the open source community contribute to this project.",Python,https://github.com/PKU-YuanGroup/Open-Sora-Plan,13.09 MB
660,PocketFlow-Tutorial-Codebase-Knowledge,12112,1385,12112,63,02/04/2025,24/10/2025,11.57 MB,Pocket Flow: Codebase to Tutorial,Python,https://github.com/The-Pocket/PocketFlow-Tutorial-Codebase-Knowledge,11.57 MB
661,LLMSurvey,12111,936,12111,26,14/03/2023,11/03/2025,44.17 MB,"The official GitHub page for the survey paper ""A Survey of Large Language Models"".",Python,https://github.com/RUCAIBox/LLMSurvey,44.17 MB
662,MOSS,12097,1134,12097,241,15/04/2023,13/07/2024,39.00 MB,An open-source tool-augmented conversational language model from Fudan University,Python,https://github.com/OpenMOSS/MOSS,39.00 MB
663,scapy,12087,2194,12087,131,01/10/2015,04/03/2026,86.70 MB,Scapy: the Python-based interactive packet manipulation program & library.,Python,https://github.com/secdev/scapy,86.70 MB
664,pix2code,12053,1440,12053,9,24/05/2017,29/05/2024,1.18 GB,pix2code: Generating Code from a Graphical User Interface Screenshot,Python,https://github.com/tonybeltramelli/pix2code,1.18 GB
665,kohya_ss,12045,1565,12045,579,30/10/2022,01/02/2026,23.88 MB,,Python,https://github.com/bmaltais/kohya_ss,23.88 MB
666,AnimateDiff,12044,1053,12044,317,17/06/2023,31/07/2024,60.36 MB,Official implementation of AnimateDiff.,Python,https://github.com/guoyww/AnimateDiff,60.36 MB
667,walle-web,12041,2773,12041,392,11/09/2015,06/01/2022,26.21 MB,walle - 瓦力 Devops开源项目代码部署平台,Python,https://github.com/meolu/walle-web,26.21 MB
668,nano-vllm,12037,1665,12037,52,09/06/2025,03/11/2025,435.00 KB,Nano vLLM,Python,https://github.com/GeeeekExplorer/nano-vllm,435.00 KB
669,agentskills,12035,687,12035,34,16/12/2025,05/03/2026,347.00 KB,Specification and documentation for Agent Skills,Python,https://github.com/agentskills/agentskills,347.00 KB
670,synapse,12014,2117,12014,1525,11/08/2014,26/04/2024,419.43 MB,Synapse: Matrix homeserver written in Python/Twisted.,Python,https://github.com/matrix-org/synapse,419.43 MB
671,h2ogpt,12012,1314,12012,329,24/03/2023,09/10/2025,53.41 MB,"Private chat with local GPT with document, images, video, etc. 100% private, Apache 2.0. Supports oLLaMa, Mixtral, llama.cpp, and more. Demo: https://gpt.h2o.ai/ https://gpt-docs.h2o.ai/",Python,https://github.com/h2oai/h2ogpt,53.41 MB
672,starlette,11996,1128,11996,46,25/06/2018,05/03/2026,7.45 MB,The little ASGI framework that shines. 🌟,Python,https://github.com/Kludex/starlette,7.45 MB
673,english-words,11959,2007,11959,132,13/07/2014,06/01/2025,27.59 MB,:memo: A text file containing 479k English words for all your dictionary/word-based projects e.g: auto-completion / autosuggestion,Python,https://github.com/dwyl/english-words,27.59 MB
674,peewee,11951,1388,11951,0,11/10/2010,05/03/2026,15.93 MB,"a small, expressive orm -- supports postgresql, mysql, sqlite and cockroachdb",Python,https://github.com/coleifer/peewee,15.93 MB
675,TRELLIS,11929,1119,11929,247,02/12/2024,05/11/2025,1.07 GB,"Official repo for paper ""Structured 3D Latents for Scalable and Versatile 3D Generation"" (CVPR'25 Spotlight).",Python,https://github.com/microsoft/TRELLIS,1.07 GB
676,InstantID,11924,878,11924,181,11/12/2023,18/07/2024,154.96 MB,InstantID: Zero-shot Identity-Preserving Generation in Seconds 🔥,Python,https://github.com/instantX-research/InstantID,154.96 MB
677,PentestGPT,11922,2021,11922,50,27/02/2023,23/02/2026,33.97 MB,Automated Penetration Testing Agentic Framework Powered by Large Language Models,Python,https://github.com/GreyDGL/PentestGPT,33.97 MB
678,DiffSynth-Studio,11914,1157,11914,471,07/12/2023,04/03/2026,16.37 MB,Enjoy the magic of Diffusion models!,Python,https://github.com/modelscope/DiffSynth-Studio,16.37 MB
679,fsociety,11908,2107,11908,91,01/09/2016,08/08/2024,536.00 KB,fsociety Hacking Tools Pack – A Penetration Testing Framework,Python,https://github.com/Manisso/fsociety,536.00 KB
680,allennlp,11891,2228,11891,91,15/05/2017,22/11/2022,72.96 MB,"An open-source NLP research library, built on PyTorch.",Python,https://github.com/allenai/allennlp,72.96 MB
681,neural-enhance,11881,1367,11881,153,01/10/2016,29/12/2020,3.28 MB,Super Resolution for images using deep learning.,Python,https://github.com/alexjc/neural-enhance,3.28 MB
682,mycli,11880,683,11880,15,05/04/2015,05/03/2026,3.54 MB,A Terminal Client for MySQL with AutoCompletion and Syntax Highlighting.,Python,https://github.com/dbcli/mycli,3.54 MB
683,Telethon,11859,1616,11859,0,26/08/2016,21/02/2026,9.63 MB,"Pure Python 3 MTProto API Telegram client library, for bots too!",Python,https://github.com/LonamiWebs/Telethon,9.63 MB
684,shell_gpt,11853,948,11853,111,18/01/2023,28/01/2026,325.00 KB,"A command-line productivity tool powered by AI large language models like GPT-5, will help you accomplish your tasks faster and more efficiently.",Python,https://github.com/TheR1D/shell_gpt,325.00 KB
685,Zappa,11851,1181,11851,686,20/01/2016,23/03/2023,5.51 MB,Serverless Python,Python,https://github.com/Miserlou/Zappa,5.51 MB
686,git-filter-repo,11850,926,11850,93,21/08/2018,01/03/2026,7.38 MB,Quickly rewrite git repository history (filter-branch replacement),Python,https://github.com/newren/git-filter-repo,7.38 MB
687,HunyuanVideo,11801,1196,11801,171,28/11/2024,21/11/2025,106.77 MB,HunyuanVideo: A Systematic Framework For Large Video Generation Model,Python,https://github.com/Tencent-Hunyuan/HunyuanVideo,106.77 MB
688,stock,11769,2427,11769,3,21/03/2023,05/02/2026,27.06 MB,"stock股票.获取股票数据,计算股票指标,筹码分布,识别股票形态,综合选股,选股策略,股票验证回测,股票自动交易,支持PC及移动设备。",Python,https://github.com/myhhub/stock,27.06 MB
689,instaloader,11701,1454,11701,77,15/06/2016,18/01/2026,1.81 MB,Download pictures (or videos) along with their captions and other metadata from Instagram.,Python,https://github.com/instaloader/instaloader,1.81 MB
690,chainlit,11682,1661,11682,109,14/03/2023,05/03/2026,10.46 MB,Build Conversational AI in minutes ⚡️,Python,https://github.com/Chainlit/chainlit,10.46 MB
691,icloud_photos_downloader,11680,765,11680,153,13/05/2016,06/01/2026,45.75 MB,A command-line tool to download photos from iCloud,Python,https://github.com/icloud-photos-downloader/icloud_photos_downloader,45.75 MB
692,sqlalchemy,11665,1650,11665,214,27/11/2018,05/03/2026,97.94 MB,The Database Toolkit for Python,Python,https://github.com/sqlalchemy/sqlalchemy,97.94 MB
693,ludwig,11653,1212,11653,1,27/12/2018,02/03/2026,29.70 MB,"Low-code framework for building custom LLMs, neural networks, and other AI models",Python,https://github.com/ludwig-ai/ludwig,29.70 MB
694,Time-Series-Library,11650,1856,11650,34,13/02/2023,23/02/2026,78.40 MB,A Library for Advanced Deep Time Series Models for General Time Series Analysis.,Python,https://github.com/thuml/Time-Series-Library,78.40 MB
695,maptoposter,11637,1017,11637,41,08/01/2026,04/03/2026,312.43 MB,"Transform your favorite cities into beautiful, minimalist designs. MapToPoster lets you create and export visually striking map posters with code.",Python,https://github.com/originalankur/maptoposter,312.43 MB
696,spinningup,11627,2438,11627,252,07/11/2018,05/08/2024,31.02 MB,An educational resource to help anyone learn deep reinforcement learning.,Python,https://github.com/openai/spinningup,31.02 MB
697,fastapi_mcp,11619,920,11619,122,08/03/2025,24/11/2025,423.00 KB,"Expose your FastAPI endpoints as Model Context Protocol (MCP) tools, with Auth!",Python,https://github.com/tadata-org/fastapi_mcp,423.00 KB
698,mealie,11604,1156,11604,185,07/12/2020,05/03/2026,420.41 MB,Mealie is a self hosted recipe manager and meal planner with a RestAPI backend and a reactive frontend application built in Vue for a pleasant user experience for the whole family. Easily add recipes into your database by providing the url and mealie will automatically import the relevant data or add a family recipe with the UI editor,Python,https://github.com/mealie-recipes/mealie,420.41 MB
699,Statistical-Learning-Method_Code,11590,2897,11590,22,15/11/2018,25/11/2025,97.91 MB,手写实现李航《统计学习方法》书中全部算法,Python,https://github.com/Dod-o/Statistical-Learning-Method_Code,97.91 MB
700,lm-evaluation-harness,11577,3074,11577,752,28/08/2020,05/03/2026,34.23 MB,A framework for few-shot evaluation of language models.,Python,https://github.com/EleutherAI/lm-evaluation-harness,34.23 MB
701,AI-Trader,11543,1949,11543,47,23/10/2025,05/03/2026,13.18 MB,"""AI-Trader: Can AI Beat the Market?""  Live Trading Bench: https://ai4trade.ai Tech Report Link: https://arxiv.org/abs/2512.10971",Python,https://github.com/HKUDS/AI-Trader,13.18 MB
702,RD-Agent,11516,1327,11516,138,03/04/2024,05/03/2026,63.58 MB,"Research and development (R&D) is crucial for the enhancement of industrial productivity, especially in the AI era, where the core aspects of R&D are mainly focused on data and models. We are committed to automating these high-value generic R&D processes through R&D-Agent, which lets AI drive data-driven AI. 🔗https://aka.ms/RD-Agent-Tech-Report",Python,https://github.com/microsoft/RD-Agent,63.58 MB
703,awesome-chatgpt-zh,11507,945,11507,0,21/03/2023,05/11/2024,68.11 MB,ChatGPT 中文指南🔥，ChatGPT 中文调教指南，指令指南，应用开发指南，精选资源清单，更好的使用 chatGPT 让你的生产力 up up up! 🚀,Python,https://github.com/EmbraceAGI/awesome-chatgpt-zh,68.11 MB
704,chinese-xinhua,11495,2656,11495,39,05/02/2018,26/12/2023,35.42 MB,:orange_book: 中华新华字典数据库。包括歇后语，成语，词语，汉字。,Python,https://github.com/pwxcoo/chinese-xinhua,35.42 MB
705,jinja,11495,1707,11495,95,17/10/2010,14/06/2025,6.77 MB,A very fast and expressive template engine.,Python,https://github.com/pallets/jinja,6.77 MB
706,keep,11490,1229,11490,523,04/02/2023,05/03/2026,87.07 MB,The open-source AIOps and alert management platform,Python,https://github.com/keephq/keep,87.07 MB
707,DrissionPage,11485,1079,11485,272,21/05/2020,20/01/2026,3.66 MB,Python based web automation tool. Powerful and elegant.,Python,https://github.com/g1879/DrissionPage,3.66 MB
708,posting,11481,222,11481,79,26/05/2024,14/10/2025,22.54 MB,The modern API client that lives in your terminal.,Python,https://github.com/darrenburns/posting,22.54 MB
709,robotframework,11448,2533,11448,282,27/06/2014,03/03/2026,168.91 MB,Generic automation framework for acceptance testing and RPA,Python,https://github.com/robotframework/robotframework,168.91 MB
710,Gymnasium,11447,1289,11447,84,08/09/2022,04/03/2026,353.82 MB,"An API standard for single-agent reinforcement learning environments, with popular reference environments and related utilities (formerly Gym)",Python,https://github.com/Farama-Foundation/Gymnasium,353.82 MB
711,deep_learning_object_detection,11424,2767,11424,5,18/09/2018,12/02/2024,785.00 KB,A paper list of object detection using deep learning.,Python,https://github.com/hoya012/deep_learning_object_detection,785.00 KB
712,axolotl,11400,1265,11400,212,14/04/2023,06/03/2026,29.25 MB,Go ahead and axolotl questions,Python,https://github.com/axolotl-ai-cloud/axolotl,29.25 MB
713,whoogle-search,11390,1037,11390,10,21/01/2020,11/02/2026,2.80 MB,"A self-hosted, ad-free, privacy-respecting metasearch engine",Python,https://github.com/benbusby/whoogle-search,2.80 MB
714,segmentation_models.pytorch,11375,1832,11375,90,01/03/2019,23/12/2025,17.12 MB,Semantic segmentation models with 500+ pretrained convolutional and transformer-based backbones.,Python,https://github.com/qubvel-org/segmentation_models.pytorch,17.12 MB
715,FlagEmbedding,11358,840,11358,898,02/08/2023,15/12/2025,51.41 MB,Retrieval and Retrieval-augmented LLMs,Python,https://github.com/FlagOpen/FlagEmbedding,51.41 MB
716,cleanlab,11355,879,11355,100,11/05/2018,13/01/2026,17.79 MB,"Cleanlab's open-source library is the standard data-centric AI package for data quality and machine learning with messy, real-world data and labels.",Python,https://github.com/cleanlab/cleanlab,17.79 MB
717,qutebrowser,11333,1094,11333,1302,26/06/2014,02/03/2026,62.71 MB,"A keyboard-driven, vim-like browser based on Python and Qt.",Python,https://github.com/qutebrowser/qutebrowser,62.71 MB
718,streamlink,11317,1171,11317,69,16/09/2016,05/03/2026,40.61 MB,Streamlink is a CLI utility which pipes video streams from various services into a video player,Python,https://github.com/streamlink/streamlink,40.61 MB
719,speechbrain,11284,1663,11284,173,28/04/2020,01/03/2026,101.87 MB,A PyTorch-based Speech Toolkit,Python,https://github.com/speechbrain/speechbrain,101.87 MB
720,statsmodels,11283,3323,11283,2968,12/06/2011,03/03/2026,58.44 MB,Statsmodels: statistical modeling and econometrics in Python,Python,https://github.com/statsmodels/statsmodels,58.44 MB
721,llm,11276,760,11276,564,01/04/2023,06/03/2026,1.30 MB,Access large language models from the command-line,Python,https://github.com/simonw/llm,1.30 MB
722,nerfstudio,11266,1582,11266,932,31/05/2022,29/07/2025,119.14 MB,A collaboration friendly studio for NeRFs,Python,https://github.com/nerfstudio-project/nerfstudio,119.14 MB
723,PythonPark,11255,1683,11255,3,29/04/2020,26/11/2024,2.82 MB,Python 开源项目之「自学编程之路」，保姆级教程：AI实验室、宝藏视频、数据结构、学习指南、机器学习实战、深度学习实战、网络爬虫、大厂面经、程序人生、资源分享。,Python,https://github.com/Jack-Cherish/PythonPark,2.82 MB
724,Pytorch-UNet,11233,2726,11233,124,16/08/2017,11/08/2024,47.40 MB,PyTorch implementation of the U-Net for image semantic segmentation with high quality images,Python,https://github.com/milesial/Pytorch-UNet,47.40 MB
725,yolov10,11228,1176,11228,288,23/05/2024,14/03/2025,11.11 MB,YOLOv10: Real-Time End-to-End Object Detection [NeurIPS 2024] ,Python,https://github.com/THU-MIG/yolov10,11.11 MB
726,great_expectations,11215,1688,11215,61,11/09/2017,06/03/2026,240.77 MB,Always know what to expect from your data.,Python,https://github.com/great-expectations/great_expectations,240.77 MB
727,scientific-visualization-book,11213,1014,11213,18,16/08/2019,04/01/2026,282.90 MB,An open access book on scientific visualization using python and matplotlib,Python,https://github.com/rougier/scientific-visualization-book,282.90 MB
728,KittenTTS,11201,627,11201,86,05/08/2025,24/02/2026,52.00 KB, State-of-the-art TTS model under 25MB 😻 ,Python,https://github.com/KittenML/KittenTTS,52.00 KB
729,pal-mcp-server,11200,956,11200,112,08/06/2025,15/12/2025,4.00 MB,The power of Claude Code / GeminiCLI / CodexCLI + [Gemini / OpenAI / OpenRouter / Azure / Grok / Ollama / Custom Model / All Of The Above] working as one.,Python,https://github.com/BeehiveInnovations/pal-mcp-server,4.00 MB
730,stylegan2,11186,2516,11186,26,26/11/2019,18/05/2024,594.00 KB,StyleGAN2 - Official TensorFlow Implementation,Python,https://github.com/NVlabs/stylegan2,594.00 KB
731,FastPhotoStyle,11176,1193,11176,57,14/02/2018,07/06/2023,50.73 MB,"Style transfer, deep learning, feature transform",Python,https://github.com/NVIDIA/FastPhotoStyle,50.73 MB
732,claude-engineer,11167,1154,11167,28,24/06/2024,12/12/2024,1.28 MB,"Claude Engineer is an interactive command-line interface (CLI) that leverages the power of Anthropic's Claude-3.5-Sonnet model to assist with software development tasks.This framework enables Claude to generate and manage its own tools, continuously expanding its capabilities through conversation. Available both as a CLI and a modern web interface",Python,https://github.com/Doriandarko/claude-engineer,1.28 MB
733,tweepy,11134,4578,11134,102,06/07/2009,11/07/2025,13.71 MB,Twitter for Python!,Python,https://github.com/tweepy/tweepy,13.71 MB
734,kornia,11106,1149,11106,78,22/08/2018,05/03/2026,80.54 MB,🐍 Geometric Computer Vision Library for Spatial AI,Python,https://github.com/kornia/kornia,80.54 MB
735,psutil,11103,1464,11103,363,23/05/2014,06/03/2026,37.54 MB,Cross-platform lib for process and system monitoring in Python,Python,https://github.com/giampaolo/psutil,37.54 MB
736,faceai,11068,2505,11068,38,17/04/2018,16/04/2020,39.52 MB,一款入门级的人脸、视频、文字检测以及识别的项目.,Python,https://github.com/vipstone/faceai,39.52 MB
737,chalice,11058,1003,11058,494,27/05/2016,29/05/2025,9.58 MB,Python Serverless Microframework for AWS,Python,https://github.com/aws/chalice,9.58 MB
738,skills,11051,619,11051,109,25/11/2025,06/03/2026,1.67 MB,Skills Catalog for Codex,Python,https://github.com/openai/skills,1.67 MB
739,promptflow,11042,1060,11042,62,30/06/2023,02/03/2026,169.38 MB,"Build high-quality LLM apps - from prototyping, testing to production deployment and monitoring.",Python,https://github.com/microsoft/promptflow,169.38 MB
740,awesome-django,11013,1446,11013,0,11/04/2018,04/03/2026,1.25 MB,A curated list of awesome things related to Django,Python,https://github.com/wsvincent/awesome-django,1.25 MB
741,fast-style-transfer,10977,2574,10977,112,21/07/2016,16/07/2023,11.02 MB,TensorFlow CNN for fast style transfer ⚡🖥🎨🖼,Python,https://github.com/lengstrom/fast-style-transfer,11.02 MB
742,ffmpeg-python,10961,935,10961,525,14/05/2017,04/08/2024,4.22 MB,Python bindings for FFmpeg - with complex filtering support,Python,https://github.com/kkroening/ffmpeg-python,4.22 MB
743,MLAlgorithms,10955,1763,10955,10,05/10/2016,15/06/2025,11.66 MB,Minimal and clean examples of machine learning algorithms implementations,Python,https://github.com/rushter/MLAlgorithms,11.66 MB
744,trae-agent,10948,1173,10948,106,13/06/2025,05/02/2026,3.00 MB,Trae Agent is an LLM-based agent for general purpose software engineering tasks.,Python,https://github.com/bytedance/trae-agent,3.00 MB
745,Spark-TTS,10945,1169,10945,201,25/02/2025,09/04/2025,7.03 MB,Spark-TTS Inference Code,Python,https://github.com/SparkAudio/Spark-TTS,7.03 MB
746,Kronos,10944,2297,10944,133,01/07/2025,02/01/2026,6.16 MB,Kronos: A Foundation Model for the Language of Financial Markets,Python,https://github.com/shiyu-coder/Kronos,6.16 MB
747,numba,10926,1232,10926,1749,08/03/2012,05/03/2026,78.61 MB,NumPy aware dynamic Python compiler using LLVM,Python,https://github.com/numba/numba,78.61 MB
748,waydroid,10921,449,10921,850,16/04/2021,01/03/2026,804.00 KB,Waydroid uses a container-based approach to boot a full Android system on a regular GNU/Linux system like Ubuntu.,Python,https://github.com/waydroid/waydroid,804.00 KB
749,magic-animate,10908,1097,10908,109,21/11/2023,29/08/2025,24.85 MB,"[CVPR 2024] Official repository for ""MagicAnimate: Temporally Consistent Human Image Animation using Diffusion Model""",Python,https://github.com/magic-research/magic-animate,24.85 MB
750,wandb,10884,829,10884,836,24/03/2017,06/03/2026,198.59 MB,"The AI developer platform. Use Weights & Biases to train and fine-tune models, and manage models from experimentation to production.",Python,https://github.com/wandb/wandb,198.59 MB
751,DALL-E,10874,1889,10874,75,23/02/2021,31/01/2024,7.00 KB,PyTorch package for the discrete VAE used for DALL·E.,Python,https://github.com/openai/DALL-E,7.00 KB
752,bpytop,10873,428,10873,98,01/07/2020,01/06/2025,947.00 KB,Linux/OSX/FreeBSD resource monitor,Python,https://github.com/aristocratos/bpytop,947.00 KB
753,chia-blockchain,10853,2059,10853,381,16/07/2019,05/03/2026,154.00 MB,"Chia blockchain python implementation (full node, farmer, harvester, timelord, and wallet)",Python,https://github.com/Chia-Network/chia-blockchain,154.00 MB
754,Sublist3r,10844,2206,10844,249,15/12/2015,02/08/2024,1.12 MB,Fast subdomains enumeration tool for penetration testers,Python,https://github.com/aboul3la/Sublist3r,1.12 MB
755,howdoi,10825,866,10825,28,22/11/2012,22/10/2024,27.07 MB,instant coding answers via the command line,Python,https://github.com/gleitz/howdoi,27.07 MB
756,cupy,10819,995,10819,650,01/11/2016,05/03/2026,45.95 MB,NumPy & SciPy for GPU,Python,https://github.com/cupy/cupy,45.95 MB
757,datasette,10806,813,10806,656,23/10/2017,26/02/2026,8.00 MB,An open source multi-tool for exploring and publishing data,Python,https://github.com/simonw/datasette,8.00 MB
758,dolly,10804,1145,10804,5,24/03/2023,30/06/2023,99.00 KB,"Databricks’ Dolly, a large language model trained on the Databricks Machine Learning Platform",Python,https://github.com/databrickslabs/dolly,99.00 KB
759,text-generation-inference,10794,1256,10794,325,08/10/2022,08/01/2026,13.87 MB,Large Language Model Text Generation Inference,Python,https://github.com/huggingface/text-generation-inference,13.87 MB
760,kedro,10775,1011,10775,200,18/04/2019,05/03/2026,240.69 MB,"Kedro is a toolbox for production-ready data science. It uses software engineering best practices to help you create data engineering and data science pipelines that are reproducible, maintainable, and modular.",Python,https://github.com/kedro-org/kedro,240.69 MB
761,amazing-qr,10771,1575,10771,70,25/08/2016,01/12/2023,8.00 MB,💮 amazing QRCode generator in Python (supporting animated gif) - Python amazing 二维码生成器（支持 gif 动态图片二维码）,Python,https://github.com/x-hw/amazing-qr,8.00 MB
762,open_deep_research,10714,1556,10714,50,20/11/2024,26/02/2026,6.39 MB,,Python,https://github.com/langchain-ai/open_deep_research,6.39 MB
763,LaZagne,10700,2121,10700,13,16/02/2015,18/09/2025,3.33 MB,Credentials recovery project,Python,https://github.com/AlessandroZ/LaZagne,3.33 MB
764,StreamDiffusion,10672,828,10672,112,28/11/2023,04/12/2024,121.66 MB,StreamDiffusion: A Pipeline-Level Solution for Real-Time Interactive Generation,Python,https://github.com/cumulo-autumn/StreamDiffusion,121.66 MB
765,django-cms,10640,3195,10640,13,05/03/2009,05/03/2026,113.57 MB,The easy-to-use and developer-friendly enterprise CMS powered by Django ,Python,https://github.com/django-cms/django-cms,113.57 MB
766,ParlAI,10629,2079,10629,51,24/04/2017,03/11/2023,145.77 MB,A framework for training and evaluating AI models on a variety of openly available dialogue datasets.,Python,https://github.com/facebookresearch/ParlAI,145.77 MB
767,MoviePilot,10621,1319,10621,384,31/05/2023,05/03/2026,52.98 MB,NAS媒体库自动化管理工具,Python,https://github.com/jxxghp/MoviePilot,52.98 MB
768,practical-python,10615,7131,10615,1,24/05/2020,22/12/2025,478.00 KB,Practical Python Programming (course by @dabeaz),Python,https://github.com/dabeaz-course/practical-python,478.00 KB
769,rq,10592,1459,10592,241,14/11/2011,03/03/2026,4.20 MB,Simple job queues for Python,Python,https://github.com/rq/rq,4.20 MB
770,pipecat,10583,1787,10583,313,27/12/2023,06/03/2026,132.33 MB,Open Source framework for voice and multimodal conversational AI,Python,https://github.com/pipecat-ai/pipecat,132.33 MB
771,DeepTutor,10570,1409,10570,31,28/12/2025,06/03/2026,62.59 MB,"""DeepTutor: AI-Powered Personalized Learning Assistant""",Python,https://github.com/HKUDS/DeepTutor,62.59 MB
772,eeeeeeeeeeeeeeeeeeeeeeeeeeeeeeeeeeeeeeeeeeeeeeeeeeeeeeeeeeeeeeeeeeeeeeeeeeeeeeeeeeeeeeeeeeeeeeeeeeee,10566,695,10566,220,08/11/2018,02/07/2019,1.21 MB,eeeeeeeeeeeeeeeeeeeeeeeeeeeeeeeeeeeeeeeeeeeeeeeeeeeeeeeeeeeeeeeeeeeee,Python,https://github.com/eeeeeeeeeeeeeeeeeeeeeeeeeeeeeeee/eeeeeeeeeeeeeeeeeeeeeeeeeeeeeeeeeeeeeeeeeeeeeeeeeeeeeeeeeeeeeeeeeeeeeeeeeeeeeeeeeeeeeeeeeeeeeeeeeeee,1.21 MB
773,doccano,10564,1834,10564,384,09/05/2018,04/03/2026,56.33 MB,Open source annotation tool for machine learning practitioners.,Python,https://github.com/doccano/doccano,56.33 MB
774,yolov3,10563,3448,10563,5,26/08/2018,20/02/2026,10.96 MB,YOLOv3 in PyTorch > ONNX > CoreML > TFLite,Python,https://github.com/ultralytics/yolov3,10.96 MB
775,the-algorithm-ml,10547,2243,10547,53,27/03/2023,10/07/2024,109.00 KB,Source code for Twitter's Recommendation Algorithm,Python,https://github.com/twitter/the-algorithm-ml,109.00 KB
776,node-gyp,10540,1868,10540,159,03/02/2012,02/03/2026,6.05 MB,Node.js native addon build tool,Python,https://github.com/nodejs/node-gyp,6.05 MB
777,Python,10539,4270,10539,118,23/06/2016,10/10/2023,6.84 MB,Python脚本。模拟登录知乎， 爬虫，操作excel，微信公众号，远程开机,Python,https://github.com/injetlee/Python,6.84 MB
778,word_cloud,10518,2331,10518,138,04/11/2012,22/01/2026,116.98 MB,A little word cloud generator in Python,Python,https://github.com/amueller/word_cloud,116.98 MB
779,aws-devops-zero-to-hero,10512,14351,10512,108,19/06/2023,14/07/2025,214.00 KB,"AWS zero to hero repo for devops engineers to learn AWS in 30 Days. This repo includes projects, presentations, interview questions and real time examples.",Python,https://github.com/iam-veeramalla/aws-devops-zero-to-hero,214.00 KB
