Ranking,Project Name,Stars,Forks,Watchers,Open Issues,Created At,Last Commit,Size,Description,Language,Repo URL,Size
717,manageiq,1393,922,1393,331,13/06/2014,12/03/2026,410.20 MB,ManageIQ Open-Source Management Platform,Ruby,https://github.com/ManageIQ/manageiq,410.20 MB
718,settingslogic,1392,187,1392,42,31/10/2008,23/04/2024,529.00 KB,A simple and straightforward settings solution that uses an ERB enabled YAML file and a singleton design pattern.,Ruby,https://github.com/binarylogic/settingslogic,529.00 KB
719,searchlogic,1391,134,1391,114,25/08/2008,19/07/2022,6.46 MB,"Searchlogic provides object based searching, common named scopes, and other useful tools.",Ruby,https://github.com/binarylogic/searchlogic,6.46 MB
720,onebody,1390,282,1390,12,23/02/2008,29/01/2021,29.73 MB,"private member portal for churches, built with Ruby on Rails",Ruby,https://github.com/seven1m/onebody,29.73 MB
721,review,1389,218,1389,95,16/01/2010,11/03/2026,45.02 MB,Re:VIEW is flexible document format/conversion system,Ruby,https://github.com/kmuto/review,45.02 MB
722,render_sync,1387,105,1387,39,06/04/2013,25/05/2019,367.00 KB,Real-time Rails Partials,Ruby,https://github.com/chrismccord/render_sync,367.00 KB
723,docker,1386,785,1386,13,11/05/2013,03/03/2026,5.10 MB,Development repository for the docker cookbook,Ruby,https://github.com/sous-chefs/docker,5.10 MB
724,spork,1385,200,1385,112,20/05/2009,26/04/2018,1.90 MB,A DRb server for testing frameworks (RSpec / Cucumber currently) that forks before each run to ensure a clean testing state.,Ruby,https://github.com/sporkrb/spork,1.90 MB
725,ohm,1385,164,1385,12,26/05/2009,20/12/2022,1.13 MB,Object-Hash Mapping for Redis,Ruby,https://github.com/soveran/ohm,1.13 MB
726,bodyapps-web,1379,10,1379,17,23/05/2014,29/11/2017,8.73 MB,Web service and web application components of #bodyapps project,Ruby,https://github.com/OpnTec/bodyapps-web,8.73 MB
727,twilio-ruby,1378,470,1378,41,15/09/2009,10/03/2026,20.18 MB,A Ruby gem for communicating with the Twilio API and generating TwiML,Ruby,https://github.com/twilio/twilio-ruby,20.18 MB
728,fastimage,1378,117,1378,0,10/06/2009,10/03/2026,25.06 MB,FastImage finds the size or type of an image given its uri by fetching as little as needed,Ruby,https://github.com/sdsykes/fastimage,25.06 MB
729,obtvse,1377,254,1377,20,23/03/2012,19/10/2022,5.34 MB,Deprecated: See natew/obtvse2,Ruby,https://github.com/natew/obtvse,5.34 MB
730,brimir,1373,293,1373,0,23/11/2012,22/12/2018,2.55 MB,Email helpdesk built using Ruby on Rails and Zurb Foundation,Ruby,https://github.com/ivaldi/brimir,2.55 MB
731,classroom,1371,569,1371,224,05/05/2015,12/03/2020,165.73 MB,"GitHub Classroom automates repository creation and access control, making it easy for teachers to distribute starter code and collect assignments on GitHub.",Ruby,https://github.com/github-education-resources/classroom,165.73 MB
732,treat,1369,124,1369,35,24/01/2012,16/05/2025,4.84 MB,Natural language processing framework for Ruby.,Ruby,https://github.com/louismullie/treat,4.84 MB
733,homebrew-autoupdate,1366,66,1366,12,22/04/2015,25/02/2026,512.00 KB,":tropical_drink: An easy, convenient way to automatically update Homebrew.",Ruby,https://github.com/DomT4/homebrew-autoupdate,512.00 KB
734,json_resume,1365,116,1365,9,24/01/2014,18/06/2018,2.36 MB,"Generates pretty HTML, LaTeX, markdown, with biodata feeded as input in JSON",Ruby,https://github.com/prat0318/json_resume,2.36 MB
735,rails-security-checklist,1365,94,1365,73,31/12/2016,17/07/2022,39.00 KB,:key: Community-driven Rails Security Checklist (see our GitHub Issues for the newest checks that aren't yet in the README),Ruby,https://github.com/eliotsykes/rails-security-checklist,39.00 KB
736,griddler,1364,198,1364,0,26/10/2012,12/07/2024,592.00 KB,Simplify receiving email in Rails (deprecated),Ruby,https://github.com/thoughtbot/griddler,592.00 KB
737,pry-rails,1363,89,1363,28,27/08/2011,20/06/2024,132.00 KB,Rails >= 3 pry initializer,Ruby,https://github.com/pry/pry-rails,132.00 KB
738,www,1362,519,1362,61,21/01/2013,12/03/2026,449.97 MB,The main website for Write the Docs. ,Ruby,https://github.com/writethedocs/www,449.97 MB
739,lamernews,1359,201,1359,46,15/10/2011,27/05/2022,330.00 KB,Lamer News -- an HN style social news site written in Ruby/Sinatra/Redis/JQuery,Ruby,https://github.com/antirez/lamernews,330.00 KB
740,XSpear,1359,243,1359,21,12/07/2019,03/03/2026,1.10 MB,🔱 Powerfull XSS Scanning and Parameter analysis tool&gem,Ruby,https://github.com/hahwul/XSpear,1.10 MB
741,legacy-cli,1359,378,1359,315,18/03/2009,12/02/2022,6.73 MB,Heroku CLI,Ruby,https://github.com/heroku/legacy-cli,6.73 MB
742,cuprite,1359,98,1359,52,17/07/2018,09/03/2026,732.00 KB,Headless Chrome/Chromium driver for Capybara,Ruby,https://github.com/rubycdp/cuprite,732.00 KB
743,hexapdf,1358,79,1358,8,11/09/2014,12/03/2026,6.26 MB,Versatile PDF creation and manipulation for Ruby,Ruby,https://github.com/gettalong/hexapdf,6.26 MB
744,wombat,1355,129,1355,24,14/11/2011,10/03/2026,2.60 MB,Lightweight Ruby web crawler/scraper with an elegant DSL which extracts structured data from pages.,Ruby,https://github.com/felipecsl/wombat,2.60 MB
745,recommendable,1354,112,1354,18,20/01/2012,24/04/2018,522.00 KB,:+1::-1: A recommendation engine using Likes and Dislikes for your Ruby app,Ruby,https://github.com/davidcelis/recommendable,522.00 KB
746,selecta,1351,81,1351,7,11/10/2013,23/01/2026,637.00 KB,"A fuzzy text selector for files and anything else you need to select. Use it from vim, from the command line, or anywhere you can run a shell command.",Ruby,https://github.com/garybernhardt/selecta,637.00 KB
747,abba,1350,71,1350,11,25/01/2013,12/08/2020,470.00 KB,A/B testing framework,Ruby,https://github.com/maccman/abba,470.00 KB
748,spreadsheet_architect,1350,41,1350,5,26/02/2016,27/12/2025,1.11 MB,"Spreadsheet Architect is a library that allows you to create XLSX, ODS, or CSV spreadsheets super easily from ActiveRecord relations, plain Ruby objects, or tabular data.",Ruby,https://github.com/westonganger/spreadsheet_architect,1.11 MB
749,ember-rails,1347,247,1347,18,03/01/2012,20/06/2018,17.93 MB,Ember for Rails 3.1+,Ruby,https://github.com/emberjs/ember-rails,17.93 MB
750,roadie,1346,82,1346,6,26/10/2010,01/10/2025,1.04 MB,Making HTML emails comfortable for the Ruby rockstars,Ruby,https://github.com/Mange/roadie,1.04 MB
751,Mars,1343,283,1343,18,21/01/2019,22/06/2020,15.35 MB,Mars(战神)——资产发现、子域名枚举、C段扫描、资产变更监测、端口变更监测、域名解析变更监测、Awvs扫描、POC检测、web指纹探测、端口指纹探测、CDN探测、操作系统指纹探测、泛解析探测、WAF探测、敏感信息检测等等,Ruby,https://github.com/TideSec/Mars,15.35 MB
752,active_hash,1341,191,1341,30,22/07/2009,24/02/2026,714.00 KB,"A readonly ActiveRecord-esque base class that lets you use a hash, a Yaml file or a custom file as the datasource",Ruby,https://github.com/active-hash/active_hash,714.00 KB
753,wechat,1337,369,1337,12,28/03/2014,24/11/2025,1.59 MB,"API, command and message handling for WeChat in Rails",Ruby,https://github.com/Eric-Guo/wechat,1.59 MB
754,developer.github.com,1336,1122,1336,0,26/04/2011,11/10/2017,144.19 MB,GitHub Developer site,Ruby,https://github.com/github/developer.github.com,144.19 MB
755,username-anarchy,1336,155,1336,2,07/11/2012,20/09/2024,16.82 MB,Username tools for penetration testing,Ruby,https://github.com/urbanadventurer/username-anarchy,16.82 MB
756,bridgetown,1333,127,1333,49,07/04/2020,11/03/2026,17.78 MB,"A next-generation progressive site generator & fullstack framework, powered by Ruby",Ruby,https://github.com/bridgetownrb/bridgetown,17.78 MB
757,wbench,1332,56,1332,7,03/02/2013,02/10/2020,863.00 KB,"It benchmarks websites, YO!",Ruby,https://github.com/desktoppr/wbench,863.00 KB
758,passwordless,1332,91,1332,20,05/11/2017,10/12/2025,415.00 KB,🗝 Authentication for your Rails app without the icky-ness of passwords,Ruby,https://github.com/mikker/passwordless,415.00 KB
759,SIMP,1331,282,1331,0,28/04/2015,05/11/2019,71.00 KB,A system automation and configuration management stack targeted toward operational flexibility and policy compliance.,Ruby,https://github.com/NationalSecurityAgency/SIMP,71.00 KB
760,activerecord-reputation-system,1329,119,1329,28,17/05/2012,14/01/2016,745.00 KB,An Active Record Reputation System for Rails,Ruby,https://github.com/twitter/activerecord-reputation-system,745.00 KB
761,business_time,1326,219,1326,28,13/04/2010,27/12/2025,332.00 KB,Support for doing time math in business hours and days,Ruby,https://github.com/bokmann/business_time,332.00 KB
762,mail_view,1326,128,1326,11,21/04/2010,08/02/2018,441.00 KB,Visual email testing,Ruby,https://github.com/basecamp/mail_view,441.00 KB
763,vim-elixir,1324,156,1324,41,06/03/2012,02/08/2025,669.00 KB,Vim configuration files for Elixir,Ruby,https://github.com/elixir-editors/vim-elixir,669.00 KB
764,dip,1323,50,1323,15,06/10/2016,25/12/2024,574.00 KB,The dip is a CLI dev–tool that provides native-like interaction with a Dockerized application.,Ruby,https://github.com/bibendi/dip,574.00 KB
765,cocoapods-binary,1323,203,1323,100,24/03/2018,22/07/2022,266.00 KB,"integrate pods in form of prebuilt frameworks conveniently, reducing compile time",Ruby,https://github.com/leavez/cocoapods-binary,266.00 KB
766,guard-rspec,1321,243,1321,49,03/10/2010,10/08/2021,673.00 KB,Guard::RSpec automatically run your specs (much like autotest),Ruby,https://github.com/guard/guard-rspec,673.00 KB
767,boom,1319,116,1319,7,19/10/2010,19/02/2023,356.00 KB,Motherfucking TEXT SNIPPETS! On the COMMAND LINE!,Ruby,https://github.com/holman/boom,356.00 KB
768,jb,1318,42,1318,19,01/07/2016,20/01/2026,159.00 KB,A simple and fast JSON API template engine for Ruby on Rails,Ruby,https://github.com/amatsuda/jb,159.00 KB
769,seeing_is_believing,1318,53,1318,30,02/01/2013,11/11/2025,21.37 MB,Displays the results of every line of code in your file,Ruby,https://github.com/JoshCheek/seeing_is_believing,21.37 MB
770,appraisal,1317,112,1317,12,11/11/2010,08/09/2025,358.00 KB,A Ruby library for testing your library against different versions of dependencies.,Ruby,https://github.com/thoughtbot/appraisal,358.00 KB
771,best-practices-badge,1317,222,1317,237,22/07/2015,12/03/2026,73.80 MB,🏆Open Source Security Foundation (OpenSSF) Best Practices Badge (formerly Core Infrastructure Initiative (CII) Best Practices Badge),Ruby,https://github.com/coreinfrastructure/best-practices-badge,73.80 MB
772,foreigner,1316,123,1316,4,16/04/2009,06/02/2019,395.00 KB,Adds foreign key helpers to migrations and correctly dumps foreign keys to schema.rb,Ruby,https://github.com/matthuhiggins/foreigner,395.00 KB
773,YosemiteSanFranciscoFont,1314,172,1314,1,19/11/2014,25/06/2015,13.82 MB,Replace Helvetica Neue on your 10.10 Yosemite Mac with San Francisco – the Watch font.,Ruby,https://github.com/supermarin/YosemiteSanFranciscoFont,13.82 MB
774,screengif,1312,54,1312,16,20/02/2013,31/07/2020,5.11 MB,Create animated gif screencasts.,Ruby,https://github.com/dergachev/screengif,5.11 MB
775,omnibus,1311,297,1311,68,14/02/2012,09/12/2025,36.12 MB,Easily create full-stack installers for your project across a variety of platforms.,Ruby,https://github.com/chef/omnibus,36.12 MB
776,rage,1310,31,1310,16,15/09/2023,12/03/2026,1.48 MB,A modern Ruby framework designed for non-blocking I/O and simpler infrastructure,Ruby,https://github.com/rage-rb/rage,1.48 MB
777,vcap,1310,349,1310,0,12/04/2011,28/08/2013,942.41 MB,Cloud Foundry - the open platform as a service project,Ruby,https://github.com/cloudfoundry-attic/vcap,942.41 MB
778,cane,1308,72,1308,9,14/01/2012,06/02/2023,333.00 KB,Code quality threshold checking as part of your build,Ruby,https://github.com/square/cane,333.00 KB
779,diffy,1305,105,1305,41,29/06/2010,09/06/2025,163.00 KB,Easy Diffing in Ruby,Ruby,https://github.com/samg/diffy,163.00 KB
780,cfn_nag,1305,209,1305,84,11/02/2016,01/08/2024,1.47 MB,Linting tool for CloudFormation templates,Ruby,https://github.com/stelligent/cfn_nag,1.47 MB
781,Ruby,1303,306,1303,9,25/07/2016,31/01/2026,546.00 KB,All algorithms implemented in Ruby,Ruby,https://github.com/TheAlgorithms/Ruby,546.00 KB
782,highline,1301,136,1301,12,02/02/2009,03/09/2025,2.26 MB,A higher level command-line oriented interface.,Ruby,https://github.com/JEG2/highline,2.26 MB
783,fluentd-kubernetes-daemonset,1300,974,1300,17,21/01/2017,09/03/2026,2.91 MB,Fluentd daemonset for Kubernetes and it Docker image,Ruby,https://github.com/fluent/fluentd-kubernetes-daemonset,2.91 MB
784,dpl,1299,365,1299,65,27/05/2013,25/08/2025,4.54 MB,Dpl (dee-pee-ell) is a deploy tool made for continuous deployment.,Ruby,https://github.com/travis-ci/dpl,4.54 MB
785,devise-two-factor,1292,263,1292,43,12/05/2014,04/02/2026,372.00 KB,Barebones two-factor authentication with Devise,Ruby,https://github.com/devise-two-factor/devise-two-factor,372.00 KB
786,devise-jwt,1292,132,1292,2,12/01/2017,14/01/2026,298.00 KB,JWT token authentication with devise and rails,Ruby,https://github.com/waiting-for-dev/devise-jwt,298.00 KB
787,apple-knowledge,1292,104,1292,3,06/12/2021,10/01/2026,87.04 MB,"A collection of reverse engineered Apple things, as well as a machine-readable database of Apple hardware",Ruby,https://github.com/hack-different/apple-knowledge,87.04 MB
788,cocoapods-playgrounds,1290,36,1290,17,10/02/2016,11/03/2019,273.00 KB,:black_joker: Generate Swift Playgrounds for any library.,Ruby,https://github.com/asmallteapot/cocoapods-playgrounds,273.00 KB
789,job-iteration,1290,56,1290,48,13/06/2018,12/03/2026,1.08 MB,Makes your background jobs interruptible and resumable by design.,Ruby,https://github.com/Shopify/job-iteration,1.08 MB
790,ruby-kafka,1284,332,1284,0,18/01/2016,10/12/2025,2.13 MB,A Ruby client library for Apache Kafka,Ruby,https://github.com/zendesk/ruby-kafka,2.13 MB
791,colorize,1284,141,1284,5,23/11/2009,21/05/2024,207.00 KB,"Ruby string class extension. It add some methods to set color, background color and text effect on console easier using ANSI escape sequences.",Ruby,https://github.com/fazibear/colorize,207.00 KB
792,powder,1284,65,1284,13,08/04/2011,08/10/2019,180.00 KB,"Makes Pow even easier. I mean really, really, ridiculously easy",Ruby,https://github.com/powder-rb/powder,180.00 KB
793,ruby-processing,1282,90,1282,0,13/04/2008,31/08/2020,78.70 MB,"Code as Art, Art as Code. Processing and Ruby are meant for each other.",Ruby,https://github.com/jashkenas/ruby-processing,78.70 MB
794,blueprinter,1281,114,1281,14,03/08/2017,10/03/2026,3.13 MB,"Simple, Fast, and Declarative Serialization Library for Ruby",Ruby,https://github.com/procore-oss/blueprinter,3.13 MB
795,awesome-vapor,1278,64,1278,8,16/02/2018,14/10/2023,173.00 KB,A curated list of Vapor-related awesome projects.,Ruby,https://github.com/vapor-community/awesome-vapor,173.00 KB
796,mocha,1277,159,1277,122,04/10/2008,07/03/2026,4.28 MB,A mocking and stubbing library for Ruby,Ruby,https://github.com/freerange/mocha,4.28 MB
797,gli,1274,105,1274,10,05/02/2009,09/03/2025,2.09 MB,Make awesome command-line applications the easy way,Ruby,https://github.com/davetron5000/gli,2.09 MB
798,watchr,1274,76,1274,33,18/08/2009,15/10/2011,1.13 MB,Modern continuous testing (flexible alternative to Autotest),Ruby,https://github.com/mynyml/watchr,1.13 MB
799,geo_pattern,1273,89,1273,1,27/01/2014,22/04/2025,1.71 MB,Create beautiful generative geometric background images from a string.,Ruby,https://github.com/jasonlong/geo_pattern,1.71 MB
800,zealot,1269,155,1269,6,25/01/2019,12/03/2026,234.00 MB,"Self-hosted Beta App Distribution for Android, iOS, macOS, Linux and Windows apps | 开源自部署移动应用、 macOS、Linux 和 Windows 应用分发平台，提供 iOS、Android SDK、fastlane 等丰富组件库",Ruby,https://github.com/tryzealot/zealot,234.00 MB
801,omniauth-facebook,1268,400,1268,2,15/10/2011,17/07/2025,366.00 KB,Facebook OAuth2 Strategy for OmniAuth,Ruby,https://github.com/simi/omniauth-facebook,366.00 KB
802,strong_parameters,1262,162,1262,65,13/03/2012,08/08/2017,169.00 KB,Taint and required checking for Action Pack and enforcement in Active Model,Ruby,https://github.com/rails/strong_parameters,169.00 KB
803,maintenance_tasks,1262,108,1262,6,22/09/2020,12/03/2026,3.12 MB,A Rails engine for queueing and managing data migrations.,Ruby,https://github.com/Shopify/maintenance_tasks,3.12 MB
804,globalid,1262,132,1262,8,15/08/2014,22/10/2025,334.00 KB,Identify app models with a URI,Ruby,https://github.com/rails/globalid,334.00 KB
805,truemail,1259,69,1259,2,04/03/2019,23/04/2024,643.00 KB,"🚀 Configurable framework agnostic plain Ruby 📨 email validator/verifier. Verify email via Regex, DNS, SMTP and even more. Be sure that email address valid and exists.",Ruby,https://github.com/truemail-rb/truemail,643.00 KB
806,slack-ruby-client,1259,226,1259,50,24/07/2015,09/03/2026,2.57 MB,A ruby client for the Slack Web and Event APIs.,Ruby,https://github.com/slack-ruby/slack-ruby-client,2.57 MB
807,debug,1258,143,1258,91,20/09/2019,19/12/2025,1.71 MB,Debugging functionality for Ruby,Ruby,https://github.com/ruby/debug,1.71 MB
808,rack-contrib,1256,221,1256,2,24/12/2008,15/11/2024,447.00 KB,Contributed Rack Middleware and Utilities,Ruby,https://github.com/rack/rack-contrib,447.00 KB
809,ProMotion,1255,143,1255,25,30/08/2012,04/02/2025,2.07 MB,ProMotion is a RubyMotion gem that makes iPhone development less like Objective-C and more like Ruby.,Ruby,https://github.com/jamonholmgren/ProMotion,2.07 MB
810,frankfurter,1253,138,1253,29,08/03/2018,09/02/2026,2.73 MB,💱 Currency data API,Ruby,https://github.com/lineofflight/frankfurter,2.73 MB
811,rspec-expectations,1251,385,1251,0,29/06/2009,30/11/2024,5.57 MB,Provides a readable API to express expected outcomes of a code example,Ruby,https://github.com/rspec/rspec-expectations,5.57 MB
812,doing,1246,94,1246,5,15/03/2014,14/02/2026,7.29 MB,,Ruby,https://github.com/ttscoff/doing,7.29 MB
813,invisible_captcha,1241,67,1241,1,06/06/2012,30/01/2025,240.00 KB,🍯 Unobtrusive and flexible spam protection for Rails apps,Ruby,https://github.com/markets/invisible_captcha,240.00 KB
814,pgslice,1236,70,1236,4,24/04/2016,06/01/2026,300.00 KB,Postgres partitioning as easy as pie,Ruby,https://github.com/ankane/pgslice,300.00 KB
815,FxLifeSheet,1236,83,1236,26,01/04/2019,13/01/2024,3.05 MB,Tracking the key metrics of my life,Ruby,https://github.com/KrauseFx/FxLifeSheet,3.05 MB
816,declarative_authorization,1236,228,1236,62,14/08/2008,01/09/2020,1.02 MB,An unmaintained authorization plugin for Rails. Please fork to support current versions of Rails,Ruby,https://github.com/stffn/declarative_authorization,1.02 MB
817,seed-fu,1235,158,1235,58,01/04/2008,09/08/2022,170.00 KB,"Advanced seed data handling for Rails, combining the best practices of several methods together.",Ruby,https://github.com/mbleigh/seed-fu,170.00 KB
818,rails-pg-extras,1234,39,1234,0,25/12/2019,10/01/2026,1.80 MB,"Rails PostgreSQL database performance insights. Locks, index usage, buffer cache hit ratios, vacuum stats and more.",Ruby,https://github.com/pawurb/rails-pg-extras,1.80 MB
819,camaleon-cms,1234,290,1234,18,09/07/2015,09/03/2026,54.81 MB,Camaleon CMS is a dynamic and advanced content management system based on Ruby on Rails,Ruby,https://github.com/owen2345/camaleon-cms,54.81 MB
820,rspec-core,1229,753,1229,0,29/06/2009,30/11/2024,11.75 MB,RSpec runner and formatters,Ruby,https://github.com/rspec/rspec-core,11.75 MB
821,openfoodnetwork,1229,773,1229,649,17/10/2012,13/03/2026,118.91 MB,"Connect suppliers, distributors and consumers to trade local produce.",Ruby,https://github.com/openfoodfoundation/openfoodnetwork,118.91 MB
822,heroku-accounts,1227,63,1227,1,23/12/2009,23/04/2016,35.00 KB,Multiple account management for Heroku,Ruby,https://github.com/ddollar/heroku-accounts,35.00 KB
823,tracks,1225,533,1225,248,16/07/2011,12/03/2026,22.27 MB,"Tracks is a GTD™ web application, built with Ruby on Rails",Ruby,https://github.com/TracksApp/tracks,22.27 MB
824,rails_performance,1222,90,1222,17,24/01/2020,15/01/2026,6.91 MB,Monitor performance of you Rails applications (self-hosted and free),Ruby,https://github.com/igorkasyanchuk/rails_performance,6.91 MB
825,xray-rails,1220,77,1220,33,06/03/2013,07/12/2024,425.00 KB,☠️ A development tool that reveals your UI's bones,Ruby,https://github.com/brentd/xray-rails,425.00 KB
826,em-http-request,1219,230,1219,17,22/08/2008,10/11/2024,922.00 KB,Asynchronous HTTP Client (EventMachine + Ruby),Ruby,https://github.com/igrigorik/em-http-request,922.00 KB
827,anystyle,1218,100,1218,67,31/08/2011,11/05/2025,17.68 MB,Fast citation reference parsing,Ruby,https://github.com/inukshuk/anystyle,17.68 MB
828,fresh,1215,86,1215,42,03/09/2012,16/12/2025,1.37 MB,Keep your dotfiles fresh.,Ruby,https://github.com/freshshell/fresh,1.37 MB
829,autoprefixer-rails,1210,109,1210,7,04/04/2013,12/04/2025,25.78 MB,Autoprefixer for Ruby and Ruby on Rails,Ruby,https://github.com/ai/autoprefixer-rails,25.78 MB
830,store_model,1209,104,1209,28,12/02/2019,07/02/2026,333.00 KB,Work with JSON-backed attributes as ActiveRecord-ish models,Ruby,https://github.com/DmitryTsepelev/store_model,333.00 KB
831,newrelic-ruby-agent,1208,607,1208,147,31/10/2008,13/03/2026,40.94 MB,New Relic RPM Ruby Agent,Ruby,https://github.com/newrelic/newrelic-ruby-agent,40.94 MB
832,ror_ecommerce,1207,405,1207,23,16/10/2010,13/06/2023,8.83 MB,"Ruby on Rails Ecommerce platform, perfect for your small business solution.",Ruby,https://github.com/drhenner/ror_ecommerce,8.83 MB
833,Home-Network-Note,1207,94,1207,3,28/11/2014,30/12/2024,14.81 MB,🚧 持续更新 🚧 记录搭建兼顾学习娱乐的家用网络环境的过程，折腾过的一些软硬件小经验。,Ruby,https://github.com/soulteary/Home-Network-Note,14.81 MB
834,RubyMotionSamples,1205,333,1205,11,03/05/2012,28/04/2021,21.25 MB,A collection of RubyMotion applications for code samples.,Ruby,https://github.com/HipByte/RubyMotionSamples,21.25 MB
835,asciidoctor-pdf,1205,499,1205,9,11/01/2014,17/02/2026,32.56 MB,":page_with_curl: Asciidoctor PDF: A native PDF converter for AsciiDoc based on Asciidoctor and Prawn, written entirely in Ruby.",Ruby,https://github.com/asciidoctor/asciidoctor-pdf,32.56 MB
836,rotating-proxy,1203,253,1203,24,11/04/2014,25/04/2024,30.00 KB,Rotating TOR proxy with Docker,Ruby,https://github.com/mattes/rotating-proxy,30.00 KB
837,fucking_shell_scripts,1202,88,1202,2,16/08/2013,17/02/2015,324.00 KB,"The easiest, most common sense configuration management tool... because you just use fucking shell scripts.",Ruby,https://github.com/brandonhilkert/fucking_shell_scripts,324.00 KB
838,vagrant-lxc,1199,176,1199,1,25/02/2013,24/11/2022,1.20 MB,LXC provider for Vagrant,Ruby,https://github.com/fgrehm/vagrant-lxc,1.20 MB
839,sshkit,1198,256,1198,46,09/03/2012,01/02/2026,1.54 MB,"A toolkit for deploying code and assets to servers in a repeatable, testable, reliable way.",Ruby,https://github.com/capistrano/sshkit,1.54 MB
840,icalendar,1198,195,1198,17,28/12/2008,07/11/2025,922.00 KB,icalendar.rb main repository,Ruby,https://github.com/icalendar/icalendar,922.00 KB
841,taps,1197,138,1197,69,07/02/2009,20/03/2018,672.00 KB,simple database import/export app,Ruby,https://github.com/ricardochimal/taps,672.00 KB
842,active_attr,1197,91,1197,51,29/09/2011,01/03/2026,522.00 KB,What ActiveModel left out,Ruby,https://github.com/cgriego/active_attr,522.00 KB
843,authority,1196,68,1196,0,09/03/2012,18/11/2019,790.00 KB,*CURRENTLY UNMAINTAINED*. Authority helps you authorize actions in your Rails app. It's ORM-neutral and has very little fancy syntax; just group your models under one or more Authorizer classes and write plain Ruby methods on them.,Ruby,https://github.com/nathanl/authority,790.00 KB
844,awesome-juce,1194,61,1194,6,08/05/2022,12/03/2026,1.67 MB,"A curated list of JUCE modules, templates, plugins, oh my!",Ruby,https://github.com/sudara/awesome-juce,1.67 MB
845,email-spec,1192,171,1192,36,09/12/2008,12/12/2025,770.00 KB,Collection of RSpec/MiniTest matchers and Cucumber steps for testing email in a ruby app using ActionMailer or Pony,Ruby,https://github.com/email-spec/email-spec,770.00 KB
846,queue_classic,1188,151,1188,11,26/01/2011,22/03/2024,752.00 KB,"Simple, efficient worker queue for Ruby & PostgreSQL.",Ruby,https://github.com/QueueClassic/queue_classic,752.00 KB
847,eye,1187,87,1187,19,29/12/2012,13/11/2021,2.14 MB,Process monitoring tool. Inspired from Bluepill and God.,Ruby,https://github.com/kostya/eye,2.14 MB
848,update_xcode_plugins,1186,81,1186,11,25/02/2016,06/06/2018,70.00 KB,No more messing with plugin UUIDs; Plugins on Xcode 8+!,Ruby,https://github.com/inket/update_xcode_plugins,70.00 KB
849,deadweight,1184,50,1184,14,21/07/2009,27/04/2016,149.00 KB,NOT MAINTAINED,Ruby,https://github.com/aanand/deadweight,149.00 KB
850,rubyinstaller,1184,296,1184,26,15/02/2009,22/05/2021,969.00 KB,RubyInstaller for Windows - Build recipes,Ruby,https://github.com/oneclick/rubyinstaller,969.00 KB
851,Xaddress,1183,44,1183,6,09/08/2016,30/09/2022,18.42 MB,Xaddress - Give 7 billion people an instant physical address,Ruby,https://github.com/roberdam/Xaddress,18.42 MB
852,homebrew-macos-cross-toolchains,1183,76,1183,6,28/02/2021,15/02/2026,163.00 KB,macOS cross compiler toolchains,Ruby,https://github.com/messense/homebrew-macos-cross-toolchains,163.00 KB
853,github,1181,314,1181,29,25/09/2011,13/05/2023,7.21 MB,Ruby interface to GitHub API,Ruby,https://github.com/piotrmurach/github,7.21 MB
854,awspec,1179,190,1179,39,27/07/2015,08/03/2026,2.62 MB,RSpec tests for your AWS resources.,Ruby,https://github.com/k1LoW/awspec,2.62 MB
855,BubbleWrap,1179,206,1179,32,03/05/2012,25/04/2021,1.82 MB,"Cocoa wrappers and helpers for RubyMotion (Ruby for iOS and OS X) - Making Cocoa APIs more Ruby like, one API at a time. Fork away and send your pull requests",Ruby,https://github.com/rubymotion-community/BubbleWrap,1.82 MB
