Ranking,Project Name,Stars,Forks,Watchers,Open Issues,Created At,Last Commit,Size,Description,Language,Repo URL,Size
572,calabash-android,1684,610,1684,98,05/02/2012,08/08/2024,57.22 MB,Automated Functional testing for Android using cucumber,Ruby,https://github.com/calabash/calabash-android,57.22 MB
573,acts_as_tenant,1683,268,1683,45,08/08/2011,16/04/2025,483.00 KB,Easy multi-tenancy for Rails in a shared database setup.,Ruby,https://github.com/ErwinM/acts_as_tenant,483.00 KB
574,logidze,1681,83,1681,15,13/04/2016,08/10/2025,708.00 KB,Database changes log for Rails,Ruby,https://github.com/palkan/logidze,708.00 KB
575,radiant,1679,340,1679,78,20/06/2008,11/03/2026,15.17 MB,"Radiant is a no-fluff, open source content management system designed for small teams.",Ruby,https://github.com/radiant/radiant,15.17 MB
576,streamio-ffmpeg,1679,420,1679,67,06/04/2010,08/05/2024,56.82 MB,Simple yet powerful ruby ffmpeg wrapper for reading metadata and transcoding movies,Ruby,https://github.com/streamio/streamio-ffmpeg,56.82 MB
577,connection_pool,1677,144,1677,0,14/05/2011,12/01/2026,232.00 KB,Generic connection pooling for Ruby,Ruby,https://github.com/mperham/connection_pool,232.00 KB
578,lita,1674,179,1674,16,20/04/2013,14/06/2022,1.06 MB,ChatOps for Ruby.,Ruby,https://github.com/litaio/lita,1.06 MB
579,imap-backup,1674,88,1674,4,10/06/2012,11/02/2026,2.79 MB,Backup and Migrate IMAP Email Accounts,Ruby,https://github.com/joeyates/imap-backup,2.79 MB
580,js-routes,1671,157,1671,4,03/08/2011,22/01/2026,2.25 MB,Brings Rails named routes to javascript,Ruby,https://github.com/railsware/js-routes,2.25 MB
581,swarm,1671,120,1671,11,24/05/2025,17/02/2026,8.22 MB,"Ruby gems for general-purpose AI agent systems: automation, research, data processing, customer support, content creation. SwarmSDK provides single-process orchestration, persistent memory with semantic   search, node workflows, and hooks. SwarmMemory/SwarmCLI included. Claude Swarm v1 for dev teams.",Ruby,https://github.com/parruda/swarm,8.22 MB
582,goldiloader,1666,53,1666,6,12/06/2014,15/12/2025,259.00 KB,Just the right amount of Rails eager loading,Ruby,https://github.com/salsify/goldiloader,259.00 KB
583,simple_calendar,1666,272,1666,4,04/02/2012,08/05/2025,491.00 KB,A wonderfully simple calendar gem for Rails,Ruby,https://github.com/excid3/simple_calendar,491.00 KB
584,message_bus,1663,133,1663,22,15/05/2013,19/02/2026,1.79 MB,A reliable and robust messaging bus for Ruby and Rack,Ruby,https://github.com/discourse/message_bus,1.79 MB
585,rotp,1656,477,1656,10,13/02/2011,24/11/2025,297.00 KB,Ruby One Time Password library,Ruby,https://github.com/mdp/rotp,297.00 KB
586,recommendify,1651,145,1651,17,29/01/2012,08/05/2014,1.87 MB,Generate recommendations using collaborative filtering,Ruby,https://github.com/asmuth/recommendify,1.87 MB
587,bootstrap_form,1647,353,1647,45,06/01/2012,27/01/2026,6.17 MB,"Official repository of the bootstrap_form gem, a Rails form builder that makes it super easy to create beautiful-looking forms using Bootstrap 5.",Ruby,https://github.com/bootstrap-ruby/bootstrap_form,6.17 MB
588,multiwoven,1644,85,1644,103,20/10/2023,13/03/2026,7.26 MB,🔥🔥🔥 Open source Reverse ETL -  alternative to hightouch and census. ,Ruby,https://github.com/Multiwoven/multiwoven,7.26 MB
589,ioctocat,1644,252,1644,29,28/03/2009,29/01/2014,17.54 MB,"iOctocat v1 - GitHub for iOS (works on the iPhone, iPad, and iPod Touch)",Objective-C,https://github.com/dennisreimann/ioctocat,17.54 MB
590,einhorn,1644,46,1644,1,25/05/2012,10/04/2025,464.00 KB,Einhorn: the language-independent shared socket manager           ,Ruby,https://github.com/contribsys/einhorn,464.00 KB
591,ch340g-ch34g-ch34x-mac-os-x-driver,1643,231,1643,4,26/09/2016,15/05/2023,854.00 KB,CH340G CH34G CH34X Mac OS X driver,Ruby,https://github.com/adrianmihalko/ch340g-ch34g-ch34x-mac-os-x-driver,854.00 KB
592,mailboxer,1641,458,1641,151,07/03/2011,11/04/2024,687.00 KB,A Rails gem to send messages inside a web application,Ruby,https://github.com/mailboxer/mailboxer,687.00 KB
593,html-proofer,1640,213,1640,15,27/02/2013,07/01/2026,8.56 MB,Test your rendered HTML files to make sure they're accurate.,Ruby,https://github.com/gjtorikian/html-proofer,8.56 MB
594,catarse,1638,819,1638,71,11/11/2010,28/03/2023,71.76 MB,The first open source crowdfunding platform for creative projects in the world,Ruby,https://github.com/catarse/catarse,71.76 MB
595,geokit,1636,359,1636,19,01/12/2008,29/07/2024,12.87 MB,Official Geokit Gem. Geokit gem provides geocoding and distance/heading calculations. Pair with the geokit-rails plugin for full-fledged location-based app functionality.,Ruby,https://github.com/geokit/geokit,12.87 MB
596,json-schema,1629,248,1629,101,24/11/2010,06/03/2026,1.25 MB,Ruby JSON Schema Validator,Ruby,https://github.com/voxpupuli/json-schema,1.25 MB
597,thinking-sphinx,1629,465,1629,17,14/04/2008,11/01/2026,5.20 MB,Sphinx/Manticore plugin for ActiveRecord/Rails,Ruby,https://github.com/pat/thinking-sphinx,5.20 MB
598,terraform-landscape,1626,152,1626,33,28/02/2017,20/03/2024,778.00 KB,Improve Terraform's plan output to be easier to read and understand,Ruby,https://github.com/coinbase/terraform-landscape,778.00 KB
599,awesome-geek-podcasts,1623,208,1623,1,20/05/2015,27/03/2023,372.00 KB,A curated list of podcasts we like to listen to. ,Ruby,https://github.com/guipdutra/awesome-geek-podcasts,372.00 KB
600,rails-assets,1623,66,1623,26,06/07/2013,29/07/2022,3.57 MB,The solution to assets management in Rails,Ruby,https://github.com/tenex/rails-assets,3.57 MB
601,mosql,1619,219,1619,58,14/01/2013,07/04/2020,260.00 KB,MongoDB → PostgreSQL streaming replication        ,Ruby,https://github.com/stripe-archive/mosql,260.00 KB
602,cuttlefish,1617,179,1617,150,30/03/2013,27/06/2024,26.14 MB,Transactional email server with a lovely web interface,Ruby,https://github.com/mlandauer/cuttlefish,26.14 MB
603,validates_timeliness,1613,235,1613,20,25/07/2008,06/12/2025,1.36 MB,Date and time validation plugin for ActiveModel and Rails.  Supports multiple ORMs and allows custom date/time formats.,Ruby,https://github.com/adzap/validates_timeliness,1.36 MB
604,shoes4,1613,192,1613,98,24/05/2012,17/11/2023,58.41 MB,Shoes 4 : the next version of Shoes,Ruby,https://github.com/shoes/shoes4,58.41 MB
605,ifme,1608,767,1608,41,19/04/2014,05/03/2026,96.82 MB,"Free, open source mental health communication web app to share experiences with loved ones",Ruby,https://github.com/ifmeorg/ifme,96.82 MB
606,anemone,1608,318,1608,51,14/04/2009,20/03/2020,591.00 KB,Anemone web-spider framework,Ruby,https://github.com/chriskite/anemone,591.00 KB
607,mongomapper,1603,379,1603,70,27/05/2009,31/12/2025,2.80 MB,A Ruby Object Mapper for Mongo,Ruby,https://github.com/mongomapper/mongomapper,2.80 MB
608,thredded,1603,214,1603,35,09/05/2013,04/03/2026,3.68 MB,The best Rails forums engine ever.,Ruby,https://github.com/thredded/thredded,3.68 MB
609,liftoff,1602,102,1602,30,19/10/2012,27/06/2020,17.92 MB,CLI for creating and configuring new Xcode projects,Ruby,https://github.com/liftoffcli/liftoff,17.92 MB
610,lol_dba,1599,72,1599,17,28/02/2012,07/03/2024,397.00 KB,"lol_dba is a small package of rake tasks that scan your application models and displays a list of columns that probably should be indexed. Also, it can generate .sql migration scripts.",Ruby,https://github.com/plentz/lol_dba,397.00 KB
611,backbone-rails,1598,253,1598,48,11/05/2011,15/06/2021,1.40 MB,Easily use backbone.js with rails 3.1,Ruby,https://github.com/codebrew/backbone-rails,1.40 MB
612,addressable,1596,274,1596,42,05/06/2008,27/02/2026,1.94 MB,"Addressable is an alternative implementation to the URI implementation that is part of Ruby's standard library. It is flexible, offers heuristic parsing, and additionally provides extensive support for IRIs and URI templates.",Ruby,https://github.com/sporkmonger/addressable,1.94 MB
613,clean-code-ruby,1596,162,1596,7,07/09/2017,10/09/2022,321.00 KB,🛁 Clean Code concepts adapted for Ruby,Ruby,https://github.com/uohzxela/clean-code-ruby,321.00 KB
614,ansible-elasticsearch,1591,855,1591,13,30/04/2015,24/06/2022,1.19 MB,Ansible playbook for Elasticsearch,Ruby,https://github.com/elastic/ansible-elasticsearch,1.19 MB
615,ruby-progressbar,1591,132,1591,1,16/02/2009,08/01/2026,1.00 MB,Ruby/ProgressBar is a text progress bar library for Ruby.,Ruby,https://github.com/jfelchner/ruby-progressbar,1.00 MB
616,travis.rb,1589,408,1589,206,09/01/2013,25/10/2024,2.00 MB,Travis CI Client (CLI and Ruby library),Ruby,https://github.com/travis-ci/travis.rb,2.00 MB
617,geokit-rails,1587,246,1587,39,19/12/2008,23/02/2024,389.00 KB,Official Geokit plugin for Rails/ActiveRecord. Provides location-based goodness for your Rails app. Requires the Geokit gem.,Ruby,https://github.com/geokit/geokit-rails,389.00 KB
618,slather,1587,240,1587,167,12/06/2014,01/10/2025,1.18 MB,Generate test coverage reports for Xcode projects & hook it into CI.,Ruby,https://github.com/SlatherOrg/slather,1.18 MB
619,github-awards,1581,118,1581,102,25/01/2015,03/01/2023,2.81 MB,Discover your ranking on github :,Ruby,https://github.com/vdaubry/github-awards,2.81 MB
620,lockbox,1581,77,1581,4,02/01/2019,26/12/2025,731.00 KB,Modern encryption for Ruby and Rails,Ruby,https://github.com/ankane/lockbox,731.00 KB
621,tailwindcss-rails,1579,188,1579,13,09/01/2021,20/02/2026,4.43 MB,,Ruby,https://github.com/rails/tailwindcss-rails,4.43 MB
622,restful-authentication,1570,265,1570,27,14/01/2008,31/07/2015,1.18 MB,inactive project,Ruby,https://github.com/technoweenie/restful-authentication,1.18 MB
623,boxen,1570,140,1570,16,30/09/2012,25/03/2018,383.00 KB,Manage Mac development boxes with love (and Puppet).,Ruby,https://github.com/boxen/boxen,383.00 KB
624,terminal-table,1569,124,1569,2,07/01/2009,24/11/2025,300.00 KB,"Ruby ASCII Table Generator, simple and feature rich.",Ruby,https://github.com/tj/terminal-table,300.00 KB
625,vite_ruby,1567,140,1567,51,19/01/2021,25/02/2026,3.07 MB,"⚡️ Vite.js in Ruby, bringing joy to your JavaScript experience",Ruby,https://github.com/ElMassimo/vite_ruby,3.07 MB
626,ffaker,1567,558,1567,15,15/01/2010,12/03/2026,5.54 MB,Faker refactored.,Ruby,https://github.com/ffaker/ffaker,5.54 MB
627,insoshi,1567,529,1567,2,02/04/2008,01/08/2022,13.55 MB,An open source social networking platform in Ruby on Rails,Ruby,https://github.com/insoshi/insoshi,13.55 MB
628,redmon,1566,124,1566,25,05/01/2012,16/05/2020,2.84 MB,"A web interface for managing redis: cli, admin, and live monitoring",Ruby,https://github.com/steelThread/redmon,2.84 MB
629,tty-prompt,1561,138,1561,31,01/11/2015,20/07/2024,1.71 MB,A beautiful and powerful interactive command line prompt,Ruby,https://github.com/piotrmurach/tty-prompt,1.71 MB
630,cocoapods-keys,1555,90,1555,50,16/08/2014,01/09/2023,281.00 KB,A key value store for storing per-developer environment and application keys,Ruby,https://github.com/orta/cocoapods-keys,281.00 KB
631,pg_search,1551,379,1551,158,14/01/2011,05/01/2026,1.26 MB,pg_search builds ActiveRecord named scopes that take advantage of PostgreSQL’s full text search ,Ruby,https://github.com/Casecommons/pg_search,1.26 MB
632,artoo,1550,142,1550,21,14/08/2012,19/12/2023,1.10 MB,"Ruby framework for robotics, drones, and the Internet of Things (IoT)",Ruby,https://github.com/hybridgroup/artoo,1.10 MB
633,forem,1550,416,1550,47,20/02/2011,05/10/2016,25.85 MB,The best Rails 3 and Rails 4 forum engine. Ever.,Ruby,https://github.com/rubysherpas/forem,25.85 MB
634,watir,1546,247,1546,12,09/11/2009,31/05/2024,8.67 MB,Watir Powered By Selenium,Ruby,https://github.com/watir/watir,8.67 MB
635,image_optim,1545,106,1545,41,05/01/2012,17/01/2026,3.97 MB,Optimize images using multiple utilities,Ruby,https://github.com/toy/image_optim,3.97 MB
636,rustboot,1545,223,1545,7,26/05/2013,01/01/2026,30.00 KB,A tiny 32 bit kernel written in Rust,Ruby,https://github.com/haileys/rustboot,30.00 KB
637,zsteg,1545,161,1545,6,06/01/2013,28/01/2026,9.44 MB,detect stegano-hidden data in PNG & BMP,Ruby,https://github.com/zed-0xff/zsteg,9.44 MB
638,word-to-markdown,1538,156,1538,13,22/03/2014,30/10/2025,20.03 MB,A ruby gem to liberate content from Microsoft Word documents,Ruby,https://github.com/benbalter/word-to-markdown,20.03 MB
639,geminabox,1537,320,1537,2,07/01/2010,11/03/2026,661.00 KB,Really simple rubygem hosting,Ruby,https://github.com/geminabox/geminabox,661.00 KB
640,impressionist,1535,307,1535,81,04/02/2011,08/02/2026,758.00 KB,Rails Plugin that tracks impressions and page views,Ruby,https://github.com/charlotte-ruby/impressionist,758.00 KB
641,action_policy,1535,91,1535,4,29/03/2018,11/03/2026,1.55 MB,Authorization framework for Ruby/Rails applications,Ruby,https://github.com/palkan/action_policy,1.55 MB
642,squasher,1534,58,1534,8,19/01/2014,16/12/2024,104.00 KB,Squasher - squash your old migrations in a single command,Ruby,https://github.com/jalkoby/squasher,104.00 KB
643,vanity,1534,266,1534,36,04/11/2009,16/03/2023,3.26 MB,Experiment Driven Development for Ruby,Ruby,https://github.com/assaf/vanity,3.26 MB
644,acts_as_votable,1532,214,1532,15,30/12/2010,12/12/2022,278.00 KB,Votable ActiveRecord for Rails,Ruby,https://github.com/ryanto/acts_as_votable,278.00 KB
645,merit,1531,196,1531,1,25/11/2011,19/08/2025,920.00 KB,Reputation engine for Rails apps,Ruby,https://github.com/tute/merit,920.00 KB
646,sidekiq-unique-jobs,1530,287,1530,80,26/07/2012,12/03/2026,20.12 MB,Prevents duplicate Sidekiq jobs,Ruby,https://github.com/mhenrixon/sidekiq-unique-jobs,20.12 MB
647,data-migrate,1530,198,1530,35,19/04/2011,11/02/2026,694.00 KB,Migrate and update data alongside your database structure.,Ruby,https://github.com/ilyakatz/data-migrate,694.00 KB
648,consuldemocracy,1528,1124,1528,235,15/07/2015,12/03/2026,118.67 MB,Consul Democracy - Open Government and E-Participation Web Software,Ruby,https://github.com/consuldemocracy/consuldemocracy,118.67 MB
649,webrat,1527,274,1527,15,02/03/2008,28/06/2016,60.68 MB,Webrat - Ruby Acceptance Testing for Web applications,Ruby,https://github.com/brynary/webrat,60.68 MB
650,rails-footnotes,1521,163,1521,15,18/12/2008,11/03/2026,706.00 KB,Every Rails page has footnotes that gives information about your application and links back to your editor,Ruby,https://github.com/indirect/rails-footnotes,706.00 KB
651,guides-old,1518,166,1518,11,01/10/2010,05/03/2018,3.65 MB,Guides for Ruby and Elixir and whatever else I feel like,Ruby,https://github.com/radar/guides-old,3.65 MB
652,rails_event_store,1516,129,1516,14,31/03/2015,09/03/2026,14.95 MB,A Ruby implementation of an Event Store based on Active Record,Ruby,https://github.com/RailsEventStore/rails_event_store,14.95 MB
653,omniauth-google-oauth2,1515,419,1515,3,03/11/2011,24/02/2026,524.00 KB,Oauth2 strategy for Google,Ruby,https://github.com/zquestz/omniauth-google-oauth2,524.00 KB
654,simple_token_authentication,1507,234,1507,81,15/12/2013,03/12/2024,777.00 KB,Simple (and safe*) token authentication for Rails apps or API with Devise.,Ruby,https://github.com/gonzalo-bulnes/simple_token_authentication,777.00 KB
655,acts_as_paranoid,1507,197,1507,46,04/03/2008,24/02/2026,729.00 KB,ActiveRecord plugin allowing you to hide and restore records without actually deleting them.,Ruby,https://github.com/ActsAsParanoid/acts_as_paranoid,729.00 KB
656,smarter_csv,1506,192,1506,1,29/07/2012,13/03/2026,1.49 MB,"Fastest end-to-end CSV ingestion for Ruby (with C acceleration). SmarterCSV auto-detects formats, applies smart defaults, and returns Rails-ready hashes for seamless use with ActiveRecord, Sidekiq, parallel jobs, and S3 pipelines — even for messy user-uploaded real-world data.",Ruby,https://github.com/tilo/smarter_csv,1.49 MB
657,timetrap,1505,115,1505,32,13/04/2009,12/03/2025,625.00 KB,Simple command line timetracker,Ruby,https://github.com/samg/timetrap,625.00 KB
658,jsduck,1498,239,1498,86,04/10/2010,16/04/2020,6.06 MB,Simple JavaScript Duckumentation generator.,Ruby,https://github.com/senchalabs/jsduck,6.06 MB
659,redis-store,1498,341,1498,7,11/04/2009,13/02/2025,3.06 MB,"Namespaced Rack::Session, Rack::Cache, I18n and cache Redis stores for Ruby web frameworks",Ruby,https://github.com/redis-store/redis-store,3.06 MB
660,toto,1497,240,1497,61,27/10/2009,08/11/2015,589.00 KB,the 10 second blog-engine for hackers,Ruby,https://github.com/cloudhead/toto,589.00 KB
661,rb,1492,42,1492,1,14/08/2018,16/02/2023,21.00 KB,Turns Ruby into a versatile command line utility,Ruby,https://github.com/thisredone/rb,21.00 KB
662,gitreflow,1492,64,1492,14,10/01/2012,01/03/2022,704.00 KB,"Reflow automatically creates pull requests, ensures the code review is approved, and squash merges finished branches to master with a great commit message template.",Ruby,https://github.com/reenhanced/gitreflow,704.00 KB
663,phlex,1492,103,1492,5,01/06/2022,21/02/2026,1.58 MB,Object-oriented views in Ruby.,Ruby,https://github.com/yippee-fun/phlex,1.58 MB
664,slack-notifier,1490,158,1490,25,05/09/2013,24/04/2023,204.00 KB,A simple wrapper for posting to slack channels,Ruby,https://github.com/slack-notifier/slack-notifier,204.00 KB
665,request_store,1485,92,1485,9,17/12/2012,01/05/2024,84.00 KB,Per-request global storage for Rack.,Ruby,https://github.com/steveklabnik/request_store,84.00 KB
666,steep,1477,111,1477,190,27/03/2017,12/03/2026,6.76 MB,Static type checker for Ruby,Ruby,https://github.com/soutaro/steep,6.76 MB
667,jeweler,1474,162,1474,20,12/10/2008,03/01/2021,1.43 MB,Opinionated tool for creating and managing Rubygem projects,Ruby,https://github.com/technicalpickles/jeweler,1.43 MB
668,decisiontree,1474,130,1474,10,23/02/2009,31/10/2018,56.00 KB,ID3-based implementation of the ML Decision Tree algorithm,Ruby,https://github.com/igrigorik/decisiontree,56.00 KB
669,semian,1470,87,1470,86,23/09/2014,11/03/2026,188.68 MB,:monkey: Resiliency toolkit for Ruby for failing fast,Ruby,https://github.com/Shopify/semian,188.68 MB
670,shipit-engine,1470,152,1470,87,26/02/2014,12/03/2026,6.00 MB,Deployment coordination,Ruby,https://github.com/Shopify/shipit-engine,6.00 MB
671,vagrant-hostmanager,1466,142,1466,77,27/03/2013,30/07/2023,192.00 KB,:pencil: A Vagrant plugin that manages hosts files within a multi-machine environment.,Ruby,https://github.com/devopsgroup-io/vagrant-hostmanager,192.00 KB
672,CodeTriage,1464,377,1464,105,21/07/2012,01/03/2026,10.68 MB,Discover the best way to get started contributing to Open Source projects,Ruby,https://github.com/codetriage/CodeTriage,10.68 MB
673,usbarmory,1462,217,1462,1,03/10/2014,28/08/2025,23.01 MB,USB armory - The open source compact secure computer,Ruby,https://github.com/usbarmory/usbarmory,23.01 MB
674,kontena,1461,124,1461,435,22/03/2015,19/02/2019,8.91 MB,"The developer friendly container and micro services platform. Works on any cloud, easy to setup, simple to use.",Ruby,https://github.com/kontena/kontena,8.91 MB
675,unicorn,1460,269,1460,5,04/09/2009,09/04/2025,8.59 MB,Unofficial Unicorn Mirror.,Ruby,https://github.com/defunkt/unicorn,8.59 MB
676,sorcery,1456,230,1456,53,16/09/2016,10/03/2026,1.83 MB,Magical Authentication,Ruby,https://github.com/Sorcery/sorcery,1.83 MB
677,contracts.ruby,1454,82,1454,51,07/06/2012,03/01/2026,733.00 KB,Contracts for Ruby.,Ruby,https://github.com/egonSchiele/contracts.ruby,733.00 KB
678,rubber,1454,241,1454,108,03/06/2008,23/11/2020,3.79 MB,"A capistrano/rails plugin that makes it easy to deploy/manage/scale to various service providers, including EC2, DigitalOcean, vSphere, and bare metal servers.",Ruby,https://github.com/rubber/rubber,3.79 MB
679,rspec_api_documentation,1452,370,1452,107,15/11/2011,24/07/2025,1.66 MB,Automatically generate API documentation from RSpec,Ruby,https://github.com/zipmark/rspec_api_documentation,1.66 MB
680,bower-rails,1452,128,1452,35,21/10/2012,24/04/2023,304.00 KB,Bundler-like DSL + rake tasks for Bower on Rails,Ruby,https://github.com/rharriso/bower-rails,304.00 KB
681,ActiveRecordExtended,1450,50,1450,11,29/04/2018,27/10/2025,425.00 KB,Adds additional postgres functionality to an ActiveRecord / Rails application,Ruby,https://github.com/GeorgeKaraszi/ActiveRecordExtended,425.00 KB
682,gitlab-ci,1449,310,1449,70,10/10/2012,14/05/2016,5.58 MB,DEPRECATED - Please use the GitLab.com issue tracker,Ruby,https://github.com/gitlabhq/gitlab-ci,5.58 MB
683,instagram-ruby-gem,1449,617,1449,65,02/02/2011,28/02/2019,347.00 KB,The official gem for the Instagram API,Ruby,https://github.com/facebookarchive/instagram-ruby-gem,347.00 KB
684,cuba,1447,258,1447,4,25/04/2010,24/01/2024,311.00 KB,Rum based microframework for web development.,Ruby,https://github.com/soveran/cuba,311.00 KB
685,dashing-rails,1447,147,1447,18,03/08/2013,06/01/2020,1.52 MB,The exceptionally handsome dashboard framework for Rails.,Ruby,https://github.com/gottfrois/dashing-rails,1.52 MB
686,litestack,1446,71,1446,21,20/02/2023,04/12/2024,4.81 MB,,Ruby,https://github.com/oldmoe/litestack,4.81 MB
687,gitdown,1446,26,1446,5,06/04/2013,08/08/2016,427.00 KB,Don't commit when you're drunk,Ruby,https://github.com/noidontdig/gitdown,427.00 KB
688,tugboat,1445,87,1445,12,13/04/2013,11/03/2018,709.00 KB,A command line tool for interacting with your DigitalOcean droplets.,Ruby,https://github.com/petems/tugboat,709.00 KB
689,samson,1443,236,1443,83,27/05/2014,30/01/2026,355.23 MB,"Web interface for deployments, with plugin architecture and kubernetes support",Ruby,https://github.com/zendesk/samson,355.23 MB
690,monocle,1440,117,1440,20,30/09/2013,16/07/2014,776.00 KB,Link and news sharing,Ruby,https://github.com/maccman/monocle,776.00 KB
691,graphql-batch,1437,104,1437,15,20/09/2015,10/03/2026,275.00 KB,A query batching executor for the graphql gem,Ruby,https://github.com/Shopify/graphql-batch,275.00 KB
692,genghis,1437,160,1437,76,17/09/2011,26/01/2016,21.38 MB,The single-file MongoDB admin app,Ruby,https://github.com/bobthecow/genghis,21.38 MB
693,mongo-ruby-driver,1435,531,1435,13,15/01/2009,12/03/2026,43.08 MB,The Official MongoDB Ruby Driver,Ruby,https://github.com/mongodb/mongo-ruby-driver,43.08 MB
694,jsonapi-serializer,1435,147,1435,66,03/10/2019,12/01/2026,472.00 KB,A fast JSON:API serializer for Ruby (fork of Netflix/fast_jsonapi),Ruby,https://github.com/jsonapi-serializer/jsonapi-serializer,472.00 KB
695,examples,1431,362,1431,2,07/05/2015,16/11/2021,1.88 MB,📝 A collection of example fastlane setups,Ruby,https://github.com/fastlane/examples,1.88 MB
696,telegram-bot-ruby,1423,223,1423,4,27/06/2015,14/01/2026,597.00 KB,Ruby wrapper for Telegram's Bot API,Ruby,https://github.com/atipugin/telegram-bot-ruby,597.00 KB
697,pretender,1420,56,1420,0,05/03/2013,26/12/2025,80.00 KB,Log in as another user in Rails,Ruby,https://github.com/ankane/pretender,80.00 KB
698,ooyala_barkeep,1419,145,1419,189,01/09/2011,26/08/2023,6.71 MB,The friendly code review system.,Ruby,https://github.com/brightcove-archive/ooyala_barkeep,6.71 MB
699,rails_apps_composer,1416,298,1416,53,17/05/2011,01/10/2020,1.71 MB,A gem with recipes to create Rails application templates for Rails starter apps.,Ruby,https://github.com/RailsApps/rails_apps_composer,1.71 MB
700,krane,1416,117,1416,67,17/01/2017,18/02/2026,9.29 MB,A command-line tool that helps you ship changes to a Kubernetes namespace and understand the result,Ruby,https://github.com/Shopify/krane,9.29 MB
701,soundcloud2000,1413,83,1413,27,19/01/2013,15/08/2019,196.00 KB,A terminal client for https://soundcloud.com,Ruby,https://github.com/grobie/soundcloud2000,196.00 KB
702,vimdeck,1411,54,1411,11,17/09/2013,11/01/2021,1.99 MB,VIM as a presentation tool,Ruby,https://github.com/tybenz/vimdeck,1.99 MB
703,seed_dump,1411,221,1411,1,27/07/2010,10/03/2026,437.00 KB,Rails task to dump your data to db/seeds.rb,Ruby,https://github.com/rroblak/seed_dump,437.00 KB
704,bunny,1408,311,1408,6,02/03/2011,22/01/2026,4.11 MB,"Bunny is a popular, easy to use, mature Ruby client for RabbitMQ",Ruby,https://github.com/ruby-amqp/bunny,4.11 MB
705,quiet_assets,1408,84,1408,0,13/02/2012,28/06/2021,45.00 KB,"DEPRECATED: As of sprockets-rails version 3.1.0, used in current versions of rails, this gem is deprecated",Ruby,https://github.com/evrone/quiet_assets,45.00 KB
706,clearskies,1408,50,1408,4,14/09/2013,09/12/2014,1.80 MB,Open source btsync clone,Ruby,https://github.com/jewel/clearskies,1.80 MB
707,suture,1408,29,1408,11,18/08/2016,29/09/2023,385.00 KB,🏥 A Ruby gem that helps you refactor your legacy code,Ruby,https://github.com/testdouble/suture,385.00 KB
708,rubyzip,1407,323,1407,22,24/09/2010,02/11/2025,2.85 MB,Official Rubyzip repository,Ruby,https://github.com/rubyzip/rubyzip,2.85 MB
709,google-cloud-ruby,1406,568,1406,109,30/05/2014,13/03/2026,314.88 MB,Google Cloud Client Library for Ruby,Ruby,https://github.com/googleapis/google-cloud-ruby,314.88 MB
710,dry-validation,1403,193,1403,26,22/07/2015,12/03/2026,2.32 MB,Validation library with type-safe schemas and rules,Ruby,https://github.com/dry-rb/dry-validation,2.32 MB
711,activegraph,1403,273,1403,241,30/05/2008,11/03/2026,47.67 MB,An active model wrapper for the Neo4j Graph Database for Ruby.,Ruby,https://github.com/neo4jrb/activegraph,47.67 MB
712,ronn,1401,84,1401,48,02/11/2009,29/01/2022,535.00 KB,the opposite of roff,Ruby,https://github.com/rtomayko/ronn,535.00 KB
713,activeresource,1400,363,1400,11,13/03/2012,06/01/2026,1.20 MB,Connects business objects and REST web services,Ruby,https://github.com/rails/activeresource,1.20 MB
714,mutations,1396,93,1396,30,19/10/2012,15/01/2026,270.00 KB,Compose your business logic into commands that sanitize and validate input.,Ruby,https://github.com/cypriss/mutations,270.00 KB
715,kredis,1396,83,1396,16,30/01/2021,01/12/2025,363.00 KB,Higher-level data structures built on Redis,Ruby,https://github.com/rails/kredis,363.00 KB
716,gruff,1395,240,1395,21,11/03/2008,01/03/2026,459.04 MB,Gruff graphing library for Ruby,Ruby,https://github.com/topfunky/gruff,459.04 MB
