Ranking,Project Name,Stars,Forks,Watchers,Open Issues,Created At,Last Commit,Size,Size (KB),Description,Language,Repo URL
578,Spark-MongoDB,308,95,308,45,02/02/2015,30/08/2016,910.00 KB,910,Spark library for easy MongoDB access,Scala,https://github.com/Stratio/Spark-MongoDB
579,akka-tracing,307,32,307,21,15/03/2014,31/01/2018,1.18 MB,1212,"A distributed tracing extension for Akka. Provides integration with Play framework, Spray and Akka HTTP.",Scala,https://github.com/levkhomich/akka-tracing
580,remotely,307,39,307,14,01/12/2014,08/06/2017,797.00 KB,797,An elegant RPC system for reasonable people,Scala,https://github.com/Verizon/remotely
581,scala-uri,306,37,306,9,11/05/2017,11/12/2024,1.68 MB,1725,Simple scala library for building and parsing URIs,Scala,https://github.com/lemonlabsuk/scala-uri
582,ping-play,306,59,306,10,16/01/2014,06/11/2016,31.84 MB,32600,BigPipe streaming for the Play Framework,Scala,https://github.com/brikis98/ping-play
583,scala-xml,306,92,306,22,17/07/2013,04/06/2025,6.84 MB,7006,The standard Scala XML library,Scala,https://github.com/scala/scala-xml
584,sbt-dynver,306,50,306,31,17/09/2016,26/05/2025,545.00 KB,545,An sbt plugin to dynamically set your version from git,Scala,https://github.com/sbt/sbt-dynver
585,gll-combinators,304,29,304,16,23/04/2009,10/07/2024,626.00 KB,626,A parser combinator library based on the GLL algorithm,Scala,https://github.com/djspiewak/gll-combinators
586,zinc,303,58,303,13,11/06/2012,03/05/2017,519.00 KB,519,⛔️ [DEPRECATED] sbt's scala incremental compiler,Scala,https://github.com/typesafehub/zinc
587,generalized-kmeans-clustering,302,50,302,3,03/09/2014,06/04/2025,7.62 MB,7801,"Spark library for generalized K-Means clustering. Supports general Bregman divergences. Suitable for clustering probabilistic data, time series data, high dimensional data, and very large data.",Scala,https://github.com/derrickburns/generalized-kmeans-clustering
588,case-app,302,45,302,39,23/10/2014,19/05/2025,1.59 MB,1625,Type-level & seamless command-line argument parsing for Scala,Scala,https://github.com/alexarchambault/case-app
589,sagemaker-spark,301,131,301,35,16/11/2017,08/03/2025,1002.00 KB,1002,A Spark library for Amazon SageMaker.,Scala,https://github.com/aws/sagemaker-spark
590,khipu,301,42,301,5,30/07/2018,05/07/2020,2.07 MB,2123,An enterprise blockchain platform based on Ethereum,Scala,https://github.com/khipu-io/khipu
591,Scalala,300,30,300,16,29/06/2009,06/06/2012,26.86 MB,27500,"Scalala has been superseded by dlwh/breeze. Scalala is a high performance numeric linear algebra library for Scala, with rich Matlab-like operators on vectors and matrices; a library of numerical routines; support for plotting.",Scala,https://github.com/scalala/Scalala
592,Scala-Algorithms,298,80,298,2,29/03/2014,12/12/2017,475.00 KB,475,Scala translations of Robert Sedgewick's Java Algorthms,Scala,https://github.com/garyaiki/Scala-Algorithms
593,fs2-kafka,297,105,297,57,15/10/2018,26/05/2025,12.11 MB,12403,Functional Kafka Streams for Scala,Scala,https://github.com/fd4s/fs2-kafka
594,activate,298,46,298,39,05/06/2011,27/02/2016,25.27 MB,25876,Abandoned: Pluggable persistence in Scala,Scala,https://github.com/fwbrasil/activate
595,sbt-ci-release,298,78,298,9,10/06/2018,02/06/2025,1.66 MB,1698,sbt plugin to automate Sonatype releases from GitHub Actions,Scala,https://github.com/sbt/sbt-ci-release
596,cats-retry,298,50,298,21,04/05/2018,27/04/2025,3.82 MB,3911,,Scala,https://github.com/cb372/cats-retry
597,crjdt,297,18,297,7,23/08/2016,21/02/2021,1.54 MB,1582,A conflict-free replicated JSON datatype (CRDT) in Scala,Scala,https://github.com/fthomas/crjdt
598,spark-hbase-connector,297,107,297,38,09/01/2015,19/12/2017,130.00 KB,130,Connect Spark to HBase for reading and writing data with ease,Scala,https://github.com/nerdammer/spark-hbase-connector
599,sirius,296,48,296,28,01/11/2013,28/02/2025,4.91 MB,5030,A distributed system library for managing application reference data,Scala,https://github.com/Comcast/sirius
600,banana-rdf,296,67,296,99,30/04/2012,11/07/2023,5.52 MB,5649,Banana RDF,Scala,https://github.com/banana-rdf/banana-rdf
601,incubator-retired-gearpump,295,91,295,9,13/04/2016,27/08/2018,21.77 MB,22289,Mirror of Apache Gearpump (Incubating),Scala,https://github.com/apache/incubator-retired-gearpump
602,spark-tfrecord,294,56,294,17,07/04/2020,22/04/2024,102.00 KB,102,Read and write Tensorflow TFRecord data from Apache Spark.,Scala,https://github.com/linkedin/spark-tfrecord
603,scalatest-embedded-kafka,294,83,294,18,01/07/2015,12/11/2019,330.00 KB,330,A library that provides an in-memory Kafka instance to run your tests against.,Scala,https://github.com/manub/scalatest-embedded-kafka
604,classic,293,58,293,0,08/12/2009,27/05/2017,3.52 MB,3601,[UNSUPPORTED] Dispatch Classic. See dispatch/reboot for the modern Dispatch for Scala 2.11/2.12,Scala,https://github.com/dispatch/classic
605,rho,293,65,293,128,29/06/2014,02/06/2025,8.98 MB,9193,A self documenting DSL built on http4s,Scala,https://github.com/http4s/rho
606,watchlistarr,292,20,292,48,26/10/2023,23/05/2025,1.23 MB,1261,Customizable sync of Plex Watchlist to Sonarr/Radarr,Scala,https://github.com/nylonee/watchlistarr
607,SwayDB,292,17,292,83,11/02/2018,12/06/2024,20.42 MB,20909,Persistent and in-memory key-value storage engine for JVM that scales on a single machine.,Scala,https://github.com/simerplaha/SwayDB
608,big-data-rosetta-code,292,34,292,15,18/02/2016,31/01/2025,350.00 KB,350,Code snippets for solving common big data problems in various platforms. Inspired by Rosetta Code,Scala,https://github.com/spotify/big-data-rosetta-code
609,udemy-scala-beginners,292,361,292,0,15/09/2021,07/05/2024,36.00 KB,36,,Scala,https://github.com/rockthejvm/udemy-scala-beginners
610,parquet4s,291,67,291,8,26/08/2018,25/05/2025,2.39 MB,2443,Read and write Parquet in Scala. Use Scala classes as schema. No need to start a cluster.,Scala,https://github.com/mjakubowski84/parquet4s
611,scala-at-light-speed,291,351,291,0,12/12/2019,31/05/2024,20.00 KB,20,The repository for the free Scala at Light Speed mini-course,Scala,https://github.com/rockthejvm/scala-at-light-speed
612,sqltyped,291,15,291,5,08/08/2012,19/11/2016,684.00 KB,684,Embedding SQL as an external DSL into Scala,Scala,https://github.com/jonifreeman/sqltyped
613,TIP,290,133,290,5,21/11/2013,05/05/2025,3.41 MB,3493,Static program analysis for TIP,Scala,https://github.com/cs-au-dk/TIP
614,Scalatex,290,38,290,29,19/12/2014,21/02/2020,2.01 MB,2063,"Programmable, Typesafe Document Generation",Scala,https://github.com/lihaoyi/Scalatex
615,sbt-explicit-dependencies,290,25,290,29,06/09/2018,21/08/2024,201.00 KB,201,,Scala,https://github.com/cb372/sbt-explicit-dependencies
616,scaldi,289,26,289,33,17/05/2010,13/08/2024,1.64 MB,1684,Lightweight Scala Dependency Injection Library,Scala,https://github.com/scaldi/scaldi
617,tvm-vta,290,80,290,4,30/03/2020,10/04/2024,1.32 MB,1355,"Open, Modular, Deep Learning Accelerator",Scala,https://github.com/apache/tvm-vta
618,net-monitor,289,22,289,1,19/10/2014,30/11/2014,3.84 MB,3936,"Toolkit for auditing ""phone home"" behavior on Mac OS X Yosemite.",Scala,https://github.com/fix-macosx/net-monitor
619,NaxRiscv,288,43,288,41,04/10/2021,10/03/2025,3.51 MB,3591,,Scala,https://github.com/SpinalHDL/NaxRiscv
620,hamsters,287,23,287,6,18/04/2016,19/12/2020,2.59 MB,2651,A mini Scala utility library,Scala,https://github.com/scala-hamsters/hamsters
621,sjsonnet,287,61,287,23,15/06/2018,06/06/2025,2.07 MB,2123,,Scala,https://github.com/databricks/sjsonnet
622,Vyxal,286,33,286,5,02/04/2020,19/05/2025,67.28 MB,68894,A code-golfing language experience that has aspects of traditional programming languages - terse yet convenient. ,Scala,https://github.com/Vyxal/Vyxal
623,harness,285,50,285,13,16/01/2017,02/02/2022,6.27 MB,6425,Harness is a Machine Learning/AI Server with plugins for many algorithms including the Universal Recommender,Scala,https://github.com/actionml/harness
624,sql-spark-connector,285,126,285,63,02/06/2020,27/02/2025,2.17 MB,2224,Apache Spark Connector for SQL Server and Azure SQL,Scala,https://github.com/microsoft/sql-spark-connector
625,scala-labs,284,162,284,12,24/08/2009,06/08/2023,5.83 MB,5965,A collection of hands-on programming exercises aimed at teaching you to program in Scala,Scala,https://github.com/scala-labs/scala-labs
626,supler,284,21,284,25,20/05/2014,10/11/2015,3.85 MB,3940,Rapid Form Development library. Use your favourite JS frontend & Scala backend frameworks.,Scala,https://github.com/softwaremill/supler
627,nexus,285,76,285,256,12/09/2017,03/06/2025,145.80 MB,149301,Blue Brain Nexus - A knowledge graph for data-driven science,Scala,https://github.com/BlueBrain/nexus
628,spark-druid-olap,282,91,282,0,09/07/2015,03/08/2018,129.89 MB,133004,Sparkline BI Accelerator provides fast ad-hoc query capability over Logical Cubes. This has been folded into our SNAP Platform(http://bit.ly/2oBJSpP) an Integrated BI platform on Apache Spark.,Scala,https://github.com/hbutani/spark-druid-olap
629,mongo-scala-driver,282,147,282,0,05/03/2014,16/07/2024,9.32 MB,9543,Former repository of MongoDB Scala driver. Official Scala driver can now be found here: https://github.com/mongodb/mongo-java-driver,Scala,https://github.com/mongodb/mongo-scala-driver
630,spatial,282,33,282,70,23/03/2018,02/06/2024,100.99 MB,103411,"Spatial: ""Specify Parameterized Accelerators Through Inordinately Abstract Language""",Scala,https://github.com/stanford-ppl/spatial
631,glow,281,116,281,53,04/10/2019,01/06/2025,99.04 MB,101418,An open-source toolkit for large-scale genomic analysis,Scala,https://github.com/projectglow/glow
632,streamz,281,45,281,11,04/06/2014,03/09/2024,2.13 MB,2179,"A combinator library for integrating Functional Streams for Scala (FS2), Akka Streams and Apache Camel",Scala,https://github.com/krasserm/streamz
633,akka-raft,281,42,281,57,17/01/2014,09/08/2016,355.00 KB,355,A toy project implementing RAFT on top of Akka Cluster (not prod ready),Scala,https://github.com/ktoso/akka-raft
634,monadless,280,17,280,16,13/04/2017,12/08/2024,333.00 KB,333,Syntactic sugar for monad composition in Scala,Scala,https://github.com/monadless/monadless
635,jerkson,280,119,280,37,24/11/2010,07/06/2012,674.00 KB,674,[ABANDONED] The Scala applewood bacon to Jackson's chicken breast: JSON cordon bleu.,Scala,https://github.com/codahale/jerkson
636,moe,279,46,279,19,12/01/2013,27/09/2013,6.68 MB,6836,An -OFun prototype of an Ultra Modern Perl 5,Scala,https://github.com/MoeOrganization/moe
637,SparkOnHBase,279,176,279,0,16/12/2014,30/03/2021,738.00 KB,738,SparkOnHBase ,Scala,https://github.com/cloudera-labs/SparkOnHBase
638,typerighter,278,11,278,26,26/10/2018,05/06/2025,31.77 MB,32532,"Even if you’re the right typer, couldn’t hurt to use Typerighter!",Scala,https://github.com/guardian/typerighter
639,scalaprops,278,20,278,10,05/05/2015,02/06/2025,1.92 MB,1963,property based testing library for Scala,Scala,https://github.com/scalaprops/scalaprops
640,swagger-akka-http,278,56,278,15,27/01/2016,17/10/2023,37.67 MB,38575,Support for generating Swagger REST API documentation for Akka-Http based services.,Scala,https://github.com/swagger-akka-http/swagger-akka-http
641,fs2-grpc,278,60,278,14,31/03/2018,04/06/2025,1.15 MB,1178,gRPC implementation for FS2/cats-effect,Scala,https://github.com/typelevel/fs2-grpc
642,gears,277,31,277,10,03/03/2023,04/06/2025,3.94 MB,4032,A strawman for a low-level async library in Scala 3.,Scala,https://github.com/lampepfl/gears
643,translate-bubble-android,277,39,277,5,10/10/2014,08/01/2020,5.05 MB,5174,Translations without interruptions,Scala,https://github.com/xebia-functional/translate-bubble-android
644,boilerplay,276,37,276,0,18/07/2015,02/06/2020,9.40 MB,9623,"Using the latest technology in the Scala ecosystem, Boilerplay is a reactive web application built on Play Framework, ScalaJS, Silhouette, Sangria/GraphQL, and PostgreSQL. It provides a good starting point for whatever you want to build.",Scala,https://github.com/kyleu/boilerplay
645,hbase-rdd,276,114,276,5,04/07/2014,22/01/2021,622.00 KB,622,"Spark RDD to read, write and delete from HBase",Scala,https://github.com/hbase-rdd/hbase-rdd
646,otoroshi,275,43,275,28,27/11/2017,05/06/2025,366.32 MB,375112,Lightweight api management on top of a modern http reverse proxy,Scala,https://github.com/MAIF/otoroshi
647,CT_from_Programmers.scala,275,39,275,6,15/09/2017,29/11/2018,61.00 KB,61,Scala sample code for Bartosz Milewski's CT for Programmers,Scala,https://github.com/typelevel/CT_from_Programmers.scala
648,quizmaster,273,38,273,4,14/10/2019,18/04/2025,7.82 MB,8010,A web-app for conducting a quiz over the internet,Scala,https://github.com/nymanjens/quizmaster
649,akka-analytics,273,36,273,0,29/07/2014,18/06/2016,48.00 KB,48,Large-scale event processing with Akka Persistence and Apache Spark,Scala,https://github.com/krasserm/akka-analytics
650,t1,271,38,271,43,18/09/2022,05/06/2025,25.62 MB,26234,The highest performace Cray-like RISC-V Vector in the world. ,Scala,https://github.com/chipsalliance/t1
651,spark-essentials,271,363,271,1,25/10/2019,10/02/2025,7.91 MB,8097,The official repository for the Rock the JVM Spark Essentials with Scala course,Scala,https://github.com/rockthejvm/spark-essentials
652,scala-dist,271,228,271,2,13/03/2011,13/05/2025,34.57 MB,35399,sbt project that packages the Scala 2 distribution,Scala,https://github.com/scala/scala-dist
653,first-edition,271,189,271,4,25/03/2015,01/07/2017,8.10 MB,8292,The book's repo,Scala,https://github.com/spark-in-action/first-edition
654,recheck,269,13,269,22,24/10/2020,06/06/2025,8.36 MB,8556,The trustworthy ReDoS checker,Scala,https://github.com/makenowjust-labs/recheck
655,zio-actors,269,56,269,41,08/07/2018,20/08/2024,1.87 MB,1912,"A high-performance, purely-functional library for building, composing, and supervising typed actors based on ZIO",Scala,https://github.com/zio-archive/zio-actors
656,sbt-dependency-check,269,43,269,14,12/01/2016,21/08/2024,5.19 MB,5318,SBT Plugin for OWASP DependencyCheck. Monitor your dependencies and report if there are any publicly known vulnerabilities (e.g. CVEs). :rainbow:,Scala,https://github.com/albuch/sbt-dependency-check
657,incubator-s2graph,269,65,269,17,08/01/2016,28/05/2020,14.10 MB,14439,Mirror of Apache S2Graph (Incubating),Scala,https://github.com/apache/incubator-s2graph
658,linter,268,34,268,22,23/03/2013,10/07/2018,2.11 MB,2164,Static Analysis Compiler Plugin for Scala,Scala,https://github.com/HairyFotr/linter
659,overview-server,268,37,268,84,18/05/2012,07/01/2023,51.12 MB,52342,Open source large document set visualization platform,Scala,https://github.com/overview/overview-server
660,zio-grpc,267,83,267,51,30/01/2020,09/05/2025,8.12 MB,8318,ScalaPB meets ZIO: write purely functional gRPC services and clients using ZIO,Scala,https://github.com/scalapb/zio-grpc
661,debox,267,20,267,13,16/05/2012,08/07/2021,258.00 KB,258,"Fast, deboxed, specialized data structures for Scala",Scala,https://github.com/non/debox
662,henkan,267,10,267,5,17/01/2016,18/10/2023,218.00 KB,218,A small library for converting between case classes.,Scala,https://github.com/kailuowang/henkan
663,riff-raff,267,18,267,18,19/08/2011,04/06/2025,14.51 MB,14854,The Guardian's deployment platform,Scala,https://github.com/guardian/riff-raff
664,sbt-onejar,266,43,266,22,22/01/2011,22/01/2019,185.00 KB,185,Packages your project using One-JAR™,Scala,https://github.com/sbt/sbt-onejar
665,spark-atlas-connector,266,150,266,52,21/11/2017,16/11/2022,925.00 KB,925,A Spark Atlas connector to track data lineage in Apache Atlas,Scala,https://github.com/hortonworks-spark/spark-atlas-connector
666,Scurses,266,26,266,7,04/11/2015,19/12/2021,169.00 KB,169,"Scurses, terminal drawing API for Scala, and Onions, a Scurses framework for easy terminal UI",Scala,https://github.com/Tenchi2xh/Scurses
667,scaffeine,265,26,265,12,05/03/2016,01/03/2025,723.00 KB,723,Thin Scala wrapper for Caffeine (https://github.com/ben-manes/caffeine),Scala,https://github.com/blemale/scaffeine
668,BIDMat,265,73,265,23,17/10/2012,25/02/2021,6.90 MB,7066,A CPU and GPU-accelerated matrix library for data mining,Scala,https://github.com/BIDData/BIDMat
669,scala-time,265,55,265,19,24/04/2009,11/07/2013,207.00 KB,207,A Scala wrapper for Joda Time,Scala,https://github.com/jorgeortiz85/scala-time
670,ScienceWorld,264,28,264,13,04/03/2022,16/05/2025,82.50 MB,84478,ScienceWorld is a text-based virtual environment centered around accomplishing tasks from the standardized elementary science curriculum.,Scala,https://github.com/allenai/ScienceWorld
671,scala-hedgehog,264,24,264,16,15/03/2017,05/04/2025,6.88 MB,7044,"Release with confidence, state-of-the-art property testing for Scala.",Scala,https://github.com/hedgehogqa/scala-hedgehog
672,LayIM,264,157,264,2,28/11/2016,26/08/2017,19.09 MB,19546,基于HTML5 WebSocket的一款IM即时通讯软件，使用Gradle集成了Scala、SpringBoot、Spring MVC、Mybatis、Redis等，前端使用了LayIm框架,Scala,https://github.com/scalad/LayIM
673,probability-monad,263,38,263,0,31/12/2011,18/05/2022,111.00 KB,111,,Scala,https://github.com/jliszka/probability-monad
674,facto,263,3,263,6,16/03/2015,30/05/2025,6.84 MB,7007,Family Accounting Tool,Scala,https://github.com/nymanjens/facto
675,millfork,263,20,263,25,06/12/2017,15/08/2023,3.92 MB,4018,Millfork: a middle-level programming language targeting 6502- and Z80-based microcomputers and home consoles,Scala,https://github.com/KarolS/millfork
676,scanns,262,65,262,7,01/02/2018,29/03/2019,503.00 KB,503,A scalable nearest neighbor search library in Apache Spark ,Scala,https://github.com/LinkedInAttic/scanns
677,scala-uri,261,33,261,9,17/11/2012,01/04/2020,388.00 KB,388,Simple scala library for building and parsing URIs,Scala,https://github.com/NET-A-PORTER/scala-uri
678,reactors,261,32,261,3,13/12/2013,03/02/2018,10.36 MB,10609,A foundational framework for distributed programming.,Scala,https://github.com/reactors-io/reactors
679,sample-applications,261,132,261,8,29/10/2012,18/01/2021,385.00 KB,385,Sample applications that go with the book Play for Scala,Scala,https://github.com/playforscala/sample-applications
680,clump,260,16,260,1,02/12/2014,07/11/2022,636.00 KB,636,A library for expressive and efficient service composition,Scala,https://github.com/getclump/clump
681,chalk,259,48,259,7,02/12/2012,30/01/2017,5.14 MB,5268,Chalk is a natural language processing library.,Scala,https://github.com/scalanlp/chalk
682,curryhoward,258,16,258,5,12/12/2017,25/05/2025,438.00 KB,438,Automatic code generation for Scala functions and expressions via the Curry-Howard isomorphism,Scala,https://github.com/Chymyst/curryhoward
683,bugatti,257,128,257,5,25/03/2015,13/05/2015,4.87 MB,4991,运维自动化部署监控平台,Scala,https://github.com/QianmiOpen/bugatti
684,each,257,26,257,20,05/05/2015,19/08/2024,622.00 KB,622,A macro library that converts native imperative syntax to scalaz's monadic expressions,Scala,https://github.com/ThoughtWorksInc/each
685,gazelle_plugin,257,75,257,215,28/12/2020,21/02/2023,36.57 MB,37451,Native SQL Engine plugin for Spark SQL with vectorized SIMD optimizations.,Scala,https://github.com/oap-project/gazelle_plugin
686,nexus,257,16,257,21,30/05/2017,12/09/2019,3.45 MB,3532,Experimental tensor-typed deep learning ,Scala,https://github.com/ctongfei/nexus
687,twitter4s,256,96,256,46,06/09/2015,10/03/2023,11.90 MB,12184,An asynchronous non-blocking Scala client for both the Twitter Rest and Streaming API,Scala,https://github.com/DanielaSfregola/twitter4s
688,potigol,256,32,256,37,14/02/2012,05/06/2024,23.95 MB,24525,Linguagem Potigol - Linguagem de programação funcional moderna para iniciantes - A Functional Programming Language for Beginners,Scala,https://github.com/potigol/potigol
689,scalismo,256,65,256,11,13/02/2015,24/06/2024,142.98 MB,146407,Scalable Image Analysis and Shape Modelling,Scala,https://github.com/unibas-gravis/scalismo
690,Airstream,256,30,256,21,13/04/2018,29/04/2025,1.73 MB,1775,State propagation and event streams with mandatory ownership and no glitches,Scala,https://github.com/raquo/Airstream
691,fsqio,255,53,255,21,17/12/2015,30/07/2024,13.55 MB,13878,A monorepo that holds all of Foursquare's opensource projects,Scala,https://github.com/foursquare/fsqio
692,sbt-scalariform,255,63,255,8,04/10/2012,29/06/2019,137.00 KB,137,sbt plugin adding support for source code formatting using Scalariform,Scala,https://github.com/sbt/sbt-scalariform
693,socko,255,51,255,15,29/03/2012,22/09/2023,9.76 MB,9994,A Scala web server powered by Netty networking and AKKA processing.,Scala,https://github.com/mashupbots/socko
694,sbt-native-image,255,24,255,28,29/08/2020,20/04/2024,112.00 KB,112,Plugin to generate native-image binaries with sbt,Scala,https://github.com/scalameta/sbt-native-image
695,silencer,254,33,254,7,10/04/2015,17/01/2025,207.00 KB,207,Scala compiler plugin for warning suppression,Scala,https://github.com/ghik/silencer
696,scala-ts,254,36,254,6,12/06/2016,04/06/2025,9.90 MB,10140,:wrench: Scala datamodel transpiler,Scala,https://github.com/scala-ts/scala-ts
697,zio-todo-backend,254,48,254,2,19/03/2019,06/06/2025,550.00 KB,550,"Todo-Backend (https://www.todobackend.com/) implementation using ZIO, http4s, doobie and circe",Scala,https://github.com/mschuwalow/zio-todo-backend
698,AlbedoMM,254,35,254,3,11/03/2020,19/06/2020,4.43 MB,4533,Albedo Morphable Model,Scala,https://github.com/waps101/AlbedoMM
699,Dsl.scala,254,29,254,26,14/10/2017,05/01/2025,4.41 MB,4515,A framework to create embedded Domain-Specific Languages in Scala,Scala,https://github.com/ThoughtWorksInc/Dsl.scala
700,spray-socketio,254,55,254,8,22/01/2014,28/11/2017,914.00 KB,914,socket.io for spray,Scala,https://github.com/dcaoyuan/spray-socketio
701,akka-http-cors,253,38,253,17,17/02/2016,12/08/2024,692.00 KB,692,Akka Http directives implementing the CORS specifications defined by W3C,Scala,https://github.com/lomigmegard/akka-http-cors
702,dragos-vscode-scala,253,39,253,31,08/08/2016,08/06/2023,351.00 KB,351,,Scala,https://github.com/dragos/dragos-vscode-scala
703,akka-management,252,160,252,113,09/11/2016,15/05/2025,17.07 MB,17475,Akka Management is a suite of tools for operating Akka Clusters.,Scala,https://github.com/akka/akka-management
704,magnum,252,19,252,20,07/02/2023,23/05/2025,1.45 MB,1480,A 'new look' for database access in Scala,Scala,https://github.com/AugustNagro/magnum
705,bazel-deps,252,121,252,102,15/06/2016,04/06/2024,979.00 KB,979,Generate bazel dependencies for maven artifacts ,Scala,https://github.com/bazeltools/bazel-deps
706,zio-magic,252,19,252,21,17/01/2021,22/01/2024,300.00 KB,300,Construct ZLayers automagically (w/ helpful compile-time errors),Scala,https://github.com/kitlangton/zio-magic
707,scalajs-angular,252,42,252,18,20/07/2014,18/01/2021,360.00 KB,360,AngularJS Binding for Scala.js,Scala,https://github.com/greencatsoft/scalajs-angular
708,scala-stm,252,41,252,9,08/07/2010,14/04/2023,9.05 MB,9264,"A library-based Software Transactional Memory (STM) for Scala, coupled with transactional sets and maps",Scala,https://github.com/nbronson/scala-stm
709,acyclic,251,35,251,10,16/02/2014,08/03/2025,506.00 KB,506,Acyclic is a Scala compiler plugin to let you prohibit circular dependencies between files,Scala,https://github.com/com-lihaoyi/acyclic
710,contextual,251,23,251,5,24/11/2016,26/01/2025,4.77 MB,4886,Statically-checked string interpolation in Scala,Scala,https://github.com/propensive/contextual
711,spark-indexedrdd,251,78,251,21,10/12/2014,11/03/2017,103.00 KB,103,An efficient updatable key-value store for Apache Spark,Scala,https://github.com/amplab/spark-indexedrdd
712,ScalaCL,250,20,250,16,12/02/2013,11/08/2015,8.70 MB,8909,ScalaCL - run Scala on your GPU!,Scala,https://github.com/nativelibs4java/ScalaCL
713,play-mailer,250,75,250,19,29/10/2014,09/05/2025,1007.00 KB,1007,Play mailer plugin,Scala,https://github.com/playframework/play-mailer
714,spark-libFM,250,119,250,15,20/04/2015,13/08/2018,46.00 KB,46,An implement of Factorization Machines (LibFM),Scala,https://github.com/zhengruifeng/spark-libFM
715,puck,250,29,250,1,18/04/2013,01/11/2014,80.38 MB,82313,Puck is a lightning-fast parser for natural languages using GPUs,Scala,https://github.com/dlwh/puck
716,silk,249,61,249,64,13/02/2014,05/06/2025,96.59 MB,98909,Silk Linked Data Integration Framework,Scala,https://github.com/silk-framework/silk
717,s2graph,249,32,249,33,04/05/2015,25/03/2016,10.15 MB,10391,"This code base is retained for historical interest only, please visit Apache Incubator Repo for latest one ",Scala,https://github.com/kakao/s2graph
718,ScalaStorm,249,50,249,5,07/10/2011,06/09/2016,131.00 KB,131,Harness the power and elegance of Scala with nathanmarz's Storm real-time system,Scala,https://github.com/velvia/ScalaStorm
719,Netflix-Recommender-with-Spark,249,107,249,3,23/04/2016,21/03/2017,792.00 KB,792,基于Apache Spark的Netflix电影的离线与实时推荐系统,Scala,https://github.com/LeechanX/Netflix-Recommender-with-Spark
720,paradox,248,76,248,80,12/08/2016,15/05/2025,2.65 MB,2716,Markdown documentation,Scala,https://github.com/lightbend/paradox
721,chaos,248,36,248,12,25/06/2013,15/04/2019,232.00 KB,232,A lightweight framework for writing REST services in Scala.,Scala,https://github.com/d2iq-archive/chaos
722,isolation-forest,247,50,247,2,26/07/2019,27/03/2025,2.10 MB,2149,"A distributed Spark/Scala implementation of the isolation forest algorithm for unsupervised outlier detection, featuring support for scalable training and ONNX export for easy cross-platform inference.",Scala,https://github.com/linkedin/isolation-forest
723,Apache-Kafka-poc-and-notes,247,93,247,1,05/08/2016,07/10/2019,22.30 MB,22836,,Scala,https://github.com/vaquarkhan/Apache-Kafka-poc-and-notes
724,slick-joda-mapper,246,46,246,24,23/03/2013,05/02/2025,580.00 KB,580,Slick with JodaTime,Scala,https://github.com/tototoshi/slick-joda-mapper
