Ranking,Project Name,Stars,Forks,Watchers,Open Issues,Created At,Last Commit,Size,Size (KB),Description,Language,Repo URL
286,blinkdb,659,122,659,9,07/10/2011,06/02/2014,309.50 MB,316928,BlinkDB: Sub-Second Approximate Queries on Very Large Data.,Scala,https://github.com/sameeragarwal/blinkdb
287,kafka-lag-exporter,659,200,659,77,26/11/2018,28/02/2024,2.55 MB,2611,Monitor Kafka Consumer Group Latency with Kafka Lag Exporter,Scala,https://github.com/seglo/kafka-lag-exporter
288,bijection,657,123,657,52,30/12/2012,22/11/2024,2.43 MB,2484,Reversible conversions between types,Scala,https://github.com/twitter/bijection
289,decline,657,72,657,37,23/10/2016,11/05/2025,2.92 MB,2990,A composable command-line parser for Scala.,Scala,https://github.com/bkirwi/decline
290,reference-apps,656,343,656,33,19/08/2014,03/10/2024,5.95 MB,6097,Spark reference applications,Scala,https://github.com/databricks/reference-apps
291,programming-scala-book-code-examples,653,408,653,0,20/06/2014,05/06/2025,24.49 MB,25073,"The code examples used in Programming Scala, 2nd and 3rd Editions (O'Reilly)",Scala,https://github.com/deanwampler/programming-scala-book-code-examples
292,sbt-release,652,161,652,88,15/10/2011,03/06/2025,451.00 KB,451,A release plugin for sbt,Scala,https://github.com/sbt/sbt-release
293,sbt-scoverage,652,159,652,43,16/05/2014,20/03/2025,608.00 KB,608,sbt plugin for scoverage,Scala,https://github.com/scoverage/sbt-scoverage
294,codebrag,649,96,649,68,12/03/2013,09/07/2018,14.84 MB,15201,Your daily code review tool,Scala,https://github.com/softwaremill/codebrag
295,testcontainers-scala,648,129,648,39,16/01/2017,26/05/2025,1.71 MB,1748,Docker containers for testing in scala,Scala,https://github.com/testcontainers/testcontainers-scala
296,airframe,643,69,643,109,14/08/2016,05/06/2025,157.39 MB,161169,Essential Building Blocks for Scala,Scala,https://github.com/wvlet/airframe
297,diode,642,88,642,14,18/11/2015,07/12/2024,5.00 MB,5117,Scala library for managing immutable application model,Scala,https://github.com/suzaku-io/diode
298,trading,638,74,638,19,17/09/2021,01/06/2025,24.12 MB,24701,💱 Trading application written in Scala 3 that showcases an Event-Driven Architecture (EDA) and Functional Programming (FP),Scala,https://github.com/gvolpe/trading
299,sri,634,35,634,8,29/07/2015,05/04/2017,39.98 MB,40944,"Build truly native cross platform (web,ios,android) apps using scalajs and react, react-native ,This project moved to new organization : https://github.com/scalajs-react-interface/sri#sri, new chat room :  https://gitter.im/scalajs-react-interface/sri",Scala,https://github.com/chandu0101/sri
300,open-korean-text,629,98,629,11,24/01/2017,12/03/2024,33.49 MB,34294,Open Korean Text Processor - An Open-source Korean Text Processor,Scala,https://github.com/open-korean-text/open-korean-text
301,spline,627,159,627,48,30/05/2017,05/06/2025,8.58 MB,8789,Data Lineage Tracking And Visualization Solution,Scala,https://github.com/AbsaOSS/spline
302,izumi,624,68,624,62,03/11/2017,05/06/2025,18.48 MB,18926,Productivity-oriented collection of lightweight fancy stuff for Scala toolchain,Scala,https://github.com/7mind/izumi
303,vamp,623,55,623,106,29/03/2015,21/04/2020,6.53 MB,6690,Vamp - canary releasing and autoscaling for microservice systems,Scala,https://github.com/magneticio/vamp
304,PkpmSpark,619,1,619,1,23/10/2019,17/06/2022,57.00 KB,57,awesome 三维数据挖掘 数据分析 & 推荐,Scala,https://github.com/MethodJiao/PkpmSpark
305,chill,615,154,615,75,15/10/2012,19/08/2024,1.22 MB,1254,Scala extensions for the Kryo serialization library,Scala,https://github.com/twitter/chill
306,freestyle,614,50,614,34,19/10/2016,13/08/2019,8.74 MB,8946,A cohesive & pragmatic framework of FP centric Scala libraries,Scala,https://github.com/frees-io/freestyle
307,learn-fp,610,124,610,0,05/12/2017,07/02/2020,1.22 MB,1249,learn-by-doing course/tutorial for functional programming on scala,Scala,https://github.com/dehun/learn-fp
308,scalate,607,104,607,37,27/01/2010,31/05/2025,51.20 MB,52425,"Scalate is a Scala based template engine which supports HAML, Mustache and JSP, Erb and Velocity style syntaxes.",Scala,https://github.com/scalate/scalate
309,spark-redshift,607,348,607,150,13/11/2014,10/08/2023,796.00 KB,796,Redshift data source for Apache Spark,Scala,https://github.com/databricks/spark-redshift
310,play2-auth,606,137,606,23,23/04/2012,10/09/2019,564.00 KB,564,Play2.x Authentication and Authorization module,Scala,https://github.com/t2v/play2-auth
311,SparkNet,604,172,604,30,16/11/2015,23/07/2020,7.49 MB,7668,Distributed Neural Networks for Spark,Scala,https://github.com/amplab/SparkNet
312,simple-docker-ui,604,95,604,20,11/04/2015,06/09/2024,1.90 MB,1944,Native Docker UI implemented using Scala.js and React - DEPRECATED,Scala,https://github.com/felixgborrego/simple-docker-ui
313,scala-cli,602,145,602,317,10/05/2021,05/06/2025,100.88 MB,103298,"Scala CLI is a command-line tool to interact with the Scala language. It lets you compile, run, test, and package your Scala code (and more!)",Scala,https://github.com/VirtusLab/scala-cli
314,SparkLearning,602,315,602,3,30/03/2016,04/11/2021,405.10 MB,414822,"Learning Apache spark,including code and data .Most part can run local.",Scala,https://github.com/xubo245/SparkLearning
315,spark-sql-perf,601,409,601,55,15/04/2015,26/02/2022,577.00 KB,577,,Scala,https://github.com/databricks/spark-sql-perf
316,scalatron,597,175,597,31,25/04/2012,19/08/2022,5.63 MB,5768,"Scalatron, a multi-player programming game in which coders pit bot programs (written in Scala) against each other",Scala,https://github.com/scalatron/scalatron
317,akka-http-json,592,134,592,41,27/02/2015,30/07/2024,704.00 KB,704,Integrate some of the best JSON libs in Scala with Akka HTTP,Scala,https://github.com/hseeberger/akka-http-json
318,reftree,589,36,589,5,23/02/2016,18/08/2024,244.95 MB,250827,Automatically generated diagrams and animations for Scala data structures,Scala,https://github.com/stanch/reftree
319,eff,587,79,587,3,04/01/2016,31/05/2025,3.74 MB,3833,Eff monad for cats - https://atnos-org.github.io/eff,Scala,https://github.com/atnos-org/eff
320,metorikku,586,160,586,65,10/10/2017,24/01/2024,4.30 MB,4405,"A simplified, lightweight ETL Framework based on Apache Spark",Scala,https://github.com/YotpoLtd/metorikku
321,kaitai_struct_compiler,586,164,586,61,21/02/2016,05/06/2025,4.94 MB,5061,Kaitai Struct: compiler to translate .ksy => .cpp / .cs / .dot / .go / .java / .js / .lua / .nim / .php / .pm / .py / .rb,Scala,https://github.com/kaitai-io/kaitai_struct_compiler
322,squeryl,583,139,583,39,30/01/2010,30/05/2025,12.30 MB,12592,A Scala DSL for talking with databases with minimum verbosity and maximum type safety,Scala,https://github.com/squeryl/squeryl
323,riscv-mini,578,120,578,8,28/09/2016,09/08/2024,1.33 MB,1359,Simple RISC-V 3-stage Pipeline in Chisel,Scala,https://github.com/ucb-bar/riscv-mini
324,korolev,578,50,578,16,10/08/2016,13/08/2023,2.93 MB,3004,Single Page Applications running on the server side.,Scala,https://github.com/fomkin/korolev
325,tut,578,63,578,64,25/10/2013,12/04/2021,2.08 MB,2135,doc/tutorial generator for scala,Scala,https://github.com/tpolecat/tut
326,sparklens,577,142,577,51,16/03/2018,26/06/2024,179.00 KB,179,Qubole Sparklens tool for performance tuning Apache Spark,Scala,https://github.com/qubole/sparklens
327,scala-graph,574,74,574,9,29/01/2013,26/03/2025,3.01 MB,3081,"Graph for Scala is intended to provide basic graph functionality seamlessly fitting into the Scala Collection Library. Like the well known members of scala.collection, Graph for Scala is an in-memory graph library aiming at editing and traversing graphs, finding cycles etc. in a user-friendly way.",Scala,https://github.com/scala-graph/scala-graph
328,collins,573,99,573,68,31/07/2012,01/03/2021,218.82 MB,224075,groovy kind of love,Scala,https://github.com/tumblr/collins
329,apibuilder,569,84,569,85,06/04/2014,14/02/2025,12.83 MB,13135,"Simple, Comprehensive Tooling for Modern APIs",Scala,https://github.com/apicollective/apibuilder
330,edda,568,133,568,10,18/08/2012,19/01/2024,3.10 MB,3172,AWS API Read Cache,Scala,https://github.com/Netflix/edda
331,scalapy,567,45,567,42,31/12/2016,27/09/2024,1.19 MB,1219,Use the world of Python from the comfort of Scala!,Scala,https://github.com/scalapy/scalapy
332,spark-scala-examples,564,554,564,9,26/11/2019,20/03/2024,3.36 MB,3445,"This project provides Apache Spark SQL, RDD, DataFrame and Dataset examples in Scala language",Scala,https://github.com/spark-examples/spark-scala-examples
333,cask,563,64,563,11,20/07/2018,30/05/2025,870.00 KB,870,"Cask: a Scala HTTP micro-framework. Cask makes it easy to set up a website, backend server, or REST API using Scala",Scala,https://github.com/com-lihaoyi/cask
334,cats-collections,560,99,560,15,19/09/2015,03/06/2025,2.73 MB,2798,Data structures for pure functional programming in Scala,Scala,https://github.com/typelevel/cats-collections
335,akka-quartz-scheduler,558,114,558,10,13/04/2013,27/11/2023,224.00 KB,224,Quartz Extension and utilities for cron-style scheduling in Akka,Scala,https://github.com/enragedginger/akka-quartz-scheduler
336,twirl,557,113,557,39,22/09/2013,05/06/2025,2.30 MB,2360,Twirl is Play's default template engine,Scala,https://github.com/playframework/twirl
337,sbt-buildinfo,554,91,554,12,03/03/2012,13/03/2025,424.00 KB,424,I know this because build.sbt knows this.,Scala,https://github.com/sbt/sbt-buildinfo
338,shc,554,279,554,164,01/10/2015,10/05/2021,583.00 KB,583,The Apache Spark - Apache HBase Connector is a library to support Spark accessing HBase table as external data source or sink. ,Scala,https://github.com/hortonworks-spark/shc
339,aprsdroid,553,114,553,202,05/01/2010,07/02/2025,6.60 MB,6762,APRSdroid - Geo-Location for Radio Amateurs,Scala,https://github.com/ge0rg/aprsdroid
340,factorie,552,145,552,26,25/06/2013,19/12/2017,44.96 MB,46039,"FACTORIE is a toolkit for deployable probabilistic modeling, implemented as a software library in Scala. It provides its users with a succinct language for creating relational factor graphs, estimating parameters and performing inference.",Scala,https://github.com/factorie/factorie
341,rudder,551,82,551,36,06/10/2011,05/06/2025,87.09 MB,89176,"Rudder is a configuration and security automation platform. Manage your Cloud, hybrid or on-premises infrastructure in a simple, scalable and dynamic way.",Scala,https://github.com/Normation/rudder
342,scala-arm,548,51,548,15,27/09/2009,26/10/2020,570.00 KB,570,This project aims to be the Scala Incubator project for Automatic-Resource-Management in the scala library,Scala,https://github.com/jsuereth/scala-arm
343,argonaut,546,108,546,30,09/12/2012,03/06/2025,13.46 MB,13782,Purely functional JSON parser and library in scala.,Scala,https://github.com/argonaut-io/argonaut
344,Scorex,544,116,544,48,28/06/2016,13/04/2022,11.63 MB,11910,Scorex 2.0 Core,Scala,https://github.com/hyperledger-labs/Scorex
345,tofu,543,97,543,45,04/04/2019,03/06/2025,24.71 MB,25300,Functional programming toolbox ,Scala,https://github.com/tofu-tf/tofu
346,kittens,542,67,542,7,09/07/2015,03/06/2025,1.33 MB,1367,Automatic type class derivation for Cats,Scala,https://github.com/typelevel/kittens
347,scala-newtype,542,31,542,25,05/05/2017,10/02/2022,159.00 KB,159,NewTypes for Scala with no runtime overhead,Scala,https://github.com/estatico/scala-newtype
348,scapegoat,541,94,541,55,21/11/2013,29/05/2025,2.36 MB,2412,Scala compiler plugin for static code analysis,Scala,https://github.com/scapegoat-scala/scapegoat
349,pfps-shopping-cart,541,168,541,36,03/10/2019,25/05/2025,1.67 MB,1710,":shopping_cart: The Shopping Cart application developed in the book ""Practical FP in Scala: A hands-on approach""",Scala,https://github.com/gvolpe/pfps-shopping-cart
350,spark-avro,538,307,538,77,30/09/2014,19/12/2018,405.00 KB,405,Avro Data Source for Apache Spark,Scala,https://github.com/databricks/spark-avro
351,scalamock,537,107,537,8,24/10/2011,04/06/2025,8.11 MB,8309,Native Scala mocking framework,Scala,https://github.com/scalamock/scalamock
352,scala-oauth2-provider,536,98,536,4,17/09/2013,04/12/2023,347.00 KB,347,OAuth 2.0 server-side implementation written in Scala,Scala,https://github.com/nulab/scala-oauth2-provider
353,guardrail,534,134,534,193,01/09/2017,01/10/2024,12.99 MB,13297,Principled code generation from OpenAPI specifications,Scala,https://github.com/guardrail-dev/guardrail
354,magellan,533,149,533,75,01/06/2015,26/08/2021,13.32 MB,13643,Geo Spatial Data Analytics on Spark,Scala,https://github.com/harsha2010/magellan
355,piflow,532,173,532,32,03/05/2018,06/12/2024,135.25 MB,138500,πflow is a big data flow engine with spark support,Scala,https://github.com/cas-bigdatalab/piflow
356,scala-offheap,531,35,531,15,08/10/2014,08/04/2019,7.71 MB,7897,Experimental type-safe off-heap memory for Scala.,Scala,https://github.com/densh/scala-offheap
357,sourcecode,530,76,530,37,26/01/2016,30/05/2025,485.00 KB,485,"Scala library providing ""source"" metadata to your program, similar to Python's __name__, C++'s __LINE__ or Ruby's __FILE__. ",Scala,https://github.com/com-lihaoyi/sourcecode
358,scribe,529,44,529,23,26/01/2016,03/06/2025,2.75 MB,2814,The fastest logging library in the world. Built from scratch in Scala and programmatically configurable.,Scala,https://github.com/outr/scribe
359,accord,529,48,529,24,13/11/2013,23/11/2022,1.55 MB,1584,Accord: A sane validation library for Scala,Scala,https://github.com/wix-incubator/accord
360,macroid,529,37,529,26,24/07/2013,30/09/2017,13.07 MB,13387,A modular functional UI language for Android,Scala,https://github.com/xebia-functional/macroid
361,sparta,526,196,526,8,04/02/2015,24/10/2019,125.86 MB,128883,Real Time Analytics and Data Pipelines based on Spark Streaming,Scala,https://github.com/Stratio/sparta
362,orbeon-forms,526,218,526,1891,20/07/2009,05/06/2025,705.64 MB,722574,"Orbeon Forms is an open source web forms solution. It includes an XForms engine, the Form Builder web-based form editor, and the Form Runner runtime.",Scala,https://github.com/orbeon/orbeon-forms
363,eqwalizer,526,31,526,9,22/06/2022,03/06/2025,2.06 MB,2105,A type-checker for Erlang,Scala,https://github.com/WhatsApp/eqwalizer
364,greyhound,525,39,525,38,12/01/2020,05/10/2023,3.41 MB,3487,Greyhound - Rich Kafka client library,Scala,https://github.com/wix/greyhound
365,eventsim,523,137,523,5,05/09/2014,16/03/2022,83.62 MB,85628,"Event data simulator. Generates a stream of pseudo-random events from a set of users, designed to simulate web traffic.",Scala,https://github.com/Interana/eventsim
366,scalariform,522,147,522,67,10/04/2010,11/05/2024,11.12 MB,11389,Scala source code formatter,Scala,https://github.com/scala-ide/scalariform
367,tranquility,516,230,516,103,13/02/2014,13/01/2020,1.03 MB,1053,"Tranquility helps you send real-time event streams to Druid and handles partitioning, replication, service discovery, and schema rollover, seamlessly and without downtime.",Scala,https://github.com/druid-io/tranquility
368,iron,516,56,516,5,13/01/2021,03/06/2025,1.50 MB,1540,Strong type constraints for Scala,Scala,https://github.com/Iltotore/iron
369,curiodb,512,47,512,5,26/04/2015,04/11/2018,1.19 MB,1216,Distributed NoSQL Database,Scala,https://github.com/stephenmcd/curiodb
370,casbah,512,130,512,7,29/10/2010,20/01/2022,33.67 MB,34479,Casbah is now officially end-of-life (EOL).,Scala,https://github.com/mongodb/casbah
371,scalameter,511,72,511,50,18/11/2012,22/08/2022,16.53 MB,16931,Microbenchmarking and performance regression testing framework for the JVM platform.,Scala,https://github.com/scalameter/scalameter
372,spark-xml,510,227,510,0,26/11/2015,11/08/2024,912.00 KB,912,XML data source for Spark SQL and DataFrames,Scala,https://github.com/databricks/spark-xml
373,codepropertygraph,511,78,511,27,28/06/2018,27/05/2025,9.30 MB,9519,"Code Property Graph: specification, query language, and utilities",Scala,https://github.com/ShiftLeftSecurity/codepropertygraph
374,high-performance-spark-examples,510,235,510,11,06/10/2015,03/11/2024,1.59 MB,1630,Examples for High Performance Spark,Scala,https://github.com/high-performance-spark/high-performance-spark-examples
375,java-webauthn-server,508,154,508,18,08/05/2018,04/06/2025,9.29 MB,9510,Server-side Web Authentication library for Java https://www.w3.org/TR/webauthn/#rp-operations,Scala,https://github.com/Yubico/java-webauthn-server
376,PortEx,507,87,507,0,27/09/2013,02/04/2025,225.99 MB,231415,Java library to analyse Portable Executable files with a special focus on malware analysis and PE malformation robustness,Scala,https://github.com/struppigel/PortEx
377,Antox,506,180,506,20,30/01/2014,18/04/2017,17.58 MB,18001,Scala android client for Project Tox - secure p2p messaging,Scala,https://github.com/markwinter/Antox
378,HashtagCashtag,506,128,506,2,25/01/2015,24/08/2022,20.47 MB,20960,"My Insight Data Engineering Fellowship project. I implemented a big data processing pipeline based on ​lambda architecture​, that aggregates Twitter and US stock market data for user sentiment analysis using open source tools - ​Apache Kafka ​for data ingestions, Apache Spark ​& ​Spark Streaming ​for batch & real-time processing, ​Apache Cassandra f​ or storage, ​Flask​, ​Bootstrap and ​HighCharts f​ or frontend.",Scala,https://github.com/shafiab/HashtagCashtag
379,ergo,504,176,504,200,13/06/2017,05/06/2025,65.60 MB,67173,Ergo protocol description & reference client implementation,Scala,https://github.com/ergoplatform/ergo
380,jackson-module-scala,504,143,504,51,29/11/2010,05/06/2025,20.13 MB,20614,Add-on module for Jackson (https://github.com/FasterXML/jackson) to support Scala-specific datatypes,Scala,https://github.com/FasterXML/jackson-module-scala
381,sbt-pack,497,76,497,35,19/11/2012,03/06/2025,1.96 MB,2006,A sbt plugin for creating distributable Scala packages.,Scala,https://github.com/xerial/sbt-pack
382,fetch,495,50,495,14,04/03/2016,02/06/2025,4.41 MB,4518,Simple & Efficient data access for Scala and Scala.js,Scala,https://github.com/xebia-functional/fetch
383,spark-excel,496,154,496,97,03/09/2016,22/05/2025,1.42 MB,1451,A Spark plugin for reading and writing Excel files,Scala,https://github.com/nightscape/spark-excel
384,scala-ide,496,307,496,2,04/10/2011,25/01/2023,142.56 MB,145981,Scala IDE for Eclipse,Scala,https://github.com/scala-ide/scala-ide
385,utest,495,86,495,38,27/01/2014,30/05/2025,1.83 MB,1875,A simple testing framework for Scala,Scala,https://github.com/com-lihaoyi/utest
386,streamDM,494,141,494,4,08/06/2015,16/04/2023,3.22 MB,3295,Stream Data Mining Library for Spark Streaming,Scala,https://github.com/huawei-noah/streamDM
387,build-server-protocol,489,66,489,38,10/01/2018,15/12/2024,8.90 MB,9113,"Protocol for IDEs and build tools to communicate about compile, run, test, debug and more.",Scala,https://github.com/build-server-protocol/build-server-protocol
388,cbt,489,59,489,224,29/09/2015,28/05/2018,1.34 MB,1371,"CBT - fun, fast, intuitive, compositional, statically checked builds written in Scala",Scala,https://github.com/cvogt/cbt
389,scalaz-and-cats,487,26,487,1,07/06/2017,18/12/2021,573.00 KB,573,Usage examples and benchmarks between Scalaz and Cats (w/ Haskell ground-truth).,Scala,https://github.com/fosskers/scalaz-and-cats
390,rogue,487,77,487,6,16/01/2011,08/06/2016,3.65 MB,3736,MOVED - The project is still under development but this page is deprecated.,Scala,https://github.com/foursquare/rogue
391,salat,485,106,485,34,12/01/2011,03/03/2019,2.93 MB,3000,Salat is a simple serialization library for case classes.,Scala,https://github.com/salat/salat
392,stringmetric,485,79,485,22,07/10/2012,28/07/2017,2.12 MB,2172,":dart: String metrics and phonetic algorithms for Scala (e.g. Dice/Sorensen, Hamming, Jaccard, Jaro, Jaro-Winkler, Levenshtein, Metaphone, N-Gram, NYSIIS, Overlap, Ratcliff/Obershelp, Refined NYSIIS, Refined Soundex, Soundex, Weighted Levenshtein).",Scala,https://github.com/rockymadden/stringmetric
393,scoobi,482,95,482,21,25/10/2011,01/07/2022,50.64 MB,51854,A Scala productivity framework for Hadoop.,Scala,https://github.com/NICTA/scoobi
394,gremlin-scala,480,76,480,32,09/01/2013,20/10/2022,2.60 MB,2666,[unmaintained] Scala wrapper for Apache TinkerPop 3 Graph DSL,Scala,https://github.com/mpollmeier/gremlin-scala
395,topshell,479,9,479,2,14/07/2018,23/08/2021,1.67 MB,1713,"TopShell - a purely functional, reactive scripting language",Scala,https://github.com/topshell-language/topshell
396,conscript,477,65,477,27,22/02/2011,03/06/2025,1.05 MB,1071,Scala at your command,Scala,https://github.com/foundweekends/conscript
397,android-plugin,476,113,476,52,09/11/2009,31/10/2014,4.65 MB,4765,An sbt plugin for Android development in Scala,Scala,https://github.com/jberkel/android-plugin
398,akka.js,476,39,476,9,17/04/2015,20/02/2022,4.75 MB,4868,"Akka, for Scala.js",Scala,https://github.com/akka-js/akka.js
399,mima,472,72,472,33,24/05/2012,03/06/2025,2.38 MB,2442,A tool for catching binary incompatibility in Scala,Scala,https://github.com/lightbend-labs/mima
400,keystone,472,117,472,39,10/04/2015,18/04/2017,19.26 MB,19723,Simplifying robust end-to-end machine learning on Apache Spark.,Scala,https://github.com/amplab/keystone
401,concurrency-in-scala-with-ce,471,44,471,4,05/06/2020,27/07/2021,309.00 KB,309,"Introduction to concepts of asynchronous and concurrent programming in Scala, based on the Cats Effect library.",Scala,https://github.com/slouc/concurrency-in-scala-with-ce
402,epic,471,82,471,30,20/04/2011,19/02/2020,22.54 MB,23078,"**Archived** Epic is a high performance statistical parser written in Scala, along with a framework for building complex structured prediction models.",Scala,https://github.com/dlwh/epic
403,outwatch,469,41,469,59,04/11/2016,10/04/2025,2.13 MB,2183,The Functional and Reactive Web-Frontend Library for Scala.js,Scala,https://github.com/outwatch/outwatch
404,featran,468,68,468,11,08/05/2017,07/02/2025,2.98 MB,3055,A Scala feature transformation library for data science and machine learning,Scala,https://github.com/spotify/featran
405,gamebub,468,29,468,3,25/04/2023,03/05/2025,11.54 MB,11812,Open-source FPGA retro emulation handheld ,Scala,https://github.com/elipsitz/gamebub
406,storehaus,466,84,466,78,22/01/2013,17/07/2020,2.30 MB,2355,Storehaus is a library that makes it easy to work with asynchronous key value stores,Scala,https://github.com/twitter/storehaus
407,frdomain,466,135,466,13,26/10/2014,08/12/2019,209.00 KB,209,Code repo for Functional and Reactive Domain Modeling,Scala,https://github.com/debasishg/frdomain
408,apalache,464,44,464,294,03/07/2015,11/05/2025,63.75 MB,65284,APALACHE: symbolic model checker for TLA+ and Quint,Scala,https://github.com/apalache-mc/apalache
409,repox,464,89,464,20,19/11/2014,03/08/2018,569.00 KB,569,Make sbt more responsive,Scala,https://github.com/Centaur/repox
410,nixiesearch,462,10,462,57,14/07/2023,04/06/2025,13.57 MB,13895,"Hybrid search engine, combining best features of text and semantic search worlds",Scala,https://github.com/nixiesearch/nixiesearch
411,zio-prelude,462,116,462,76,02/03/2020,04/06/2025,16.26 MB,16647,"A lightweight, distinctly Scala take on functional abstractions, with tight ZIO integration",Scala,https://github.com/zio/zio-prelude
412,spring-scala,461,124,461,8,31/08/2011,13/04/2022,603.00 KB,603,,Scala,https://github.com/spring-attic/spring-scala
413,openie,461,108,461,5,05/07/2013,27/12/2018,90.00 KB,90,Quality information extraction at web scale.,Scala,https://github.com/knowitall/openie
414,munit,451,96,451,40,03/01/2020,06/06/2025,2.69 MB,2758,Scala testing library with actionable errors and extensible APIs,Scala,https://github.com/scalameta/munit
415,papa-carlo,449,23,449,6,05/10/2013,15/12/2020,362.00 KB,362,Constructor of incremental parsers in Scala,Scala,https://github.com/Eliah-Lakhin/papa-carlo
416,udash-core,449,37,449,32,25/02/2016,04/06/2025,12.11 MB,12404,Scala framework for building beautiful and maintainable web applications.,Scala,https://github.com/UdashFramework/udash-core
417,resy-booking-bot,448,225,448,35,13/02/2018,28/04/2024,65.00 KB,65,🔫 Helps to snipe hard to get reservations at restaurants that use resy,Scala,https://github.com/Alkaar/resy-booking-bot
418,spark-fast-tests,447,78,447,29,06/04/2017,01/06/2025,2.26 MB,2318,"Apache Spark testing helpers (dependency free & works with Scalatest, uTest, and MUnit)",Scala,https://github.com/mrpowers-io/spark-fast-tests
419,spark-solr,446,249,446,62,15/01/2015,18/12/2023,9.99 MB,10225,Tools for reading data from Solr as a Spark RDD and indexing objects from Spark into Solr using SolrJ.,Scala,https://github.com/lucidworks/spark-solr
420,xitrum,444,52,444,56,19/07/2010,28/02/2023,12.73 MB,13031,Async and clustered Scala web framework and HTTP(S) server,Scala,https://github.com/xitrum-framework/xitrum
421,LearningSpark,444,291,444,1,28/09/2014,17/09/2020,494.00 KB,494,Scala examples for learning to use Spark,Scala,https://github.com/spirom/LearningSpark
422,play2-war-plugin,443,71,443,33,26/03/2012,07/09/2019,80.86 MB,82803,WAR Plugin for Play framework 2.x,Scala,https://github.com/play2war/play2-war-plugin
423,akka-http-session,440,58,440,11,30/06/2015,29/08/2023,809.00 KB,809,"Web & mobile client-side akka-http sessions, with optional JWT support",Scala,https://github.com/softwaremill/akka-http-session
424,ox,440,30,440,18,18/01/2023,04/06/2025,1.38 MB,1415,Safe direct-style concurrency and resiliency for Scala on the JVM,Scala,https://github.com/softwaremill/ox
425,Laika,438,51,438,11,22/12/2012,02/06/2025,109.49 MB,112121,"Site and E-book Generator and Customizable Text Markup Transformer for sbt, Scala and Scala.js",Scala,https://github.com/typelevel/Laika
426,scala-java8-compat,437,102,437,11,11/03/2014,04/06/2025,829.00 KB,829,A Java 8 (and up) compatibility kit for Scala.,Scala,https://github.com/scala/scala-java8-compat
