Ranking,Project Name,Stars,Forks,Watchers,Open Issues,Created At,Last Commit,Size,Size (KB),Description,Language,Repo URL
427,scastie,436,106,436,118,22/11/2016,10/05/2025,20.77 MB,21265,An interactive playground for Scala,Scala,https://github.com/scalacenter/scastie
428,rainier,435,44,435,31,12/03/2018,12/05/2023,5.59 MB,5722,Bayesian inference in Scala.,Scala,https://github.com/stripe/rainier
429,twofishes,435,62,435,15,17/02/2012,15/01/2019,50.65 MB,51864,MOVED - The project is still under development but this page is deprecated.,Scala,https://github.com/foursquare/twofishes
430,woof,435,18,435,21,11/10/2021,19/05/2025,337.00 KB,337,A pure Scala 3 logging library with no reflection,Scala,https://github.com/LEGO/woof
431,scalgos,435,90,435,13,25/03/2013,04/04/2024,2.71 MB,2773,algorithms in scala,Scala,https://github.com/pathikrit/scalgos
432,jawn,434,74,434,14,01/10/2012,03/06/2025,4.86 MB,4974,Jawn is for parsing jay-sawn (JSON),Scala,https://github.com/typelevel/jawn
433,docker-it-scala,432,90,432,27,26/01/2015,14/02/2024,443.00 KB,443,Docker integration testing kit with Scala,Scala,https://github.com/whisklabs/docker-it-scala
434,akka-grpc,432,126,432,167,08/02/2018,15/05/2025,4.86 MB,4977,"A platform to build and run apps that are elastic, agile, and resilient. SDK, libraries, and hosted environments.",Scala,https://github.com/akka/akka-grpc
435,scalac-scoverage-plugin,431,127,431,62,26/11/2013,04/05/2025,6.19 MB,6334,Scoverage Scala Code Coverage Core Libs,Scala,https://github.com/scoverage/scalac-scoverage-plugin
436,play-scalajs.g8,429,114,429,3,13/02/2014,15/05/2025,1.64 MB,1675, Giter8 template to get started with Play and Scala.js.,Scala,https://github.com/vmunier/play-scalajs.g8
437,mypipe,428,81,428,18,15/03/2014,22/02/2023,6.07 MB,6211,MySQL binary log consumer with the ability to act on changed rows and publish changes to different systems with emphasis on Apache Kafka.,Scala,https://github.com/mardambey/mypipe
438,metrics-scala,427,60,427,1,10/09/2012,03/06/2025,5.52 MB,5657,The scala API for Dropwizard's Metrics.,Scala,https://github.com/erikvanoosten/metrics-scala
439,reboot,426,106,426,5,11/12/2011,25/08/2024,1.85 MB,1897,Scala wrapper for the Java AsyncHttpClient.,Scala,https://github.com/dispatch/reboot
440,hyperspace,425,115,425,135,07/05/2020,14/01/2022,4.98 MB,5104,An open source indexing subsystem that brings index-based query acceleration to Apache Spark™ and big data workloads.,Scala,https://github.com/microsoft/hyperspace
441,scala,425,106,425,0,20/07/2013,31/12/2021,2.51 MB,2572,Scala reference (as seen by Java developer),Scala,https://github.com/mbonaci/scala
442,telegram,422,101,422,14,01/08/2015,21/05/2025,2.21 MB,2267,Telegram Bot API Wrapper for Scala,Scala,https://github.com/bot4s/telegram
443,lc-core,422,19,422,23,02/01/2018,01/06/2025,12.80 MB,13105,"The LibreCaptcha framework, for self-hosted, privacy respecting CAPTCHAs",Scala,https://github.com/librecaptcha/lc-core
444,ducktape,421,8,421,3,05/10/2021,03/06/2025,1.55 MB,1586,"Automatic and customizable compile time transformations between similar case classes and sealed traits/enums, essentially a thing that glues your code. Scala 3 only. Or is it duct 🤔",Scala,https://github.com/arainko/ducktape
445,spark-corenlp,421,120,421,18,21/08/2015,15/11/2018,61.00 KB,61,Stanford CoreNLP wrapper for Apache Spark,Scala,https://github.com/databricks/spark-corenlp
446,zio-json,421,149,421,72,03/07/2020,03/06/2025,8.56 MB,8768,"Fast, secure JSON library with tight ZIO integration.",Scala,https://github.com/zio/zio-json
447,shardcake,420,32,420,6,22/07/2022,04/06/2025,15.53 MB,15899,Sharding and location transparency for Scala,Scala,https://github.com/devsisters/shardcake
448,Play-ReactiveMongo,414,127,414,0,30/08/2012,04/06/2025,1.64 MB,1675,:leaves: ReactiveMongo plugin for Playframework,Scala,https://github.com/ReactiveMongo/Play-ReactiveMongo
449,kafka,412,140,412,49,06/02/2015,03/05/2018,1.44 MB,1474,Apache Kafka on Apache Mesos,Scala,https://github.com/mesos/kafka
450,fury-old,411,34,411,138,29/09/2018,03/09/2024,5.32 MB,5452,A new build tool for JVM languages,Scala,https://github.com/propensive/fury-old
451,endpoints4s,409,97,409,54,25/04/2016,25/03/2025,10.78 MB,11040,"Describe HTTP endpoints in Scala and derive clients, servers, and documentation",Scala,https://github.com/endpoints4s/endpoints4s
452,log4cats,409,83,409,23,24/04/2018,03/06/2025,2.48 MB,2541,Logging Tools For Interaction with cats-effect,Scala,https://github.com/typelevel/log4cats
453,play-swagger,406,134,406,22,17/09/2015,10/11/2023,881.00 KB,881,Swagger spec generator for play framework,Scala,https://github.com/iheartradio/play-swagger
454,ciris,405,49,405,1,27/04/2017,04/06/2025,8.45 MB,8649,Functional Configurations for Scala,Scala,https://github.com/vlovgr/ciris
455,spray-template,405,200,405,3,25/03/2011,24/03/2015,742.00 KB,742,SBT template project for quickly getting started with spray-server,Scala,https://github.com/spray/spray-template
456,examples-scala,404,204,404,6,24/11/2016,20/11/2023,95.00 KB,95,Stream Processing with Apache Flink - Scala Examples,Scala,https://github.com/streaming-with-flink/examples-scala
457,spark-training,402,358,402,3,25/08/2014,24/11/2015,666.22 MB,682214,Apache Spark training material,Scala,https://github.com/databricks/spark-training
458,shard,402,57,402,4,07/07/2016,05/10/2016,221.00 KB,221,A command line tool to detect shared passwords,Scala,https://github.com/philwantsfish/shard
459,platform,402,64,402,18,06/12/2011,15/11/2013,82.36 MB,84341,Advanced Analytics Engine for NoSQL Data,Scala,https://github.com/precog/platform
460,larray,401,43,401,26,18/03/2013,30/11/2022,1.69 MB,1727,Large off-heap arrays and mmap files for Scala and Java,Scala,https://github.com/xerial/larray
461,mdoc,401,85,401,61,23/10/2017,02/06/2025,6.65 MB,6812,Typechecked markdown documentation for Scala,Scala,https://github.com/scalameta/mdoc
462,nelson,400,40,400,42,14/06/2017,31/08/2022,27.57 MB,28236,"Automated, multi-region container deployment",Scala,https://github.com/getnelson/nelson
463,embedded-kafka,400,45,400,4,23/11/2018,03/06/2025,857.00 KB,857,A library that provides an in-memory Kafka instance to run your tests against.,Scala,https://github.com/embeddedkafka/embedded-kafka
464,sql-differential-privacy,399,71,399,5,15/06/2017,03/12/2019,228.00 KB,228,Dataflow analysis & differential privacy for SQL queries. This project is deprecated and not maintained.,Scala,https://github.com/uber-archive/sql-differential-privacy
465,sbt-tpolecat,399,55,399,14,19/07/2017,04/06/2025,443.00 KB,443,scalac options for the enlightened,Scala,https://github.com/typelevel/sbt-tpolecat
466,REPLesent,397,36,397,5,02/02/2015,02/10/2019,123.00 KB,123,A neat little tool to build presentations using the Scala REPL,Scala,https://github.com/marconilanna/REPLesent
467,intellij-lsp,397,48,397,89,04/10/2017,15/06/2023,23.88 MB,24450,Plugin adding Language Server Protocol support for IntelliJ,Scala,https://github.com/gtache/intellij-lsp
468,brushfire,392,44,392,32,20/11/2014,09/01/2019,1.48 MB,1517,Distributed decision tree ensemble learning in Scala                          ,Scala,https://github.com/stripe-archive/brushfire
469,norbert,390,125,390,9,16/12/2009,04/10/2022,2.68 MB,2742,Norbert is a cluster manager and networking layer built on top of Zookeeper.,Scala,https://github.com/rhavyn/norbert
470,droste,390,52,390,17,12/01/2018,02/06/2025,1.53 MB,1562,"recursion schemes for cats; to iterate is human, to recurse, divine",Scala,https://github.com/higherkindness/droste
471,chisel2-deprecated,389,89,389,122,08/02/2012,18/04/2018,57.02 MB,58389,,Scala,https://github.com/ucb-bar/chisel2-deprecated
472,s3mock,388,108,388,81,10/08/2016,14/11/2023,299.00 KB,299,Embedded S3 server for easy mocking,Scala,https://github.com/findify/s3mock
473,flink-notes,388,132,388,3,07/01/2020,01/07/2022,102.65 MB,105116,flink学习笔记,Scala,https://github.com/pierre94/flink-notes
474,subcut,386,29,386,8,30/05/2011,12/10/2020,542.00 KB,542,Scala Uniquely Bound Classes Under Traits,Scala,https://github.com/dickwall/subcut
475,links,384,48,384,0,06/06/2013,26/05/2025,2.54 MB,2605,Just a bunch of useful links,Scala,https://github.com/velvia/links
476,ddd-leaven-akka-v2,383,69,383,2,03/01/2015,21/07/2018,1.20 MB,1230,Sample e-commerce system #Microservices #Akka #Reactive-DDD #CQRS,Scala,https://github.com/pawelkaczor/ddd-leaven-akka-v2
477,sbt-war,382,102,382,1,24/04/2011,01/06/2025,1.88 MB,1928,Package and run WAR files from sbt,Scala,https://github.com/earldouglas/sbt-war
478,tensil,381,30,381,19,26/02/2022,24/03/2024,2.87 MB,2942,Open source machine learning accelerators,Scala,https://github.com/tensil-ai/tensil
479,tyrian,381,31,381,32,04/06/2021,07/05/2025,18.26 MB,18697,Elm-inspired Scala UI library.,Scala,https://github.com/PurpleKingdomGames/tyrian
480,elastiknn,380,50,380,17,29/10/2019,06/06/2025,142.01 MB,145423,Elasticsearch plugin for nearest neighbor search. Store vectors and run similarity search using exact and approximate algorithms.,Scala,https://github.com/alexklibisz/elastiknn
481,spark-perf,380,201,380,39,17/06/2014,09/07/2018,3.51 MB,3599,Performance tests for Apache Spark,Scala,https://github.com/databricks/spark-perf
482,scala_typeclassopedia,380,39,380,33,18/02/2017,05/12/2024,1.75 MB,1789,"Abstractions from Category theory with simple description & implementation, links to further resources.",Scala,https://github.com/lemastero/scala_typeclassopedia
483,autowire,379,48,379,34,05/07/2014,04/01/2022,174.00 KB,174,"Macros for simple/safe RPCs between Scala applications, including ScalaJS/ScalaJVM",Scala,https://github.com/lihaoyi/autowire
484,bloom-filter-scala,380,55,380,19,07/02/2016,19/03/2021,284.00 KB,284,"Bloom filter for Scala, the fastest for JVM",Scala,https://github.com/alexandrnikitin/bloom-filter-scala
485,sse-chat,378,84,378,1,11/06/2013,08/02/2015,3.92 MB,4015,"Chat example app using Server Sent Events plus REST calls. Scala, Play Framework 2.3, AngularJS or React (alternatively).",Scala,https://github.com/matthiasn/sse-chat
486,algebra,378,69,378,37,18/10/2013,05/11/2021,4.66 MB,4770,Experimental project to lay out basic algebra type classes,Scala,https://github.com/typelevel/algebra
487,smithy4s,377,81,377,115,22/12/2021,05/06/2025,29.89 MB,30604,https://disneystreaming.github.io/smithy4s/,Scala,https://github.com/disneystreaming/smithy4s
488,stainless,375,56,375,305,17/08/2016,15/05/2025,142.57 MB,145995,Verification framework and tool for higher-order Scala programs,Scala,https://github.com/epfl-lara/stainless
489,mouse,375,66,375,6,05/05/2016,03/06/2025,873.00 KB,873,A small companion to cats,Scala,https://github.com/typelevel/mouse
490,osstracker,372,54,372,18,08/02/2016,10/03/2024,1.08 MB,1111,Github organization OSS metrics collector and metrics dashboard,Scala,https://github.com/Netflix/osstracker
491,splain,371,28,371,9,18/12/2016,19/04/2025,1.14 MB,1168,better implicit errors for scala,Scala,https://github.com/tek/splain
492,effekt,371,35,371,199,05/03/2020,05/06/2025,21.22 MB,21726,A language with lexical effect handlers and lightweight effect polymorphism,Scala,https://github.com/effekt-lang/effekt
493,kafka-security-manager,369,162,369,32,01/03/2018,01/02/2024,270.00 KB,270,Manage your Kafka ACL at scale,Scala,https://github.com/conduktor/kafka-security-manager
494,sbt-web,369,66,369,24,18/11/2013,05/06/2025,585.00 KB,585,Library for building sbt plugins for the web,Scala,https://github.com/sbt/sbt-web
495,boopickle,366,37,366,27,10/04/2015,19/08/2024,1.21 MB,1237,Binary serialization library for efficient network communication,Scala,https://github.com/suzaku-io/boopickle
496,legacy-svn-scala,366,58,366,0,16/08/2010,08/01/2014,289.75 MB,296706,"OBSOLETE, we're over there:",Scala,https://github.com/scala/legacy-svn-scala
497,bitcoin-s,366,97,366,386,28/04/2016,28/05/2025,536.66 MB,549536,Bitcoin Implementation in Scala,Scala,https://github.com/bitcoin-s/bitcoin-s
498,webjars,366,65,366,105,29/09/2012,02/06/2025,6.65 MB,6810,Client-side web libraries packaged into JARs,Scala,https://github.com/webjars/webjars
499,play-json,365,138,365,63,06/12/2016,09/05/2025,2.15 MB,2204,The Play JSON library,Scala,https://github.com/playframework/play-json
500,News_recommend,364,91,364,12,19/05/2019,21/06/2022,17.46 MB,17877,基于Spark的新闻推荐系统，包含爬虫项目、web网站以及spark推荐系统,Scala,https://github.com/luochana/News_recommend
501,pilon,363,58,363,84,30/03/2013,10/04/2022,4.46 MB,4567,Pilon is an automated genome assembly improvement and variant detection tool,Scala,https://github.com/broadinstitute/pilon
502,akka-http-rest,362,99,362,0,09/07/2015,28/03/2021,107.00 KB,107,Example of reactive REST service written on akka-http with slick,Scala,https://github.com/arhelmus/akka-http-rest
503,graphx,360,103,360,31,17/09/2013,05/12/2022,64.80 MB,66360,Former GraphX development repository. GraphX has been merged into Apache Spark; please submit pull requests there.,Scala,https://github.com/amplab/graphx
504,blaze,360,64,360,91,06/01/2014,05/06/2025,7.00 MB,7166,Blazing fast NIO microframework and Http Parser,Scala,https://github.com/http4s/blaze
505,atto,358,58,358,32,04/09/2013,19/08/2024,2.44 MB,2498,friendly little parsers,Scala,https://github.com/tpolecat/atto
506,sparklint,358,92,358,16,06/10/2016,02/11/2022,6.44 MB,6592,A tool for monitoring and tuning Spark jobs for efficiency.,Scala,https://github.com/groupon/sparklint
507,akka-streams-example,357,73,357,2,06/10/2014,17/10/2022,613.00 KB,613,,Scala,https://github.com/inanna-malick/akka-streams-example
508,mockito-scala,357,60,357,25,23/06/2018,29/05/2025,2.60 MB,2661,Mockito for Scala language,Scala,https://github.com/mockito/mockito-scala
509,retry,357,37,357,23,25/04/2013,04/06/2025,207.00 KB,207,"because you should never give up, at least not on the first try",Scala,https://github.com/softwaremill/retry
510,akka-ddd,355,59,355,5,20/10/2014,01/06/2025,2.97 MB,3044,Akka CQRS/ES framework,Scala,https://github.com/pawelkaczor/akka-ddd
511,sbt-git,355,103,355,33,26/10/2011,05/06/2025,388.00 KB,388,A git plugin for sbt,Scala,https://github.com/sbt/sbt-git
512,redis4cats,354,90,354,9,17/06/2018,05/06/2025,10.44 MB,10695,":bookmark: Redis client built on top of Cats Effect, Fs2 and Lettuce",Scala,https://github.com/profunktor/redis4cats
513,zio-kafka,354,141,354,19,28/02/2019,04/06/2025,652.70 MB,668366,A Kafka client for ZIO and ZIO Streams,Scala,https://github.com/zio/zio-kafka
514,scala-kafka-client,353,116,353,20,15/01/2016,10/08/2022,526.00 KB,526,Scala helper modules for operating the Apache Kafka client library (0.9.x - 2.1.0),Scala,https://github.com/cakesolutions/scala-kafka-client
515,tsec,350,58,350,65,04/08/2017,26/11/2021,3.05 MB,3119,Type-safe general-cryptography library - https://jmcardon.github.io/tsec/,Scala,https://github.com/jmcardon/tsec
516,javacv-examples,347,157,347,0,03/05/2014,07/12/2024,41.81 MB,42810,Examples of using JavaCV / OpenCV library on Java Virtual Machine,Scala,https://github.com/bytedeco/javacv-examples
517,kantan.csv,347,38,347,59,22/07/2015,12/04/2025,10.25 MB,10496,CSV handling library for Scala,Scala,https://github.com/nrinaudo/kantan.csv
518,vinyldns,346,104,346,108,26/07/2018,03/06/2025,32.73 MB,33515,DNS automation and governance for streamlining DNS operations and enabling safe and secure DNS self-service,Scala,https://github.com/vinyldns/vinyldns
519,scala-tutorials,345,214,345,14,30/11/2019,06/06/2025,4.41 MB,4513,Supporting code for the tutorials on https://www.baeldung.com/scala,Scala,https://github.com/Baeldung/scala-tutorials
520,ordasity,345,28,345,13,19/10/2011,11/10/2023,297.00 KB,297,Ordasity is Boundary's library for building stateful clustered services on the JVM.,Scala,https://github.com/boundary/ordasity
521,ooyala_spark-jobserver,344,133,344,50,26/02/2014,19/05/2017,555.00 KB,555,"REST job server for Spark.  Note that this is *not* the mainline open source version.  For that, go to https://github.com/spark-jobserver/spark-jobserver.  This fork now serves as a semi-private repo for Ooyala.",Scala,https://github.com/brightcove-archive/ooyala_spark-jobserver
522,delight,344,55,344,0,26/10/2020,31/05/2024,2.37 MB,2422,"A Spark UI and Spark History Server alternative with CPU and Memory metrics! Delight is free, cross-platform, and open-source.",Scala,https://github.com/datamechanics/delight
523,baker,343,83,343,43,05/12/2016,05/06/2025,170.83 MB,174927,Orchestrate microservice-based process flows,Scala,https://github.com/ing-bank/baker
524,diffx,343,30,343,21,03/05/2019,03/12/2024,1.33 MB,1365,Pretty diffs for scala case classes,Scala,https://github.com/softwaremill/diffx
525,scala_school2,343,77,343,51,21/06/2013,08/10/2021,1.07 MB,1100,Scala School 2,Scala,https://github.com/twitter/scala_school2
526,pekko-http-scala-js-websocket-chat,343,59,343,2,27/04/2015,03/10/2024,512.00 KB,512,An example app that integrates pekko-http and scala-js to implement a websocket chat,Scala,https://github.com/jrudolph/pekko-http-scala-js-websocket-chat
527,DeepLearningForFun,342,63,342,1,19/07/2016,30/08/2024,421.55 MB,431664,Implementation of some interesting ideas of deeplearning.,Scala,https://github.com/Ldpe2G/DeepLearningForFun
528,nak,342,84,342,12,15/01/2013,18/07/2017,5.77 MB,5905,The Nak Machine Learning Library,Scala,https://github.com/scalanlp/nak
529,ratatool,341,54,341,27,01/08/2016,30/04/2025,1.32 MB,1348,"A tool for data sampling, data generation, and data diffing",Scala,https://github.com/spotify/ratatool
530,morpheus,341,62,341,29,02/08/2016,09/09/2020,30.30 MB,31032,"Morpheus brings the leading graph query language, Cypher, onto the leading distributed processing platform, Spark.",Scala,https://github.com/opencypher/morpheus
531,scalaxb,341,159,341,162,05/02/2010,14/03/2025,4.23 MB,4335,scalaxb is an XML data binding tool for Scala.,Scala,https://github.com/eed3si9n/scalaxb
532,zinc,339,121,339,78,04/08/2015,01/06/2025,27.49 MB,28149,"Scala incremental compiler library, used by sbt and other build tools",Scala,https://github.com/sbt/zinc
533,scala-2-beginners,339,287,339,1,15/06/2018,25/04/2024,22.00 KB,22,The official repository for the Rock the JVM Scala 2 for beginners course,Scala,https://github.com/rockthejvm/scala-2-beginners
534,scalacss,339,44,339,55,07/03/2015,12/08/2024,12.64 MB,12947,Super type-safe CSS for Scala and Scala.JS.,Scala,https://github.com/japgolly/scalacss
535,scala3-example-project,338,152,338,1,30/12/2015,26/05/2025,252.00 KB,252,An example sbt project that compiles using Dotty,Scala,https://github.com/scala/scala3-example-project
536,doodle,338,82,338,31,10/12/2014,30/04/2025,23.27 MB,23828,Compositional vector graphics in Scala / Scala.JS,Scala,https://github.com/creativescala/doodle
537,sbt-sonatype,339,65,339,27,20/01/2014,03/06/2025,787.00 KB,787,A sbt plugin for publishing Scala/Java projects to the Maven central.,Scala,https://github.com/xerial/sbt-sonatype
538,kmq,337,45,337,28,11/02/2017,04/06/2025,462.00 KB,462,Kafka-based message queue,Scala,https://github.com/softwaremill/kmq
539,bahir,336,197,336,7,29/05/2016,07/07/2023,1.11 MB,1133,Mirror of Apache Bahir,Scala,https://github.com/apache/bahir
540,idea-composer-plugin,336,10,336,10,05/12/2014,19/02/2020,1021.00 KB,1021,PhpStorm plugin that adds code completion in composer.json file,Scala,https://github.com/psliwa/idea-composer-plugin
541,koober,336,106,336,3,06/12/2016,14/01/2018,2.23 MB,2283,,Scala,https://github.com/jamesward/koober
542,quine,332,42,332,8,05/02/2022,04/06/2025,25.27 MB,25880,Quine • a streaming graph • https://quine.io • Discord: https://discord.gg/GMhd8TE4MR,Scala,https://github.com/thatdot/quine
543,fun-cqrs,332,48,332,7,20/09/2015,30/06/2022,1.09 MB,1120,Fun.CQRS is a Scala CQRS/ES framework. It provides the basic blocks to build event driven aggregates with Event Sourcing.,Scala,https://github.com/fun-cqrs/fun-cqrs
544,natchez,332,78,332,19,23/05/2019,05/06/2025,2.13 MB,2185,functional tracing for cats,Scala,https://github.com/typelevel/natchez
545,discipline,332,56,332,5,19/10/2013,05/06/2025,597.00 KB,597,Flexible law checking for Scala,Scala,https://github.com/typelevel/discipline
546,mu-scala,331,34,331,34,05/05/2017,02/06/2025,7.76 MB,7943,Mu is a purely functional library for building RPC endpoint based services with support for RPC and HTTP/2,Scala,https://github.com/higherkindness/mu-scala
547,scala-kafka,330,134,330,11,18/12/2013,02/07/2017,1.56 MB,1600,Quick up and running using Scala for Apache Kafka,Scala,https://github.com/elodina/scala-kafka
548,fgbio,329,73,329,71,03/03/2016,04/06/2025,9.90 MB,10136,Tools for working with genomic and high throughput sequencing data.,Scala,https://github.com/fulcrumgenomics/fgbio
549,skuber,329,98,329,47,25/11/2015,04/03/2025,2.10 MB,2152,A Scala Kubernetes client library,Scala,https://github.com/doriordan/skuber
550,virtualization-lms-core,329,91,329,28,19/08/2010,27/02/2019,6.76 MB,6919,A Framework for Runtime Code Generation and Compiled DSLs,Scala,https://github.com/TiarkRompf/virtualization-lms-core
551,openie-standalone,329,53,329,3,27/05/2016,20/04/2017,540.00 KB,540,Quality information extraction at web scale. Edit,Scala,https://github.com/allenai/openie-standalone
552,akka-persistence-cassandra,326,134,326,61,04/01/2016,15/05/2025,3.64 MB,3731,A replicated Akka Persistence journal backed by Apache Cassandra,Scala,https://github.com/akka/akka-persistence-cassandra
553,mist,326,72,326,31,15/01/2016,29/10/2020,10.20 MB,10449,Serverless proxy for Spark cluster,Scala,https://github.com/Hydrospheredata/mist
554,berkeley-hardfloat,326,92,326,21,08/09/2014,11/09/2024,1.33 MB,1367,,Scala,https://github.com/ucb-bar/berkeley-hardfloat
555,aecor,324,35,324,79,05/06/2016,13/08/2024,20.46 MB,20946,Pure functional event sourcing runtime,Scala,https://github.com/notxcain/aecor
556,scala-js-dom,323,161,323,39,15/10/2013,30/11/2024,11.62 MB,11899,Statically typed DOM API for Scala.js,Scala,https://github.com/scala-js/scala-js-dom
557,IScala,322,49,322,26,14/08/2013,09/01/2019,917.00 KB,917,Scala backend for IPython,Scala,https://github.com/mattpap/IScala
558,scala-activerecord,322,27,322,20,10/04/2012,08/01/2021,6.81 MB,6976,ActiveRecord-like ORM library for Scala,Scala,https://github.com/aselab/scala-activerecord
559,rpgboss,321,149,321,174,18/10/2012,08/06/2021,40.36 MB,41327,point and click rpg game editor and engine,Scala,https://github.com/rpgboss/rpgboss
560,chana,321,46,321,7,31/12/2014,05/03/2018,1.61 MB,1652,Realtime Data Store Based on Akka,Scala,https://github.com/dcaoyuan/chana
561,Spark-SQL-on-HBase,320,155,320,7,15/07/2015,12/04/2022,1.03 MB,1057,"Native, optimized access to HBase Data through Spark SQL/Dataframe Interfaces",Scala,https://github.com/Huawei-Spark/Spark-SQL-on-HBase
562,cloudflow,320,89,320,129,08/11/2019,13/08/2024,14.78 MB,15133,"Cloudflow enables users to quickly develop, orchestrate, and operate distributed streaming applications on Kubernetes.",Scala,https://github.com/lightbend/cloudflow
563,cats-tagless,320,41,320,11,11/07/2018,03/06/2025,6.28 MB,6433,Library of utilities for tagless final encoded algebras,Scala,https://github.com/typelevel/cats-tagless
564,scanamo,318,125,318,56,01/02/2016,11/01/2025,37.60 MB,38503,Simpler DynamoDB access for Scala,Scala,https://github.com/scanamo/scanamo
565,diffson,318,51,318,13,30/08/2013,21/09/2024,794.00 KB,794,A scala diff/patch library for Json,Scala,https://github.com/gnieh/diffson
566,lmvtfy,318,24,318,17,24/05/2014,12/03/2020,58.74 MB,60145,LMVTFY: Let Me Validate That For You,Scala,https://github.com/cvrebert/lmvtfy
567,gps-overlay-on-video,316,38,316,23,02/04/2014,03/06/2025,7.35 MB,7531,Telemetry (GPS) data overlay on videos,Scala,https://github.com/peregin/gps-overlay-on-video
568,odin,315,19,315,50,13/11/2019,06/08/2024,600.00 KB,600,Fast & Functional logger in Scala,Scala,https://github.com/valskalla/odin
569,spark-distributed-louvain-modularity,315,151,315,14,21/03/2014,02/09/2020,176.00 KB,176,Spark / graphX implementation of the distributed louvain modularity algorithm,Scala,https://github.com/Sotera/spark-distributed-louvain-modularity
570,scalikejdbc-async,314,40,314,12,25/07/2013,03/06/2025,2.25 MB,2302,ScalikeJDBC Extension: Non-blocking APIs in the JDBC way,Scala,https://github.com/scalikejdbc/scalikejdbc-async
571,neo4j-spark-connector,313,116,313,3,03/03/2016,05/06/2025,3.06 MB,3135,"Neo4j Connector for Apache Spark, which provides bi-directional read/write access to Neo4j from Spark, using the Spark DataSource APIs",Scala,https://github.com/neo4j/neo4j-spark-connector
572,Bigdata,313,68,313,10,27/06/2018,15/01/2024,7.62 MB,7800,大数据处理相关技术学习之路(持续更新中...)。        Bigdata整理  -->  慢慢滴~ 大数据相关技术包括离线处理，实时处理，OLAP等，如hadoop、spark、flink、hive、hbase、oozie...以及大数据项目，如用户画像、数据仓库等，欢迎感兴趣的小伙伴一起来开发...,Scala,https://github.com/baolibin/Bigdata
573,Neutrino,312,43,312,9,29/12/2015,09/02/2018,254.00 KB,254,Neutrino is a software load balancer(SLB),Scala,https://github.com/eBay/Neutrino
574,degraph,312,36,312,21,01/09/2011,15/05/2021,14.69 MB,15042,Test and Visualize and Manage Dependencies of classes and packages in JVM Byte Code (think Scala and Java),Scala,https://github.com/riy/degraph
575,scala-clippy,311,18,311,14,19/12/2015,14/03/2019,573.00 KB,573,Good advice for Scala compiler errors,Scala,https://github.com/softwaremill/scala-clippy
576,cats-mtl,310,64,310,18,23/04/2017,03/06/2025,5.98 MB,6128,cats transformer type classes.,Scala,https://github.com/typelevel/cats-mtl
577,akka-persistence-jdbc,309,141,309,39,23/05/2014,19/05/2025,7.22 MB,7395,Asynchronously writes journal and snapshot entries to configured JDBC databases so that Akka Actors can recover state,Scala,https://github.com/akka/akka-persistence-jdbc
