Ranking,Project Name,Stars,Forks,Watchers,Open Issues,Created At,Last Commit,Size,Size (KB),Description,Language,Repo URL
1,computer-science,192701,24059,192701,16,04/05/2014,23/08/2025,1.73 MB,1767,ğŸ“ Path to a free self-taught education in Computer Science!,HTML,https://github.com/ossu/computer-science
2,free-for-dev,111780,11485,111780,13,18/03/2015,11/09/2025,8.74 MB,8952,"A list of SaaS, PaaS and IaaS offerings that have free tiers of interest to devops and infradev",HTML,https://github.com/ripienaar/free-for-dev
3,FreeDomain,96284,1784,96284,19,30/05/2024,14/05/2025,66.00 KB,66,DigitalPlat FreeDomain: Free Domain For Everyone,HTML,https://github.com/DigitalPlatDev/FreeDomain
4,cs-self-learning,67162,7594,67162,127,20/10/2021,31/08/2025,64.54 MB,66087,è®¡ç®—æœºè‡ªå­¦æŒ‡å—,HTML,https://github.com/PKUFlyingPig/cs-self-learning
5,retrofit,43716,7339,43716,160,06/09/2010,11/09/2025,6.53 MB,6689,A type-safe HTTP client for Android and the JVM,HTML,https://github.com/square/retrofit
6,awesome-compose,41273,7683,41273,276,13/02/2020,09/09/2025,8.46 MB,8661,Awesome Docker Compose samples,HTML,https://github.com/docker/awesome-compose
7,tabler,40054,4250,40054,104,01/02/2018,08/09/2025,354.36 MB,362865,Tabler is free and open-source HTML Dashboard UI Kit built on Bootstrap,HTML,https://github.com/tabler/tabler
8,zju-icicles,39464,9560,39464,10,28/06/2016,23/06/2025,5.28 GB,5536847,æµ™æ±Ÿå¤§å­¦è¯¾ç¨‹æ”»ç•¥å…±äº«è®¡åˆ’,HTML,https://github.com/QSCTech/zju-icicles
9,English-level-up-tips,39298,4232,39298,30,30/05/2017,13/07/2024,147.74 MB,151284,An advanced guide to learn English which might benefit you a lot ğŸ‰ .  ç¦»è°±çš„è‹±è¯­å­¦ä¹ æŒ‡å—/è‹±è¯­å­¦ä¹ æ•™ç¨‹ã€‚,HTML,https://github.com/byoungd/English-level-up-tips
10,styleguide,38506,13006,38506,166,20/05/2015,03/09/2025,3.09 MB,3168,Style guides for Google-originated open-source projects,HTML,https://github.com/google/styleguide
