Ranking,Project Name,Stars,Forks,Watchers,Open Issues,Created At,Last Commit,Size,Size (KB),Description,Language,Repo URL
1,computer-science,191498,23909,191498,15,04/05/2014,23/08/2025,1.73 MB,1767,ğŸ“ Path to a free self-taught education in Computer Science!,HTML,https://github.com/ossu/computer-science
2,free-for-dev,111391,11457,111391,13,18/03/2015,04/09/2025,8.83 MB,9043,"A list of SaaS, PaaS and IaaS offerings that have free tiers of interest to devops and infradev",HTML,https://github.com/ripienaar/free-for-dev
3,FreeDomain,93761,1751,93761,19,30/05/2024,14/05/2025,66.00 KB,66,DigitalPlat FreeDomain: Free Domain For Everyone,HTML,https://github.com/DigitalPlatDev/FreeDomain
4,cs-self-learning,67034,7586,67034,124,20/10/2021,31/08/2025,64.54 MB,66087,è®¡ç®—æœºè‡ªå­¦æŒ‡å—,HTML,https://github.com/PKUFlyingPig/cs-self-learning
5,retrofit,43706,7338,43706,160,06/09/2010,03/09/2025,6.40 MB,6552,A type-safe HTTP client for Android and the JVM,HTML,https://github.com/square/retrofit
6,awesome-compose,41157,7664,41157,276,13/02/2020,22/07/2025,8.09 MB,8282,Awesome Docker Compose samples,HTML,https://github.com/docker/awesome-compose
7,tabler,40016,4248,40016,99,01/02/2018,03/09/2025,354.35 MB,362854,Tabler is free and open-source HTML Dashboard UI Kit built on Bootstrap,HTML,https://github.com/tabler/tabler
8,zju-icicles,39430,9559,39430,10,28/06/2016,23/06/2025,5.28 GB,5536847,æµ™æ±Ÿå¤§å­¦è¯¾ç¨‹æ”»ç•¥å…±äº«è®¡åˆ’,HTML,https://github.com/QSCTech/zju-icicles
9,English-level-up-tips,39268,4231,39268,30,30/05/2017,13/07/2024,147.74 MB,151284,An advanced guide to learn English which might benefit you a lot ğŸ‰ .  ç¦»è°±çš„è‹±è¯­å­¦ä¹ æŒ‡å—/è‹±è¯­å­¦ä¹ æ•™ç¨‹ã€‚,HTML,https://github.com/byoungd/English-level-up-tips
10,styleguide,38482,13007,38482,165,20/05/2015,03/09/2025,3.09 MB,3168,Style guides for Google-originated open-source projects,HTML,https://github.com/google/styleguide
