Ranking,Project Name,Stars,Forks,Watchers,Open Issues,Created At,Last Commit,Size,Size (KB),Description,Language,Repo URL
1,animate.css,82357,16155,82357,67,12/10/2011,29/07/2024,1.96 MB,2002,ğŸ¿ A cross-browser library of CSS animations. As easy to use as an easy thing.,CSS,https://github.com/animate-css/animate.css
2,nerd-fonts,60060,3821,60060,47,05/12/2014,13/10/2025,26.17 GB,27437407,"Iconic font aggregator, collection, & patcher. 3,600+ icons, 50+ patched fonts: Hack, Source Code Pro, more. Glyph collections: Font Awesome, Material Design Icons, Octicons, & more",CSS,https://github.com/ryanoasis/nerd-fonts
3,normalize.css,53591,10512,53591,72,04/05/2011,12/06/2024,379.00 KB,379,A modern alternative to CSS resets,CSS,https://github.com/necolas/normalize.css
4,bulma,49970,3938,49970,511,23/01/2016,27/06/2025,113.31 MB,116034,Modern CSS framework based on Flexbox,CSS,https://github.com/jgthms/bulma
5,AdminLTE,45078,18260,45078,169,25/12/2013,14/10/2025,134.51 MB,137741,AdminLTE - Free admin dashboard template based on Bootstrap 5,CSS,https://github.com/ColorlibHQ/AdminLTE
6,CppCoreGuidelines,44301,5517,44301,261,19/08/2015,29/09/2025,25.80 MB,26420,"The C++ Core Guidelines are a set of tried-and-true guidelines, rules, and best practices about coding in C++",CSS,https://github.com/isocpp/CppCoreGuidelines
7,50projects50days,39934,9664,39934,24,16/11/2020,26/02/2025,482.00 KB,482,"50+ mini web projects using HTML, CSS & JS",CSS,https://github.com/bradtraversy/50projects50days
8,freecodecamp.cn,37536,1399,37536,156,30/09/2016,16/07/2023,30.23 MB,30959,FCC China open source codebase and curriculum. Learn to code and help nonprofits.,CSS,https://github.com/FreeCodeCampChina/freecodecamp.cn
9,hangzhou_house_knowledge,27110,5271,27110,103,24/02/2018,28/02/2022,847.69 MB,868034,"2017å¹´ä¹°æˆ¿ç»å†æ€»ç»“å‡ºæ¥çš„ä¹°æˆ¿è´­æˆ¿çŸ¥è¯†åˆ†äº«ç»™å¤§å®¶ï¼Œå¸Œæœ›å¯¹å¤§å®¶æœ‰æ‰€å¸®åŠ©ã€‚ä¹°æˆ¿ä¸æ˜“ï¼Œä¸”ä¹°ä¸”çæƒœã€‚Sharing the knowledge of buy an own house that according  to the experience at hangzhou in 2017 to all the people. It's not easy to buy a own house, so I hope that it would be useful to everyone.",CSS,https://github.com/houshanren/hangzhou_house_knowledge
10,awesome-english-ebooks,26155,2101,26155,0,28/06/2022,16/10/2025,12.42 GB,13028113,"ç»æµå­¦äºº(å«éŸ³é¢‘)ã€çº½çº¦å®¢ã€å«æŠ¥ã€è¿çº¿ã€å¤§è¥¿æ´‹æœˆåˆŠç­‰è‹±è¯­æ‚å¿—å…è´¹ä¸‹è½½,æ”¯æŒepubã€mobiã€pdfæ ¼å¼, æ¯å‘¨æ›´æ–°",CSS,https://github.com/hehonghui/awesome-english-ebooks
