Ranking,Project Name,Stars,Forks,Watchers,Open Issues,Created At,Last Commit,Size,Description,Language,Repo URL,Size
481,router,13745,1584,13745,545,14/01/2019,05/03/2026,68.34 MB,"🤖 A client-first, server-capable, fully type-safe router and full-stack framework for the web (React and more).",TypeScript,https://github.com/TanStack/router,68.34 MB
482,partytown,13657,452,13657,83,20/08/2021,02/03/2026,21.40 MB,Relocate resource intensive third-party scripts off of the main thread and into a web worker. 🎉,TypeScript,https://github.com/QwikDev/partytown,21.40 MB
483,nextra,13655,1411,13655,317,15/06/2020,05/03/2026,39.73 MB,"Simple, powerful and flexible site generation framework with everything you love from Next.js.",TypeScript,https://github.com/shuding/nextra,39.73 MB
484,quicktype,13653,1172,13653,558,13/07/2017,27/10/2025,19.22 MB,"Generate types and converters from JSON, Schema, and GraphQL",TypeScript,https://github.com/glideapps/quicktype,19.22 MB
485,emoji-cheat-sheet,13627,4600,13627,85,17/03/2017,06/03/2026,31.09 MB,A markdown version emoji cheat sheet,TypeScript,https://github.com/ikatyang/emoji-cheat-sheet,31.09 MB
486,gitpod,13620,1371,13620,454,24/04/2018,05/03/2026,104.30 MB,The developer platform for on-demand cloud development environments to create software faster and more securely.,TypeScript,https://github.com/gitpod-io/gitpod,104.30 MB
487,draw-a-ui,13606,1639,13606,51,07/11/2023,26/07/2025,999.00 KB,Draw a mockup and generate html for it,TypeScript,https://github.com/SawyerHood/draw-a-ui,999.00 KB
488,color-thief,13565,1320,13565,6,01/11/2011,04/03/2026,3.31 MB,Grab the color palette from an image using just Javascript.  Works in the browser and in Node.,TypeScript,https://github.com/lokesh/color-thief,3.31 MB
489,nexe,13563,556,13563,163,26/11/2011,05/03/2026,32.14 MB,🎉 create a single executable out of your node.js apps,TypeScript,https://github.com/nexe/nexe,32.14 MB
490,kysely,13546,389,13546,163,22/02/2021,04/03/2026,52.92 MB,A type-safe TypeScript SQL query builder,TypeScript,https://github.com/kysely-org/kysely,52.92 MB
491,open-saas,13483,1541,13483,120,01/12/2023,05/03/2026,123.26 MB,"A 100% free modern JS SaaS boilerplate (React, NodeJS, Prisma). Full-featured: Auth (email, google, github, slack, MS), Email sending, Background jobs, Landing page, Payments (Stripe, Polar.sh), Shadcn UI, S3 file upload. AI-ready with tailored AGENTS.md, skills, and Claude Code plugin. One cmd deploy. Powered by Wasp full-stack framework.",TypeScript,https://github.com/wasp-lang/open-saas,123.26 MB
492,flipper,13482,983,13482,507,12/04/2018,26/09/2025,433.03 MB,A desktop debugging platform for mobile developers.,TypeScript,https://github.com/facebook/flipper,433.03 MB
493,ui-router,13457,2954,13457,25,18/01/2013,31/12/2025,13.14 MB,The de-facto solution to flexible routing with nested views in AngularJS,TypeScript,https://github.com/angular-ui/ui-router,13.14 MB
494,react-toastify,13444,740,13444,102,08/11/2016,25/08/2025,15.90 MB,React notification made easy 🚀 !,TypeScript,https://github.com/fkhadra/react-toastify,15.90 MB
495,Figma-Context-MCP,13417,1066,13417,42,13/02/2025,04/03/2026,646.00 KB,MCP server to provide Figma layout information to AI coding agents like Cursor,TypeScript,https://github.com/GLips/Figma-Context-MCP,646.00 KB
496,chartist,13406,2491,13406,244,09/03/2014,05/03/2026,15.16 MB,Simple responsive charts,TypeScript,https://github.com/chartist-js/chartist,15.16 MB
497,effect,13403,525,13403,496,13/11/2019,05/03/2026,93.37 MB,Build production-ready applications in TypeScript,TypeScript,https://github.com/Effect-TS/effect,93.37 MB
498,react-redux-typescript-guide,13335,1085,13335,34,20/12/2016,31/05/2022,2.87 MB,"The complete guide to static typing in ""React & Redux"" apps using TypeScript",TypeScript,https://github.com/piotrwitek/react-redux-typescript-guide,2.87 MB
499,blockly,13333,3830,13333,394,25/10/2013,05/03/2026,143.45 MB,The web-based visual programming editor.,TypeScript,https://github.com/RaspberryPiFoundation/blockly,143.45 MB
500,lenis,13303,526,13303,22,21/02/2022,04/03/2026,8.93 MB,Smooth scroll at it should be,TypeScript,https://github.com/darkroomengineering/lenis,8.93 MB
501,wechat-chatgpt,13279,3779,13279,62,06/12/2022,20/05/2024,1.27 MB,Use ChatGPT On Wechat via wechaty,TypeScript,https://github.com/fuergaosi233/wechat-chatgpt,1.27 MB
502,drawnix,13262,1109,13262,65,04/06/2024,03/03/2026,1.47 MB,"开源白板工具（SaaS），一体化白板，包含思维导图、流程图、自由画等。All in one open-source whiteboard tool with mind, flowchart, freehand and etc.",TypeScript,https://github.com/plait-board/drawnix,1.47 MB
503,omi,13260,1263,13260,69,31/05/2015,10/01/2026,156.02 MB,Web Components Framework - Web组件框架,TypeScript,https://github.com/Tencent/omi,156.02 MB
504,chromeless,13244,570,13244,198,01/06/2017,13/11/2018,1.06 MB,🖥  Chrome automation made simple. Runs locally or headless on AWS Lambda.,TypeScript,https://github.com/schickling/chromeless,1.06 MB
505,unleash,13239,839,13239,68,29/09/2014,05/03/2026,295.50 MB,Open-source feature management platform,TypeScript,https://github.com/Unleash/unleash,295.50 MB
506,peerjs,13236,1453,13236,198,23/12/2012,27/02/2026,10.76 MB,Simple peer-to-peer with WebRTC.,TypeScript,https://github.com/peers/peerjs,10.76 MB
507,tinacms,13189,683,13189,385,23/07/2019,06/03/2026,892.87 MB,A fully open-source headless CMS that supports Markdown and Visual Editing,TypeScript,https://github.com/tinacms/tinacms,892.87 MB
508,chatgpt-google-extension,13140,1476,13140,106,04/12/2022,14/08/2024,2.25 MB,This project is deprecated. Check my new project ChatHub:,TypeScript,https://github.com/wong2/chatgpt-google-extension,2.25 MB
509,ts-node,13138,548,13138,229,15/07/2015,18/07/2024,8.06 MB,TypeScript execution and REPL for node.js,TypeScript,https://github.com/TypeStrong/ts-node,8.06 MB
510,metamask-extension,13095,5531,13095,2578,06/09/2015,06/03/2026,1.14 GB,:globe_with_meridians: :electric_plug: The MetaMask browser extension enables browsing Ethereum blockchain enabled websites,TypeScript,https://github.com/MetaMask/metamask-extension,1.14 GB
511,satori,13080,333,13080,105,27/01/2022,05/03/2026,7.57 MB,Enlightened library to convert HTML and CSS to SVG,TypeScript,https://github.com/vercel/satori,7.57 MB
512,Auto-Claude,13038,1777,13038,338,04/12/2025,03/03/2026,54.63 MB,Autonomous multi-session AI coding,TypeScript,https://github.com/AndyMik90/Auto-Claude,54.63 MB
513,core,13035,830,13035,165,15/02/2017,04/03/2026,82.05 MB,"A toolchain for building scalable, enterprise-ready component systems on top of TypeScript and Web Component standards. Stencil components can be distributed natively to React, Angular, Vue, (+ more) and traditional web applications from a single, framework-agnostic codebase.",TypeScript,https://github.com/stenciljs/core,82.05 MB
514,stimulus,13029,443,13029,69,17/12/2016,21/01/2026,4.00 MB,A modest JavaScript framework for the HTML you already have,TypeScript,https://github.com/hotwired/stimulus,4.00 MB
515,shiki,13017,579,13017,98,29/10/2018,02/03/2026,15.74 MB,A beautiful yet powerful syntax highlighter,TypeScript,https://github.com/shikijs/shiki,15.74 MB
516,redux-persist,13002,856,13002,596,23/07/2015,01/05/2024,1.08 MB,persist and rehydrate a redux store,TypeScript,https://github.com/rt2zz/redux-persist,1.08 MB
517,ext-saladict,12996,829,12996,771,20/11/2015,08/10/2025,15.47 MB,"🥗 All-in-one professional pop-up dictionary and page translator which supports multiple search modes, page translations, new word notebook and PDF selection searching.",TypeScript,https://github.com/crimx/ext-saladict,15.47 MB
518,crystal,12911,612,12911,150,14/04/2016,05/03/2026,119.94 MB,"🔮 Graphile's Crystal Monorepo; home to Grafast, PostGraphile, pg-introspection, pg-sql2 and much more!",TypeScript,https://github.com/graphile/crystal,119.94 MB
519,plasmo,12908,452,12908,369,02/05/2022,06/03/2026,6.20 MB,🧩 The Browser Extension Framework,TypeScript,https://github.com/PlasmoHQ/plasmo,6.20 MB
520,interact.js,12901,804,12901,95,21/10/2012,28/03/2024,30.70 MB,"JavaScript drag and drop, resizing and multi-touch gestures with inertia and snapping for modern browsers (and also IE9+)",TypeScript,https://github.com/taye/interact.js,30.70 MB
521,google-webfonts-helper,12896,445,12896,63,22/12/2014,27/02/2026,792.00 KB,"A Hassle-Free Way to Self-Host Google Fonts. Get eot, ttf, svg, woff and woff2 files + CSS snippets",TypeScript,https://github.com/majodev/google-webfonts-helper,792.00 KB
522,barba,12883,492,12883,14,12/11/2015,02/12/2024,30.48 MB,"Create badass, fluid and smooth transitions between your website’s pages",TypeScript,https://github.com/barbajs/barba,30.48 MB
523,eigent,12857,1479,12857,171,29/07/2025,05/03/2026,115.76 MB,Eigent: The Open Source Cowork Desktop to Unlock Your Exceptional Productivity.,TypeScript,https://github.com/eigent-ai/eigent,115.76 MB
524,SponsorBlock,12851,438,12851,405,10/07/2019,05/03/2026,15.62 MB,Skip YouTube video sponsors (browser extension),TypeScript,https://github.com/ajayyy/SponsorBlock,15.62 MB
525,clash-nyanpasu,12830,778,12830,114,10/11/2023,05/03/2026,35.86 MB,Clash Nyanpasu～(∠・ω< )⌒☆​,TypeScript,https://github.com/libnyanpasu/clash-nyanpasu,35.86 MB
526,Vencord,12820,2037,12820,314,24/08/2022,05/03/2026,10.94 MB,The cutest Discord modification,TypeScript,https://github.com/Vendicated/Vencord,10.94 MB
527,playground,12796,2692,12796,141,04/04/2016,17/02/2026,1.52 MB,Play with neural networks!,TypeScript,https://github.com/tensorflow/playground,1.52 MB
528,qmd,12776,712,12776,207,08/12/2025,26/02/2026,5.70 MB,"mini cli search engine for your docs, knowledge bases, meeting notes, whatever. Tracking current sota approaches while being all local",TypeScript,https://github.com/tobi/qmd,5.70 MB
529,element-web,12762,2477,12762,3614,22/07/2015,05/03/2026,457.74 MB,A glossy Matrix collaboration client for the web.,TypeScript,https://github.com/element-hq/element-web,457.74 MB
530,Next-js-Boilerplate,12689,2362,12689,5,22/07/2020,05/03/2026,41.13 MB,"🚀🎉📚 Nextjs Boilerplate and Starter with App Router and Page Router support, Tailwind CSS 4 and TypeScript ⚡️ Made with developer experience first: Next.js 16 + TypeScript + ESLint + Prettier + Drizzle ORM + Husky + Lint-Staged + Vitest + Testing Library + Playwright + Storybook + Commitlint + VSCode + Sentry + PostCSS + Tailwind CSS ✨",TypeScript,https://github.com/ixartz/Next-js-Boilerplate,41.13 MB
531,aws-cdk,12681,4419,12681,2646,04/10/2017,05/03/2026,1.45 GB,The AWS Cloud Development Kit is a framework for defining cloud infrastructure in code,TypeScript,https://github.com/aws/aws-cdk,1.45 GB
532,banana-slides,12663,1478,12663,52,29/11/2025,05/03/2026,45.00 MB,一个基于nano banana pro🍌的原生AI PPT生成应用，迈向真正的＂Vibe PPT＂; 支持上传任意模板图片；上传任意素材&智能解析；一句话/大纲/页面描述自动生成PPT；口头修改指定区域、一键导出可编辑ppt - An AI-native slides generator based on nano banana pro🍌,TypeScript,https://github.com/Anionex/banana-slides,45.00 MB
533,browserless,12661,979,12661,43,17/11/2017,05/03/2026,101.00 MB,Deploy headless browsers in Docker. Run on our cloud or bring your own. Free for non-commercial uses.,TypeScript,https://github.com/browserless/browserless,101.00 MB
534,juice-shop,12636,16702,12636,17,19/09/2014,05/03/2026,267.06 MB,OWASP Juice Shop: Probably the most modern and sophisticated insecure web application,TypeScript,https://github.com/juice-shop/juice-shop,267.06 MB
535,tui.calendar,12634,1354,12634,208,11/09/2017,24/06/2024,77.07 MB,🍞📅A JavaScript calendar that has everything you need.,TypeScript,https://github.com/nhn/tui.calendar,77.07 MB
536,wp-calypso,12631,2003,12631,3312,10/11/2015,06/03/2026,946.96 MB,The JavaScript and API powered WordPress.com,TypeScript,https://github.com/Automattic/wp-calypso,946.96 MB
537,turbolinks,12630,612,12630,99,01/02/2016,11/08/2021,596.00 KB,Turbolinks makes navigating your web application faster,TypeScript,https://github.com/turbolinks/turbolinks,596.00 KB
538,formily,12613,1597,12613,138,09/01/2019,21/06/2025,28.23 MB,📱🚀 🧩 Cross Device & High Performance Normal Form/Dynamic(JSON Schema) Form/Form Builder -- Support React/React Native/Vue 2/Vue 3,TypeScript,https://github.com/alibaba/formily,28.23 MB
539,Zettlr,12590,768,12590,539,26/12/2017,04/03/2026,142.83 MB,Your One-Stop Publication Workbench,TypeScript,https://github.com/Zettlr/Zettlr,142.83 MB
540,comlink,12585,421,12585,117,06/09/2017,26/02/2026,2.10 MB,Comlink makes WebWorkers enjoyable.,TypeScript,https://github.com/GoogleChromeLabs/comlink,2.10 MB
541,G2,12527,1671,12527,179,26/05/2016,10/02/2026,348.09 MB,📊 The concise and progressive visualization grammar.,TypeScript,https://github.com/antvis/G2,348.09 MB
542,univer,12516,1108,12516,167,29/09/2022,05/03/2026,101.67 MB,"Build AI-native spreadsheets. Univer is a full-stack framework for creating and editing spreadsheets on both web and server. With Univer Platform, Univer Spreadsheets is driven directly through natural language.",TypeScript,https://github.com/dream-num/univer,101.67 MB
543,pragmatic-drag-and-drop,12508,321,12508,100,04/02/2024,05/03/2026,9.81 MB,Fast drag and drop for any experience on any tech stack,TypeScript,https://github.com/atlassian/pragmatic-drag-and-drop,9.81 MB
544,react-icons,12503,804,12503,234,23/10/2015,05/03/2026,340.37 MB,svg react icons of popular icon packs,TypeScript,https://github.com/react-icons/react-icons,340.37 MB
545,markmap,12500,943,12500,58,13/01/2020,12/06/2025,1.72 MB,Build mindmaps with plain text,TypeScript,https://github.com/markmap/markmap,1.72 MB
546,documenso,12470,2393,12470,251,12/03/2023,06/03/2026,238.52 MB,The Open Source DocuSign Alternative.,TypeScript,https://github.com/documenso/documenso,238.52 MB
547,highcharts,12418,3852,12418,657,11/06/2010,05/03/2026,401.88 MB,"Highcharts JS, the JavaScript charting framework",TypeScript,https://github.com/highcharts/highcharts,401.88 MB
548,clients,12415,1674,12415,1088,09/03/2016,06/03/2026,1.18 GB,"Bitwarden client apps (web, browser extension, desktop, and cli).",TypeScript,https://github.com/bitwarden/clients,1.18 GB
549,nanobrowser,12382,1287,12382,49,31/12/2024,24/11/2025,1.12 MB,Open-Source Chrome extension for AI-powered web automation. Run multi-agent workflows using your own LLM API key. Alternative to OpenAI Operator.,TypeScript,https://github.com/nanobrowser/nanobrowser,1.12 MB
550,snabbdom,12377,1116,12377,83,09/05/2015,23/10/2025,4.85 MB,"A virtual DOM library with focus on simplicity, modularity, powerful features and performance.",TypeScript,https://github.com/snabbdom/snabbdom,4.85 MB
551,illa-builder,12355,1209,12355,42,18/04/2022,22/02/2026,52.49 MB,"Low-code platform allows you to build business apps, enables you to quickly create internal tools such as dashboard, crud app, admin panel, crm, cms, etc. Supports PostgreSQL, MySQL, Supabase, GraphQL, MongoDB, MSSQL, Rest API, Hugging Face, Redis, etc. Automate workflows with schedule or webhook. Open source Retool. ",TypeScript,https://github.com/illacloud/illa-builder,52.49 MB
552,primeng,12343,5008,12343,1208,16/01/2016,05/03/2026,282.21 MB,The Most Complete Angular UI Component Library,TypeScript,https://github.com/primefaces/primeng,282.21 MB
553,noodle,12311,790,12311,15,19/05/2022,17/10/2024,14.07 MB,Rethinking Student Productivity,TypeScript,https://github.com/noodle-run/noodle,14.07 MB
554,cmdk,12308,359,12308,66,15/07/2022,29/10/2025,798.00 KB,"Fast, unstyled command menu React component.",TypeScript,https://github.com/dip/cmdk,798.00 KB
555,boardgame.io,12284,811,12284,121,21/11/2017,18/04/2025,13.79 MB,State Management and Multiplayer Networking for Turn-Based Games,TypeScript,https://github.com/boardgameio/boardgame.io,13.79 MB
556,linaria,12281,416,12281,146,23/05/2017,07/02/2026,32.72 MB,Zero-runtime CSS in JS library,TypeScript,https://github.com/callstack/linaria,32.72 MB
557,puck,12272,854,12272,194,02/06/2023,05/03/2026,6.71 MB,Create your own AI page builder,TypeScript,https://github.com/puckeditor/puck,6.71 MB
558,react-native-firebase,12258,2319,12258,93,01/02/2017,05/03/2026,105.36 MB,🔥 A well-tested feature-rich modular Firebase implementation for React Native. Supports both iOS & Android platforms for all Firebase services.,TypeScript,https://github.com/invertase/react-native-firebase,105.36 MB
559,mi-gpt,12220,1650,12220,6,24/01/2024,10/09/2025,32.61 MB,🏠 将小爱音箱接入 ChatGPT 和豆包，改造成你的专属语音助手。,TypeScript,https://github.com/idootop/mi-gpt,32.61 MB
560,theatre,12209,417,12209,139,23/12/2013,14/08/2024,26.99 MB,Motion design editor for the web,TypeScript,https://github.com/theatre-js/theatre,26.99 MB
561,voicebox,12201,1388,12201,191,25/01/2026,23/02/2026,87.43 MB,The open-source voice synthesis studio powered by Qwen3-TTS.,TypeScript,https://github.com/jamiepine/voicebox,87.43 MB
562,zerox,12159,833,12159,85,21/07/2024,20/05/2025,168.00 MB,OCR & Document Extraction using vision models,TypeScript,https://github.com/getomni-ai/zerox,168.00 MB
563,mapbox-gl-js,12160,2328,12160,1432,07/03/2013,05/03/2026,623.77 MB,"Interactive, thoroughly customizable maps in the browser, powered by vector tiles and WebGL",TypeScript,https://github.com/mapbox/mapbox-gl-js,623.77 MB
564,ralph,12135,1307,12135,53,07/01/2026,02/02/2026,4.59 MB,Ralph is an autonomous AI agent loop that runs repeatedly until all PRD items are complete. ,TypeScript,https://github.com/snarktank/ralph,4.59 MB
565,google-api-nodejs-client,12090,2012,12090,209,06/03/2013,03/03/2026,581.23 MB,"Google's officially supported Node.js client library for accessing Google APIs. Support for authorization and authentication with OAuth 2.0, API Keys and JWT (Service Tokens) is included. ",TypeScript,https://github.com/googleapis/google-api-nodejs-client,581.23 MB
566,mean,12085,3397,12085,96,22/05/2013,17/02/2026,10.32 MB,"The MEAN stack uses Mongo, Express, Angular(6) and Node for simple and scalable fullstack js applications",TypeScript,https://github.com/linnovate/mean,10.32 MB
567,InversifyJS,12067,718,12067,2,07/04/2015,19/11/2025,3.39 MB,Powerful and lightweight inversion of control container. Moved to https://github.com/inversify/monorepo,TypeScript,https://github.com/inversify/InversifyJS,3.39 MB
568,sonner,12049,411,12049,67,23/02/2023,23/12/2025,1.20 MB,An opinionated toast component for React.,TypeScript,https://github.com/emilkowalski/sonner,1.20 MB
569,aliyunpan,11993,1113,11993,344,22/04/2021,24/10/2022,11.66 MB,阿里云盘小白羊版  阿里云盘PC版 aliyundriver,TypeScript,https://github.com/liupan1890/aliyunpan,11.66 MB
570,G6,11988,1602,11988,328,13/02/2017,11/02/2026,80.60 MB,♾ A Graph Visualization Framework in JavaScript.,TypeScript,https://github.com/antvis/G6,80.60 MB
571,ant-design-mobile,11957,2495,11957,299,30/11/2015,09/01/2026,166.03 MB,Essential UI blocks for building mobile web apps.,TypeScript,https://github.com/ant-design/ant-design-mobile,166.03 MB
572,midscene,11953,869,11953,78,23/07/2024,05/03/2026,424.69 MB,Driving all platforms UI automation with vision-based model,TypeScript,https://github.com/web-infra-dev/midscene,424.69 MB
573,chokidar,11949,608,11949,34,20/04/2012,11/12/2025,2.01 MB,Minimal and efficient cross-platform file watching library,TypeScript,https://github.com/paulmillr/chokidar,2.01 MB
574,formbricks,11944,2129,11944,241,06/06/2022,05/03/2026,277.47 MB,Open Source Qualtrics Alternative,TypeScript,https://github.com/formbricks/formbricks,277.47 MB
575,sigma.js,11916,1618,11916,35,11/03/2012,05/03/2026,32.11 MB,A JavaScript library aimed at visualizing graphs of thousands of nodes and edges,TypeScript,https://github.com/jacomyal/sigma.js,32.11 MB
576,json-render,11914,628,11914,54,14/01/2026,02/03/2026,4.42 MB,The Generative UI framework,TypeScript,https://github.com/vercel-labs/json-render,4.42 MB
577,LaTeX-Workshop,11892,570,11892,5,26/12/2016,05/03/2026,47.17 MB,"Boost LaTeX typesetting efficiency with preview, compile, autocomplete, colorize, and more.",TypeScript,https://github.com/James-Yu/LaTeX-Workshop,47.17 MB
578,rete,11883,741,11883,6,28/02/2017,21/11/2025,1.89 MB,JavaScript framework for visual programming,TypeScript,https://github.com/retejs/rete,1.89 MB
579,signature_pad,11870,2190,11870,6,15/03/2013,23/01/2026,5.32 MB,HTML5 canvas based smooth signature drawing,TypeScript,https://github.com/szimek/signature_pad,5.32 MB
580,tsx,11839,221,11839,133,15/03/2022,13/02/2026,2.28 MB,⚡️ TypeScript Execute | The easiest way to run TypeScript in Node.js,TypeScript,https://github.com/privatenumber/tsx,2.28 MB
581,mitt,11836,483,11836,25,15/01/2017,14/08/2024,217.00 KB,🥊 Tiny 200 byte functional event emitter / pubsub.,TypeScript,https://github.com/developit/mitt,217.00 KB
582,openreplay,11819,693,11819,170,29/04/2021,05/03/2026,204.99 MB,"Session replay, cobrowsing and product analytics you can self-host. Best for reproducing issues and iterating on your product.",TypeScript,https://github.com/openreplay/openreplay,204.99 MB
583,A2UI,11765,890,11765,197,24/09/2025,06/03/2026,120.81 MB,,TypeScript,https://github.com/google/A2UI,120.81 MB
584,typescript-sdk,11763,1652,11763,334,24/09/2024,05/03/2026,6.59 MB,The official TypeScript SDK for Model Context Protocol servers and clients,TypeScript,https://github.com/modelcontextprotocol/typescript-sdk,6.59 MB
585,ui,11743,4860,11743,17,19/09/2016,20/02/2026,59.25 MB,"Open-source components, blocks, and AI agents designed to speed up your workflow. Import them seamlessly into your favorite tools through Registry and MCPs.",TypeScript,https://github.com/creativetimofficial/ui,59.25 MB
586,class-validator,11726,845,11726,306,03/10/2015,26/02/2026,5.15 MB,Decorator-based property validation for classes.,TypeScript,https://github.com/typestack/class-validator,5.15 MB
587,rybbit,11718,610,11718,155,14/01/2025,27/02/2026,261.89 MB,🐸 Rybbit - open-source and privacy-friendly alternative to Google Analytics that is 10x more intuitive.,TypeScript,https://github.com/rybbit-io/rybbit,261.89 MB
588,framework,11697,613,11697,60,10/12/2014,27/01/2023,3.18 MB,"The Aurelia 1 framework entry point, bringing together all the required sub-modules of Aurelia.",TypeScript,https://github.com/aurelia/framework,3.18 MB
589,logto,11635,725,11635,202,19/06/2021,06/03/2026,103.58 MB,"🧑‍🚀 Authentication and authorization infrastructure for SaaS and AI apps, built on OIDC and OAuth 2.1 with multi-tenancy, SSO, and RBAC.",TypeScript,https://github.com/logto-io/logto,103.58 MB
590,kepler.gl,11611,1919,11611,617,28/02/2018,27/02/2026,41.28 MB,Kepler.gl is a powerful open source geospatial analysis tool for large-scale data sets.,TypeScript,https://github.com/keplergl/kepler.gl,41.28 MB
591,botkit,11584,2268,11584,45,11/12/2015,01/07/2024,11.79 MB,"Botkit is an open source developer tool for building chat bots, apps and custom integrations for major messaging platforms.",TypeScript,https://github.com/howdyai/botkit,11.79 MB
592,changesets,11492,761,11492,461,21/03/2019,04/03/2026,5.50 MB,🦋       A way to manage your versioning and changelogs with a focus on monorepos,TypeScript,https://github.com/changesets/changesets,5.50 MB
593,scira,11491,1459,11491,17,07/08/2024,10/02/2026,15.48 MB,Scira (Formerly MiniPerplx) is a minimalistic AI-powered search engine that helps you find information on the internet and cites it too. Powered by Vercel AI SDK!,TypeScript,https://github.com/zaidmukaddam/scira,15.48 MB
594,fp-ts,11481,511,11481,192,25/01/2017,18/08/2025,22.62 MB,Functional programming in TypeScript,TypeScript,https://github.com/gcanti/fp-ts,22.62 MB
595,tsdx,11464,506,11464,40,24/01/2019,09/02/2026,4.18 MB,Zero-config CLI for TypeScript package development,TypeScript,https://github.com/jaredpalmer/tsdx,4.18 MB
596,quartz,11402,3518,11402,308,18/07/2021,04/03/2026,37.53 MB,"🌱 a fast, batteries-included static-site generator that transforms Markdown content into fully functional websites",TypeScript,https://github.com/jackyzha0/quartz,37.53 MB
597,giscus,11342,458,11342,122,27/03/2021,06/07/2025,3.43 MB,A commenting system powered by GitHub Discussions. :octocat: :speech_balloon: :gem:,TypeScript,https://github.com/giscus/giscus,3.43 MB
598,shadcn-admin,11328,1832,11328,13,26/01/2024,11/02/2026,2.91 MB,Admin Dashboard UI built with Shadcn and Vite.,TypeScript,https://github.com/satnaing/shadcn-admin,2.91 MB
599,starter-workflows,11325,6841,11325,411,29/07/2019,26/02/2026,3.58 MB,Accelerating new GitHub Actions workflows ,TypeScript,https://github.com/actions/starter-workflows,3.58 MB
600,react-styleguidist,11291,1427,11291,246,07/09/2015,07/01/2025,25.77 MB,Isolated React component development environment with a living style guide,TypeScript,https://github.com/styleguidist/react-styleguidist,25.77 MB
601,oni,11276,298,11276,518,16/11/2016,01/04/2020,39.38 MB,Oni: Modern Modal Editing - powered by Neovim,TypeScript,https://github.com/onivim/oni,39.38 MB
602,victory,11267,536,11267,91,02/07/2015,19/12/2025,64.13 MB,A collection of composable React components for building interactive data visualizations,TypeScript,https://github.com/FormidableLabs/victory,64.13 MB
603,ccusage,11264,397,11264,115,29/05/2025,05/03/2026,9.26 MB,A CLI tool for analyzing Claude Code/Codex CLI usage from local JSONL files.,TypeScript,https://github.com/ryoppippi/ccusage,9.26 MB
604,vee-validate,11242,1301,11242,159,30/07/2016,04/03/2026,22.96 MB,✅  Painless Vue forms,TypeScript,https://github.com/logaretm/vee-validate,22.96 MB
605,graphql-code-generator,11223,1392,11223,623,05/12/2016,05/03/2026,90.93 MB,"A tool for generating code based on a GraphQL schema and GraphQL operations (query/mutation/subscription), with flexible support for custom plugins. ",TypeScript,https://github.com/dotansimha/graphql-code-generator,90.93 MB
