Ranking,Project Name,Stars,Forks,Watchers,Open Issues,Created At,Last Commit,Size,Description,Language,Repo URL,Size
241,react-starter-kit,23544,4219,23544,9,16/04/2014,02/03/2026,28.47 MB,"Modern React starter kit with Bun, TypeScript, Tailwind CSS, tRPC, Stripe, and Cloudflare Workers. Production-ready monorepo for building fast web apps.",TypeScript,https://github.com/kriasoft/react-starter-kit,28.47 MB
242,react-redux,23505,3342,23505,37,11/07/2015,19/03/2026,11.96 MB,Official React bindings for Redux,TypeScript,https://github.com/reduxjs/react-redux,11.96 MB
243,langfuse,23431,2372,23431,593,18/05/2023,19/03/2026,73.63 MB,"🪢 Open source LLM engineering platform: LLM Observability, metrics, evals, prompt management, playground, datasets. Integrates with OpenTelemetry, Langchain, OpenAI SDK, LiteLLM, and more. 🍊YC W23 ",TypeScript,https://github.com/langfuse/langfuse,73.63 MB
244,next-ai-draw-io,23405,2485,23405,130,23/03/2025,18/03/2026,5.38 MB,"A next.js web application that integrates AI capabilities with draw.io diagrams. This app allows you to create, modify, and enhance diagrams through natural language commands and AI-assisted visualization.",TypeScript,https://github.com/DayuanJiang/next-ai-draw-io,5.38 MB
245,toon,23371,1042,23371,14,22/10/2025,10/03/2026,1.94 MB,"🎒 Token-Oriented Object Notation (TOON) – Compact, human-readable, schema-aware JSON for LLM prompts. Spec, benchmarks, TypeScript SDK.",TypeScript,https://github.com/toon-format/toon,1.94 MB
246,github1s,23290,907,23290,64,16/06/2019,28/02/2026,18.13 MB,One second to read GitHub code with VS Code.,TypeScript,https://github.com/conwnet/github1s,18.13 MB
247,dub,23203,2893,23203,104,27/08/2022,20/03/2026,78.75 MB,"The modern link attribution platform. Loved by world-class marketing teams like Framer, Perplexity, Superhuman, Twilio, Buffer and more.",TypeScript,https://github.com/dubinc/dub,78.75 MB
248,lexical,23123,2110,23123,546,03/12/2020,19/03/2026,130.43 MB,"Lexical is an extensible text editor framework that provides excellent reliability, accessibility and performance.",TypeScript,https://github.com/facebook/lexical,130.43 MB
249,rxdb,23089,1155,23089,12,02/12/2016,20/03/2026,528.44 MB,"A fast, local first, reactive Database for JavaScript Applications https://rxdb.info/",TypeScript,https://github.com/pubkey/rxdb,528.44 MB
250,ai,22804,4022,22804,1379,23/05/2023,20/03/2026,162.56 MB,"The AI Toolkit for TypeScript. From the creators of Next.js, the AI SDK is a free open-source library for building AI-powered applications and agents ",TypeScript,https://github.com/vercel/ai,162.56 MB
251,Roo-Code,22745,2921,22745,720,31/10/2024,20/03/2026,356.47 MB,Roo Code gives you a whole dev team of AI agents in your code editor.,TypeScript,https://github.com/RooCodeInc/Roo-Code,356.47 MB
252,react-bootstrap,22646,3603,22646,207,27/12/2013,19/03/2026,32.50 MB,Bootstrap components built with React,TypeScript,https://github.com/react-bootstrap/react-bootstrap,32.50 MB
253,wechaty,22613,2793,22613,191,01/05/2016,21/12/2025,8.82 MB,Conversational RPA SDK for Chatbot Makers. Join our Discord: https://discord.gg/7q8NBZbQzt,TypeScript,https://github.com/wechaty/wechaty,8.82 MB
254,ember.js,22573,4192,22573,403,25/05/2011,19/03/2026,103.98 MB,Ember.js - A JavaScript framework for creating ambitious web applications,TypeScript,https://github.com/emberjs/ember.js,103.98 MB
255,repomix,22538,1048,22538,150,13/07/2024,20/03/2026,16.62 MB,"📦 Repomix is a powerful tool that packs your entire repository into a single, AI-friendly file. Perfect for when you need to feed your codebase to Large Language Models (LLMs) or other AI tools like Claude, ChatGPT, DeepSeek, Perplexity, Gemini, Gemma, Llama, Grok, and more.",TypeScript,https://github.com/yamadashy/repomix,16.62 MB
256,dockge,22522,716,22522,143,23/10/2023,21/01/2026,813.00 KB,"A fancy, easy-to-use and reactive self-hosted docker compose.yaml stack-oriented manager",TypeScript,https://github.com/louislam/dockge,813.00 KB
257,crawlee,22429,1274,22429,177,26/08/2016,20/03/2026,154.96 MB,"Crawlee—A web scraping and browser automation library for Node.js to build reliable crawlers. In JavaScript and TypeScript. Extract data for AI, LLMs, RAG, or GPTs. Download HTML, PDF, JPG, PNG, and other files from websites. Works with Puppeteer, Playwright, Cheerio, JSDOM, and raw HTTP. Both headful and headless mode. With proxy rotation.",TypeScript,https://github.com/apify/crawlee,154.96 MB
258,generator-jhipster,22369,4162,22369,124,21/10/2013,20/03/2026,183.93 MB,"JHipster is a development platform to quickly generate, develop, & deploy modern web applications & microservice architectures.",TypeScript,https://github.com/jhipster/generator-jhipster,183.93 MB
259,sweetalert,22330,2780,22330,200,30/09/2014,15/04/2023,5.35 MB,"A beautiful replacement for JavaScript's ""alert""",TypeScript,https://github.com/t4t5/sweetalert,5.35 MB
260,beekeeper-studio,22238,1471,22238,1048,23/07/2019,19/03/2026,112.64 MB,"Modern and easy to use SQL client for MySQL, Postgres, SQLite, SQL Server, and more. Linux, MacOS, and Windows.",TypeScript,https://github.com/beekeeper-studio/beekeeper-studio,112.64 MB
261,gpt-crawler,22202,2391,22202,110,14/11/2023,07/07/2025,884.00 KB,Crawl a site to generate knowledge files to create your own custom GPT from a URL,TypeScript,https://github.com/BuilderIO/gpt-crawler,884.00 KB
262,openui,22178,2048,22178,84,17/03/2024,11/02/2026,25.80 MB,"OpenUI let's you describe UI using your imagination, then see it rendered live.",TypeScript,https://github.com/wandb/openui,25.80 MB
263,vueuse,22148,2875,22148,337,14/12/2019,20/03/2026,15.83 MB,Collection of essential Vue Composition Utilities for Vue 3,TypeScript,https://github.com/vueuse/vueuse,15.83 MB
264,mastra,22147,1754,22147,385,06/08/2024,20/03/2026,1.03 GB,"From the team behind Gatsby, Mastra is a framework for building AI-powered applications and agents with a modern TypeScript stack.",TypeScript,https://github.com/mastra-ai/mastra,1.03 GB
265,react-grid-layout,22136,2701,22136,81,27/12/2014,01/03/2026,18.47 MB,"A draggable and resizable grid layout with responsive breakpoints, for React.",TypeScript,https://github.com/react-grid-layout/react-grid-layout,18.47 MB
266,clash-verge,22045,3184,22045,235,04/12/2021,03/11/2023,9.70 MB,"A Clash GUI based on tauri. Supports Windows, macOS and Linux.",TypeScript,https://github.com/zzzgydi/clash-verge,9.70 MB
267,qwik,21958,1384,21958,106,19/05/2021,20/03/2026,69.02 MB,"Instant-loading web apps, without effort",TypeScript,https://github.com/QwikDev/qwik,69.02 MB
268,ruflo,21906,2396,21906,376,02/06/2025,19/03/2026,492.95 MB,"🌊 The leading agent orchestration platform for Claude. Deploy intelligent multi-agent swarms, coordinate autonomous workflows, and build conversational AI systems. Features    enterprise-grade architecture, distributed swarm intelligence, RAG integration, and native Claude Code / Codex Integration",TypeScript,https://github.com/ruvnet/ruflo,492.95 MB
269,nocobase,21866,2492,21866,295,24/10/2020,20/03/2026,265.71 MB,NocoBase is the most extensible AI-powered no-code/low-code platform for building business applications and enterprise solutions.,TypeScript,https://github.com/nocobase/nocobase,265.71 MB
270,darkreader,21809,2675,21809,1431,15/11/2014,18/03/2026,35.36 MB,Dark Reader Chrome and Firefox extension,TypeScript,https://github.com/darkreader/darkreader,35.36 MB
271,clash-party,21744,1726,21744,263,02/08/2024,18/03/2026,15.39 MB,:electron: Another Mihomo GUI. ,TypeScript,https://github.com/mihomo-party-org/clash-party,15.39 MB
272,qwerty-learner,21660,2393,21660,271,21/01/2021,09/03/2026,192.87 MB,为键盘工作者设计的单词记忆与英语肌肉记忆锻炼软件 / Words learning and English muscle memory training software designed for keyboard workers,TypeScript,https://github.com/RealKai42/qwerty-learner,192.87 MB
273,react-dnd,21638,2011,21638,474,19/10/2014,06/07/2025,574.25 MB,Drag and Drop for React,TypeScript,https://github.com/react-dnd/react-dnd,574.25 MB
274,lucide,21624,1237,21624,518,08/06/2020,19/03/2026,18.61 MB,Beautiful & consistent icon toolkit made by the community. Open-source project and a fork of Feather Icons.,TypeScript,https://github.com/lucide-icons/lucide,18.61 MB
275,stagehand,21616,1425,21616,169,24/03/2024,20/03/2026,78.14 MB,The AI Browser Automation Framework,TypeScript,https://github.com/browserbase/stagehand,78.14 MB
276,chartdb,21611,1299,21611,142,05/08/2024,14/03/2026,66.96 MB,Database diagrams editor that allows you to visualize and design your DB with a single query.,TypeScript,https://github.com/chartdb/chartdb,66.96 MB
277,blueprint,21551,2264,21551,901,25/10/2016,19/03/2026,384.62 MB,A React-based UI toolkit for the web,TypeScript,https://github.com/palantir/blueprint,384.62 MB
278,typescript-book,21504,2616,21504,151,21/03/2015,29/06/2024,8.51 MB,:books: The definitive guide to TypeScript and possibly the best TypeScript book :book:. Free and Open Source 🌹,TypeScript,https://github.com/basarat/typescript-book,8.51 MB
279,Inquirer.js,21489,1350,21489,24,17/05/2013,16/03/2026,4.67 GB,A collection of common interactive command line user interfaces.,TypeScript,https://github.com/SBoudrias/Inquirer.js,4.67 GB
280,theia,21405,2809,21405,1451,24/02/2017,20/03/2026,199.10 MB,Eclipse Theia is a cloud & desktop IDE framework implemented in TypeScript.,TypeScript,https://github.com/eclipse-theia/theia,199.10 MB
281,lit,21331,1056,21331,659,29/06/2017,16/03/2026,60.88 MB,"Lit is a simple library for building fast, lightweight web components.",TypeScript,https://github.com/lit/lit,60.88 MB
282,appium,21310,6271,21310,79,09/01/2013,20/03/2026,228.70 MB,"Cross-platform automation framework for all kinds of apps, built on top of the W3C WebDriver protocol",TypeScript,https://github.com/appium/appium,228.70 MB
283,activepieces,21291,3435,21291,635,03/12/2022,20/03/2026,412.99 MB,AI Agents & MCPs & AI Workflow Automation • (~400 MCP servers for AI agents) • AI Automation / AI Agent with MCPs • AI Workflows & AI Agents • MCPs for AI Agents,TypeScript,https://github.com/activepieces/activepieces,412.99 MB
284,desktop,21287,10191,21287,982,11/05/2016,19/03/2026,107.39 MB,Focus on what matters instead of fighting with Git.,TypeScript,https://github.com/desktop/desktop,107.39 MB
285,open-notebook,21189,2414,21189,124,21/10/2024,17/03/2026,9.91 MB,An Open Source implementation of Notebook LM with more flexibility and features,TypeScript,https://github.com/lfnovo/open-notebook,9.91 MB
286,renovate,21077,2985,21077,1020,17/12/2016,19/03/2026,141.66 MB,Home of the Renovate CLI: Cross-platform Dependency Automation by Mend.io,TypeScript,https://github.com/renovatebot/renovate,141.66 MB
287,jotai,21066,710,21066,6,11/08/2020,18/03/2026,14.26 MB,👻 Primitive and flexible state management for React,TypeScript,https://github.com/pmndrs/jotai,14.26 MB
288,teable,21038,1229,21038,149,01/11/2022,19/03/2026,57.32 MB,✨ The Next Gen Airtable Alternative: No-Code Postgres,TypeScript,https://github.com/teableio/teable,57.32 MB
289,opcode,21014,1618,21014,327,19/06/2025,16/10/2025,2.51 MB,"A powerful GUI app and Toolkit for Claude Code - Create custom agents, manage interactive Claude Code sessions, run secure background agents, and more.",TypeScript,https://github.com/winfunc/opcode,2.51 MB
290,kibana,21012,8547,21012,13645,26/01/2013,20/03/2026,13.08 GB,Your window into all of your data,TypeScript,https://github.com/elastic/kibana,13.08 GB
291,personal-security-checklist,20969,1430,20969,57,02/03/2018,28/02/2026,89.83 MB,🔒 A compiled checklist of 300+ tips for protecting digital security and privacy in 2026,TypeScript,https://github.com/Lissy93/personal-security-checklist,89.83 MB
292,react-scan,20824,349,20824,57,02/09/2024,07/03/2026,43.22 MB,Scan for React performance issues and eliminate slow renders in your app,TypeScript,https://github.com/aidenybai/react-scan,43.22 MB
293,qwen-code,20784,1840,20784,615,26/06/2025,20/03/2026,71.76 MB,An open-source AI agent that lives in your terminal.,TypeScript,https://github.com/QwenLM/qwen-code,71.76 MB
294,visx,20677,756,20677,149,15/03/2017,11/11/2025,16.33 MB,🐯 visx | visualization components,TypeScript,https://github.com/airbnb/visx,16.33 MB
295,deskreen,20428,1132,20428,20,08/08/2020,08/02/2026,10.86 MB,Deskreen turns any device with a web browser into a secondary screen for your computer. ⭐️ Star to support our work!,TypeScript,https://github.com/pavlobu/deskreen,10.86 MB
296,fullcalendar,20396,3713,20396,1103,22/11/2009,23/12/2025,31.75 MB,Full-sized drag & drop event calendar in JavaScript,TypeScript,https://github.com/fullcalendar/fullcalendar,31.75 MB
297,NativeBase,20387,2417,20387,379,15/04/2016,31/01/2026,69.35 MB,"Mobile-first, accessible components for React Native & Web to build consistent UI across Android, iOS and Web.",TypeScript,https://github.com/GeekyAnts/NativeBase,69.35 MB
298,bokeh,20367,4255,20367,859,26/03/2012,19/03/2026,373.73 MB,"Interactive Data Visualization in the browser, from  Python",TypeScript,https://github.com/bokeh/bokeh,373.73 MB
299,graphql-js,20334,2058,20334,134,30/06/2015,17/03/2026,28.89 MB,A reference implementation of GraphQL for JavaScript,TypeScript,https://github.com/graphql/graphql-js,28.89 MB
300,wenyan,20245,1102,20245,213,08/12/2019,20/10/2023,46.28 MB,文言文編程語言 A programming language for the ancient Chinese.,TypeScript,https://github.com/wenyan-lang/wenyan,46.28 MB
301,coze-studio,20244,2900,20244,478,26/06/2025,16/03/2026,73.52 MB,"An AI agent development platform with all-in-one visual tools, simplifying agent creation, debugging, and deployment like never before. Coze your way to AI Agent creation.",TypeScript,https://github.com/coze-dev/coze-studio,73.52 MB
302,xterm.js,20151,1837,20151,124,24/03/2014,14/03/2026,32.62 MB,A terminal for the web,TypeScript,https://github.com/xtermjs/xterm.js,32.62 MB
303,web3.js,19961,5085,19961,144,30/09/2014,05/03/2025,133.87 MB,Collection of comprehensive TypeScript libraries for Interaction with the Ethereum JSON RPC API and utility functions.,TypeScript,https://github.com/web3/web3.js,133.87 MB
304,chatbot,19920,6407,19920,79,19/05/2023,19/03/2026,15.90 MB,"A full-featured, hackable Next.js AI chatbot built by Vercel",TypeScript,https://github.com/vercel/chatbot,15.90 MB
305,dyad,19916,2297,19916,281,11/04/2025,19/03/2026,30.08 MB,"Local, open-source AI app builder for power users ✨ v0 / Lovable / Replit / Bolt alternative 🌟 Star if you like it!",TypeScript,https://github.com/dyad-sh/dyad,30.08 MB
306,KaTeX,19901,1291,19901,439,05/07/2013,19/03/2026,91.58 MB,Fast math typesetting for the web.,TypeScript,https://github.com/KaTeX/KaTeX,91.58 MB
307,fluentui,19880,2875,19880,670,06/06/2016,19/03/2026,806.95 MB,"Fluent UI web represents a collection of utilities, React components, and web components for building web applications.",TypeScript,https://github.com/microsoft/fluentui,806.95 MB
308,apollo-client,19723,2705,19723,420,26/02/2016,18/03/2026,98.16 MB,"The industry-leading GraphQL client for TypeScript, JavaScript, React, Vue, Angular, and more. Apollo Client delivers powerful caching, intuitive APIs, and comprehensive developer tools to accelerate your app development.",TypeScript,https://github.com/apollographql/apollo-client,98.16 MB
309,ignite,19699,1519,19699,32,10/02/2016,18/03/2026,60.39 MB,"Infinite Red's battle-tested React Native project boilerplate, along with a CLI, component/model generators, and more! 9 years of continuous development and counting.",TypeScript,https://github.com/infinitered/ignite,60.39 MB
310,monkeytype,19620,3083,19620,88,14/05/2020,19/03/2026,146.01 MB,"The most customizable typing website with a minimalistic design and a ton of features. Test yourself in various modes, track your progress and improve your speed.",TypeScript,https://github.com/monkeytypegame/monkeytype,146.01 MB
311,winboat,19608,523,19608,299,04/04/2025,25/02/2026,16.63 MB,Run Windows apps on 🐧 Linux with ✨ seamless integration,TypeScript,https://github.com/TibixDev/winboat,16.63 MB
312,pangolin,19585,603,19585,88,27/09/2024,19/03/2026,52.05 MB,"Identity-aware VPN and proxy for remote access to anything, anywhere.",TypeScript,https://github.com/fosrl/pangolin,52.05 MB
313,suna,19524,3373,19524,14,05/10/2024,17/03/2026,261.12 MB,"Kortix – build, manage and train AI Agents.",TypeScript,https://github.com/kortix-ai/suna,261.12 MB
314,BongoCat,19512,885,19512,58,28/03/2025,22/01/2026,10.00 MB,🐱 跨平台互动桌宠 BongoCat，为桌面增添乐趣！,TypeScript,https://github.com/ayangweb/BongoCat,10.00 MB
315,docmost,19479,1168,19479,273,03/08/2023,17/03/2026,8.45 MB,Docmost is an open-source collaborative wiki and documentation software. It is an open-source alternative to Confluence and Notion.,TypeScript,https://github.com/docmost/docmost,8.45 MB
316,qinglong,19409,3248,19409,126,13/03/2021,13/03/2026,7.06 MB,"支持 Python3、JavaScript、Shell、Typescript 的定时任务管理平台（Timed task management platform supporting Python3, JavaScript, Shell, Typescript）",TypeScript,https://github.com/whyour/qinglong,7.06 MB
317,rrweb,19339,1638,19339,399,06/10/2018,19/03/2026,11.48 MB,record and replay the web,TypeScript,https://github.com/rrweb-io/rrweb,11.48 MB
318,AionUi,19211,1527,19211,328,07/08/2025,19/03/2026,435.11 MB,"Free, local, open-source 24/7 Cowork app and OpenClaw for Gemini CLI, Claude Code, Codex, OpenCode, Qwen Code, Goose CLI, Auggie, and more | 🌟 Star if you like it!",TypeScript,https://github.com/iOfficeAI/AionUi,435.11 MB
319,taxonomy,19177,2706,19177,218,18/10/2022,14/08/2024,14.14 MB,"An open source application built using the new router, server components and everything new in Next.js 13.",TypeScript,https://github.com/shadcn-ui/taxonomy,14.14 MB
320,agents.md,19166,1380,19166,125,19/08/2025,12/03/2026,1.87 MB,"AGENTS.md — a simple, open format for guiding coding agents",TypeScript,https://github.com/agentsmd/agents.md,1.87 MB
321,FossFLOW,19165,1255,19165,14,30/06/2025,18/03/2026,3.53 MB,Make beautiful isometric infrastructure diagrams,TypeScript,https://github.com/stan-smith/FossFLOW,3.53 MB
322,Kap,19142,870,19142,247,10/08/2016,12/11/2024,24.05 MB,An open-source screen recorder built with web technology,TypeScript,https://github.com/wulkano/Kap,24.05 MB
323,docs,19140,66402,19140,167,31/05/2019,19/03/2026,2.17 GB,The open-source repo for docs.github.com,TypeScript,https://github.com/github/docs,2.17 GB
324,upterm,19123,615,19123,220,22/03/2015,20/05/2019,7.63 MB,A terminal emulator for the 21st century.,TypeScript,https://github.com/railsware/upterm,7.63 MB
325,tfjs,19114,2024,19114,638,05/03/2018,06/02/2026,170.13 MB,A WebGL accelerated JavaScript library for training and deploying ML models.,TypeScript,https://github.com/tensorflow/tfjs,170.13 MB
326,reselect,19057,661,19057,45,01/07/2015,26/09/2025,5.96 MB,Selector library for Redux,TypeScript,https://github.com/reduxjs/reselect,5.96 MB
327,awesome-shadcn-ui,19047,1147,19047,4,05/02/2024,18/03/2026,1.32 MB,A curated list of awesome things related to shadcn/ui.,TypeScript,https://github.com/birobirobiro/awesome-shadcn-ui,1.32 MB
328,egg,19008,1813,19008,382,18/06/2016,19/03/2026,27.16 MB,🥚🥚🥚🥚 Born to build better enterprise frameworks and apps with Node.js & Koa. https://307.run/eggcode,TypeScript,https://github.com/eggjs/egg,27.16 MB
329,amis,18841,2722,18841,1706,28/04/2019,18/03/2026,187.90 MB,前端低代码框架，通过 JSON 配置就能生成各种页面。,TypeScript,https://github.com/baidu/amis,187.90 MB
330,subql,18836,389,18836,96,15/12/2020,09/03/2026,45.59 MB,"SubQuery is an Open, Flexible, Fast and Universal data indexing framework for web3. Our mission is to help developers create the decentralised products of the future.",TypeScript,https://github.com/subquery/subql,45.59 MB
331,readest,18831,1020,18831,118,12/10/2024,19/03/2026,68.48 MB,"Readest is a modern, feature-rich ebook reader designed for avid readers offering seamless cross-platform access, powerful tools, and an intuitive interface to elevate your reading experience.",TypeScript,https://github.com/readest/readest,68.48 MB
332,12-factor-agents,18823,1429,18823,21,30/03/2025,21/09/2025,44.42 MB,What are the principles we can use to build LLM-powered software that is actually good enough to put in the hands of production customers?,TypeScript,https://github.com/humanlayer/12-factor-agents,44.42 MB
333,core,18801,665,18801,3,15/08/2015,18/03/2026,6.19 MB,"AdonisJS is a TypeScript-first web framework for building web apps and API servers. It comes with support for testing, modern tooling, an ecosystem of official packages, and more.",TypeScript,https://github.com/adonisjs/core,6.19 MB
334,primitives,18708,1131,18708,782,19/06/2020,13/02/2026,21.12 MB,"Radix Primitives is an open-source UI component library for building high-quality, accessible design systems and web apps. Maintained by @workos.",TypeScript,https://github.com/radix-ui/primitives,21.12 MB
335,unocss,18691,966,18691,164,30/09/2021,18/03/2026,19.46 MB,The instant on-demand atomic CSS engine.,TypeScript,https://github.com/unocss/unocss,19.46 MB
336,ice,18644,2123,18644,386,03/11/2016,19/03/2026,149.16 MB,🚀 ice.js: The Progressive App Framework Based On React（基于 React 的渐进式应用框架）,TypeScript,https://github.com/alibaba/ice,149.16 MB
337,newsnow,18634,5328,18634,129,23/09/2024,27/02/2026,5.53 MB,Elegant reading of real-time and hottest news,TypeScript,https://github.com/ourongxing/newsnow,5.53 MB
338,compiler-explorer,18628,2008,18628,775,23/05/2012,19/03/2026,94.58 MB,Run compilers interactively from your web browser and interact with the assembly,TypeScript,https://github.com/compiler-explorer/compiler-explorer,94.58 MB
339,deep-research,18593,1932,18593,79,04/02/2025,08/09/2025,72.00 KB,"An AI-powered research assistant that performs iterative, deep research on any topic by combining search engines, web scraping, and large language models.  The goal of this repo is to provide the simplest implementation of a deep research agent - e.g. an agent that can refine its research direction overtime and deep dive into a topic.",TypeScript,https://github.com/dzhng/deep-research,72.00 KB
340,catppuccin,18581,340,18581,91,06/11/2021,23/02/2026,11.72 MB,😸 Soothing pastel theme for the high-spirited!,TypeScript,https://github.com/catppuccin/catppuccin,11.72 MB
341,commitlint,18396,958,18396,170,12/02/2016,18/03/2026,20.34 MB,📓 Lint commit messages,TypeScript,https://github.com/conventional-changelog/commitlint,20.34 MB
342,bit,18363,951,18363,70,22/01/2017,19/03/2026,201.92 MB,"AI-powered development workspaces with reusable components, architectural clarity and zero overhead.",TypeScript,https://github.com/teambit/bit,201.92 MB
343,wangEditor,18318,3360,18318,873,06/11/2014,11/10/2024,18.72 MB,"wangEditor, open-source Web rich text editor 开源 Web 富文本编辑器",TypeScript,https://github.com/wangeditor-team/wangEditor,18.72 MB
344,motion-canvas,18280,725,18280,171,03/08/2022,16/02/2025,10.75 MB,Visualize Your Ideas With Code,TypeScript,https://github.com/motion-canvas/motion-canvas,10.75 MB
345,openobserve,18233,758,18233,659,02/02/2023,20/03/2026,123.42 MB,"OpenObserve is an open-source observability platform for logs, metrics, traces, and frontend monitoring. A cost-effective alternative to Datadog, Splunk, and Elasticsearch with 140x lower storage costs and single binary deployment.",TypeScript,https://github.com/openobserve/openobserve,123.42 MB
346,react-email,18222,943,18222,70,19/09/2022,19/03/2026,106.66 MB,💌 Build and send emails using React,TypeScript,https://github.com/resend/react-email,106.66 MB
347,wasp,18201,1431,18201,841,30/01/2020,20/03/2026,799.14 MB,"The batteries-included full-stack framework for the AI era. Develop JS/TS web apps (React, Node.js, and Prisma) using declarative code that abstracts away complex full-stack features like auth, background jobs, RPC, email sending, end-to-end type safety, single-command deployment, and more.",TypeScript,https://github.com/wasp-lang/wasp,799.14 MB
348,naive-ui,18200,1853,18200,659,04/06/2021,19/03/2026,27.06 MB,A Vue 3 Component Library. Fairly Complete. Theme Customizable. Uses TypeScript. Fast.,TypeScript,https://github.com/tusen-ai/naive-ui,27.06 MB
349,etherpad-lite,18191,3011,18191,126,26/03/2011,19/03/2026,42.49 MB,Etherpad: A modern really-real-time collaborative document editor.,TypeScript,https://github.com/ether/etherpad-lite,42.49 MB
350,yaak,18183,726,18183,24,16/02/2023,17/03/2026,35.16 MB,"The most intuitive desktop API client. Organize and execute REST, GraphQL, WebSockets, Server Sent Events, and gRPC 🦬",TypeScript,https://github.com/mountain-loop/yaak,35.16 MB
351,agentic,18129,2239,18129,15,03/12/2022,11/02/2026,16.61 MB,Your API ⇒ Paid MCP. Instantly.,TypeScript,https://github.com/transitive-bullshit/agentic,16.61 MB
352,dexter,18071,2229,18071,49,14/10/2025,19/03/2026,1.05 MB,An autonomous agent for deep financial research,TypeScript,https://github.com/virattt/dexter,1.05 MB
353,super-productivity,18049,1551,18049,856,06/01/2017,20/03/2026,137.45 MB,"Super Productivity is an advanced todo list app with integrated Timeboxing and time tracking capabilities. It also comes with integrations for Jira, GitLab, GitHub and Open Project.",TypeScript,https://github.com/super-productivity/super-productivity,137.45 MB
354,ionicons,18009,2059,18009,67,10/10/2013,17/03/2026,28.02 MB,"Premium hand-crafted icons built by Ionic, for Ionic apps and web apps everywhere 🌎",TypeScript,https://github.com/ionic-team/ionicons,28.02 MB
