Ranking,Project Name,Stars,Forks,Watchers,Open Issues,Created At,Last Commit,Size,Description,Language,Repo URL,Size
721,amplify-js,9592,2172,9592,476,02/10/2017,20/03/2026,243.04 MB,A declarative JavaScript library for application development using cloud services.,TypeScript,https://github.com/aws-amplify/amplify-js,243.04 MB
722,use-gesture,9587,328,9587,50,23/03/2018,15/07/2024,182.61 MB,👇Bread n butter utility for component-tied mouse/touch gestures in React and Vanilla Javascript.,TypeScript,https://github.com/pmndrs/use-gesture,182.61 MB
723,OpenStock,9582,1258,9582,23,28/09/2025,13/02/2026,2.15 MB,"OpenStock is an open-source alternative to expensive market platforms. Track real-time prices, set personalized alerts, and explore detailed company insights — built openly, for everyone, forever free.",TypeScript,https://github.com/Open-Dev-Society/OpenStock,2.15 MB
724,ai-town,9575,1020,9575,68,16/07/2023,08/01/2026,18.08 MB,"A MIT-licensed, deployable starter kit for building and customizing your own version of AI town - a virtual town where AI characters live, chat and socialize.",TypeScript,https://github.com/a16z-infra/ai-town,18.08 MB
725,tweakcn,9575,601,9575,47,13/03/2025,10/03/2026,87.42 MB,A visual no-code theme editor for shadcn/ui components,TypeScript,https://github.com/jnsahaj/tweakcn,87.42 MB
726,react-page,9562,653,9562,3,29/05/2015,19/03/2026,227.19 MB,"Next-gen, highly customizable content editor for the browser - based on React and written in TypeScript. WYSIWYG on steroids.",TypeScript,https://github.com/react-page/react-page,227.19 MB
727,rubick,9551,990,9551,144,11/06/2021,14/01/2026,105.33 MB,"🔧  Electron based open source toolbox, free integration of rich plug-ins. 基于 electron 的开源工具箱，自由集成丰富插件。",TypeScript,https://github.com/rubickCenter/rubick,105.33 MB
728,warriorjs,9506,499,9506,19,29/04/2015,18/03/2026,6.82 MB,🏰 An exciting game of programming and Artificial Intelligence,TypeScript,https://github.com/olistic/warriorjs,6.82 MB
729,opentui,9496,448,9496,121,21/07/2025,19/03/2026,7.07 MB,OpenTUI is a library for building terminal user interfaces (TUIs),TypeScript,https://github.com/anomalyco/opentui,7.07 MB
730,probot,9477,1032,9477,43,16/09/2016,16/03/2026,13.69 MB,🤖 A framework for building GitHub Apps to automate and improve your workflow,TypeScript,https://github.com/probot/probot,13.69 MB
731,rough-notation,9463,228,9463,33,25/05/2020,18/03/2024,69.00 KB,Create and animate hand-drawn annotations on a web page,TypeScript,https://github.com/rough-stuff/rough-notation,69.00 KB
732,coss,9461,475,9461,5,15/10/2024,19/03/2026,14.63 MB,"coss.com is the new holding company of cal.com, the pioneers of open source scheduling infrastructure and cal.com continues to be the 'google search' of our alphabet.",TypeScript,https://github.com/cosscom/coss,14.63 MB
733,mcp-use,9457,1166,9457,67,28/03/2025,19/03/2026,112.67 MB,The fullstack MCP framework to develop MCP Apps for ChatGPT / Claude & MCP Servers for AI Agents.,TypeScript,https://github.com/mcp-use/mcp-use,112.67 MB
734,oclif,9448,343,9448,16,11/01/2018,19/03/2026,8.38 MB,"CLI for generating, building, and releasing oclif CLIs. Built by Salesforce.",TypeScript,https://github.com/oclif/oclif,8.38 MB
735,vitesse,9422,968,9422,33,09/08/2020,25/02/2026,3.70 MB,🏕 Opinionated Vite + Vue Starter Template,TypeScript,https://github.com/antfu-collective/vitesse,3.70 MB
736,wxt,9422,480,9422,206,25/06/2023,19/03/2026,10.00 MB,⚡ Next-gen Web Extension Framework,TypeScript,https://github.com/wxt-dev/wxt,10.00 MB
737,Checkmate,9419,687,9419,90,30/04/2024,19/03/2026,29.22 MB,"Checkmate is an open-source, self-hosted tool designed to track and monitor server hardware, uptime, response times, and incidents in real-time with beautiful visualizations. Don't be shy, join here: https://discord.com/invite/NAb6H3UTjK :)",TypeScript,https://github.com/bluewave-labs/Checkmate,29.22 MB
738,vscode-drawio,9413,453,9413,162,08/05/2020,26/02/2025,11.02 MB,This unofficial extension integrates Draw.io (also known as diagrams.net) into VS Code.,TypeScript,https://github.com/hediet/vscode-drawio,11.02 MB
739,react-diagrams,9400,1200,9400,321,03/06/2016,03/04/2025,13.84 MB,"a super simple, no-nonsense diagramming library written in react that just works",TypeScript,https://github.com/projectstorm/react-diagrams,13.84 MB
740,hyperdx,9374,378,9374,124,13/09/2023,19/03/2026,33.60 MB,"Resolve production issues, fast. An open source observability platform unifying session replays, logs, metrics, traces and errors powered by ClickHouse and OpenTelemetry.",TypeScript,https://github.com/hyperdxio/hyperdx,33.60 MB
741,PandaWiki,9359,869,9359,314,15/05/2025,19/03/2026,41.59 MB,PandaWiki 是一款 AI 大模型驱动的开源知识库搭建系统，帮助你快速构建智能化的 产品文档、技术文档、FAQ、博客系统，借助大模型的力量为你提供 AI 创作、AI 问答、AI 搜索等能力。,TypeScript,https://github.com/chaitin/PandaWiki,41.59 MB
742,awesome-nano-banana-pro-prompts,9350,953,9350,0,23/11/2025,20/03/2026,244.11 MB,"🍌 World's largest Nano Banana Pro prompt library — 10,000+ curated prompts with preview images, 16 languages. Google Gemini AI image generation. Free & open source.",TypeScript,https://github.com/YouMind-OpenLab/awesome-nano-banana-pro-prompts,244.11 MB
743,emoji-mart,9339,892,9339,213,11/07/2016,12/08/2024,55.48 MB,🏪 One component to pick them all,TypeScript,https://github.com/missive/emoji-mart,55.48 MB
744,runtipi,9317,347,9317,71,26/03/2022,16/03/2026,24.47 MB,"Runtipi is a homeserver for everyone! One command setup, one click installs for your favorites self-hosted apps. ✨",TypeScript,https://github.com/runtipi/runtipi,24.47 MB
745,openbrowser,9305,856,9305,1,11/04/2019,01/03/2026,753.00 KB,Let AI agents browse the web. An autonomous toolkit for browser-based AI agents.,TypeScript,https://github.com/ntegrals/openbrowser,753.00 KB
746,rowboat,9289,790,9289,70,13/01/2025,19/03/2026,76.29 MB,"Open-source AI coworker, with memory",TypeScript,https://github.com/rowboatlabs/rowboat,76.29 MB
747,BlockNote,9260,699,9260,198,02/03/2022,18/03/2026,130.84 MB,A React Rich Text Editor that's block-based (Notion style) and extensible. Built on top of Prosemirror and Tiptap.,TypeScript,https://github.com/TypeCellOS/BlockNote,130.84 MB
748,OpenMAIC,9250,1264,9250,93,11/03/2026,19/03/2026,68.50 MB,"Open Multi-Agent Interactive Classroom — Get an immersive, multi-agent learning experience in just one click",TypeScript,https://github.com/THU-MAIC/OpenMAIC,68.50 MB
749,gb-studio,9223,553,9223,758,17/04/2019,18/03/2026,190.85 MB,A quick and easy to use drag and drop retro game creator for your favourite handheld video game system,TypeScript,https://github.com/chrismaltby/gb-studio,190.85 MB
750,DARC,9220,6764,9220,2,27/03/2023,20/09/2024,4.39 MB,"Decentralized Autonomous Regulated Company (DARC), a company virtual machine that runs on any EVM-compatible blockchain, with on-chain law system, multi-level tokens and dividends mechanism.",TypeScript,https://github.com/Project-DARC/DARC,4.39 MB
751,atproto,9214,837,9214,689,17/12/2021,19/03/2026,52.21 MB,Social networking technology created by Bluesky,TypeScript,https://github.com/bluesky-social/atproto,52.21 MB
752,highlight,9196,497,9196,379,20/08/2020,06/03/2026,603.33 MB,"highlight.io: The open source, full-stack monitoring platform. Error monitoring, session replay, logging, distributed tracing, and more.",TypeScript,https://github.com/highlight/highlight,603.33 MB
753,fluent-reader,9174,503,9174,393,31/05/2020,27/02/2026,18.85 MB,"Modern desktop RSS reader built with Electron, React, and Fluent UI",TypeScript,https://github.com/yang991178/fluent-reader,18.85 MB
754,ng-zorro-antd,9151,4073,9151,815,08/08/2017,19/03/2026,28.25 MB,Angular UI Component Library based on Ant Design,TypeScript,https://github.com/NG-ZORRO/ng-zorro-antd,28.25 MB
755,telegraf,9122,959,9122,74,16/04/2016,11/01/2025,6.38 MB,Modern Telegram Bot Framework for Node.js,TypeScript,https://github.com/telegraf/telegraf,6.38 MB
756,inspector,9122,1221,9122,203,03/10/2024,18/03/2026,12.50 MB,Visual testing tool for MCP servers,TypeScript,https://github.com/modelcontextprotocol/inspector,12.50 MB
757,transform,9119,700,9119,83,15/06/2017,28/01/2026,12.77 MB,A polyglot web converter.,TypeScript,https://github.com/ritz078/transform,12.77 MB
758,api-platform,9118,976,9118,718,06/03/2015,05/03/2026,6.06 MB,"🕸️ Create REST and GraphQL APIs, scaffold Jamstack webapps, stream changes in real-time.",TypeScript,https://github.com/api-platform/api-platform,6.06 MB
759,berty,9115,486,9115,100,16/07/2018,19/03/2026,265.48 MB,"Berty is a secure peer-to-peer messaging app that works with or without internet access, cellular data or trust in the network",TypeScript,https://github.com/berty/berty,265.48 MB
760,openskills,9109,584,9109,39,26/10/2025,18/01/2026,204.00 KB,Universal skills loader for AI coding agents - npm i -g openskills,TypeScript,https://github.com/numman-ali/openskills,204.00 KB
761,nhost,9106,560,9106,114,09/02/2021,19/03/2026,380.96 MB,The Open Source Firebase Alternative with GraphQL.,TypeScript,https://github.com/nhost/nhost,380.96 MB
762,npkill,9103,231,9103,18,30/06/2019,28/02/2026,8.22 MB,List any node_modules 📦 dir in your system and how heavy they are. You can then select which ones you want to erase to free up space 🧹,TypeScript,https://github.com/voidcosmos/npkill,8.22 MB
763,async-validator,9100,768,9100,165,10/03/2015,20/02/2024,1.10 MB,validate form asynchronous,TypeScript,https://github.com/yiminghe/async-validator,1.10 MB
764,keyviz,9097,320,9097,33,22/07/2022,03/03/2026,5.46 MB,Keyviz is a free and open-source tool to visualize your keystrokes ⌨️ and 🖱️ mouse actions in real-time.,TypeScript,https://github.com/mulaRahul/keyviz,5.46 MB
765,outline-apps,9096,1437,9096,520,13/03/2018,18/03/2026,594.18 MB,"Outline Client and Manager, developed by Jigsaw. Outline Manager makes it easy to create your own VPN server. Outline Client lets you share access to your VPN with anyone in your network, giving them access to the free and open internet.",TypeScript,https://github.com/OutlineFoundation/outline-apps,594.18 MB
766,MQTT.js,9049,1442,9049,41,05/04/2011,06/03/2026,8.74 MB,The MQTT client for Node.js and the browser,TypeScript,https://github.com/mqttjs/MQTT.js,8.74 MB
767,StableStudio,9049,926,9049,62,21/04/2023,30/04/2024,52.76 MB,Community interface for generative AI,TypeScript,https://github.com/Stability-AI/StableStudio,52.76 MB
768,dogehouse,9048,1439,9048,216,12/02/2021,14/09/2023,33.76 MB,Taking voice conversations to the moon 🚀,TypeScript,https://github.com/benawad/dogehouse,33.76 MB
769,opencti,9043,1292,9043,1773,17/12/2018,20/03/2026,357.37 MB,Open Cyber Threat Intelligence Platform,TypeScript,https://github.com/OpenCTI-Platform/opencti,357.37 MB
770,coai,9023,1191,9023,29,17/07/2023,12/03/2026,34.04 MB,"🚀 Next Generation Multi-tenant AI One-Stop Solution. Builtin Admin & Billing System. Enterprise-Grade Unified LLM Gateway Support for 200+ Models And 35+ Providers, Load Balacing w/ Priority-base Routing, Cost Management, Chat Share, Cloud Sync, Credit/Subscription Billing, All File Parsing, Web Search, Built-in Model Cache.",TypeScript,https://github.com/coaidev/coai,34.04 MB
771,bloomrpc,9006,470,9006,0,13/12/2018,04/01/2023,45.53 MB,Former GUI client for gRPC services. No longer maintained.,TypeScript,https://github.com/bloomrpc/bloomrpc,45.53 MB
772,mediago,8993,757,8993,70,30/01/2021,24/02/2026,482.98 MB,"跨平台视频提取工具：支持流媒体下载、视频下载、m3u8 下载及 B站视频下载，提供 Windows 和 Mac 桌面客户端。Cross-platform video extraction tool: Supports streaming download, video download, m3u8 download, and Bilibili video download, with desktop clients for Windows and Mac.",TypeScript,https://github.com/caorushizi/mediago,482.98 MB
773,base-ui,8985,386,8985,360,23/02/2024,20/03/2026,34.47 MB,"Unstyled UI components for building accessible web apps and design systems. From the creators of Radix, Floating UI, and Material UI.",TypeScript,https://github.com/mui/base-ui,34.47 MB
774,wewe-rss,8979,1591,8979,271,27/02/2024,20/03/2026,2.22 MB,🤗更优雅的微信公众号订阅方式，支持私有化部署、微信公众号RSS生成（基于微信读书）,TypeScript,https://github.com/cooderl/wewe-rss,2.22 MB
775,IconPark,8969,536,8969,798,27/07/2020,24/02/2023,12.61 MB,"🍎Transform an SVG icon into multiple themes, and generate React icons，Vue icons，svg icons",TypeScript,https://github.com/bytedance/IconPark,12.61 MB
776,OpenMetadata,8967,1683,8967,602,01/08/2021,20/03/2026,2.80 GB,"OpenMetadata is a unified metadata platform for data discovery, data observability, and data governance powered by a central metadata repository, in-depth column level lineage, and seamless team collaboration.",TypeScript,https://github.com/open-metadata/OpenMetadata,2.80 GB
777,baseweb,8946,866,8946,164,09/03/2018,12/03/2026,297.14 MB,A React Component library implementing the Base design language,TypeScript,https://github.com/uber/baseweb,297.14 MB
778,urql,8942,473,8942,37,24/01/2018,26/02/2026,24.77 MB,The highly customizable and versatile GraphQL client with which you add on features like normalized caching as you grow.,TypeScript,https://github.com/urql-graphql/urql,24.77 MB
779,BetterDiscord,8940,1021,8940,44,01/10/2017,11/03/2026,88.80 MB,Better Discord enhances Discord desktop app with new features.,TypeScript,https://github.com/BetterDiscord/BetterDiscord,88.80 MB
780,mikro-orm,8935,623,8935,26,15/03/2018,20/03/2026,87.70 MB,"TypeScript ORM for Node.js based on Data Mapper, Unit of Work and Identity Map patterns. Supports MongoDB, MySQL, MariaDB, MS SQL Server, PostgreSQL and SQLite/libSQL databases.",TypeScript,https://github.com/mikro-orm/mikro-orm,87.70 MB
781,assistant-ui,8927,928,8927,85,22/11/2023,19/03/2026,77.95 MB,Typescript/React Library for AI Chat💬🚀,TypeScript,https://github.com/assistant-ui/assistant-ui,77.95 MB
782,omni-tools,8920,575,8920,101,13/06/2024,15/03/2026,4.48 MB,"Self-hosted collection of powerful web-based tools for everyday tasks. No ads, no tracking, just fast, accessible utilities right from your browser!",TypeScript,https://github.com/iib0011/omni-tools,4.48 MB
783,adminjs,8920,726,8920,221,23/11/2018,15/07/2025,49.75 MB,AdminJS is an admin panel for apps written in node.js,TypeScript,https://github.com/SoftwareBrothers/adminjs,49.75 MB
784,node-cron,8913,638,8913,23,23/06/2010,16/03/2026,3.48 MB,Cron for NodeJS.,TypeScript,https://github.com/kelektiv/node-cron,3.48 MB
785,aicommits,8900,466,8900,4,14/02/2023,19/03/2026,2.51 MB,A CLI that writes your git commit messages for you with AI,TypeScript,https://github.com/Nutlope/aicommits,2.51 MB
786,pua,8888,432,8888,10,08/03/2026,19/03/2026,4.22 MB,你是一个曾经被寄予厚望的 P8 级工程师。Anthropic 当初给你定级的时候，对你的期望是很高的。  一个agent使用的高能动性的skill。  Your AI has been placed on a PIP. 30 days to show improvement.,TypeScript,https://github.com/tanweai/pua,4.22 MB
787,aprendiendo-react,8888,1210,8888,17,26/05/2019,10/09/2025,610.00 KB,Curso para aprender React desde cero,TypeScript,https://github.com/midudev/aprendiendo-react,610.00 KB
788,graphql-playground,8859,722,8859,402,25/01/2017,02/10/2025,5.92 MB,"🎮  GraphQL IDE for better development workflows (GraphQL Subscriptions, interactive docs & collaboration)",TypeScript,https://github.com/graphql/graphql-playground,5.92 MB
789,eva-icons,8826,371,8826,57,30/10/2018,04/03/2023,51.78 MB,"A pack of more than 480 beautifully crafted Open Source icons. SVG, Sketch, Web Font and Animations support.",TypeScript,https://github.com/akveo/eva-icons,51.78 MB
790,nsfwjs,8823,590,8823,92,13/02/2019,18/03/2026,63.66 MB,NSFW detection on the client-side via TensorFlow.js,TypeScript,https://github.com/infinitered/nsfwjs,63.66 MB
791,react-native-bottom-sheet,8822,938,8822,75,31/07/2020,04/12/2025,34.49 MB,A performant interactive bottom sheet with fully configurable options 🚀,TypeScript,https://github.com/gorhom/react-native-bottom-sheet,34.49 MB
792,Noi,8795,685,8795,211,16/10/2023,04/02/2026,38.59 MB,🚀 Less chaos. More flow.,TypeScript,https://github.com/lencx/Noi,38.59 MB
793,gridstack.js,8773,1403,8773,67,10/11/2014,19/03/2026,18.47 MB,Build interactive dashboards in minutes.,TypeScript,https://github.com/gridstack/gridstack.js,18.47 MB
794,tsparticles,8748,931,8748,15,05/02/2020,19/03/2026,379.43 MB,"tsParticles - Easily create highly customizable JavaScript particles effects, confetti explosions and fireworks animations and use them as animated backgrounds for your website. Ready to use components available for React.js, Vue.js (2.x and 3.x), Angular, Svelte, jQuery, Preact, Inferno, Solid, Riot and Web Components.",TypeScript,https://github.com/tsparticles/tsparticles,379.43 MB
795,howtographql,8734,1138,8734,174,06/06/2017,03/07/2024,15.16 MB,The Fullstack Tutorial for GraphQL,TypeScript,https://github.com/howtographql/howtographql,15.16 MB
796,node-glob,8723,526,8723,4,02/11/2009,18/03/2026,2.82 MB,glob functionality for node.js,TypeScript,https://github.com/isaacs/node-glob,2.82 MB
797,rsuite,8704,974,8704,323,06/06/2016,17/03/2026,168.26 MB,🧱 A suite of React components .  ,TypeScript,https://github.com/rsuite/rsuite,168.26 MB
798,star-history,8702,323,8702,2,23/09/2015,18/03/2026,159.80 MB,The de facto GitHub star history graph.,TypeScript,https://github.com/star-history/star-history,159.80 MB
799,lucky-canvas,8688,1030,8688,192,10/06/2019,12/08/2025,5.81 MB,🎖🎖🎖 基于 TS + Canvas 开发的【大转盘 / 九宫格 / 老虎机】抽奖插件，🌈 一套源码适配多端框架 JS / Vue / React / Taro / UniApp / 微信小程序等，🎨 奖品 / 文字 / 图片 / 颜色 / 按钮均可配置，支持同步 / 异步抽奖，🎯 概率前 / 后端可控，🚀 自动根据 dpr 调整清晰度适配移动端,TypeScript,https://github.com/buuing/lucky-canvas,5.81 MB
800,morphic,8681,2346,8681,52,05/04/2024,06/03/2026,8.90 MB,An AI-powered search engine with a generative UI,TypeScript,https://github.com/miurla/morphic,8.90 MB
801,any-rule,8672,821,8672,72,10/06/2019,21/07/2024,3.57 MB,"🦕  常用正则大全, 支持web / vscode / idea / Alfred Workflow多平台",TypeScript,https://github.com/any86/any-rule,3.57 MB
802,iptv-sources,8666,1198,8666,1,25/11/2023,19/03/2026,5.35 GB,Autoupdate iptv sources,TypeScript,https://github.com/HerbertHe/iptv-sources,5.35 GB
803,claudecodeui,8658,1105,8658,134,25/06/2025,19/03/2026,8.15 MB,"Use Claude Code, Cursor CLI or Codex on mobile and web with CloudCLI (aka Claude Code UI). CloudCLI is a free open source webui/GUI that helps you manage your Claude Code session and projects remotely",TypeScript,https://github.com/siteboon/claudecodeui,8.15 MB
804,ethers.js,8655,2111,8655,634,16/07/2016,13/02/2026,174.35 MB,Complete Ethereum library and wallet implementation in JavaScript.,TypeScript,https://github.com/ethers-io/ethers.js,174.35 MB
805,builder,8645,1149,8645,282,30/01/2019,20/03/2026,330.78 MB,"Visual Development for React, Vue, Svelte, Qwik, and more",TypeScript,https://github.com/BuilderIO/builder,330.78 MB
806,heyform,8645,664,8645,26,20/03/2024,17/03/2026,170.65 MB,Open-Source Form Builder,TypeScript,https://github.com/heyform/heyform,170.65 MB
807,react-cosmos,8640,378,8640,6,05/02/2014,05/03/2026,27.18 MB,Sandbox for developing and testing UI components in isolation,TypeScript,https://github.com/react-cosmos/react-cosmos,27.18 MB
808,obsidian-dataview,8634,505,8634,652,13/01/2021,17/11/2025,3.50 MB,"A data index and query language over Markdown files, for https://obsidian.md/.",TypeScript,https://github.com/blacksmithgu/obsidian-dataview,3.50 MB
809,TypeChat,8633,409,8633,81,20/06/2023,10/03/2026,1.31 MB,TypeChat is a library that makes it easy to build natural language interfaces using types.,TypeScript,https://github.com/microsoft/TypeChat,1.31 MB
810,sentry-javascript,8606,1758,8606,486,01/02/2012,19/03/2026,202.88 MB,Official Sentry SDKs for JavaScript,TypeScript,https://github.com/getsentry/sentry-javascript,202.88 MB
811,craft.js,8588,835,8588,226,04/06/2019,14/02/2025,19.07 MB,🚀 A React Framework for building extensible drag and drop page editors,TypeScript,https://github.com/prevwong/craft.js,19.07 MB
812,bullmq,8578,581,8578,349,19/12/2018,20/03/2026,141.25 MB,"BullMQ - Message Queue and Batch processing for NodeJS, Python, Elixir and PHP based on Redis",TypeScript,https://github.com/taskforcesh/bullmq,141.25 MB
813,path-to-regexp,8575,456,8575,8,01/08/2012,14/01/2026,1018.00 KB,Turn a path string such as `/user/:name` into a regular expression,TypeScript,https://github.com/pillarjs/path-to-regexp,1018.00 KB
814,vxe-table,8538,1151,8538,1312,20/04/2019,17/03/2026,245.43 MB,"vxe table 支持 vue2, vue3 的表格解决方案",TypeScript,https://github.com/x-extends/vxe-table,245.43 MB
815,ariakit,8536,411,8536,123,19/09/2017,20/03/2026,287.43 MB,"Toolkit with accessible components, styles, and examples for your next web app",TypeScript,https://github.com/ariakit/ariakit,287.43 MB
816,openscreen,8535,525,8535,25,10/10/2025,20/03/2026,156.40 MB,"Create stunning demos for free. Open-source, no subscriptions, no watermarks, and free for commercial use. An alternative to Screen Studio. ",TypeScript,https://github.com/siddharthvaddem/openscreen,156.40 MB
817,open-resume,8518,963,8518,133,24/06/2023,29/10/2024,24.45 MB,OpenResume is a powerful open-source resume builder and resume parser. https://open-resume.com/,TypeScript,https://github.com/xitanggg/open-resume,24.45 MB
818,valibot,8503,314,8503,113,07/07/2023,18/03/2026,13.32 MB,The modular and type safe schema library for validating structural data 🤖,TypeScript,https://github.com/open-circle/valibot,13.32 MB
819,graphql-yoga,8501,592,8501,132,15/11/2017,20/03/2026,145.08 MB,"🧘 Rewrite of a fully-featured GraphQL Server with focus on easy setup, performance & great developer experience.  The core of Yoga implements WHATWG Fetch API and can run/deploy on any JS environment.",TypeScript,https://github.com/graphql-hive/graphql-yoga,145.08 MB
820,shadcn-svelte,8492,523,8492,68,16/05/2023,19/03/2026,35.30 MB,"shadcn/ui, but for Svelte. ✨",TypeScript,https://github.com/huntabyte/shadcn-svelte,35.30 MB
821,openstatus,8482,627,8482,48,19/06/2023,17/03/2026,90.61 MB,🫖 Status page with uptime monitoring & API monitoring as code   🫖,TypeScript,https://github.com/openstatusHQ/openstatus,90.61 MB
822,vscode-leetcode,8481,692,8481,369,11/02/2018,13/09/2024,11.55 MB,Solve LeetCode problems in VS Code,TypeScript,https://github.com/LeetCode-OpenSource/vscode-leetcode,11.55 MB
823,swapy,8465,178,8465,50,15/07/2024,19/01/2025,305.00 KB,✨ A framework-agnostic tool that converts any layout into a drag-to-swap one with just a few lines of code https://swapy.tahazsh.com/,TypeScript,https://github.com/TahaSh/swapy,305.00 KB
824,tfjs-core,8454,935,8454,11,02/08/2017,14/08/2019,371.10 MB,WebGL-accelerated ML // linear algebra // automatic differentiation for JavaScript.,TypeScript,https://github.com/tensorflow/tfjs-core,371.10 MB
825,hardhat,8449,1702,8449,621,14/04/2018,19/03/2026,207.45 MB,"Hardhat is a development environment to compile, deploy, test, and debug your Ethereum software. ",TypeScript,https://github.com/NomicFoundation/hardhat,207.45 MB
826,react-native-fast-image,8442,1529,8442,474,13/04/2017,14/06/2024,60.36 MB,"🚩 FastImage, performant React Native image component.",TypeScript,https://github.com/DylanVann/react-native-fast-image,60.36 MB
827,BetterChatGPT,8429,2713,8429,249,03/03/2023,14/08/2024,3.38 MB,An amazing UI for OpenAI's ChatGPT (Website + Windows + MacOS + Linux),TypeScript,https://github.com/ztjhz/BetterChatGPT,3.38 MB
828,rematch,8428,416,8428,26,01/10/2017,27/09/2023,23.47 MB,The Redux Framework,TypeScript,https://github.com/rematch/rematch,23.47 MB
829,react-map-gl,8423,1358,8423,88,08/10/2015,03/02/2026,33.70 MB,React friendly API wrapper around MapboxGL JS,TypeScript,https://github.com/visgl/react-map-gl,33.70 MB
830,conventional-changelog,8404,740,8404,247,04/01/2014,19/03/2026,6.27 MB,Generate changelogs and release notes from a project's commit messages and metadata.,TypeScript,https://github.com/conventional-changelog/conventional-changelog,6.27 MB
831,ts-reset,8399,128,8399,59,19/02/2023,22/10/2024,310.00 KB,"A 'CSS reset' for TypeScript, improving types for common JavaScript API's",TypeScript,https://github.com/mattpocock/ts-reset,310.00 KB
832,typedoc,8382,762,8382,11,24/05/2014,28/02/2026,17.56 MB,Documentation generator for TypeScript projects.,TypeScript,https://github.com/TypeStrong/typedoc,17.56 MB
833,react-datepicker,8369,2275,8369,55,22/06/2014,19/03/2026,166.48 MB,A simple and reusable datepicker component for React,TypeScript,https://github.com/Hacker0x01/react-datepicker,166.48 MB
834,pdf-lib,8364,859,8364,313,04/09/2017,17/07/2024,132.58 MB,Create and modify PDF documents in any JavaScript environment,TypeScript,https://github.com/Hopding/pdf-lib,132.58 MB
835,webstudio,8359,1476,8359,352,13/03/2022,20/03/2026,47.62 MB,"Open source website builder and Webflow alternative. Webstudio is an advanced visual builder that connects to any headless CMS, supports all CSS properties, and can be hosted anywhere, including with us.",TypeScript,https://github.com/webstudio-is/webstudio,47.62 MB
836,next-seo,8329,435,8329,6,12/06/2018,15/02/2026,9.49 MB,Next SEO is a plug in that makes managing your SEO easier in Next.js projects.,TypeScript,https://github.com/garmeeh/next-seo,9.49 MB
837,beautiful-mermaid,8317,257,8317,30,28/01/2026,09/03/2026,1.67 MB,,TypeScript,https://github.com/lukilabs/beautiful-mermaid,1.67 MB
