Ranking,Project Name,Stars,Forks,Watchers,Open Issues,Created At,Last Commit,Size,Description,Language,Repo URL,Size
242,rxdb,23073,1149,23073,13,02/12/2016,06/03/2026,519.18 MB,"A fast, local first, reactive Database for JavaScript Applications https://rxdb.info/",TypeScript,https://github.com/pubkey/rxdb,519.18 MB
243,lexical,23041,2101,23041,550,03/12/2020,05/03/2026,130.30 MB,"Lexical is an extensible text editor framework that provides excellent reliability, accessibility and performance.",TypeScript,https://github.com/facebook/lexical,130.30 MB
244,toon,23032,1024,23032,12,22/10/2025,05/03/2026,1.88 MB,"🎒 Token-Oriented Object Notation (TOON) – Compact, human-readable, schema-aware JSON for LLM prompts. Spec, benchmarks, TypeScript SDK.",TypeScript,https://github.com/toon-format/toon,1.88 MB
245,langfuse,22690,2273,22690,568,18/05/2023,05/03/2026,70.32 MB,"🪢 Open source LLM engineering platform: LLM Observability, metrics, evals, prompt management, playground, datasets. Integrates with OpenTelemetry, Langchain, OpenAI SDK, LiteLLM, and more. 🍊YC W23 ",TypeScript,https://github.com/langfuse/langfuse,70.32 MB
246,react-bootstrap,22648,3605,22648,207,27/12/2013,05/03/2026,32.50 MB,Bootstrap components built with React,TypeScript,https://github.com/react-bootstrap/react-bootstrap,32.50 MB
247,ember.js,22579,4193,22579,422,25/05/2011,05/03/2026,103.73 MB,Ember.js - A JavaScript framework for creating ambitious web applications,TypeScript,https://github.com/emberjs/ember.js,103.73 MB
248,wechaty,22546,2794,22546,191,01/05/2016,21/12/2025,8.82 MB,Conversational RPA SDK for Chatbot Makers. Join our Discord: https://discord.gg/7q8NBZbQzt,TypeScript,https://github.com/wechaty/wechaty,8.82 MB
249,Roo-Code,22524,2886,22524,641,31/10/2024,05/03/2026,355.86 MB,Roo Code gives you a whole dev team of AI agents in your code editor.,TypeScript,https://github.com/RooCodeInc/Roo-Code,355.86 MB
250,next-ai-draw-io,22423,2403,22423,125,23/03/2025,06/03/2026,4.81 MB,"A next.js web application that integrates AI capabilities with draw.io diagrams. This app allows you to create, modify, and enhance diagrams through natural language commands and AI-assisted visualization.",TypeScript,https://github.com/DayuanJiang/next-ai-draw-io,4.81 MB
251,generator-jhipster,22364,4153,22364,123,21/10/2013,06/03/2026,182.83 MB,"JHipster is a development platform to quickly generate, develop, & deploy modern web applications & microservice architectures.",TypeScript,https://github.com/jhipster/generator-jhipster,182.83 MB
252,sweetalert,22344,2781,22344,200,30/09/2014,15/04/2023,5.35 MB,"A beautiful replacement for JavaScript's ""alert""",TypeScript,https://github.com/t4t5/sweetalert,5.35 MB
253,ai,22338,3921,22338,1246,23/05/2023,06/03/2026,155.26 MB,"The AI Toolkit for TypeScript. From the creators of Next.js, the AI SDK is a free open-source library for building AI-powered applications and agents ",TypeScript,https://github.com/vercel/ai,155.26 MB
254,dockge,22335,708,22335,139,23/10/2023,21/01/2026,813.00 KB,"A fancy, easy-to-use and reactive self-hosted docker compose.yaml stack-oriented manager",TypeScript,https://github.com/louislam/dockge,813.00 KB
255,repomix,22251,1029,22251,147,13/07/2024,05/03/2026,15.94 MB,"📦 Repomix is a powerful tool that packs your entire repository into a single, AI-friendly file. Perfect for when you need to feed your codebase to Large Language Models (LLMs) or other AI tools like Claude, ChatGPT, DeepSeek, Perplexity, Gemini, Gemma, Llama, Grok, and more.",TypeScript,https://github.com/yamadashy/repomix,15.94 MB
256,gpt-crawler,22183,2387,22183,108,14/11/2023,07/07/2025,884.00 KB,Crawl a site to generate knowledge files to create your own custom GPT from a URL,TypeScript,https://github.com/BuilderIO/gpt-crawler,884.00 KB
257,beekeeper-studio,22135,1457,22135,1041,23/07/2019,05/03/2026,111.60 MB,"Modern and easy to use SQL client for MySQL, Postgres, SQLite, SQL Server, and more. Linux, MacOS, and Windows.",TypeScript,https://github.com/beekeeper-studio/beekeeper-studio,111.60 MB
258,vueuse,22120,2871,22120,335,14/12/2019,02/03/2026,16.23 MB,Collection of essential Vue Composition Utilities for Vue 3,TypeScript,https://github.com/vueuse/vueuse,16.23 MB
259,react-grid-layout,22106,2697,22106,75,27/12/2014,01/03/2026,18.47 MB,"A draggable and resizable grid layout with responsive breakpoints, for React.",TypeScript,https://github.com/react-grid-layout/react-grid-layout,18.47 MB
260,openui,22055,2049,22055,84,17/03/2024,11/02/2026,25.80 MB,"OpenUI let's you describe UI using your imagination, then see it rendered live.",TypeScript,https://github.com/wandb/openui,25.80 MB
261,crawlee,22046,1235,22046,176,26/08/2016,05/03/2026,152.68 MB,"Crawlee—A web scraping and browser automation library for Node.js to build reliable crawlers. In JavaScript and TypeScript. Extract data for AI, LLMs, RAG, or GPTs. Download HTML, PDF, JPG, PNG, and other files from websites. Works with Puppeteer, Playwright, Cheerio, JSDOM, and raw HTTP. Both headful and headless mode. With proxy rotation.",TypeScript,https://github.com/apify/crawlee,152.68 MB
262,clash-verge,22027,3188,22027,235,04/12/2021,03/11/2023,9.70 MB,"A Clash GUI based on tauri. Supports Windows, macOS and Linux.",TypeScript,https://github.com/zzzgydi/clash-verge,9.70 MB
263,qwik,21945,1384,21945,102,19/05/2021,05/03/2026,67.44 MB,"Instant-loading web apps, without effort",TypeScript,https://github.com/QwikDev/qwik,67.44 MB
264,learn-claude-code,21783,4209,21783,11,29/06/2025,02/03/2026,533.00 KB,"Bash is all you need -  A nano Claude Code–like agent, built from 0 to 1",TypeScript,https://github.com/shareAI-lab/learn-claude-code,533.00 KB
265,darkreader,21756,2674,21756,1432,15/11/2014,04/03/2026,36.54 MB,Dark Reader Chrome and Firefox extension,TypeScript,https://github.com/darkreader/darkreader,36.54 MB
266,mastra,21727,1672,21727,440,06/08/2024,06/03/2026,1.01 GB,"From the team behind Gatsby, Mastra is a framework for building AI-powered applications and agents with a modern TypeScript stack.",TypeScript,https://github.com/mastra-ai/mastra,1.01 GB
267,nocobase,21705,2473,21705,284,24/10/2020,06/03/2026,263.65 MB,NocoBase is the most extensible AI-powered no-code/low-code platform for building business applications and enterprise solutions.,TypeScript,https://github.com/nocobase/nocobase,263.65 MB
268,react-dnd,21636,2013,21636,475,19/10/2014,06/07/2025,574.25 MB,Drag and Drop for React,TypeScript,https://github.com/react-dnd/react-dnd,574.25 MB
269,qwerty-learner,21571,2375,21571,266,21/01/2021,04/03/2026,192.04 MB,为键盘工作者设计的单词记忆与英语肌肉记忆锻炼软件 / Words learning and English muscle memory training software designed for keyboard workers,TypeScript,https://github.com/RealKai42/qwerty-learner,192.04 MB
270,blueprint,21523,2255,21523,900,25/10/2016,04/03/2026,382.16 MB,A React-based UI toolkit for the web,TypeScript,https://github.com/palantir/blueprint,382.16 MB
271,typescript-book,21512,2619,21512,151,21/03/2015,29/06/2024,8.51 MB,:books: The definitive guide to TypeScript and possibly the best TypeScript book :book:. Free and Open Source 🌹,TypeScript,https://github.com/basarat/typescript-book,8.51 MB
272,Inquirer.js,21459,1349,21459,21,17/05/2013,02/03/2026,4.67 GB,A collection of common interactive command line user interfaces.,TypeScript,https://github.com/SBoudrias/Inquirer.js,4.67 GB
273,chartdb,21445,1285,21445,139,05/08/2024,04/03/2026,67.11 MB,Database diagrams editor that allows you to visualize and design your DB with a single query.,TypeScript,https://github.com/chartdb/chartdb,67.11 MB
274,lucide,21392,1210,21392,497,08/06/2020,05/03/2026,18.90 MB,Beautiful & consistent icon toolkit made by the community. Open-source project and a fork of Feather Icons.,TypeScript,https://github.com/lucide-icons/lucide,18.90 MB
275,theia,21392,2800,21392,1730,24/02/2017,05/03/2026,198.59 MB,Eclipse Theia is a cloud & desktop IDE framework implemented in TypeScript.,TypeScript,https://github.com/eclipse-theia/theia,198.59 MB
276,stagehand,21365,1404,21365,151,24/03/2024,05/03/2026,77.07 MB,The AI Browser Automation Framework,TypeScript,https://github.com/browserbase/stagehand,77.07 MB
277,lit,21291,1052,21291,659,29/06/2017,06/03/2026,60.73 MB,"Lit is a simple library for building fast, lightweight web components.",TypeScript,https://github.com/lit/lit,60.73 MB
278,clash-party,21262,1707,21262,263,02/08/2024,02/03/2026,15.21 MB,:electron: Another Mihomo GUI. ,TypeScript,https://github.com/mihomo-party-org/clash-party,15.21 MB
279,appium,21257,6270,21257,78,09/01/2013,05/03/2026,226.37 MB,"Cross-platform automation framework for all kinds of apps, built on top of the W3C WebDriver protocol",TypeScript,https://github.com/appium/appium,226.37 MB
280,desktop,21246,10171,21246,976,11/05/2016,05/03/2026,106.71 MB,Focus on what matters instead of fighting with Git.,TypeScript,https://github.com/desktop/desktop,106.71 MB
281,activepieces,21087,3377,21087,410,03/12/2022,05/03/2026,395.81 MB,AI Agents & MCPs & AI Workflow Automation • (~400 MCP servers for AI agents) • AI Automation / AI Agent with MCPs • AI Workflows & AI Agents • MCPs for AI Agents,TypeScript,https://github.com/activepieces/activepieces,395.81 MB
282,jotai,21030,706,21030,5,11/08/2020,04/03/2026,14.21 MB,👻 Primitive and flexible state management for React,TypeScript,https://github.com/pmndrs/jotai,14.21 MB
283,renovate,20987,2968,20987,1015,17/12/2016,05/03/2026,140.86 MB,Home of the Renovate CLI: Cross-platform Dependency Automation by Mend.io,TypeScript,https://github.com/renovatebot/renovate,140.86 MB
284,teable,20987,1221,20987,146,01/11/2022,05/03/2026,55.07 MB,✨ The Next Gen Airtable Alternative: No-Code Postgres,TypeScript,https://github.com/teableio/teable,55.07 MB
285,kibana,20977,8537,20977,14873,26/01/2013,06/03/2026,12.89 GB,Your window into all of your data,TypeScript,https://github.com/elastic/kibana,12.89 GB
286,personal-security-checklist,20868,1422,20868,56,02/03/2018,28/02/2026,89.83 MB,🔒 A compiled checklist of 300+ tips for protecting digital security and privacy in 2026,TypeScript,https://github.com/Lissy93/personal-security-checklist,89.83 MB
287,opcode,20802,1597,20802,324,19/06/2025,16/10/2025,2.51 MB,"A powerful GUI app and Toolkit for Claude Code - Create custom agents, manage interactive Claude Code sessions, run secure background agents, and more.",TypeScript,https://github.com/winfunc/opcode,2.51 MB
288,react-scan,20749,347,20749,56,02/09/2024,17/02/2026,43.58 MB,Scan for React performance issues and eliminate slow renders in your app,TypeScript,https://github.com/aidenybai/react-scan,43.58 MB
289,visx,20650,755,20650,148,15/03/2017,11/11/2025,16.33 MB,🐯 visx | visualization components,TypeScript,https://github.com/airbnb/visx,16.33 MB
290,open-notebook,20585,2341,20585,125,21/10/2024,04/03/2026,9.47 MB,An Open Source implementation of Notebook LM with more flexibility and features,TypeScript,https://github.com/lfnovo/open-notebook,9.47 MB
291,NativeBase,20388,2417,20388,379,15/04/2016,31/01/2026,69.35 MB,"Mobile-first, accessible components for React Native & Web to build consistent UI across Android, iOS and Web.",TypeScript,https://github.com/GeekyAnts/NativeBase,69.35 MB
292,fullcalendar,20369,3715,20369,1098,22/11/2009,23/12/2025,31.75 MB,Full-sized drag & drop event calendar in JavaScript,TypeScript,https://github.com/fullcalendar/fullcalendar,31.75 MB
293,bokeh,20363,4257,20363,860,26/03/2012,05/03/2026,373.87 MB,"Interactive Data Visualization in the browser, from  Python",TypeScript,https://github.com/bokeh/bokeh,373.87 MB
294,pi-mono,20336,2115,20336,20,09/08/2025,05/03/2026,38.25 MB,"AI agent toolkit: coding agent CLI, unified LLM API, TUI & web UI libraries, Slack bot, vLLM pods",TypeScript,https://github.com/badlogic/pi-mono,38.25 MB
295,graphql-js,20331,2055,20331,131,30/06/2015,05/03/2026,28.71 MB,A reference implementation of GraphQL for JavaScript,TypeScript,https://github.com/graphql/graphql-js,28.71 MB
296,deskreen,20309,1132,20309,12,08/08/2020,08/02/2026,10.86 MB,Deskreen turns any device with a web browser into a secondary screen for your computer. ⭐️ Star to support our work!,TypeScript,https://github.com/pavlobu/deskreen,10.86 MB
297,wenyan,20216,1101,20216,213,08/12/2019,20/10/2023,46.28 MB,文言文編程語言 A programming language for the ancient Chinese.,TypeScript,https://github.com/wenyan-lang/wenyan,46.28 MB
298,xterm.js,20043,1823,20043,140,24/03/2014,06/03/2026,32.42 MB,A terminal for the web,TypeScript,https://github.com/xtermjs/xterm.js,32.42 MB
299,qwen-code,20038,1757,20038,627,26/06/2025,06/03/2026,67.27 MB,An open-source AI agent that lives in your terminal.,TypeScript,https://github.com/QwenLM/qwen-code,67.27 MB
300,coze-studio,20038,2861,20038,469,26/06/2025,09/02/2026,73.51 MB,"An AI agent development platform with all-in-one visual tools, simplifying agent creation, debugging, and deployment like never before. Coze your way to AI Agent creation.",TypeScript,https://github.com/coze-dev/coze-studio,73.51 MB
301,web3.js,19962,5088,19962,144,30/09/2014,05/03/2025,133.87 MB,Collection of comprehensive TypeScript libraries for Interaction with the Ethereum JSON RPC API and utility functions.,TypeScript,https://github.com/web3/web3.js,133.87 MB
302,fluentui,19868,2868,19868,662,06/06/2016,05/03/2026,806.58 MB,"Fluent UI web represents a collection of utilities, React components, and web components for building web applications.",TypeScript,https://github.com/microsoft/fluentui,806.58 MB
303,KaTeX,19861,1286,19861,440,05/07/2013,05/03/2026,88.42 MB,Fast math typesetting for the web.,TypeScript,https://github.com/KaTeX/KaTeX,88.42 MB
304,dyad,19813,2267,19813,258,11/04/2025,06/03/2026,29.59 MB,"Local, open-source AI app builder for power users ✨ v0 / Lovable / Replit / Bolt alternative 🌟 Star if you like it!",TypeScript,https://github.com/dyad-sh/dyad,29.59 MB
305,chatbot,19813,6377,19813,74,19/05/2023,04/03/2026,15.62 MB,"A full-featured, hackable Next.js AI chatbot built by Vercel",TypeScript,https://github.com/vercel/chatbot,15.62 MB
306,apollo-client,19720,2706,19720,421,26/02/2016,05/03/2026,97.91 MB,"The industry-leading GraphQL client for TypeScript, JavaScript, React, Vue, Angular, and more. Apollo Client delivers powerful caching, intuitive APIs, and comprehensive developer tools to accelerate your app development.",TypeScript,https://github.com/apollographql/apollo-client,97.91 MB
307,ignite,19685,1515,19685,33,10/02/2016,06/01/2026,60.38 MB,"Infinite Red's battle-tested React Native project boilerplate, along with a CLI, component/model generators, and more! 9 years of continuous development and counting.",TypeScript,https://github.com/infinitered/ignite,60.38 MB
308,monkeytype,19533,3053,19533,94,14/05/2020,05/03/2026,144.76 MB,"The most customizable typing website with a minimalistic design and a ton of features. Test yourself in various modes, track your progress and improve your speed.",TypeScript,https://github.com/monkeytypegame/monkeytype,144.76 MB
309,suna,19468,3366,19468,15,05/10/2024,05/03/2026,261.06 MB,"Kortix – build, manage and train AI Agents.",TypeScript,https://github.com/kortix-ai/suna,261.06 MB
310,qinglong,19347,3243,19347,114,13/03/2021,01/03/2026,6.82 MB,"支持 Python3、JavaScript、Shell、Typescript 的定时任务管理平台（Timed task management platform supporting Python3, JavaScript, Shell, Typescript）",TypeScript,https://github.com/whyour/qinglong,6.82 MB
311,pangolin,19341,587,19341,82,27/09/2024,05/03/2026,52.18 MB,"Identity-aware VPN and proxy for remote access to anything, anywhere.",TypeScript,https://github.com/fosrl/pangolin,52.18 MB
312,nanoclaw,19308,3122,19308,244,31/01/2026,05/03/2026,10.08 MB,"A lightweight alternative to OpenClaw that runs in containers for security. Connects to WhatsApp, Telegram, Slack, Discord, Gmail and other messaging apps,, has memory, scheduled jobs, and runs directly on Anthropic's Agents SDK",TypeScript,https://github.com/qwibitai/nanoclaw,10.08 MB
313,docmost,19287,1148,19287,254,03/08/2023,05/03/2026,8.18 MB,Docmost is an open-source collaborative wiki and documentation software. It is an open-source alternative to Confluence and Notion.,TypeScript,https://github.com/docmost/docmost,8.18 MB
314,rrweb,19286,1632,19286,390,06/10/2018,20/02/2026,11.48 MB,record and replay the web,TypeScript,https://github.com/rrweb-io/rrweb,11.48 MB
315,winboat,19237,506,19237,294,04/04/2025,25/02/2026,16.63 MB,Run Windows apps on 🐧 Linux with ✨ seamless integration,TypeScript,https://github.com/TibixDev/winboat,16.63 MB
316,ruflo,19200,2139,19200,429,02/06/2025,06/03/2026,493.18 MB,"🌊 The leading agent orchestration platform for Claude. Deploy intelligent multi-agent swarms, coordinate autonomous workflows, and build conversational AI systems. Features    enterprise-grade architecture, distributed swarm intelligence, RAG integration, and native Claude Code / Codex Integration",TypeScript,https://github.com/ruvnet/ruflo,493.18 MB
317,taxonomy,19172,2707,19172,219,18/10/2022,14/08/2024,14.14 MB,"An open source application built using the new router, server components and everything new in Next.js 13.",TypeScript,https://github.com/shadcn-ui/taxonomy,14.14 MB
318,upterm,19124,617,19124,220,22/03/2015,20/05/2019,7.63 MB,A terminal emulator for the 21st century.,TypeScript,https://github.com/railsware/upterm,7.63 MB
319,Kap,19123,870,19123,246,10/08/2016,12/11/2024,24.05 MB,An open-source screen recorder built with web technology,TypeScript,https://github.com/wulkano/Kap,24.05 MB
320,tfjs,19109,2021,19109,635,05/03/2018,06/02/2026,170.13 MB,A WebGL accelerated JavaScript library for training and deploying ML models.,TypeScript,https://github.com/tensorflow/tfjs,170.13 MB
321,reselect,19059,662,19059,47,01/07/2015,26/09/2025,5.96 MB,Selector library for Redux,TypeScript,https://github.com/reduxjs/reselect,5.96 MB
322,docs,19054,66238,19054,161,31/05/2019,06/03/2026,2.16 GB,The open-source repo for docs.github.com,TypeScript,https://github.com/github/docs,2.16 GB
323,BongoCat,19051,865,19051,50,28/03/2025,22/01/2026,10.00 MB,🐱 跨平台互动桌宠 BongoCat，为桌面增添乐趣！,TypeScript,https://github.com/ayangweb/BongoCat,10.00 MB
324,egg,19003,1818,19003,381,18/06/2016,05/03/2026,26.26 MB,🥚🥚🥚🥚 Born to build better enterprise frameworks and apps with Node.js & Koa. https://307.run/eggcode,TypeScript,https://github.com/eggjs/egg,26.26 MB
325,FossFLOW,18982,1231,18982,14,30/06/2025,01/03/2026,3.29 MB,Make beautiful isometric infrastructure diagrams,TypeScript,https://github.com/stan-smith/FossFLOW,3.29 MB
326,awesome-shadcn-ui,18914,1143,18914,4,05/02/2024,05/03/2026,1.35 MB,A curated list of awesome things related to shadcn/ui.,TypeScript,https://github.com/birobirobiro/awesome-shadcn-ui,1.35 MB
327,subql,18853,387,18853,92,15/12/2020,04/03/2026,45.57 MB,"SubQuery is an Open, Flexible, Fast and Universal data indexing framework for web3. Our mission is to help developers create the decentralised products of the future.",TypeScript,https://github.com/subquery/subql,45.57 MB
328,amis,18835,2720,18835,1705,28/04/2019,26/02/2026,188.51 MB,前端低代码框架，通过 JSON 配置就能生成各种页面。,TypeScript,https://github.com/baidu/amis,188.51 MB
329,core,18774,666,18774,4,15/08/2015,04/03/2026,6.16 MB,"AdonisJS is a TypeScript-first web framework for building web apps and API servers. It comes with support for testing, modern tooling, an ecosystem of official packages, and more.",TypeScript,https://github.com/adonisjs/core,6.16 MB
330,primitives,18681,1122,18681,774,19/06/2020,13/02/2026,21.12 MB,"Radix Primitives is an open-source UI component library for building high-quality, accessible design systems and web apps. Maintained by @workos.",TypeScript,https://github.com/radix-ui/primitives,21.12 MB
331,unocss,18653,966,18653,160,30/09/2021,04/03/2026,19.16 MB,The instant on-demand atomic CSS engine.,TypeScript,https://github.com/unocss/unocss,19.16 MB
332,ice,18643,2123,18643,384,03/11/2016,28/02/2026,150.09 MB,🚀 ice.js: The Progressive App Framework Based On React（基于 React 的渐进式应用框架）,TypeScript,https://github.com/alibaba/ice,150.09 MB
333,compiler-explorer,18599,1997,18599,792,23/05/2012,05/03/2026,94.21 MB,Run compilers interactively from your web browser and interact with the assembly,TypeScript,https://github.com/compiler-explorer/compiler-explorer,94.21 MB
334,agents.md,18547,1335,18547,125,19/08/2025,19/12/2025,1.90 MB,"AGENTS.md — a simple, open format for guiding coding agents",TypeScript,https://github.com/agentsmd/agents.md,1.90 MB
335,12-factor-agents,18546,1410,18546,19,30/03/2025,21/09/2025,44.42 MB,What are the principles we can use to build LLM-powered software that is actually good enough to put in the hands of production customers?,TypeScript,https://github.com/humanlayer/12-factor-agents,44.42 MB
336,deep-research,18525,1918,18525,78,04/02/2025,08/09/2025,72.00 KB,"An AI-powered research assistant that performs iterative, deep research on any topic by combining search engines, web scraping, and large language models.  The goal of this repo is to provide the simplest implementation of a deep research agent - e.g. an agent that can refine its research direction overtime and deep dive into a topic.",TypeScript,https://github.com/dzhng/deep-research,72.00 KB
337,catppuccin,18495,339,18495,87,06/11/2021,23/02/2026,11.72 MB,😸 Soothing pastel theme for the high-spirited!,TypeScript,https://github.com/catppuccin/catppuccin,11.72 MB
338,readest,18482,998,18482,132,12/10/2024,05/03/2026,67.16 MB,"Readest is a modern, feature-rich ebook reader designed for avid readers offering seamless cross-platform access, powerful tools, and an intuitive interface to elevate your reading experience.",TypeScript,https://github.com/readest/readest,67.16 MB
339,newsnow,18395,5261,18395,125,23/09/2024,27/02/2026,5.53 MB,Elegant reading of real-time and hottest news,TypeScript,https://github.com/ourongxing/newsnow,5.53 MB
340,bit,18357,948,18357,65,22/01/2017,05/03/2026,200.85 MB,"AI-powered development workspaces with reusable components, architectural clarity and zero overhead.",TypeScript,https://github.com/teambit/bit,200.85 MB
341,commitlint,18353,953,18353,173,12/02/2016,05/03/2026,19.53 MB,📓 Lint commit messages,TypeScript,https://github.com/conventional-changelog/commitlint,19.53 MB
342,wangEditor,18311,3360,18311,872,06/11/2014,11/10/2024,18.72 MB,"wangEditor, open-source Web rich text editor 开源 Web 富文本编辑器",TypeScript,https://github.com/wangeditor-team/wangEditor,18.72 MB
343,motion-canvas,18231,721,18231,171,03/08/2022,16/02/2025,10.75 MB,Visualize Your Ideas With Code,TypeScript,https://github.com/motion-canvas/motion-canvas,10.75 MB
344,naive-ui,18173,1852,18173,640,04/06/2021,18/02/2026,27.29 MB,A Vue 3 Component Library. Fairly Complete. Theme Customizable. Uses TypeScript. Fast.,TypeScript,https://github.com/tusen-ai/naive-ui,27.29 MB
345,wasp,18169,1431,18169,829,30/01/2020,05/03/2026,798.46 MB,"The batteries-included full-stack framework for the AI era. Develop JS/TS web apps (React, Node.js, and Prisma) using declarative code that abstracts away complex full-stack features like auth, background jobs, RPC, email sending, end-to-end type safety, single-command deployment, and more.",TypeScript,https://github.com/wasp-lang/wasp,798.46 MB
346,etherpad-lite,18149,3009,18149,129,26/03/2011,05/03/2026,42.57 MB,Etherpad: A modern really-real-time collaborative document editor.,TypeScript,https://github.com/ether/etherpad-lite,42.57 MB
347,react-email,18148,927,18148,68,19/09/2022,05/03/2026,107.36 MB,💌 Build and send emails using React,TypeScript,https://github.com/resend/react-email,107.36 MB
348,agentic,18129,2242,18129,15,03/12/2022,11/02/2026,16.61 MB,Your API ⇒ Paid MCP. Instantly.,TypeScript,https://github.com/transitive-bullshit/agentic,16.61 MB
349,openobserve,18073,740,18073,636,02/02/2023,05/03/2026,115.52 MB,"OpenObserve is an open-source observability platform for logs, metrics, traces, and frontend monitoring. A cost-effective alternative to Datadog, Splunk, and Elasticsearch with 140x lower storage costs and single binary deployment.",TypeScript,https://github.com/openobserve/openobserve,115.52 MB
350,yaak,18028,717,18028,14,16/02/2023,06/03/2026,34.02 MB,"The most intuitive desktop API client. Organize and execute REST, GraphQL, WebSockets, Server Sent Events, and gRPC 🦬",TypeScript,https://github.com/mountain-loop/yaak,34.02 MB
351,ionicons,18001,2062,18001,65,10/10/2013,05/03/2026,28.02 MB,"Premium hand-crafted icons built by Ionic, for Ionic apps and web apps everywhere 🌎",TypeScript,https://github.com/ionic-team/ionicons,28.02 MB
352,AionUi,17916,1387,17916,188,07/08/2025,05/03/2026,422.97 MB,"Free, local, open-source 24/7 Cowork app and OpenClaw for Gemini CLI, Claude Code, Codex, OpenCode, Qwen Code, Goose CLI, Auggie, and more | 🌟 Star if you like it!",TypeScript,https://github.com/iOfficeAI/AionUi,422.97 MB
353,tui.editor,17909,1843,17909,642,27/07/2015,01/08/2024,80.55 MB,🍞📝 Markdown WYSIWYG Editor. GFM Standard + Chart & UML Extensible.,TypeScript,https://github.com/nhn/tui.editor,80.55 MB
354,react-native-vector-icons,17833,2113,17833,11,15/05/2015,03/03/2026,29.47 MB,Customizable Icons for React Native with support for image source and full styling.,TypeScript,https://github.com/oblador/react-native-vector-icons,29.47 MB
355,super-productivity,17821,1514,17821,827,06/01/2017,05/03/2026,133.72 MB,"Super Productivity is an advanced todo list app with integrated Timeboxing and time tracking capabilities. It also comes with integrations for Jira, GitLab, GitHub and Open Project.",TypeScript,https://github.com/super-productivity/super-productivity,133.72 MB
