Ranking,Project Name,Stars,Forks,Watchers,Open Issues,Created At,Last Commit,Size,Description,Language,Repo URL,Size
723,mcp-use,9374,1154,9374,68,28/03/2025,05/03/2026,114.43 MB,The fullstack MCP framework to develop MCP Apps for ChatGPT / Claude & MCP Servers for AI Agents.,TypeScript,https://github.com/mcp-use/mcp-use,114.43 MB
724,Checkmate,9359,680,9359,92,30/04/2024,05/03/2026,29.07 MB,"Checkmate is an open-source, self-hosted tool designed to track and monitor server hardware, uptime, response times, and incidents in real-time with beautiful visualizations. Don't be shy, join here: https://discord.com/invite/NAb6H3UTjK :)",TypeScript,https://github.com/bluewave-labs/Checkmate,29.07 MB
725,hyperdx,9358,372,9358,126,13/09/2023,05/03/2026,32.74 MB,"Resolve production issues, fast. An open source observability platform unifying session replays, logs, metrics, traces and errors powered by ClickHouse and OpenTelemetry.",TypeScript,https://github.com/hyperdxio/hyperdx,32.74 MB
726,wxt,9318,472,9318,209,25/06/2023,06/03/2026,9.82 MB,⚡ Next-gen Web Extension Framework,TypeScript,https://github.com/wxt-dev/wxt,9.82 MB
727,emoji-mart,9309,892,9309,214,11/07/2016,12/08/2024,55.48 MB,🏪 One component to pick them all,TypeScript,https://github.com/missive/emoji-mart,55.48 MB
728,runtipi,9302,344,9302,76,26/03/2022,05/03/2026,24.09 MB,"Runtipi is a homeserver for everyone! One command setup, one click installs for your favorites self-hosted apps. ✨",TypeScript,https://github.com/runtipi/runtipi,24.09 MB
729,opencode-antigravity-auth,9259,630,9259,36,09/12/2025,23/02/2026,1.18 MB,Enable Opencode to authenticate against Antigravity (Google's IDE) via OAuth so you can use Antigravity rate limits and access models like gemini-3-pro and claude-opus-4-5-thinking with your Google credentials.,TypeScript,https://github.com/NoeFabris/opencode-antigravity-auth,1.18 MB
730,OpenStock,9256,1196,9256,21,28/09/2025,13/02/2026,2.15 MB,"OpenStock is an open-source alternative to expensive market platforms. Track real-time prices, set personalized alerts, and explore detailed company insights — built openly, for everyone, forever free.",TypeScript,https://github.com/Open-Dev-Society/OpenStock,2.15 MB
731,DARC,9226,6774,9226,2,27/03/2023,20/09/2024,4.39 MB,"Decentralized Autonomous Regulated Company (DARC), a company virtual machine that runs on any EVM-compatible blockchain, with on-chain law system, multi-level tokens and dividends mechanism.",TypeScript,https://github.com/Project-DARC/DARC,4.39 MB
732,gb-studio,9196,547,9196,742,17/04/2019,04/03/2026,190.94 MB,A quick and easy to use drag and drop retro game creator for your favourite handheld video game system,TypeScript,https://github.com/chrismaltby/gb-studio,190.94 MB
733,PandaWiki,9195,849,9195,312,15/05/2025,05/03/2026,41.08 MB,PandaWiki 是一款 AI 大模型驱动的开源知识库搭建系统，帮助你快速构建智能化的 产品文档、技术文档、FAQ、博客系统，借助大模型的力量为你提供 AI 创作、AI 问答、AI 搜索等能力。,TypeScript,https://github.com/chaitin/PandaWiki,41.08 MB
734,BlockNote,9182,694,9182,183,02/03/2022,05/03/2026,130.01 MB,A React Rich Text Editor that's block-based (Notion style) and extensible. Built on top of Prosemirror and Tiptap.,TypeScript,https://github.com/TypeCellOS/BlockNote,130.01 MB
735,atproto,9176,836,9176,677,17/12/2021,06/03/2026,51.21 MB,Social networking technology created by Bluesky,TypeScript,https://github.com/bluesky-social/atproto,51.21 MB
736,highlight,9173,485,9173,374,20/08/2020,05/03/2026,603.35 MB,"highlight.io: The open source, full-stack monitoring platform. Error monitoring, session replay, logging, distributed tracing, and more.",TypeScript,https://github.com/highlight/highlight,603.35 MB
737,ng-zorro-antd,9152,4074,9152,833,08/08/2017,04/03/2026,28.68 MB,Angular UI Component Library based on Ant Design,TypeScript,https://github.com/NG-ZORRO/ng-zorro-antd,28.68 MB
738,fluent-reader,9131,501,9131,395,31/05/2020,27/02/2026,18.85 MB,"Modern desktop RSS reader built with Electron, React, and Fluent UI",TypeScript,https://github.com/yang991178/fluent-reader,18.85 MB
739,opentui,9125,416,9125,134,21/07/2025,05/03/2026,6.49 MB,OpenTUI is a library for building terminal user interfaces (TUIs),TypeScript,https://github.com/anomalyco/opentui,6.49 MB
740,api-platform,9117,979,9117,718,06/03/2015,05/03/2026,6.06 MB,"🕸️ Create REST and GraphQL APIs, scaffold Jamstack webapps, stream changes in real-time.",TypeScript,https://github.com/api-platform/api-platform,6.06 MB
741,telegraf,9112,958,9112,74,16/04/2016,11/01/2025,6.38 MB,Modern Telegram Bot Framework for Node.js,TypeScript,https://github.com/telegraf/telegraf,6.38 MB
742,transform,9104,699,9104,83,15/06/2017,28/01/2026,12.77 MB,A polyglot web converter.,TypeScript,https://github.com/ritz078/transform,12.77 MB
743,async-validator,9100,769,9100,165,10/03/2015,20/02/2024,1.10 MB,validate form asynchronous,TypeScript,https://github.com/yiminghe/async-validator,1.10 MB
744,nhost,9096,560,9096,103,09/02/2021,05/03/2026,377.11 MB,The Open Source Firebase Alternative with GraphQL.,TypeScript,https://github.com/nhost/nhost,377.11 MB
745,berty,9092,484,9092,113,16/07/2018,05/03/2026,265.43 MB,"Berty is a secure peer-to-peer messaging app that works with or without internet access, cellular data or trust in the network",TypeScript,https://github.com/berty/berty,265.43 MB
746,npkill,9091,231,9091,18,30/06/2019,28/02/2026,8.22 MB,List any node_modules 📦 dir in your system and how heavy they are. You can then select which ones you want to erase to free up space 🧹,TypeScript,https://github.com/voidcosmos/npkill,8.22 MB
747,outline-apps,9088,1439,9088,518,13/03/2018,04/03/2026,594.16 MB,"Outline Client and Manager, developed by Jigsaw. Outline Manager makes it easy to create your own VPN server. Outline Client lets you share access to your VPN with anyone in your network, giving them access to the free and open internet.",TypeScript,https://github.com/OutlineFoundation/outline-apps,594.16 MB
748,StableStudio,9052,926,9052,62,21/04/2023,30/04/2024,52.76 MB,Community interface for generative AI,TypeScript,https://github.com/Stability-AI/StableStudio,52.76 MB
749,keyviz,9051,316,9051,22,22/07/2022,03/03/2026,5.46 MB,Keyviz is a free and open-source tool to visualize your keystrokes ⌨️ and 🖱️ mouse actions in real-time.,TypeScript,https://github.com/mulaRahul/keyviz,5.46 MB
750,dogehouse,9051,1441,9051,216,12/02/2021,14/09/2023,33.76 MB,Taking voice conversations to the moon 🚀,TypeScript,https://github.com/benawad/dogehouse,33.76 MB
751,MQTT.js,9039,1442,9039,40,05/04/2011,25/02/2026,9.08 MB,The MQTT client for Node.js and the browser,TypeScript,https://github.com/mqttjs/MQTT.js,9.08 MB
752,rowboat,9036,771,9036,61,13/01/2025,05/03/2026,76.12 MB,"Open-source AI coworker, with memory",TypeScript,https://github.com/rowboatlabs/rowboat,76.12 MB
753,bloomrpc,9005,471,9005,0,13/12/2018,04/01/2023,45.53 MB,Former GUI client for gRPC services. No longer maintained.,TypeScript,https://github.com/bloomrpc/bloomrpc,45.53 MB
754,coai,8982,1184,8982,27,17/07/2023,27/02/2026,34.03 MB,"🚀 Next Generation Multi-tenant AI One-Stop Solution. Builtin Admin & Billing System. Enterprise-Grade Unified LLM Gateway Support for 200+ Models And 35+ Providers, Load Balacing w/ Priority-base Routing, Cost Management, Chat Share, Cloud Sync, Credit/Subscription Billing, All File Parsing, Web Search, Built-in Model Cache.",TypeScript,https://github.com/coaidev/coai,34.03 MB
755,opencti,8967,1278,8967,1723,17/12/2018,05/03/2026,352.70 MB,Open Cyber Threat Intelligence Platform,TypeScript,https://github.com/OpenCTI-Platform/opencti,352.70 MB
756,mediago,8961,753,8961,70,30/01/2021,24/02/2026,482.98 MB,"跨平台视频提取工具：支持流媒体下载、视频下载、m3u8 下载及 B站视频下载，提供 Windows 和 Mac 桌面客户端。Cross-platform video extraction tool: Supports streaming download, video download, m3u8 download, and Bilibili video download, with desktop clients for Windows and Mac.",TypeScript,https://github.com/caorushizi/mediago,482.98 MB
757,IconPark,8955,535,8955,798,27/07/2020,24/02/2023,12.61 MB,"🍎Transform an SVG icon into multiple themes, and generate React icons，Vue icons，svg icons",TypeScript,https://github.com/bytedance/IconPark,12.61 MB
758,openbrowser,8955,793,8955,0,11/04/2019,01/03/2026,753.00 KB,Let AI agents browse the web. An autonomous toolkit for browser-based AI agents.,TypeScript,https://github.com/ntegrals/openbrowser,753.00 KB
759,baseweb,8943,866,8943,163,09/03/2018,27/02/2026,297.14 MB,A React Component library implementing the Base design language,TypeScript,https://github.com/uber/baseweb,297.14 MB
760,urql,8939,472,8939,35,24/01/2018,26/02/2026,24.77 MB,The highly customizable and versatile GraphQL client with which you add on features like normalized caching as you grow.,TypeScript,https://github.com/urql-graphql/urql,24.77 MB
761,adminjs,8915,727,8915,221,23/11/2018,15/07/2025,49.75 MB,AdminJS is an admin panel for apps written in node.js,TypeScript,https://github.com/SoftwareBrothers/adminjs,49.75 MB
762,inspector,8913,1198,8913,189,03/10/2024,02/03/2026,6.69 MB,Visual testing tool for MCP servers,TypeScript,https://github.com/modelcontextprotocol/inspector,6.69 MB
763,BetterDiscord,8911,1019,8911,45,01/10/2017,05/03/2026,88.75 MB,Better Discord enhances Discord desktop app with new features.,TypeScript,https://github.com/BetterDiscord/BetterDiscord,88.75 MB
764,node-cron,8908,636,8908,21,23/06/2010,05/03/2026,3.24 MB,Cron for NodeJS.,TypeScript,https://github.com/kelektiv/node-cron,3.24 MB
765,wewe-rss,8903,1567,8903,271,27/02/2024,04/04/2025,2.23 MB,🤗更优雅的微信公众号订阅方式，支持私有化部署、微信公众号RSS生成（基于微信读书）,TypeScript,https://github.com/cooderl/wewe-rss,2.23 MB
766,mikro-orm,8886,617,8886,32,15/03/2018,06/03/2026,80.60 MB,"TypeScript ORM for Node.js based on Data Mapper, Unit of Work and Identity Map patterns. Supports MongoDB, MySQL, MariaDB, MS SQL Server, PostgreSQL and SQLite/libSQL databases.",TypeScript,https://github.com/mikro-orm/mikro-orm,80.60 MB
767,aprendiendo-react,8876,1208,8876,17,26/05/2019,10/09/2025,610.00 KB,Curso para aprender React desde cero,TypeScript,https://github.com/midudev/aprendiendo-react,610.00 KB
768,aicommits,8869,464,8869,7,14/02/2023,02/03/2026,2.38 MB,A CLI that writes your git commit messages for you with AI,TypeScript,https://github.com/Nutlope/aicommits,2.38 MB
769,graphql-playground,8859,723,8859,402,25/01/2017,02/10/2025,5.92 MB,"🎮  GraphQL IDE for better development workflows (GraphQL Subscriptions, interactive docs & collaboration)",TypeScript,https://github.com/graphql/graphql-playground,5.92 MB
770,OpenMetadata,8843,1655,8843,623,01/08/2021,05/03/2026,2.80 GB,"OpenMetadata is a unified metadata platform for data discovery, data observability, and data governance powered by a central metadata repository, in-depth column level lineage, and seamless team collaboration.",TypeScript,https://github.com/open-metadata/OpenMetadata,2.80 GB
771,base-ui,8842,378,8842,366,23/02/2024,05/03/2026,33.62 MB,"Unstyled UI components for building accessible web apps and design systems. From the creators of Radix, Floating UI, and Material UI.",TypeScript,https://github.com/mui/base-ui,33.62 MB
772,eva-icons,8825,371,8825,57,30/10/2018,04/03/2023,51.78 MB,"A pack of more than 480 beautifully crafted Open Source icons. SVG, Sketch, Web Font and Animations support.",TypeScript,https://github.com/akveo/eva-icons,51.78 MB
773,nsfwjs,8815,588,8815,92,13/02/2019,23/02/2026,63.60 MB,NSFW detection on the client-side via TensorFlow.js,TypeScript,https://github.com/infinitered/nsfwjs,63.60 MB
774,omni-tools,8800,549,8800,103,13/06/2024,28/02/2026,3.85 MB,"Self-hosted collection of powerful web-based tools for everyday tasks. No ads, no tracking, just fast, accessible utilities right from your browser!",TypeScript,https://github.com/iib0011/omni-tools,3.85 MB
775,react-native-bottom-sheet,8788,937,8788,76,31/07/2020,04/12/2025,34.49 MB,A performant interactive bottom sheet with fully configurable options 🚀,TypeScript,https://github.com/gorhom/react-native-bottom-sheet,34.49 MB
776,openskills,8777,564,8777,36,26/10/2025,18/01/2026,204.00 KB,Universal skills loader for AI coding agents - npm i -g openskills,TypeScript,https://github.com/numman-ali/openskills,204.00 KB
777,Noi,8765,683,8765,210,16/10/2023,04/02/2026,38.59 MB,🚀 Less chaos. More flow.,TypeScript,https://github.com/lencx/Noi,38.59 MB
778,gridstack.js,8740,1402,8740,67,10/11/2014,05/03/2026,18.06 MB,Build interactive dashboards in minutes.,TypeScript,https://github.com/gridstack/gridstack.js,18.06 MB
779,howtographql,8734,1139,8734,175,06/06/2017,03/07/2024,15.16 MB,The Fullstack Tutorial for GraphQL,TypeScript,https://github.com/howtographql/howtographql,15.16 MB
780,tsparticles,8724,931,8724,16,05/02/2020,05/03/2026,378.19 MB,"tsParticles - Easily create highly customizable JavaScript particles effects, confetti explosions and fireworks animations and use them as animated backgrounds for your website. Ready to use components available for React.js, Vue.js (2.x and 3.x), Angular, Svelte, jQuery, Preact, Inferno, Solid, Riot and Web Components.",TypeScript,https://github.com/tsparticles/tsparticles,378.19 MB
781,assistant-ui,8721,909,8721,65,22/11/2023,06/03/2026,72.00 MB,Typescript/React Library for AI Chat💬🚀,TypeScript,https://github.com/assistant-ui/assistant-ui,72.00 MB
782,node-glob,8718,523,8718,3,02/11/2009,26/02/2026,2.97 MB,glob functionality for node.js,TypeScript,https://github.com/isaacs/node-glob,2.97 MB
783,rsuite,8700,971,8700,321,06/06/2016,05/03/2026,167.74 MB,🧱 A suite of React components .  ,TypeScript,https://github.com/rsuite/rsuite,167.74 MB
784,lucky-canvas,8683,1029,8683,192,10/06/2019,12/08/2025,5.81 MB,🎖🎖🎖 基于 TS + Canvas 开发的【大转盘 / 九宫格 / 老虎机】抽奖插件，🌈 一套源码适配多端框架 JS / Vue / React / Taro / UniApp / 微信小程序等，🎨 奖品 / 文字 / 图片 / 颜色 / 按钮均可配置，支持同步 / 异步抽奖，🎯 概率前 / 后端可控，🚀 自动根据 dpr 调整清晰度适配移动端,TypeScript,https://github.com/buuing/lucky-canvas,5.81 MB
785,any-rule,8672,822,8672,71,10/06/2019,21/07/2024,3.57 MB,"🦕  常用正则大全, 支持web / vscode / idea / Alfred Workflow多平台",TypeScript,https://github.com/any86/any-rule,3.57 MB
786,ethers.js,8652,2108,8652,633,16/07/2016,13/02/2026,174.35 MB,Complete Ethereum library and wallet implementation in JavaScript.,TypeScript,https://github.com/ethers-io/ethers.js,174.35 MB
787,iptv-sources,8641,1200,8641,1,25/11/2023,06/03/2026,5.32 GB,Autoupdate iptv sources,TypeScript,https://github.com/HerbertHe/iptv-sources,5.32 GB
788,morphic,8637,2346,8637,52,05/04/2024,05/03/2026,8.88 MB,An AI-powered search engine with a generative UI,TypeScript,https://github.com/miurla/morphic,8.88 MB
789,builder,8623,1152,8623,256,30/01/2019,05/03/2026,330.30 MB,"Visual Development for React, Vue, Svelte, Qwik, and more",TypeScript,https://github.com/BuilderIO/builder,330.30 MB
790,heyform,8621,666,8621,26,20/03/2024,05/03/2026,170.16 MB,Open-Source Form Builder,TypeScript,https://github.com/heyform/heyform,170.16 MB
791,TypeChat,8618,409,8618,81,20/06/2023,06/03/2026,1.28 MB,TypeChat is a library that makes it easy to build natural language interfaces using types.,TypeScript,https://github.com/microsoft/TypeChat,1.28 MB
792,react-cosmos,8617,363,8617,6,05/02/2014,05/03/2026,27.18 MB,Sandbox for developing and testing UI components in isolation,TypeScript,https://github.com/react-cosmos/react-cosmos,27.18 MB
793,sentry-javascript,8596,1754,8596,486,01/02/2012,05/03/2026,197.92 MB,Official Sentry SDKs for JavaScript,TypeScript,https://github.com/getsentry/sentry-javascript,197.92 MB
794,obsidian-dataview,8588,501,8588,649,13/01/2021,17/11/2025,3.50 MB,"A data index and query language over Markdown files, for https://obsidian.md/.",TypeScript,https://github.com/blacksmithgu/obsidian-dataview,3.50 MB
795,star-history,8584,318,8584,3,23/09/2015,05/03/2026,159.74 MB,The missing star history graph of GitHub repos - https://star-history.com,TypeScript,https://github.com/star-history/star-history,159.74 MB
796,path-to-regexp,8575,456,8575,8,01/08/2012,14/01/2026,1018.00 KB,Turn a path string such as `/user/:name` into a regular expression,TypeScript,https://github.com/pillarjs/path-to-regexp,1018.00 KB
797,craft.js,8566,833,8566,225,04/06/2019,14/02/2025,19.07 MB,🚀 A React Framework for building extensible drag and drop page editors,TypeScript,https://github.com/prevwong/craft.js,19.07 MB
798,ariakit,8529,411,8529,123,19/09/2017,05/03/2026,257.19 MB,"Toolkit with accessible components, styles, and examples for your next web app",TypeScript,https://github.com/ariakit/ariakit,257.19 MB
799,oh-my-claudecode,8523,592,8523,1,09/01/2026,06/03/2026,18.91 MB,Teams-first Multi-agent orchestration for Claude Code,TypeScript,https://github.com/Yeachan-Heo/oh-my-claudecode,18.91 MB
800,vxe-table,8523,1151,8523,1310,20/04/2019,27/02/2026,244.25 MB,"vxe table 支持 vue2, vue3 的表格解决方案",TypeScript,https://github.com/x-extends/vxe-table,244.25 MB
801,awesome-nano-banana-pro-prompts,8511,853,8511,1,23/11/2025,06/03/2026,224.55 MB,"🍌 World's largest Nano Banana Pro prompt library — 10,000+ curated prompts with preview images, 16 languages. Google Gemini AI image generation. Free & open source.",TypeScript,https://github.com/YouMind-OpenLab/awesome-nano-banana-pro-prompts,224.55 MB
802,bullmq,8503,570,8503,342,19/12/2018,06/03/2026,139.68 MB,"BullMQ - Message Queue and Batch processing for NodeJS, Python, Elixir and PHP based on Redis",TypeScript,https://github.com/taskforcesh/bullmq,139.68 MB
803,graphql-yoga,8490,591,8490,130,15/11/2017,05/03/2026,145.17 MB,"🧘 Rewrite of a fully-featured GraphQL Server with focus on easy setup, performance & great developer experience.  The core of Yoga implements WHATWG Fetch API and can run/deploy on any JS environment.",TypeScript,https://github.com/graphql-hive/graphql-yoga,145.17 MB
804,skills,8490,715,8490,211,14/01/2026,05/03/2026,445.00 KB,The open agent skills tool - npx skills,TypeScript,https://github.com/vercel-labs/skills,445.00 KB
805,open-resume,8486,959,8486,132,24/06/2023,29/10/2024,24.45 MB,OpenResume is a powerful open-source resume builder and resume parser. https://open-resume.com/,TypeScript,https://github.com/xitanggg/open-resume,24.45 MB
806,valibot,8474,310,8474,142,07/07/2023,05/03/2026,12.46 MB,The modular and type safe schema library for validating structural data 🤖,TypeScript,https://github.com/open-circle/valibot,12.46 MB
807,vscode-leetcode,8473,692,8473,369,11/02/2018,13/09/2024,11.55 MB,Solve LeetCode problems in VS Code,TypeScript,https://github.com/LeetCode-OpenSource/vscode-leetcode,11.55 MB
808,swapy,8459,178,8459,50,15/07/2024,19/01/2025,305.00 KB,✨ A framework-agnostic tool that converts any layout into a drag-to-swap one with just a few lines of code https://swapy.tahazsh.com/,TypeScript,https://github.com/TahaSh/swapy,305.00 KB
809,tfjs-core,8459,936,8459,11,02/08/2017,14/08/2019,371.10 MB,WebGL-accelerated ML // linear algebra // automatic differentiation for JavaScript.,TypeScript,https://github.com/tensorflow/tfjs-core,371.10 MB
810,react-native-fast-image,8441,1530,8441,474,13/04/2017,14/06/2024,60.36 MB,"🚩 FastImage, performant React Native image component.",TypeScript,https://github.com/DylanVann/react-native-fast-image,60.36 MB
811,hardhat,8435,1700,8435,618,14/04/2018,06/03/2026,207.39 MB,"Hardhat is a development environment to compile, deploy, test, and debug your Ethereum software. ",TypeScript,https://github.com/NomicFoundation/hardhat,207.39 MB
812,rematch,8427,414,8427,26,01/10/2017,27/09/2023,23.47 MB,The Redux Framework,TypeScript,https://github.com/rematch/rematch,23.47 MB
813,BetterChatGPT,8425,2720,8425,248,03/03/2023,14/08/2024,3.38 MB,An amazing UI for OpenAI's ChatGPT (Website + Windows + MacOS + Linux),TypeScript,https://github.com/ztjhz/BetterChatGPT,3.38 MB
814,openstatus,8418,586,8418,43,19/06/2023,05/03/2026,88.30 MB,🫖 Status page with uptime monitoring & API monitoring as code   🫖,TypeScript,https://github.com/openstatusHQ/openstatus,88.30 MB
815,react-map-gl,8415,1359,8415,89,08/10/2015,03/02/2026,33.70 MB,React friendly API wrapper around MapboxGL JS,TypeScript,https://github.com/visgl/react-map-gl,33.70 MB
816,shadcn-svelte,8410,515,8410,71,16/05/2023,02/03/2026,34.98 MB,"shadcn/ui, but for Svelte. ✨",TypeScript,https://github.com/huntabyte/shadcn-svelte,34.98 MB
817,ts-reset,8398,128,8398,58,19/02/2023,22/10/2024,310.00 KB,"A 'CSS reset' for TypeScript, improving types for common JavaScript API's",TypeScript,https://github.com/mattpocock/ts-reset,310.00 KB
818,conventional-changelog,8394,740,8394,243,04/01/2014,06/03/2026,6.25 MB,Generate changelogs and release notes from a project's commit messages and metadata.,TypeScript,https://github.com/conventional-changelog/conventional-changelog,6.25 MB
819,typedoc,8374,759,8374,11,24/05/2014,28/02/2026,17.56 MB,Documentation generator for TypeScript projects.,TypeScript,https://github.com/TypeStrong/typedoc,17.56 MB
820,react-datepicker,8372,2274,8372,45,22/06/2014,04/03/2026,168.28 MB,A simple and reusable datepicker component for React,TypeScript,https://github.com/Hacker0x01/react-datepicker,168.28 MB
821,waoowaoo,8338,1723,8338,59,22/01/2026,03/03/2026,8.23 MB,首家工业级全流程 AI 影视生产平台。Industry-first professional AI Agent platform for controllable film & video production. From shorts to live-action with Hollywood-standard workflows.,TypeScript,https://github.com/waoowaooAI/waoowaoo,8.23 MB
822,pdf-lib,8335,856,8335,313,04/09/2017,17/07/2024,132.58 MB,Create and modify PDF documents in any JavaScript environment,TypeScript,https://github.com/Hopding/pdf-lib,132.58 MB
823,next-seo,8310,438,8310,6,12/06/2018,15/02/2026,9.49 MB,Next SEO is a plug in that makes managing your SEO easier in Next.js projects.,TypeScript,https://github.com/garmeeh/next-seo,9.49 MB
824,platform,8303,2048,8303,67,02/03/2017,05/03/2026,31.16 MB,Reactive State for Angular,TypeScript,https://github.com/ngrx/platform,31.16 MB
825,webstudio,8288,1450,8288,352,13/03/2022,01/03/2026,46.60 MB,"Open source website builder and Webflow alternative. Webstudio is an advanced visual builder that connects to any headless CMS, supports all CSS properties, and can be hosted anywhere, including with us.",TypeScript,https://github.com/webstudio-is/webstudio,46.60 MB
826,reactxp,8254,485,8254,96,22/03/2017,18/07/2023,25.80 MB,Library for cross-platform app development.,TypeScript,https://github.com/microsoft/reactxp,25.80 MB
827,unredacter,8254,800,8254,35,22/10/2021,15/03/2024,1.56 MB,Never ever ever use pixelation as a redaction technique,TypeScript,https://github.com/BishopFox/unredacter,1.56 MB
828,ng-bootstrap,8246,1563,8246,427,14/09/2015,18/12/2025,17.54 MB,Angular powered Bootstrap,TypeScript,https://github.com/ng-bootstrap/ng-bootstrap,17.54 MB
829,react-native-skia,8234,579,8234,106,08/11/2021,05/03/2026,339.26 MB,High-performance React Native Graphics using Skia,TypeScript,https://github.com/Shopify/react-native-skia,339.26 MB
830,oblivion-desktop,8227,930,8227,23,11/04/2024,01/01/2026,9.89 MB,Oblivion Desktop - Unofficial Warp Client for Windows/Mac/Linux,TypeScript,https://github.com/bepass-org/oblivion-desktop,9.89 MB
831,RedisInsight,8221,436,8221,74,30/07/2021,05/03/2026,79.56 MB,Redis GUI by Redis,TypeScript,https://github.com/redis/RedisInsight,79.56 MB
832,zyfun,8194,1005,8194,15,06/02/2023,01/03/2026,42.68 MB,"跨平台桌面端视频资源播放器,免费高颜值.",TypeScript,https://github.com/Hiram-Wong/zyfun,42.68 MB
833,themes,8188,318,8188,154,15/06/2023,12/02/2026,23.89 MB,"Radix Themes is an open-source component library optimized for fast development, easy maintenance, and accessibility. Maintained by @workos.",TypeScript,https://github.com/radix-ui/themes,23.89 MB
834,vaul,8183,340,8183,151,16/07/2023,03/10/2025,1.11 MB,A drawer component for React.,TypeScript,https://github.com/emilkowalski/vaul,1.11 MB
835,react-native-mmkv,8170,333,8170,56,24/02/2021,04/03/2026,36.65 MB,⚡️ The fastest key/value storage for React Native. ~30x faster than AsyncStorage!,TypeScript,https://github.com/mrousavy/react-native-mmkv,36.65 MB
836,vscode-debug-visualizer,8165,441,8165,108,20/06/2019,17/03/2025,57.96 MB,An extension for VS Code that visualizes data during debugging.,TypeScript,https://github.com/hediet/vscode-debug-visualizer,57.96 MB
837,countUp.js,8165,1373,8165,5,30/12/2013,05/03/2026,3.00 MB,Animates a numerical value by counting to it,TypeScript,https://github.com/inorganik/countUp.js,3.00 MB
838,ChatGPT-Shortcut,8129,904,8129,1,24/02/2023,05/03/2026,552.32 MB,"🚀💪Maximize your efficiency and productivity. The ultimate hub to manage, customize, and share prompts. (English/中文/Español/العربية). 让生产力加倍的 AI 快捷指令。更高效地管理提示词，在分享社区中发现适用于不同场景的灵感。",TypeScript,https://github.com/rockbenben/ChatGPT-Shortcut,552.32 MB
839,nebular,8128,1509,8128,931,20/09/2017,15/01/2026,147.69 MB,:boom: Customizable Angular UI Library based on Eva Design System :new_moon_with_face::sparkles:Dark Mode,TypeScript,https://github.com/akveo/nebular,147.69 MB
840,search_with_lepton,8116,1017,8116,47,23/01/2024,02/12/2025,323.00 KB,Building a quick conversation-based search demo with Lepton AI.,TypeScript,https://github.com/leptonai/search_with_lepton,323.00 KB
841,beautiful-mermaid,8103,246,8103,19,28/01/2026,26/02/2026,713.00 KB,,TypeScript,https://github.com/lukilabs/beautiful-mermaid,713.00 KB
