Ranking,Project Name,Stars,Forks,Watchers,Open Issues,Created At,Last Commit,Size,Description,Language,Repo URL,Size
478,notesnook,13843,933,13843,955,01/04/2021,19/03/2026,274.80 MB,A fully open source & end-to-end encrypted note taking alternative to Evernote.,TypeScript,https://github.com/streetwriters/notesnook,274.80 MB
479,tamagui,13826,590,13826,100,16/10/2020,20/03/2026,864.57 MB,"Style React fast with 100% parity on React Native, an optional UI kit, and optimizing compiler.",TypeScript,https://github.com/tamagui/tamagui,864.57 MB
480,cropperjs,13813,2452,13813,42,25/09/2015,22/11/2025,15.02 MB,JavaScript image cropper.,TypeScript,https://github.com/fengyuanchen/cropperjs,15.02 MB
481,Figma-Context-MCP,13794,1091,13794,34,13/02/2025,19/03/2026,821.00 KB,MCP server to provide Figma layout information to AI coding agents like Cursor,TypeScript,https://github.com/GLips/Figma-Context-MCP,821.00 KB
482,mitosis,13791,637,13791,175,06/11/2020,13/01/2026,27.97 MB,"Write components once, run everywhere. Compiles to React, Vue, Qwik, Solid, Angular, Svelte, and more. ",TypeScript,https://github.com/BuilderIO/mitosis,27.97 MB
483,fresh,13764,743,13764,309,07/05/2021,25/02/2026,43.43 MB,The next-gen web framework.,TypeScript,https://github.com/denoland/fresh,43.43 MB
484,auto-animate,13759,249,13759,38,11/05/2022,16/03/2026,11.23 MB,"A zero-config, drop-in animation utility that adds smooth transitions to your web app. You can use it with React, Vue, or any other JavaScript application.",TypeScript,https://github.com/formkit/auto-animate,11.23 MB
485,nextra,13692,1413,13692,313,15/06/2020,17/03/2026,39.83 MB,"Simple, powerful and flexible site generation framework with everything you love from Next.js.",TypeScript,https://github.com/shuding/nextra,39.83 MB
486,partytown,13667,452,13667,82,20/08/2021,17/03/2026,21.44 MB,Relocate resource intensive third-party scripts off of the main thread and into a web worker. 🎉,TypeScript,https://github.com/QwikDev/partytown,21.44 MB
487,quicktype,13665,1177,13665,560,13/07/2017,27/10/2025,19.22 MB,"Generate types and converters from JSON, Schema, and GraphQL",TypeScript,https://github.com/glideapps/quicktype,19.22 MB
488,emoji-cheat-sheet,13647,4610,13647,85,17/03/2017,20/03/2026,31.08 MB,A markdown version emoji cheat sheet,TypeScript,https://github.com/ikatyang/emoji-cheat-sheet,31.08 MB
489,gitpod,13632,1372,13632,459,24/04/2018,17/03/2026,104.45 MB,The developer platform for on-demand cloud development environments to create software faster and more securely.,TypeScript,https://github.com/gitpod-io/gitpod,104.45 MB
490,effect,13612,534,13612,504,13/11/2019,20/03/2026,94.61 MB,Build production-ready applications in TypeScript,TypeScript,https://github.com/Effect-TS/effect,94.61 MB
491,open-saas,13611,1567,13611,118,01/12/2023,17/03/2026,123.27 MB,"A 100% free modern JS SaaS boilerplate (React, NodeJS, Prisma). Full-featured: Auth (email, google, github, slack, MS), Email sending, Background jobs, Landing page, Payments (Stripe, Polar.sh), Shadcn UI, S3 file upload. AI-ready with tailored AGENTS.md, skills, and Claude Code plugin. One cmd deploy. Powered by Wasp full-stack framework.",TypeScript,https://github.com/wasp-lang/open-saas,123.27 MB
492,draw-a-ui,13603,1639,13603,51,07/11/2023,26/07/2025,999.00 KB,Draw a mockup and generate html for it,TypeScript,https://github.com/SawyerHood/draw-a-ui,999.00 KB
493,color-thief,13601,1319,13601,5,01/11/2011,06/03/2026,3.36 MB,Grab the color palette from an image using just Javascript.  Works in the browser and in Node.,TypeScript,https://github.com/lokesh/color-thief,3.36 MB
494,kysely,13597,395,13597,160,22/02/2021,18/03/2026,53.16 MB,A type-safe TypeScript SQL query builder,TypeScript,https://github.com/kysely-org/kysely,53.16 MB
495,voicebox,13589,1596,13589,154,25/01/2026,19/03/2026,99.07 MB,The open-source voice synthesis studio,TypeScript,https://github.com/jamiepine/voicebox,99.07 MB
496,nexe,13571,556,13571,164,26/11/2011,05/03/2026,32.14 MB,🎉 create a single executable out of your node.js apps,TypeScript,https://github.com/nexe/nexe,32.14 MB
497,flipper,13481,985,13481,507,12/04/2018,26/09/2025,433.03 MB,A desktop debugging platform for mobile developers.,TypeScript,https://github.com/facebook/flipper,433.03 MB
498,ui-router,13453,2952,13453,25,18/01/2013,31/12/2025,13.14 MB,The de-facto solution to flexible routing with nested views in AngularJS,TypeScript,https://github.com/angular-ui/ui-router,13.14 MB
499,A2UI,13445,1011,13445,203,24/09/2025,20/03/2026,123.20 MB,,TypeScript,https://github.com/google/A2UI,123.20 MB
500,react-toastify,13439,740,13439,103,08/11/2016,25/08/2025,15.90 MB,React notification made easy 🚀 !,TypeScript,https://github.com/fkhadra/react-toastify,15.90 MB
501,Aperant,13405,1828,13405,359,04/12/2025,19/03/2026,57.41 MB,Autonomous multi-session AI coding,TypeScript,https://github.com/AndyMik90/Aperant,57.41 MB
502,chartist,13403,2492,13403,245,09/03/2014,15/03/2026,15.16 MB,Simple responsive charts,TypeScript,https://github.com/chartist-js/chartist,15.16 MB
503,lenis,13388,530,13388,20,21/02/2022,18/03/2026,9.06 MB,Smooth scroll at it should be,TypeScript,https://github.com/darkroomengineering/lenis,9.06 MB
504,blockly,13351,3836,13351,397,25/10/2013,19/03/2026,143.71 MB,The web-based visual programming editor.,TypeScript,https://github.com/RaspberryPiFoundation/blockly,143.71 MB
505,react-redux-typescript-guide,13327,1088,13327,42,20/12/2016,31/05/2022,2.87 MB,"The complete guide to static typing in ""React & Redux"" apps using TypeScript",TypeScript,https://github.com/piotrwitek/react-redux-typescript-guide,2.87 MB
506,drawnix,13317,1118,13317,67,04/06/2024,03/03/2026,1.47 MB,"开源白板工具（SaaS），一体化白板，包含思维导图、流程图、自由画等。All in one open-source whiteboard tool with mind, flowchart, freehand and etc.",TypeScript,https://github.com/plait-board/drawnix,1.47 MB
507,ralph,13303,1389,13303,58,07/01/2026,02/02/2026,4.59 MB,Ralph is an autonomous AI agent loop that runs repeatedly until all PRD items are complete. ,TypeScript,https://github.com/snarktank/ralph,4.59 MB
508,unleash,13286,841,13286,60,29/09/2014,19/03/2026,296.59 MB,Open-source feature management platform,TypeScript,https://github.com/Unleash/unleash,296.59 MB
509,wechat-chatgpt,13269,3765,13269,62,06/12/2022,20/05/2024,1.27 MB,Use ChatGPT On Wechat via wechaty,TypeScript,https://github.com/fuergaosi233/wechat-chatgpt,1.27 MB
510,peerjs,13258,1457,13258,200,23/12/2012,27/02/2026,10.76 MB,Simple peer-to-peer with WebRTC.,TypeScript,https://github.com/peers/peerjs,10.76 MB
511,omi,13258,1264,13258,70,31/05/2015,17/03/2026,156.02 MB,Web Components Framework - Web组件框架,TypeScript,https://github.com/Tencent/omi,156.02 MB
512,chromeless,13241,570,13241,198,01/06/2017,13/11/2018,1.06 MB,🖥  Chrome automation made simple. Runs locally or headless on AWS Lambda.,TypeScript,https://github.com/schickling/chromeless,1.06 MB
513,tinacms,13215,683,13215,380,23/07/2019,20/03/2026,893.50 MB,A fully open-source headless CMS that supports Markdown and Visual Editing,TypeScript,https://github.com/tinacms/tinacms,893.50 MB
514,satori,13150,335,13150,106,27/01/2022,16/03/2026,7.77 MB,Enlightened library to convert HTML and CSS to SVG,TypeScript,https://github.com/vercel/satori,7.77 MB
515,ts-node,13141,549,13141,229,15/07/2015,18/07/2024,8.06 MB,TypeScript execution and REPL for node.js,TypeScript,https://github.com/TypeStrong/ts-node,8.06 MB
516,chatgpt-google-extension,13134,1475,13134,106,04/12/2022,14/08/2024,2.25 MB,This project is deprecated. Check my new project ChatHub:,TypeScript,https://github.com/wong2/chatgpt-google-extension,2.25 MB
517,banana-slides,13115,1527,13115,55,29/11/2025,16/03/2026,44.36 MB,一个基于nano banana pro🍌的原生AI PPT生成应用，迈向真正的＂Vibe PPT＂; 支持上传任意模板图片；上传任意素材&智能解析；一句话/大纲/页面描述自动生成PPT；口头修改指定区域、一键导出可编辑ppt - An AI-native slides generator based on nano banana pro🍌,TypeScript,https://github.com/Anionex/banana-slides,44.36 MB
518,metamask-extension,13104,5533,13104,2590,06/09/2015,20/03/2026,1.14 GB,:globe_with_meridians: :electric_plug: The MetaMask browser extension enables browsing Ethereum blockchain enabled websites,TypeScript,https://github.com/MetaMask/metamask-extension,1.14 GB
519,shiki,13100,583,13100,101,29/10/2018,10/03/2026,15.65 MB,A beautiful yet powerful syntax highlighter,TypeScript,https://github.com/shikijs/shiki,15.65 MB
520,eigent,13079,1508,13079,156,29/07/2025,18/03/2026,117.14 MB,Eigent: The Open Source Cowork Desktop to Unlock Your Exceptional Productivity. Local and Free Alternative to Claude Cowork.,TypeScript,https://github.com/eigent-ai/eigent,117.14 MB
521,core,13046,832,13046,172,15/02/2017,19/03/2026,82.23 MB,"A toolchain for building scalable, enterprise-ready component systems on top of TypeScript and Web Component standards. Stencil components can be distributed natively to React, Angular, Vue, (+ more) and traditional web applications from a single, framework-agnostic codebase.",TypeScript,https://github.com/stenciljs/core,82.23 MB
522,stimulus,13032,443,13032,68,17/12/2016,21/01/2026,4.00 MB,A modest JavaScript framework for the HTML you already have,TypeScript,https://github.com/hotwired/stimulus,4.00 MB
523,ext-saladict,13018,829,13018,773,20/11/2015,08/10/2025,15.47 MB,"🥗 All-in-one professional pop-up dictionary and page translator which supports multiple search modes, page translations, new word notebook and PDF selection searching.",TypeScript,https://github.com/crimx/ext-saladict,15.47 MB
524,redux-persist,12999,856,12999,596,23/07/2015,01/05/2024,1.08 MB,persist and rehydrate a redux store,TypeScript,https://github.com/rt2zz/redux-persist,1.08 MB
525,plasmo,12932,453,12932,370,02/05/2022,19/03/2026,5.94 MB,🧩 The Browser Extension Framework,TypeScript,https://github.com/PlasmoHQ/plasmo,5.94 MB
526,google-webfonts-helper,12929,445,12929,63,22/12/2014,27/02/2026,792.00 KB,"A Hassle-Free Way to Self-Host Google Fonts. Get eot, ttf, svg, woff and woff2 files + CSS snippets",TypeScript,https://github.com/majodev/google-webfonts-helper,792.00 KB
527,SponsorBlock,12921,441,12921,405,10/07/2019,17/03/2026,15.62 MB,Skip YouTube video sponsors (browser extension),TypeScript,https://github.com/ajayyy/SponsorBlock,15.62 MB
528,crystal,12912,613,12912,158,14/04/2016,19/03/2026,118.15 MB,"🔮 Graphile's Crystal Monorepo; home to Grafast, PostGraphile, pg-introspection, pg-sql2 and much more!",TypeScript,https://github.com/graphile/crystal,118.15 MB
529,Vencord,12912,2071,12912,307,24/08/2022,19/03/2026,11.21 MB,The cutest Discord modification,TypeScript,https://github.com/Vendicated/Vencord,11.21 MB
530,interact.js,12908,808,12908,95,21/10/2012,28/03/2024,30.70 MB,"JavaScript drag and drop, resizing and multi-touch gestures with inertia and snapping for modern browsers (and also IE9+)",TypeScript,https://github.com/taye/interact.js,30.70 MB
531,barba,12891,493,12891,14,12/11/2015,02/12/2024,30.48 MB,"Create badass, fluid and smooth transitions between your website’s pages",TypeScript,https://github.com/barbajs/barba,30.48 MB
532,clash-nyanpasu,12873,781,12873,115,10/11/2023,20/03/2026,36.53 MB,Clash Nyanpasu～(∠・ω< )⌒☆​,TypeScript,https://github.com/libnyanpasu/clash-nyanpasu,36.53 MB
533,gemini-voyager,12865,389,12865,73,04/10/2025,19/03/2026,42.96 MB,"An all-in-one enhancement suite for Google Gemini & AI Studio - timeline navigation, folder management, prompt library, and chat export in one powerful extension. / Google Gemini & AI Studio 全能增强插件：集成时间轴导航、文件夹管理、提示词库及聊天导出等众多功能。",TypeScript,https://github.com/Nagi-ovo/gemini-voyager,42.96 MB
534,element-web,12859,2509,12859,3651,22/07/2015,19/03/2026,466.46 MB,A glossy Matrix collaboration client for the web.,TypeScript,https://github.com/element-hq/element-web,466.46 MB
535,playground,12824,2699,12824,142,04/04/2016,11/03/2026,1.44 MB,Play with neural networks!,TypeScript,https://github.com/tensorflow/playground,1.44 MB
536,json-render,12814,688,12814,69,14/01/2026,19/03/2026,4.20 MB,The Generative UI framework,TypeScript,https://github.com/vercel-labs/json-render,4.20 MB
537,browserless,12786,985,12786,43,17/11/2017,19/03/2026,100.87 MB,Deploy headless browsers in Docker. Run on our cloud or bring your own. Free for non-commercial uses.,TypeScript,https://github.com/browserless/browserless,100.87 MB
538,Next-js-Boilerplate,12764,2365,12764,6,22/07/2020,19/03/2026,42.43 MB,"🚀🎉📚 Nextjs Boilerplate and Starter with App Router and Page Router support, Tailwind CSS 4 and TypeScript ⚡️ Made with developer experience first: Next.js 16 + TypeScript + ESLint + Prettier + Drizzle ORM + Husky + Lint-Staged + Vitest + Testing Library + Playwright + Storybook + Commitlint + VSCode + Sentry + PostCSS + Tailwind CSS ✨",TypeScript,https://github.com/ixartz/Next-js-Boilerplate,42.43 MB
539,juice-shop,12719,16918,12719,13,19/09/2014,19/03/2026,270.49 MB,OWASP Juice Shop: Probably the most modern and sophisticated insecure web application,TypeScript,https://github.com/juice-shop/juice-shop,270.49 MB
540,aws-cdk,12694,4444,12694,2642,04/10/2017,19/03/2026,1.45 GB,The AWS Cloud Development Kit is a framework for defining cloud infrastructure in code,TypeScript,https://github.com/aws/aws-cdk,1.45 GB
541,Zettlr,12693,781,12693,545,26/12/2017,19/03/2026,145.41 MB,Your One-Stop Publication Workbench,TypeScript,https://github.com/Zettlr/Zettlr,145.41 MB
542,formily,12656,1599,12656,138,09/01/2019,21/06/2025,28.23 MB,📱🚀 🧩 Cross Device & High Performance Normal Form/Dynamic(JSON Schema) Form/Form Builder -- Support React/React Native/Vue 2/Vue 3,TypeScript,https://github.com/alibaba/formily,28.23 MB
543,tui.calendar,12637,1353,12637,208,11/09/2017,24/06/2024,77.07 MB,🍞📅A JavaScript calendar that has everything you need.,TypeScript,https://github.com/nhn/tui.calendar,77.07 MB
544,wp-calypso,12629,2004,12629,3342,10/11/2015,20/03/2026,953.38 MB,The JavaScript and API powered WordPress.com,TypeScript,https://github.com/Automattic/wp-calypso,953.38 MB
545,turbolinks,12625,612,12625,99,01/02/2016,11/08/2021,596.00 KB,Turbolinks makes navigating your web application faster,TypeScript,https://github.com/turbolinks/turbolinks,596.00 KB
546,univer,12604,1128,12604,178,29/09/2022,19/03/2026,102.87 MB,"Build AI-native spreadsheets. Univer is a full-stack framework for creating and editing spreadsheets on both web and server. With Univer Platform, Univer Spreadsheets is driven directly through natural language.",TypeScript,https://github.com/dream-num/univer,102.87 MB
547,comlink,12599,421,12599,117,06/09/2017,26/02/2026,2.10 MB,Comlink makes WebWorkers enjoyable.,TypeScript,https://github.com/GoogleChromeLabs/comlink,2.10 MB
548,markmap,12559,947,12559,59,13/01/2020,12/06/2025,1.72 MB,Build mindmaps with plain text,TypeScript,https://github.com/markmap/markmap,1.72 MB
549,pragmatic-drag-and-drop,12540,323,12540,100,04/02/2024,19/03/2026,10.04 MB,Fast drag and drop for any experience on any tech stack,TypeScript,https://github.com/atlassian/pragmatic-drag-and-drop,10.04 MB
550,G2,12528,1672,12528,180,26/05/2016,17/03/2026,346.36 MB,📊 The concise and progressive visualization grammar.,TypeScript,https://github.com/antvis/G2,346.36 MB
551,react-icons,12525,806,12525,237,23/10/2015,18/03/2026,341.29 MB,svg react icons of popular icon packs,TypeScript,https://github.com/react-icons/react-icons,341.29 MB
552,documenso,12516,2417,12516,200,12/03/2023,20/03/2026,242.13 MB,The Open Source DocuSign Alternative.,TypeScript,https://github.com/documenso/documenso,242.13 MB
553,clients,12502,1702,12502,1083,09/03/2016,20/03/2026,1.19 GB,"Bitwarden client apps (web, browser extension, desktop, and cli).",TypeScript,https://github.com/bitwarden/clients,1.19 GB
554,nanobrowser,12483,1303,12483,51,31/12/2024,24/11/2025,1.12 MB,Open-Source Chrome extension for AI-powered web automation. Run multi-agent workflows using your own LLM API key. Alternative to OpenAI Operator.,TypeScript,https://github.com/nanobrowser/nanobrowser,1.12 MB
555,highcharts,12422,3852,12422,650,11/06/2010,20/03/2026,403.96 MB,"Highcharts JS, the JavaScript charting framework",TypeScript,https://github.com/highcharts/highcharts,403.96 MB
556,snabbdom,12379,1115,12379,83,09/05/2015,23/10/2025,4.85 MB,"A virtual DOM library with focus on simplicity, modularity, powerful features and performance.",TypeScript,https://github.com/snabbdom/snabbdom,4.85 MB
557,cmdk,12376,361,12376,67,15/07/2022,29/10/2025,798.00 KB,"Fast, unstyled command menu React component.",TypeScript,https://github.com/dip/cmdk,798.00 KB
558,primeng,12369,5014,12369,1224,16/01/2016,19/03/2026,296.86 MB,The Most Complete Angular UI Component Library,TypeScript,https://github.com/primefaces/primeng,296.86 MB
559,puck,12365,865,12365,201,02/06/2023,19/03/2026,6.71 MB,Create your own AI page builder,TypeScript,https://github.com/puckeditor/puck,6.71 MB
560,illa-builder,12360,1206,12360,42,18/04/2022,22/02/2026,52.49 MB,"Low-code platform allows you to build business apps, enables you to quickly create internal tools such as dashboard, crud app, admin panel, crm, cms, etc. Supports PostgreSQL, MySQL, Supabase, GraphQL, MongoDB, MSSQL, Rest API, Hugging Face, Redis, etc. Automate workflows with schedule or webhook. Open source Retool. ",TypeScript,https://github.com/illacloud/illa-builder,52.49 MB
561,noodle,12306,790,12306,15,19/05/2022,17/10/2024,14.07 MB,Rethinking Student Productivity,TypeScript,https://github.com/noodle-run/noodle,14.07 MB
562,boardgame.io,12299,815,12299,122,21/11/2017,18/04/2025,13.79 MB,State Management and Multiplayer Networking for Turn-Based Games,TypeScript,https://github.com/boardgameio/boardgame.io,13.79 MB
563,mi-gpt,12291,1665,12291,6,24/01/2024,10/09/2025,32.61 MB,🏠 将小爱音箱接入 ChatGPT 和豆包，改造成你的专属语音助手。,TypeScript,https://github.com/idootop/mi-gpt,32.61 MB
564,linaria,12290,414,12290,145,23/05/2017,07/02/2026,32.72 MB,Zero-runtime CSS in JS library,TypeScript,https://github.com/callstack/linaria,32.72 MB
565,react-native-firebase,12265,2320,12265,91,01/02/2017,19/03/2026,105.76 MB,🔥 A well-tested feature-rich modular Firebase implementation for React Native. Supports both iOS & Android platforms for all Firebase services.,TypeScript,https://github.com/invertase/react-native-firebase,105.76 MB
566,midscene,12250,906,12250,86,23/07/2024,19/03/2026,425.70 MB,"AI-powered, vision-driven UI automation for every platform.",TypeScript,https://github.com/web-infra-dev/midscene,425.70 MB
567,theatre,12243,431,12243,139,23/12/2013,14/08/2024,26.99 MB,Motion design editor for the web,TypeScript,https://github.com/theatre-js/theatre,26.99 MB
568,mapbox-gl-js,12191,2335,12191,1439,07/03/2013,19/03/2026,626.65 MB,"Interactive, thoroughly customizable maps in the browser, powered by vector tiles and WebGL",TypeScript,https://github.com/mapbox/mapbox-gl-js,626.65 MB
569,zerox,12188,833,12188,85,21/07/2024,20/05/2025,168.00 MB,OCR & Document Extraction using vision models,TypeScript,https://github.com/getomni-ai/zerox,168.00 MB
570,sonner,12109,413,12109,70,23/02/2023,23/12/2025,1.20 MB,An opinionated toast component for React.,TypeScript,https://github.com/emilkowalski/sonner,1.20 MB
571,google-api-nodejs-client,12109,2014,12109,208,06/03/2013,03/03/2026,581.23 MB,"Google's officially supported Node.js client library for accessing Google APIs. Support for authorization and authentication with OAuth 2.0, API Keys and JWT (Service Tokens) is included. ",TypeScript,https://github.com/googleapis/google-api-nodejs-client,581.23 MB
572,mean,12084,3394,12084,96,22/05/2013,17/02/2026,10.32 MB,"The MEAN stack uses Mongo, Express, Angular(6) and Node for simple and scalable fullstack js applications",TypeScript,https://github.com/linnovate/mean,10.32 MB
573,InversifyJS,12068,718,12068,2,07/04/2015,19/11/2025,3.39 MB,Powerful and lightweight inversion of control container. Moved to https://github.com/inversify/monorepo,TypeScript,https://github.com/inversify/InversifyJS,3.39 MB
574,G6,12011,1603,12011,331,13/02/2017,19/03/2026,80.60 MB,♾ A Graph Visualization Framework in JavaScript.,TypeScript,https://github.com/antvis/G6,80.60 MB
575,openwork,12005,1087,12005,86,14/01/2026,20/03/2026,375.31 MB,"An open-source alternative to Claude Cowork built for teams, powered by opencode",TypeScript,https://github.com/different-ai/openwork,375.31 MB
576,formbricks,11987,2143,11987,236,06/06/2022,19/03/2026,278.41 MB,Open Source Qualtrics Alternative,TypeScript,https://github.com/formbricks/formbricks,278.41 MB
577,aliyunpan,11974,1114,11974,344,22/04/2021,24/10/2022,11.66 MB,阿里云盘小白羊版  阿里云盘PC版 aliyundriver,TypeScript,https://github.com/liupan1890/aliyunpan,11.66 MB
578,ant-design-mobile,11969,2494,11969,300,30/11/2015,17/03/2026,166.05 MB,Essential UI blocks for building mobile web apps.,TypeScript,https://github.com/ant-design/ant-design-mobile,166.05 MB
579,chokidar,11967,611,11967,35,20/04/2012,11/12/2025,2.01 MB,Minimal and efficient cross-platform file watching library,TypeScript,https://github.com/paulmillr/chokidar,2.01 MB
580,sigma.js,11939,1619,11939,35,11/03/2012,17/03/2026,35.30 MB,A JavaScript library aimed at visualizing graphs of thousands of nodes and edges,TypeScript,https://github.com/jacomyal/sigma.js,35.30 MB
581,rete,11939,745,11939,6,28/02/2017,21/11/2025,1.89 MB,JavaScript framework for visual programming,TypeScript,https://github.com/retejs/rete,1.89 MB
582,LaTeX-Workshop,11929,573,11929,4,26/12/2016,19/03/2026,46.77 MB,"Boost LaTeX typesetting efficiency with preview, compile, autocomplete, colorize, and more.",TypeScript,https://github.com/James-Yu/LaTeX-Workshop,46.77 MB
583,typescript-sdk,11897,1691,11897,374,24/09/2024,19/03/2026,6.69 MB,The official TypeScript SDK for Model Context Protocol servers and clients,TypeScript,https://github.com/modelcontextprotocol/typescript-sdk,6.69 MB
584,signature_pad,11883,2188,11883,7,15/03/2013,20/03/2026,5.32 MB,HTML5 canvas based smooth signature drawing,TypeScript,https://github.com/szimek/signature_pad,5.32 MB
585,tsx,11868,221,11868,133,15/03/2022,13/02/2026,2.28 MB,⚡️ TypeScript Execute | The easiest way to run TypeScript in Node.js,TypeScript,https://github.com/privatenumber/tsx,2.28 MB
586,openreplay,11866,707,11866,164,29/04/2021,20/03/2026,205.25 MB,"Session replay, cobrowsing and product analytics you can self-host. Best for reproducing issues and iterating on your product.",TypeScript,https://github.com/openreplay/openreplay,205.25 MB
587,rybbit,11861,629,11861,152,14/01/2025,19/03/2026,262.53 MB,🐸 Rybbit - open-source and privacy-friendly alternative to Google Analytics that is 10x more intuitive.,TypeScript,https://github.com/rybbit-io/rybbit,262.53 MB
588,mitt,11848,483,11848,25,15/01/2017,14/08/2024,217.00 KB,🥊 Tiny 200 byte functional event emitter / pubsub.,TypeScript,https://github.com/developit/mitt,217.00 KB
589,Termix,11834,474,11834,7,25/11/2024,15/03/2026,39.05 MB,"Termix is a web-based server management platform with SSH terminal, tunneling, and file editing capabilities.",TypeScript,https://github.com/Termix-SSH/Termix,39.05 MB
590,page-agent,11827,900,11827,50,23/09/2025,19/03/2026,2.07 MB,JavaScript in-page GUI agent. Control web interfaces with natural language.,TypeScript,https://github.com/alibaba/page-agent,2.07 MB
591,ui,11767,4850,11767,18,19/09/2016,14/03/2026,59.27 MB,"Open-source components, blocks, and AI agents designed to speed up your workflow. Import them seamlessly into your favorite tools through Registry and MCPs.",TypeScript,https://github.com/creativetimofficial/ui,59.27 MB
592,class-validator,11744,843,11744,307,03/10/2015,19/03/2026,5.29 MB,Decorator-based property validation for classes.,TypeScript,https://github.com/typestack/class-validator,5.29 MB
593,logto,11726,740,11726,209,19/06/2021,20/03/2026,104.71 MB,"🧑‍🚀 Authentication and authorization infrastructure for SaaS and AI apps, built on OIDC and OAuth 2.1 with multi-tenancy, SSO, and RBAC.",TypeScript,https://github.com/logto-io/logto,104.71 MB
594,ccusage,11721,429,11721,135,29/05/2025,19/03/2026,9.32 MB,A CLI tool for analyzing Claude Code/Codex CLI usage from local JSONL files.,TypeScript,https://github.com/ryoppippi/ccusage,9.32 MB
595,AiToEarn,11715,2538,11715,64,24/02/2025,18/03/2026,331.45 MB,Let's use AI to Earn!,TypeScript,https://github.com/yikart/AiToEarn,331.45 MB
596,framework,11692,613,11692,60,10/12/2014,27/01/2023,3.18 MB,"The Aurelia 1 framework entry point, bringing together all the required sub-modules of Aurelia.",TypeScript,https://github.com/aurelia/framework,3.18 MB
597,kepler.gl,11661,1925,11661,612,28/02/2018,16/03/2026,44.31 MB,Kepler.gl is a powerful open source geospatial analysis tool for large-scale data sets.,TypeScript,https://github.com/keplergl/kepler.gl,44.31 MB
598,botkit,11580,2261,11580,45,11/12/2015,01/07/2024,11.79 MB,"Botkit is an open source developer tool for building chat bots, apps and custom integrations for major messaging platforms.",TypeScript,https://github.com/howdyai/botkit,11.79 MB
599,changesets,11568,767,11568,472,21/03/2019,16/03/2026,6.15 MB,🦋       A way to manage your versioning and changelogs with a focus on monorepos,TypeScript,https://github.com/changesets/changesets,6.15 MB
600,scira,11542,1455,11542,20,07/08/2024,18/03/2026,18.90 MB,Scira (Formerly MiniPerplx) is a minimalistic AI-powered search engine that helps you find information on the internet and cites it too. Powered by Vercel AI SDK!,TypeScript,https://github.com/zaidmukaddam/scira,18.90 MB
