Ranking,Project Name,Stars,Forks,Watchers,Open Issues,Created At,Last Commit,Size,Size (KB),Description,Language,Repo URL
617,vimrc,320,114,320,0,26/08/2011,29/09/2022,4.83 MB,4946,Opinionated VIM Configuration,Vim Script,https://github.com/tlhunter/vimrc
618,jupytext.vim,319,26,319,11,01/01/2019,19/12/2024,29.00 KB,29,Vim plugin for editing Jupyter ipynb files via jupytext,Vim Script,https://github.com/goerz/jupytext.vim
619,vim-monochrome,318,59,318,2,31/12/2013,01/02/2022,5.38 MB,5504,Monochrome color scheme for Vim,Vim script,https://github.com/fxn/vim-monochrome
620,vim-vividchalk,317,162,317,5,13/12/2009,13/11/2019,6.00 KB,6,vividchalk.vim: a colorscheme strangely reminiscent of Vibrant Ink for a certain OS X editor,Vim script,https://github.com/tpope/vim-vividchalk
621,gen_tags.vim,317,43,317,3,20/11/2013,06/03/2023,181.00 KB,181,Async plugin for vim and neovim to ease the use of ctags/gtags,Vim Script,https://github.com/jsfaint/gen_tags.vim
622,leetcode.vim,315,42,315,31,03/09/2018,07/03/2024,843.00 KB,843,Solve LeetCode problems in Vim!,Vim script,https://github.com/ianding1/leetcode.vim
623,dotfiles,314,110,314,2,22/01/2014,21/08/2025,1.50 MB,1531,Cross-platform dotfiles shared by macOS and Linux (native and WSL2),Vim Script,https://github.com/fatso83/dotfiles
624,xptemplate,314,41,314,18,03/09/2010,08/09/2022,4.92 MB,5039,"Code snippets engine for Vim, with snippets library.  XPTemplate let you write codes in a smooth, quick and comfortable way.",Vim Script,https://github.com/drmingdrmer/xptemplate
625,vim-swap,313,4,313,4,26/01/2016,26/08/2023,309.00 KB,309,Reorder delimited items.,Vim script,https://github.com/machakann/vim-swap
626,anderson.vim,312,24,312,2,02/09/2015,15/03/2020,21.00 KB,21,Dark vim colorscheme based on colors from Wes Anderson films,Vim script,https://github.com/tlhr/anderson.vim
627,minimalist,311,26,311,0,02/12/2016,16/03/2024,52.00 KB,52,A Material Color Scheme Darker for Vim.,Vim Script,https://github.com/dikiaap/minimalist
628,MatchTag,310,31,310,14,22/11/2011,14/04/2020,15.00 KB,15,Vim's MatchParen for HTML tags,Vim script,https://github.com/gregsexton/MatchTag
629,vim-deep-space,309,23,309,4,23/06/2016,25/10/2019,1.13 MB,1162,An intergalactically friendly color scheme for Vim.,Vim script,https://github.com/tyrannicaltoucan/vim-deep-space
630,eleline.vim,309,77,309,2,16/03/2017,05/12/2023,84.00 KB,84,:herb: Another elegant statusline for vim,Vim Script,https://github.com/liuchengxu/eleline.vim
631,colorschemes,309,30,309,29,03/05/2020,23/08/2025,1.86 MB,1909,colorschemes for Vim,Vim Script,https://github.com/vim/colorschemes
632,DrawIt,309,44,309,4,18/10/2010,24/08/2017,218.00 KB,218,"Ascii drawing plugin: lines, ellipses, arrows, fills, and more!",VimL,https://github.com/vim-scripts/DrawIt
633,dianping,308,31,308,0,09/10/2023,10/03/2025,1.85 MB,1894,黑马点评项目优化，新增消息队列RabbitMQ，令牌桶限流实现优惠券秒杀，用户登录限流(redis实现滑动窗口)等功能,Vim Script,https://github.com/haopengmai/dianping
634,neovim-rust,308,27,308,0,21/09/2020,29/11/2022,64.00 KB,64,Sample neovim and vim configurations for Rust development,Vim Script,https://github.com/sharksforarms/neovim-rust
635,vim-subversive,308,3,308,11,26/12/2018,02/01/2024,124.00 KB,124,Vim plugin providing operator motions to quickly replace text,Vim Script,https://github.com/svermeulen/vim-subversive
636,vim-jsx-typescript,308,29,308,14,16/02/2017,26/01/2021,7.44 MB,7618,React JSX syntax highlighting for vim and Typescript,Vim script,https://github.com/peitalin/vim-jsx-typescript
637,vim,308,19,308,0,29/04/2022,11/08/2025,393.00 KB,393,🧋 Soothing pastel theme for Vim,Vim Script,https://github.com/catppuccin/vim
638,FlyGrep.vim,308,33,308,0,13/07/2017,16/02/2025,339.00 KB,339,Asynchronously fly grep in vim,Vim Script,https://github.com/wsdjeg/FlyGrep.vim
639,vimrc.js,307,15,307,4,31/08/2016,21/09/2022,45.00 KB,45,A vimrc that Just Works™ for modern JavaScript development,Vim Script,https://github.com/sloanelybutsurely/vimrc.js
640,presenting.vim,305,49,305,15,05/07/2013,30/12/2023,793.00 KB,793,A simple tool for presenting slides in vim based on text files.,Vim Script,https://github.com/sotte/presenting.vim
641,vim-styled-components,305,24,305,9,03/12/2016,18/03/2021,126.00 KB,126,Vim bundle for http://styled-components.com based javascript files.,Vim script,https://github.com/styled-components/vim-styled-components
642,Comrade,305,26,305,22,29/01/2019,25/02/2023,81.00 KB,81,Brings JetBrains/IntelliJ IDEs magic to Neovim with minimal setup.,Vim script,https://github.com/beeender/Comrade
643,aquarium-vim,305,16,305,6,04/10/2021,27/11/2024,4.48 MB,4591,"🌊 Aquarium, a simple vibrant dark theme for vim 🗒",Vim Script,https://github.com/FrenzyExists/aquarium-vim
644,nvcode-color-schemes.vim,305,66,305,25,29/10/2020,08/07/2024,1.03 MB,1059,A bunch of generated colorschemes (treesitter supported),Vim script,https://github.com/ChristianChiarulli/nvcode-color-schemes.vim
645,vim-bufkill,304,22,304,7,10/05/2015,19/04/2022,29.00 KB,29,Git repo for http://www.vim.org/scripts/script.php?script_id=1147,Vim script,https://github.com/qpkorr/vim-bufkill
646,file-line,303,61,303,29,26/01/2011,15/11/2022,26.00 KB,26,Plugin for vim to enabling opening a file in a given line,Vim Script,https://github.com/bogado/file-line
647,investigate.vim,301,18,301,3,14/11/2013,26/02/2024,1.13 MB,1159,A Vim plugin for looking up documentation,Vim Script,https://github.com/keith/investigate.vim
648,vim-argwrap,301,15,301,10,28/11/2014,26/12/2023,157.00 KB,157," Wrap and unwrap function arguments, lists, and dictionaries in Vim",Vim Script,https://github.com/FooSoft/vim-argwrap
649,dotfiles,300,21,300,0,12/08/2011,17/07/2013,2.87 MB,2939,"A git mirror of my dotfiles (.vimrc, .zshrc, .hgrc, etc).  Note: this won't work on its own because the real repo uses Mercurial's subrepos.  Look at .hgsub and .hgsubstate for what you'll need to get.",VimL,https://github.com/sjl/dotfiles
650,vim-plugin,300,54,300,1,17/03/2017,25/10/2021,15.21 MB,15580,The Kite plugin for Vim.,Vim script,https://github.com/kiteco/vim-plugin
651,vim-characterize,299,21,299,1,23/01/2013,14/11/2024,380.00 KB,380,characterize.vim: Unicode character metadata,Vim Script,https://github.com/tpope/vim-characterize
652,vim-mergetool,299,12,299,17,09/03/2019,07/09/2020,7.22 MB,7389,:cake: Efficient way of using Vim as a Git mergetool,Vim script,https://github.com/samoshkin/vim-mergetool
653,vim-nix,298,26,298,11,26/04/2015,01/02/2025,114.00 KB,114,Vim configuration files for Nix http://nixos.org/nix,Vim Script,https://github.com/LnL7/vim-nix
654,vim-tmux-runner,297,38,297,37,24/11/2012,30/11/2024,84.00 KB,84,"Vim and tmux, sittin' in a tree...",Vim Script,https://github.com/christoomey/vim-tmux-runner
655,Sierra,297,21,297,5,10/02/2016,26/08/2023,175.00 KB,175,A Vim Colorscheme,Vim script,https://github.com/AlessandroYorba/Sierra
656,vim-tmux-clipboard,296,24,296,9,29/07/2016,23/07/2023,15.00 KB,15,seamless integration for vim and tmux's clipboard,Vim Script,https://github.com/roxma/vim-tmux-clipboard
657,vim.reaper,296,11,296,6,07/10/2019,24/01/2023,250.00 KB,250,"💀 A Hackable, Fully Featured, Rice Friendly Neovim Configuration",Vim script,https://github.com/GideonWolfe/vim.reaper
658,toothpaste,296,33,296,16,30/01/2016,08/07/2020,5.30 MB,5426,Toothpaste is a custom theme for your text editor with flavorful colors,Vim script,https://github.com/toothpaste-theme/toothpaste
659,dotfiles,295,15,295,0,08/06/2022,21/03/2023,27.00 KB,27,some of my configs,Vim Script,https://github.com/jdah/dotfiles
660,vim-leader-guide,293,21,293,15,06/09/2015,03/08/2020,258.00 KB,258,,Vim script,https://github.com/hecal3/vim-leader-guide
661,vim-sayonara,292,16,292,7,02/05/2015,03/07/2022,51.00 KB,51,:japanese_goblin: Sane buffer/window deletion.,Vim script,https://github.com/mhinz/vim-sayonara
662,vim-config,292,87,292,13,16/12/2013,23/03/2021,166.00 KB,166,Nice vim config for front-end development,Vim script,https://github.com/L0stSoul/vim-config
663,vim-tomorrow-theme,291,142,291,13,13/11/2011,30/10/2024,41.00 KB,41,Tomorrow Theme for Vim,Vim Script,https://github.com/chriskempson/vim-tomorrow-theme
664,vim-phpqa,290,31,290,12,26/03/2012,10/04/2018,322.00 KB,322,PHP QA tools for Vim,VimL,https://github.com/joonty/vim-phpqa
665,dotfiles,290,22,290,0,25/02/2010,08/11/2018,11.36 MB,11630,My Dotfiles,Vim script,https://github.com/cypher/dotfiles
666,vim-LanguageTool,290,30,290,24,10/08/2013,08/09/2024,45.00 KB,45,A vim plugin for the LanguageTool grammar checker,Vim Script,https://github.com/dpelle/vim-LanguageTool
667,vim-glsl,289,27,289,4,07/07/2012,15/06/2024,58.00 KB,58,Vim runtime files for OpenGL Shading Language,Vim Script,https://github.com/tikhomirov/vim-glsl
668,FixCursorHold.nvim,288,9,288,1,13/07/2020,13/02/2023,13.00 KB,13,Fix CursorHold Performance.,Vim Script,https://github.com/antoinemadec/FixCursorHold.nvim
669,vim-unstack,288,15,288,7,03/02/2013,02/02/2021,69.00 KB,69,Vim plugin for parsing stack traces and opening the files,Vim script,https://github.com/mattboehm/vim-unstack
670,rust.vim,286,17,286,0,20/01/2013,09/05/2016,136.00 KB,136,Vim support for Rust file detection and syntax highlighting.,VimL,https://github.com/wting/rust.vim
671,async.vim,286,20,286,5,20/03/2016,01/11/2022,59.00 KB,59,normalize async job control api for vim and neovim,Vim script,https://github.com/prabirshrestha/async.vim
672,dotvim,286,50,286,0,26/08/2011,23/08/2025,26.18 MB,26808,My vim config,Vim Script,https://github.com/lilydjwg/dotvim
673,vaffle.vim,285,21,285,10,30/12/2016,09/11/2020,127.00 KB,127,":file_folder: Lightweight, window-based file manager for Vim",Vim script,https://github.com/cocopon/vaffle.vim
674,vim-frontend,284,25,284,1,21/07/2016,26/07/2018,43.00 KB,43,:star: Vim Frontend is a Vim configured for Front-end Developers. ,Vim script,https://github.com/victorvoid/vim-frontend
675,vim-cute-python,284,30,284,0,19/10/2010,18/06/2021,22.00 KB,22,Unicode goodness for Python code using vim's “conceal” feature,Vim script,https://github.com/ehamberg/vim-cute-python
676,vim-twiggy,283,17,283,14,11/10/2014,10/01/2022,127.00 KB,127,Git branch management for Vim,Vim script,https://github.com/sodapopcan/vim-twiggy
677,vim-auto-popmenu,283,39,283,10,04/03/2020,05/08/2023,417.00 KB,417, :sunglasses: Display the Completion Menu Automantically (next AutoComplPop) !! ,Vim Script,https://github.com/skywind3000/vim-auto-popmenu
678,vim-rtags,283,55,283,35,03/03/2014,14/12/2019,180.00 KB,180,"Vim bindings for rtags, llvm/clang based c++ code indexer.",Vim script,https://github.com/lyuts/vim-rtags
679,vim-jsx-improve,282,23,282,3,06/12/2016,28/02/2022,87.00 KB,87,Syntax and indent plugin for React jsx.,Vim script,https://github.com/neoclide/vim-jsx-improve
680,startuptime.vim,282,4,282,6,03/03/2017,10/12/2022,14.00 KB,14,Breakdown Vim's --startuptime output,Vim script,https://github.com/tweekmonster/startuptime.vim
681,spaceline.vim,281,23,281,8,02/07/2019,04/08/2021,240.00 KB,240,vim statusline like spacemacs,Vim script,https://github.com/nvimdev/spaceline.vim
682,vim-hemisu,280,33,280,2,20/11/2011,05/09/2013,96.00 KB,96,A Vim color scheme with dark and light variants,VimL,https://github.com/noahfrederick/vim-hemisu
683,vim-stylus,279,37,279,6,15/03/2011,03/02/2023,56.00 KB,56,Syntax Highlighting for Stylus,Vim Script,https://github.com/wavded/vim-stylus
684,vim-merginal,279,21,279,6,28/05/2014,14/10/2024,173.00 KB,173,Fugitive extension to manage and merge Git branches,Vim Script,https://github.com/idanarye/vim-merginal
685,vim-autopep8,279,52,279,11,07/06/2013,14/12/2021,41.00 KB,41,autopep8 plugin for Vim,Vim script,https://github.com/tell-k/vim-autopep8
686,gutentags_plus,278,50,278,29,21/05/2018,13/10/2023,124.00 KB,124,The right way to use gtags with gutentags,Vim Script,https://github.com/skywind3000/gutentags_plus
687,vim-monster,277,9,277,4,04/08/2014,17/03/2018,70.00 KB,70,Ruby code completion.,Vim script,https://github.com/osyo-manga/vim-monster
688,quickmenu.vim,277,12,277,7,11/07/2017,12/09/2024,28.00 KB,28,A nice customizable popup menu for vim,Vim Script,https://github.com/skywind3000/quickmenu.vim
689,elm.vim,277,25,277,6,16/03/2013,24/09/2017,142.00 KB,142,Vim plugin for the Elm programming language,VimL,https://github.com/lambdatoast/elm.vim
690,msfs2020-google-map,277,38,277,15,07/08/2021,21/04/2024,74.38 MB,76170,Replace MSFS2020's bing map to google map,Vim script,https://github.com/derekhe/msfs2020-google-map
691,vim-fibo-indent,277,9,277,2,28/08/2018,04/09/2018,65.00 KB,65,Fibonacci Indentation for Vim.,Vim script,https://github.com/dodie/vim-fibo-indent
692,pgsql.vim,276,12,276,0,10/01/2016,08/12/2021,1.38 MB,1413,The best PostgreSQL plugin for Vim!,Vim script,https://github.com/lifepillar/pgsql.vim
693,vim-crystalline,276,10,276,0,17/05/2019,16/04/2025,261.00 KB,261,Build your own fancy statusline/tabline in Vim/Neovim,Vim Script,https://github.com/rbong/vim-crystalline
694,vim-anyfold,275,12,275,13,24/08/2016,20/01/2022,99.00 KB,99,Language agnostic vim plugin for folding and motion based on indentation.,Vim script,https://github.com/pseewald/vim-anyfold
695,plantuml-previewer.vim,274,30,274,19,03/09/2017,28/10/2024,38.21 MB,39123,Vim / Neovim plugin for preview PlantUML,Vim Script,https://github.com/weirongxu/plantuml-previewer.vim
696,fugitive-gitlab.vim,274,23,274,4,01/08/2014,13/11/2024,130.00 KB,130,A vim extension to fugitive.vim for GitLab support,Vim Script,https://github.com/shumphrey/fugitive-gitlab.vim
697,vim-rubocop,274,44,274,16,11/04/2013,01/11/2023,222.00 KB,222,The Vim RuboCop plugin runs RuboCop and displays the results in Vim,VimL,https://github.com/ngmy/vim-rubocop
698,pytest.vim,274,39,274,6,28/01/2011,22/07/2024,478.00 KB,478,Runs your UnitTests with py.test displaying red/green bars and errors,Vim Script,https://github.com/alfredodeza/pytest.vim
699,vim-cmake,274,22,274,7,09/05/2020,03/08/2024,204.00 KB,204,Vim/Neovim plugin for working with CMake projects,Vim Script,https://github.com/cdelledonne/vim-cmake
700,vim-conflicted,273,12,273,7,12/01/2014,19/04/2025,1.11 MB,1134,Easy git merge conflict resolution in Vim,Vim Script,https://github.com/christoomey/vim-conflicted
701,dotfiles,273,55,273,3,03/02/2010,20/01/2017,4.29 MB,4392,My config files,VimL,https://github.com/shawncplus/dotfiles
702,vim-arpeggio,273,19,273,15,28/03/2010,20/08/2020,77.00 KB,77,Vim plugin: Mappings for simultaneously pressed keys,Vim script,https://github.com/kana/vim-arpeggio
703,vim-tidal,272,57,272,29,13/07/2014,22/06/2024,110.00 KB,110,Vim plugin for TidalCycles,Vim Script,https://github.com/tidalcycles/vim-tidal
704,AutoComplPop,272,94,272,5,19/10/2010,24/08/2021,355.00 KB,355,Automatically opens popup menu for completions,VimL,https://github.com/vim-scripts/AutoComplPop
705,smartim,272,35,272,14,22/08/2012,04/02/2024,24.00 KB,24,A Vim plugin to make it stand well with input methods (Mac only),Vim Script,https://github.com/ybian/smartim
706,dotfiles,270,36,270,0,07/10/2008,09/07/2013,957.00 KB,957,twerth,VimL,https://github.com/twerth/dotfiles
707,vim-colorscheme-primary,270,30,270,1,22/04/2015,18/11/2022,58.00 KB,58,"Primary, a Vim color scheme based on Google's colors",Vim Script,https://github.com/google/vim-colorscheme-primary
708,automatic-verilog,269,78,269,21,11/01/2021,24/10/2023,16.59 MB,16985,automatic-verilog based on vimscript,Vim Script,https://github.com/HonkW93/automatic-verilog
709,dotfiles,269,126,269,11,15/12/2011,05/03/2020,274.00 KB,274,My dotfiles,VimL,https://github.com/michaeljsmalley/dotfiles
710,vim-lexical,267,8,267,10,01/01/2014,11/02/2022,25.00 KB,25,Build on Vim’s spell/thes/dict completion,Vim script,https://github.com/preservim/vim-lexical
711,vim-railscasts-theme,267,119,267,1,11/10/2008,07/06/2016,1.34 MB,1373,A vim color scheme based on the Railscasts Textmate theme.,VimL,https://github.com/jpo/vim-railscasts-theme
712,vim-chatgpt,266,34,266,7,30/03/2023,20/08/2025,83.00 KB,83,Vim Plugin For ChatGPT,Vim Script,https://github.com/CoderCookE/vim-chatgpt
713,golf,266,5,266,9,12/04/2025,27/04/2025,91.00 KB,91,,Vim Script,https://github.com/vuciv/golf
714,mru,264,50,264,9,01/09/2013,29/12/2024,211.00 KB,211,Most Recently Used (MRU) Vim Plugin,Vim Script,https://github.com/yegappan/mru
715,vim-colors-paramount,263,47,263,2,15/05/2016,09/01/2019,2.33 MB,2382,A minimal colorscheme for Vim that only puts emphasis on the paramount.,Vim script,https://github.com/owickstrom/vim-colors-paramount
716,vim-dim,263,35,263,10,15/06/2016,29/01/2021,19.00 KB,19,"Dim (/dɪm/; a contraction of Default IMproved) is a clone of Vim’s default colorscheme, with some improvements.",Vim script,https://github.com/jeffkreeftmeijer/vim-dim
717,vimfiles,263,53,263,0,28/11/2011,17/04/2019,152.00 KB,152,"vim configuration – Ruby, Rails, Markdown, SCSS, CoffeeScript",Vim script,https://github.com/mislav/vimfiles
718,CompleteParameter.vim,262,27,262,13,07/06/2017,16/12/2021,246.00 KB,246,"Complete parameter after select the completion. Integration with YouCompleteMe(ycm), deoplete, neocomplete. ",Vim script,https://github.com/tenfyzhong/CompleteParameter.vim
719,oeasy-vim-tutorial,261,43,261,2,23/07/2021,09/06/2023,1.30 MB,1331,这是oeasy制作的的一套关于vim的教程 可以做实验 本教程从0基础开始，到精通vim配置，和高级命令。希望能让vim是你的开发更高效。,Vim Script,https://github.com/overmind1980/oeasy-vim-tutorial
720,vim-rainbow,260,30,260,7,13/01/2019,13/01/2019,19.00 KB,19,Rainbow brackets for Vim,Vim script,https://github.com/frazrepo/vim-rainbow
721,calendar-vim,260,44,260,11,18/06/2009,09/02/2023,102.00 KB,102,calendar vimscript,Vim script,https://github.com/mattn/calendar-vim
722,taboo.vim,259,35,259,0,09/07/2014,17/10/2024,50.00 KB,50,Few utilities for pretty tabs,Vim Script,https://github.com/gcmt/taboo.vim
723,vim-prosession,259,23,259,1,12/05/2014,22/08/2025,107.00 KB,107,Handle vim sessions like a pro,Vim Script,https://github.com/dhruvasagar/vim-prosession
724,vim-sort-motion,259,9,259,3,28/05/2014,07/03/2021,11.00 KB,11,Vim mapping for sorting a range of text,Vim script,https://github.com/christoomey/vim-sort-motion
725,vim-journal,259,9,259,2,19/04/2015,13/07/2017,32.00 KB,32,:memo:,Vim script,https://github.com/junegunn/vim-journal
726,FuzzyFinder,259,49,259,2,19/10/2010,12/11/2021,450.00 KB,450,buffer/file/command/tag/etc explorer with fuzzy matching,VimL,https://github.com/vim-scripts/FuzzyFinder
727,lusty,258,30,258,17,15/09/2008,24/07/2018,527.00 KB,527,LustyExplorer / LustyJuggler for Vim,Vim script,https://github.com/sjbach/lusty
728,xmledit,258,41,258,10,03/04/2009,08/12/2020,127.00 KB,127,A filetype plugin for VIM to help edit XML files,Vim script,https://github.com/sukima/xmledit
729,vim-php-namespace,257,28,257,10,02/04/2011,27/04/2022,68.00 KB,68,"PHP namespace support for VIM. Types ""use"" statements for you",Vim script,https://github.com/arnaud-lb/vim-php-namespace
730,vim-material-theme,257,30,257,8,24/06/2015,01/05/2021,14.00 KB,14,Material theme for vim,Vim script,https://github.com/jdkanani/vim-material-theme
731,jshint2.vim,257,18,257,5,27/06/2013,21/09/2021,378.00 KB,378,"Lightweight, customizable and functional Vim plugin for JSHint integration.",Vim script,https://github.com/NikolayFrantsev/jshint2.vim
732,vim-zenroom2,256,21,256,6,29/12/2013,16/08/2020,7.00 KB,7,"A Vim extension that emulates iA Writer environment when editing Markdown, reStructuredText or text files",Vim script,https://github.com/amix/vim-zenroom2
733,vim-ollama,256,28,256,16,09/09/2024,13/08/2025,10.04 MB,10277,Vim plugin for integrating Ollama based LLM (large language models),Vim Script,https://github.com/gergap/vim-ollama
734,vim-highlighter,256,11,256,3,07/05/2021,14/03/2025,297.00 KB,297,Highlight words and expressions,Vim Script,https://github.com/azabiong/vim-highlighter
735,vCoolor.vim,255,11,255,7,01/08/2014,01/11/2020,265.00 KB,265,Simple color selector/picker plugin for Vim.,Vim script,https://github.com/KabbAmine/vCoolor.vim
736,MiniVim,254,19,254,1,25/02/2016,02/08/2019,119.00 KB,119,My way to see Vim.,Vim script,https://github.com/sd65/MiniVim
737,dotfiles,254,12,254,1,25/10/2020,28/04/2024,3.70 MB,3789,Dotfiles or you can say my swiss army knife. Configs for creating a delightful development experience - vim + tmux + Fzf + Rg + LSP etc.,Vim Script,https://github.com/kalkayan/dotfiles
738,is.vim,254,3,254,11,30/10/2017,13/11/2023,12.00 KB,12,incremental search improved - successor of incsearch.vim,Vim script,https://github.com/haya14busa/is.vim
739,vim-markdown-folding,254,43,254,15,16/10/2012,17/07/2024,199.00 KB,199,Fold markdown documents by section.,Vim Script,https://github.com/masukomi/vim-markdown-folding
740,zoxide.vim,254,6,254,2,11/08/2020,23/10/2023,53.00 KB,53,A small (Neo)Vim wrapper for zoxide,Vim Script,https://github.com/nanotee/zoxide.vim
741,vim-syntax-extra,254,42,254,0,27/10/2012,26/04/2020,111.00 KB,111,"Vim syntax highlighting for c, bison, flex",Vim script,https://github.com/justinmk/vim-syntax-extra
742,vimrc-config,253,36,253,0,28/03/2016,19/07/2021,1.91 MB,1960,re-vim: sensible vim configuration,Vim script,https://github.com/ashfinal/vimrc-config
743,vim-cheat40,253,21,253,1,04/06/2016,19/12/2023,28.00 KB,28,"A Vim cheat sheet that makes sense, inside Vim!",Vim Script,https://github.com/lifepillar/vim-cheat40
744,vim-man,253,32,253,23,16/01/2015,07/05/2024,137.00 KB,137,View and grep man pages in vim,Vim script,https://github.com/vim-utils/vim-man
745,Conque-Shell,252,50,252,4,14/11/2010,28/08/2011,296.00 KB,296,Run interactive commands inside a Vim buffer,VimL,https://github.com/vim-scripts/Conque-Shell
746,lightline-ale,252,14,252,2,30/10/2017,12/09/2021,72.00 KB,72,ALE indicator for the lightline vim plugin,Vim script,https://github.com/maximbaz/lightline-ale
747,vim-carbon-now-sh,251,10,251,0,09/02/2018,11/08/2022,16.00 KB,16,Open selected text in https://carbon.now.sh,Vim script,https://github.com/kristijanhusak/vim-carbon-now-sh
748,vim-kolor,251,48,251,1,03/12/2012,04/10/2022,19.00 KB,19,Vim color scheme.,Vim script,https://github.com/zeis/vim-kolor
749,Recover.vim,251,25,251,1,20/04/2010,07/09/2022,265.00 KB,265,"A Plugin to show a diff, whenever recovering a buffer",Vim Script,https://github.com/chrisbra/Recover.vim
750,legolas-vim,251,89,251,0,10/10/2016,18/08/2021,277.00 KB,277,Vim配置，为python、go开发者打造的IDE。,Vim script,https://github.com/TTWShell/legolas-vim
751,vim-terminal-help,251,34,251,23,08/01/2020,07/07/2024,60.00 KB,60,Small changes make vim/nvim's internal terminal great again !!,Vim Script,https://github.com/skywind3000/vim-terminal-help
752,vim-kitty,250,15,250,1,25/02/2021,03/07/2025,70.00 KB,70,Vim syntax highlighting for Kitty terminal config files,Vim Script,https://github.com/fladson/vim-kitty
753,w3m.vim,250,34,250,8,13/03/2012,05/06/2019,252.00 KB,252,w3m plugin for vim,VimL,https://github.com/yuratomo/w3m.vim
754,vim-anzu,250,14,250,5,01/05/2013,05/07/2025,87.00 KB,87,Vim search status.,Vim Script,https://github.com/osyo-manga/vim-anzu
755,PIV,249,35,249,21,21/04/2010,08/02/2016,8.22 MB,8417,PHP Integration environment for Vim,VimL,https://github.com/spf13/PIV
756,miramare,249,19,249,2,17/03/2020,18/11/2021,696.00 KB,696, :maple_leaf: Comfortable & Pleasant Color Scheme for Vim,Vim script,https://github.com/franbach/miramare
757,salt-vim,248,75,248,8,08/03/2012,01/07/2017,35.00 KB,35,Vim files for editing Salt files,Vim script,https://github.com/vmware-archive/salt-vim
758,Vim,248,108,248,3,08/08/2015,19/08/2022,31.60 MB,32354,🚩 一键化打造 Vim IDE 环境(安装只需数秒) 【环境:Linux 64 位】 Vim7.X 可以安装版本1.0,Vim script,https://github.com/meetbill/Vim
759,vinux,247,41,247,3,27/04/2016,29/03/2025,1.29 MB,1325,Swiss Army Knife，Dark power (neo)vim config,Vim Script,https://github.com/tracyone/vinux
760,vim-online-thesaurus,247,21,247,12,15/05/2013,28/02/2021,100.00 KB,100,A Vim plugin for looking up words in an online thesaurus,VimL,https://github.com/beloglazov/vim-online-thesaurus
761,vim-packager,247,7,247,4,08/09/2018,20/11/2021,143.00 KB,143,"Vim plugin manager that utilizes ""jobs"" and ""pack"" features.",Vim script,https://github.com/kristijanhusak/vim-packager
762,vim-swoop,247,11,247,4,07/12/2014,17/11/2021,9.44 MB,9668,,Vim script,https://github.com/pelodelfuego/vim-swoop
763,vim-rake,246,19,246,2,04/08/2010,11/09/2023,93.00 KB,93,rake.vim: it's like rails.vim without the rails,Vim Script,https://github.com/tpope/vim-rake
764,base16-black-metal-scheme,245,3,245,1,01/12/2017,07/12/2023,1.95 MB,1994,A collection of Black Metal inspired base16 schemes.,Vim script,https://github.com/metalelf0/base16-black-metal-scheme
765,vim-themis,245,29,245,13,30/06/2014,30/10/2024,564.00 KB,564,A testing framework for Vim script.,Vim Script,https://github.com/thinca/vim-themis
766,vim-log-highlighting,243,39,243,12,09/07/2018,27/11/2023,484.00 KB,484,Syntax highlighting for generic log files in VIM,Vim script,https://github.com/MTDL9/vim-log-highlighting
767,vim-zoom,242,16,242,0,12/12/2016,24/01/2023,23.00 KB,23,Toggle zoom in / out individual windows (splits),Vim Script,https://github.com/dhruvasagar/vim-zoom
768,oceanic-material,241,14,241,4,01/05/2020,22/06/2023,85.00 KB,85,Oceanic Material Colorscheme on Vim/NeoVim,Vim Script,https://github.com/nvimdev/oceanic-material
769,color-schemes,240,32,240,0,06/03/2013,16/08/2014,999.00 KB,999,Color schemes I've used for an extended period of time and like,VimL,https://github.com/chrishunt/color-schemes
770,vim-colortuner,240,7,240,2,20/04/2015,10/08/2020,2.69 MB,2758,Adjust your vim colors using sliders,Vim script,https://github.com/zefei/vim-colortuner
771,blood_i3,240,12,240,4,06/08/2020,23/12/2021,26.25 MB,26877,,Vim script,https://github.com/ab-dx/blood_i3
