Ranking,Project Name,Stars,Forks,Watchers,Open Issues,Created At,Last Commit,Size,Size (KB),Description,Language,Repo URL
460,vim-mustache-handlebars,453,48,453,15,24/10/2013,30/11/2021,79.00 KB,79,mustache and handlebars mode for vim,Vim script,https://github.com/mustache/vim-mustache-handlebars
461,YUNOcommit.vim,453,8,453,5,20/10/2014,26/11/2014,205.00 KB,205,Y U NO commit after so many writes???,VimL,https://github.com/esneider/YUNOcommit.vim
462,vim-trailing-whitespace,452,62,452,3,11/08/2010,28/02/2023,19.00 KB,19,Highlights trailing whitespace in red and provides :FixWhitespace to fix it.,Vim Script,https://github.com/bronson/vim-trailing-whitespace
463,vim-textobj-entire,450,26,450,6,28/03/2010,02/08/2022,22.00 KB,22,Vim plugin: Text objects for entire buffer,Vim script,https://github.com/kana/vim-textobj-entire
464,vim-repl,450,38,450,50,23/05/2018,27/03/2025,30.35 MB,31082,Best REPL environment for Vim,Vim Script,https://github.com/sillybun/vim-repl
465,nginx.vim,449,40,449,6,13/04/2017,26/11/2023,99.00 KB,99,Improved nginx vim plugin (incl. syntax highlighting),Vim Script,https://github.com/chr4/nginx.vim
466,vim-ansible-yaml,448,78,448,15,07/12/2013,31/10/2017,131.00 KB,131,Add additional support for Ansible in VIM,Vim script,https://github.com/chase/vim-ansible-yaml
467,python-syntax,446,81,446,39,16/02/2017,19/10/2023,194.00 KB,194,Python syntax highlighting for Vim,Vim script,https://github.com/vim-python/python-syntax
468,8cc.vim,446,7,446,0,20/10/2016,22/10/2016,648.00 KB,648,C Compiler written in Vim script,VimL,https://github.com/rhysd/8cc.vim
469,vim-sexp-mappings-for-regular-people,443,23,443,3,24/12/2013,16/08/2025,7.00 KB,7,vim-sexp mappings for regular people,Vim Script,https://github.com/tpope/vim-sexp-mappings-for-regular-people
470,dot-files,441,305,441,4,19/10/2016,31/05/2019,125.00 KB,125,Dotfiles repository,Vim script,https://github.com/amacgregor/dot-files
471,focus,437,13,437,2,23/02/2013,23/01/2021,232.00 KB,232,"Code editor color theme that lets you focus on the content. Available for Sublime Text, Atom, TextMate, Vim, Chocolat, and more...",Vim script,https://github.com/sindresorhus/focus
472,dotfiles,436,58,436,1,21/09/2010,26/02/2024,1.02 MB,1048,My dotfiles (vim / bash etc.),Vim Script,https://github.com/mitsuhiko/dotfiles
473,vim-ruby-debugger,434,36,434,26,18/04/2009,09/05/2013,735.00 KB,735,Vim plugin for debugging Ruby applications (using ruby-debug-ide gem),VimL,https://github.com/astashov/vim-ruby-debugger
474,vim-easycomplete,433,27,433,38,19/09/2018,23/08/2025,4.23 MB,4333,杭州市余杭区最好用的 VIM/NVIM 代码补全插件,Vim Script,https://github.com/jayli/vim-easycomplete
475,vim-fish,432,59,432,26,05/05/2013,17/03/2022,37.00 KB,37,Vim support for editing fish scripts,Vim script,https://github.com/dag/vim-fish
476,ghcmod-vim,431,59,431,42,16/02/2012,30/08/2018,230.00 KB,230,"Happy Haskell programming on Vim, powered by ghc-mod",VimL,https://github.com/eagletmt/ghcmod-vim
477,miasma.nvim,430,22,430,5,17/06/2023,12/07/2025,784.00 KB,784,a fog descends upon your editor ☁  dark color scheme inspired by the woods for vim and neovim,Vim Script,https://github.com/xero/miasma.nvim
478,vim-android,428,42,428,2,08/02/2013,31/05/2025,628.00 KB,628,Android development plugin for vim,Vim Script,https://github.com/hsanson/vim-android
479,dbext.vim,426,101,426,15,18/10/2010,10/09/2023,455.00 KB,455,"Provides database access to many dbms (Oracle, Sybase, Microsoft, MySQL, DBI,..)",VimL,https://github.com/vim-scripts/dbext.vim
480,flattened,426,54,426,0,28/04/2014,16/04/2023,803.00 KB,803,"Solarized, without the bullshit.",Vim Script,https://github.com/romainl/flattened
481,rainbow_levels.vim,426,9,426,0,17/12/2017,09/10/2022,679.00 KB,679,A different approach to code highlighting.,Vim Script,https://github.com/thiagoalessio/rainbow_levels.vim
482,vim-vebugger,426,35,426,39,23/12/2013,15/11/2020,201.00 KB,201,"Yes, we do need another debugger plugin",Vim script,https://github.com/idanarye/vim-vebugger
483,init.nvim,426,53,426,0,29/11/2019,21/04/2025,1.32 MB,1354,An Opinionated Neovim Config for the Minimalists,Vim Script,https://github.com/Blacksuan19/init.nvim
484,dotvim,424,79,424,3,07/12/2012,24/07/2016,749.00 KB,749,lean & mean vim distribution,VimL,https://github.com/bling/dotvim
485,vim-pandoc-syntax,424,62,424,144,04/11/2013,18/04/2025,500.00 KB,500,"pandoc markdown syntax, to be installed alongside vim-pandoc",Vim Script,https://github.com/vim-pandoc/vim-pandoc-syntax
486,vim-golang,423,57,423,1,26/10/2010,14/05/2022,275.00 KB,275,"Github mirror of Go vimscripts, synced with main repository",VimL,https://github.com/jnwhiteh/vim-golang
487,vim-crystal,423,30,423,12,17/02/2014,15/03/2023,335.00 KB,335,Vim filetype and tools support for Crystal language.,Vim Script,https://github.com/vim-crystal/vim-crystal
488,vim-clojure-static,423,50,423,15,13/12/2012,29/09/2021,420.00 KB,420,Meikel Brandmeyer's excellent Clojure runtime files,Vim script,https://github.com/guns/vim-clojure-static
489,vim-flutter,421,30,421,3,13/03/2019,07/06/2023,656.00 KB,656,"Vim commands for Flutter, including hot-reload-on-save and more. 🦋",Vim Script,https://github.com/thosakwe/vim-flutter
490,tagalong.vim,418,5,418,1,16/04/2019,07/09/2023,93.00 KB,93,Change an HTML(ish) opening tag and take the closing one along as well,Vim Script,https://github.com/AndrewRadev/tagalong.vim
491,vimrc,417,175,417,0,23/03/2014,17/10/2023,37.41 MB,38304,Ruchee's Vim Config Files,Vim Script,https://github.com/ruchee/vimrc
492,vim-plugins,417,94,417,23,04/11/2012,22/09/2021,8.68 MB,8888,Vim plug-ins which offer support for various programming languages.,Vim script,https://github.com/WolfgangMehner/vim-plugins
493,YankRing.vim,417,64,417,7,18/10/2010,27/02/2022,349.00 KB,349,"Maintains a history of previous yanks, changes and deletes",VimL,https://github.com/vim-scripts/YankRing.vim
494,vim-lucius,414,83,414,8,23/08/2012,15/05/2021,19.00 KB,19,Lucius color scheme for vim,Vim script,https://github.com/jonathanfilip/vim-lucius
495,vim-gh-line,414,38,414,17,31/10/2015,19/02/2024,80.00 KB,80,vim plugin that open the link of current line on github,Vim Script,https://github.com/ruanyl/vim-gh-line
496,vim-atom-dark,414,112,414,0,19/11/2014,28/10/2017,24.00 KB,24,A vim theme inspired by Atom's default dark theme,Vim script,https://github.com/gosukiwi/vim-atom-dark
497,wxapp.vim,414,40,414,0,25/09/2016,22/06/2019,84.00 KB,84,提供微信小程序开发全方位支持的 vim 插件,Vim script,https://github.com/chemzqm/wxapp.vim
498,vim-config,410,68,410,0,05/07/2011,26/09/2021,4.25 MB,4351,My Vim configuration,Vim script,https://github.com/derekwyatt/vim-config
499,neodark.vim,410,34,410,8,30/10/2016,12/01/2024,7.76 MB,7946,A dark color scheme for vim,Vim Script,https://github.com/KeitaNakamura/neodark.vim
500,vim-silicon,410,5,410,9,28/07/2019,19/02/2024,28.00 KB,28,Vim plugin for generating images of source code using https://github.com/Aloxaf/silicon,Vim script,https://github.com/segeljakt/vim-silicon
501,vim-tbone,409,17,409,5,27/03/2013,31/03/2023,18.00 KB,18,tbone.vim: tmux basics,Vim Script,https://github.com/tpope/vim-tbone
502,diffconflicts,409,20,409,2,18/07/2018,30/01/2024,746.00 KB,746,A better Vimdiff Git mergetool,Vim Script,https://github.com/whiteinge/diffconflicts
503,vime,406,76,406,6,14/05/2019,20/01/2022,15.77 MB,16147,"vime, an easy and structural config for (neo)vim users",Vim script,https://github.com/fgheng/vime
504,configs,406,123,406,1,10/05/2019,23/06/2022,181.00 KB,181,My neovim configuration,Vim script,https://github.com/nschurmann/configs
505,vim-bundler,406,29,406,10,22/08/2011,26/08/2023,119.00 KB,119,bundler.vim: Lightweight support for Ruby's Bundler,Vim Script,https://github.com/tpope/vim-bundler
506,verilog_systemverilog.vim,402,94,402,34,19/08/2013,13/10/2024,529.00 KB,529,Verilog/SystemVerilog Syntax and Omni-completion,Vim Script,https://github.com/vhda/verilog_systemverilog.vim
507,vim-tpipeline,401,11,401,2,11/01/2021,06/05/2025,425.00 KB,425,Embed your vim statusline in tmux,Vim Script,https://github.com/vimpostor/vim-tpipeline
508,vim-interestingwords,400,61,400,1,05/09/2014,04/07/2024,55.00 KB,55,🎨 A plugin for seamlessly highlighting and navigating through words,Vim Script,https://github.com/lfv89/vim-interestingwords
509,scratch.vim,400,32,400,6,19/07/2013,24/12/2021,480.00 KB,480,Unobtrusive scratch window,Vim script,https://github.com/mtth/scratch.vim
510,img-paste.vim,399,87,399,21,10/12/2017,04/04/2024,146.00 KB,146,paste image to markdown,Vim Script,https://github.com/img-paste-devs/img-paste.vim
511,vim-buffet,399,23,399,16,12/05/2017,08/04/2023,1.94 MB,1989,IDE-like Vim tabline,Vim script,https://github.com/bagrat/vim-buffet
512,claude.vim,398,19,398,16,27/06/2024,22/05/2025,79.00 KB,79,Claude vim plugin for AI pair programming - a hacker's gateway to LLMs,Vim Script,https://github.com/pasky/claude.vim
513,vim-asterisk,398,16,398,16,27/11/2014,31/03/2021,87.00 KB,87,:snowflake: *-Improved,Vim script,https://github.com/haya14busa/vim-asterisk
514,vim-kitty-navigator,398,33,398,9,26/12/2018,06/12/2024,23.00 KB,23,Seamless navigation between kitty panes and vim splits,Vim Script,https://github.com/knubie/vim-kitty-navigator
515,ctrlp-funky,397,69,397,10,25/02/2012,24/06/2025,615.00 KB,615,A super simple function navigator for ctrlp.vim,Vim Script,https://github.com/tacahiroy/ctrlp-funky
516,dotfile,396,72,396,2,29/05/2015,31/03/2020,977.00 KB,977,YiJun's (Neo)Vim work file,Vim script,https://github.com/DemonCloud/dotfile
517,vim-monokai-tasty,396,54,396,1,05/12/2018,22/04/2025,2.07 MB,2116,VIM Colour scheme,Vim Script,https://github.com/patstockwell/vim-monokai-tasty
518,braceless.vim,396,13,396,13,15/02/2016,30/08/2017,223.00 KB,223,":snake: Text objects, folding, and more for Python and other indented languages.",Vim script,https://github.com/tweekmonster/braceless.vim
519,pyflakes-vim,392,65,392,32,11/11/2008,06/01/2022,365.00 KB,365,on the fly Python checking in Vim with PyFlakes,Vim script,https://github.com/kevinw/pyflakes-vim
520,pear-tree,391,13,391,18,02/03/2018,29/11/2024,207.00 KB,207,"A Vim auto-pair plugin that supports multi-character pairs, intelligent matching, and more",Vim Script,https://github.com/tmsvg/pear-tree
521,coc-fzf,390,26,390,5,26/01/2020,24/04/2024,198.00 KB,198,fzf :heart: coc.nvim,Vim Script,https://github.com/antoinemadec/coc-fzf
522,zeavim.vim,389,28,389,2,02/05/2014,02/11/2022,1019.00 KB,1019,Zeal for Vim,Vim script,https://github.com/KabbAmine/zeavim.vim
523,Misc-Cheatsheet,386,39,386,0,02/06/2021,07/07/2022,30.00 KB,30,대학원 생활을 하며 사용하는 작고 소중한 코딩팁 (linux 명령어 등),Vim script,https://github.com/subinium/Misc-Cheatsheet
524,mydotfiles,386,159,386,0,27/06/2015,30/06/2024,3.70 MB,3789,All my dot configuration files.,Vim Script,https://github.com/TimothyYe/mydotfiles
525,vim-yoink,385,6,385,14,25/12/2018,15/09/2021,127.00 KB,127,Vim plugin that maintains a yank history to cycle between when pasting,Vim script,https://github.com/svermeulen/vim-yoink
526,vim-ledger,383,54,383,33,12/11/2012,28/01/2025,317.00 KB,317,Vim plugin for Ledger,Vim Script,https://github.com/ledger/vim-ledger
527,xterm-color-table.vim,383,39,383,6,21/01/2011,21/11/2022,498.00 KB,498,"All 256 xterm colors with their RGB equivalents, right in Vim!",Vim Script,https://github.com/guns/xterm-color-table.vim
528,darcula,382,60,382,10,06/10/2019,23/07/2024,607.00 KB,607,A Vim color scheme reproduction of the official JetBrains IDE Darcula theme,Vim script,https://github.com/doums/darcula
529,cheat.sh-vim,379,17,379,2,20/04/2018,07/08/2022,184.00 KB,184,A vim plugin to access cheat.sh sheets,Vim script,https://github.com/dbeniamine/cheat.sh-vim
530,eddie-vim,379,139,379,3,13/01/2012,07/02/2020,1.24 MB,1268,Yet another vimrc,VimL,https://github.com/kaochenlong/eddie-vim
531,vim-php-cs-fixer,378,39,378,8,20/05/2012,01/03/2023,64.00 KB,64,Use FriendsOfPHP/PHP-CS-Fixer,Vim Script,https://github.com/stephpy/vim-php-cs-fixer
532,vim-colors-github,377,42,377,12,13/10/2018,20/03/2022,1.88 MB,1926,A Vim colorscheme based on Github's syntax highlighting as of 2018.,Vim script,https://github.com/cormacrelf/vim-colors-github
533,vim-template,377,149,377,24,07/03/2012,25/10/2024,197.00 KB,197,Simple templates plugin for Vim ,Vim Script,https://github.com/aperezdc/vim-template
534,caw.vim,377,46,377,36,27/02/2010,06/06/2023,561.00 KB,561,"Vim comment plugin: supported operator/non-operator mappings, repeatable by dot-command, 300+ filetypes",Vim Script,https://github.com/tyru/caw.vim
535,vim-sublime,375,43,375,7,28/11/2013,07/09/2018,28.83 MB,29517,A ready to use minimal Vim (Sublime Text -like) .vimrc configuration,VimL,https://github.com/grigio/vim-sublime
536,spacevim,371,20,371,5,10/04/2016,29/03/2018,849.00 KB,849,Spacemacs for vim,Vim script,https://github.com/ctjhoa/spacevim
537,vim-searchindex,370,24,370,6,13/10/2015,26/09/2019,423.00 KB,423,vim-searchindex: display number of search matches & index of a current match,Vim script,https://github.com/google/vim-searchindex
538,vim-material,370,42,370,0,06/07/2017,14/10/2024,40.00 KB,40,🧩 Visual Studio Code Material Theme port for Vim/Neovim,Vim Script,https://github.com/hzchirs/vim-material
539,vim-swift,369,20,369,3,03/06/2014,27/12/2016,13.00 KB,13,"Adds Swift support to vim. It covers syntax, intenting, and more.",VimL,https://github.com/toyamarinyon/vim-swift
540,dotfiles,369,61,369,0,03/08/2016,29/07/2024,172.00 KB,172,Configuration files,Vim Script,https://github.com/koekeishiya/dotfiles
541,vim-enfocado,368,14,368,3,18/09/2021,25/04/2024,21.50 MB,22011,How themes should be.,Vim Script,https://github.com/wuelnerdotexe/vim-enfocado
542,vim-misc,367,57,367,11,15/03/2011,22/05/2021,724.00 KB,724,Miscellaneous auto-load Vim scripts,VimL,https://github.com/xolox/vim-misc
543,spelunker.vim,367,20,367,29,12/11/2018,19/07/2024,1.02 MB,1047,Improved vim spelling plugin (with camel case support)!,Vim script,https://github.com/kamykn/spelunker.vim
544,vim-arduino,365,23,365,11,30/06/2015,10/02/2024,108.00 KB,108,Vim plugin for compiling and uploading arduino sketches,Vim Script,https://github.com/stevearc/vim-arduino
545,neomux,365,11,365,1,10/06/2019,17/04/2023,16.22 MB,16606,Control Neovim from shells running inside Neovim.,Vim Script,https://github.com/nikvdp/neomux
546,dotmatrix,364,95,364,7,05/10/2009,25/02/2023,586.00 KB,586,Hashrocket Dot Files,Vim Script,https://github.com/hashrocket/dotmatrix
547,python-syntax,363,108,363,23,12/05/2013,09/01/2022,442.00 KB,442,Python syntax highlighting script for Vim,VimL,https://github.com/hdima/python-syntax
548,dotfiles,363,77,363,4,07/03/2012,09/08/2025,258.00 KB,258,".vimrc, .bashrc etc",Vim Script,https://github.com/tomnomnom/dotfiles
549,purify,362,24,362,3,11/07/2018,26/07/2022,7.11 MB,7276,":rainbow: Clean & vibrant color schemes for Vim, Terminals...",Vim script,https://github.com/kyoz/purify
550,cfg,362,85,362,1,23/10/2010,18/01/2019,3.54 MB,3629,dotfiles and related syncing scripts,Vim script,https://github.com/durdn/cfg
551,vim-tags,360,24,360,13,22/10/2012,30/11/2020,315.00 KB,315,Ctags generator for Vim,VimL,https://github.com/szw/vim-tags
552,vim-clang,360,47,360,34,01/02/2013,20/12/2023,544.00 KB,544,Clang completion plugin for vim,Vim Script,https://github.com/justmao945/vim-clang
553,vim-diff-enhanced,359,17,359,0,25/02/2015,20/09/2024,309.00 KB,309,Better Diff options for Vim,Vim Script,https://github.com/chrisbra/vim-diff-enhanced
554,vim-jdaddy,358,8,358,8,13/02/2014,26/03/2022,6.00 KB,6,jdaddy.vim: JSON manipulation and pretty printing,Vim script,https://github.com/tpope/vim-jdaddy
555,neco-ghc,358,31,358,0,24/09/2010,22/02/2021,143.00 KB,143,"A completion plugin for Haskell, using ghc-mod",Vim script,https://github.com/eagletmt/neco-ghc
556,vim-system-copy,357,32,357,13,06/06/2014,16/03/2024,26.00 KB,26,Vim plugin for copying to the system clipboard with text-objects and motions,Vim Script,https://github.com/christoomey/vim-system-copy
557,quickfix-reflector.vim,357,18,357,3,16/03/2014,02/02/2022,31.00 KB,31,Change code right in the quickfix window,Vim script,https://github.com/stefandtw/quickfix-reflector.vim
558,vim-up,356,22,356,1,30/11/2016,21/08/2023,1.31 MB,1342,"A bunch of vim shortcuts, colors, and bundles to make your life easier",Vim Script,https://github.com/cassidoo/vim-up
559,colorizer,353,29,353,11,04/05/2011,03/01/2022,615.00 KB,615,A Vim plugin to colorize all text in the form #rrggbb or #rgb.,Vim script,https://github.com/lilydjwg/colorizer
560,vim-coloresque,352,62,352,15,11/08/2013,03/05/2020,68.00 KB,68,css/less/sass/html color preview for vim,Vim script,https://github.com/gko/vim-coloresque
561,vim-tmux-focus-events,352,22,352,15,21/03/2015,23/03/2024,50.00 KB,50,Make terminal vim and tmux work better together.,Vim script,https://github.com/tmux-plugins/vim-tmux-focus-events
562,vim-esearch,352,12,352,12,20/07/2015,16/10/2023,3.83 MB,3923,Perform search in files easily,Vim Script,https://github.com/eugen0329/vim-esearch
563,vim-closer,351,34,351,17,31/05/2015,14/07/2024,64.00 KB,64,Closes brackets,Vim Script,https://github.com/rstacruz/vim-closer
564,vim-afterglow,351,37,351,1,27/02/2017,31/03/2024,41.00 KB,41,Vim adaptation of the Afterglow colorscheme,Vim Script,https://github.com/danilo-augusto/vim-afterglow
565,Vim-Jinja2-Syntax,350,66,350,8,17/12/2011,22/06/2021,42.00 KB,42,An up-to-date jinja2 syntax file.,Vim script,https://github.com/Glench/Vim-Jinja2-Syntax
566,vim-ragtag,349,53,349,5,18/01/2010,12/10/2022,87.00 KB,87,ragtag.vim: ghetto HTML/XML mappings (formerly allml.vim),Vim script,https://github.com/tpope/vim-ragtag
567,dotfiles,349,10,349,0,26/03/2017,24/08/2020,59.00 KB,59,files that define my GNU/Linux box.,Vim script,https://github.com/oppiliappan/dotfiles
568,vifm.vim,348,20,348,15,09/06/2014,22/08/2025,8.05 MB,8241,Vim plugin that allows use of vifm as a file picker,Vim Script,https://github.com/vifm/vifm.vim
569,vim-dirdiff,348,62,348,20,04/02/2015,24/05/2023,104.00 KB,104,Vim plugin to diff two directories,Vim script,https://github.com/will133/vim-dirdiff
570,pangu.vim,348,29,348,2,26/03/2015,19/02/2023,78.00 KB,78,『盘古之白』中文排版自动规范化的 Vim 插件,Vim Script,https://github.com/hotoo/pangu.vim
571,vim-cheatsheet,347,53,347,1,13/01/2020,13/06/2025,7.21 MB,7378,🍁Vim cheat sheet with everything you want to know.,Vim Script,https://github.com/chloneda/vim-cheatsheet
572,typst.vim,346,31,346,17,24/03/2023,27/04/2025,161.00 KB,161,Vim plugin for Typst,Vim Script,https://github.com/kaarmu/typst.vim
573,vim-sonictemplate,344,44,344,3,25/10/2011,02/07/2025,741.00 KB,741,Easy and high speed coding method,Vim Script,https://github.com/mattn/vim-sonictemplate
574,vim-snazzy,342,34,342,6,16/04/2018,30/07/2022,7.09 MB,7259,Elegant vim theme with bright colors.,Vim script,https://github.com/connorholyday/vim-snazzy
575,vimdoc-ja,342,34,342,11,15/09/2011,22/08/2025,145.29 MB,148782,A project which translate Vim documents into Japanese.,Vim Script,https://github.com/vim-jp/vimdoc-ja
576,vim-jetpack,342,33,342,11,13/02/2022,20/02/2025,705.00 KB,705,"The lightning-fast plugin manager, alternative to vim-plug",Vim Script,https://github.com/tani/vim-jetpack
577,vim-pydocstring,341,52,341,1,18/01/2012,15/07/2023,9.46 MB,9690,Generate Python docstring to your Python source code.,Vim Script,https://github.com/heavenshell/vim-pydocstring
578,vim-lsp-cxx-highlight,340,25,340,19,24/02/2019,24/09/2024,5.50 MB,5633,"Vim plugin for C/C++/ObjC semantic highlighting using cquery, ccls, or clangd",Vim Script,https://github.com/jackguo380/vim-lsp-cxx-highlight
579,vimroom,340,40,340,24,31/10/2010,05/01/2017,148.00 KB,148,Simulating a vaguely WriteRoom-like environment in Vim.,VimL,https://github.com/mikewest/vimroom
580,vim2hs,340,47,340,64,29/02/2012,29/04/2018,1.02 MB,1046,vim2hs :: Vim -> Haskell,VimL,https://github.com/dag/vim2hs
581,vim-diminactive,340,12,340,15,09/02/2014,25/09/2021,170.00 KB,170,Vim plugin to dim inactive windows,Vim script,https://github.com/blueyed/vim-diminactive
582,vim-terraform-completion,339,24,339,18,28/04/2017,04/03/2022,6.94 MB,7102,"A (Neo)Vim Autocompletion and linter for Terraform, a HashiCorp tool",Vim script,https://github.com/juliosueiras/vim-terraform-completion
583,lightline-bufferline,339,25,339,1,05/10/2016,26/11/2023,586.00 KB,586,A lightweight plugin to display the list of buffers in the lightline vim plugin,Vim Script,https://github.com/mengelbrecht/lightline-bufferline
584,vim-slim,339,66,339,13,12/03/2011,13/05/2024,42.00 KB,42,Syntax highlighting for VIM,Vim Script,https://github.com/slim-template/vim-slim
585,ReplaceWithRegister,337,26,337,1,19/10/2010,22/06/2015,193.00 KB,193,Replace text with the contents of a register. ,VimL,https://github.com/vim-scripts/ReplaceWithRegister
586,vim-tmux,336,21,336,9,14/11/2014,04/10/2021,74.00 KB,74,vim plugin for tmux.conf,Vim script,https://github.com/tmux-plugins/vim-tmux
587,wim,336,15,336,0,21/06/2022,09/11/2024,6.91 MB,7075,This is a Vim configuration that gets you a similar experience as a full-featured IDE. This is accomplished using native vim features with the help of some plugins.,Vim Script,https://github.com/wolandark/wim
588,42header,335,118,335,0,07/04/2020,05/08/2025,149.00 KB,149,42 header,Vim Script,https://github.com/42paris/42header
589,deol.nvim,334,15,334,0,07/11/2016,13/08/2025,191.00 KB,191,Dark powered shell interface for Vim/Neovim,Vim Script,https://github.com/Shougo/deol.nvim
590,vimpyter,333,17,333,12,20/02/2018,02/12/2021,116.00 KB,116,Edit your Jupyter notebooks in Vim/Neovim,Vim script,https://github.com/szymonmaszke/vimpyter
591,vim-slash,333,34,333,11,19/10/2016,06/09/2023,19.00 KB,19,Enhancing in-buffer search experience,Vim script,https://github.com/junegunn/vim-slash
592,taskpaper.vim,332,69,332,22,22/08/2010,03/10/2015,296.00 KB,296,This package contains a syntax file and a file-type plugin for the simple format used by the TaskPaper application. ,VimL,https://github.com/davidoc/taskpaper.vim
593,nofrils,331,44,331,4,02/11/2015,22/03/2021,124.00 KB,124,"An extremely minimalist colorscheme, even opting out of the second L in frills",Vim script,https://github.com/robertmeta/nofrils
594,vim-textobj-rubyblock,331,21,331,18,20/11/2010,11/08/2018,43.00 KB,43,A custom text object for selecting ruby blocks.,VimL,https://github.com/nelstrom/vim-textobj-rubyblock
595,webvim,330,34,330,24,14/02/2014,26/08/2020,1.38 MB,1412,WebVim is a vim based distribution targeting JavaScript and Web development,Vim script,https://github.com/vim-dist/webvim
596,golden-ratio,330,34,330,4,11/08/2011,28/06/2022,34.00 KB,34,Automatic resizing of Vim windows to the golden ratio ,Vim script,https://github.com/roman/golden-ratio
597,msfs2020-map-enhancement,329,43,329,4,05/12/2021,06/08/2025,9.97 MB,10206,MSFS2020 Map Enhancement,Vim Script,https://github.com/derekhe/msfs2020-map-enhancement
598,bigvim,329,77,329,4,12/11/2013,22/12/2024,7.24 MB,7413,Vim configuration,Vim Script,https://github.com/ruanyl/bigvim
599,personal_ansible_desktop_configs,328,104,328,2,09/12/2020,18/09/2022,7.58 MB,7764,,Vim script,https://github.com/LearnLinuxTV/personal_ansible_desktop_configs
600,vim-config,328,391,328,6,29/03/2012,02/04/2020,2.71 MB,2778,my vim config to share amongst my machines,VimL,https://github.com/j1z0/vim-config
601,vim-gtfo,327,18,327,18,13/08/2013,17/06/2024,87.00 KB,87,Go to Terminal or File manager :point_right:,Vim Script,https://github.com/justinmk/vim-gtfo
602,lavalamp,327,8,327,0,02/03/2014,14/02/2019,110.00 KB,110,A text editor theme that visually differentiates languages.,VimL,https://github.com/jasonlong/lavalamp
603,vim-ps1,326,43,326,10,05/03/2012,06/03/2024,70.00 KB,70,A Vim plugin for Windows PowerShell support,Vim Script,https://github.com/PProvost/vim-ps1
604,vim-wintabs,326,26,326,17,15/08/2014,16/02/2024,4.50 MB,4610,Modern buffer manager for Vim,Vim script,https://github.com/zefei/vim-wintabs
605,vim-pasta,326,11,326,6,06/11/2011,12/08/2023,19.00 KB,19,Pasting in Vim with indentation adjusted to destination context,Vim Script,https://github.com/ku1ik/vim-pasta
606,pwnbox,326,55,326,0,13/03/2016,04/05/2021,39.00 KB,39,Docker container with tools for binary reverse engineering and exploitation.,Vim script,https://github.com/superkojiman/pwnbox
607,vim-cucumber,326,61,326,12,24/11/2008,20/11/2023,66.00 KB,66,Vim Cucumber runtime files,Vim Script,https://github.com/tpope/vim-cucumber
608,everblush.vim,325,18,325,0,31/08/2021,19/06/2023,4.17 MB,4272,🎨 A beautiful and dark vim colorscheme. ,Vim Script,https://github.com/Everblush/everblush.vim
609,vim-svelte,325,10,325,4,27/05/2019,30/05/2025,54.00 KB,54,Vim syntax highlighting and indentation for Svelte 3 components.,Vim Script,https://github.com/evanleck/vim-svelte
610,vim-fetch,324,18,324,16,12/01/2015,26/07/2024,276.00 KB,276,Make Vim handle line and column numbers in file names with a minimum of fuss,Vim Script,https://github.com/wsdjeg/vim-fetch
611,vim-smooth-scroll,323,33,323,18,05/04/2013,09/11/2019,127.00 KB,127,Make scrolling in Vim more pleasant,VimL,https://github.com/terryma/vim-smooth-scroll
612,vitality.vim,322,31,322,24,12/04/2012,20/04/2020,31.00 KB,31,Make Vim play nicely with iTerm 2 and tmux.,Vim script,https://github.com/sjl/vitality.vim
613,vim-easygrep,322,44,322,31,22/09/2013,06/11/2019,387.00 KB,387,Fast and Easy Find and Replace Across Multiple Files,Vim script,https://github.com/dkprice/vim-easygrep
614,vim-quantum,321,31,321,3,21/10/2016,10/07/2021,50.00 KB,50,A Material color scheme for Vim.,Vim script,https://github.com/tyrannicaltoucan/vim-quantum
615,a.vim,321,203,321,5,06/11/2010,27/01/2023,137.00 KB,137,Alternate Files quickly (.c --> .h etc),VimL,https://github.com/vim-scripts/a.vim
616,vim-smartinput,320,31,320,22,10/02/2012,22/03/2018,275.00 KB,275,Vim plugin: Provide smart input assistant,Vim script,https://github.com/kana/vim-smartinput
