Ranking,Project Name,Stars,Forks,Watchers,Open Issues,Created At,Last Commit,Size,Size (KB),Description,Language,Repo URL
307,vimified,687,129,687,9,26/02/2012,12/08/2020,519.00 KB,519,Yet another Vim configuration ,Vim script,https://github.com/zaiste/vimified
308,vim-rest-console,685,56,685,30,27/05/2015,29/02/2024,173.00 KB,173,A REST console for Vim.,Vim script,https://github.com/diepm/vim-rest-console
309,vim-scriptease,684,40,684,5,26/11/2012,13/11/2023,100.00 KB,100,scriptease.vim: A Vim plugin for Vim plugins,Vim Script,https://github.com/tpope/vim-scriptease
310,haskell-vim,682,83,682,34,17/06/2014,11/09/2022,241.00 KB,241,Custom Haskell Vimscripts,Vim script,https://github.com/neovimhaskell/haskell-vim
311,timl,680,18,680,4,22/11/2013,19/01/2015,1.54 MB,1572,Clojure like language which compiles down to VimL,VimL,https://github.com/tpope/timl
312,dot_vim,680,127,680,0,11/10/2011,19/07/2025,3.50 MB,3580,My 13 Year-Old (Neo)Vim Configuration,Vim Script,https://github.com/mutewinter/dot_vim
313,vim-oscyank,680,43,680,4,26/11/2020,11/04/2025,69.00 KB,69,A Vim plugin to copy text through SSH with OSC52,Vim Script,https://github.com/ojroques/vim-oscyank
314,ranger.vim,677,57,677,43,14/11/2015,02/06/2023,330.00 KB,330,Ranger integration in vim and neovim,Vim script,https://github.com/francoiscabrol/ranger.vim
315,vim-bbye,676,34,676,11,20/07/2013,31/05/2024,18.00 KB,18,"Delete buffers and close files in Vim without closing your windows or messing up your layout. Like Bclose.vim, but rewritten and well maintained.",Vim script,https://github.com/moll/vim-bbye
316,yats.vim,668,67,668,59,06/04/2015,17/08/2025,1.03 MB,1051,Yet Another TypeScript Syntax: The most advanced TypeScript Syntax Highlighting in Vim,Vim Script,https://github.com/HerringtonDarkholme/yats.vim
317,vim-addon-manager,665,54,665,32,27/12/2009,29/08/2024,1.33 MB,1367,manage and install vim plugins (including their dependencies) in a sane way. If you have any trouble contact me. Usually I reply within 24 hours,Vim Script,https://github.com/MarcWeber/vim-addon-manager
318,vim-jukit,658,30,658,48,28/03/2021,22/10/2023,957.00 KB,957,Jupyter-Notebook inspired Neovim/Vim Plugin,Vim Script,https://github.com/luk400/vim-jukit
319,vim-rspec,657,105,657,19,03/04/2013,23/09/2024,46.00 KB,46,Run Rspec specs from Vim,Vim Script,https://github.com/thoughtbot/vim-rspec
320,palenight.vim,657,82,657,11,20/06/2017,21/07/2023,224.00 KB,224,Soothing color scheme for your favorite [best] text editor,Vim Script,https://github.com/drewtempelmeyer/palenight.vim
321,python-vimrc,657,339,657,13,06/07/2015,18/03/2021,318.00 KB,318,VIM Configuration for Python / Cython / C Development,Vim script,https://github.com/ets-labs/python-vimrc
322,SimpylFold,656,55,656,21,03/09/2011,02/05/2022,116.00 KB,116,No-BS Python code folding for Vim,Vim script,https://github.com/tmhedberg/SimpylFold
323,nnn.vim,656,24,656,6,24/11/2018,23/05/2023,244.00 KB,244,File manager for vim/neovim powered by n³,Vim Script,https://github.com/mcchrish/nnn.vim
324,taglist.vim,654,266,654,11,18/10/2010,27/02/2022,401.00 KB,401,"Source code browser (supports C/C++, java, perl, python, tcl, sql, php, etc)",VimL,https://github.com/vim-scripts/taglist.vim
325,vim-workshop,654,131,654,0,24/02/2015,10/06/2022,39.85 MB,40803,An accompanying vim configuration and tmux.conf for my vim + tmux video,Vim script,https://github.com/nicknisi/vim-workshop
326,dart-vim-plugin,653,52,653,10,31/10/2012,24/07/2025,2.35 MB,2411,Syntax highlighting for Dart in Vim,Vim Script,https://github.com/dart-lang/dart-vim-plugin
327,vim-qf,651,34,651,35,07/04/2015,18/05/2025,5.22 MB,5350,Tame the quickfix window.,Vim Script,https://github.com/romainl/vim-qf
328,vim-css-color,644,47,644,13,03/07/2010,18/01/2016,357.00 KB,357,Highlight colors in css files,VimL,https://github.com/skammer/vim-css-color
329,comfortable-motion.vim,641,20,641,25,02/10/2016,11/08/2022,18.00 KB,18,Brings physics-based smooth scrolling to the Vim world!,Vim script,https://github.com/yuttie/comfortable-motion.vim
330,vim-sexp,636,37,636,21,17/12/2012,08/03/2021,359.00 KB,359,Precision Editing for S-expressions,Vim script,https://github.com/guns/vim-sexp
331,dotfiles-manjaro,636,95,636,3,21/02/2015,11/03/2022,36.94 MB,37825,My personal dotfiles (how do these have so many stars?),Vim script,https://github.com/Airblader/dotfiles-manjaro
332,vim-startuptime,635,11,635,2,10/01/2020,18/02/2025,571.00 KB,571,A plugin for viewing Vim and Neovim startup event timing information.,Vim Script,https://github.com/dstein64/vim-startuptime
333,vim-colors-xcode,635,63,635,4,14/12/2019,25/10/2024,671.00 KB,671,Xcode 11’s dark and light colourschemes for Vim,Vim Script,https://github.com/lunacookies/vim-colors-xcode
334,kotlin-vim,632,51,632,7,25/11/2012,30/12/2022,81.00 KB,81,"Kotlin plugin for Vim. Featuring: syntax highlighting, basic indentation, Syntastic support",Vim Script,https://github.com/udalov/kotlin-vim
335,vim-racer,631,43,631,5,15/09/2015,04/04/2021,126.00 KB,126,Racer support for Vim,Vim script,https://github.com/racer-rust/vim-racer
336,dotfiles,629,46,629,0,21/12/2010,25/02/2023,1.77 MB,1808,tpope's dotfiles. DON'T USE unless you're tpope,Vim Script,https://github.com/tpope/dotfiles
337,vim-toml,626,43,626,7,26/02/2013,02/05/2025,36.00 KB,36,Vim syntax for TOML,Vim Script,https://github.com/cespare/vim-toml
338,vim-lastplace,624,29,624,4,12/01/2015,18/05/2024,82.00 KB,82,A vim / nvim plugin that intelligently reopens files at your last edit position.,Vim Script,https://github.com/farmergreg/vim-lastplace
339,promptline.vim,624,54,624,42,22/12/2013,26/07/2024,77.00 KB,77,Generate a fast shell prompt with powerline symbols and airline colors,Vim script,https://github.com/edkolev/promptline.vim
340,vim-markdown-toc,622,57,622,23,17/12/2015,01/09/2024,989.00 KB,989,A vim 7.4+ plugin to generate table of contents for Markdown files.,Vim Script,https://github.com/mzlogin/vim-markdown-toc
341,vim,621,42,621,2,21/11/2013,17/01/2023,52.00 KB,52,FlatColor vim colorscheme,Vim script,https://github.com/challenger-deep-theme/vim
342,vim-rsi,620,36,620,19,16/12/2012,30/04/2023,17.00 KB,17,rsi.vim: Readline style insertion,Vim Script,https://github.com/tpope/vim-rsi
343,javascript-libraries-syntax.vim,620,36,620,14,31/01/2013,09/10/2018,305.00 KB,305,Syntax for JavaScript libraries,Vim script,https://github.com/othree/javascript-libraries-syntax.vim
344,vim-cursorword,616,36,616,0,25/01/2015,17/11/2022,21.00 KB,21,Underlines the word under the cursor,Vim Script,https://github.com/itchyny/vim-cursorword
345,vim-for-server,616,269,616,2,26/10/2014,01/09/2022,10.00 KB,10,".vimrc, simple configures for server, without plugins.",Vim script,https://github.com/wklken/vim-for-server
346,vim-colors-pencil,615,71,615,5,05/01/2014,07/05/2022,1.05 MB,1075,Light (& dark) color scheme inspired by iA Writer,Vim script,https://github.com/preservim/vim-colors-pencil
347,material.vim,615,71,615,1,15/12/2017,23/07/2025,7.52 MB,7697,🎨 A port of the Material color scheme for Vim/Neovim,Vim Script,https://github.com/kaicataldo/material.vim
348,winresizer,614,27,614,18,06/11/2011,17/05/2024,34.00 KB,34,very simple vim plugin for easy resizing of your vim windows ,Vim script,https://github.com/simeji/winresizer
349,vim-emoji,614,31,614,10,22/09/2013,15/08/2020,54.00 KB,54,:smiley: Emoji in Vim,Vim script,https://github.com/junegunn/vim-emoji
350,CamelCaseMotion,611,44,611,10,16/11/2010,19/08/2025,70.00 KB,70,A vim script to provide CamelCase motion through words (fork of inkarkat's camelcasemotion script),Vim Script,https://github.com/bkad/CamelCaseMotion
351,wildfire.vim,608,19,608,0,08/01/2014,22/07/2023,256.00 KB,256,Smart selection of the closest text object,Vim Script,https://github.com/gcmt/wildfire.vim
352,space-vim-dark,607,72,607,3,06/11/2016,04/11/2023,3.82 MB,3911,":purple_heart: A dark colorscheme for space-vim, see space-vim-theme for light background support!",Vim Script,https://github.com/liuchengxu/space-vim-dark
353,vim-web,602,128,602,5,03/03/2016,23/06/2024,2.00 MB,2046,◈ 搞得像IDE一样的Vim，安装配置自己的Vim。,Vim Script,https://github.com/jaywcjlove/vim-web
354,hardmode,602,29,602,10,28/12/2012,03/08/2016,180.00 KB,180,Vim: Hard Mode (deprecated),VimL,https://github.com/wikitopian/hardmode
355,vim-virtualenv,601,51,601,6,08/03/2011,17/11/2022,48.00 KB,48,Vim plugin for working with python virtualenvs,Vim Script,https://github.com/jmcantrell/vim-virtualenv
356,vim-less,600,45,600,6,17/05/2011,25/04/2016,96.00 KB,96,vim syntax for LESS (dynamic CSS),VimL,https://github.com/groenewege/vim-less
357,dot-files,599,85,599,0,27/08/2010,29/06/2025,4.37 MB,4470,"Dot-files for Linux, Mac OS X, Windows",Vim Script,https://github.com/chrishunt/dot-files
358,vader.vim,597,40,597,74,09/10/2013,30/04/2024,282.00 KB,282,A simple Vimscript test framework,Vim Script,https://github.com/junegunn/vader.vim
359,vim-haml,595,67,595,24,20/06/2008,08/09/2024,68.00 KB,68,"Vim runtime files for Haml, Sass, and SCSS",Vim Script,https://github.com/tpope/vim-haml
360,phpcomplete.vim,594,109,594,14,28/07/2010,31/08/2023,10.47 MB,10720,Improved PHP omnicompletion,Vim Script,https://github.com/shawncplus/phpcomplete.vim
361,vim-git,594,77,594,3,11/09/2008,03/10/2024,127.00 KB,127,Vim Git runtime files,Vim Script,https://github.com/tpope/vim-git
362,vim-c-cpp-modern,594,43,594,2,12/10/2016,15/01/2025,95.00 KB,95,Extended Vim syntax highlighting for C and C++ (C++11/14/17/20/23),Vim Script,https://github.com/bfrg/vim-c-cpp-modern
363,vim-maktaba,592,41,592,42,05/12/2013,21/03/2023,803.00 KB,803,Consistent Vimscript,Vim Script,https://github.com/google/vim-maktaba
364,lsp,589,72,589,103,07/12/2020,23/08/2025,1.25 MB,1275,Language Server Protocol (LSP) plugin for Vim9,Vim Script,https://github.com/yegappan/lsp
365,dotfiles,585,80,585,1,06/06/2012,22/04/2017,22.47 MB,23007,My .dotfiles,Vim script,https://github.com/joedicastro/dotfiles
366,vim-markdown-preview,580,88,580,38,15/08/2014,30/10/2021,8.26 MB,8462,A light Vim plugin for previewing markdown files in a browser - without leaving Vim.,Vim script,https://github.com/JamshedVesuna/vim-markdown-preview
367,vital.vim,580,64,580,70,30/01/2011,14/08/2025,4.20 MB,4300,A comprehensive Vim utility functions for Vim plugins,Vim Script,https://github.com/vim-jp/vital.vim
368,echodoc.vim,579,31,579,0,02/06/2010,27/11/2022,166.00 KB,166,Print documents in echo area.,Vim Script,https://github.com/Shougo/echodoc.vim
369,vim-practice,579,97,579,4,17/12/2015,28/09/2022,7.87 MB,8058,💘 Vim is awesome! Here is my practice and study log.,Vim Script,https://github.com/oldratlee/vim-practice
370,vim-go-ide,579,291,579,13,08/01/2015,06/04/2018,2.07 MB,2122,"Ready to use, fully configured for Go development.",Vim script,https://github.com/farazdagi/vim-go-ide
371,vim-over,576,18,576,20,05/11/2013,26/01/2020,311.00 KB,311,:substitute preview,Vim script,https://github.com/osyo-manga/vim-over
372,tokyonight-vim,576,48,576,8,03/07/2020,23/04/2021,507.00 KB,507,"A clean, dark vim colorscheme that celebrates the lights of downtown Tokyo at night, based on a VSCode theme by @enkia with the same name [Archived because I'm no longer using this]",Vim script,https://github.com/ghifarit53/tokyonight-vim
373,git-vim,575,69,575,15,27/04/2008,15/02/2018,40.00 KB,40,My vim files for Git,Vim script,https://github.com/motemen/git-vim
374,elm-vim,575,101,575,64,11/06/2015,19/05/2021,668.00 KB,668,Elm plugin for Vim,Vim script,https://github.com/ElmCast/elm-vim
375,vim-zettel,575,75,575,53,23/06/2017,16/08/2025,282.00 KB,282,VimWiki addon for managing notes according to Zettelkasten method,Vim Script,https://github.com/michal-h21/vim-zettel
376,vimoutliner,574,80,574,21,03/11/2010,29/08/2023,928.00 KB,928,"Work fast, think well.",Vim Script,https://github.com/vimoutliner/vimoutliner
377,EverVim,568,68,568,1,11/08/2016,11/03/2021,449.00 KB,449,"A Modern, Powerful & Modular Vim Distribution | Archived, see notice: https://ry.sb/evervim-archive",Vim script,https://github.com/LER0ever/EverVim
378,vim-dotoo,568,27,568,21,10/06/2014,14/03/2025,462.00 KB,462,Org-mode like task logging & time tracking in Vim,Vim Script,https://github.com/dhruvasagar/vim-dotoo
379,vim-choosewin,567,44,567,18,21/12/2013,19/04/2024,233.00 KB,233,Land on window you chose like tmux's 'display-pane',Vim script,https://github.com/t9md/vim-choosewin
380,vim,567,185,567,3,12/04/2015,22/04/2025,4.72 MB,4831,"My Vim configuration more Python, Javascript, Vue.js, Golang and Markdown, will add Haskell, Ruby and C/C++",Vim Script,https://github.com/tao12345666333/vim
381,Colorizer,564,32,564,7,25/02/2012,03/05/2025,730.00 KB,730,color hex codes and color names,Vim Script,https://github.com/chrisbra/Colorizer
382,intellimacs,563,95,563,3,09/02/2019,03/11/2024,568.00 KB,568,Spacemacs' like key bindings for IntelliJ platform.,Vim Script,https://github.com/marcoieni/intellimacs
383,vim-latex,562,97,562,38,13/10/2013,11/01/2025,1.46 MB,1492,Enhanced LaTeX support for Vim,Vim Script,https://github.com/vim-latex/vim-latex
384,vim-disapprove-deep-indentation,561,10,561,1,05/03/2017,25/06/2019,237.00 KB,237,ಠ_ಠ Vim plugin to disapprove deeply indented code. ಠ_ಠ,Vim script,https://github.com/dodie/vim-disapprove-deep-indentation
385,vim-cool,558,24,558,6,12/04/2016,19/02/2025,52.00 KB,52,A very simple plugin that makes hlsearch more useful.,Vim Script,https://github.com/romainl/vim-cool
386,vim-ripgrep,555,99,555,35,25/09/2016,04/04/2023,12.00 KB,12,Use RipGrep in Vim and display results in a quickfix list,Vim script,https://github.com/jremmen/vim-ripgrep
387,vimrc,555,168,555,1,01/06/2010,07/02/2025,2.22 MB,2276,"My personal Neovim configuration, with a lot of love put into it.",Vim Script,https://github.com/nvie/vimrc
388,bullets.vim,554,42,554,46,12/02/2016,24/05/2025,1.87 MB,1918,🔫 Bullets.vim is a Vim/NeoVim plugin for automated bullet lists.,Vim Script,https://github.com/bullets-vim/bullets.vim
389,vim-godot,549,25,549,7,26/04/2020,12/11/2024,861.00 KB,861,Use vim and godot engine to make games,Vim Script,https://github.com/habamax/vim-godot
390,vim-hybrid-material,548,45,548,2,24/06/2015,16/06/2020,198.00 KB,198,Material color scheme for Vim based on w0ng/vim-hybrid color scheme,Vim script,https://github.com/kristijanhusak/vim-hybrid-material
391,dotfiles,547,20,547,1,26/04/2015,26/06/2021,68.07 MB,69705,🍙 dotfiles,Vim script,https://github.com/dylanaraps/dotfiles
392,dotvim,547,131,547,0,19/01/2010,25/06/2016,1.65 MB,1687,"An attempt at The Ultimate Vim Configuration™ with focus on Rails development. DEPRECATED, SEE https://github.com/vitaly/dotvim2",VimL,https://github.com/astrails/dotvim
393,zig.vim,541,63,541,29,13/04/2017,20/07/2025,114.00 KB,114,Vim configuration for Zig,Vim Script,https://github.com/ziglang/zig.vim
394,vim-as-a-python-ide,541,202,541,0,06/06/2012,24/08/2014,1.61 MB,1649,Example code from my PyCon APAC 2012 talk.,VimL,https://github.com/mbrochh/vim-as-a-python-ide
395,vim-mario,540,6,540,0,03/08/2014,28/01/2020,248.00 KB,248,Mario on Vim,Vim script,https://github.com/rbtnn/vim-mario
396,snipmate-snippets,537,240,537,11,18/02/2009,07/10/2011,415.00 KB,415,A collection of snippets for snipmate,VimL,https://github.com/scrooloose/snipmate-snippets
397,vim-iced,533,35,533,21,27/07/2018,23/02/2025,3.37 MB,3455,Clojure Interactive Development Environment for Vim8/Neovim,Vim Script,https://github.com/liquidz/vim-iced
398,vim-gruvbox8,533,49,533,2,22/01/2018,04/06/2025,583.00 KB,583,A simplified and optimized Gruvbox colorscheme for Vim,Vim Script,https://github.com/lifepillar/vim-gruvbox8
399,bufexplorer,532,98,532,16,09/10/2013,19/08/2025,308.00 KB,308,BufExplorer Plugin for Vim,Vim Script,https://github.com/jlanzarotta/bufexplorer
400,conflict-marker.vim,529,18,529,9,11/10/2013,20/05/2024,93.00 KB,93,Weapon to fight against conflicts in Vim.,Vim Script,https://github.com/rhysd/conflict-marker.vim
401,vim-translator,528,50,528,17,24/04/2019,25/05/2023,337.00 KB,337,:closed_book: Translating plugin for Vim/Neovim,Vim Script,https://github.com/voldikss/vim-translator
402,SpaceCamp,527,19,527,0,01/06/2019,25/08/2023,2.55 MB,2611,🔭 Vim colors for the final frontier,Vim Script,https://github.com/jaredgorski/SpaceCamp
403,augment.vim,526,42,526,32,10/12/2024,14/08/2025,612.00 KB,612,AI-augmented development in Vim and Neovim,Vim Script,https://github.com/augmentcode/augment.vim
404,vim-taskwarrior,526,40,526,42,01/09/2013,22/05/2019,367.00 KB,367,vim interface for taskwarrior,VimL,https://github.com/blindFS/vim-taskwarrior
405,vim-lion,525,17,525,3,16/03/2013,09/06/2022,34.00 KB,34,A simple alignment operator for Vim text editor,Vim script,https://github.com/tommcdo/vim-lion
406,vim-chat,524,85,524,2,19/11/2016,05/03/2025,71.00 KB,71,:purple_heart: Chatting client for neovim/vim8,Vim Script,https://github.com/wsdjeg/vim-chat
407,vim-flow,524,48,524,27,30/10/2014,13/08/2019,69.00 KB,69,A vim plugin for Flow,Vim script,https://github.com/flow/vim-flow
408,vim-ruby-refactoring,522,52,522,12,09/10/2010,01/07/2020,129.00 KB,129,Refactoring tool for Ruby in vim!,VimL,https://github.com/ecomba/vim-ruby-refactoring
409,open-browser.vim,521,48,521,27,19/06/2010,14/04/2023,691.00 KB,691,Open URI with your favorite browser from your most favorite editor,Vim Script,https://github.com/tyru/open-browser.vim
410,shougo-s-github,519,58,519,0,14/01/2009,17/08/2025,3.51 MB,3594,"Shougo's git repository - vim, zsh, screen, etc...",Vim Script,https://github.com/Shougo/shougo-s-github
411,NeoSolarized,518,98,518,8,26/09/2016,28/05/2023,164.00 KB,164,NeoSolarized: A fixed solarized colorscheme for better truecolor support.,Vim script,https://github.com/overcache/NeoSolarized
412,tmux-complete.vim,518,21,518,14,16/03/2014,12/08/2022,99.00 KB,99,Vim plugin for insert mode completion of words in adjacent tmux panes,Vim script,https://github.com/wellle/tmux-complete.vim
413,riv.vim,516,86,516,34,17/05/2012,19/03/2024,3.41 MB,3490,Notes and Wiki with rst.,Vim Script,https://github.com/gu-fan/riv.vim
414,rigel,516,37,516,10,03/07/2019,11/01/2024,287.00 KB,287,"🌌 Colorscheme for vim, terminal, vscode and slack - based on the star Rigel ✨.",Vim Script,https://github.com/Rigellute/rigel
415,autoconfig-mac-vimrc,515,125,515,7,13/04/2016,21/04/2016,35.00 KB,35,autoconfig mac vimrc with bundle,VimL,https://github.com/barretlee/autoconfig-mac-vimrc
416,killersheep,514,18,514,1,12/12/2019,18/10/2023,875.00 KB,875,Silly game for Vim 8.2,Vim Script,https://github.com/vim/killersheep
417,VimOrganizer,514,65,514,42,09/11/2010,15/12/2020,799.00 KB,799,"VimOrganizer is partly a clone of Emacs' Org-mode, and partly a front end to Org-mode itself.  Do Org in Vim.",Vim script,https://github.com/hsitz/VimOrganizer
418,vim-maximizer,513,18,513,7,21/11/2012,10/03/2022,167.00 KB,167,Maximizes and restores the current window in Vim.,VimL,https://github.com/szw/vim-maximizer
419,vim-delve,509,24,509,13,06/07/2017,13/12/2022,8.69 MB,8895,Neovim / Vim integration for Delve,Vim Script,https://github.com/sebdah/vim-delve
420,Running-LinuxKernel,507,184,507,8,29/10/2016,11/09/2019,76.41 MB,78242,奔跑吧linux内核,Vim script,https://github.com/figozhang/Running-LinuxKernel
421,vim-graphql,507,25,507,0,31/12/2015,25/05/2025,172.00 KB,172,"A Vim plugin that provides GraphQL file detection, syntax highlighting, and indentation.",Vim Script,https://github.com/jparise/vim-graphql
422,neural,504,21,504,18,21/12/2022,22/07/2025,304.00 KB,304,"AI Vim/Neovim code generation plugin (OpenAI, ChatGPT, and more)",Vim Script,https://github.com/dense-analysis/neural
423,night-owl.vim,504,41,504,9,21/06/2018,08/05/2021,87.00 KB,87,A 24bit dark Vim colorscheme based on sdras/night-owl-vscode-theme,Vim script,https://github.com/haishanh/night-owl.vim
424,vim-puppet,504,136,504,11,27/12/2010,15/09/2024,203.00 KB,203,Puppet niceties for your Vim setup,Vim Script,https://github.com/rodjek/vim-puppet
425,vim-autoclose,503,65,503,42,21/12/2008,26/02/2019,373.00 KB,373,"This plugin for Vim enable an auto-close chars feature for you. For instance if you type an '(', ``autoclose`` will automatically insert a ')' and put the cursor between than.",VimL,https://github.com/Townk/vim-autoclose
426,vim-bufferline,497,46,497,25,29/03/2013,30/01/2020,68.00 KB,68,super simple vim plugin to show the list of buffers in the command bar,VimL,https://github.com/bling/vim-bufferline
427,vim-perl,497,122,497,89,16/02/2009,09/03/2024,2.81 MB,2879,Support for Perl 5 in Vim,Vim Script,https://github.com/vim-perl/vim-perl
428,todo.txt-vim,497,126,497,29,31/05/2011,27/03/2024,94.00 KB,94,Vim plugin for Todo.txt,Vim Script,https://github.com/freitass/todo.txt-vim
429,vim-buffergator,497,48,497,54,06/06/2011,28/11/2021,248.00 KB,248,"Vim plugin to list, select and switch between buffers.",Vim script,https://github.com/jeetsukumaran/vim-buffergator
430,vim-bracketed-paste,492,29,492,14,07/04/2013,06/03/2024,21.00 KB,21,Handles bracketed-paste-mode in vim (aka. automatic `:set paste`),Vim Script,https://github.com/ConradIrwin/vim-bracketed-paste
431,vim-solidity,491,323,491,22,07/03/2015,03/05/2021,26.00 KB,26,Vim syntax file for solidity,Vim script,https://github.com/tomlion/vim-solidity
432,plantuml-syntax,490,75,490,9,03/04/2011,25/08/2024,151.00 KB,151,vim syntax file for plantuml,Vim Script,https://github.com/aklt/plantuml-syntax
433,vim-livedown,490,19,490,10,23/11/2014,19/03/2020,10.00 KB,10,Vim plugin for Livedown.,Vim script,https://github.com/shime/vim-livedown
434,semantic-highlight.vim,487,33,487,21,14/07/2014,31/10/2023,253.00 KB,253,Semantic Highlighting for Vim,Vim script,https://github.com/jaxbot/semantic-highlight.vim
435,vim-localvimrc,487,28,487,2,06/07/2011,25/10/2024,445.00 KB,445,"Search local vimrc files ("".lvimrc"") in the tree (root dir up to current dir) and load them.",Vim Script,https://github.com/embear/vim-localvimrc
436,vim-xkbswitch,487,22,487,16,01/04/2013,17/09/2024,258.00 KB,258,vim plugin for automatic keyboard layout switching in insert mode,Vim Script,https://github.com/lyokha/vim-xkbswitch
437,mkdx,486,13,486,3,06/11/2017,16/10/2023,26.55 MB,27186,A vim plugin that adds some nice extra's for working with markdown documents,Vim Script,https://github.com/SidOfc/mkdx
438,vim-github-dashboard,485,23,485,4,23/06/2013,27/01/2022,642.00 KB,642,:octocat: Browse GitHub events in Vim,Vim script,https://github.com/junegunn/vim-github-dashboard
439,linediff.vim,485,24,485,4,11/08/2011,22/04/2024,109.00 KB,109,A vim plugin to perform diffs on blocks of code,Vim Script,https://github.com/AndrewRadev/linediff.vim
440,ivim,477,99,477,2,20/01/2012,11/08/2021,5.75 MB,5889,"I love Vim, and I also love modifying it to be more convenient and efficient. So I name it ""ivim""! Welcome to contribute to ivim.",Vim script,https://github.com/kepbod/ivim
441,Alduin,475,25,475,9,28/01/2016,31/08/2022,9.56 MB,9792,A Vim Colorscheme,Vim script,https://github.com/AlessandroYorba/Alduin
442,lens.vim,474,15,474,25,22/02/2020,30/05/2021,18.00 KB,18,A Vim Automatic Window Resizing Plugin,Vim script,https://github.com/camspiers/lens.vim
443,vim-monokai,473,137,473,0,04/09/2014,26/01/2025,4.93 MB,5052,"Refined Monokai color scheme for vim, inspired by Sublime Text",Vim Script,https://github.com/crusoexia/vim-monokai
444,dotfiles,471,49,471,2,18/03/2010,04/05/2017,2.13 MB,2179,My dotfiles. Mainly customisations for Vim and Bash.,Vim script,https://github.com/nelstrom/dotfiles
445,vlime,471,33,471,38,26/12/2016,18/05/2025,1.08 MB,1105,A Common Lisp dev environment for Vim (and Neovim),Vim Script,https://github.com/vlime/vlime
446,vim-ide,469,92,469,7,01/08/2013,06/10/2018,83.36 MB,85360,VIM configured as powerful IDE (Integrated Development Environment),Vim script,https://github.com/DamZiobro/vim-ide
447,vim-workspace,468,29,468,25,25/12/2016,29/05/2023,5.21 MB,5340,📑 Automated Vim session management with file auto-save and persistent undo history,Vim Script,https://github.com/thaerkh/vim-workspace
448,vim-windowswap,468,10,468,5,24/09/2013,23/10/2019,14.00 KB,14,Swap your windows without ruining your layout,Vim script,https://github.com/wesQ3/vim-windowswap
449,vim-seek,467,20,467,8,26/01/2013,05/10/2014,280.00 KB,280,"Seek makes navigating long lines effortless, acting like f but taking two characters.",VimL,https://github.com/goldfeld/vim-seek
450,vim-pizza,467,10,467,1,01/12/2017,16/10/2022,29.00 KB,29,My initial attempt at trying to order pizza from within vim.,Vim script,https://github.com/arithran/vim-pizza
451,vim-auto-save,466,36,466,13,12/11/2012,08/08/2022,54.00 KB,54,A Vim plugin which saves files to disk automatically.,Vim script,https://github.com/907th/vim-auto-save
452,vim-es6,465,18,465,9,13/02/2015,15/12/2019,6.60 MB,6763,List of JavaScript ES6 snippets and syntax highlighting for vim.,Vim script,https://github.com/isRuslan/vim-es6
453,terminus,464,25,464,13,06/07/2015,24/01/2025,2.77 MB,2835,🖥 Enhanced terminal integration for Vim,Vim Script,https://github.com/wincent/terminus
454,vim-two-firewatch,463,42,463,12,02/07/2016,14/11/2021,270.00 KB,270,A blend between duotone light and firewatch for atom,VimL,https://github.com/rakr/vim-two-firewatch
455,unicode.vim,461,27,461,3,19/04/2010,05/05/2025,782.00 KB,782,A Vim plugin that provides a completion function for Unicode glyphs,Vim Script,https://github.com/chrisbra/unicode.vim
456,vim-slumlord,460,35,460,14,08/08/2016,22/08/2021,13.41 MB,13735,Inline previews for Plantuml sequence diagrams. OMG!,Vim script,https://github.com/scrooloose/vim-slumlord
457,vim-jsdoc,457,44,457,1,17/01/2013,23/05/2023,2.90 MB,2974,Generate JSDoc to your JavaScript code.,Vim Script,https://github.com/heavenshell/vim-jsdoc
458,vim,457,19,457,3,23/12/2017,24/10/2018,369.00 KB,369,320+ color themes for VIM.,Vim script,https://github.com/rainglow/vim
459,vim-godebug,454,21,454,8,06/02/2017,22/03/2022,232.00 KB,232,Go debugging for Vim ,Vim script,https://github.com/jodosha/vim-godebug
