Ranking,Project Name,Stars,Forks,Watchers,Open Issues,Created At,Last Commit,Size (KB),Description,Language,Repo URL
1,shellcheck,37142,1800,37142,1110,2012-11-17T03:15:11Z,2024-12-14T05:42:11Z,5382,"ShellCheck, a static analysis tool for shell scripts",Haskell,https://github.com/koalaman/shellcheck
2,pandoc,36593,3470,36593,1112,2010-03-20T20:34:23Z,2025-03-28T05:04:09Z,66908,Universal markup converter,Haskell,https://github.com/jgm/pandoc
3,postgrest,25042,1071,25042,310,2014-06-13T00:23:00Z,2025-03-28T09:53:35Z,12409,REST API for any Postgres database,Haskell,https://github.com/PostgREST/postgrest
4,hadolint,10796,438,10796,231,2015-11-15T20:20:58Z,2025-03-24T08:35:52Z,3882,"Dockerfile linter, validate inline bash, written in Haskell",Haskell,https://github.com/hadolint/hadolint
5,semantic,9027,453,9027,116,2019-03-15T14:54:00Z,2024-07-24T03:56:04Z,34508,"Parsing, analyzing, and comparing source code across many languages",Haskell,https://github.com/github/semantic
6,purescript,8678,566,8678,305,2013-09-30T05:29:23Z,2025-02-20T15:16:21Z,13682,A strongly-typed language that compiles to JavaScript,Haskell,https://github.com/purescript/purescript
7,compiler,7617,659,7617,344,2012-04-19T06:24:43Z,2024-07-17T21:53:51Z,9877,"Compiler for Elm, a functional language for reliable webapps.",Haskell,https://github.com/elm/compiler
8,unison,5960,274,5960,1136,2015-05-06T14:53:49Z,2025-03-28T04:38:43Z,131968,A friendly programming language from the future,Haskell,https://github.com/unisonweb/unison
9,Carp,5632,173,5632,146,2016-01-11T12:54:09Z,2024-11-26T10:58:51Z,11981,"A statically typed lisp, without a GC, for real-time applications.",Haskell,https://github.com/carp-lang/Carp
10,ihp,5022,202,5022,267,2017-12-03T18:45:14Z,2025-03-26T19:26:55Z,55949,🔥 The fastest way to build type safe web apps. IHP is a new batteries-included web framework optimized for longterm productivity and programmer happiness,Haskell,https://github.com/digitallyinduced/ihp
11,kmonad,4365,329,4365,202,2019-09-28T17:54:41Z,2025-03-25T10:20:50Z,1497,An advanced keyboard manager,Haskell,https://github.com/kmonad/kmonad
12,Haxl,4295,311,4295,6,2014-04-02T20:10:58Z,2024-11-19T13:29:04Z,783,"A Haskell library that simplifies access to remote data, such as databases or web-based services. ",Haskell,https://github.com/facebook/Haxl
13,fp-course,4172,1196,4172,17,2013-01-03T00:13:31Z,2024-12-02T00:31:53Z,4257,Functional Programming Course,Haskell,https://github.com/system-f/fp-course
14,duckling,4134,728,4134,137,2017-03-02T01:45:50Z,2025-02-22T01:17:27Z,7572,"Language, engine, and tooling for expressing, testing, and evaluating composable language rules on input strings.",Haskell,https://github.com/facebook/duckling
15,stack,4015,849,4015,587,2015-04-29T20:56:42Z,2025-03-22T20:22:55Z,26968,The Haskell Tool Stack,Haskell,https://github.com/commercialhaskell/stack
16,cardano-sl,3772,629,3772,188,2016-10-14T13:44:38Z,2020-07-30T15:22:04Z,119915,Cryptographic currency implementing Ouroboros PoS protocol,Haskell,https://github.com/input-output-hk/cardano-sl
17,Kind,3649,145,3649,6,2018-07-13T03:08:55Z,2025-01-22T16:54:12Z,36229,A modern proof language,Haskell,https://github.com/HigherOrderCO/Kind
18,koka,3465,177,3465,187,2016-12-08T23:00:37Z,2025-03-25T17:41:57Z,47446,Koka language compiler and interpreter,Haskell,https://github.com/koka-lang/koka
19,Idris-dev,3449,640,3449,709,2011-09-14T16:55:49Z,2025-02-17T14:08:47Z,38281,A Dependently Typed Functional Programming Language,Haskell,https://github.com/idris-lang/Idris-dev
20,xmonad,3431,295,3431,58,2015-08-22T15:58:45Z,2025-03-22T05:40:40Z,5697,"The core of xmonad, a small but functional ICCCM-compliant tiling window manager",Haskell,https://github.com/xmonad/xmonad
21,write-you-a-haskell,3370,256,3370,30,2015-01-05T13:44:54Z,2021-01-11T13:56:03Z,961,Building a modern functional compiler from first principles. (http://dev.stephendiehl.com/fun/),Haskell,https://github.com/sdiehl/write-you-a-haskell
22,hledger,3208,323,3208,367,2013-04-08T16:41:47Z,2025-03-13T21:53:27Z,105938,"Robust, fast, intuitive plain text accounting tool with CLI, TUI and web interfaces.",Haskell,https://github.com/simonmichael/hledger
23,awesome-haskell,3137,173,3137,15,2014-07-13T14:08:56Z,2023-04-13T20:54:30Z,172,"A collection of awesome Haskell links, frameworks, libraries and software. Inspired by awesome projects line.",Haskell,https://github.com/krispo/awesome-haskell
24,cardano-node,3114,728,3114,332,2019-05-23T20:12:22Z,2025-03-28T13:02:18Z,114383,The core component that is used to participate in a Cardano decentralised blockchain.,Haskell,https://github.com/IntersectMBO/cardano-node
25,ghc,3113,713,3113,8,2011-04-02T19:39:34Z,2025-03-28T14:34:47Z,481181,Mirror of the Glasgow Haskell Compiler. Please submit issues and patches to GHC's Gitlab instance (https://gitlab.haskell.org/ghc/ghc). First time contributors are encouraged to get started with the newcomers info (https://gitlab.haskell.org/ghc/ghc/wikis/contributing).,Haskell,https://github.com/ghc/ghc
26,Simula,3042,96,3042,68,2017-04-13T11:35:42Z,2024-12-14T22:46:21Z,216312,Linux VR Desktop,Haskell,https://github.com/SimulaVR/Simula
27,echidna,2852,387,2852,147,2017-08-27T23:13:10Z,2025-03-10T22:34:34Z,2506,Ethereum smart contract fuzzer,Haskell,https://github.com/crytic/echidna
28,xdg-ninja,2783,154,2783,30,2022-05-12T13:35:20Z,2025-03-09T22:18:24Z,641,A shell script which checks your $HOME for unwanted files and directories.,Haskell,https://github.com/b3nj5m1n/xdg-ninja
29,haskell-language-server,2775,381,2775,529,2020-01-25T14:19:39Z,2025-03-27T14:28:21Z,24529,Official haskell ide support via language server (LSP). Successor of ghcide & haskell-ide-engine.,Haskell,https://github.com/haskell/haskell-language-server
30,hakyll,2740,412,2740,117,2009-12-02T12:45:28Z,2025-03-23T14:05:31Z,18777,A static website compiler library in Haskell,Haskell,https://github.com/jaspervdj/hakyll
31,Functional-Programming,2693,158,2693,9,2015-02-10T15:07:42Z,2019-08-06T22:00:55Z,10279,"Functional Programming concepts, examples and patterns illustrated in Haskell, Ocaml and Python",Haskell,https://github.com/caiorss/Functional-Programming
32,yesod,2667,372,2667,119,2009-06-27T22:54:51Z,2025-03-21T18:16:29Z,9241,A RESTful Haskell web framework built on WAI.,Haskell,https://github.com/yesodweb/yesod
33,wire-server,2663,324,2663,136,2017-02-14T10:42:59Z,2025-03-28T14:31:23Z,71548,🇪🇺 Wire back-end services,Haskell,https://github.com/wireapp/wire-server
34,eta,2617,140,2617,242,2016-04-07T11:25:02Z,2022-07-31T17:14:19Z,11304,"The Eta Programming Language, a dialect of Haskell on the JVM",Haskell,https://github.com/typelead/eta
35,ghcjs,2611,186,2611,293,2010-08-19T16:32:40Z,2023-01-21T23:46:36Z,6831,"Haskell to JavaScript compiler, based on GHC",Haskell,https://github.com/ghcjs/ghcjs
36,agda,2602,367,2602,1048,2015-08-08T17:51:48Z,2025-03-28T13:48:01Z,152067,Agda is a dependently typed programming language / interactive theorem prover.,Haskell,https://github.com/agda/agda
37,wiwinwlh,2581,241,2581,8,2014-03-31T00:33:36Z,2022-02-25T06:38:14Z,10083,What I Wish I Knew When Learning Haskell,Haskell,https://github.com/sdiehl/wiwinwlh
38,patat,2546,62,2546,18,2016-09-23T09:37:28Z,2025-03-24T17:24:34Z,965,Terminal-based presentations using Pandoc,Haskell,https://github.com/jaspervdj/patat
39,futhark,2494,173,2494,71,2013-02-01T15:07:26Z,2025-03-28T09:09:23Z,51743,:boom::computer::boom: A data-parallel functional programming language,Haskell,https://github.com/diku-dk/futhark
40,Tidal,2385,264,2385,107,2010-09-09T11:00:10Z,2025-03-09T21:22:10Z,14571,Pattern language,Haskell,https://github.com/tidalcycles/Tidal
41,haskell-ide-engine,2374,206,2374,301,2015-10-22T06:59:33Z,2020-12-23T06:21:46Z,6794,The engine for haskell ide-integration. Not an IDE,Haskell,https://github.com/haskell/haskell-ide-engine
42,miso,2237,141,2237,7,2016-06-26T04:28:54Z,2025-03-28T08:48:25Z,1981,:ramen: A tasty Haskell front-end framework,Haskell,https://github.com/dmjio/miso
43,gitit,2191,224,2191,207,2008-11-07T07:38:49Z,2025-01-13T20:03:24Z,2226,"A wiki using HAppS, pandoc, and git",Haskell,https://github.com/jgm/gitit
44,corrode,2167,114,2167,79,2016-05-05T21:12:52Z,2019-03-10T01:48:47Z,725,C to Rust translator,Haskell,https://github.com/jameysharp/corrode
45,dapptools,2120,325,2120,171,2018-06-12T12:34:20Z,2025-02-25T19:28:22Z,8864,"Dapp, Seth, Hevm, and more",Haskell,https://github.com/dapphub/dapptools
46,lens,2049,275,2049,106,2012-07-25T22:00:42Z,2025-03-04T12:07:05Z,28727,"Lenses, Folds, and Traversals - Join us on web.libera.chat #haskell-lens",Haskell,https://github.com/ekmett/lens
47,asterius,1967,58,1967,137,2017-11-20T13:18:05Z,2022-11-14T00:45:01Z,92407,"DEPRECATED in favor of ghc wasm backend, see https://www.tweag.io/blog/2022-11-22-wasm-backend-merged-in-ghc",Haskell,https://github.com/tweag/asterius
48,lamdu,1865,74,1865,26,2011-10-20T21:13:43Z,2025-03-20T16:42:09Z,32668,lamdu - towards the next generation IDE,Haskell,https://github.com/lamdu/lamdu
49,servant,1863,415,1863,293,2014-12-02T15:58:17Z,2025-03-18T13:41:54Z,7424,"Servant is a Haskell DSL for describing, serving, querying, mocking, documenting web applications and more!",Haskell,https://github.com/haskell-servant/servant
50,erd,1824,152,1824,18,2013-10-26T17:12:42Z,2024-09-09T12:30:17Z,309,Translates a plain text description of a relational database schema to a graphical entity-relationship diagram.,Haskell,https://github.com/BurntSushi/erd
51,aura,1808,115,1808,50,2012-05-14T11:56:22Z,2025-01-04T07:45:01Z,15087,A multilingual package manager for Arch Linux and the AUR.,Haskell,https://github.com/fosskers/aura
52,taskell,1747,73,1747,54,2017-11-15T15:02:14Z,2023-10-03T06:57:40Z,3649,Command-line Kanban board/task manager with support for Trello boards and GitHub projects,Haskell,https://github.com/smallhadroncollider/taskell
53,scotty,1739,136,1739,33,2011-12-30T22:43:27Z,2025-02-23T11:31:38Z,755,"Haskell web framework inspired by Ruby's Sinatra, using WAI and Warp (Official Repository)",Haskell,https://github.com/scotty-web/scotty
54,zsh-git-prompt,1737,398,1737,58,2010-04-29T18:05:24Z,2023-11-08T03:54:12Z,1105,Informative git prompt for zsh,Haskell,https://github.com/olivierverdier/zsh-git-prompt
55,niv,1692,77,1692,91,2019-01-17T21:00:18Z,2025-03-02T23:46:25Z,587,Easy dependency management for Nix projects,Haskell,https://github.com/nmattia/niv
56,cabal,1656,707,1656,1880,2012-03-15T12:53:38Z,2025-03-28T13:45:00Z,55532,Official upstream development repository for Cabal and cabal-install,Haskell,https://github.com/haskell/cabal
57,HLearn,1627,133,1627,23,2012-07-18T00:08:33Z,2016-05-29T16:51:53Z,17533,Homomorphic machine learning,Haskell,https://github.com/mikeizbicki/HLearn
58,brick,1626,167,1626,4,2015-05-09T08:23:44Z,2025-03-12T17:00:15Z,2996,A declarative Unix terminal UI library written in Haskell,Haskell,https://github.com/jtdaugherty/brick
59,dex-lang,1609,109,1609,141,2019-10-25T12:33:24Z,2025-01-25T03:31:39Z,36176,Research language for array processing in the Haskell/ML family,Haskell,https://github.com/google-research/dex-lang
60,plutus,1591,486,1591,220,2016-11-15T22:38:43Z,2025-03-28T13:47:28Z,318799,The Plutus language implementation and tools,Haskell,https://github.com/IntersectMBO/plutus
61,haskell,1591,198,1591,39,2016-10-16T03:40:47Z,2024-08-15T15:09:36Z,10161,Haskell bindings for TensorFlow,Haskell,https://github.com/tensorflow/haskell
62,real-world-haskell-cn,1568,231,1568,26,2012-10-19T16:07:47Z,2022-02-14T13:35:16Z,11410,《Real World Haskell》中文翻译项目,Haskell,https://github.com/huangzworks/real-world-haskell-cn
63,neuron,1524,148,1524,25,2020-03-05T01:29:54Z,2023-05-22T16:29:04Z,29920,Future-proof note-taking and publishing based on Zettelkasten (superseded by Emanote: https://github.com/srid/emanote),Haskell,https://github.com/srid/neuron
64,yi,1518,201,1518,221,2011-02-06T21:16:54Z,2024-11-01T13:05:53Z,34634,The Haskell-Scriptable Editor,Haskell,https://github.com/yi-editor/yi
65,hlint,1504,199,1504,273,2013-07-23T08:43:40Z,2025-03-28T10:25:48Z,6224,Haskell source code suggestions,Haskell,https://github.com/ndmitchell/hlint
66,clash-compiler,1483,156,1483,349,2013-07-04T09:29:15Z,2025-03-26T20:54:02Z,20509,Haskell to VHDL/Verilog/SystemVerilog compiler,Haskell,https://github.com/clash-lang/clash-compiler
67,grenade,1451,83,1451,24,2016-06-23T12:04:52Z,2023-12-08T21:23:07Z,357,Deep Learning in Haskell,Haskell,https://github.com/HuwCampbell/grenade
68,haste-compiler,1442,111,1442,63,2012-01-26T10:23:30Z,2019-03-17T10:49:58Z,4176,A GHC-based Haskell to JavaScript compiler,Haskell,https://github.com/valderman/haste-compiler
69,haskell-trainings,1405,109,1405,4,2019-01-23T10:10:14Z,2023-04-10T00:27:48Z,688,Haskell 101 and 102: slides and codelabs,Haskell,https://github.com/google/haskell-trainings
70,greenclip,1401,35,1401,8,2017-01-03T22:43:14Z,2025-03-22T21:05:18Z,3600,Simple clipboard manager to be integrated with rofi - Static binary available,Haskell,https://github.com/erebe/greenclip
71,course-plan,1388,58,1388,0,2021-12-19T16:24:32Z,2023-07-09T14:01:05Z,122,"📜 Haskell course info, plan, video lectures, slides",Haskell,https://github.com/haskell-beginners-2022/course-plan
72,gifcurry,1385,56,1385,40,2016-01-13T05:37:43Z,2021-08-13T16:19:41Z,86715,"😎 The open-source, Haskell-built video editor for GIF makers.",Haskell,https://github.com/lettier/gifcurry
73,plutus-pioneer-program,1384,997,1384,5,2021-03-30T19:29:22Z,2025-02-22T17:07:57Z,147511,"This repository hosts the lectures of the Plutus Pioneers Program. This program is a training course that the IOG Education Team provides to recruit and train software developers in Plutus, the native smart contract language for the Cardano ecosystem.",Haskell,https://github.com/input-output-hk/plutus-pioneer-program
74,fossa-cli,1345,178,1345,68,2018-01-10T18:30:32Z,2025-03-27T20:51:30Z,119429,"Fast, portable and reliable dependency analysis for any codebase.  Supports license & vulnerability scanning for large monoliths.  Language-agnostic; integrates with 20+ build systems.",Haskell,https://github.com/fossas/fossa-cli
75,elm-format,1318,148,1318,228,2015-09-13T00:09:34Z,2023-04-13T18:43:21Z,4031,elm-format formats Elm source code according to a standard set of rules based on the official Elm Style Guide,Haskell,https://github.com/avh4/elm-format
76,fay,1283,89,1283,24,2012-07-21T15:26:38Z,2021-06-09T15:10:00Z,2630,A proper subset of Haskell that compiles to JavaScript,Haskell,https://github.com/faylang/fay
77,Publications,1274,38,1274,4,2014-12-08T10:14:19Z,2025-01-10T12:21:23Z,43313,"Misc. publications, conference slides, etc. For more, go to http://BartoszMilewski.com",Haskell,https://github.com/BartoszMilewski/Publications
78,aeson,1268,323,1268,83,2011-01-21T21:24:26Z,2025-03-27T18:36:58Z,41327,A fast Haskell JSON library,Haskell,https://github.com/haskell/aeson
79,articles,1259,92,1259,0,2013-02-07T18:52:10Z,2023-07-12T09:28:11Z,8466,Miscellaneous articles. The readme is the table of contents.,Haskell,https://github.com/quchen/articles
80,codeworld,1251,198,1251,445,2014-06-19T21:56:15Z,2025-03-26T22:25:29Z,7550,Educational computer programming environment using Haskell,Haskell,https://github.com/google/codeworld
81,liquidhaskell,1230,145,1230,444,2012-09-22T15:06:55Z,2025-03-22T20:10:13Z,60400,Liquid Types For Haskell,Haskell,https://github.com/ucsd-progsys/liquidhaskell
82,developers-roadmap,1212,262,1212,61,2019-03-31T10:40:35Z,2025-03-14T11:13:25Z,983,How to learn front-end or back-end development,Haskell,https://github.com/fullstack-development/developers-roadmap
83,ghcid,1151,113,1151,121,2014-09-26T22:01:52Z,2024-03-01T13:09:46Z,972,Very low feature GHCi based IDE,Haskell,https://github.com/ndmitchell/ghcid
84,cryptol,1150,123,1150,242,2014-04-17T22:29:10Z,2025-03-27T11:58:43Z,87220,Cryptol: The Language of Cryptography,Haskell,https://github.com/GaloisInc/cryptol
85,reanimate,1143,62,1143,30,2019-02-13T20:08:04Z,2025-02-06T18:32:33Z,7972,Haskell library for building declarative animations based on SVG graphics,Haskell,https://github.com/reanimate/reanimate
86,haskell-must-watch,1136,59,1136,0,2015-03-04T13:56:54Z,2017-10-17T13:24:26Z,14,"Huge list of  videos, talks, courses for Haskell programming language.",Haskell,https://github.com/hzlmn/haskell-must-watch
87,kitten,1115,40,1115,69,2011-12-20T04:17:17Z,2023-04-10T00:10:33Z,2914,A statically typed concatenative systems programming language.,Haskell,https://github.com/evincarofautumn/kitten
88,hasktorch,1105,111,1105,89,2017-09-09T21:50:59Z,2025-02-16T05:30:20Z,14020,Tensors and neural networks in Haskell,Haskell,https://github.com/hasktorch/hasktorch
89,software-design-in-haskell,1095,69,1095,4,2019-12-18T15:25:35Z,2024-12-18T11:27:13Z,349,Software Design in Haskell. A structured set of materials. How to build real-world applications in Haskell.,Haskell,https://github.com/graninas/software-design-in-haskell
90,reflex,1083,150,1083,92,2014-11-09T20:27:01Z,2025-03-09T22:54:46Z,2378,"Interactive programs without callbacks or side-effects. Functional Reactive Programming (FRP) uses composable events and time-varying values to describe interactive systems as pure functions. Just like other pure functional code, functional reactive code is easier to get right on the first try, maintain, and reuse.",Haskell,https://github.com/reflex-frp/reflex
91,queryparser,1079,145,1079,23,2017-04-13T04:51:29Z,2022-02-16T11:16:33Z,410,"Parsing and analysis of Vertica, Hive, and Presto SQL.",Haskell,https://github.com/uber/queryparser
92,nixfmt,1071,48,1071,27,2018-08-02T12:33:51Z,2025-03-18T16:20:42Z,1022,The official (but not yet stable) formatter for Nix code,Haskell,https://github.com/NixOS/nixfmt
93,matterhorn,1067,78,1067,20,2016-08-19T16:25:54Z,2025-03-24T18:42:11Z,8183,A feature-rich Unix terminal client for the Mattermost chat system,Haskell,https://github.com/matterhorn-chat/matterhorn
94,nix-output-monitor,1059,30,1059,76,2020-10-03T14:25:34Z,2025-03-07T12:23:07Z,9300,Pipe your nix-build output through the nix-output-monitor a.k.a nom to get additional information while building.,Haskell,https://github.com/maralorn/nix-output-monitor
95,HaLVM,1057,79,1057,37,2012-03-29T22:39:16Z,2018-12-06T17:24:40Z,4182,The Haskell Lightweight Virtual Machine (HaLVM): GHC running on Xen,Haskell,https://github.com/GaloisInc/HaLVM
96,polysemy,1041,74,1041,44,2019-02-13T20:53:25Z,2025-03-15T12:15:30Z,1148,":gemini: higher-order, no-boilerplate monads",Haskell,https://github.com/polysemy-research/polysemy
97,kaleidoscope,1038,129,1038,9,2013-12-28T05:12:52Z,2020-04-21T09:09:58Z,531,Haskell LLVM JIT Compiler Tutorial,Haskell,https://github.com/sdiehl/kaleidoscope
98,grin,1037,38,1037,31,2017-06-23T20:18:06Z,2023-04-28T14:15:23Z,22867,GRIN is a compiler back-end for lazy and strict functional languages with whole program optimization support.,Haskell,https://github.com/grin-compiler/grin
99,fp-course,1031,133,1031,18,2011-06-30T12:40:12Z,2023-03-06T02:28:36Z,3501,Functional Programming Course,Haskell,https://github.com/tonymorris/fp-course
100,linux_notification_center,1028,40,1028,42,2017-04-12T19:24:01Z,2025-02-06T11:12:49Z,235435,A notification daemon/center for linux,Haskell,https://github.com/phuhl/linux_notification_center
101,kit,1023,30,1023,20,2018-08-03T22:22:58Z,2021-08-14T01:21:10Z,1764,"Kit: a magical, high performance programming language, designed for game development.",Haskell,https://github.com/kitlang/kit
102,learn4haskell,1022,849,1022,35,2020-09-26T09:44:33Z,2024-06-28T18:49:09Z,945,👩‍🏫 👨‍🏫 Learn Haskell basics in 4 pull requests,Haskell,https://github.com/kowainik/learn4haskell
103,intero,1008,135,1008,30,2014-10-19T16:29:25Z,2020-01-25T08:48:39Z,2317,,Haskell,https://github.com/chrisdone-archive/intero
104,stylish-haskell,1004,151,1004,138,2012-05-14T09:42:11Z,2025-01-19T06:41:46Z,1228,Haskell code prettifier,Haskell,https://github.com/haskell/stylish-haskell
105,LtuPatternFactory,999,38,999,11,2018-10-05T19:32:13Z,2024-01-17T23:42:42Z,602,"Lambda the ultimate Pattern Factory: FP, Haskell, Typeclassopedia vs Software Design Patterns",Haskell,https://github.com/thma/LtuPatternFactory
106,neut,993,13,993,0,2020-04-26T02:23:12Z,2025-03-14T10:03:03Z,33434,A programming language with static memory management based on λ-calculus,Haskell,https://github.com/vekatze/neut
107,bsc,989,153,989,211,2020-01-31T22:01:29Z,2025-03-06T02:53:08Z,40004,Bluespec Compiler (BSC),Haskell,https://github.com/B-Lang-org/bsc
108,obelisk,988,108,988,183,2018-05-23T01:53:32Z,2025-03-18T11:13:53Z,19546,"Functional reactive web and mobile applications, with batteries included.",Haskell,https://github.com/obsidiansystems/obelisk
109,ormolu,987,83,987,65,2018-11-25T12:16:23Z,2025-03-12T12:40:08Z,3516,A formatter for Haskell source code,Haskell,https://github.com/tweag/ormolu
110,toodles,977,33,977,14,2018-09-21T23:49:17Z,2023-04-18T21:04:04Z,439,Project management directly from the TODOs in your codebase,Haskell,https://github.com/aviaviavi/toodles
111,leksah,976,110,976,229,2011-02-14T22:17:54Z,2024-05-01T15:56:06Z,26001,Haskell IDE,Haskell,https://github.com/leksah/leksah
112,pandoc-crossref,976,77,976,89,2015-03-19T20:51:47Z,2025-03-23T21:38:22Z,2910,Pandoc filter for cross-references,Haskell,https://github.com/lierdakil/pandoc-crossref
113,turtle,950,90,950,43,2015-01-18T02:53:20Z,2024-05-23T15:37:10Z,910,"Shell programming, Haskell style",Haskell,https://github.com/Gabriella439/turtle
114,megaparsec,940,90,940,20,2015-07-26T19:33:53Z,2025-01-31T14:08:11Z,2617,Industrial-strength monadic parser combinator library,Haskell,https://github.com/mrkkrp/megaparsec
115,optparse-applicative,925,117,925,37,2012-05-11T17:09:52Z,2025-03-27T22:38:09Z,1020,Applicative option parser,Haskell,https://github.com/pcapriotti/optparse-applicative
116,tetris,922,41,922,9,2017-06-13T03:48:49Z,2025-02-27T18:29:33Z,417,A terminal interface for Tetris,Haskell,https://github.com/samtay/tetris
117,egison,918,31,918,22,2013-02-15T04:35:21Z,2022-12-22T23:19:05Z,8911,The Egison Programming Language,Haskell,https://github.com/egison/egison
118,project-m36,918,47,918,89,2014-10-27T00:17:22Z,2025-03-08T01:56:48Z,7207,Project: M36 Relational Algebra Engine,Haskell,https://github.com/agentm/project-m36
119,accelerate,914,122,914,62,2011-04-08T02:50:11Z,2025-01-13T21:00:16Z,16146,Embedded language for high-performance array computations,Haskell,https://github.com/AccelerateHS/accelerate
120,radicle-alpha,914,32,914,45,2018-05-17T08:50:33Z,2020-03-26T14:58:12Z,2568,A peer-to-peer stack for code collaboration,Haskell,https://github.com/radicle-dev/radicle-alpha
121,conduit,911,195,911,50,2011-12-11T04:55:45Z,2025-03-16T07:41:18Z,4166,A streaming data library,Haskell,https://github.com/snoyberg/conduit
122,detexify-hs-backend,899,40,899,1,2010-11-10T08:38:30Z,2016-12-26T21:00:50Z,18506,Detexify Backend written in Haskell,Haskell,https://github.com/kirel/detexify-hs-backend
123,streamly,886,66,886,451,2017-07-13T13:31:39Z,2025-03-26T23:12:10Z,17976,"High performance, concurrent functional programming abstractions",Haskell,https://github.com/composewell/streamly
124,cachix,884,48,884,123,2018-02-25T19:55:01Z,2025-03-15T13:42:29Z,3560,Command line client for Nix binary cache hosting:,Haskell,https://github.com/cachix/cachix
125,bench,883,21,883,10,2016-03-20T06:35:02Z,2024-12-20T04:27:30Z,61,Command-line benchmark tool,Haskell,https://github.com/Gabriella439/bench
126,parsec,865,97,865,48,2014-03-23T20:46:26Z,2025-01-05T00:08:42Z,469,A monadic parser combinator library,Haskell,https://github.com/haskell/parsec
127,swarm,860,54,860,266,2021-08-23T16:47:47Z,2025-03-28T13:51:49Z,10831,Resource gathering + programming game,Haskell,https://github.com/swarm-game/swarm
128,emanote,857,73,857,69,2021-05-09T15:21:59Z,2025-03-23T20:33:24Z,6558,Emanate a structured view of your plain-text notes,Haskell,https://github.com/srid/emanote
129,unused,854,24,854,1,2016-04-28T09:37:11Z,2020-05-28T02:48:16Z,272,Deprecated; see https://github.com/unused-code/unused,Haskell,https://github.com/joshuaclayton/unused
130,waymonad,853,39,853,16,2017-09-15T07:49:55Z,2019-07-13T18:57:40Z,1737,A wayland compositor based on ideas from and inspired by xmonad,Haskell,https://github.com/waymonad/waymonad
131,wai,848,264,848,67,2010-01-17T15:44:09Z,2025-03-17T01:08:31Z,4983,Haskell Web Application Interface,Haskell,https://github.com/yesodweb/wai
132,rio,848,54,848,38,2017-12-30T16:36:57Z,2024-08-08T07:08:50Z,527,A standard library for Haskell,Haskell,https://github.com/commercialhaskell/rio
133,nix-tree,826,17,826,14,2020-06-24T22:41:51Z,2025-02-28T03:33:43Z,269,Interactively browse dependency graphs of Nix derivations.,Haskell,https://github.com/utdemir/nix-tree
134,espial,826,29,826,17,2018-04-10T00:17:07Z,2024-12-30T21:06:59Z,30399," Espial is an open-source, web-based bookmarking server.",Haskell,https://github.com/jonschoning/espial
135,Rome,822,57,822,35,2016-08-08T13:47:49Z,2023-01-25T03:26:12Z,1025,"Carthage cache for S3, Minio, Ceph, Google Storage, Artifactory and many others ",Haskell,https://github.com/tmspzz/Rome
136,cardano-wallet,793,223,793,17,2019-03-01T10:50:58Z,2025-03-28T08:41:00Z,288690,HTTP server & command-line for managing UTxOs and HD wallets in Cardano.,Haskell,https://github.com/cardano-foundation/cardano-wallet
137,shake,779,120,779,199,2013-02-25T20:10:28Z,2025-02-02T21:45:37Z,9366,Shake build system,Haskell,https://github.com/ndmitchell/shake
138,hspec,766,104,766,46,2011-02-09T22:00:08Z,2025-03-17T01:47:57Z,4995,A Testing Framework for Haskell,Haskell,https://github.com/hspec/hspec
139,hoogle,763,143,763,167,2012-04-19T13:23:16Z,2025-03-23T17:52:06Z,6120,Haskell API search engine,Haskell,https://github.com/ndmitchell/hoogle
140,tip-toi-reveng,762,127,762,42,2013-04-14T17:16:18Z,2024-10-28T12:04:50Z,17176,Trying to understand the file format of Tip Toi,Haskell,https://github.com/entropia/tip-toi-reveng
