Ranking,Project Name,Stars,Forks,Watchers,Open Issues,Created At,Last Commit,Size (KB),Description,Language,Repo URL
567,graphmod,183,30,183,12,2008-09-08T23:08:05Z,2024-07-04T05:43:13Z,549,A utility for displaying the module dependencies of Haskell programs.,Haskell,https://github.com/yav/graphmod
568,gtk2hs,183,87,183,126,2013-10-15T03:24:39Z,2025-03-20T08:33:25Z,62124,GUI library for Haskell based on GTK+,Haskell,https://github.com/gtk2hs/gtk2hs
569,lex-pass,182,23,182,0,2009-05-05T09:05:07Z,2014-05-15T16:49:55Z,510,manipulate a php codebase using haskell to transform the abstract-syntax-tree,Haskell,https://github.com/facebookarchive/lex-pass
570,geordi,182,38,182,2,2010-03-10T22:39:03Z,2022-10-05T22:16:35Z,1979,IRC C++ eval bot,Haskell,https://github.com/Eelis/geordi
571,floskell,181,24,181,18,2017-06-21T09:08:39Z,2024-07-13T14:56:24Z,2207,Floskell is a flexible Haskell source code pretty printer.,Haskell,https://github.com/ennocramer/floskell
572,pdf-toolbox,181,26,181,12,2013-02-13T21:35:47Z,2024-05-29T18:41:25Z,582,A collection of tools for processing PDF files in Haskell,Haskell,https://github.com/Yuras/pdf-toolbox
573,gitlib,181,56,181,21,2012-12-18T10:29:16Z,2025-03-18T16:06:09Z,7061,,Haskell,https://github.com/jwiegley/gitlib
574,auto,181,11,181,1,2014-06-28T23:40:14Z,2019-06-28T22:08:19Z,3325,"Haskell DSL and platform providing denotational, compositional api for discrete-step, locally stateful, interactive programs, games & automations.  http://hackage.haskell.org/package/auto",Haskell,https://github.com/mstksg/auto
575,stripe,180,74,180,23,2014-04-25T18:50:35Z,2024-12-14T00:05:41Z,736,:moneybag: Stripe API,Haskell,https://github.com/dmjio/stripe
576,universum,180,28,180,38,2016-07-25T10:55:02Z,2025-01-16T17:34:12Z,914,:milky_way: Prelude written in @Serokell,Haskell,https://github.com/serokell/universum
577,hledger-flow,180,24,180,22,2018-08-07T20:23:13Z,2024-04-13T04:56:47Z,1069,An hledger/ledger-cli workflow focusing on automated statement import and classification,Haskell,https://github.com/apauley/hledger-flow
578,esqueleto,180,49,180,43,2012-09-03T12:18:53Z,2016-11-10T07:29:21Z,801,"Bare bones, type-safe EDSL for SQL queries on persistent backends.",Haskell,https://github.com/prowdsponsor/esqueleto
579,HTTP,179,59,179,18,2010-10-31T11:33:10Z,2025-01-05T18:05:02Z,600,Haskell HTTP package,Haskell,https://github.com/haskell/HTTP
580,HVM3,179,17,179,13,2024-11-07T00:01:23Z,2025-03-27T13:54:05Z,508,HVM3,Haskell,https://github.com/HigherOrderCO/HVM3
581,scion,179,43,179,13,2008-10-09T13:48:59Z,2013-03-15T12:55:28Z,1182,"OLD, DEPRECATED: Use this instead https://github.com/haskell/haskell-ide-engine",Haskell,https://github.com/nominolo/scion
582,haskell-dangerous-functions,179,14,179,0,2021-03-13T15:29:42Z,2025-02-26T11:42:06Z,85,Documentation about Haskell's dangerous functions and a hlint config file to warn about them,Haskell,https://github.com/NorfairKing/haskell-dangerous-functions
583,nix-serve-ng,178,17,178,8,2022-07-06T23:42:29Z,2024-12-02T14:12:47Z,71,A drop-in replacement for nix-serve that is faster and more reliable,Haskell,https://github.com/aristanetworks/nix-serve-ng
584,android-lint-summary,178,12,178,3,2015-05-22T13:14:31Z,2017-12-09T22:27:23Z,851,Prettier display of Android Lint issues,Haskell,https://github.com/passy/android-lint-summary
585,lobster-challenge,178,58,178,3,2021-09-10T08:21:15Z,2021-11-18T13:59:23Z,327,Simple Plutus contract to help give Charles' stuffed lobster a name,Haskell,https://github.com/input-output-hk/lobster-challenge
586,shortcut-highlighter,178,2,178,4,2019-03-18T12:34:45Z,2021-04-26T04:12:45Z,27,set of tools and services for highlighting shortcuts from applications and system with RGB keyboard,Haskell,https://github.com/Rasie1/shortcut-highlighter
587,groundhog,178,39,178,24,2011-06-22T07:37:46Z,2024-07-26T07:40:26Z,4493,"This library maps datatypes to a relational model, in a way similar to what ORM libraries do in OOP. See the tutorial https://www.schoolofhaskell.com/user/lykahb/groundhog for introduction",Haskell,https://github.com/lykahb/groundhog
588,learn-physics,178,16,178,1,2015-11-07T23:04:41Z,2023-01-12T19:08:55Z,93,"A library of functions for vector calculus, calculation of electric field, electric flux, magnetic field, and other quantities in mechanics and electromagnetic theory.",Haskell,https://github.com/walck/learn-physics
589,nixos-manager,177,7,177,8,2020-03-12T14:58:18Z,2020-05-02T06:04:27Z,1957,"Manage your NixOS packages and configuration via a simple, intuitive UI",Haskell,https://github.com/pmiddend/nixos-manager
590,elm-make,176,45,176,29,2014-09-25T18:00:52Z,2018-08-22T20:02:16Z,218,A build tool for Elm projects,Haskell,https://github.com/elm-lang/elm-make
591,inspection-testing,175,28,175,10,2017-11-04T15:16:10Z,2025-01-01T19:37:47Z,247,Inspection Testing for Haskell,Haskell,https://github.com/nomeata/inspection-testing
592,godot-haskell,175,17,175,13,2018-02-20T16:57:54Z,2024-07-08T05:14:40Z,5658,Haskell bindings for GdNative,Haskell,https://github.com/SimulaVR/godot-haskell
593,ditto,174,5,174,0,2015-08-02T05:11:35Z,2018-07-12T13:00:17Z,331,A Super Kawaii Dependently Typed Programming Language,Haskell,https://github.com/ditto/ditto
594,HaskellSpriteKit,174,8,174,14,2016-08-07T08:18:44Z,2020-12-16T15:54:44Z,4788,Haskell binding to Apple's SpriteKit framework,Haskell,https://github.com/mchakravarty/HaskellSpriteKit
595,spectacle,174,12,174,8,2021-03-18T17:16:51Z,2023-01-13T17:38:50Z,516,Embedded specification language & model checker in Haskell,Haskell,https://github.com/awakesecurity/spectacle
596,extensible-effects,174,25,174,5,2013-11-19T16:37:38Z,2021-01-18T19:31:45Z,979,Extensible Effects: An Alternative to Monad Transformers,Haskell,https://github.com/suhailshergill/extensible-effects
597,nix-deploy,174,10,174,4,2017-11-13T22:40:33Z,2022-06-21T23:14:21Z,43,Deploy software or an entire NixOS system configuration to another NixOS system,Haskell,https://github.com/awakesecurity/nix-deploy
598,ddc,174,19,174,1,2012-09-24T09:11:06Z,2019-02-06T03:00:24Z,51786,The Disco Discus Compiler,Haskell,https://github.com/discus-lang/ddc
599,unit-test-example,173,15,173,0,2012-12-05T05:38:51Z,2024-01-31T00:48:41Z,72,Unit test example for Haskell,Haskell,https://github.com/kazu-yamamoto/unit-test-example
600,propagators,172,25,172,8,2015-09-20T02:08:45Z,2024-04-01T18:39:40Z,169,The Art of the Propagator. See also:,Haskell,https://github.com/ekmett/propagators
601,compiler,172,1,172,16,2018-12-31T08:05:24Z,2019-05-12T03:36:44Z,781,The compiler for Keli,Haskell,https://github.com/KeliLanguage/compiler
602,pursuit,172,47,172,76,2014-08-04T04:57:54Z,2024-09-03T21:46:42Z,1364,Website for hosting and searching PureScript API documentation,Haskell,https://github.com/purescript/pursuit
603,idris-php,172,14,172,1,2015-03-03T22:52:45Z,2017-08-04T12:23:59Z,23,"Yes, really...",Haskell,https://github.com/edwinb/idris-php
604,codex,172,33,172,16,2014-04-23T22:51:47Z,2021-06-20T17:05:27Z,239,A ctags file generator for cabal/stack project dependencies.,Haskell,https://github.com/aloiscochard/codex
605,mongodb,172,47,172,31,2014-06-04T20:49:48Z,2024-06-14T16:10:14Z,943,MongoDB driver for Haskell,Haskell,https://github.com/mongodb-haskell/mongodb
606,ghc-hotswap,172,8,172,2,2017-09-19T20:52:31Z,2018-09-24T20:34:23Z,13,Example code for how we swap compiled code within a running Haskell process.,Haskell,https://github.com/fbsamples/ghc-hotswap
607,hdevtools,171,41,171,26,2012-07-19T16:21:14Z,2019-08-10T10:38:12Z,47,REPO UNMAINTAINED!!! Try this: https://github.com/hdevtools/hdevtools/,Haskell,https://github.com/bitc/hdevtools
608,free,171,67,171,46,2011-02-17T19:18:14Z,2025-03-03T10:16:23Z,1072,free monads,Haskell,https://github.com/ekmett/free
609,Awesome-list-of-Haskell-mentors,171,16,171,0,2018-07-29T14:07:16Z,2022-08-31T07:20:51Z,59,An amazing list of Haskell developers who would like to mentor beginner-contributors in open source projects.,Haskell,https://github.com/willbasky/Awesome-list-of-Haskell-mentors
610,blackstar,171,13,171,0,2016-02-19T16:33:39Z,2021-11-09T19:38:05Z,47752,A black hole raytracer written in Haskell,Haskell,https://github.com/flannelhead/blackstar
611,cxxdraft-htmlgen,171,15,171,6,2015-04-08T16:31:00Z,2025-03-27T16:43:10Z,1201,Generates https://eel.is/c++draft,Haskell,https://github.com/Eelis/cxxdraft-htmlgen
612,weeder,171,30,171,38,2019-09-10T09:23:38Z,2025-03-04T17:22:51Z,270,A re-implementation of weeder using HIE files,Haskell,https://github.com/ocharles/weeder
613,registry,170,12,170,0,2018-08-07T09:54:27Z,2025-03-07T09:13:49Z,725,Components as records of functions for Haskell,Haskell,https://github.com/etorreborre/registry
614,caledon,170,9,170,2,2012-11-16T05:02:35Z,2018-08-07T09:47:20Z,2599,higher order dependently typed logic programing,Haskell,https://github.com/mmirman/caledon
615,higgledy,170,21,170,5,2019-04-07T21:28:19Z,2024-08-20T15:15:34Z,115,Higher-kinded data via generics,Haskell,https://github.com/i-am-tom/higgledy
616,finkel,170,2,170,4,2020-01-14T09:28:46Z,2024-11-18T21:51:16Z,22615,Haskell in S-expression,Haskell,https://github.com/finkel-lang/finkel
617,codec-beam,170,6,170,1,2017-04-29T23:20:33Z,2024-11-19T16:49:23Z,258,Generate Erlang VM byte code from Haskell,Haskell,https://github.com/kofigumbs/codec-beam
618,elm-repl,170,34,170,55,2013-10-30T14:53:20Z,2018-08-22T20:27:21Z,175,A REPL for Elm,Haskell,https://github.com/elm-lang/elm-repl
619,cql,169,15,169,44,2018-07-12T20:00:47Z,2023-04-14T09:31:36Z,631,CQL: Categorical Query Language implementation in Haskell,Haskell,https://github.com/statebox/cql
620,graphql-haskell,169,27,169,6,2015-09-12T10:56:19Z,2019-06-11T04:34:32Z,323,Haskell GraphQL implementation,Haskell,https://github.com/jdnavarro/graphql-haskell
621,haskellings,169,23,169,9,2020-11-03T21:48:56Z,2023-05-10T03:02:26Z,243,An automated tutorial to teach you about Haskell!,Haskell,https://github.com/MondayMorningHaskell/haskellings
622,haskell-yesod-realworld-example-app,169,26,169,0,2018-07-11T22:51:16Z,2021-12-09T12:00:22Z,378,Exemplary real world application built with Haskell + Yesod,Haskell,https://github.com/tzemanovic/haskell-yesod-realworld-example-app
623,legacy-old-hercules,168,16,168,25,2016-10-20T20:56:56Z,2018-10-03T09:33:55Z,217,Abandoned,Haskell,https://github.com/hercules-ci/legacy-old-hercules
624,estuary,167,26,167,21,2015-12-03T15:12:56Z,2024-11-20T21:38:07Z,19511,Platform for collaboration and learning through live coding,Haskell,https://github.com/dktr0/estuary
625,holbert,167,7,167,1,2020-09-08T12:57:39Z,2024-11-21T04:43:28Z,11421,A graphical interactive proof assistant designed for education,Haskell,https://github.com/liamoc/holbert
626,dhc,166,12,166,2,2017-11-01T23:03:53Z,2019-03-04T21:30:47Z,385,Compiles Haskell to WebAssembly,Haskell,https://github.com/dfinity-side-projects/dhc
627,shentong,166,10,166,1,2014-12-11T04:02:52Z,2018-04-05T20:12:35Z,1040,A Haskell implementation of the Shen programming language.,Haskell,https://github.com/mthom/shentong
628,foldl,166,52,166,21,2013-08-05T00:22:18Z,2025-01-16T02:57:52Z,324,"Composable, streaming, and efficient left folds",Haskell,https://github.com/Gabriella439/foldl
629,deli,166,9,166,3,2017-10-12T20:12:14Z,2020-12-16T15:50:07Z,50,,Haskell,https://github.com/github/deli
630,proofsweeper,166,3,166,1,2017-12-29T01:31:37Z,2024-09-25T22:34:56Z,30,Play Minesweeper by formally proving your moves in Idris,Haskell,https://github.com/A1kmm/proofsweeper
631,HaskellStarter,165,18,165,2,2014-02-25T03:09:18Z,2014-10-05T16:36:49Z,539,A project that demonstrates getting up and running with Haskell.,Haskell,https://github.com/joshcough/HaskellStarter
632,AoPL,165,36,165,4,2013-01-29T23:51:47Z,2021-03-05T01:03:38Z,16333,"A book on programming languages, using Haskell",Haskell,https://github.com/w7cook/AoPL
633,lambdabot,165,70,165,39,2012-03-17T00:15:23Z,2025-01-08T15:44:29Z,15297,"A friendly IRC bot and apprentice coder, written in Haskell.",Haskell,https://github.com/lambdabot/lambdabot
634,oama,164,13,164,4,2022-06-07T23:38:47Z,2025-03-17T21:44:39Z,253,OAuth credential Manager,Haskell,https://github.com/pdobsan/oama
635,learn-haskell,164,8,164,0,2016-01-27T22:01:03Z,2016-03-03T00:18:12Z,6642,,Haskell,https://github.com/nushio3/learn-haskell
636,accelerate-llvm,164,54,164,15,2014-02-21T03:26:03Z,2024-09-14T18:47:42Z,3847,LLVM backend for Accelerate,Haskell,https://github.com/AccelerateHS/accelerate-llvm
637,styx,164,16,164,9,2016-11-14T19:00:58Z,2021-08-11T09:46:39Z,41,A nix-based Haskell project manager,Haskell,https://github.com/jyp/styx
638,cradle,164,12,164,2,2010-01-11T08:28:25Z,2020-02-26T23:38:52Z,2527,Let's Build a Compiler (in Haskell),Haskell,https://github.com/g-ford/cradle
639,yaml,164,77,164,11,2009-07-27T18:52:01Z,2024-08-15T04:28:37Z,717,Support for serialising Haskell to and from Yaml.,Haskell,https://github.com/snoyberg/yaml
640,servant-elm,164,48,164,10,2015-10-22T20:50:32Z,2024-01-14T23:22:31Z,298,Automatically derive Elm functions to query servant webservices,Haskell,https://github.com/haskell-servant/servant-elm
641,citeproc,164,19,164,22,2020-09-06T23:09:00Z,2025-03-28T05:08:01Z,1401,CSL citation processing library in Haskell,Haskell,https://github.com/jgm/citeproc
642,stratosphere,163,19,163,3,2016-03-27T16:06:24Z,2024-12-11T22:54:10Z,18090,Haskell EDSL and type-checker for AWS CloudFormation templates,Haskell,https://github.com/mbj/stratosphere
643,tiny-games-hs,163,31,163,2,2023-02-07T11:19:15Z,2023-08-31T19:38:00Z,14440,Haskell Tiny Game Jam,Haskell,https://github.com/haskell-game/tiny-games-hs
644,zero-to-quake-3,163,7,163,4,2018-08-27T16:31:56Z,2020-04-29T01:36:00Z,80,Implementing Quake 3 in Haskell & Vulkan,Haskell,https://github.com/ocharles/zero-to-quake-3
645,riscv-semantics,163,17,163,11,2017-09-08T00:25:39Z,2023-08-13T00:03:11Z,630,A formal semantics of the RISC-V ISA in Haskell,Haskell,https://github.com/mit-plv/riscv-semantics
646,hask,162,15,162,1,2014-06-23T13:54:30Z,2021-03-23T04:15:01Z,1066,"Category theory for Haskell with a lens flavor (you need GHC 7.8.3, not 7.8.2 to build this!)",Haskell,https://github.com/ekmett/hask
647,coda,162,14,162,5,2017-08-20T09:20:14Z,2024-04-10T06:04:55Z,2824,A language experiment -- irc.freenode.net ##coda,Haskell,https://github.com/ekmett/coda
648,irc-core,162,28,162,15,2015-03-01T01:46:34Z,2025-01-30T20:23:28Z,6388,Haskell IRC library and console client - Join us on libera.chat #glirc,Haskell,https://github.com/glguy/irc-core
649,generics-sop,162,48,162,40,2014-06-27T20:58:23Z,2025-01-04T21:20:17Z,690,Generic Programming using True Sums of Products,Haskell,https://github.com/well-typed/generics-sop
650,streaming,162,29,162,37,2017-09-13T01:12:03Z,2024-02-05T20:45:02Z,611,"An optimized general monad transformer for streaming applications, with a simple prelude of functions",Haskell,https://github.com/haskell-streaming/streaming
651,haskell-game-programming,161,7,161,10,2015-09-23T10:36:40Z,2019-10-22T03:45:09Z,103843,"A central repository of Haskell Game Programming resources, put together by Keera Studios",Haskell,https://github.com/keera-studios/haskell-game-programming
652,ghc-lib,161,9,161,4,2019-01-09T19:54:31Z,2025-03-21T10:13:29Z,986,"The GHC API, decoupled from GHC versions",Haskell,https://github.com/digital-asset/ghc-lib
653,validity,160,31,160,4,2016-07-10T13:11:41Z,2025-02-24T20:27:20Z,1514,Validity and validity-based testing,Haskell,https://github.com/NorfairKing/validity
654,GPipe-Core,160,29,160,20,2012-04-12T19:37:48Z,2023-09-12T19:24:27Z,523,"Core library of new GPipe, encapsulating OpenGl and providing a type safe minimal library",Haskell,https://github.com/tobbebex/GPipe-Core
655,logger,160,67,160,16,2011-12-22T02:47:40Z,2024-10-31T03:21:11Z,543,A fast logging system for Haskell,Haskell,https://github.com/kazu-yamamoto/logger
656,scarf,160,9,160,2,2019-02-24T05:19:27Z,2021-06-10T21:27:00Z,679,An environment manager and development tool powered by Nomia.,Haskell,https://github.com/scarf-sh/scarf
657,language-javascript,160,47,160,24,2010-11-21T19:29:30Z,2023-03-07T01:38:33Z,1137,"Parser for JavaScript, in Haskell",Haskell,https://github.com/erikd/language-javascript
658,gressgraph,160,22,160,3,2012-05-06T17:02:52Z,2020-06-15T17:20:42Z,52,visualize your iptables firewall,Haskell,https://github.com/jekor/gressgraph
659,ChessPositionRanking,160,7,160,0,2021-07-19T13:41:33Z,2023-11-21T22:26:16Z,119169,Software suite for ranking chess positions and accurately estimating the number of legal chess positions,Haskell,https://github.com/tromp/ChessPositionRanking
660,servant-auth,159,72,159,45,2016-09-05T13:35:46Z,2021-10-29T13:04:57Z,456,,Haskell,https://github.com/haskell-servant/servant-auth
661,curl-runnings,159,13,159,15,2018-02-28T18:04:50Z,2023-06-25T21:43:04Z,218,A declarative test framework for quickly and easily writing integration tests against JSON APIs.,Haskell,https://github.com/aviaviavi/curl-runnings
662,open-game-engine,159,28,159,9,2019-12-05T19:43:43Z,2025-01-31T14:52:16Z,6553,Haskell implementation of open games,Haskell,https://github.com/CyberCat-Institute/open-game-engine
663,haskell-tree-sitter,159,51,159,17,2017-01-30T20:39:52Z,2024-09-23T21:51:27Z,1647,Haskell bindings for tree-sitter,Haskell,https://github.com/tree-sitter/haskell-tree-sitter
664,haskell-exercises,158,49,158,1,2014-09-22T09:31:51Z,2021-08-09T10:30:17Z,98,Haskell exercises with automatic tests,Haskell,https://github.com/opqdonut/haskell-exercises
665,zephyr,158,16,158,10,2017-08-19T10:47:35Z,2023-04-25T07:29:41Z,417,Tree shaking breeze for PureScript CoreFn AST,Haskell,https://github.com/MaybeJustJames/zephyr
666,rel8,158,40,158,50,2017-02-13T09:53:51Z,2025-03-11T13:02:41Z,2567,Hey! Hey! Can u rel8?,Haskell,https://github.com/circuithub/rel8
667,twitter-conduit,158,48,158,1,2011-07-18T17:34:50Z,2021-12-14T17:59:26Z,797,"Twitter API package for Haskell, including enumerator interfaces and Streaming API supports.",Haskell,https://github.com/himura/twitter-conduit
668,hierarchical-free-monads-the-most-developed-approach-in-haskell,157,9,157,0,2020-05-05T06:31:09Z,2021-07-22T14:02:02Z,1255,"Big article about Hierarchical Free Monads, the most developed approach to build real software in Haskell",Haskell,https://github.com/graninas/hierarchical-free-monads-the-most-developed-approach-in-haskell
669,tiny-optimising-compiler,157,6,157,0,2017-07-02T09:42:08Z,2019-08-28T15:01:09Z,1237,A tiny *optimising* compiler for an imperative programming language written in haskell,Haskell,https://github.com/bollu/tiny-optimising-compiler
670,blip,157,6,157,13,2013-03-27T11:08:30Z,2020-07-30T09:29:01Z,483,A bytecode compiler for Python 3,Haskell,https://github.com/bjpop/blip
671,flatparse,157,13,157,11,2021-03-01T16:35:27Z,2025-01-04T16:37:52Z,459,Fast parsing from bytestrings,Haskell,https://github.com/AndrasKovacs/flatparse
672,what4,157,13,157,53,2020-02-25T23:38:15Z,2025-03-28T12:24:20Z,6998,Symbolic formula representation and solver interaction library,Haskell,https://github.com/GaloisInc/what4
673,nix-linter,156,16,156,24,2018-10-02T18:35:00Z,2023-02-27T05:56:07Z,446,Linter for the Nix expression language,Haskell,https://github.com/Synthetica9/nix-linter
674,glancer,156,12,156,1,2021-01-04T23:33:23Z,2023-08-27T09:09:31Z,3415,Glance over some technical videos,Haskell,https://github.com/rberenguel/glancer
675,cardano-addresses,156,50,156,8,2020-02-21T09:04:23Z,2025-03-03T05:51:31Z,85091,Addresses and mnemonic manipulation & derivations,Haskell,https://github.com/IntersectMBO/cardano-addresses
676,mono-traversable,156,67,156,48,2013-09-09T07:38:09Z,2025-03-27T16:20:54Z,1570,"Type classes for mapping, folding, and traversing monomorphic containers",Haskell,https://github.com/snoyberg/mono-traversable
677,TypedFlow,156,13,156,4,2017-07-31T08:54:31Z,2022-07-01T07:47:29Z,837,Typed frontend to TensorFlow and higher-order deep learning,Haskell,https://github.com/GU-CLASP/TypedFlow
678,kalyn,156,3,156,20,2020-03-22T00:03:52Z,2022-07-02T21:48:02Z,10042,"⚗️ Self-hosting compiler from a Haskell-like Lisp directly to x86-64, from scratch.",Haskell,https://github.com/radian-software/kalyn
679,ThreadScope,155,35,155,35,2011-08-26T20:27:13Z,2025-03-27T12:01:46Z,47579,A graphical tool for profiling parallel Haskell programs,Haskell,https://github.com/haskell/ThreadScope
680,toysolver,155,11,155,3,2011-06-12T02:38:42Z,2025-02-28T14:35:33Z,7831,My sandbox for experimenting with solver algorithms.,Haskell,https://github.com/msakai/toysolver
681,haskell-opencv,155,44,155,22,2016-05-19T12:55:02Z,2023-09-29T14:27:51Z,45926,Haskell binding to OpenCV-3.x,Haskell,https://github.com/LumiGuide/haskell-opencv
682,ComonadSheet,155,11,155,4,2013-11-26T13:57:08Z,2021-03-03T05:18:56Z,1177,"A library for expressing ""spreadsheet-like"" computations with absolute and relative references, using fixed-points of n-dimensional comonads.",Haskell,https://github.com/plaidfinch/ComonadSheet
683,Haskell-OpenGL-Tutorial,154,14,154,0,2013-12-09T21:57:52Z,2024-05-19T15:33:50Z,32268,an attempt to create a concise modern Haskell OpenGL boilerplate with basic IO,Haskell,https://github.com/madjestic/Haskell-OpenGL-Tutorial
684,grpc-haskell,153,16,153,8,2016-11-16T18:16:07Z,2018-08-31T12:15:37Z,149,gRPC library binding for Haskell.,Haskell,https://github.com/grpc/grpc-haskell
685,apply-refact,153,29,153,30,2015-06-29T20:42:31Z,2025-01-29T23:41:53Z,587,Refactor Haskell source files,Haskell,https://github.com/mpickering/apply-refact
686,haskell-wasm,153,24,153,7,2018-01-19T00:06:15Z,2025-01-18T03:19:33Z,1031,Haskell WebAssembly Toolkit,Haskell,https://github.com/SPY/haskell-wasm
687,dataflow,152,17,152,1,2015-05-08T07:40:58Z,2019-09-04T18:59:35Z,971,Render graphs using a declarative markup.,Haskell,https://github.com/sonyxperiadev/dataflow
688,arithmoi,152,41,152,19,2015-03-28T03:45:13Z,2025-03-01T16:58:34Z,2464,"Number theory: primes, arithmetic functions, modular computations, special sequences",Haskell,https://github.com/Bodigrim/arithmoi
689,rattletrap,152,21,152,5,2016-09-28T22:01:59Z,2025-03-17T01:34:13Z,81095,:car: Parse and generate Rocket League replays.,Haskell,https://github.com/tfausak/rattletrap
690,rfc,152,11,152,0,2016-09-02T10:31:40Z,2024-08-31T07:10:59Z,45528,My slides and compilation of resources.,Haskell,https://github.com/soupi/rfc
691,elm-beam,152,5,152,0,2018-10-06T18:57:25Z,2018-10-09T02:23:35Z,2914,Exploring Elm on the Erlang VM,Haskell,https://github.com/kofigumbs/elm-beam
692,hsthrift,152,36,152,7,2020-09-17T16:29:02Z,2025-03-27T23:20:23Z,5098,The Haskell Thrift Compiler. This is an implementation of the Thrift spec that generates code in Haskell. It depends on the fbthrift project for the implementation of the underlying transport.,Haskell,https://github.com/facebookincubator/hsthrift
693,swift-haskell-tutorial,151,12,151,3,2017-02-09T05:51:48Z,2017-02-26T03:22:47Z,471,Integrating Haskell with Swift Mac Apps,Haskell,https://github.com/nanotech/swift-haskell-tutorial
694,lorem-markdownum,151,7,151,2,2013-11-11T13:28:36Z,2025-01-20T16:53:14Z,351,A lorem ipsum generator for markdown,Haskell,https://github.com/jaspervdj/lorem-markdownum
695,envy,151,26,151,6,2015-06-26T02:17:19Z,2024-12-10T03:29:06Z,122,:angry: Environmentally friendly environment variables,Haskell,https://github.com/dmjio/envy
696,Jikka,151,12,151,36,2019-07-04T08:18:43Z,2021-09-29T17:44:46Z,80840,an automated solver for problems of competitive programming,Haskell,https://github.com/kmyk-jikka/Jikka
697,awesome-open-science,151,15,151,0,2014-09-15T23:27:17Z,2017-10-31T20:45:51Z,20,"some links to projects/tools related to ""open science"".",Haskell,https://github.com/silky/awesome-open-science
698,OpenGL,151,27,151,27,2011-04-07T02:08:01Z,2024-07-07T08:51:05Z,2111,Haskell bindings to OpenGL,Haskell,https://github.com/haskell-opengl/OpenGL
699,AIT,151,15,151,0,2013-03-27T19:27:05Z,2025-03-27T17:28:36Z,499,"Algorithmic Information Theory, using Binary Lambda Calculus",Haskell,https://github.com/tromp/AIT
700,digestive-functors,150,68,150,48,2010-10-02T12:01:57Z,2025-02-04T02:19:39Z,781,A general way to consume input using applicative functors,Haskell,https://github.com/jaspervdj/digestive-functors
701,texts,150,33,150,0,2015-02-11T08:48:05Z,2015-02-11T09:08:01Z,346804,,Haskell,https://github.com/Mzk-Levi/texts
702,hamilton,150,11,150,3,2016-11-22T10:03:48Z,2024-09-08T03:50:54Z,303,Simulate physics on generalized coordinate systems using Hamiltonian Mechanics and automatic differentiation.  Don't throw away your shot.,Haskell,https://github.com/mstksg/hamilton
703,hode,150,4,150,11,2018-12-07T01:33:48Z,2021-06-03T18:57:11Z,2844,"rslt, take five-ish",Haskell,https://github.com/JeffreyBenjaminBrown/hode
704,unliftio,150,49,150,27,2017-07-12T15:12:15Z,2025-03-10T08:58:21Z,384,The MonadUnliftIO typeclass for unlifting monads to IO,Haskell,https://github.com/fpco/unliftio
705,haskellweekly,150,54,150,0,2019-07-12T22:02:44Z,2025-03-27T09:59:45Z,4365,Publishes curated news about the Haskell programming language.,Haskell,https://github.com/haskellweekly/haskellweekly
706,generative-art,150,7,150,5,2018-10-26T15:14:33Z,2025-01-13T18:14:38Z,10130,"I wanted to make a nicer sticker for Munihac, then things got out of hand.",Haskell,https://github.com/quchen/generative-art
707,Drasil,150,26,150,389,2014-09-07T13:44:04Z,2025-03-27T14:09:18Z,851126,Generate all the things (focusing on research software),Haskell,https://github.com/JacquesCarette/Drasil
708,vulkan,149,33,149,26,2016-02-17T21:54:21Z,2024-11-22T09:34:14Z,197282,Haskell bindings for Vulkan,Haskell,https://github.com/expipiplus1/vulkan
709,json-autotype,149,23,149,13,2014-05-01T07:52:05Z,2023-09-21T00:08:59Z,924,Automatic Haskell type inference from JSON input,Haskell,https://github.com/migamake/json-autotype
710,static-ls,149,17,149,5,2023-03-27T15:48:59Z,2025-03-12T20:34:39Z,2704,,Haskell,https://github.com/josephsumabat/static-ls
