Ranking,Project Name,Stars,Forks,Watchers,Open Issues,Created At,Last Commit,Size (KB),Description,Language,Repo URL
423,Hubris,261,16,261,4,2009-08-07T09:52:15Z,2015-06-30T18:14:04Z,856,Bridge from Ruby to Haskell,Haskell,https://github.com/mwotton/Hubris
424,keter,261,75,261,61,2012-05-06T04:21:55Z,2025-03-15T12:37:07Z,860,Web app deployment manager,Haskell,https://github.com/snoyberg/keter
425,hid-examples,260,92,260,2,2018-05-22T16:07:07Z,2024-12-01T11:47:10Z,3077,"Examples to accompany the book ""Haskell in Depth""",Haskell,https://github.com/bravit/hid-examples
426,co-log,260,51,260,18,2018-07-26T08:40:11Z,2025-03-16T15:51:51Z,506,📓 Flexible and configurable modern #Haskell logging framework,Haskell,https://github.com/co-log/co-log
427,sixty,258,7,258,2,2019-04-27T21:22:21Z,2024-09-05T18:35:20Z,11362,Dependent type checker using normalisation by evaluation,Haskell,https://github.com/ollef/sixty
428,lion,257,16,257,3,2021-02-18T03:18:12Z,2024-08-03T07:53:28Z,331,Where Lions Roam: RISC-V on the VELDT,Haskell,https://github.com/standardsemiconductor/lion
429,pp,257,21,257,18,2016-03-29T09:18:28Z,2023-12-22T15:13:18Z,4300,"PP - Generic preprocessor (with pandoc in mind) - macros, literate programming, diagrams, scripts...",Haskell,https://github.com/CDSoft/pp
430,quickspec,254,26,254,19,2012-03-21T15:16:50Z,2025-03-13T18:01:01Z,1957,Equational laws for free,Haskell,https://github.com/nick8325/quickspec
431,Algorithm-W-Step-By-Step,253,20,253,4,2010-03-21T08:05:22Z,2010-03-29T06:44:31Z,403,Classic Algorithm W for type inference.,Haskell,https://github.com/wh5a/Algorithm-W-Step-By-Step
432,sbv,252,35,252,1,2011-01-07T07:26:47Z,2025-03-27T17:44:06Z,17531,SMT Based Verification in Haskell. Express properties about Haskell programs  and automatically prove them using SMT solvers. ,Haskell,https://github.com/LeventErkok/sbv
433,typo,251,7,251,0,2013-08-07T17:17:46Z,2016-03-19T16:13:34Z,32,A programming language that runs in Haskell's type system.,Haskell,https://github.com/seliopou/typo
434,haskell-tools,250,27,250,52,2016-01-03T16:04:22Z,2024-07-18T10:02:43Z,6605,Developer tools for Haskell,Haskell,https://github.com/haskell-tools/haskell-tools
435,api.unverified.email,250,7,250,1,2019-08-12T08:52:31Z,2020-04-11T15:07:18Z,190,A service to help with testing of sending the right emails,Haskell,https://github.com/honest-technology/api.unverified.email
436,frp-arduino,249,20,249,17,2015-01-13T16:38:50Z,2019-04-23T11:08:51Z,438,Arduino programming without the hassle of C.,Haskell,https://github.com/frp-arduino/frp-arduino
437,chainweb-node,248,97,248,101,2019-03-16T13:13:12Z,2025-03-24T15:12:57Z,35525,Chainweb: A Proof-of-Work Parallel-Chain Architecture for Massive Throughput,Haskell,https://github.com/kadena-io/chainweb-node
438,record,248,6,248,13,2015-01-18T19:42:43Z,2019-02-20T13:01:44Z,165,Anonymous records,Haskell,https://github.com/nikita-volkov/record
439,blaze-html,248,48,248,23,2010-03-13T17:12:35Z,2025-03-12T10:25:48Z,4876,A blazingly fast HTML combinator library for Haskell.,Haskell,https://github.com/jaspervdj/blaze-html
440,pretty-simple,246,30,246,17,2016-12-15T06:07:56Z,2025-01-27T13:44:33Z,1745,pretty-printer for Haskell data types that have a Show instance,Haskell,https://github.com/cdepillabout/pretty-simple
441,hyperbole,245,12,245,7,2023-11-27T18:16:21Z,2025-03-27T16:04:47Z,2618,"Haskell interactive serverside web framework inspired by HTMX, Elm, and Phoenix LiveView",Haskell,https://github.com/seanhess/hyperbole
442,airship,244,14,244,7,2015-01-23T22:30:51Z,2023-03-01T14:00:13Z,338,"Helium + Webmachine = Airship. A toolkit for building declarative, RESTful web apps.",Haskell,https://github.com/tmcgilchrist/airship
443,aws,243,107,243,49,2010-10-08T19:45:35Z,2025-01-20T23:51:52Z,2058,Amazon Web Services for Haskell,Haskell,https://github.com/aristidb/aws
444,mmaclone,243,17,243,1,2016-02-08T15:32:19Z,2019-07-10T18:51:44Z,1272,A simple Wolfram Language clone in Haskell,Haskell,https://github.com/jyh1/mmaclone
445,gRPC-haskell,243,78,243,31,2017-02-28T17:42:11Z,2025-03-25T21:21:24Z,16409,Haskell gRPC support,Haskell,https://github.com/awakesecurity/gRPC-haskell
446,silica,242,7,242,3,2018-03-18T08:18:44Z,2020-01-18T06:16:44Z,129,optics for Haskell with the most amazing type errors you've seen,Haskell,https://github.com/evertedsphere/silica
447,hal,242,13,242,18,2018-12-19T19:15:19Z,2024-09-14T02:41:30Z,383,hal provides an AWS Lambda Custom Runtime environment for your Haskell applications.,Haskell,https://github.com/Nike-Inc/hal
448,pandoc-plot,239,8,239,9,2019-11-09T18:32:42Z,2025-03-02T03:01:16Z,2474,Render and include figures in Pandoc documents using your plotting toolkit of choice,Haskell,https://github.com/LaurentRDC/pandoc-plot
449,Juicy.Pixels,238,57,238,36,2011-08-21T17:40:31Z,2024-06-05T07:07:48Z,41407,Haskell library to load & save pictures,Haskell,https://github.com/Twinside/Juicy.Pixels
450,fireward,238,4,238,17,2019-04-09T14:14:08Z,2023-04-10T20:34:55Z,940,"A concise and readable language for Firestore security rules, similar to Firebase Bolt.",Haskell,https://github.com/bijoutrouvaille/fireward
451,owlcloud,236,13,236,2,2015-09-11T17:18:43Z,2017-11-25T11:04:42Z,35,OwnCloud for owls done via The Microservice Architecture,Haskell,https://github.com/k-bx/owlcloud
452,act,236,38,236,36,2019-09-13T16:50:11Z,2025-03-21T14:09:05Z,4524,Smart contract specification language,Haskell,https://github.com/ethereum/act
453,tagsoup,235,38,235,34,2013-10-11T10:28:20Z,2024-10-20T16:16:14Z,1451,Haskell library for parsing and extracting information from (possibly malformed) HTML/XML documents,Haskell,https://github.com/ndmitchell/tagsoup
454,stack-templates,235,111,235,2,2015-07-14T16:39:43Z,2024-12-28T22:50:07Z,1261,Project templates for stack new,Haskell,https://github.com/commercialhaskell/stack-templates
455,TaskLite,235,14,235,45,2019-06-13T16:11:08Z,2024-11-18T16:05:34Z,4574,The CLI task manager for power users,Haskell,https://github.com/ad-si/TaskLite
456,fregot,235,11,235,10,2019-02-10T12:48:49Z,2022-06-30T13:38:28Z,2372,Fugue Rego Toolkit,Haskell,https://github.com/fugue/fregot
457,sjsp,234,7,234,0,2015-06-30T05:31:06Z,2020-01-31T15:54:00Z,46,Simple JavaScript Profiler,Haskell,https://github.com/itchyny/sjsp
458,combinatorrent,234,31,234,27,2009-12-09T23:56:38Z,2017-01-18T14:16:10Z,1940,A bittorrent client written in Haskell,Haskell,https://github.com/jlouis/combinatorrent
459,lets-lens,233,92,233,9,2015-05-21T00:58:53Z,2024-12-02T00:31:36Z,67,Course material for lens,Haskell,https://github.com/system-f/lets-lens
460,haskeline,233,77,233,43,2013-10-31T05:19:04Z,2025-03-03T16:45:05Z,1276,A Haskell library for line input in command-line programs.,Haskell,https://github.com/haskell/haskeline
461,haskell-relational-record,233,36,233,14,2013-05-08T05:44:28Z,2023-12-02T17:32:37Z,5413,"This repository includes a joined query generator based on typefull relational algebra, and mapping tools between SQL values list and Haskell record type.",Haskell,https://github.com/khibino/haskell-relational-record
462,inline-java,231,15,231,11,2016-10-19T08:36:42Z,2023-11-25T19:14:28Z,1108,Haskell/Java interop via inline Java code in Haskell modules.,Haskell,https://github.com/tweag/inline-java
463,freer-simple,231,21,231,19,2017-07-05T18:14:52Z,2024-05-16T14:26:15Z,283,A friendly effect system for Haskell,Haskell,https://github.com/lexi-lambda/freer-simple
464,Lol,230,45,230,12,2015-09-29T21:04:20Z,2021-03-22T14:10:51Z,4155,Λ ⚬ λ: Functional Lattice Cryptography,Haskell,https://github.com/cpeikert/Lol
465,ruhaskell,229,48,229,4,2015-01-14T09:20:51Z,2023-03-20T11:17:48Z,6546,Главный сайт сообщества,Haskell,https://github.com/ruHaskell/ruhaskell
466,klfc,229,13,229,26,2016-09-12T18:58:34Z,2023-03-05T14:43:29Z,6319,Keyboard Layout Files Creator,Haskell,https://github.com/39aldo39/klfc
467,1HaskellADay,228,38,228,0,2016-06-08T13:17:11Z,2021-06-04T18:22:33Z,88775,,Haskell,https://github.com/geophf/1HaskellADay
468,psc-package,228,45,228,27,2017-02-07T03:47:49Z,2022-07-24T14:21:16Z,138,A package manager for PureScript based on package sets,Haskell,https://github.com/purescript/psc-package
469,inline-rust,226,9,226,14,2017-09-28T07:19:06Z,2021-05-24T19:54:03Z,140,Use snippets of Rust inline in your Haskell programs,Haskell,https://github.com/harpocrates/inline-rust
470,yesod-cookbook,226,43,226,5,2015-09-08T13:55:24Z,2021-02-02T17:54:42Z,512,Cookbook documentation,Haskell,https://github.com/yesodweb/yesod-cookbook
471,glambda,224,30,224,0,2015-05-04T19:51:04Z,2025-03-27T13:01:32Z,4868,The home of the Glamorous Glambda interpreter,Haskell,https://github.com/goldfirere/glambda
472,Euterpea2,224,71,224,20,2015-12-16T19:59:10Z,2024-08-04T15:00:10Z,19558,Euterpea version 2,Haskell,https://github.com/Euterpea/Euterpea2
473,pronk,224,21,224,12,2011-07-11T23:59:47Z,2013-01-11T16:41:46Z,210,"A small command line application for load testing web servers.  Think of it as similar to httperf or ab, only more modern and simpler to deal with.",Haskell,https://github.com/bos/pronk
474,cassava,223,107,223,59,2012-03-20T00:14:40Z,2025-03-11T12:44:27Z,592,A CSV parsing and encoding library optimized for ease of use and high performance,Haskell,https://github.com/haskell-hvr/cassava
475,nstack,222,14,222,0,2017-03-21T09:08:32Z,2024-02-07T10:39:39Z,237,"Type-safe, composable microservices for data analytics",Haskell,https://github.com/nstack/nstack
476,eclair-lang,222,13,222,9,2021-06-19T14:46:24Z,2024-01-22T09:15:36Z,4080,"A minimal, fast Datalog implementation in Haskell that compiles to LLVM IR",Haskell,https://github.com/luc-tielen/eclair-lang
477,compiler,222,17,222,1,2019-12-21T06:32:11Z,2024-12-08T06:52:04Z,2092,The adventures of a Haskell compiler,Haskell,https://github.com/blynn/compiler
478,givegif,221,5,221,1,2016-03-28T18:30:14Z,2019-11-04T11:44:01Z,11854,GIFs on the command line,Haskell,https://github.com/passy/givegif
479,unordered-containers,221,100,221,123,2011-01-17T19:52:29Z,2024-05-13T06:54:14Z,2246,Efficient hashing-based container types,Haskell,https://github.com/haskell-unordered-containers/unordered-containers
480,ermine,220,17,220,14,2012-11-19T19:48:26Z,2018-08-20T01:59:58Z,9597,The Ermine Programming Language - Join us on irc.freenode.net #ermine,Haskell,https://github.com/ermine-language/ermine
481,par-tutorial,219,24,219,2,2011-05-17T11:02:18Z,2013-02-07T14:14:34Z,7665,A tutorial on Parallel and Concurrent Haskell,Haskell,https://github.com/simonmar/par-tutorial
482,Allure,219,18,219,27,2010-10-02T13:22:20Z,2023-11-17T13:43:38Z,11839,"Allure of the Stars is a near-future Sci-Fi roguelike and tactical squad combat game written in Haskell; please offer feedback, e.g., after trying out the web frontend version at",Haskell,https://github.com/AllureOfTheStars/Allure
483,twidge,219,29,219,25,2010-04-22T02:49:06Z,2016-05-30T20:26:35Z,1834,Command-line twitter/identica client [Haskell],Haskell,https://github.com/jgoerzen/twidge
484,macaw,218,20,218,80,2017-09-28T16:42:26Z,2025-03-24T18:55:41Z,10943,Open source binary analysis tools.,Haskell,https://github.com/GaloisInc/macaw
485,traderjoes,218,14,218,2,2024-01-21T21:12:21Z,2024-12-27T18:09:11Z,53,"Price tracking program and website for Trader Joe's, updated daily.",Haskell,https://github.com/cmoog/traderjoes
486,serverless-haskell,217,22,217,23,2017-12-18T04:33:00Z,2024-01-08T06:08:15Z,2940,Deploying Haskell applications to AWS Lambda with Serverless,Haskell,https://github.com/seek-oss/serverless-haskell
487,rzk,217,10,217,58,2020-11-26T10:28:20Z,2025-03-14T14:59:52Z,58250,An experimental proof assistant based on a type theory for synthetic ∞-categories.,Haskell,https://github.com/rzk-lang/rzk
488,dunai,217,36,217,6,2016-07-11T22:22:46Z,2025-02-28T07:12:57Z,18051,"Classic FRP, Arrowized FRP, Reactive Programming, and Stream Programming, all via Monadic Stream Functions",Haskell,https://github.com/ivanperez-keera/dunai
489,haskell-backend,216,45,216,152,2017-01-11T06:07:30Z,2025-03-24T19:07:20Z,112764,The symbolic execution engine powering the K Framework,Haskell,https://github.com/runtimeverification/haskell-backend
490,defect-process,215,15,215,1,2021-09-19T02:28:05Z,2023-08-01T05:46:10Z,1756,Defect Process (2d hack n' slash game) full source code,Haskell,https://github.com/incoherentsoftware/defect-process
491,capability,214,9,214,9,2018-08-09T07:23:27Z,2024-07-02T09:52:43Z,360,Extensional capabilities and deriving combinators,Haskell,https://github.com/tweag/capability
492,duet,214,8,214,0,2017-04-17T14:07:46Z,2023-05-07T20:36:44Z,2975,"A tiny language, a subset of Haskell aimed at aiding teachers teach Haskell",Haskell,https://github.com/chrisdone-archive/duet
493,summer-2015-haskell-class,213,11,213,0,2015-06-18T13:36:12Z,2015-09-08T19:09:59Z,371,Summer 2015 Haskell Class,Haskell,https://github.com/michaelochurch/summer-2015-haskell-class
494,elm-package,213,66,213,54,2013-09-25T20:52:59Z,2018-08-22T20:03:43Z,700,Command line tool to share Elm libraries,Haskell,https://github.com/elm-lang/elm-package
495,haskell-phrasebook,213,22,213,20,2019-07-24T05:31:44Z,2022-02-24T23:11:51Z,303,The Haskell Phrasebook: a quick intro to Haskell via small annotated example programs,Haskell,https://github.com/typeclasses/haskell-phrasebook
496,PLFA-zh,211,22,211,26,2019-01-17T06:01:32Z,2025-03-24T07:42:27Z,146214,《编程语言基础：Agda 描述》，Programming Language Foundations in Agda 中文版,Haskell,https://github.com/Agda-zh/PLFA-zh
497,quine,211,25,211,1,2014-10-13T07:47:26Z,2019-01-05T16:19:31Z,5010,"haskell, opengl, toy project",Haskell,https://github.com/ekmett/quine
498,haskell-scotty-realworld-example-app,210,33,210,2,2017-09-09T06:40:01Z,2019-11-10T12:21:16Z,119,Exemplary real world backend API built with Haskell/Scotty https://realworld.io,Haskell,https://github.com/eckyputrady/haskell-scotty-realworld-example-app
499,optparse-generic,210,31,210,11,2016-02-26T15:37:18Z,2024-02-01T23:55:53Z,164,Auto-generate a command-line parser for your datatype,Haskell,https://github.com/Gabriella439/optparse-generic
500,music-suite,210,17,210,32,2014-06-04T19:05:56Z,2022-04-13T18:55:51Z,9758,Music in Haskell,Haskell,https://github.com/music-suite/music-suite
501,slick,210,24,210,1,2018-07-17T18:57:00Z,2024-08-14T21:45:14Z,9612,Static site generator built on Shake configured in Haskell,Haskell,https://github.com/ChrisPenner/slick
502,haskelldocumentation,208,30,208,1,2015-02-24T08:42:03Z,2022-05-18T18:21:41Z,158,Repository for collaborative Haskell documentation,Haskell,https://github.com/commercialhaskell/haskelldocumentation
503,axel,208,9,208,42,2017-08-11T14:56:55Z,2024-05-17T22:32:09Z,906,Haskell + Lisp,Haskell,https://github.com/axellang/axel
504,linear,208,52,208,28,2011-06-02T06:04:58Z,2025-03-04T12:07:13Z,2242,Low-dimensional linear algebra primitives for Haskell.,Haskell,https://github.com/ekmett/linear
505,katip,207,69,207,20,2015-05-28T23:09:52Z,2025-01-27T05:09:57Z,719,A structured logging framework for Haskell,Haskell,https://github.com/Soostone/katip
506,hadrian,207,37,207,39,2014-12-23T17:01:44Z,2019-02-04T16:58:24Z,3208,Hadrian: a new build system for the Glasgow Haskell Compiler. Now merged into the GHC tree!,Haskell,https://github.com/snowleopard/hadrian
507,implicit-hie,207,17,207,20,2020-05-01T00:59:28Z,2024-02-21T07:24:21Z,479,Auto generate a stack or cabal multi component hie.yaml file,Haskell,https://github.com/Avi-D-coder/implicit-hie
508,diagrams,206,11,206,11,2012-07-26T20:18:20Z,2023-08-01T19:59:59Z,60,Embedded domain-specific language for declarative vector graphics (wrapper package),Haskell,https://github.com/diagrams/diagrams
509,postgresql-simple,206,71,206,79,2011-12-25T05:51:13Z,2021-11-19T18:13:41Z,892,Mid-level client library for accessing PostgreSQL from Haskell,Haskell,https://github.com/lpsmith/postgresql-simple
510,antigen-hs,206,21,206,3,2014-05-21T11:22:30Z,2024-07-29T20:56:09Z,52,A fast zsh plugin manager,Haskell,https://github.com/Tarrasch/antigen-hs
511,thesis,206,6,206,3,2015-04-28T20:15:56Z,2018-07-19T03:52:32Z,15271,Richard A. Eisenberg's PhD Dissertation,Haskell,https://github.com/goldfirere/thesis
512,pie-hs,205,16,205,1,2019-02-04T04:30:09Z,2019-11-08T23:25:21Z,138,An implementation of Pie in Haskell,Haskell,https://github.com/david-christiansen/pie-hs
513,lambdacube-edsl,205,12,205,0,2012-04-21T00:41:37Z,2018-06-23T09:28:59Z,11173,Previous version of LambdaCube 3D as Embedded Domain Specific Language in Haskell. Check the latest system:,Haskell,https://github.com/lambdacube3d/lambdacube-edsl
514,haskell-telegram-api,204,67,204,20,2016-01-04T08:19:58Z,2023-03-07T14:13:05Z,1720,Telegram Bot API for Haskell,Haskell,https://github.com/klappvisor/haskell-telegram-api
515,c-repl,204,24,204,1,2008-08-27T15:56:34Z,2020-09-07T05:21:11Z,93,a C read-eval-print loop (abandoned),Haskell,https://github.com/evmar/c-repl
516,quickcheck-state-machine,203,25,203,28,2017-02-15T14:38:52Z,2021-05-11T14:40:30Z,2843,Test monadic programs using state machine based models,Haskell,https://github.com/advancedtelematic/quickcheck-state-machine
517,hi,203,20,203,7,2013-07-17T14:48:25Z,2023-01-12T07:27:37Z,234,Generate scaffold for a Haskell project,Haskell,https://github.com/fujimura/hi
518,skylighting,202,64,202,26,2016-12-13T15:19:33Z,2025-01-29T19:28:58Z,4749,A Haskell syntax highlighting library with tokenizers derived from KDE syntax highlighting descriptions,Haskell,https://github.com/jgm/skylighting
519,unfog,202,7,202,9,2019-10-22T07:12:01Z,2025-02-05T07:11:31Z,476,"⏱ Minimalist CLI task & time manager, written in Haskell.",Haskell,https://github.com/soywod/unfog
520,nvfetcher,201,16,201,19,2021-04-20T04:07:58Z,2024-11-25T04:41:30Z,3933,Generate nix sources expr for the latest version of packages,Haskell,https://github.com/berberman/nvfetcher
521,gifstream,201,7,201,0,2015-01-11T16:44:41Z,2023-09-22T09:41:56Z,310,Make interactive games in Haskell using GIF streams that can be shown in the web browser,Haskell,https://github.com/def-/gifstream
522,9m,201,13,201,2,2014-05-20T19:50:34Z,2023-08-20T18:16:30Z,103,9m Unicode URL Shortener,Haskell,https://github.com/ehamberg/9m
523,c2hs,200,52,200,78,2013-07-25T11:49:51Z,2024-03-13T22:20:15Z,4732,c2hs is a pre-processor for Haskell FFI bindings to C libraries,Haskell,https://github.com/haskell/c2hs
524,flow,200,11,200,0,2015-04-01T22:12:06Z,2025-03-17T14:22:50Z,118,:droplet: Write more understandable Haskell.,Haskell,https://github.com/tfausak/flow
525,QuickFuzz,199,45,199,21,2015-06-27T12:33:53Z,2020-04-21T14:14:56Z,12486,An experimental grammar fuzzer in Haskell using QuickCheck,Haskell,https://github.com/CIFASIS/QuickFuzz
526,HaTeX,199,46,199,20,2012-01-17T13:47:45Z,2023-09-28T10:01:27Z,919,The Haskell LaTeX library.,Haskell,https://github.com/Daniel-Diaz/HaTeX
527,lhc,199,14,199,7,2012-04-06T15:23:07Z,2020-04-30T02:37:17Z,33036,The LLVM LHC Haskell Optimization System,Haskell,https://github.com/lemmih/lhc
528,herms,198,43,198,24,2017-06-28T12:46:33Z,2023-10-07T04:30:15Z,373,:stew::fork_and_knife: A command-line manager for delicious kitchen recipes,Haskell,https://github.com/LuxMiranda/herms
529,keera-hails,198,12,198,9,2012-06-15T12:44:50Z,2022-04-05T08:30:03Z,1447,Keera Hails: Haskell on Rails - Reactive Programming Framework for Interactive Haskell applications,Haskell,https://github.com/keera-studios/keera-hails
530,haskell-src-exts,197,94,197,115,2013-05-04T08:37:51Z,2023-07-22T13:37:19Z,19726,"Manipulating Haskell source: abstract syntax, lexer, parser, and pretty-printer",Haskell,https://github.com/haskell-suite/haskell-src-exts
531,dejafu,197,19,197,22,2014-12-19T07:21:45Z,2025-03-11T09:31:45Z,2765,Systematic concurrency testing meets Haskell.,Haskell,https://github.com/barrucadu/dejafu
532,cborg,196,89,196,62,2015-07-06T11:49:59Z,2025-03-26T11:51:43Z,4181,Binary serialisation in the CBOR format,Haskell,https://github.com/well-typed/cborg
533,snap-server,196,84,196,23,2010-05-22T04:03:40Z,2024-07-04T07:38:13Z,2266,"A fast HTTP server library, which runs Snap web handlers. ",Haskell,https://github.com/snapframework/snap-server
534,morloc,196,4,196,5,2016-12-02T03:11:38Z,2025-03-26T03:46:06Z,6174,"A typed, polyglot, functional language",Haskell,https://github.com/morloc-project/morloc
535,dino-rush,195,17,195,0,2018-01-31T02:02:29Z,2022-02-04T01:59:38Z,10512,🌋 Endless runner game,Haskell,https://github.com/jxv/dino-rush
536,haskell-webdriver,195,72,195,27,2012-03-12T21:17:20Z,2025-03-20T08:04:45Z,1096,A Haskell client for the Selenium WebDriver protocol.,Haskell,https://github.com/haskell-webdriver/haskell-webdriver
537,learn-you-a-haskell-exercises,195,152,195,8,2012-12-21T21:26:00Z,2019-10-17T23:16:23Z,38,,Haskell,https://github.com/noelmarkham/learn-you-a-haskell-exercises
538,ff,195,18,195,45,2017-12-29T09:24:15Z,2024-06-10T04:01:32Z,6250,A distributed note taker and task manager.,Haskell,https://github.com/ff-notes/ff
539,Hydra,195,13,195,42,2019-05-01T17:15:44Z,2024-09-03T11:03:42Z,570,"Hydra is a full-fledged framework for building web services, multithreaded and concurrent applications with SQL and KV DB support.",Haskell,https://github.com/graninas/Hydra
540,PortFusion,194,41,194,10,2012-03-29T13:56:59Z,2016-08-01T06:30:09Z,725,"Haskell-powered cross-platform transport-layer distributed reverse / forward proxy & tunneling solution – currently available for all TCP protocols (RDP, VNC, HTTP(S), SSH, ...).",Haskell,https://github.com/corsis/PortFusion
541,HerbiePlugin,193,5,193,10,2015-08-26T04:16:04Z,2015-10-06T11:35:10Z,460,GHC plugin that improves Haskell code's numerical stability,Haskell,https://github.com/mikeizbicki/HerbiePlugin
542,hs-web3,193,68,193,11,2016-10-03T13:56:19Z,2024-10-25T10:43:26Z,1794,Web3 API for Haskell,Haskell,https://github.com/airalab/hs-web3
543,PolysemyCleanArchitecture,192,16,192,1,2020-02-06T19:52:32Z,2023-12-15T08:39:42Z,1678,Showcasing how the Polysemy library can be used to implement a REST application conforming to the guidelines of the Clean Architecture model.,Haskell,https://github.com/thma/PolysemyCleanArchitecture
544,tryhaskell,192,40,192,6,2010-02-28T15:05:22Z,2023-06-04T20:14:30Z,103,Try Haskell,Haskell,https://github.com/chrisdone-archive/tryhaskell
545,dynamic,191,5,191,0,2019-03-31T15:33:14Z,2019-05-29T23:05:25Z,30,Dynamic typing in Haskell,Haskell,https://github.com/chrisdone-archive/dynamic
546,quad-ci,190,12,190,1,2020-12-23T13:23:10Z,2022-04-01T16:30:43Z,278,A CI server written in Simple Haskell.,Haskell,https://github.com/alpacaaa/quad-ci
547,cmt,189,9,189,3,2019-02-21T22:38:06Z,2020-10-05T19:04:17Z,1211,Write consistent git commit messages based on a custom template,Haskell,https://github.com/smallhadroncollider/cmt
548,hie-bios,189,64,189,39,2019-06-14T16:13:34Z,2025-03-25T07:16:43Z,595,Set up a GHC API session for various Haskell Projects,Haskell,https://github.com/haskell/hie-bios
549,PomPom-Language,189,6,189,0,2021-06-14T01:48:28Z,2022-12-13T17:09:55Z,1827,The cuteness implementation of a dependently typed language.,Haskell,https://github.com/caotic123/PomPom-Language
550,idris-erlang,188,15,188,1,2014-11-13T20:08:43Z,2017-07-01T20:41:18Z,314,Erlang Backend for Idris Compiler,Haskell,https://github.com/lenary/idris-erlang
551,higher-order-unification,188,5,188,1,2017-08-05T10:23:05Z,2017-08-06T10:17:19Z,31,A small implementation of higher-order unification,Haskell,https://github.com/jozefg/higher-order-unification
552,pearls,188,32,188,0,2013-01-29T13:26:29Z,2016-04-01T13:40:53Z,1707,Pearls of Functional Algorithm Design by Richard Bird - Haskell Code,Haskell,https://github.com/derekmcloughlin/pearls
553,foldilocks,188,12,188,1,2019-04-20T17:47:53Z,2019-04-28T21:09:10Z,74,"Tutorial using ghci to make folds easier. Come for the tutorial, stay for the fold puns.",Haskell,https://github.com/aymannadeem/foldilocks
554,fgl,188,54,188,17,2015-03-05T06:03:19Z,2024-09-30T06:55:43Z,427,A Functional Graph Library for Haskell,Haskell,https://github.com/haskell/fgl
555,git-mediate,187,8,187,11,2014-12-01T13:36:08Z,2025-02-06T15:53:04Z,204,Become a conflict resolution hero,Haskell,https://github.com/Peaker/git-mediate
556,cellularAutomata,187,13,187,1,2016-02-11T14:06:20Z,2019-05-28T10:41:53Z,18418,a collection of cellular automata written in Haskell with Diagrams,Haskell,https://github.com/bollu/cellularAutomata
557,muesli,187,6,187,2,2013-09-14T18:46:37Z,2024-09-22T01:00:10Z,208,An alternative approach to food,Haskell,https://github.com/l29ah/muesli
558,alfred-margaret,187,11,187,3,2019-03-05T14:57:31Z,2025-02-05T15:33:13Z,412,Fast Aho-Corasick string searching,Haskell,https://github.com/channable/alfred-margaret
559,iris,186,22,186,19,2022-05-11T20:21:36Z,2023-11-12T10:23:07Z,20427,🌈 Haskell CLI Framework supporting Command Line Interface Guidelines,Haskell,https://github.com/chshersh/iris
560,backprop,186,22,186,5,2017-02-22T07:43:46Z,2024-07-05T17:27:38Z,11606,"Heterogeneous automatic differentiation (""backpropagation"") in Haskell",Haskell,https://github.com/mstksg/backprop
561,refined,186,32,186,6,2015-04-27T17:57:44Z,2024-12-21T01:39:39Z,212,Refinement types with static checking,Haskell,https://github.com/nikita-volkov/refined
562,Haskell-Typed-Spreadsheet-Library,185,12,185,3,2015-11-09T15:27:43Z,2022-09-05T00:04:41Z,91,Typed and composable spreadsheets,Haskell,https://github.com/Gabriella439/Haskell-Typed-Spreadsheet-Library
563,elsa,185,22,185,1,2017-03-11T08:02:59Z,2025-03-26T02:36:03Z,93,Elsa is a lambda calculus evaluator ,Haskell,https://github.com/ucsd-progsys/elsa
564,tinyjit,184,9,184,2,2016-01-02T00:59:31Z,2020-01-19T12:06:10Z,17,Haskell JIT,Haskell,https://github.com/sdiehl/tinyjit
565,onyx,184,18,184,105,2014-02-03T02:13:39Z,2024-12-04T04:21:17Z,139082,"Toolkit for converting and building songs for Rock Band, Guitar Hero, Clone Hero, and other similar rhythm games",Haskell,https://github.com/mtolly/onyx
566,haskell-json,183,29,183,4,2019-11-04T18:10:37Z,2023-03-03T18:37:37Z,49,Source Code for JSON Parser Video,Haskell,https://github.com/tsoding/haskell-json
