Ranking,Project Name,Stars,Forks,Watchers,Open Issues,Created At,Last Commit,Size (KB),Description,Language,Repo URL
277,call-haskell-from-anything,396,19,396,7,2013-02-04T04:59:02Z,2022-06-17T18:14:04Z,63,Call Haskell functions from any programming language via serialization and dynamic libraries,Haskell,https://github.com/nh2/call-haskell-from-anything
278,Haskell,396,98,396,20,2020-02-18T07:40:50Z,2024-01-25T20:17:18Z,181,,Haskell,https://github.com/TheAlgorithms/Haskell
279,fourmolu,393,61,393,73,2020-05-16T14:18:46Z,2025-02-01T01:36:39Z,5035,A fourk of ormolu that uses four space indentation and allows arbitrary configuration. Don't like it? PRs welcome!,Haskell,https://github.com/fourmolu/fourmolu
280,monocle,392,59,392,112,2019-11-29T22:51:30Z,2025-03-13T17:46:08Z,9103,Monocle helps teams and individual to better organize daily duties and to detect anomalies in the way changes are produced and reviewed.,Haskell,https://github.com/change-metrics/monocle
281,apecs,390,44,390,15,2017-08-10T14:59:21Z,2024-03-20T21:35:02Z,1679,"a fast, extensible, type driven Haskell ECS framework for games",Haskell,https://github.com/jonascarpay/apecs
282,hmatrix,390,104,390,69,2011-12-07T20:11:51Z,2024-06-25T00:05:52Z,3435,Linear algebra and numerical computation,Haskell,https://github.com/haskell-numerics/hmatrix
283,peridot,389,4,389,0,2020-07-28T23:10:32Z,2023-01-06T14:19:21Z,1197,A fast functional language based on two level type theory,Haskell,https://github.com/eashanhatti/peridot
284,tart,388,19,388,2,2017-08-05T21:47:33Z,2024-11-22T22:44:07Z,531,Tart - draw ASCII art in the terminal with your mouse!,Haskell,https://github.com/jtdaugherty/tart
285,ogma,388,35,388,4,2021-08-05T15:28:13Z,2025-03-22T20:55:27Z,32236,Generator of runtime monitors for flight and robotics applications.,Haskell,https://github.com/nasa/ogma
286,rest,388,52,388,50,2014-04-04T14:22:27Z,2018-10-02T17:26:16Z,1491,"Packages for defining APIs, running them, generating client code and documentation.",Haskell,https://github.com/silkapp/rest
287,nix-diff,387,19,387,11,2017-09-30T19:02:53Z,2024-12-20T07:48:10Z,928,Explain why two Nix derivations differ,Haskell,https://github.com/Gabriella439/nix-diff
288,yst,386,38,386,16,2009-08-01T18:09:05Z,2024-05-27T09:16:54Z,277,create static websites from YAML data and string templates,Haskell,https://github.com/jgm/yst
289,esqueleto,386,107,386,86,2016-12-14T21:00:29Z,2025-03-20T14:45:49Z,2412,"New home of Esqueleto, please file issues so we can get things caught up!",Haskell,https://github.com/bitemyapp/esqueleto
290,doctest,385,75,385,76,2010-11-04T19:06:17Z,2025-02-17T06:47:14Z,739,An implementation of Python's doctest for Haskell,Haskell,https://github.com/sol/doctest
291,markup.rocks,385,22,385,15,2015-05-02T18:49:03Z,2016-08-31T06:12:01Z,998,Pandoc based document editor and converter in your browser.,Haskell,https://github.com/ozanmakes/markup.rocks
292,lsp,385,95,385,52,2016-09-23T19:21:01Z,2025-03-19T21:30:41Z,4055,Haskell library for the Microsoft Language Server Protocol,Haskell,https://github.com/haskell/lsp
293,massiv,385,24,385,20,2017-02-24T01:05:34Z,2025-01-12T17:30:30Z,6835,Efficient Haskell Arrays featuring Parallel computation,Haskell,https://github.com/lehins/massiv
294,constellation,384,109,384,3,2016-11-14T06:27:55Z,2020-07-06T12:57:42Z,253,Peer-to-peer encrypted message exchange,Haskell,https://github.com/Consensys/constellation
295,optics,382,25,382,55,2017-03-10T21:08:54Z,2025-03-26T21:19:36Z,2802,Optics as an abstract interface,Haskell,https://github.com/well-typed/optics
296,wreq,380,69,380,18,2014-04-01T03:59:07Z,2024-03-25T07:48:19Z,573,,Haskell,https://github.com/haskell/wreq
297,hnes,380,19,380,0,2017-08-17T06:53:47Z,2023-05-17T22:34:36Z,18410,:video_game: NES Emulator written in Haskell,Haskell,https://github.com/dbousamra/hnes
298,haskell-emacs,380,24,380,19,2014-12-05T20:44:22Z,2024-02-05T22:25:26Z,285,Write Emacs extensions in Haskell,Haskell,https://github.com/knupfer/haskell-emacs
299,ad,379,74,379,16,2010-06-14T09:19:18Z,2025-03-03T11:31:51Z,2382,Automatic Differentiation,Haskell,https://github.com/ekmett/ad
300,haskell-platform,379,91,379,76,2012-03-22T17:58:26Z,2022-02-02T16:09:53Z,3234,Distribution of Haskell with batteries included ,Haskell,https://github.com/haskell/haskell-platform
301,LambdaNet,378,38,378,5,2014-11-14T20:05:28Z,2016-03-25T18:15:48Z,1020,Purely functional artificial neural network library implemented in Haskell.,Haskell,https://github.com/jbarrow/LambdaNet
302,Haskell-Morte-Library,377,25,377,14,2014-08-27T04:23:55Z,2022-09-04T23:23:07Z,394,A bare-bones calculus-of-constructions,Haskell,https://github.com/Gabriella439/Haskell-Morte-Library
303,vector,377,139,377,60,2013-09-24T18:27:31Z,2025-01-28T14:27:07Z,2651,"An efficient implementation of Int-indexed arrays (both mutable and immutable), with a powerful loop optimisation framework .",Haskell,https://github.com/haskell/vector
304,postgres-websockets,375,29,375,5,2016-05-08T01:43:22Z,2025-03-20T01:37:18Z,473,PostgreSQL + Websockets,Haskell,https://github.com/diogob/postgres-websockets
305,mtl,374,64,374,33,2012-01-25T02:09:10Z,2024-07-25T18:09:51Z,272,The Monad Transformer Library,Haskell,https://github.com/haskell/mtl
306,Earley,370,24,370,16,2015-04-11T18:27:29Z,2023-05-14T21:25:58Z,259,Parsing all context-free grammars using Earley's algorithm in Haskell.,Haskell,https://github.com/ollef/Earley
307,incredible,370,37,370,29,2015-07-24T07:46:31Z,2025-03-02T10:57:33Z,2533,The Incredible Proof Machine,Haskell,https://github.com/nomeata/incredible
308,squeal,369,32,369,30,2017-08-28T16:55:09Z,2024-12-26T15:54:07Z,3947,"Squeal, a deep embedding of SQL in Haskell",Haskell,https://github.com/morphismtech/squeal
309,cabal2nix,366,157,366,88,2011-08-05T15:31:37Z,2025-03-11T17:57:28Z,3386,Generate Nix build instructions from a Cabal file,Haskell,https://github.com/NixOS/cabal2nix
310,sdl2,365,86,365,38,2014-10-17T08:27:25Z,2025-03-22T11:15:16Z,2813,Haskell bindings to the SDL2 library,Haskell,https://github.com/haskell-game/sdl2
311,hawk,365,20,365,75,2013-08-03T00:48:32Z,2024-02-10T04:55:36Z,932,Haskell text processor for the command-line,Haskell,https://github.com/gelisam/hawk
312,mezzo,364,12,364,3,2016-10-30T16:34:22Z,2019-03-03T12:30:38Z,1262,A Haskell library for typesafe music composition,Haskell,https://github.com/DimaSamoz/mezzo
313,funflow,364,32,364,36,2017-09-28T19:17:56Z,2024-01-29T06:37:52Z,64772,Functional workflows,Haskell,https://github.com/tweag/funflow
314,reflex-dom,363,148,363,61,2014-11-09T20:27:30Z,2025-03-09T19:34:45Z,2697,Web applications without callbacks or side-effects. Reflex-DOM brings the power of functional reactive programming (FRP) to the web. Build HTML and other Document Object Model (DOM) data with a pure functional interface.,Haskell,https://github.com/reflex-frp/reflex-dom
315,clay,360,72,360,12,2012-12-18T09:15:25Z,2025-01-09T13:37:35Z,632,A CSS preprocessor as embedded Haskell.,Haskell,https://github.com/sebastiaanvisser/clay
316,Son,358,7,358,9,2017-01-31T21:34:31Z,2019-12-23T18:56:29Z,225,Work in progress. Best alternative: https://matrix.org/docs/spec/appendices.html#canonical-json,Haskell,https://github.com/seagreen/Son
317,parconc-examples,356,105,356,7,2013-01-24T16:11:30Z,2025-03-25T11:54:58Z,1188,"Sample code to accompany the book ""Parallel and Concurrent Programming in Haskell""",Haskell,https://github.com/simonmar/parconc-examples
318,picard,354,119,354,37,2021-08-31T16:57:40Z,2023-10-18T02:48:43Z,778,PICARD - Parsing Incrementally for Constrained Auto-Regressive Decoding from Language Models. PICARD is a ServiceNow Research project that was started at Element AI.,Haskell,https://github.com/ServiceNow/picard
319,react-haskell,352,26,352,14,2014-11-10T01:04:47Z,2015-08-02T03:17:48Z,5494,React bindings for Haskell,Haskell,https://github.com/joelburget/react-haskell
320,haskell-do,352,32,352,34,2017-02-01T18:25:24Z,2018-02-10T18:56:50Z,43837,:pencil2: :bar_chart: - The Haskell code editor focused on interactive development.,Haskell,https://github.com/theam/haskell-do
321,CloudHaskell,349,22,349,4,2011-02-14T15:37:42Z,2012-10-16T13:49:17Z,631,A distributed computing framework for Haskell,Haskell,https://github.com/jepst/CloudHaskell
322,texmath,347,68,347,29,2009-07-01T18:05:53Z,2025-03-16T17:14:46Z,8781,A Haskell library for converting LaTeX math to MathML.,Haskell,https://github.com/jgm/texmath
323,recursion-schemes,345,57,345,27,2011-01-29T01:19:23Z,2024-12-07T03:19:07Z,340,"Generalized bananas, lenses and barbed wire",Haskell,https://github.com/recursion-schemes/recursion-schemes
324,verve-lang,344,7,344,4,2016-03-19T19:37:51Z,2021-11-30T02:18:45Z,4200,A functional language for the working hacker,Haskell,https://github.com/tadeuzagallo/verve-lang
325,nuri,344,13,344,6,2019-05-11T02:07:41Z,2025-03-03T11:19:22Z,909,누리 : 함수형 한글 프로그래밍 언어,Haskell,https://github.com/suhdonghwi/nuri
326,linear-base,342,37,342,55,2017-11-23T09:46:09Z,2024-11-08T16:06:21Z,1739,Standard library for linear types in Haskell.,Haskell,https://github.com/tweag/linear-base
327,nix-package-versions,341,29,341,10,2020-02-11T23:23:47Z,2025-01-23T23:25:07Z,40916,Search for old versions of Nix packages,Haskell,https://github.com/lazamar/nix-package-versions
328,req,341,40,341,8,2016-09-13T19:03:43Z,2025-03-27T20:09:44Z,377,An HTTP client library,Haskell,https://github.com/mrkkrp/req
329,purerl,339,7,339,7,2019-12-05T12:16:23Z,2024-06-21T19:28:00Z,401,Erlang backend for the PureScript compiler,Haskell,https://github.com/purerl/purerl
330,ptghci,338,6,338,12,2019-02-27T01:27:51Z,2023-10-08T16:37:13Z,282,"High-powered REPL for Haskell, inspired by IPython",Haskell,https://github.com/litxio/ptghci
331,machines,338,46,338,20,2012-08-16T22:31:42Z,2025-03-03T12:13:20Z,570,Networks of composable stream transducers,Haskell,https://github.com/ekmett/machines
332,infernu,338,11,338,15,2014-09-02T22:46:45Z,2018-12-18T19:51:19Z,2484,Type inference and checking for a safer JavaScript.,Haskell,https://github.com/sinelaw/infernu
333,network,335,190,335,30,2010-10-27T21:37:32Z,2025-01-28T04:28:58Z,2034,Low-level networking interface,Haskell,https://github.com/haskell/network
334,mu-haskell,334,19,334,16,2019-09-27T08:44:27Z,2024-08-01T23:25:22Z,11034,Mu (μ) is a purely functional framework for building micro services.,Haskell,https://github.com/higherkindness/mu-haskell
335,amulet,333,16,333,31,2017-12-20T14:04:11Z,2021-10-17T20:03:22Z,4121,An ML-like functional programming language,Haskell,https://github.com/amuletml/amulet
336,aima-haskell,332,43,332,2,2012-06-29T17:51:18Z,2017-08-07T21:48:51Z,2196,Algorithms from AIMA in Haskell,Haskell,https://github.com/chris-taylor/aima-haskell
337,monad-challenges,332,78,332,3,2016-01-19T10:57:41Z,2021-08-03T14:15:00Z,326,A set of challenges for jump starting your understanding of monads.,Haskell,https://github.com/mightybyte/monad-challenges
338,containers,330,182,330,191,2011-06-20T17:48:10Z,2025-03-23T06:47:26Z,9600,Assorted concrete container types,Haskell,https://github.com/haskell/containers
339,hedis,330,130,330,32,2011-02-23T20:31:41Z,2024-11-25T04:14:05Z,699,A Redis client library for Haskell.,Haskell,https://github.com/informatikr/hedis
340,scalpel,329,41,329,11,2014-12-26T08:15:53Z,2024-11-16T02:59:58Z,271,A high level web scraping library for Haskell.,Haskell,https://github.com/fimad/scalpel
341,arbtt,326,36,326,58,2013-11-05T08:32:01Z,2024-04-20T18:37:22Z,1283,"arbtt, the automatic rule-based time-tracker",Haskell,https://github.com/nomeata/arbtt
342,csound-expression,325,31,325,19,2013-01-20T15:47:46Z,2024-10-22T16:34:23Z,4647,Haskell Framework for Electronic Music,Haskell,https://github.com/spell-music/csound-expression
343,async,324,65,324,26,2012-06-08T13:36:45Z,2024-11-01T14:51:42Z,188,Run IO operations asynchronously and wait for their results,Haskell,https://github.com/simonmar/async
344,hakaru,319,31,319,42,2014-12-19T00:51:11Z,2022-03-21T16:23:19Z,13949,A probabilistic programming language,Haskell,https://github.com/hakaru-dev/hakaru
345,snap-core,318,84,318,23,2010-05-22T04:00:45Z,2024-07-04T22:39:10Z,2094,"Core type definitions (Snap monad, HTTP types, etc) and utilities for web handlers. ",Haskell,https://github.com/snapframework/snap-core
346,hascard,318,9,318,6,2020-01-19T21:42:09Z,2024-10-27T19:23:17Z,10075,flashcard TUI with markdown cards,Haskell,https://github.com/Yvee1/hascard
347,vty,316,57,316,2,2011-03-16T22:03:51Z,2025-03-09T02:34:27Z,3657,A high-level ncurses alternative written in Haskell,Haskell,https://github.com/jtdaugherty/vty
348,purenix,313,9,313,15,2021-10-03T00:58:20Z,2024-08-26T08:49:45Z,158,Nix backend for PureScript.  Transpile PureScript code to Nix.,Haskell,https://github.com/purenix-org/purenix
349,berp,313,10,313,2,2010-03-03T08:21:43Z,2016-01-29T22:39:41Z,1318,An implementation of Python 3,Haskell,https://github.com/bjpop/berp
350,ogmios,313,93,313,2,2020-03-16T21:58:59Z,2025-03-12T18:09:42Z,64484,❇️ A WebSocket JSON/RPC bridge for Cardano,Haskell,https://github.com/CardanoSolutions/ogmios
351,quine-central,313,11,313,0,2016-09-13T04:18:05Z,2018-12-12T05:29:37Z,15,A quine generator,Haskell,https://github.com/dpiponi/quine-central
352,mariposa,311,6,311,1,2024-01-08T01:39:51Z,2024-02-12T23:02:03Z,54,A toy programming language with time travel,Haskell,https://github.com/ambulancja/mariposa
353,NeoHaskell,311,3,311,94,2023-09-16T18:03:47Z,2025-03-27T19:33:47Z,157,⏩ NeoHaskell is a dialect of Haskell that is focused on newcomer-friendliness and productivity.,Haskell,https://github.com/neohaskell/NeoHaskell
354,ghcup-hs,310,94,310,185,2020-03-08T23:37:19Z,2025-03-27T14:51:08Z,12357,,Haskell,https://github.com/haskell/ghcup-hs
355,three-layer,310,26,310,9,2018-04-25T15:53:38Z,2021-04-06T05:52:01Z,333,:three: :cake: Architecture of the Haskell web applications,Haskell,https://github.com/Holmusk/three-layer
356,husk-scheme,309,28,309,32,2010-05-26T17:02:56Z,2023-11-15T03:49:59Z,10943,A full implementation of the Scheme programming language for the Haskell Platform.,Haskell,https://github.com/justinethier/husk-scheme
357,alex,306,82,306,32,2011-07-11T20:13:56Z,2025-03-15T19:58:43Z,4697,A lexical analyser generator for Haskell,Haskell,https://github.com/haskell/alex
358,holmes,305,16,305,8,2019-11-24T19:15:28Z,2024-07-02T05:06:01Z,111,A reference library for constraint-solving with propagators and CDCL.,Haskell,https://github.com/i-am-tom/holmes
359,plutus-apps,305,214,305,80,2021-10-21T09:27:28Z,2024-09-27T11:52:06Z,129361,The Plutus application platform,Haskell,https://github.com/IntersectMBO/plutus-apps
360,dth,304,26,304,0,2014-07-23T18:59:23Z,2022-10-18T20:25:43Z,91944,Examples of Dependently-typed programs in Haskell,Haskell,https://github.com/sweirich/dth
361,statistics,304,69,304,25,2010-10-10T17:49:07Z,2025-02-16T15:30:21Z,1633,"A fast, high quality library for computing with statistics in Haskell.",Haskell,https://github.com/haskell/statistics
362,cardano-db-sync,302,164,302,161,2020-02-26T23:34:13Z,2025-03-26T19:12:39Z,11108,A component that follows the Cardano chain and stores blocks and transactions in PostgreSQL,Haskell,https://github.com/IntersectMBO/cardano-db-sync
363,Expresso,302,13,302,5,2012-08-16T06:37:20Z,2023-04-21T09:07:01Z,158,A simple expressions language with polymorphic extensible row types.,Haskell,https://github.com/willtim/Expresso
364,happy,301,85,301,47,2012-09-21T19:14:30Z,2025-02-09T19:13:25Z,24057,The Happy parser generator for Haskell,Haskell,https://github.com/haskell/happy
365,hydra,301,87,301,88,2021-03-01T13:45:19Z,2025-03-28T14:09:50Z,230652,Implementation of the Hydra Head protocol,Haskell,https://github.com/cardano-scaling/hydra
366,prettyprinter,301,37,301,55,2017-05-17T07:06:18Z,2024-11-07T12:37:45Z,878,"A modern, extensible and well-documented prettyprinter.",Haskell,https://github.com/quchen/prettyprinter
367,Frames,300,41,300,74,2014-12-01T23:33:05Z,2023-11-01T12:49:13Z,2186,Data frames for tabular data.,Haskell,https://github.com/acowley/Frames
368,smos,299,47,299,11,2018-07-29T13:45:17Z,2025-03-27T10:20:58Z,9922,A comprehensive self-management System,Haskell,https://github.com/NorfairKing/smos
369,trifecta,299,49,299,12,2011-08-04T23:59:03Z,2025-03-03T12:19:22Z,1038,"Parser combinators with highlighting, slicing, layout, literate comments, Clang-style diagnostics and the kitchen sink",Haskell,https://github.com/ekmett/trifecta
370,acid-state,299,60,299,31,2013-06-29T15:16:55Z,2025-03-15T10:59:41Z,551,Add ACID guarantees to any serializable Haskell data structure,Haskell,https://github.com/acid-state/acid-state
371,haskell-gi,299,74,299,29,2013-04-10T09:04:15Z,2025-02-21T20:53:56Z,4099,Generate Haskell bindings for GObject-Introspection capable libraries,Haskell,https://github.com/haskell-gi/haskell-gi
372,dbignore,296,9,296,12,2014-05-13T03:32:09Z,2015-02-10T02:34:52Z,428,.gitignore for Dropbox,Haskell,https://github.com/tkonolige/dbignore
373,magic-haskell,296,28,296,41,2016-07-14T00:11:08Z,2019-05-15T08:02:00Z,7027,魔力haskell官方网站,Haskell,https://github.com/winterland1989/magic-haskell
374,bytestring,296,141,296,86,2013-02-15T19:06:34Z,2025-03-04T12:41:35Z,13798,"An efficient compact, immutable byte string type (both strict and lazy) suitable for binary or 8-bit character data.",Haskell,https://github.com/haskell/bytestring
375,servant-persistent,296,49,296,6,2015-06-06T07:09:28Z,2022-04-16T18:43:30Z,102,A brief example of Servant with Persistent,Haskell,https://github.com/parsonsmatt/servant-persistent
376,slides,294,30,294,1,2015-07-05T23:42:43Z,2023-06-23T18:01:17Z,44154,Slides from talks that I give,Haskell,https://github.com/Gabriella439/slides
377,package.elm-lang.org,292,113,292,86,2014-10-28T20:24:07Z,2023-03-24T11:17:37Z,4514,website for browsing packages and exploring documentation,Haskell,https://github.com/elm/package.elm-lang.org
378,lucid,292,40,292,0,2014-11-15T12:46:52Z,2025-03-11T17:03:13Z,329,"Clear to write, read and edit DSL for writing HTML",Haskell,https://github.com/chrisdone/lucid
379,microlens,292,40,292,16,2015-02-19T13:20:07Z,2025-03-08T07:50:58Z,883,A lightweight (but compatible with ‘lens’) lenses library,Haskell,https://github.com/stevenfontanella/microlens
380,pandoc-citeproc,292,60,292,0,2013-08-24T05:52:39Z,2020-10-09T23:33:53Z,3344,Library and executable for using citeproc with pandoc,Haskell,https://github.com/jgm/pandoc-citeproc
381,FuncShell,291,8,291,5,2017-04-20T08:26:01Z,2022-01-27T20:04:32Z,32650,Improve your shell by making it functional through Haskell! (An update to Awkward),Haskell,https://github.com/iostreamer-X/FuncShell
382,gotta-go-fast,290,16,290,6,2017-07-20T22:35:37Z,2023-02-25T21:17:54Z,6214,A command line utility for practicing typing and measuring your WPM and accuracy.,Haskell,https://github.com/callum-oakley/gotta-go-fast
383,gi-gtk-declarative,290,35,290,32,2018-05-31T19:36:04Z,2024-01-11T17:27:15Z,1280,Declarative GTK+ programming in Haskell,Haskell,https://github.com/owickstrom/gi-gtk-declarative
384,singletons,290,37,290,29,2012-11-26T17:31:46Z,2025-03-08T13:11:52Z,7040,Fake dependent types in Haskell using singletons,Haskell,https://github.com/goldfirere/singletons
385,frank,288,11,288,3,2017-08-18T01:36:37Z,2024-04-23T15:10:02Z,667,Frank compiler,Haskell,https://github.com/frank-lang/frank
386,inline-c,288,50,288,16,2015-02-12T13:16:26Z,2024-12-06T15:33:39Z,1108,,Haskell,https://github.com/fpco/inline-c
387,coreutils,287,3,287,0,2018-09-02T16:39:11Z,2025-03-18T16:05:36Z,387,Unix core utilities implemented in Haskell,Haskell,https://github.com/Gandalf-/coreutils
388,hue-dashboard,286,21,286,7,2016-04-24T15:29:57Z,2018-05-01T14:29:42Z,3477,A web interface for monitoring and controlling Philips Hue lights,Haskell,https://github.com/blitzcode/hue-dashboard
389,Carnap,286,28,286,105,2016-01-10T18:21:59Z,2024-12-15T21:37:52Z,6563,A formal logic framework that runs in the browser,Haskell,https://github.com/Carnap/Carnap
390,shh,286,11,286,13,2017-09-22T02:32:27Z,2024-08-17T06:57:28Z,287,Simple shell like scripting from Haskell,Haskell,https://github.com/luke-clifton/shh
391,haskell,285,24,285,1,2015-03-14T07:49:47Z,2022-01-02T07:05:07Z,8666,A curated list of awesome things related to Haskell.,Haskell,https://github.com/lotz84/haskell
392,gogol,285,110,285,33,2015-09-24T18:19:43Z,2025-03-10T03:07:50Z,160288,A comprehensive Google Services SDK for Haskell.,Haskell,https://github.com/brendanhay/gogol
393,Angel,284,25,284,9,2010-06-04T18:51:13Z,2019-09-25T19:56:49Z,214,"Process Monitoring/Management, Like Daemontools",Haskell,https://github.com/MichaelXavier/Angel
394,http-client,284,191,284,69,2013-10-04T08:09:04Z,2025-03-26T11:04:29Z,2616,"An HTTP client engine, intended as a base layer for more user-friendly packages.",Haskell,https://github.com/snoyberg/http-client
395,UwUpp,283,8,283,5,2020-03-03T12:40:41Z,2022-12-04T07:42:57Z,86,The next generation esoteric language,Haskell,https://github.com/Deltaphish/UwUpp
396,HaskellKoans,283,85,283,11,2012-01-09T00:19:12Z,2021-01-20T01:44:00Z,27,Haskell Koans for the Vancouver's Haskell UnMeetup,Haskell,https://github.com/HaskVan/HaskellKoans
397,ouroboros-network,282,87,282,346,2018-09-19T16:38:43Z,2025-03-27T20:51:11Z,45922,Specifications of network protocols and implementations of components running these protocols which support a family of Ouroboros Consesus protocols; the diffusion layer of the Cardano Node.,Haskell,https://github.com/IntersectMBO/ouroboros-network
398,vado,281,7,281,0,2017-08-01T14:15:54Z,2019-04-27T09:40:54Z,24,A demo web browser engine written in Haskell,Haskell,https://github.com/chrisdone-archive/vado
399,z,281,9,281,0,2012-12-29T17:24:45Z,2014-01-26T09:25:01Z,201,"A strict, impure, curried, partially applied programming language with rather peculiar syntax. ",Haskell,https://github.com/chrisdone-archive/z
400,nix-vscode-extensions,278,21,278,15,2022-08-27T06:23:22Z,2025-03-28T01:54:55Z,295024,"Nix expressions for VSCode and OpenVSX extensions [maintainers: @deemp, @AmeerTaweel]",Haskell,https://github.com/nix-community/nix-vscode-extensions
401,haskell-course,278,21,278,2,2015-12-09T17:31:55Z,2022-07-08T13:15:28Z,3994,Introductory Haskell course materials (originally CIS 194 @ UPenn),Haskell,https://github.com/byorgey/haskell-course
402,discord-haskell,277,59,277,20,2018-06-12T21:47:56Z,2025-02-23T14:19:34Z,1710,Haskell library for writing Discord bots,Haskell,https://github.com/discord-haskell/discord-haskell
403,haskanoid,276,27,276,14,2014-09-22T11:18:09Z,2023-04-08T21:33:52Z,18088,"A free and open source breakout clone in Haskell using SDL and FRP, with Wiimote and Kinect support.",Haskell,https://github.com/ivanperez-keera/haskanoid
404,friday,276,18,276,7,2013-08-02T14:51:10Z,2023-05-20T02:40:17Z,12969,Fast image IO and transformations.,Haskell,https://github.com/RaphaelJ/friday
405,ru-haskell-book,276,24,276,29,2012-05-18T15:24:42Z,2023-08-08T05:30:20Z,24105,учебник по Haskell,Haskell,https://github.com/anton-k/ru-haskell-book
406,aws-lambda-haskell-runtime,276,48,276,25,2018-11-30T02:11:11Z,2024-02-22T12:48:58Z,322,⚡Haskell runtime for AWS Lambda,Haskell,https://github.com/theam/aws-lambda-haskell-runtime
407,lawvere,275,5,275,9,2020-12-05T17:58:27Z,2023-03-06T13:57:10Z,217,A categorical programming language with effects,Haskell,https://github.com/jameshaydon/lawvere
408,lit,274,13,274,0,2014-07-28T18:35:53Z,2017-04-17T16:52:10Z,197,A modern tool for literate programming,Haskell,https://github.com/cdosborn/lit
409,haskell-tor,273,19,273,25,2015-11-17T06:07:28Z,2017-11-03T23:50:56Z,891,A Haskell implementation of the Tor protocol.,Haskell,https://github.com/GaloisInc/haskell-tor
410,Sirea,272,8,272,0,2012-04-06T22:47:37Z,2013-05-25T18:00:22Z,2010,Simply Reactive! Declarative orchestration in Haskell using RDP,Haskell,https://github.com/dmbarbour/Sirea
411,exercises,271,356,271,3,2021-12-19T17:13:09Z,2024-05-20T22:08:04Z,93,💻 Exercises for the Haskell Beginners 2022 course,Haskell,https://github.com/haskell-beginners-2022/exercises
412,atom,271,20,271,3,2009-05-20T03:37:49Z,2017-05-15T16:40:15Z,180,A DSL for embedded hard realtime applications.,Haskell,https://github.com/tomahawkins/atom
413,hevm,270,55,270,48,2022-08-29T18:39:09Z,2025-03-27T17:38:32Z,14212,symbolic EVM evaluator,Haskell,https://github.com/ethereum/hevm
414,cheatsheet,269,20,269,0,2008-10-07T23:35:33Z,2023-06-01T18:36:44Z,1283,A Haskell CheatSheet in PDF and literate source formats.,Haskell,https://github.com/m4dc4p/cheatsheet
415,nvim-hs,268,18,268,9,2014-11-22T13:46:38Z,2025-03-21T15:18:53Z,803,Neovim API for Haskell plugins as well as the plugin provider,Haskell,https://github.com/neovimhaskell/nvim-hs
416,cardano-ledger,267,156,267,213,2018-09-24T14:14:10Z,2025-03-28T12:43:54Z,118217,The ledger implementation and specifications of the Cardano blockchain.,Haskell,https://github.com/IntersectMBO/cardano-ledger
417,hint,267,42,267,33,2016-03-06T17:04:07Z,2025-03-12T10:50:19Z,498,Runtime Haskell interpreter,Haskell,https://github.com/haskell-hint/hint
418,ohaskell.guide,265,29,265,30,2016-02-29T09:55:27Z,2023-11-03T18:00:33Z,23436,Ваша первая книга о языке Haskell,Haskell,https://github.com/denisshevchenko/ohaskell.guide
419,halive,263,16,263,14,2015-05-07T07:14:54Z,2021-03-26T04:26:54Z,199,Live recompiler for Haskell,Haskell,https://github.com/lukexi/halive
420,guanxi,263,29,263,6,2018-10-01T18:09:56Z,2024-09-07T04:16:44Z,303,Relational programming in Haskell. Mostly developed on twitch.,Haskell,https://github.com/ekmett/guanxi
421,diagnose,262,19,262,12,2020-08-21T10:19:02Z,2024-08-11T20:45:06Z,1608,A simple library for reporting compiler/interpreter errors,Haskell,https://github.com/Mesabloo/diagnose
422,Vinyl,262,48,262,44,2012-10-26T03:36:57Z,2023-10-28T07:29:29Z,860,Extensible Records for Haskell. Pull requests welcome! Come visit us on #vinyl on freenode.,Haskell,https://github.com/VinylRecords/Vinyl
